name,address,Availability_availability_of_beds,Availability_oxygen_beds,Availability_non_oxygen_beds,Availability_i_c_u_beds,Availability_ventilators,Allocated_oxygen_beds,Allocated_non_oxygen_beds,Allocated_i_c_u,Allocated_ventilators,Availability_availability_of_oxygen,Availability_antiviral_remdesivir_etc_,Availability_steroids,Availability_anticoagulant,Availability_antipyretic,updated_on,city
Cygnus Multispecialty Hospital Kaithal,"Huda Bypass Road, Sector 20, Kaithal, Haryana",Yes (32),28,0,4,0,28,0,12,2,Yes,No,Yes,Yes,Yes,1970-01-01 00:00,10
District Civil Hospital Kaithal,"Huda Sec 18, Kaithal",Yes (89),66,13,10,15,80,15,20,18,Yes,Yes,Yes,Yes,Yes,1970-01-01 00:00,10
SDH Guhla,SDH Guhla,Yes (70),24,41,5,5,24,41,5,5,Yes,No,Yes,No,Yes,1970-01-01 00:00,10
Shah Multispecialty Hospital Kaithal,"opp.old, bus stand, Jind - Kaithal Rd, Amar Garh Colony, Kaithal, Haryana",Yes (60),44,11,5,5,51,11,15,10,Yes,No,Yes,Yes,Yes,1970-01-01 00:00,10
Alchemist Hospital panchkula,Sector 21 Panchkula,Yes (33),27,0,6,0,42,0,12,4,Yes,Yes,Yes,Yes,Yes,1970-01-01 00:00,16
Alchemist Ojas Hospital,"H1  SEctor 26, Panchkula Ext, Panchkula",Yes (55),46,0,9,2,54,0,13,4,Yes,Yes,Yes,Yes,Yes,1970-01-01 00:00,16
Civil Hospital Panchkula,sector 6 Panchkula,Yes (84),55,27,2,4,111,29,24,6,Yes,Yes,Yes,Yes,Yes,1970-01-01 00:00,16
JN Shory Hospital,Pinjore,Yes (22),16,6,0,0,18,6,0,0,Yes,No,Yes,Yes,Yes,1970-01-01 00:00,16
Kare Partners Hospital,"Sector 2, Panchkula",Yes (12),12,0,0,0,13,0,0,0,Yes,No,Yes,Yes,Yes,1970-01-01 00:00,16
Paras Hospital Pvt,"Plot no 2, sec 22, panchkula",Yes (26),21,0,5,2,32,0,17,6,Yes,Yes,Yes,Yes,Yes,1970-01-01 00:00,16
Wings Hospital,Sector 25 Panchkula,Yes (31),15,11,5,0,15,11,5,0,Yes,No,Yes,Yes,Yes,1970-01-01 00:00,16
ASHIRWAD BHAGAT HOSPITAL,"Old DC Rd, near bhagat hospital, Sonipat, Haryana 131001",Yes (15),12,0,3,1,12,0,3,1,Yes,Yes,Yes,Yes,Yes,1970-01-01 00:00,21
Bhagwan Dass Hospital,"Near Shahpur Turk, block-E, omaxe city, Sector 18, Sonipat, Haryana 131001",Yes (40),27,0,13,2,27,0,13,2,Yes,No,Yes,Yes,Yes,1970-01-01 00:00,21
"BPS MEDICAL COLLEGE KHANPUR , SONIPAT ( 01263283088)","Ganaur - Gohana Rd, Khanpur Kalan, Haryana",Yes (254),138,77,39,39,170,80,50,50,Yes,Yes,Yes,Yes,Yes,1970-01-01 00:00,21
CHC GANUR,CHC GANUR,Yes (4),4,0,0,0,8,0,0,0,Yes,Yes,Yes,Yes,Yes,1970-01-01 00:00,21
CHC Kharkhoda,"SH 20, Kharkhoda, Haryana 131402",Yes (9),4,5,0,0,5,5,0,0,To Be Updated,To Be Updated,Yes,Yes,Yes,1970-01-01 00:00,21
"CHC, JUAN, SONIPAT, HARYANA","CHC, JUAN, SONIPAT, HARYANACHC, JUAN, SONIPAT, HARYANA, 131024",Yes (5),3,2,0,0,3,2,0,0,Yes,No,Yes,Yes,Yes,1970-01-01 00:00,21
"Civil Hospital, Sonipat (9050007668 )","Delhi Road, Near Maharana Pratap Chowk, Sonipat, Haryana 131001",Yes (164),154,0,10,10,190,0,10,10,Yes,Yes,Yes,Yes,Yes,1970-01-01 00:00,21
"CYGNUS HOSPITAL, Sonipat","Old Rohtak Rd, near Hindu College of Engineering, Industrial Area, Sonipat, Haryana 131001",Yes (20),18,0,2,1,18,0,2,1,Yes,No,Yes,Yes,Yes,1970-01-01 00:00,21
Dayanand Hospital-Sonepat,"Kakroi Rd, Prem Nagar, West Ram Nagar, Sonipat, Haryana",Yes (21),18,0,3,0,20,0,5,1,Yes,No,Yes,Yes,Yes,1970-01-01 00:00,21
FIIMS Hospital,"Road, Bahalgarh, Sonipat, Haryana 131304",Yes (91),63,0,28,2,63,0,37,8,Yes,No,Yes,Yes,Yes,1970-01-01 00:00,21
GAJRAJ HOSPITAL,"Bus Stand, Gajraj Hospital Road, Near, Gohana, Haryana 131301",Yes (20),20,0,0,0,20,0,0,0,Yes,To Be Updated,Yes,Yes,Yes,1970-01-01 00:00,21
HARYANA HOSPITAL,"Vivekanand Chowk, Delhi Rd, behind Bullet Showroom, Janta Colony, Sonipat, Haryana 131001",No (0),0,0,0,1,1,0,1,1,Yes,No,No,No,Yes,1970-01-01 00:00,21
MEMORIAL HOSPITAL,"SH 11, near Mama Bhanja Chowk, Nandwani Nagar, Anand Nagar,, Sonipat, Haryana 131001",Yes (17),15,0,2,2,16,0,4,2,Yes,No,Yes,Yes,Yes,1970-01-01 00:00,21
NIDAAN HOSPITAL PVT.,"Murthal Rd, Sonipat, Haryana 131001",Yes (3),0,0,3,1,1,0,3,1,Yes,No,Yes,Yes,Yes,1970-01-01 00:00,21
OSCAR HOSPITAL,"SH 11, Lakshmi Nagar, Sonipat, Haryana 131001",Yes (19),12,0,7,2,12,0,8,2,Yes,No,Yes,Yes,Yes,1970-01-01 00:00,21
PHC PURKHAS,"Purkhas, Haryana 131102",Yes (30),0,30,0,0,0,30,0,0,To Be Updated,To Be Updated,To Be Updated,To Be Updated,To Be Updated,1970-01-01 00:00,21
"SANJIVNI HOSPITAL, SONIPAT","Mehlana Rd, Malviya Nagar, Sonipat, Haryana 131304",Yes (15),14,0,1,1,14,0,1,1,Yes,No,Yes,Yes,Yes,1970-01-01 00:00,21
SAXSENA HOSPITAL,"112/113, T.P. Scheme, Delhi Rd, Sonipat, Haryana 131304",Yes (23),18,0,5,2,18,0,5,2,Yes,No,Yes,Yes,Yes,1970-01-01 00:00,21
SDH GOHANA,"Devi Nagar, Uttam Nagar, Gohana, Haryana 131301",Yes (9),9,0,0,0,10,0,0,0,Yes,Yes,Yes,Yes,Yes,1970-01-01 00:00,21
SITA HOSPITAL SONIPAT,"Railway Rd, Ganaur, Haryana 131101",Yes (18),18,0,0,0,20,0,0,0,Yes,No,Yes,Yes,Yes,1970-01-01 00:00,21
SUNHERI DEVI HOSPITAL,"Mission Rd, Dev Nagar, Sonipat, Haryana 131001",Yes (19),14,0,5,1,15,0,5,1,Yes,No,Yes,Yes,Yes,1970-01-01 00:00,21
TULIP HOSPITAL,"T. P. Scheme, no.15, Delhi Rd, Vivekanand chowk, Sonipat, Haryana 131001",Yes (2),0,0,2,3,0,0,20,5,Yes,No,Yes,Yes,Yes,1970-01-01 00:00,21
Advanta Super Speciality Hospital,Near Power House,Yes (29),19,0,10,4,25,0,14,4,Yes,No,Yes,Yes,Yes,1970-01-01 00:00,19
ARS Holy Heart Advanced Cardiac care &amp; Research Centre,"330, Vinay Nagar Rohtak, Near Delhi Bypass Rohtak",Yes (18),0,0,18,2,0,0,20,2,Yes,No,No,No,No,1970-01-01 00:00,19
CHC Chiri,"VOP Chiri, Meham Gohana Road, Distt. Rohtak Haryana",Yes (10),10,0,0,0,10,0,0,0,Yes,Yes,Yes,Yes,Yes,1970-01-01 00:00,19
CHC Kahanaur,"Near Sarva haryana Gramin Bank, Opp. Banquet hall, Nigana Road, Kahanaur",Yes (10),4,6,0,0,4,6,0,0,Yes,No,Yes,No,Yes,1970-01-01 00:00,19
CHC kalanaur,"Police Station, Bhiwani-Rohtak Road , Near Kalanaur kalan, Kalanaur,",Yes (9),9,0,0,0,10,0,0,0,Yes,No,Yes,No,Yes,1970-01-01 00:00,19
CHC Kiloi,"VPO Kiloi, Water Works, Distt. Rohtak",Yes (10),5,5,0,0,5,5,0,0,Yes,No,Yes,No,Yes,1970-01-01 00:00,19
CHC Madina,"VPO Madina, Hisar Road Distt. Rohtak, Haryana",Yes (10),0,10,0,0,0,10,0,0,Yes,No,No,No,Yes,1970-01-01 00:00,19
CHC Meham,"Near ITI, Meham Distt. Rohtak",Yes (7),7,0,0,0,10,0,0,0,Yes,No,Yes,No,Yes,1970-01-01 00:00,19
CHC Sampla,"Gadi Sampla, Rohtak, SH-20, Jhajjar Sampla Road, Sampla, Sampla, Haryana 124501",Yes (10),0,10,0,0,0,10,0,0,No,No,Yes,No,Yes,1970-01-01 00:00,19
"Civil Hospital, Rohtak",Subash Road,Yes (60),30,26,4,5,38,26,7,5,Yes,Yes,Yes,Yes,Yes,1970-01-01 00:00,19
Holy Heart Super speciality Hospital,Vinay Nagar Delhi Bye pass,Yes (45),19,5,21,0,25,5,27,6,Yes,No,No,Yes,Yes,1970-01-01 00:00,19
"Hridaya Nilayam Heart, Lung &amp; vascular Institute","5, Raj Garden, Delhi Bypass, Rohtak",Yes (24),0,0,24,2,0,0,25,2,Yes,No,Yes,Yes,Yes,1970-01-01 00:00,19
Joyline Multispeciality,"Surajmal Colony, Sunarian Road, Opposite Birgadier Muktram Statue Rohtak",Yes (20),15,0,5,1,15,0,5,1,Yes,Yes,Yes,Yes,Yes,1970-01-01 00:00,19
Kainos Hospital,Near Kheri Sadh Village Outer Bye Pass,Yes (65),25,10,30,16,26,10,34,17,Yes,No,Yes,Yes,Yes,1970-01-01 00:00,19
Life Care Hospital,Subash Nagar,Yes (47),30,0,17,6,30,0,20,6,No,No,Yes,Yes,Yes,1970-01-01 00:00,19
Maan Hospital,Bhagwan Colony Near Radio Station,Yes (42),29,0,13,6,29,0,16,6,Yes,No,Yes,Yes,Yes,1970-01-01 00:00,19
Mansarover Hospital,Mansarover Colony Near Park,Yes (29),19,0,10,7,20,0,10,7,Yes,No,Yes,Yes,Yes,1970-01-01 00:00,19
Neurocentre Super Speciality Hospital,"Kalawati Bulding, Near Power House Rohtak",Yes (23),4,6,13,2,4,6,13,2,Yes,No,Yes,Yes,Yes,1970-01-01 00:00,19
Noble Heart Super Speciality Hospital,Near Raj Garden Delhi Bye Pass,Yes (31),26,1,4,3,26,1,7,6,Yes,No,Yes,Yes,Yes,1970-01-01 00:00,19
Oscar Super Speciality Trauma Center,"Medical Moad, Daryao Singh Nagar,",Yes (19),11,1,7,2,23,3,15,2,Yes,Yes,Yes,No,Yes,1970-01-01 00:00,19
Oxygen Hospital,Islam Pura Daries Hisar Road,Yes (30),15,10,5,4,15,10,5,4,Yes,No,Yes,Yes,Yes,1970-01-01 00:00,19
PGIMS Rohtak,"Pt.Bhagwat Dayal PGIMS, Medical Rd, Rohtak, Haryana",Yes (487),406,0,81,81,451,0,115,115,Yes,Yes,Yes,Yes,Yes,1970-01-01 00:00,19
Positron Hospital,Suncity Sector 35,Yes (27),0,16,11,0,0,16,16,4,Yes,No,No,Yes,Yes,1970-01-01 00:00,19
Pragati Hospital,"Sukhpura Chowk, Gohana Road, opp. Ladhot Road Rohtak",Yes (9),5,0,4,1,11,0,4,1,Yes,No,Yes,Yes,Yes,1970-01-01 00:00,19
"Sanghi Nursing Home, Rohtak, Haryana","Chotu Ram Chowk, Civil Road, Arya Nagar, Rohtak, Haryana",Yes (14),10,0,4,4,10,0,4,4,Yes,Yes,Yes,Yes,Yes,1970-01-01 00:00,19
Shivam Liver &amp; Gastro Super Speciality Hospital,"CIVIL ROAD NEAR SHANT MAI CHOWK, Rohtak, Haryana - 124001, India",Yes (9),5,0,4,1,5,0,4,1,Yes,No,Yes,Yes,Yes,1970-01-01 00:00,19
Sunflag Global Hospital,Bharat Colony Near Sheela Bye Pass,Yes (35),20,0,15,5,20,0,15,5,Yes,No,Yes,Yes,Yes,1970-01-01 00:00,19
Aashirwad Hospital,101 Devi Murti Colony Panipat,Yes (9),2,0,7,1,2,0,7,1,Yes,No,Yes,Yes,Yes,1970-01-01 00:00,17
Aayushmaan Bhav Hospital,"GT Road Sewah, Near Police Line Panipat",Yes (12),5,4,3,2,5,4,6,2,Yes,No,Yes,Yes,Yes,1970-01-01 00:00,17
APEX HOSPITAL &amp; TRAUMA CENTRE,SANOLI ROAD BABAIL NAKA,Yes (35),9,0,26,2,9,0,26,2,No,No,Yes,Yes,Yes,1970-01-01 00:00,17
CHC Dadlana,"VPO Dadlana, Panipat",Yes (8),0,8,0,0,0,8,0,0,No,No,No,No,Yes,1970-01-01 00:00,17
CHC Khotpura,VPO Khotpura Panipat,Yes (9),0,9,0,0,0,9,0,0,No,No,No,No,No,1970-01-01 00:00,17
Chhabra Hospital,A-1 Narain Singh Park,Yes (10),6,0,4,1,6,0,5,1,Yes,No,Yes,Yes,Yes,1970-01-01 00:00,17
Civil Hospital panipat,Civil Hospital GT Road Panipat,Yes (85),65,20,0,0,74,20,10,4,Yes,Yes,Yes,Yes,Yes,1970-01-01 00:00,17
Cygnus Hospital panipat,Cygnus Hospital Near Devi Mndir Panipat,Yes (17),12,0,5,4,12,0,5,4,Yes,No,Yes,Yes,Yes,1970-01-01 00:00,17
GALAXY HOSPITAL,ASSAND ROAD PANIPAT,Yes (14),6,0,8,2,7,0,8,2,Yes,No,Yes,Yes,Yes,1970-01-01 00:00,17
Guru Teg Bhadur Sanjeevani Hospital,"Village Bal Jatan Near Panipat Refinary, Panipat",Yes (314),307,7,0,0,307,7,0,0,Yes,No,Yes,Yes,Yes,1970-01-01 00:00,17
Hyderabadi General Hospital &amp; Nursing Home,"Sanoli Road, Near Sanjay, Chowk, Panipat",Yes (10),0,0,10,2,0,0,10,2,Yes,No,Yes,Yes,Yes,1970-01-01 00:00,17
IBM HOSPITAL &amp; TRAUMA CENTRE,NEAR BHIM GODA MANDIR SANOLI ROAD,Yes (24),12,0,12,2,12,0,12,2,Yes,No,Yes,Yes,Yes,1970-01-01 00:00,17
LHDM &amp; Prem Hospital,Prem Hospital Opp. Bus Stand Panipat,Yes (55),55,0,0,0,71,0,9,8,Yes,Yes,Yes,Yes,Yes,1970-01-01 00:00,17
MAX PLUS HOSPITAL,NEAR MALIK PETROL PUMP SANOLI ROAD,Yes (13),6,0,7,2,8,0,7,3,Yes,No,Yes,Yes,Yes,1970-01-01 00:00,17
NC Medical College,NC Medical Colllage Israna,Yes (530),42,483,5,4,42,483,5,4,Yes,No,Yes,Yes,Yes,1970-01-01 00:00,17
Park Hospital GT road panipat,"GT Road Sewah, Paniapt",Yes (79),52,14,13,2,52,14,16,2,Yes,Yes,Yes,Yes,Yes,1970-01-01 00:00,17
Prime Hospital Health Leaders,"Opp. Gangapuri Road, Sanoli Road Panipat",Yes (18),14,2,2,4,14,2,4,4,Yes,No,Yes,Yes,Yes,1970-01-01 00:00,17
Rainbow Hospital,152-R Model Town Panipat,Yes (8),6,0,2,1,6,0,3,1,Yes,No,Yes,Yes,Yes,1970-01-01 00:00,17
SDH Samalkha,G.T Road Samalkha,Yes (47),28,19,0,0,30,20,0,0,No,No,Yes,No,Yes,1970-01-01 00:00,17
shobhit Hospital,"adjacent canara bank, tahsil camp",Yes (19),12,2,5,1,12,2,5,1,Yes,No,Yes,Yes,Yes,1970-01-01 00:00,17
Shree Badri Das Hospital and ICU Care Centre,Assandh Road Panipat,Yes (9),7,0,2,1,8,0,3,1,Yes,No,Yes,Yes,Yes,1970-01-01 00:00,17
Shree Balajee Multispeciality Hospital,Aggarsan Colony Assandh Road Panipat,Yes (7),4,0,3,2,4,0,6,2,Yes,Yes,Yes,Yes,Yes,1970-01-01 00:00,17
Shubham Hospital,"202 New Sukhdev Nagar, Panipat",Yes (9),6,0,3,2,6,0,3,3,Yes,No,Yes,Yes,Yes,1970-01-01 00:00,17
"AAROGYAM HOSPITAL, Kurukshetra","NEAR OLD BUS STAND, THANESAR, KURUSKHETRA",Yes (50),28,7,15,9,40,12,15,27,Yes,Yes,Yes,Yes,Yes,1970-01-01 00:00,12
"ADESH MEDICAL COLLEGE, SHAHBAD MOHRI KURUKSHETRA.","VILL. MOHRI, SHAHBAD, KURUSHETRA",Yes (103),30,68,5,11,30,70,5,11,Yes,Yes,Yes,Yes,Yes,1970-01-01 00:00,12
AGGARWAL NURSING HOME,"SALARPUR ROAD, THANESAR, KURUKSHETRA.",Yes (17),14,2,1,3,20,7,3,7,Yes,Yes,Yes,Yes,Yes,1970-01-01 00:00,12
B.S. HEART CARE,"OPP. NEW BUS STAND, KURUKSHETRA.",Yes (22),14,0,8,14,18,0,8,20,Yes,Yes,Yes,Yes,Yes,1970-01-01 00:00,12
"CYGNUS HOSPITAL, Kurukshetra","NEAR OLD BUS STAND, THANESAR, KURUSKHETRA",Yes (12),7,4,1,4,7,4,1,4,Yes,Yes,Yes,Yes,Yes,1970-01-01 00:00,12
KURUKSHETRA NURSING HOME,,Yes (14),13,0,1,2,18,0,1,2,Yes,Yes,Yes,Yes,Yes,1970-01-01 00:00,12
LNJP CIVIL HOSPITAL.,LNJP HOSPITAL KURUKSHETRA.,Yes (84),53,26,5,3,60,30,5,5,Yes,Yes,Yes,Yes,Yes,1970-01-01 00:00,12
MIRI PIRI SHAHBAD,"SHAHBAD, KURUKSHETRA",Yes (10),6,0,4,4,10,0,4,4,Yes,Yes,Yes,Yes,Yes,1970-01-01 00:00,12
Nirogi Hospital,Shahabad Kurukshetra,Yes (7),5,2,0,3,5,2,0,3,Yes,Yes,Yes,Yes,Yes,1970-01-01 00:00,12
"Saraswati Mission Hospital, Kurukshetra","Theme Park Road, Kurukshetra",Yes (20),4,0,16,2,4,0,16,2,Yes,Yes,Yes,Yes,Yes,1970-01-01 00:00,12
"Saraswati Mission Hospital, Pehowa","Ambala Road Dist. Kurukshetra, Pehowa, Haryana 136128",Yes (16),14,0,2,3,20,0,2,5,Yes,No,Yes,Yes,Yes,1970-01-01 00:00,12
"SIDHARTH HOSPITAL, SHAHBAD","SHAHBAD, KURUKSHETRA",Yes (13),6,4,3,3,8,4,4,3,Yes,Yes,Yes,Yes,Yes,1970-01-01 00:00,12
VERMA HOSPITAL,LADWA,Yes (9),5,2,2,2,9,3,2,2,Yes,Yes,Yes,Yes,Yes,1970-01-01 00:00,12
"Ayurvedic Medical College, Patikra",HUDA Sec. 1 Narnaul,Yes (190),32,158,0,0,40,160,0,0,Yes,Yes,Yes,Yes,Yes,1970-01-01 00:00,13
CHC ATELI,CHC ATELI,Yes (19),14,5,0,0,15,5,0,0,Yes,Yes,Yes,Yes,Yes,1970-01-01 00:00,13
CHC Kanina,Kanina,Yes (27),15,12,0,0,15,12,0,0,To Be Updated,To Be Updated,To Be Updated,To Be Updated,To Be Updated,1970-01-01 00:00,13
CHC Nangal Chaudhary,chc nangal choudhary,Yes (10),5,5,0,0,5,5,0,0,No,Yes,Yes,Yes,Yes,1970-01-01 00:00,13
CHC Sehlang,CHC SEHLANG,Yes (9),5,4,0,0,5,4,0,0,Yes,Yes,Yes,Yes,Yes,1970-01-01 00:00,13
Civil Hospital Narnaul,"Housing Board, Narnaul",Yes (64),64,0,0,7,80,0,0,10,Yes,Yes,Yes,Yes,Yes,1970-01-01 00:00,13
Jaipur Heart &amp; Multi Speciality Hospital,"Opp. Sadar Thana, Narnaul",Yes (10),4,3,3,2,6,3,4,2,Yes,Yes,Yes,Yes,Yes,1970-01-01 00:00,13
LAXMI NARAYANAN,"Laxmi Narayanan Hospital , Narnaul Road Mahendergarh",Yes (10),6,0,4,1,6,0,4,1,Yes,Yes,Yes,Yes,Yes,1970-01-01 00:00,13
Nihal Hospital Kanina,Kanina Main Bus Stand,Yes (13),12,0,1,1,13,0,1,1,Yes,Yes,Yes,Yes,Yes,1970-01-01 00:00,13
Rainbow Multispecialty hospital and trauma Centre,"Singhana road, Narnaul",Yes (5),1,2,2,0,4,3,6,2,Yes,No,Yes,Yes,Yes,1970-01-01 00:00,13
Sammat Memorial Hospital,"Sastri colony, near bus stand, mahendergarh",Yes (13),10,0,3,2,10,0,3,2,Yes,No,Yes,Yes,Yes,1970-01-01 00:00,13
Sanwedna Hospital Narnaul,"HUDA Sector 1, Narnaul",Yes (26),17,0,9,1,25,0,9,1,Yes,Yes,Yes,Yes,Yes,1970-01-01 00:00,13
SDH Mahendergarh,SDH Mahendergarh,Yes (18),18,0,0,5,20,0,0,5,Yes,Yes,Yes,Yes,Yes,1970-01-01 00:00,13
Shanti Hospital Narnaul,Shanti Hospital Narnaul,Yes (22),9,7,6,2,9,7,7,2,Yes,Yes,Yes,Yes,Yes,1970-01-01 00:00,13
Sheela Multi Superspeciality Hospital,Behind Bus Stand Mahindergarh,Yes (9),6,0,3,1,6,0,3,1,Yes,No,Yes,Yes,Yes,1970-01-01 00:00,13
Shri Arvind Heart and Multispecialty Hospital,"Rao Tula Ram Chowk, Dadri Road Mahendergarh",Yes (17),9,5,3,3,9,5,3,3,Yes,Yes,Yes,Yes,Yes,1970-01-01 00:00,13
Tanwar Health Care MGarh,,Yes (9),5,0,4,1,5,0,4,1,Yes,No,Yes,Yes,Yes,1970-01-01 00:00,13
Vijay Hospital Narnaul,"HUDA Sector 1, Narnaul",Yes (22),8,0,14,2,8,0,15,2,Yes,Yes,Yes,Yes,Yes,1970-01-01 00:00,13
"Aditya Neuro &amp; Spine Hospital, Rewari","Circular Rd, near Kanod gate, Raam Bagh Mahalla, Rewari, Haryana",Yes (10),8,0,2,2,8,0,2,2,Yes,No,Yes,Yes,Yes,2021-05-28 11:46,18
Advance Hospital,"Bawal Road, Model Town",Yes (8),5,0,3,0,5,0,6,1,Yes,No,Yes,Yes,Yes,2021-05-25 17:43,18
"Apex Hospital, Dharuhera","Plot No.5, Sector 6, Dharuhera, Haryana 123106",Yes (10),6,0,4,1,6,0,4,1,Yes,No,Yes,Yes,Yes,2021-05-28 12:08,18
Apollo Rewari/Family Health Edge Hospital,"Garhi Bolni Rd, near Public Health Office, krishna Nagar, Rewari, Haryana",Yes (27),17,3,7,0,17,3,7,0,Yes,No,Yes,Yes,Yes,1970-01-01 00:00,18
Capt. Nand Lal Hospital,"Circular Road near Government Girls Senior Secondary School naiwali, chowk, Rewari",Yes (20),6,10,4,1,11,10,8,1,Yes,No,Yes,Yes,Yes,2021-05-15 23:54,18
Civil Hospital rewari,"Kayasthwara Mohalla, Rewari, Haryana",Yes (58),36,16,6,4,40,16,8,4,Yes,Yes,Yes,No,Yes,1970-01-01 00:00,18
Cygnus Hospital Rewari,"Opposite Civil Hospital Mohola, Sanghi Ka Bass, Rewari, Haryana",Yes (32),21,7,4,1,26,7,9,2,Yes,No,Yes,No,Yes,2021-05-28 09:58,18
Devjyoti Hospital,"Ambedkar chowk, near Bus Stand, Rewari, Haryana",Yes (13),7,2,4,1,7,2,6,2,Yes,No,Yes,Yes,Yes,1970-01-01 00:00,18
Dr. K.K. NAGAR HOSPITAL,"317, Near Shishu Shala School, Model Town, Rewari, Haryana",Yes (11),1,0,10,0,2,0,10,0,Yes,No,Yes,Yes,Yes,1970-01-01 00:00,18
Dr. Vijay Pal Yadav Hospital,"Near Ambedker chowk, Rewari",Yes (7),2,2,3,0,3,3,4,0,Yes,No,Yes,Yes,Yes,2021-05-23 09:52,18
Kamla Nursing Home/Kalawati Hospital,"201, Model Town, Rewari, Near Bus Stand, Opposite Bal Bhawan, Shivam Chowk",Yes (17),12,0,5,5,14,0,9,6,Yes,No,Yes,Yes,Yes,2021-05-27 18:47,18
Katyal Hospital,"Katyal Hospital, KANOD GATE, CIRCULAR ROAD, Rewari, Haryana, India",Yes (21),9,6,6,0,12,6,10,1,Yes,No,Yes,Yes,Yes,1970-01-01 00:00,18
Maars Hospital,"Garhi Bolni Rd, near PWD Office, Sector 19, Rewari, Haryana",Yes (14),14,0,0,0,15,0,0,0,Yes,No,Yes,Yes,No,1970-01-01 00:00,18
"Manasavi Hospital, Rewari",,Yes (10),10,0,0,0,10,0,0,0,Yes,No,Yes,No,Yes,2021-05-28 12:12,18
Matrika Hospital,"Matrika Hospital, Ranbir Singh Huda Chowk, Bawal-Rewari Rd, Rewari, Haryana",Yes (23),12,0,11,1,16,0,14,3,Yes,No,No,Yes,Yes,2021-05-28 10:27,18
Mediom Hospital/Medcare Hospital,"Sohna Rd, near Municipal Corporation, Dharuhera, Haryana",Yes (4),3,Beds Over Utilized 1,1,0,8,0,4,1,Yes,No,Yes,Yes,Yes,2021-05-23 18:58,18
Om Hospital,"Om Hospital, Nandrampur Bass Rd, Dharuhera, Haryana",Yes (24),12,4,8,0,12,4,8,0,Yes,No,Yes,Yes,Yes,1970-01-01 00:00,18
Pushpanjli Hospital Rewari,"Rajesh Pilot Chowk, Rewari, Haryana",No (0),0,0,0,0,40,12,10,3,No,No,Yes,Yes,Yes,2021-05-25 16:33,18
R. B. Yadav Hospital,"Dr. R B Yadav Hospital, Circular Rd Jainpuri, Kayasthwara Mohalla, Rewari, Haryana",Yes (22),8,6,8,2,8,6,8,2,Yes,No,Yes,Yes,Yes,1970-01-01 00:00,18
Samrat Hospital,Near Azad Chowk Rewari,Yes (9),5,0,4,3,5,0,10,3,Yes,No,Yes,Yes,Yes,2021-05-25 17:44,18
SDH Kosli,"Kosli, Rewari, Haryana",Yes (31),11,20,0,0,20,20,0,0,Yes,No,No,No,No,2021-05-25 16:32,18
Shanti Yadav Hospital,"Bawal-Rewari Rd Model Town, Rewari, Haryana",Yes (28),16,8,4,1,19,10,4,1,Yes,No,Yes,No,No,2021-05-26 09:37,18
Sheela Neuro &amp; Multi. Superspeciality Hospital,"Sheela Neuro Multi-Super Speciality Hospital, Opposite Jain Public School, Circular Road, Rewari",Yes (32),15,15,2,0,15,15,3,1,Yes,No,Yes,Yes,No,2021-05-25 17:47,18
Shri Ashwani Sexena Hospital,"343-L, Model town Rewari",Yes (10),7,3,0,0,7,3,0,0,Yes,No,Yes,Yes,Yes,1970-01-01 00:00,18
SMCC Hospital,"Sector 5 Rewari, Haryana",Yes (12),2,0,10,1,2,0,11,1,Yes,No,Yes,Yes,Yes,1970-01-01 00:00,18
Surendra Hospital Bawal,"Circuar Road, Rewari, Haryana",Yes (11),5,2,4,0,5,2,5,0,Yes,No,Yes,No,Yes,2021-05-28 13:05,18
"Sushma Devi Hospital, Bawal","Rewari Road, Bawal, Rewari, Near Power House & Bharat Petrol Pump",Yes (18),9,9,0,0,9,9,0,0,Yes,No,Yes,Yes,Yes,1970-01-01 00:00,18
Vedanta Hospital,"Circulare Road, Near Nirankari Satsang Bhavan Dharuhera, Chungi, Rewari, Haryana",Yes (29),0,7,22,0,0,7,30,0,Yes,No,Yes,Yes,Yes,2021-05-25 16:42,18
Virat Hospital,"Circular Rd, Near Oriental Bank of Commerce, Madhu Vihar, Rewari, Haryana",Yes (83),55,10,18,Beds Over Utilized 1,63,10,27,2,Yes,No,Yes,Yes,Yes,1970-01-01 00:00,18
Yaduvanshi Hospital,"Maharana Pratap Chowk, Model Town, Rewari, Haryana",Yes (19),14,0,5,2,14,0,5,2,Yes,No,Yes,Yes,No,1970-01-01 00:00,18
Ch Lekh Raj Multispeciality Hospital,Vill Gadhauli Yamuna Nagar,Yes (147),137,0,10,4,140,0,10,5,Yes,Yes,Yes,Yes,Yes,1970-01-01 00:00,22
CHC Bilaspur,CHC Bilaspur,Yes (20),6,14,0,0,8,17,0,0,Yes,No,Yes,No,Yes,1970-01-01 00:00,22
CHC Chhachharuli,CHC Chhachharuli,Yes (30),10,20,0,0,10,20,0,0,Yes,No,Yes,Yes,Yes,1970-01-01 00:00,22
CHC Naharpur,Naharpur Yamuna Nagar,Yes (10),10,0,0,0,10,0,0,0,Yes,No,No,No,Yes,1970-01-01 00:00,22
CHC Partap Nagar,CHC Partap Nagar,Yes (14),6,8,0,0,6,10,0,0,Yes,No,Yes,No,Yes,1970-01-01 00:00,22
CHC Radaur,Radaur Yamuna Nagar,Yes (20),10,10,0,0,10,10,0,0,Yes,No,Yes,Yes,Yes,1970-01-01 00:00,22
CHC Saraswati Nagar,CHC Saraswati Nagar,Yes (25),14,11,0,0,14,11,0,0,Yes,No,Yes,No,Yes,1970-01-01 00:00,22
DABRA HOSPITAL Yamunanagar,DABRA HOSPITAL,Yes (19),10,8,1,2,11,8,4,2,Yes,No,Yes,Yes,Yes,1970-01-01 00:00,22
ESI Hospital,"ESI Hospital, Jagadhri",Yes (42),24,0,18,0,36,0,22,0,Yes,No,Yes,Yes,Yes,1970-01-01 00:00,22
Gaba Hospital,Gaba Hospital Yamunanagar,Yes (27),17,10,0,0,20,10,15,5,Yes,No,Yes,Yes,Yes,1970-01-01 00:00,22
GULATI HOSPITAL,GULATI HOSPITAL,Yes (29),23,3,3,0,25,3,6,0,Yes,No,Yes,Yes,Yes,1970-01-01 00:00,22
Heart Care Center Hospital,Near Lal Dwara Mandir Yamuna Nagar,Yes (19),2,2,15,7,2,2,15,7,Yes,No,Yes,Yes,Yes,1970-01-01 00:00,22
JP Hospital Pvt,"Jagadhri Rd, near Luxmi Theater, Vishwakarma Mohalla, Yamuna Nagar,HARAYANA Haryana",Yes (38),12,15,11,1,15,15,13,2,Yes,No,Yes,Yes,Yes,1970-01-01 00:00,22
KAPOOR HOSPITAL,"SH 6A Indira Colony Jagadhri, yamunanagart ,Haryana",Yes (12),4,0,8,0,4,0,8,0,Yes,No,Yes,Yes,Yes,1970-01-01 00:00,22
KESHWANI HOSPITAL,"Jagadhri - Yamuna Nagar Rd, Tagore Garden, Yamuna Nagar, Haryana",Yes (9),9,0,0,0,10,0,0,0,Yes,No,Yes,Yes,Yes,1970-01-01 00:00,22
Maxxwell Hospital,Jagadhari Yamuna Nagar,Yes (15),11,0,4,0,11,0,6,0,Yes,No,Yes,Yes,Yes,1970-01-01 00:00,22
Mukand Lal District Civil Hospital Yamunanagar,Mukand Lal District Civil Hospital YNR,Yes (26),18,8,0,3,18,9,0,5,Yes,No,Yes,Yes,Yes,1970-01-01 00:00,22
RK Gupta,opp DAV Sr Sec School Near Madhu Hotel YNR,Yes (14),0,2,12,0,0,2,15,0,Yes,Yes,Yes,Yes,Yes,1970-01-01 00:00,22
SABBARWAL HOSPITAL,"Gulab Nagar, Jagadhri, Haryana",Yes (10),5,1,4,0,6,1,6,0,Yes,No,Yes,Yes,Yes,1970-01-01 00:00,22
Sachdeva Hospital,"2227, Civil Lines Rd, Sri Nagar Colony, Civil Lines, Gomti Mohalla, Jagadhri, Haryana",Yes (27),16,8,3,0,16,8,4,0,Yes,No,Yes,Yes,Yes,1970-01-01 00:00,22
Santosh Hospital,"Santosh Hospital  Kanhaiya Sahib Chowk, near Govt.School, Harbanspura Colony, Gobind Pura, Yamuna Nagar, Haryana",Yes (26),5,9,12,1,5,9,14,2,Yes,No,Yes,Yes,Yes,1970-01-01 00:00,22
SHARMA HOSPITAL,Near Agarsain Chowk Jagadhri,Yes (12),12,0,0,0,12,0,0,0,Yes,No,Yes,Yes,Yes,1970-01-01 00:00,22
Shree Medical Care Hospital,"359/2, Jain nagar, Jagadhri, Haryana",Yes (14),14,0,0,0,15,0,0,0,Yes,Yes,Yes,Yes,Yes,1970-01-01 00:00,22
Shureshtha Hospital,Model Colony YNR,Yes (6),3,1,2,0,9,1,2,0,Yes,No,Yes,Yes,Yes,1970-01-01 00:00,22
SP Hospital Jag,S.P Hospital Jag,Yes (6),4,0,2,1,4,0,3,1,Yes,No,Yes,Yes,Yes,1970-01-01 00:00,22
Swami Vivekanand Hospital Yamunanagar,"Swami Vivekanand Hospital,Yamuna Nagar, Haryana",Yes (41),17,10,14,1,20,10,19,1,Yes,No,Yes,Yes,Yes,1970-01-01 00:00,22
Swastik Hospital,"Basant Nagar, Yamuna Nagar, Haryana",Yes (5),3,2,0,0,4,2,0,0,Yes,No,Yes,Yes,Yes,1970-01-01 00:00,22
tejli stadium,64 A Tejli,Yes (65),16,49,0,0,20,56,0,0,Yes,No,No,No,Yes,1970-01-01 00:00,22
VARDAAN HOSPITAL,OPP KOHLI HOSPITAL NEAR AGARSEN COLLEGE JAGADHRI,Yes (9),7,2,0,0,8,2,0,0,Yes,No,Yes,Yes,Yes,1970-01-01 00:00,22