name,address,Availability_availability_of_beds,Availability_oxygen_beds,Availability_non_oxygen_beds,Availability_i_c_u_beds,Availability_ventilators,Allocated_oxygen_beds,Allocated_non_oxygen_beds,Allocated_i_c_u,Allocated_ventilators,Availability_availability_of_oxygen,Availability_antiviral_remdesivir_etc_,Availability_steroids,Availability_anticoagulant,Availability_antipyretic,updated_on,city
"Aditya Neuro &amp; Spine Hospital, Rewari","Circular Rd, near Kanod gate, Raam Bagh Mahalla, Rewari, Haryana",Yes (10),8,0,2,2,8,0,2,2,Yes,No,Yes,Yes,Yes,2021-05-28 11:46,18
Advance Hospital,"Bawal Road, Model Town",Yes (8),5,0,3,0,5,0,6,1,Yes,No,Yes,Yes,Yes,2021-05-25 17:43,18
"Apex Hospital, Dharuhera","Plot No.5, Sector 6, Dharuhera, Haryana 123106",Yes (10),6,0,4,1,6,0,4,1,Yes,No,Yes,Yes,Yes,2021-05-28 12:08,18
Apollo Rewari/Family Health Edge Hospital,"Garhi Bolni Rd, near Public Health Office, krishna Nagar, Rewari, Haryana",Yes (27),17,3,7,0,17,3,7,0,Yes,No,Yes,Yes,Yes,1970-01-01 00:00,18
Capt. Nand Lal Hospital,"Circular Road near Government Girls Senior Secondary School naiwali, chowk, Rewari",Yes (20),6,10,4,1,11,10,8,1,Yes,No,Yes,Yes,Yes,2021-05-15 23:54,18
Civil Hospital rewari,"Kayasthwara Mohalla, Rewari, Haryana",Yes (63),39,16,8,4,40,16,8,4,Yes,Yes,Yes,Yes,Yes,1970-01-01 00:00,18
Cygnus Hospital Rewari,"Opposite Civil Hospital Mohola, Sanghi Ka Bass, Rewari, Haryana",Yes (32),21,7,4,1,26,7,9,2,Yes,No,Yes,No,Yes,2021-05-28 09:58,18
Devjyoti Hospital,"Ambedkar chowk, near Bus Stand, Rewari, Haryana",Yes (14),7,2,5,1,7,2,6,2,Yes,No,Yes,Yes,Yes,1970-01-01 00:00,18
Dr. K.K. NAGAR HOSPITAL,"317, Near Shishu Shala School, Model Town, Rewari, Haryana",Yes (12),2,0,10,0,2,0,10,0,Yes,No,Yes,Yes,Yes,1970-01-01 00:00,18
Dr. Vijay Pal Yadav Hospital,"Near Ambedker chowk, Rewari",Yes (7),2,2,3,0,3,3,4,0,Yes,No,Yes,Yes,Yes,2021-05-23 09:52,18
Kamla Nursing Home/Kalawati Hospital,"201, Model Town, Rewari, Near Bus Stand, Opposite Bal Bhawan, Shivam Chowk",Yes (17),12,0,5,5,14,0,9,6,Yes,No,Yes,Yes,Yes,2021-05-27 18:47,18
Katyal Hospital,"Katyal Hospital, KANOD GATE, CIRCULAR ROAD, Rewari, Haryana, India",Yes (21),9,6,6,0,12,6,10,1,Yes,No,Yes,Yes,Yes,1970-01-01 00:00,18
Maars Hospital,"Garhi Bolni Rd, near PWD Office, Sector 19, Rewari, Haryana",Yes (15),15,0,0,0,15,0,0,0,Yes,No,Yes,Yes,No,1970-01-01 00:00,18
"Manasavi Hospital, Rewari",,Yes (10),10,0,0,0,10,0,0,0,Yes,No,Yes,No,Yes,2021-05-28 12:12,18
Matrika Hospital,"Matrika Hospital, Ranbir Singh Huda Chowk, Bawal-Rewari Rd, Rewari, Haryana",Yes (23),12,0,11,1,16,0,14,3,Yes,No,No,Yes,Yes,2021-05-28 10:27,18
Mediom Hospital/Medcare Hospital,"Sohna Rd, near Municipal Corporation, Dharuhera, Haryana",Yes (4),3,Beds Over Utilized 1,1,0,8,0,4,1,Yes,No,Yes,Yes,Yes,2021-05-23 18:58,18
Om Hospital,"Om Hospital, Nandrampur Bass Rd, Dharuhera, Haryana",Yes (24),12,4,8,0,12,4,8,0,Yes,No,Yes,Yes,Yes,1970-01-01 00:00,18
Pushpanjli Hospital Rewari,"Rajesh Pilot Chowk, Rewari, Haryana",No (0),0,0,0,0,40,12,10,3,No,No,Yes,Yes,Yes,2021-05-25 16:33,18
R. B. Yadav Hospital,"Dr. R B Yadav Hospital, Circular Rd Jainpuri, Kayasthwara Mohalla, Rewari, Haryana",Yes (22),8,6,8,2,8,6,8,2,Yes,No,Yes,Yes,Yes,1970-01-01 00:00,18
Samrat Hospital,Near Azad Chowk Rewari,Yes (9),5,0,4,3,5,0,10,3,Yes,No,Yes,Yes,Yes,2021-05-25 17:44,18
SDH Kosli,"Kosli, Rewari, Haryana",Yes (31),11,20,0,0,20,20,0,0,Yes,No,No,No,No,2021-05-25 16:32,18
Shanti Yadav Hospital,"Bawal-Rewari Rd Model Town, Rewari, Haryana",Yes (28),16,8,4,1,19,10,4,1,Yes,No,Yes,No,No,2021-05-26 09:37,18
Sheela Neuro &amp; Multi. Superspeciality Hospital,"Sheela Neuro Multi-Super Speciality Hospital, Opposite Jain Public School, Circular Road, Rewari",Yes (32),15,15,2,0,15,15,3,1,Yes,No,Yes,Yes,No,2021-05-25 17:47,18
Shri Ashwani Sexena Hospital,"343-L, Model town Rewari",Yes (10),7,3,0,0,7,3,0,0,Yes,No,Yes,Yes,Yes,1970-01-01 00:00,18
SMCC Hospital,"Sector 5 Rewari, Haryana",Yes (13),2,0,11,1,2,0,11,1,Yes,No,Yes,Yes,Yes,1970-01-01 00:00,18
Surendra Hospital Bawal,"Circuar Road, Rewari, Haryana",Yes (11),5,2,4,0,5,2,5,0,Yes,No,Yes,No,Yes,1970-01-01 00:00,18
"Sushma Devi Hospital, Bawal","Rewari Road, Bawal, Rewari, Near Power House & Bharat Petrol Pump",Yes (18),9,9,0,0,9,9,0,0,Yes,No,Yes,Yes,Yes,1970-01-01 00:00,18
Vedanta Hospital,"Circulare Road, Near Nirankari Satsang Bhavan Dharuhera, Chungi, Rewari, Haryana",Yes (29),0,7,22,0,0,7,30,0,Yes,No,Yes,Yes,Yes,2021-05-25 16:42,18
Virat Hospital,"Circular Rd, Near Oriental Bank of Commerce, Madhu Vihar, Rewari, Haryana",Yes (99),62,10,27,2,63,10,27,2,Yes,No,Yes,Yes,Yes,1970-01-01 00:00,18
Yaduvanshi Hospital,"Maharana Pratap Chowk, Model Town, Rewari, Haryana",Yes (19),14,0,5,2,14,0,5,2,Yes,No,Yes,Yes,No,1970-01-01 00:00,18
GH Charkhi Dadri,"Near Loharu Chowk,Charkhi Dadri",Yes (51),35,15,1,11,35,15,1,11,Yes,Yes,Yes,Yes,Yes,1970-01-01 00:00,3
Jaihind Hospital,Charkhi Dadri,Yes (13),7,1,5,0,7,1,5,0,Yes,Yes,Yes,To Be Updated,To Be Updated,1970-01-01 00:00,3
Murari Lal Rasiwasia Ayurvedic Hospital,"Delhi Road,Near Janta College",Yes (70),60,10,0,0,60,10,0,0,Yes,Yes,Yes,Yes,Yes,1970-01-01 00:00,3
Oscar Hospital,Charkhi Dadri,Yes (20),0,0,20,0,0,0,20,0,To Be Updated,To Be Updated,To Be Updated,To Be Updated,To Be Updated,1970-01-01 00:00,3
Pradhan Medicare Centre,"Loharu Rd, Charkhi Dadri, Haryana",Yes (17),14,0,3,0,14,0,3,0,To Be Updated,Yes,Yes,Yes,Yes,1970-01-01 00:00,3
Sunflag Hospital,Charkhi Dadri,Yes (12),6,0,6,0,6,0,6,0,To Be Updated,To Be Updated,To Be Updated,To Be Updated,To Be Updated,1970-01-01 00:00,3
"Ayurvedic Medical College, Patikra",HUDA Sec. 1 Narnaul,Yes (192),35,157,0,0,40,160,0,0,Yes,Yes,Yes,Yes,Yes,1970-01-01 00:00,13
CHC ATELI,CHC ATELI,Yes (20),15,5,0,0,15,5,0,0,Yes,Yes,Yes,Yes,Yes,1970-01-01 00:00,13
CHC Kanina,Kanina,Yes (27),15,12,0,0,15,12,0,0,To Be Updated,To Be Updated,To Be Updated,To Be Updated,To Be Updated,1970-01-01 00:00,13
CHC Nangal Chaudhary,chc nangal choudhary,Yes (10),5,5,0,0,5,5,0,0,No,Yes,Yes,Yes,Yes,1970-01-01 00:00,13
CHC Sehlang,CHC SEHLANG,Yes (9),5,4,0,0,5,4,0,0,Yes,Yes,Yes,Yes,Yes,1970-01-01 00:00,13
Civil Hospital Narnaul,"Housing Board, Narnaul",Yes (77),77,0,0,8,80,0,0,10,Yes,Yes,Yes,Yes,Yes,1970-01-01 00:00,13
Jaipur Heart &amp; Multi Speciality Hospital,"Opp. Sadar Thana, Narnaul",Yes (12),6,3,3,2,6,3,4,2,Yes,Yes,Yes,Yes,Yes,1970-01-01 00:00,13
LAXMI NARAYANAN,"Laxmi Narayanan Hospital , Narnaul Road Mahendergarh",Yes (10),6,0,4,1,6,0,4,1,Yes,Yes,Yes,Yes,Yes,1970-01-01 00:00,13
Nihal Hospital Kanina,Kanina Main Bus Stand,Yes (13),12,0,1,1,13,0,1,1,Yes,Yes,Yes,Yes,Yes,1970-01-01 00:00,13
Rainbow Multispecialty hospital and trauma Centre,"Singhana road, Narnaul",Yes (13),4,3,6,2,4,3,6,2,Yes,No,Yes,Yes,Yes,1970-01-01 00:00,13
Sammat Memorial Hospital,"Sastri colony, near bus stand, mahendergarh",Yes (13),10,0,3,2,10,0,3,2,Yes,No,Yes,Yes,Yes,1970-01-01 00:00,13
Sanwedna Hospital Narnaul,"HUDA Sector 1, Narnaul",Yes (26),17,0,9,1,25,0,9,1,Yes,Yes,Yes,Yes,Yes,1970-01-01 00:00,13
SDH Mahendergarh,SDH Mahendergarh,Yes (20),20,0,0,5,20,0,0,5,Yes,Yes,Yes,Yes,Yes,1970-01-01 00:00,13
Shanti Hospital Narnaul,Shanti Hospital Narnaul,Yes (22),9,7,6,2,9,7,7,2,Yes,Yes,Yes,Yes,Yes,1970-01-01 00:00,13
Sheela Multi Superspeciality Hospital,Behind Bus Stand Mahindergarh,Yes (9),6,0,3,1,6,0,3,1,Yes,No,Yes,Yes,Yes,1970-01-01 00:00,13
Shri Arvind Heart and Multispecialty Hospital,"Rao Tula Ram Chowk, Dadri Road Mahendergarh",Yes (17),9,5,3,3,9,5,3,3,Yes,Yes,Yes,Yes,Yes,1970-01-01 00:00,13
Tanwar Health Care MGarh,,Yes (9),5,0,4,1,5,0,4,1,Yes,No,Yes,Yes,Yes,1970-01-01 00:00,13
Vijay Hospital Narnaul,"HUDA Sector 1, Narnaul",Yes (22),8,0,14,2,8,0,15,2,Yes,Yes,Yes,Yes,Yes,1970-01-01 00:00,13
Cygnus Multispecialty Hospital Kaithal,"Huda Bypass Road, Sector 20, Kaithal, Haryana",Yes (40),28,0,12,2,28,0,12,2,Yes,No,Yes,Yes,Yes,1970-01-01 00:00,10
District Civil Hospital Kaithal,"Huda Sec 18, Kaithal",Yes (104),70,14,20,18,80,15,20,18,Yes,Yes,Yes,Yes,Yes,1970-01-01 00:00,10
SDH Guhla,SDH Guhla,Yes (70),35,35,0,5,35,35,0,5,Yes,No,Yes,No,Yes,1970-01-01 00:00,10
Shah Multispecialty Hospital Kaithal,"opp.old, bus stand, Jind - Kaithal Rd, Amar Garh Colony, Kaithal, Haryana",Yes (74),50,11,13,9,51,11,15,10,Yes,No,Yes,Yes,Yes,1970-01-01 00:00,10
Amar Hospotal,Assandh,No (0),0,0,0,0,0,0,0,0,Yes,Yes,Yes,Yes,Yes,1970-01-01 00:00,11
"AMRITDHARA, Chaura Bazar","Near ITI Chowk, Gahoon Vihar, Karnal, Haryana",Yes (4),4,0,0,0,38,0,26,2,Yes,No,Yes,Yes,Yes,1970-01-01 00:00,11
Arpana Hospital,"G.T. Road, Madhuban, Karnal, Karnal, Haryana",Yes (18),16,0,2,0,16,0,2,1,Yes,No,Yes,Yes,Yes,1970-01-01 00:00,11
Arsh Hospital,Opp. Kalpana Chawla Medical College,Yes (15),9,0,6,0,9,0,6,0,Yes,Yes,Yes,Yes,Yes,1970-01-01 00:00,11
CHC Assandh,"Assandh, Assandh Ruralpart, Haryana",Yes (10),10,0,0,0,10,0,0,0,Yes,No,Yes,No,Yes,1970-01-01 00:00,11
CHC Gharaunda,"Balinagar, Gharaunda, Haryana",Yes (10),10,0,0,0,10,0,0,0,Yes,No,Yes,No,Yes,1970-01-01 00:00,11
CHC Kunjpura,Village Kunjpura,Yes (11),11,0,0,0,11,0,0,0,To Be Updated,Yes,Yes,Yes,Yes,1970-01-01 00:00,11
CHC Nissing,"SH 8, Gondar, Nissing, Haryana",Yes (10),10,0,0,0,10,0,0,0,Yes,No,Yes,No,Yes,1970-01-01 00:00,11
CHC Taraori,CHC Taraori,Yes (6),6,0,0,0,6,0,0,0,Yes,No,Yes,No,Yes,1970-01-01 00:00,11
Dr. Gian Bhushan Hospital,"Kunjpura Rd Old Char Chaman Dyal Singh Colony Karnal  132001 Republic of,",Yes (8),3,0,5,0,6,0,5,0,Yes,No,No,No,No,1970-01-01 00:00,11
Ishwar Kirpa Hospital,"Ishwar Kirpa Hospital, Sector -14",Yes (20),14,0,6,0,14,0,7,0,Yes,No,Yes,Yes,Yes,1970-01-01 00:00,11
"Kalpana Chawla Government Medical College, Karnal","Model Town, Karnal, Haryana",Yes (2),1,0,1,0,200,0,80,80,Yes,Yes,Yes,Yes,Yes,1970-01-01 00:00,11
Karnal Nursing Home,"26 Duggal Colony, Karnal",Yes (16),8,0,8,0,8,0,10,0,Yes,To Be Updated,Yes,Yes,Yes,1970-01-01 00:00,11
Maxxwell Hospital Indri,Near Budhnath Dera Ward No 1,Yes (15),10,0,5,3,10,0,5,3,Yes,Yes,Yes,Yes,Yes,1970-01-01 00:00,11
Park Hospital karnal,"CHD City, NH-1, Sector 45, Karnal, Haryana",Yes (30),10,0,20,2,10,0,20,2,To Be Updated,To Be Updated,To Be Updated,To Be Updated,To Be Updated,1970-01-01 00:00,11
Rama Superspeciality Hospital,Civil Hosp Chowk Karnal,No (0),0,0,0,0,8,0,6,0,Yes,No,Yes,Yes,Yes,1970-01-01 00:00,11
RP Welltar Hospital,"Vill. Bastara, District Karnal",Yes (17),9,4,4,1,10,4,4,1,Yes,No,Yes,No,Yes,1970-01-01 00:00,11
Sanidhya Nursing Home,"indri, Karnal",Yes (15),10,0,5,0,10,0,5,0,To Be Updated,Yes,Yes,Yes,Yes,1970-01-01 00:00,11
"Sanjiv Bansal Cygnus Hospital , Karnal","Railway Rd, Ibrahim Mandi, Karnal, Haryana",Yes (19),17,0,2,2,20,0,5,2,Yes,Yes,Yes,Yes,Yes,1970-01-01 00:00,11
Sarvodya Hospital Karnal,"Sector 14, Near Tau Devi Lal Chowk",Yes (22),12,0,10,0,12,0,10,0,Yes,Yes,Yes,Yes,Yes,1970-01-01 00:00,11
SDH Nilokheri,SDH Nilokheri,Yes (10),10,0,0,0,10,0,0,0,Yes,No,Yes,No,Yes,1970-01-01 00:00,11
Shri Ram Chand Memorial Hospital,"12, Ashoka colony,Opp Kalpana Chawla hospital, Karnal, Haryana",No (0),0,0,0,0,8,0,7,3,Yes,No,Yes,Yes,Yes,1970-01-01 00:00,11
Shri Sanatan Dharam Mahabir Dal,"Kunjpura Road, Karnal Near Sanatan Dharam Mandir",Yes (12),12,0,0,0,12,0,0,0,Yes,Yes,Yes,Yes,Yes,1970-01-01 00:00,11
SS Hospital,"Sector 14, Karnal",Yes (14),7,0,7,0,7,0,7,0,Yes,To Be Updated,Yes,Yes,Yes,1970-01-01 00:00,11
Swastik Hospital,Swastic Hospital Opp DCH,Yes (19),10,0,9,0,10,0,9,0,Yes,No,Yes,Yes,Yes,1970-01-01 00:00,11
Virk Hospital Karnal,"363-364, Randhir lane, near Dyal Singh College, Karnal, Haryana",Yes (44),36,0,8,1,37,0,8,1,Yes,Yes,Yes,Yes,Yes,1970-01-01 00:00,11
Anchal Multispeciality Hospital,"Anchal Multi speciality Hospital, Krishna Colony, Bhiwani, Haryana 127027",Yes (35),25,0,10,2,25,0,10,2,Yes,Yes,Yes,Yes,Yes,1970-01-01 00:00,2
Ch. Bansilal Govt Hospital,"Bansi Lal General Hospital, Ghanta Ghar Chowk, SH 17, Krishna Colony, Bhiwani, Haryana 127021",Yes (168),137,5,26,16,139,5,28,16,Yes,Yes,Yes,Yes,Yes,1970-01-01 00:00,2
Chugh Hospital,"Meham Gate, Circular Road, Bhiwani",Yes (20),20,0,0,0,20,0,0,0,Yes,Yes,Yes,Yes,Yes,1970-01-01 00:00,2
ESI Hospital Bhiwani,"Stadium Rd, Housing Board Colony, Bhiwani, Haryana 127021",Yes (40),0,40,0,0,0,40,0,0,No,No,Yes,Yes,Yes,1970-01-01 00:00,2
Ganpatrai Hospital,"SH 17, Bank Colony, Bound Kalan, Krishna Colony, Bhiwani, Haryana 127021",Yes (10),4,4,2,1,4,4,2,1,Yes,No,Yes,Yes,Yes,1970-01-01 00:00,2
Jangra Multispecilaity Hospital,"Bank Colony, Old Bharat Nagar, Bhiwani, Haryana 127021",Yes (10),7,3,0,0,7,3,0,0,Yes,No,Yes,Yes,Yes,1970-01-01 00:00,2
Jeevan Nursing Home-Bhiwani,Rohtak gate Bhiwani,Yes (10),3,4,3,0,3,4,3,0,Yes,Yes,Yes,Yes,Yes,1970-01-01 00:00,2
Jeevanrekha Hospital,Near Railway Road Bhiwani,Yes (30),25,0,5,1,25,0,5,1,To Be Updated,To Be Updated,To Be Updated,To Be Updated,To Be Updated,1970-01-01 00:00,2
Kadam Hospital,"Bank Colony Near New Bus Stand, Bhiwani",Yes (45),11,0,34,1,11,0,34,1,Yes,Yes,Yes,Yes,Yes,1970-01-01 00:00,2
Krishan Lal Jalan Hospital,"Jalan Nagar, M.C.Colony, Bhiwani, Haryana 127021",Yes (40),20,20,0,0,20,20,0,0,Yes,Yes,Yes,Yes,Yes,1970-01-01 00:00,2
Life Line Hospital,"Circular Rd, M.C.Colony, Bhiwani, Haryana 127021",Yes (27),21,0,6,0,21,0,6,0,Yes,Yes,Yes,Yes,Yes,1970-01-01 00:00,2
RPS HOSPITAL,,Yes (24),4,16,4,0,4,16,4,0,Yes,No,Yes,Yes,Yes,1970-01-01 00:00,2
Sharma Nursing and Maternity Home Tosham,Siwani Road Tosham,Yes (10),7,0,3,2,7,0,3,2,Yes,Yes,To Be Updated,Yes,Yes,1970-01-01 00:00,2
Shree Ganesha Hospital,"Dadri Gate, Bhiwani",Yes (13),6,3,4,0,6,3,4,0,Yes,Yes,Yes,Yes,Yes,1970-01-01 00:00,2
"SHRI BABA YOGI NETANATH HOSPITAL , LOHANI ,BHIWANI",VPO Lohani,Yes (48),34,5,9,2,35,5,10,2,Yes,Yes,Yes,Yes,Yes,1970-01-01 00:00,2
Shri Ram Hospital,Siwani,Yes (23),13,0,10,4,13,0,11,4,To Be Updated,To Be Updated,To Be Updated,To Be Updated,To Be Updated,1970-01-01 00:00,2
SMSG Multispeciality Hospital,"Rohtak Gate, Bhiwani",Yes (30),2,17,11,2,2,17,11,2,Yes,Yes,Yes,Yes,Yes,1970-01-01 00:00,2
Spes Hospital,"Circular Rd, Bound Kalan, M.C.Colony, Bhiwani, Haryana 127021",Yes (22),4,6,12,1,4,6,12,1,Yes,Yes,Yes,Yes,Yes,1970-01-01 00:00,2
Ch Lekh Raj Multispeciality Hospital,Vill Gadhauli Yamuna Nagar,Yes (149),139,0,10,5,140,0,10,5,Yes,Yes,Yes,Yes,Yes,1970-01-01 00:00,22
CHC Bilaspur,CHC Bilaspur,Yes (25),8,17,0,0,8,17,0,0,Yes,No,Yes,No,Yes,1970-01-01 00:00,22
CHC Chhachharuli,CHC Chhachharuli,Yes (30),10,20,0,0,10,20,0,0,Yes,No,Yes,Yes,Yes,1970-01-01 00:00,22
CHC Naharpur,Naharpur Yamuna Nagar,Yes (10),10,0,0,0,10,0,0,0,Yes,No,No,No,Yes,1970-01-01 00:00,22
CHC Partap Nagar,CHC Partap Nagar,Yes (16),6,10,0,0,6,10,0,0,Yes,No,Yes,No,Yes,1970-01-01 00:00,22
CHC Radaur,Radaur Yamuna Nagar,Yes (20),10,10,0,0,10,10,0,0,Yes,No,Yes,Yes,Yes,1970-01-01 00:00,22
CHC Saraswati Nagar,CHC Saraswati Nagar,Yes (25),14,11,0,0,14,11,0,0,Yes,No,Yes,No,Yes,1970-01-01 00:00,22
DABRA HOSPITAL Yamunanagar,DABRA HOSPITAL,Yes (23),11,8,4,2,11,8,4,2,Yes,No,Yes,Yes,Yes,1970-01-01 00:00,22
ESI Hospital,"ESI Hospital, Jagadhri",Yes (51),29,0,22,0,36,0,22,0,Yes,No,Yes,Yes,Yes,1970-01-01 00:00,22
Gaba Hospital,Gaba Hospital Yamunanagar,Yes (41),20,10,11,5,20,10,15,5,Yes,No,Yes,Yes,Yes,1970-01-01 00:00,22
GULATI HOSPITAL,GULATI HOSPITAL,Yes (33),24,3,6,0,25,3,6,0,Yes,No,Yes,Yes,Yes,1970-01-01 00:00,22
Heart Care Center Hospital,Near Lal Dwara Mandir Yamuna Nagar,Yes (19),2,2,15,7,2,2,15,7,Yes,No,Yes,Yes,Yes,1970-01-01 00:00,22
JP Hospital Pvt,"Jagadhri Rd, near Luxmi Theater, Vishwakarma Mohalla, Yamuna Nagar,HARAYANA Haryana",Yes (40),15,15,10,2,15,15,13,2,Yes,No,Yes,Yes,Yes,1970-01-01 00:00,22
KAPOOR HOSPITAL,"SH 6A Indira Colony Jagadhri, yamunanagart ,Haryana",Yes (12),4,0,8,0,4,0,8,0,Yes,No,Yes,Yes,Yes,1970-01-01 00:00,22
KESHWANI HOSPITAL,"Jagadhri - Yamuna Nagar Rd, Tagore Garden, Yamuna Nagar, Haryana",Yes (10),10,0,0,0,10,0,0,0,Yes,No,Yes,Yes,Yes,1970-01-01 00:00,22
Maxxwell Hospital,Jagadhari Yamuna Nagar,Yes (17),11,0,6,0,11,0,6,0,Yes,No,Yes,Yes,Yes,1970-01-01 00:00,22
Mukand Lal District Civil Hospital Yamunanagar,Mukand Lal District Civil Hospital YNR,Yes (27),18,9,0,2,18,9,0,5,Yes,No,Yes,Yes,Yes,1970-01-01 00:00,22
RK Gupta,opp DAV Sr Sec School Near Madhu Hotel YNR,Yes (16),0,2,14,0,0,2,15,0,Yes,Yes,Yes,Yes,Yes,1970-01-01 00:00,22
SABBARWAL HOSPITAL,"Gulab Nagar, Jagadhri, Haryana",Yes (12),5,1,6,0,6,1,6,0,Yes,No,Yes,Yes,Yes,1970-01-01 00:00,22
Sachdeva Hospital,"2227, Civil Lines Rd, Sri Nagar Colony, Civil Lines, Gomti Mohalla, Jagadhri, Haryana",Yes (28),16,8,4,0,16,8,4,0,Yes,No,Yes,Yes,Yes,1970-01-01 00:00,22
Santosh Hospital,"Santosh Hospital  Kanhaiya Sahib Chowk, near Govt.School, Harbanspura Colony, Gobind Pura, Yamuna Nagar, Haryana",Yes (27),5,9,13,2,5,9,14,2,Yes,No,Yes,Yes,Yes,1970-01-01 00:00,22
SHARMA HOSPITAL,Near Agarsain Chowk Jagadhri,Yes (12),12,0,0,0,12,0,0,0,Yes,No,Yes,Yes,Yes,1970-01-01 00:00,22
Shree Medical Care Hospital,"359/2, Jain nagar, Jagadhri, Haryana",Yes (15),15,0,0,0,15,0,0,0,Yes,Yes,Yes,Yes,Yes,1970-01-01 00:00,22
Shureshtha Hospital,Model Colony YNR,Yes (10),7,1,2,0,9,1,2,0,Yes,No,Yes,Yes,Yes,1970-01-01 00:00,22
SP Hospital Jag,S.P Hospital Jag,Yes (7),4,0,3,1,4,0,3,1,Yes,No,Yes,Yes,Yes,1970-01-01 00:00,22
Swami Vivekanand Hospital Yamunanagar,"Swami Vivekanand Hospital,Yamuna Nagar, Haryana",Yes (49),20,10,19,1,20,10,19,1,Yes,No,Yes,Yes,Yes,1970-01-01 00:00,22
Swastik Hospital,"Basant Nagar, Yamuna Nagar, Haryana",Yes (6),4,2,0,0,4,2,0,0,Yes,No,Yes,Yes,Yes,1970-01-01 00:00,22
tejli stadium,64 A Tejli,Yes (76),20,56,0,0,20,56,0,0,Yes,No,No,No,Yes,1970-01-01 00:00,22
VARDAAN HOSPITAL,OPP KOHLI HOSPITAL NEAR AGARSEN COLLEGE JAGADHRI,Yes (10),8,2,0,0,8,2,0,0,Yes,No,Yes,Yes,Yes,1970-01-01 00:00,22