name,address,Availability_availability_of_beds,Availability_oxygen_beds,Availability_non_oxygen_beds,Availability_i_c_u_beds,Availability_ventilators,Allocated_oxygen_beds,Allocated_non_oxygen_beds,Allocated_i_c_u,Allocated_ventilators,Availability_availability_of_oxygen,Availability_antiviral_remdesivir_etc_,Availability_steroids,Availability_anticoagulant,Availability_antipyretic,updated_on,city
Aashirwad Hospital,101 Devi Murti Colony Panipat,Yes (9),2,0,7,1,2,0,7,1,Yes,No,Yes,Yes,Yes,1970-01-01 00:00,17
Aayushmaan Bhav Hospital,"GT Road Sewah, Near Police Line Panipat",Yes (15),5,4,6,2,5,4,6,2,Yes,No,Yes,Yes,Yes,1970-01-01 00:00,17
APEX HOSPITAL &amp; TRAUMA CENTRE,SANOLI ROAD BABAIL NAKA,Yes (35),9,0,26,2,9,0,26,2,Yes,No,Yes,Yes,Yes,1970-01-01 00:00,17
CHC Dadlana,"VPO Dadlana, Panipat",Yes (8),0,8,0,0,0,8,0,0,No,No,No,No,Yes,1970-01-01 00:00,17
CHC Khotpura,VPO Khotpura Panipat,Yes (9),0,9,0,0,0,9,0,0,No,No,No,No,No,1970-01-01 00:00,17
Chhabra Hospital,A-1 Narain Singh Park,Yes (11),6,0,5,1,6,0,5,1,Yes,No,Yes,Yes,Yes,1970-01-01 00:00,17
Civil Hospital panipat,Civil Hospital GT Road Panipat,Yes (103),74,20,9,3,74,20,10,4,Yes,Yes,Yes,Yes,Yes,1970-01-01 00:00,17
Cygnus Hospital panipat,Cygnus Hospital Near Devi Mndir Panipat,Yes (17),12,0,5,4,12,0,5,4,Yes,No,Yes,Yes,Yes,1970-01-01 00:00,17
GALAXY HOSPITAL,ASSAND ROAD PANIPAT,Yes (15),7,0,8,2,7,0,8,2,Yes,No,Yes,Yes,Yes,1970-01-01 00:00,17
Guru Teg Bhadur Sanjeevani Hospital,"Village Bal Jatan Near Panipat Refinary, Panipat",Yes (314),307,7,0,0,307,7,0,0,Yes,No,Yes,Yes,Yes,1970-01-01 00:00,17
Hyderabadi General Hospital &amp; Nursing Home,"Sanoli Road, Near Sanjay, Chowk, Panipat",Yes (10),0,0,10,2,0,0,10,2,Yes,No,Yes,Yes,Yes,1970-01-01 00:00,17
IBM HOSPITAL &amp; TRAUMA CENTRE,NEAR BHIM GODA MANDIR SANOLI ROAD,Yes (24),12,0,12,2,12,0,12,2,Yes,No,Yes,Yes,Yes,1970-01-01 00:00,17
LHDM &amp; Prem Hospital,Prem Hospital Opp. Bus Stand Panipat,Yes (78),70,0,8,3,71,0,9,8,Yes,Yes,Yes,Yes,Yes,1970-01-01 00:00,17
MAX PLUS HOSPITAL,NEAR MALIK PETROL PUMP SANOLI ROAD,Yes (15),8,0,7,3,8,0,7,3,Yes,No,Yes,Yes,Yes,1970-01-01 00:00,17
NC Medical College,NC Medical Colllage Israna,Yes (530),42,483,5,4,42,483,5,4,Yes,No,Yes,Yes,Yes,1970-01-01 00:00,17
Park Hospital GT road panipat,"GT Road Sewah, Paniapt",Yes (81),52,14,15,2,52,14,16,2,Yes,Yes,Yes,Yes,Yes,1970-01-01 00:00,17
Prime Hospital Health Leaders,"Opp. Gangapuri Road, Sanoli Road Panipat",Yes (20),14,2,4,4,14,2,4,4,Yes,No,Yes,Yes,Yes,1970-01-01 00:00,17
Rainbow Hospital,152-R Model Town Panipat,Yes (9),6,0,3,1,6,0,3,1,Yes,No,Yes,Yes,Yes,1970-01-01 00:00,17
SDH Samalkha,G.T Road Samalkha,Yes (50),30,20,0,0,30,20,0,0,No,No,Yes,No,Yes,1970-01-01 00:00,17
shobhit Hospital,"adjacent canara bank, tahsil camp",Yes (19),12,2,5,1,12,2,5,1,Yes,No,Yes,Yes,Yes,1970-01-01 00:00,17
Shree Badri Das Hospital and ICU Care Centre,Assandh Road Panipat,Yes (11),8,0,3,1,8,0,3,1,Yes,No,Yes,Yes,Yes,1970-01-01 00:00,17
Shree Balajee Multispeciality Hospital,Aggarsan Colony Assandh Road Panipat,Yes (10),4,0,6,2,4,0,6,2,Yes,Yes,Yes,Yes,Yes,1970-01-01 00:00,17
Shubham Hospital,"202 New Sukhdev Nagar, Panipat",Yes (9),6,0,3,3,6,0,3,3,Yes,No,Yes,Yes,Yes,1970-01-01 00:00,17
"AAROGYAM HOSPITAL, Kurukshetra","NEAR OLD BUS STAND, THANESAR, KURUSKHETRA",Yes (49),34,12,3,26,40,12,15,27,Yes,Yes,Yes,Yes,Yes,1970-01-01 00:00,12
"ADESH MEDICAL COLLEGE, SHAHBAD MOHRI KURUKSHETRA.","VILL. MOHRI, SHAHBAD, KURUSHETRA",Yes (105),30,70,5,11,30,70,5,11,Yes,Yes,Yes,Yes,Yes,1970-01-01 00:00,12
AGGARWAL NURSING HOME,"SALARPUR ROAD, THANESAR, KURUKSHETRA.",Yes (16),7,7,2,3,20,7,3,7,Yes,Yes,Yes,Yes,Yes,1970-01-01 00:00,12
B.S. HEART CARE,"OPP. NEW BUS STAND, KURUKSHETRA.",Yes (26),18,0,8,20,18,0,8,20,Yes,Yes,Yes,Yes,Yes,1970-01-01 00:00,12
"CYGNUS HOSPITAL, Kurukshetra","NEAR OLD BUS STAND, THANESAR, KURUSKHETRA",Yes (10),6,3,1,4,7,4,1,4,Yes,Yes,Yes,Yes,Yes,1970-01-01 00:00,12
KURUKSHETRA NURSING HOME,,Yes (19),18,0,1,2,18,0,1,2,Yes,Yes,Yes,Yes,Yes,1970-01-01 00:00,12
LNJP CIVIL HOSPITAL.,LNJP HOSPITAL KURUKSHETRA.,Yes (86),54,27,5,5,60,30,5,5,Yes,Yes,Yes,Yes,Yes,1970-01-01 00:00,12
MIRI PIRI SHAHBAD,"SHAHBAD, KURUKSHETRA",Yes (14),10,0,4,4,10,0,4,4,Yes,Yes,Yes,Yes,Yes,1970-01-01 00:00,12
Nirogi Hospital,Shahabad Kurukshetra,Yes (7),5,2,0,3,5,2,0,3,Yes,Yes,Yes,Yes,Yes,1970-01-01 00:00,12
"Saraswati Mission Hospital, Kurukshetra","Theme Park Road, Kurukshetra",Yes (20),4,0,16,2,4,0,16,2,Yes,Yes,Yes,Yes,Yes,1970-01-01 00:00,12
"Saraswati Mission Hospital, Pehowa","Ambala Road Dist. Kurukshetra, Pehowa, Haryana 136128",Yes (21),19,0,2,5,20,0,2,5,Yes,No,Yes,Yes,Yes,1970-01-01 00:00,12
"SIDHARTH HOSPITAL, SHAHBAD","SHAHBAD, KURUKSHETRA",Yes (16),8,4,4,3,8,4,4,3,Yes,Yes,Yes,Yes,Yes,1970-01-01 00:00,12
VERMA HOSPITAL,LADWA,Yes (13),8,3,2,2,9,3,2,2,Yes,Yes,Yes,Yes,Yes,1970-01-01 00:00,12
"Aditya Neuro &amp; Spine Hospital, Rewari","Circular Rd, near Kanod gate, Raam Bagh Mahalla, Rewari, Haryana",Yes (10),8,0,2,2,8,0,2,2,Yes,No,Yes,Yes,Yes,2021-05-28 11:46,18
Advance Hospital,"Bawal Road, Model Town",Yes (8),5,0,3,0,5,0,6,1,Yes,No,Yes,Yes,Yes,2021-05-25 17:43,18
"Apex Hospital, Dharuhera","Plot No.5, Sector 6, Dharuhera, Haryana 123106",Yes (10),6,0,4,1,6,0,4,1,Yes,No,Yes,Yes,Yes,2021-05-28 12:08,18
Apollo Rewari/Family Health Edge Hospital,"Garhi Bolni Rd, near Public Health Office, krishna Nagar, Rewari, Haryana",Yes (27),17,3,7,0,17,3,7,0,Yes,No,Yes,Yes,Yes,1970-01-01 00:00,18
Capt. Nand Lal Hospital,"Circular Road near Government Girls Senior Secondary School naiwali, chowk, Rewari",Yes (20),6,10,4,1,11,10,8,1,Yes,No,Yes,Yes,Yes,2021-05-15 23:54,18
Civil Hospital rewari,"Kayasthwara Mohalla, Rewari, Haryana",Yes (60),39,16,5,1,40,16,8,4,Yes,No,Yes,Yes,Yes,1970-01-01 00:00,18
Cygnus Hospital Rewari,"Opposite Civil Hospital Mohola, Sanghi Ka Bass, Rewari, Haryana",Yes (32),21,7,4,1,26,7,9,2,Yes,No,Yes,No,Yes,2021-05-28 09:58,18
Devjyoti Hospital,"Ambedkar chowk, near Bus Stand, Rewari, Haryana",Yes (14),7,2,5,1,7,2,6,2,Yes,No,Yes,Yes,Yes,1970-01-01 00:00,18
Dr. K.K. NAGAR HOSPITAL,"317, Near Shishu Shala School, Model Town, Rewari, Haryana",Yes (12),2,0,10,0,2,0,10,0,Yes,No,Yes,Yes,Yes,1970-01-01 00:00,18
Dr. Vijay Pal Yadav Hospital,"Near Ambedker chowk, Rewari",Yes (7),2,2,3,0,3,3,4,0,Yes,No,Yes,Yes,Yes,2021-05-23 09:52,18
Kamla Nursing Home/Kalawati Hospital,"201, Model Town, Rewari, Near Bus Stand, Opposite Bal Bhawan, Shivam Chowk",Yes (17),12,0,5,5,14,0,9,6,Yes,No,Yes,Yes,Yes,2021-05-27 18:47,18
Katyal Hospital,"Katyal Hospital, KANOD GATE, CIRCULAR ROAD, Rewari, Haryana, India",Yes (21),9,6,6,0,12,6,10,1,Yes,No,Yes,Yes,Yes,1970-01-01 00:00,18
Maars Hospital,"Garhi Bolni Rd, near PWD Office, Sector 19, Rewari, Haryana",Yes (15),15,0,0,0,15,0,0,0,Yes,No,Yes,Yes,No,1970-01-01 00:00,18
"Manasavi Hospital, Rewari",,Yes (10),10,0,0,0,10,0,0,0,Yes,No,Yes,No,Yes,2021-05-28 12:12,18
Matrika Hospital,"Matrika Hospital, Ranbir Singh Huda Chowk, Bawal-Rewari Rd, Rewari, Haryana",Yes (23),12,0,11,1,16,0,14,3,Yes,No,No,Yes,Yes,2021-05-28 10:27,18
Mediom Hospital/Medcare Hospital,"Sohna Rd, near Municipal Corporation, Dharuhera, Haryana",Yes (4),3,Beds Over Utilized 1,1,0,8,0,4,1,Yes,No,Yes,Yes,Yes,2021-05-23 18:58,18
Om Hospital,"Om Hospital, Nandrampur Bass Rd, Dharuhera, Haryana",Yes (24),12,4,8,0,12,4,8,0,Yes,No,Yes,Yes,Yes,1970-01-01 00:00,18
Pushpanjli Hospital Rewari,"Rajesh Pilot Chowk, Rewari, Haryana",No (0),0,0,0,0,40,12,10,3,No,No,Yes,Yes,Yes,2021-05-25 16:33,18
R. B. Yadav Hospital,"Dr. R B Yadav Hospital, Circular Rd Jainpuri, Kayasthwara Mohalla, Rewari, Haryana",Yes (22),8,6,8,2,8,6,8,2,Yes,No,Yes,Yes,Yes,1970-01-01 00:00,18
Samrat Hospital,Near Azad Chowk Rewari,Yes (9),5,0,4,3,5,0,10,3,Yes,No,Yes,Yes,Yes,2021-05-25 17:44,18
SDH Kosli,"Kosli, Rewari, Haryana",Yes (31),11,20,0,0,20,20,0,0,Yes,No,No,No,No,2021-05-25 16:32,18
Shanti Yadav Hospital,"Bawal-Rewari Rd Model Town, Rewari, Haryana",Yes (28),16,8,4,1,19,10,4,1,Yes,No,Yes,No,No,2021-05-26 09:37,18
Sheela Neuro &amp; Multi. Superspeciality Hospital,"Sheela Neuro Multi-Super Speciality Hospital, Opposite Jain Public School, Circular Road, Rewari",Yes (32),15,15,2,0,15,15,3,1,Yes,No,Yes,Yes,No,2021-05-25 17:47,18
Shri Ashwani Sexena Hospital,"343-L, Model town Rewari",Yes (10),7,3,0,0,7,3,0,0,Yes,No,Yes,Yes,Yes,1970-01-01 00:00,18
SMCC Hospital,"Sector 5 Rewari, Haryana",Yes (13),2,0,11,1,2,0,11,1,Yes,No,Yes,Yes,Yes,1970-01-01 00:00,18
Surendra Hospital Bawal,"Circuar Road, Rewari, Haryana",Yes (11),5,2,4,0,5,2,5,0,Yes,No,Yes,No,Yes,1970-01-01 00:00,18
"Sushma Devi Hospital, Bawal","Rewari Road, Bawal, Rewari, Near Power House & Bharat Petrol Pump",Yes (18),9,9,0,0,9,9,0,0,Yes,No,Yes,Yes,Yes,1970-01-01 00:00,18
Vedanta Hospital,"Circulare Road, Near Nirankari Satsang Bhavan Dharuhera, Chungi, Rewari, Haryana",Yes (29),0,7,22,0,0,7,30,0,Yes,No,Yes,Yes,Yes,2021-05-25 16:42,18
Virat Hospital,"Circular Rd, Near Oriental Bank of Commerce, Madhu Vihar, Rewari, Haryana",Yes (98),62,10,26,2,63,10,27,2,Yes,No,Yes,Yes,Yes,1970-01-01 00:00,18
Yaduvanshi Hospital,"Maharana Pratap Chowk, Model Town, Rewari, Haryana",Yes (19),14,0,5,2,14,0,5,2,Yes,No,Yes,Yes,No,1970-01-01 00:00,18
Cygnus Multispecialty Hospital Kaithal,"Huda Bypass Road, Sector 20, Kaithal, Haryana",Yes (40),28,0,12,2,28,0,12,2,Yes,No,Yes,Yes,Yes,1970-01-01 00:00,10
District Civil Hospital Kaithal,"Huda Sec 18, Kaithal",Yes (101),67,14,20,18,80,15,20,18,Yes,Yes,Yes,Yes,Yes,1970-01-01 00:00,10
SDH Guhla,SDH Guhla,Yes (70),24,41,5,5,24,41,5,5,Yes,No,Yes,No,Yes,1970-01-01 00:00,10
Shah Multispecialty Hospital Kaithal,"opp.old, bus stand, Jind - Kaithal Rd, Amar Garh Colony, Kaithal, Haryana",Yes (70),50,11,9,7,51,11,15,10,Yes,No,Yes,Yes,Yes,1970-01-01 00:00,10
DCHC Barara,,Yes (50),50,0,0,0,50,0,0,0,To Be Updated,To Be Updated,To Be Updated,To Be Updated,To Be Updated,1970-01-01 00:00,1
DCHC Mullana,,Yes (50),50,0,0,0,50,0,0,0,To Be Updated,To Be Updated,To Be Updated,To Be Updated,To Be Updated,1970-01-01 00:00,1
District Civil Hospital,Ambala City,Yes (125),104,0,21,11,116,0,23,11,Yes,Yes,Yes,Yes,Yes,1970-01-01 00:00,1
District Civil Hospital Ambala Cantt,Ambala Cantt,Yes (77),71,0,6,6,80,0,13,7,Yes,Yes,Yes,Yes,Yes,1970-01-01 00:00,1
Guardian Hospital,AMBALA JAGADHARI ROAD AMBALA CANTT,Yes (23),15,3,5,3,15,3,5,3,Yes,Yes,Yes,Yes,Yes,1970-01-01 00:00,1
Ishwar Hospital,,Yes (16),16,0,0,0,16,0,0,0,Yes,Yes,Yes,Yes,Yes,1970-01-01 00:00,1
Kuldeep Hospital,,Yes (6),4,0,2,0,8,0,2,0,To Be Updated,To Be Updated,To Be Updated,To Be Updated,To Be Updated,1970-01-01 00:00,1
Mehndiratta Hospital,"#106, manali house, near central jail,  ambala city",Yes (29),24,0,5,1,25,0,5,1,Yes,No,Yes,Yes,Yes,1970-01-01 00:00,1
Military Hospital,Ambala Cantonment,Yes (155),59,81,15,15,60,85,15,15,To Be Updated,To Be Updated,To Be Updated,To Be Updated,To Be Updated,1970-01-01 00:00,1
MM Medical College Pvt,MMIMSR Mullana Ambala,Yes (198),116,70,12,10,116,70,14,10,Yes,Yes,Yes,Yes,Yes,1970-01-01 00:00,1
Park Healing Touch Hospital,"Sultanpur Chowk, Nr Dhulkot Barrier, Ambala Chandigarh Expy. Ambala",Yes (45),27,0,18,10,30,0,20,10,Yes,Yes,Yes,Yes,Yes,1970-01-01 00:00,1
Philedelphia mission Hospital pvt,"Mission Compound, Ambala City",Yes (82),74,0,8,2,92,0,8,2,Yes,No,Yes,Yes,Yes,1970-01-01 00:00,1
Railways Hospital,"Railway Hospital, railway colony,  Ambala Cantt",Yes (29),29,0,0,0,30,0,5,0,Yes,No,Yes,Yes,Yes,1970-01-01 00:00,1
Rotary Hospital Ambala cantt Pvt,"Rambagh road, Opp Dusshera ground, Ambala Cantt",Yes (20),15,0,5,2,15,0,5,2,Yes,No,Yes,Yes,Yes,1970-01-01 00:00,1
Sant Hospital,,Yes (12),9,0,3,1,10,0,3,1,To Be Updated,To Be Updated,To Be Updated,To Be Updated,To Be Updated,1970-01-01 00:00,1
SDH Naraingarh,,Yes (49),49,0,0,0,50,0,0,0,To Be Updated,To Be Updated,To Be Updated,To Be Updated,To Be Updated,1970-01-01 00:00,1
Yafe Indoor Hospital,,Yes (13),7,6,0,0,9,6,0,0,To Be Updated,To Be Updated,To Be Updated,To Be Updated,To Be Updated,1970-01-01 00:00,1
ASHIRWAD BHAGAT HOSPITAL,"Old DC Rd, near bhagat hospital, Sonipat, Haryana 131001",Yes (15),12,0,3,1,12,0,3,1,Yes,Yes,Yes,Yes,Yes,1970-01-01 00:00,21
Bhagwan Dass Hospital,"Near Shahpur Turk, block-E, omaxe city, Sector 18, Sonipat, Haryana 131001",Yes (40),27,0,13,2,27,0,13,2,Yes,No,Yes,Yes,Yes,1970-01-01 00:00,21
"BPS MEDICAL COLLEGE KHANPUR , SONIPAT ( 01263283088)","Ganaur - Gohana Rd, Khanpur Kalan, Haryana",Yes (295),167,80,48,48,170,80,50,50,Yes,Yes,Yes,Yes,Yes,1970-01-01 00:00,21
CHC GANUR,CHC GANUR,Yes (8),8,0,0,0,8,0,0,0,Yes,No,Yes,Yes,Yes,1970-01-01 00:00,21
CHC Kharkhoda,"SH 20, Kharkhoda, Haryana 131402",Yes (10),5,5,0,0,5,5,0,0,To Be Updated,To Be Updated,Yes,Yes,Yes,1970-01-01 00:00,21
"CHC, JUAN, SONIPAT, HARYANA","CHC, JUAN, SONIPAT, HARYANACHC, JUAN, SONIPAT, HARYANA, 131024",Yes (5),3,2,0,0,3,2,0,0,Yes,No,Yes,Yes,Yes,1970-01-01 00:00,21
"Civil Hospital, Sonipat (9050007668 )","Delhi Road, Near Maharana Pratap Chowk, Sonipat, Haryana 131001",Yes (192),182,0,10,10,190,0,10,10,Yes,Yes,Yes,Yes,Yes,1970-01-01 00:00,21
"CYGNUS HOSPITAL, Sonipat","Old Rohtak Rd, near Hindu College of Engineering, Industrial Area, Sonipat, Haryana 131001",Yes (20),18,0,2,1,18,0,2,1,Yes,No,Yes,Yes,Yes,1970-01-01 00:00,21
Dayanand Hospital-Sonepat,"Kakroi Rd, Prem Nagar, West Ram Nagar, Sonipat, Haryana",Yes (25),20,0,5,1,20,0,5,1,Yes,No,Yes,Yes,Yes,1970-01-01 00:00,21
FIIMS Hospital,"Road, Bahalgarh, Sonipat, Haryana 131304",Yes (99),63,0,36,6,63,0,37,8,Yes,No,Yes,Yes,Yes,1970-01-01 00:00,21
GAJRAJ HOSPITAL,"Bus Stand, Gajraj Hospital Road, Near, Gohana, Haryana 131301",Yes (20),20,0,0,0,20,0,0,0,Yes,To Be Updated,Yes,Yes,Yes,1970-01-01 00:00,21
HARYANA HOSPITAL,"Vivekanand Chowk, Delhi Rd, behind Bullet Showroom, Janta Colony, Sonipat, Haryana 131001",Yes (2),1,0,1,1,1,0,1,1,Yes,No,No,No,Yes,1970-01-01 00:00,21
MEMORIAL HOSPITAL,"SH 11, near Mama Bhanja Chowk, Nandwani Nagar, Anand Nagar,, Sonipat, Haryana 131001",Yes (20),16,0,4,2,16,0,4,2,Yes,No,Yes,Yes,Yes,1970-01-01 00:00,21
NIDAAN HOSPITAL PVT.,"Murthal Rd, Sonipat, Haryana 131001",No (0),0,0,0,0,0,0,0,0,Yes,No,Yes,Yes,Yes,1970-01-01 00:00,21
OSCAR HOSPITAL,"SH 11, Lakshmi Nagar, Sonipat, Haryana 131001",Yes (20),12,0,8,2,12,0,8,2,Yes,No,Yes,Yes,Yes,1970-01-01 00:00,21
PHC PURKHAS,"Purkhas, Haryana 131102",Yes (30),0,30,0,0,0,30,0,0,To Be Updated,To Be Updated,To Be Updated,To Be Updated,To Be Updated,1970-01-01 00:00,21
"SANJIVNI HOSPITAL, SONIPAT","Mehlana Rd, Malviya Nagar, Sonipat, Haryana 131304",Yes (15),14,0,1,1,14,0,1,1,Yes,No,Yes,Yes,Yes,1970-01-01 00:00,21
SAXSENA HOSPITAL,"112/113, T.P. Scheme, Delhi Rd, Sonipat, Haryana 131304",Yes (23),18,0,5,2,18,0,5,2,Yes,No,Yes,Yes,Yes,1970-01-01 00:00,21
SDH GOHANA,"Devi Nagar, Uttam Nagar, Gohana, Haryana 131301",Yes (10),10,0,0,0,10,0,0,0,Yes,Yes,Yes,Yes,Yes,1970-01-01 00:00,21
SITA HOSPITAL SONIPAT,"Railway Rd, Ganaur, Haryana 131101",Yes (20),20,0,0,0,20,0,0,0,Yes,No,Yes,Yes,Yes,1970-01-01 00:00,21
SUNHERI DEVI HOSPITAL,"Mission Rd, Dev Nagar, Sonipat, Haryana 131001",Yes (20),15,0,5,1,15,0,5,1,Yes,No,Yes,Yes,Yes,1970-01-01 00:00,21
TULIP HOSPITAL,"T. P. Scheme, no.15, Delhi Rd, Vivekanand chowk, Sonipat, Haryana 131001",Yes (17),0,0,17,4,0,0,20,5,Yes,No,Yes,Yes,Yes,1970-01-01 00:00,21
Alchemist Hospital panchkula,Sector 21 Panchkula,Yes (13),11,0,2,1,15,0,4,3,Yes,Yes,Yes,Yes,Yes,1970-01-01 00:00,16
Alchemist Ojas Hospital,"H1  SEctor 26, Panchkula Ext, Panchkula",Yes (64),54,0,10,2,54,0,13,4,Yes,Yes,Yes,Yes,Yes,1970-01-01 00:00,16
Civil Hospital Panchkula,sector 6 Panchkula,Yes (30),25,5,0,3,45,8,10,10,Yes,Yes,Yes,Yes,Yes,1970-01-01 00:00,16
JN Shory Hospital,Pinjore,Yes (24),18,6,0,0,18,6,0,0,Yes,No,Yes,Yes,Yes,1970-01-01 00:00,16
Kare Partners Hospital,"Sector 2, Panchkula",Yes (13),13,0,0,0,13,0,0,0,Yes,No,Yes,Yes,Yes,1970-01-01 00:00,16
Paras Hospital Pvt,"Plot no 2, sec 22, panchkula",Yes (18),2,0,16,6,2,0,17,6,Yes,Yes,Yes,Yes,Yes,1970-01-01 00:00,16
Wings Hospital,Sector 25 Panchkula,Yes (31),15,11,5,0,15,11,5,0,Yes,No,Yes,Yes,Yes,1970-01-01 00:00,16
Ch Lekh Raj Multispeciality Hospital,Vill Gadhauli Yamuna Nagar,Yes (149),139,0,10,5,140,0,10,5,Yes,Yes,Yes,Yes,Yes,1970-01-01 00:00,22
CHC Bilaspur,CHC Bilaspur,Yes (20),6,14,0,0,8,17,0,0,Yes,No,Yes,No,Yes,1970-01-01 00:00,22
CHC Chhachharuli,CHC Chhachharuli,Yes (30),10,20,0,0,10,20,0,0,Yes,No,Yes,Yes,Yes,1970-01-01 00:00,22
CHC Naharpur,Naharpur Yamuna Nagar,Yes (10),10,0,0,0,10,0,0,0,Yes,No,No,No,Yes,1970-01-01 00:00,22
CHC Partap Nagar,CHC Partap Nagar,Yes (16),6,10,0,0,6,10,0,0,Yes,No,Yes,No,Yes,1970-01-01 00:00,22
CHC Radaur,Radaur Yamuna Nagar,Yes (20),10,10,0,0,10,10,0,0,Yes,No,Yes,Yes,Yes,1970-01-01 00:00,22
CHC Saraswati Nagar,CHC Saraswati Nagar,Yes (25),14,11,0,0,14,11,0,0,Yes,No,Yes,No,Yes,1970-01-01 00:00,22
DABRA HOSPITAL Yamunanagar,DABRA HOSPITAL,Yes (23),11,8,4,2,11,8,4,2,Yes,No,Yes,Yes,Yes,1970-01-01 00:00,22
ESI Hospital,"ESI Hospital, Jagadhri",Yes (48),28,0,20,0,36,0,22,0,Yes,No,Yes,Yes,Yes,1970-01-01 00:00,22
Gaba Hospital,Gaba Hospital Yamunanagar,Yes (38),20,10,8,4,20,10,15,5,Yes,No,Yes,Yes,Yes,1970-01-01 00:00,22
GULATI HOSPITAL,GULATI HOSPITAL,Yes (31),22,3,6,0,25,3,6,0,Yes,No,Yes,Yes,Yes,1970-01-01 00:00,22
Heart Care Center Hospital,Near Lal Dwara Mandir Yamuna Nagar,Yes (19),2,2,15,7,2,2,15,7,Yes,No,Yes,Yes,Yes,1970-01-01 00:00,22
JP Hospital Pvt,"Jagadhri Rd, near Luxmi Theater, Vishwakarma Mohalla, Yamuna Nagar,HARAYANA Haryana",Yes (39),15,15,9,2,15,15,13,2,Yes,No,Yes,Yes,Yes,1970-01-01 00:00,22
KAPOOR HOSPITAL,"SH 6A Indira Colony Jagadhri, yamunanagart ,Haryana",Yes (12),4,0,8,0,4,0,8,0,Yes,No,Yes,Yes,Yes,1970-01-01 00:00,22
KESHWANI HOSPITAL,"Jagadhri - Yamuna Nagar Rd, Tagore Garden, Yamuna Nagar, Haryana",Yes (8),8,0,0,0,10,0,0,0,Yes,No,Yes,Yes,Yes,1970-01-01 00:00,22
Maxxwell Hospital,Jagadhari Yamuna Nagar,Yes (17),11,0,6,0,11,0,6,0,Yes,No,Yes,Yes,Yes,1970-01-01 00:00,22
Mukand Lal District Civil Hospital Yamunanagar,Mukand Lal District Civil Hospital YNR,Yes (26),18,8,0,3,18,9,0,5,Yes,No,Yes,Yes,Yes,1970-01-01 00:00,22
RK Gupta,opp DAV Sr Sec School Near Madhu Hotel YNR,Yes (15),0,2,13,0,0,2,15,0,Yes,Yes,Yes,Yes,Yes,1970-01-01 00:00,22
SABBARWAL HOSPITAL,"Gulab Nagar, Jagadhri, Haryana",Yes (13),6,1,6,0,6,1,6,0,Yes,No,Yes,Yes,Yes,1970-01-01 00:00,22
Sachdeva Hospital,"2227, Civil Lines Rd, Sri Nagar Colony, Civil Lines, Gomti Mohalla, Jagadhri, Haryana",Yes (28),16,8,4,0,16,8,4,0,Yes,No,Yes,Yes,Yes,1970-01-01 00:00,22
Santosh Hospital,"Santosh Hospital  Kanhaiya Sahib Chowk, near Govt.School, Harbanspura Colony, Gobind Pura, Yamuna Nagar, Haryana",Yes (26),5,9,12,2,5,9,14,2,Yes,No,Yes,Yes,Yes,1970-01-01 00:00,22
SHARMA HOSPITAL,Near Agarsain Chowk Jagadhri,Yes (12),12,0,0,0,12,0,0,0,Yes,No,Yes,Yes,Yes,1970-01-01 00:00,22
Shree Medical Care Hospital,"359/2, Jain nagar, Jagadhri, Haryana",Yes (15),15,0,0,0,15,0,0,0,Yes,Yes,Yes,Yes,Yes,1970-01-01 00:00,22
Shureshtha Hospital,Model Colony YNR,Yes (11),8,1,2,0,9,1,2,0,Yes,No,Yes,Yes,Yes,1970-01-01 00:00,22
SP Hospital Jag,S.P Hospital Jag,Yes (7),4,0,3,1,4,0,3,1,Yes,No,Yes,Yes,Yes,1970-01-01 00:00,22
Swami Vivekanand Hospital Yamunanagar,"Swami Vivekanand Hospital,Yamuna Nagar, Haryana",Yes (48),20,10,18,1,20,10,19,1,Yes,No,Yes,Yes,Yes,1970-01-01 00:00,22
Swastik Hospital,"Basant Nagar, Yamuna Nagar, Haryana",Yes (6),4,2,0,0,4,2,0,0,Yes,No,Yes,Yes,Yes,1970-01-01 00:00,22
tejli stadium,64 A Tejli,Yes (76),20,56,0,0,20,56,0,0,Yes,No,No,No,Yes,1970-01-01 00:00,22
VARDAAN HOSPITAL,OPP KOHLI HOSPITAL NEAR AGARSEN COLLEGE JAGADHRI,Yes (10),8,2,0,0,8,2,0,0,Yes,No,Yes,Yes,Yes,1970-01-01 00:00,22