name,address,Availability_availability_of_beds,Availability_oxygen_beds,Availability_non_oxygen_beds,Availability_i_c_u_beds,Availability_ventilators,Allocated_oxygen_beds,Allocated_non_oxygen_beds,Allocated_i_c_u,Allocated_ventilators,Availability_availability_of_oxygen,Availability_antiviral_remdesivir_etc_,Availability_steroids,Availability_anticoagulant,Availability_antipyretic,updated_on_unparsed,updated_on,city
Adiyogi Arogya Avenue,"232, Subhash Nagar, Near civil hospital back gate, Jhajjar",Yes (15),7,2,6,1,7,2,6,1,To Be Updated,To Be Updated,Yes,Yes,Yes,"1:02 PM 14th Jun,21",2021-06-14 13:02,8
"Advanta Hospital, Jhajjar city","Silani Gate, Jhajjar, Haryana",Yes (50),24,10,16,1,24,10,16,1,Yes,To Be Updated,Yes,To Be Updated,Yes,"4:38 PM 9th Jun,21",2021-06-09 16:38,8
"Brahm Shakti Sanjivani Hospital, B.garh","Opp. BSNL Exchange, Delhi - Rohtak Road, NH9, Bahadurgarh, Haryana",Yes (100),60,20,20,3,60,20,20,3,Yes,No,Yes,Yes,Yes,"11:02 AM 15th Jun,21",2021-06-15 11:02,8
Civil Hospital Jhajjar,"Jhajjar, NH-71, Jhajjar Rohtak Road, Jhajjar, Jhajjar, Haryana",Yes (38),33,0,5,5,33,0,5,5,Yes,To Be Updated,To Be Updated,To Be Updated,To Be Updated,"8:53 AM 7th Sep,21",2021-09-07 08:53,8
"Delhi Hospital, Bahadurgarh","Rohtak Rd, near Shyamji Complex, Ram Nagar, Bahadurgarh, Haryana",Yes (50),20,20,10,2,20,20,10,2,Yes,No,Yes,Yes,Yes,"2:45 PM 1st Jun,21",2021-06-01 14:45,8
Dr. Sanjay Multi Speciality Hospital,INFRONT OF CIVIL HOSPITAL BAHADURGARH,Yes (61),45,10,6,1,45,10,6,1,Yes,No,No,To Be Updated,To Be Updated,"3:29 PM 30th Jun,21",2021-06-30 15:29,8
"Jeewan Jyoti Hospital, Bahadurgarh","Rohtak Rd, MIE Part-B, Bahadurgarh, Haryana",Yes (143),70,68,5,4,70,68,5,4,Yes,To Be Updated,To Be Updated,To Be Updated,To Be Updated,"11:19 AM 15th Jun,21",2021-06-15 11:19,8
"JK Hospital, Bahadurgarh","Bahadurgarh,, Bahamnoli, Bahadurgarh, Haryana",Yes (44),5,31,8,0,5,31,8,0,Yes,To Be Updated,Yes,Yes,Yes,"4:59 PM 9th Jan,22",2022-01-09 16:59,8
"Medicare Super Speciality Hospiatl &amp; Trauma Centre, Jhajjar City","Dadri road Jhajjar, Jhajjar, Haryana",Yes (50),15,23,12,3,15,23,12,3,Yes,To Be Updated,Yes,To Be Updated,Yes,"3:20 PM 15th Jul,21",2021-07-15 15:20,8
"Mission Hospital, Bahadurgarh","Near main Bus Stand & City Metro Station, Rohtak Rd, Bahadurgarh, Jhajjar ,Haryana",Yes (33),25,0,8,4,25,0,8,4,To Be Updated,No,Yes,Yes,No,"10:26 AM 13th Jun,21",2021-06-13 10:26,8
"Oscar Hospital, JJR city","Civil Road,Opp Civil Hospital, Jhajjar, Haryana",Yes (80),8,58,14,1,8,58,14,1,To Be Updated,To Be Updated,To Be Updated,To Be Updated,To Be Updated,"10:08 AM 16th Jun,21",2021-06-16 10:08,8
Oxymus Hospital,"Opposite Civil Hospital, Near Metro Pollar No. 876 Delhi Rohtak Road, Bahadurgarh",Yes (10),4,0,6,0,4,0,6,0,Yes,No,No,No,No,"5:58 PM 6th Jun,21",2021-06-06 17:58,8
"Rana Hospital, Bahadurgarh","OPP. REST HOUSE,OLD BARAHI ROAD, BAHADURGARH",Yes (25),18,0,7,2,18,0,7,2,To Be Updated,To Be Updated,No,No,Yes,"8:47 AM 22nd Jun,21",2021-06-22 08:47,8
"RJ Super Speciality Hospital, B.garh","Delhi - Rohtak Rd, Near Rajesh Joon Office, Dalbir Nagar, Bahadurgarh, Haryana",Yes (17),10,5,2,1,10,5,2,1,Yes,No,Yes,Yes,Yes,"5:05 PM 1st Jul,21",2021-07-01 17:05,8
RS GAUR GLOBAL MULTISPECIALITY HOSPITAL,"Jhajjar Road Netaji Subhash Vihar, Haryana",Yes (33),19,7,7,2,19,7,7,2,Yes,No,Yes,Yes,Yes,"10:19 AM 15th Jun,21",2021-06-15 10:19,8
"SDH, Bahadurgarh","Madhya Marg, Old Industrial Area, Bahadurgarh, Haryana",Yes (35),27,0,8,8,27,0,8,8,Yes,Yes,Yes,No,Yes,"12:46 PM 15th Jun,21",2021-06-15 12:46,8
"Shivam Hospital, B.garh","Line Par, Shastri Nagar, Netaji Nagar, Bahadurgarh, Haryana",Yes (51),30,15,6,1,30,15,6,1,Yes,No,Yes,Yes,Yes,"4:57 PM 13th Jun,21",2021-06-13 16:57,8
"Swastik Hospital, Bahadurgarh","Jhajjar Rd, Shakti Nagar, Sakti Nagar, Bahadurgarh, Haryana",Yes (40),26,4,10,2,26,4,10,2,Yes,No,Yes,Yes,Yes,"9:19 AM 17th Jun,21",2021-06-17 09:19,8
World College Of Medical Sciences And Hospital,"Jhajjar Sampla Road, Gurwar, Jhajjar, Haryana",Yes (250),90,135,25,4,90,135,25,4,Yes,Yes,Yes,Yes,Yes,"9:05 PM 18th Jun,21",2021-06-18 21:05,8
"Ayurvedic Medical College, Patikra",HUDA Sec. 1 Narnaul,Yes (192),35,157,0,0,40,160,0,0,Yes,Yes,Yes,Yes,Yes,"4:32 PM 9th Jun,21",2021-06-09 16:32,13
CHC ATELI,CHC ATELI,Yes (20),15,5,0,0,15,5,0,0,Yes,Yes,Yes,Yes,Yes,"4:33 PM 9th Jun,21",2021-06-09 16:33,13
CHC Kanina,Kanina,Yes (27),15,12,0,0,15,12,0,0,To Be Updated,To Be Updated,To Be Updated,To Be Updated,To Be Updated,"9:48 PM 6th Jun,21",2021-06-06 21:48,13
CHC Nangal Chaudhary,chc nangal choudhary,Yes (10),5,5,0,0,5,5,0,0,No,Yes,Yes,Yes,Yes,"3:54 PM 2nd Jun,21",2021-06-02 15:54,13
CHC Sehlang,CHC SEHLANG,Yes (9),5,4,0,0,5,4,0,0,Yes,Yes,Yes,Yes,Yes,"8:50 AM 28th Jun,21",2021-06-28 08:50,13
Civil Hospital Narnaul,"Housing Board, Narnaul",Yes (77),77,0,0,8,80,0,0,10,Yes,Yes,Yes,Yes,Yes,"4:31 PM 9th Jun,21",2021-06-09 16:31,13
Jaipur Heart &amp; Multi Speciality Hospital,"Opp. Sadar Thana, Narnaul",Yes (13),6,3,4,2,6,3,4,2,Yes,Yes,Yes,Yes,Yes,"9:10 AM 7th Aug,21",2021-08-07 09:10,13
LAXMI NARAYANAN,"Laxmi Narayanan Hospital , Narnaul Road Mahendergarh",Yes (10),6,0,4,1,6,0,4,1,Yes,Yes,Yes,Yes,Yes,"9:33 AM 6th Jun,21",2021-06-06 09:33,13
Nihal Hospital Kanina,Kanina Main Bus Stand,Yes (13),12,0,1,1,13,0,1,1,Yes,Yes,Yes,Yes,Yes,"10:31 AM 21st Jun,21",2021-06-21 10:31,13
Rainbow Multispecialty hospital and trauma Centre,"Singhana road, Narnaul",Yes (13),4,3,6,2,4,3,6,2,Yes,No,Yes,Yes,Yes,"11:59 PM 17th Jun,21",2021-06-17 23:59,13
Sammat Memorial Hospital,"Sastri colony, near bus stand, mahendergarh",Yes (13),10,0,3,2,10,0,3,2,Yes,No,Yes,Yes,Yes,"4:48 PM 24th Jun,21",2021-06-24 16:48,13
Sanwedna Hospital Narnaul,"HUDA Sector 1, Narnaul",Yes (26),17,0,9,1,25,0,9,1,Yes,Yes,Yes,Yes,Yes,"10:40 AM 1st Jun,21",2021-06-01 10:40,13
SDH Mahendergarh,SDH Mahendergarh,Yes (20),20,0,0,5,20,0,0,5,Yes,Yes,Yes,Yes,Yes,"4:33 PM 9th Jun,21",2021-06-09 16:33,13
Shanti Hospital Narnaul,Shanti Hospital Narnaul,Yes (22),9,7,6,2,9,7,7,2,Yes,Yes,Yes,Yes,Yes,"10:22 AM 3rd Jun,21",2021-06-03 10:22,13
Sheela Multi Superspeciality Hospital,Behind Bus Stand Mahindergarh,Yes (9),6,0,3,1,6,0,3,1,Yes,No,Yes,Yes,Yes,"4:33 PM 9th Jun,21",2021-06-09 16:33,13
Shri Arvind Heart and Multispecialty Hospital,"Rao Tula Ram Chowk, Dadri Road Mahendergarh",Yes (17),9,5,3,3,9,5,3,3,Yes,Yes,Yes,Yes,Yes,"5:19 PM 12th Jun,21",2021-06-12 17:19,13
Tanwar Health Care MGarh,,Yes (9),5,0,4,1,5,0,4,1,Yes,No,Yes,Yes,Yes,"11:33 PM 15th Jun,21",2021-06-15 23:33,13
Vijay Hospital Narnaul,"HUDA Sector 1, Narnaul",Yes (22),8,0,14,2,8,0,15,2,Yes,Yes,Yes,Yes,Yes,"9:22 AM 8th Jun,21",2021-06-08 09:22,13
Balaji Gautam Hospital,"Model Colony, East Bhatia Nagar, Yamuna Nagar, Haryana",Yes (12),7,2,3,0,7,2,3,0,Yes,No,Yes,Yes,Yes,"11:29 PM 4th Dec,21",2021-12-04 23:29,22
Ch Lekh Raj Multispeciality Hospital,Vill Gadhauli Yamuna Nagar,Yes (150),140,0,10,5,140,0,10,5,Yes,Yes,Yes,Yes,Yes,"9:53 AM 27th Aug,21",2021-08-27 09:53,22
CHC Bilaspur,CHC Bilaspur,Yes (23),8,15,0,0,8,17,0,0,Yes,No,Yes,No,Yes,"8:55 AM 27th Sep,21",2021-09-27 08:55,22
CHC Chhachharuli,CHC Chhachharuli,Yes (30),10,20,0,0,10,20,0,0,Yes,No,Yes,Yes,Yes,"9:41 AM 27th Aug,21",2021-08-27 09:41,22
CHC Naharpur,Naharpur Yamuna Nagar,Yes (10),10,0,0,0,10,0,0,0,Yes,No,No,No,Yes,"9:54 AM 27th Aug,21",2021-08-27 09:54,22
CHC Partap Nagar,CHC Partap Nagar,Yes (16),6,10,0,0,6,10,0,0,Yes,No,Yes,No,Yes,"9:41 AM 27th Aug,21",2021-08-27 09:41,22
CHC Radaur,Radaur Yamuna Nagar,Yes (20),10,10,0,0,10,10,0,0,Yes,No,Yes,Yes,Yes,"9:53 AM 27th Aug,21",2021-08-27 09:53,22
CHC Saraswati Nagar,CHC Saraswati Nagar,Yes (25),14,11,0,0,14,11,0,0,Yes,No,Yes,No,Yes,"9:41 AM 27th Aug,21",2021-08-27 09:41,22
DABRA HOSPITAL Yamunanagar,DABRA HOSPITAL,Yes (23),11,8,4,2,11,8,4,2,No,No,No,No,No,"9:42 AM 27th Aug,21",2021-08-27 09:42,22
ESI Hospital,"ESI Hospital, Jagadhri",Yes (58),36,0,22,0,36,0,22,0,Yes,No,Yes,Yes,Yes,"9:40 AM 27th Aug,21",2021-08-27 09:40,22
Gaba Hospital,Gaba Hospital Yamunanagar,Yes (45),20,10,15,5,20,10,15,5,Yes,No,Yes,Yes,Yes,"9:12 AM 17th Sep,21",2021-09-17 09:12,22
GULATI HOSPITAL,GULATI HOSPITAL,Yes (32),23,3,6,0,25,3,6,0,Yes,No,Yes,Yes,Yes,"9:49 AM 27th Aug,21",2021-08-27 09:49,22
Heart Care Center Hospital,Near Lal Dwara Mandir Yamuna Nagar,Yes (19),2,2,15,7,2,2,15,7,Yes,No,Yes,Yes,Yes,"9:40 AM 27th Aug,21",2021-08-27 09:40,22
JP Hospital Pvt,"Jagadhri Rd, near Luxmi Theater, Vishwakarma Mohalla, Yamuna Nagar,HARAYANA Haryana",Yes (43),15,15,13,2,15,15,13,2,Yes,No,Yes,Yes,Yes,"9:40 AM 27th Aug,21",2021-08-27 09:40,22
KAPOOR HOSPITAL,"SH 6A Indira Colony Jagadhri, yamunanagart ,Haryana",Yes (12),4,0,8,0,4,0,8,0,Yes,No,Yes,Yes,Yes,"9:51 AM 27th Aug,21",2021-08-27 09:51,22
KESHWANI HOSPITAL,"Jagadhri - Yamuna Nagar Rd, Tagore Garden, Yamuna Nagar, Haryana",Yes (10),10,0,0,0,10,0,0,0,Yes,No,Yes,Yes,Yes,"9:54 AM 27th Aug,21",2021-08-27 09:54,22
Maxxwell Hospital,Jagadhari Yamuna Nagar,Yes (17),11,0,6,0,11,0,6,0,Yes,No,Yes,Yes,Yes,"9:49 AM 27th Aug,21",2021-08-27 09:49,22
Mukand Lal District Civil Hospital Yamunanagar,Mukand Lal District Civil Hospital YNR,Yes (24),15,9,0,5,18,9,0,5,Yes,No,Yes,Yes,Yes,"10:16 AM 9th Oct,21",2021-10-09 10:16,22
NIRMAL HOSPITAL,"199, Radaur Rd, near nirmal hospital, camp, Garhi Gujran, Haryana",Yes (20),13,1,6,0,13,1,6,0,Yes,No,Yes,Yes,Yes,"9:40 AM 27th Aug,21",2021-08-27 09:40,22
RK Gupta,opp DAV Sr Sec School Near Madhu Hotel YNR,Yes (17),0,2,15,0,0,2,15,0,Yes,Yes,Yes,Yes,Yes,"9:54 AM 27th Aug,21",2021-08-27 09:54,22
SABBARWAL HOSPITAL,"Gulab Nagar, Jagadhri, Haryana",Yes (12),6,0,6,0,6,0,6,0,Yes,No,Yes,Yes,Yes,"9:53 AM 27th Aug,21",2021-08-27 09:53,22
Sachdeva Hospital,"2227, Civil Lines Rd, Sri Nagar Colony, Civil Lines, Gomti Mohalla, Jagadhri, Haryana",Yes (28),16,8,4,0,16,8,4,0,Yes,No,Yes,Yes,Yes,"9:54 AM 27th Aug,21",2021-08-27 09:54,22
Santosh Hospital,"Santosh Hospital  Kanhaiya Sahib Chowk, near Govt.School, Harbanspura Colony, Gobind Pura, Yamuna Nagar, Haryana",Yes (28),5,9,14,2,5,9,14,2,Yes,No,Yes,Yes,Yes,"9:40 AM 27th Aug,21",2021-08-27 09:40,22
SHARMA HOSPITAL,Near Agarsain Chowk Jagadhri,Yes (12),12,0,0,0,12,0,0,0,Yes,No,Yes,Yes,Yes,"9:53 AM 27th Aug,21",2021-08-27 09:53,22
Shree Medical Care Hospital,"359/2, Jain nagar, Jagadhri, Haryana",Yes (15),15,0,0,0,15,0,0,0,Yes,Yes,Yes,Yes,Yes,"9:56 AM 27th Aug,21",2021-08-27 09:56,22
Shureshtha Hospital,Model Colony YNR,Yes (11),9,0,2,0,9,0,2,0,Yes,No,Yes,Yes,Yes,"9:53 AM 27th Aug,21",2021-08-27 09:53,22
SP Hospital Jag,S.P Hospital Jag,Yes (7),4,0,3,1,4,0,3,1,Yes,No,Yes,Yes,Yes,"9:49 AM 27th Aug,21",2021-08-27 09:49,22
Swami Vivekanand Hospital Yamunanagar,"Swami Vivekanand Hospital,Yamuna Nagar, Haryana",Yes (49),20,10,19,1,20,10,19,1,Yes,No,Yes,Yes,Yes,"9:50 AM 27th Aug,21",2021-08-27 09:50,22
Swastik Hospital,"Basant Nagar, Yamuna Nagar, Haryana",Yes (6),4,2,0,0,4,2,0,0,Yes,No,Yes,Yes,Yes,"9:55 AM 27th Aug,21",2021-08-27 09:55,22
tejli stadium,64 A Tejli,Yes (76),20,56,0,0,20,56,0,0,Yes,No,No,No,Yes,"9:52 AM 27th Aug,21",2021-08-27 09:52,22
VARDAAN HOSPITAL,OPP KOHLI HOSPITAL NEAR AGARSEN COLLEGE JAGADHRI,Yes (10),8,2,0,0,8,2,0,0,Yes,No,Yes,Yes,Yes,"9:54 AM 27th Aug,21",2021-08-27 09:54,22