name,address,Availability_availability_of_beds,Availability_oxygen_beds,Availability_non_oxygen_beds,Availability_i_c_u_beds,Availability_ventilators,Allocated_oxygen_beds,Allocated_non_oxygen_beds,Allocated_i_c_u,Allocated_ventilators,Availability_availability_of_oxygen,Availability_antiviral_remdesivir_etc_,Availability_steroids,Availability_anticoagulant,Availability_antipyretic,updated_on_unparsed,updated_on,city
Anchal Multispeciality Hospital,"Anchal Multi speciality Hospital, Krishna Colony, Bhiwani, Haryana 127027",Yes (35),25,0,10,2,25,0,10,2,Yes,Yes,Yes,Yes,Yes,"11:34 AM 5th Jul,21",2021-07-05 11:34,2
Ch. Bansilal Govt Hospital,"Bansi Lal General Hospital, Ghanta Ghar Chowk, SH 17, Krishna Colony, Bhiwani, Haryana 127021",Yes (171),139,5,27,16,139,5,28,16,Yes,Yes,Yes,Yes,Yes,"11:20 AM 5th Jul,21",2021-07-05 11:20,2
Chugh Hospital,"Meham Gate, Circular Road, Bhiwani",Yes (20),20,0,0,0,20,0,0,0,Yes,Yes,Yes,Yes,Yes,"12:08 PM 5th Jul,21",2021-07-05 12:08,2
ESI Hospital Bhiwani,"Stadium Rd, Housing Board Colony, Bhiwani, Haryana 127021",Yes (40),0,40,0,0,0,40,0,0,No,No,Yes,Yes,Yes,"11:34 AM 5th Jul,21",2021-07-05 11:34,2
Ganpatrai Hospital,"SH 17, Bank Colony, Bound Kalan, Krishna Colony, Bhiwani, Haryana 127021",Yes (10),4,4,2,1,4,4,2,1,Yes,No,Yes,Yes,Yes,"11:34 AM 5th Jul,21",2021-07-05 11:34,2
Jangra Multispecilaity Hospital,"Bank Colony, Old Bharat Nagar, Bhiwani, Haryana 127021",Yes (10),7,3,0,0,7,3,0,0,Yes,No,Yes,Yes,Yes,"12:06 PM 5th Jul,21",2021-07-05 12:06,2
Jeevan Nursing Home-Bhiwani,Rohtak gate Bhiwani,Yes (10),3,4,3,0,3,4,3,0,Yes,Yes,Yes,Yes,Yes,"12:09 PM 5th Jul,21",2021-07-05 12:09,2
Jeevanrekha Hospital,Near Railway Road Bhiwani,Yes (30),25,0,5,1,25,0,5,1,To Be Updated,To Be Updated,To Be Updated,To Be Updated,To Be Updated,"12:09 PM 5th Jul,21",2021-07-05 12:09,2
Kadam Hospital,"Bank Colony Near New Bus Stand, Bhiwani",Yes (45),11,0,34,1,11,0,34,1,Yes,Yes,Yes,Yes,Yes,"11:34 AM 5th Jul,21",2021-07-05 11:34,2
Krishan Lal Jalan Hospital,"Jalan Nagar, M.C.Colony, Bhiwani, Haryana 127021",Yes (40),20,20,0,0,20,20,0,0,Yes,Yes,Yes,Yes,Yes,"12:06 PM 5th Jul,21",2021-07-05 12:06,2
Life Line Hospital,"Circular Rd, M.C.Colony, Bhiwani, Haryana 127021",Yes (27),21,0,6,0,21,0,6,0,Yes,Yes,Yes,Yes,Yes,"12:06 PM 5th Jul,21",2021-07-05 12:06,2
RPS HOSPITAL,,Yes (24),4,16,4,0,4,16,4,0,Yes,No,Yes,Yes,Yes,"12:06 PM 5th Jul,21",2021-07-05 12:06,2
Sharma Nursing and Maternity Home Tosham,Siwani Road Tosham,Yes (10),7,0,3,2,7,0,3,2,Yes,Yes,To Be Updated,Yes,Yes,"12:09 PM 5th Jul,21",2021-07-05 12:09,2
Shree Ganesha Hospital,"Dadri Gate, Bhiwani",Yes (13),6,3,4,0,6,3,4,0,Yes,Yes,Yes,Yes,Yes,"12:08 PM 5th Jul,21",2021-07-05 12:08,2
"SHRI BABA YOGI NETANATH HOSPITAL , LOHANI ,BHIWANI",VPO Lohani,Yes (50),35,5,10,2,35,5,10,2,Yes,Yes,Yes,Yes,Yes,"12:09 PM 5th Jul,21",2021-07-05 12:09,2
Shri Ram Hospital,Siwani,Yes (11),0,0,11,4,0,0,11,4,To Be Updated,To Be Updated,To Be Updated,To Be Updated,To Be Updated,"12:09 PM 5th Jul,21",2021-07-05 12:09,2
SMSG Multispeciality Hospital,"Rohtak Gate, Bhiwani",Yes (30),2,17,11,2,2,17,11,2,Yes,Yes,Yes,Yes,Yes,"12:08 PM 5th Jul,21",2021-07-05 12:08,2
Spes Hospital,"Circular Rd, Bound Kalan, M.C.Colony, Bhiwani, Haryana 127021",Yes (22),4,6,12,1,4,6,12,1,Yes,Yes,Yes,Yes,Yes,"12:07 PM 5th Jul,21",2021-07-05 12:07,2
Cygnus Multispecialty Hospital Kaithal,"Huda Bypass Road, Sector 20, Kaithal, Haryana",Yes (40),28,0,12,2,28,0,12,2,Yes,No,Yes,Yes,Yes,"1:02 PM 18th Jul,21",2021-07-18 13:02,10
District Civil Hospital Kaithal,"Huda Sec 18, Kaithal",Yes (115),80,15,20,18,80,15,20,18,Yes,Yes,Yes,Yes,Yes,"11:59 AM 9th Aug,21",2021-08-09 11:59,10
SDH Guhla,SDH Guhla,Yes (70),35,35,0,5,35,35,0,5,Yes,No,Yes,No,Yes,"9:45 AM 16th Aug,21",2021-08-16 09:45,10
Shah Multispecialty Hospital Kaithal,"opp.old, bus stand, Jind - Kaithal Rd, Amar Garh Colony, Kaithal, Haryana",Yes (76),50,11,15,10,51,11,15,10,Yes,No,Yes,Yes,Yes,"2:00 PM 30th Sep,21",2021-09-30 14:00,10
ABLE HOSPITAL,,Yes (37),10,25,2,2,10,25,2,5,Yes,No,Yes,Yes,Yes,"3:08 PM 26th May,21",2021-05-26 15:08,15
Apex Hospital,"Prakash Vihar, Delhi Mathura Road, Palwal, Haryana",Yes (19),13,0,6,2,13,0,6,2,Yes,No,Yes,Yes,Yes,"10:07 AM 31st May,21",2021-05-31 10:07,15
ATLAS HOSPITAL,"Palwal, Haryana",Yes (14),1,11,2,2,2,11,2,2,To Be Updated,To Be Updated,To Be Updated,To Be Updated,To Be Updated,"11:02 AM 29th May,21",2021-05-29 11:02,15
BIKAL HOSPITAL,"PALWAL, HARYANA",Yes (21),13,5,3,0,13,5,3,0,Yes,No,Yes,Yes,Yes,"2:57 PM 23rd Jun,21",2021-06-23 14:57,15
CHC Alawalpur,CHC Alawalpur,Yes (17),1,16,0,0,4,16,0,0,To Be Updated,To Be Updated,To Be Updated,To Be Updated,To Be Updated,"6:55 PM 18th May,21",2021-05-18 18:55,15
Civil Hospital Palwal,"Civil Hospital, palwal",Yes (110),103,0,7,7,103,0,7,7,Yes,To Be Updated,To Be Updated,To Be Updated,To Be Updated,"2:02 PM 4th Dec,21",2021-12-04 14:02,15
COSMOS HOSPITAL,PALWAL,Yes (10),5,5,0,0,5,5,0,0,To Be Updated,To Be Updated,To Be Updated,To Be Updated,To Be Updated,"12:02 PM 16th May,21",2021-05-16 12:02,15
GALAXY HOSPITAL,HUDA SECTOR 2,Yes (21),5,0,16,11,5,0,16,11,Yes,No,Yes,Yes,Yes,"5:22 PM 16th Jun,21",2021-06-16 17:22,15
"Gurunanak Hospital, Palwal","NH2, Near Bus Stand, Shiv Colony, Palwal Haryana",Yes (37),18,4,15,3,18,4,15,3,Yes,Yes,Yes,Yes,Yes,"5:07 PM 7th Jun,21",2021-06-07 17:07,15
JINDAL HOSPITAL,"Palwal, Haryana",Yes (15),10,2,3,0,10,2,3,0,To Be Updated,No,Yes,Yes,Yes,"12:53 PM 19th May,21",2021-05-19 12:53,15
NIDHI HOSPITAL,"Palwal, Haryana",Yes (12),2,7,3,0,2,7,3,0,Yes,No,Yes,Yes,Yes,"12:42 PM 19th May,21",2021-05-19 12:42,15
Palwal Hospital,"Moti Colony, Palwal, Haryana",Yes (22),0,6,16,1,0,6,16,1,Yes,No,Yes,Yes,Yes,"2:19 PM 28th May,21",2021-05-28 14:19,15
RAHUL HOSPITAL,PALWAL,Yes (15),7,5,3,0,7,5,3,0,Yes,No,Yes,Yes,Yes,"4:20 PM 13th May,21",2021-05-13 16:20,15
Sachin Hospital,"New Sohna Road, Near Panchwati Chowk, Palwal Haryana",Yes (28),10,5,13,2,10,5,13,2,Yes,Yes,Yes,Yes,Yes,"9:29 AM 14th Jun,21",2021-06-14 09:29,15
SDH Hodal,SDH Hodal,Yes (20),10,10,0,0,10,10,0,0,Yes,No,Yes,Yes,Yes,"11:45 AM 1st Jun,21",2021-06-01 11:45,15
Shri. Satya Sai Sanjivani Hospital Palwal,"Palwal, Haryana",Yes (23),4,16,3,2,4,17,4,2,Yes,No,Yes,Yes,Yes,"5:13 PM 2nd Jun,21",2021-06-02 17:13,15
SRI SAI HOSPITAL,"Palwal, Haryana",Yes (6),0,6,0,0,0,6,0,0,Yes,No,Yes,Yes,Yes,"10:08 AM 2nd Jun,21",2021-06-02 10:08,15
VASHU HOSPITAL,,Yes (10),10,0,0,0,10,0,0,0,Yes,No,Yes,Yes,Yes,"12:53 PM 19th May,21",2021-05-19 12:53,15
"Apex Hospital, Sirsa","Circular Road, Sirsa",Yes (18),12,2,4,1,12,2,4,1,To Be Updated,To Be Updated,To Be Updated,To Be Updated,To Be Updated,"10:43 AM 10th Jun,21",2021-06-10 10:43,20
"Astha Hospital, Sirsa",Dabwali Road Sirsa,Yes (20),15,0,5,0,15,0,5,0,Yes,No,Yes,Yes,Yes,"11:48 AM 25th Jun,21",2021-06-25 11:48,20
CIVIL HOSPITAL SIRSA,"Civil Hospital Road, Sirsa",Yes (103),83,14,6,6,85,14,6,6,Yes,Yes,Yes,Yes,Yes,"11:41 AM 28th Aug,21",2021-08-28 11:41,20
"Dayal Nursing Home, Sirsa","Dabwali Road, Sirsa",Yes (12),9,3,0,0,9,3,0,0,Yes,To Be Updated,Yes,Yes,Yes,"8:38 AM 20th Aug,21",2021-08-20 08:38,20
"Gupta Hospital, Sirsa","Dabwali Road, Sirsa Near Easy Day",Yes (12),4,3,5,0,4,3,5,0,Yes,To Be Updated,Yes,Yes,Yes,"5:31 PM 15th Jul,21",2021-07-15 17:31,20
"Jagdish Nursing Home, Sirsa","Gandhi Market, Parshuram Chowk, Sirsa",Yes (11),0,4,7,1,0,4,7,1,Yes,No,Yes,Yes,Yes,"6:17 PM 15th Jul,21",2021-07-15 18:17,20
"Jeevan Jyoti Hospital, Sirsa",Dabwali Road Sirsa,Yes (14),7,1,6,3,7,1,6,3,Yes,No,Yes,Yes,Yes,"5:59 PM 15th Jul,21",2021-07-15 17:59,20
"Khurana Hospital, Sirsa",Dabwali Road Sirsa,Yes (10),6,0,4,0,6,0,4,0,Yes,No,Yes,Yes,Yes,"5:34 PM 15th Jul,21",2021-07-15 17:34,20
"Lalgarhia Hospital, Sirsa",Dabwali Road Sirsa,Yes (18),13,2,3,1,13,2,3,1,Yes,Yes,Yes,No,Yes,"12:15 PM 29th Sep,21",2021-09-29 12:15,20
"Medicare Hospital, Sirsa","Dabwali Road, Sirsa",Yes (13),1,6,6,2,1,6,6,2,Yes,Yes,Yes,Yes,Yes,"9:23 AM 16th Jul,21",2021-07-16 09:23,20
"Metro Health Care Hospital, Sirsa","Near Dena Bank, lal Batti Chowk, Sirsa",Yes (10),5,0,5,1,5,0,5,1,Yes,Yes,Yes,Yes,Yes,"12:24 PM 3rd Aug,21",2021-08-03 12:24,20
"Mittal Hospital, Sirsa","Near Jhunthra Petrol Pump, Dabwali Road Sirsa",Yes (19),14,1,4,0,14,1,4,0,Yes,No,Yes,Yes,Yes,"2:19 PM 21st Aug,21",2021-08-21 14:19,20
"New Life Care Hospital, Sirsa","Dabwali Road, Sirsa",Yes (12),7,2,3,0,7,2,3,0,Yes,No,Yes,Yes,Yes,"5:18 PM 15th Jul,21",2021-07-15 17:18,20
"Poonia COVID Care Center, Sirsa","Near Ambedkar chowk, opposite Seth tula ram dharamshala, Hisar Road, Sirsa, Haryana 125055",Yes (24),14,7,3,1,14,7,3,1,Yes,Yes,Yes,Yes,Yes,"9:33 AM 18th Aug,21",2021-08-18 09:33,20
"Sanjeevni Hospital, Sirsa (Wing -2, 1 &amp; 2nd Floor)","Under over bridge, hisar road, sirsa",Yes (91),45,30,16,6,45,30,16,6,Yes,Yes,Yes,Yes,Yes,"9:27 AM 8th Jul,21",2021-07-08 09:27,20
SDCH Dabwali,"Dabwali, District Sirsa",Yes (25),12,13,0,0,12,13,0,0,Yes,No,Yes,Yes,Yes,"6:09 PM 15th Jul,21",2021-07-15 18:09,20
"Shah Satnam Dera Hospital (Wing -2, 2nd floor), Sirsa","Begu Road, Sirsa",Yes (65),21,30,14,7,21,30,14,7,Yes,Yes,Yes,Yes,Yes,"3:59 PM 12th Jul,21",2021-07-12 15:59,20
"Shivam Hospital, Sirsa",Surkhab Chowk Sirsa,Yes (16),6,6,4,1,6,6,4,1,Yes,No,Yes,Yes,Yes,"12:43 PM 27th Sep,21",2021-09-27 12:43,20
"Shri Baba Tara Hospital &amp; Research Center, Sirsa","Hisar Road, Sirsa",Yes (25),15,5,5,3,15,5,5,3,Yes,No,Yes,Yes,Yes,"6:17 PM 15th Jul,21",2021-07-15 18:17,20
"SPS Hospital, Sirsa","Near Sangwan Chowk, Dabwali Road, Sirsa",Yes (15),12,0,3,2,12,0,3,2,Yes,No,Yes,Yes,Yes,"6:20 PM 15th Jul,21",2021-07-15 18:20,20
"Suraksha Hospital, Sirsa","Dabwali Rd, opposite Hotel Aroma, Sirsa, Haryana 125055",Yes (24),10,3,11,7,10,3,11,7,Yes,Yes,Yes,Yes,Yes,"9:37 PM 1st Oct,21",2021-10-01 21:37,20
"Swastik Hospital, Sirsa","Ambedkar Chowk, Nandan Vatika, Sirsa,",Yes (15),5,5,5,1,5,5,5,1,Yes,No,Yes,Yes,Yes,"6:21 PM 31st Aug,21",2021-08-31 18:21,20
"Talwar Nursing Home, Sirsa","Under Over Bridge, Hisar Road, Sirsa",Yes (16),12,2,2,1,12,2,2,1,Yes,Yes,Yes,Yes,Yes,"6:26 PM 15th Jul,21",2021-07-15 18:26,20
"Tomar Nursing Home, Sirsa","Nandan Vatika, near surkhab Chock, Hathi park, Agrasain Colony, Sirsa, Haryana 125055",Yes (18),12,2,4,1,12,2,4,1,Yes,Yes,Yes,Yes,Yes,"6:17 PM 15th Jul,21",2021-07-15 18:17,20
"Vardan Hospital, Sirsa","Near Lal Batti Chowk, Sirsa",Yes (18),9,3,6,0,9,3,6,0,Yes,No,Yes,Yes,Yes,"6:00 PM 15th Jul,21",2021-07-15 18:00,20
Adiyogi Arogya Avenue,"232, Subhash Nagar, Near civil hospital back gate, Jhajjar",Yes (15),7,2,6,1,7,2,6,1,To Be Updated,To Be Updated,Yes,Yes,Yes,"1:02 PM 14th Jun,21",2021-06-14 13:02,8
"Advanta Hospital, Jhajjar city","Silani Gate, Jhajjar, Haryana",Yes (50),24,10,16,1,24,10,16,1,Yes,To Be Updated,Yes,To Be Updated,Yes,"4:38 PM 9th Jun,21",2021-06-09 16:38,8
"Brahm Shakti Sanjivani Hospital, B.garh","Opp. BSNL Exchange, Delhi - Rohtak Road, NH9, Bahadurgarh, Haryana",Yes (100),60,20,20,3,60,20,20,3,Yes,No,Yes,Yes,Yes,"11:02 AM 15th Jun,21",2021-06-15 11:02,8
Civil Hospital Jhajjar,"Jhajjar, NH-71, Jhajjar Rohtak Road, Jhajjar, Jhajjar, Haryana",Yes (38),33,0,5,5,33,0,5,5,Yes,To Be Updated,To Be Updated,To Be Updated,To Be Updated,"8:53 AM 7th Sep,21",2021-09-07 08:53,8
"Delhi Hospital, Bahadurgarh","Rohtak Rd, near Shyamji Complex, Ram Nagar, Bahadurgarh, Haryana",Yes (50),20,20,10,2,20,20,10,2,Yes,No,Yes,Yes,Yes,"2:45 PM 1st Jun,21",2021-06-01 14:45,8
Dr. Sanjay Multi Speciality Hospital,INFRONT OF CIVIL HOSPITAL BAHADURGARH,Yes (61),45,10,6,1,45,10,6,1,Yes,No,No,To Be Updated,To Be Updated,"3:29 PM 30th Jun,21",2021-06-30 15:29,8
"Jeewan Jyoti Hospital, Bahadurgarh","Rohtak Rd, MIE Part-B, Bahadurgarh, Haryana",Yes (143),70,68,5,4,70,68,5,4,Yes,To Be Updated,To Be Updated,To Be Updated,To Be Updated,"11:19 AM 15th Jun,21",2021-06-15 11:19,8
"JK Hospital, Bahadurgarh","Bahadurgarh,, Bahamnoli, Bahadurgarh, Haryana",Yes (44),5,31,8,0,5,31,8,0,Yes,To Be Updated,Yes,Yes,Yes,"10:46 AM 17th Jun,21",2021-06-17 10:46,8
"Medicare Super Speciality Hospiatl &amp; Trauma Centre, Jhajjar City","Dadri road Jhajjar, Jhajjar, Haryana",Yes (50),15,23,12,3,15,23,12,3,Yes,To Be Updated,Yes,To Be Updated,Yes,"3:20 PM 15th Jul,21",2021-07-15 15:20,8
"Mission Hospital, Bahadurgarh","Near main Bus Stand & City Metro Station, Rohtak Rd, Bahadurgarh, Jhajjar ,Haryana",Yes (33),25,0,8,4,25,0,8,4,To Be Updated,No,Yes,Yes,No,"10:26 AM 13th Jun,21",2021-06-13 10:26,8
"Oscar Hospital, JJR city","Civil Road,Opp Civil Hospital, Jhajjar, Haryana",Yes (80),8,58,14,1,8,58,14,1,To Be Updated,To Be Updated,To Be Updated,To Be Updated,To Be Updated,"10:08 AM 16th Jun,21",2021-06-16 10:08,8
Oxymus Hospital,"Opposite Civil Hospital, Near Metro Pollar No. 876 Delhi Rohtak Road, Bahadurgarh",Yes (10),4,0,6,0,4,0,6,0,Yes,No,No,No,No,"5:58 PM 6th Jun,21",2021-06-06 17:58,8
"Rana Hospital, Bahadurgarh","OPP. REST HOUSE,OLD BARAHI ROAD, BAHADURGARH",Yes (25),18,0,7,2,18,0,7,2,To Be Updated,To Be Updated,No,No,Yes,"8:47 AM 22nd Jun,21",2021-06-22 08:47,8
"RJ Super Speciality Hospital, B.garh","Delhi - Rohtak Rd, Near Rajesh Joon Office, Dalbir Nagar, Bahadurgarh, Haryana",Yes (17),10,5,2,1,10,5,2,1,Yes,No,Yes,Yes,Yes,"5:05 PM 1st Jul,21",2021-07-01 17:05,8
RS GAUR GLOBAL MULTISPECIALITY HOSPITAL,"Jhajjar Road Netaji Subhash Vihar, Haryana",Yes (33),19,7,7,2,19,7,7,2,Yes,No,Yes,Yes,Yes,"10:19 AM 15th Jun,21",2021-06-15 10:19,8
"SDH, Bahadurgarh","Madhya Marg, Old Industrial Area, Bahadurgarh, Haryana",Yes (35),27,0,8,8,27,0,8,8,Yes,Yes,Yes,No,Yes,"12:46 PM 15th Jun,21",2021-06-15 12:46,8
"Shivam Hospital, B.garh","Line Par, Shastri Nagar, Netaji Nagar, Bahadurgarh, Haryana",Yes (51),30,15,6,1,30,15,6,1,Yes,No,Yes,Yes,Yes,"4:57 PM 13th Jun,21",2021-06-13 16:57,8
"Swastik Hospital, Bahadurgarh","Jhajjar Rd, Shakti Nagar, Sakti Nagar, Bahadurgarh, Haryana",Yes (40),26,4,10,2,26,4,10,2,Yes,No,Yes,Yes,Yes,"9:19 AM 17th Jun,21",2021-06-17 09:19,8
World College Of Medical Sciences And Hospital,"Jhajjar Sampla Road, Gurwar, Jhajjar, Haryana",Yes (250),90,135,25,4,90,135,25,4,Yes,Yes,Yes,Yes,Yes,"9:05 PM 18th Jun,21",2021-06-18 21:05,8
Amar Hospotal,Assandh,No (0),0,0,0,0,0,0,0,0,Yes,Yes,Yes,Yes,Yes,"3:37 PM 5th Jul,21",2021-07-05 15:37,11
"AMRITDHARA, Chaura Bazar","Near ITI Chowk, Gahoon Vihar, Karnal, Haryana",Yes (4),4,0,0,0,38,0,26,2,Yes,No,Yes,Yes,Yes,"3:33 PM 5th Jul,21",2021-07-05 15:33,11
Arpana Hospital,"G.T. Road, Madhuban, Karnal, Karnal, Haryana",Yes (18),16,0,2,1,16,0,2,1,Yes,No,Yes,Yes,Yes,"11:52 AM 26th Jul,21",2021-07-26 11:52,11
Arsh Hospital,Opp. Kalpana Chawla Medical College,Yes (15),9,0,6,0,9,0,6,0,Yes,Yes,Yes,Yes,Yes,"3:36 PM 5th Jul,21",2021-07-05 15:36,11
CHC Assandh,"Assandh, Assandh Ruralpart, Haryana",Yes (10),10,0,0,0,10,0,0,0,Yes,No,Yes,No,Yes,"3:32 PM 5th Jul,21",2021-07-05 15:32,11
CHC Gharaunda,"Balinagar, Gharaunda, Haryana",Yes (10),10,0,0,0,10,0,0,0,Yes,No,Yes,No,Yes,"3:32 PM 5th Jul,21",2021-07-05 15:32,11
CHC Kunjpura,Village Kunjpura,Yes (11),11,0,0,0,11,0,0,0,To Be Updated,Yes,Yes,Yes,Yes,"3:36 PM 5th Jul,21",2021-07-05 15:36,11
CHC Nissing,"SH 8, Gondar, Nissing, Haryana",Yes (10),10,0,0,0,10,0,0,0,Yes,No,Yes,No,Yes,"3:32 PM 5th Jul,21",2021-07-05 15:32,11
CHC Taraori,CHC Taraori,Yes (6),6,0,0,0,6,0,0,0,Yes,No,Yes,No,Yes,"3:39 PM 5th Jul,21",2021-07-05 15:39,11
Dr. Gian Bhushan Hospital,"Kunjpura Rd Old Char Chaman Dyal Singh Colony Karnal  132001 Republic of,",Yes (8),3,0,5,0,6,0,5,0,Yes,No,No,No,No,"3:34 PM 5th Jul,21",2021-07-05 15:34,11
Ishwar Kirpa Hospital,"Ishwar Kirpa Hospital, Sector -14",Yes (20),14,0,6,0,14,0,7,0,Yes,No,Yes,Yes,Yes,"5:43 PM 11th Jul,21",2021-07-11 17:43,11
"Kalpana Chawla Government Medical College, Karnal","Model Town, Karnal, Haryana",Yes (2),1,0,1,0,200,0,80,80,Yes,Yes,Yes,Yes,Yes,"3:33 PM 5th Jul,21",2021-07-05 15:33,11
Karnal Nursing Home,"26 Duggal Colony, Karnal",Yes (16),8,0,8,0,8,0,10,0,Yes,To Be Updated,Yes,Yes,Yes,"3:38 PM 5th Jul,21",2021-07-05 15:38,11
Maxxwell Hospital Indri,Near Budhnath Dera Ward No 1,Yes (15),10,0,5,3,10,0,5,3,Yes,Yes,Yes,Yes,Yes,"3:35 PM 5th Jul,21",2021-07-05 15:35,11
Park Hospital karnal,"CHD City, NH-1, Sector 45, Karnal, Haryana",Yes (30),10,0,20,2,10,0,20,2,To Be Updated,To Be Updated,To Be Updated,To Be Updated,To Be Updated,"1:42 PM 5th Aug,21",2021-08-05 13:42,11
Rama Superspeciality Hospital,Civil Hosp Chowk Karnal,No (0),0,0,0,0,8,0,6,0,Yes,No,Yes,Yes,Yes,"3:37 PM 5th Jul,21",2021-07-05 15:37,11
RP Welltar Hospital,"Vill. Bastara, District Karnal",Yes (17),9,4,4,1,10,4,4,1,Yes,No,Yes,No,Yes,"3:34 PM 5th Jul,21",2021-07-05 15:34,11
Sanidhya Nursing Home,"indri, Karnal",Yes (15),10,0,5,0,10,0,5,0,To Be Updated,Yes,Yes,Yes,Yes,"3:35 PM 5th Jul,21",2021-07-05 15:35,11
"Sanjiv Bansal Cygnus Hospital , Karnal","Railway Rd, Ibrahim Mandi, Karnal, Haryana",Yes (19),17,0,2,2,20,0,5,2,Yes,Yes,Yes,Yes,Yes,"9:52 AM 17th Jul,21",2021-07-17 09:52,11
Sarvodya Hospital Karnal,"Sector 14, Near Tau Devi Lal Chowk",Yes (22),12,0,10,0,12,0,10,0,Yes,Yes,Yes,Yes,Yes,"3:38 PM 5th Jul,21",2021-07-05 15:38,11
SDH Nilokheri,SDH Nilokheri,Yes (10),10,0,0,0,10,0,0,0,Yes,No,Yes,No,Yes,"3:39 PM 5th Jul,21",2021-07-05 15:39,11
Shri Ram Chand Memorial Hospital,"12, Ashoka colony,Opp Kalpana Chawla hospital, Karnal, Haryana",No (0),0,0,0,0,8,0,7,3,Yes,No,Yes,Yes,Yes,"3:34 PM 5th Jul,21",2021-07-05 15:34,11
Shri Sanatan Dharam Mahabir Dal,"Kunjpura Road, Karnal Near Sanatan Dharam Mandir",Yes (12),12,0,0,0,12,0,0,0,Yes,Yes,Yes,Yes,Yes,"3:34 PM 5th Jul,21",2021-07-05 15:34,11
SS Hospital,"Sector 14, Karnal",Yes (14),7,0,7,0,7,0,7,0,Yes,To Be Updated,Yes,Yes,Yes,"3:37 PM 5th Jul,21",2021-07-05 15:37,11
Swastik Hospital,Swastic Hospital Opp DCH,Yes (19),10,0,9,0,10,0,9,0,Yes,No,Yes,Yes,Yes,"3:38 PM 5th Jul,21",2021-07-05 15:38,11
Virk Hospital Karnal,"363-364, Randhir lane, near Dyal Singh College, Karnal, Haryana",Yes (45),37,0,8,1,37,0,8,1,Yes,Yes,Yes,Yes,Yes,"9:33 AM 7th Aug,21",2021-08-07 09:33,11
"AADHAR Hospital, Hisar",Tosham Road Hisar,Yes (44),26,6,12,6,26,6,12,6,Yes,No,Yes,Yes,Yes,"6:59 AM 7th Sep,21",2021-09-07 06:59,7
Bharat Multispeciality Hospital,Hisar,Yes (26),24,0,2,2,24,0,2,2,Yes,No,Yes,Yes,Yes,"12:54 PM 28th Sep,21",2021-09-28 12:54,7
Central Medical Centre (CMC),CMC Hospital Delhi Road Hisar,Yes (62),47,5,10,3,47,5,10,3,Yes,Yes,Yes,Yes,Yes,"1:16 PM 24th Sep,21",2021-09-24 13:16,7
Ch. Devi Lal Sanjeevani Make Shift Covid Hopsital Hisar,Near Jindal School Hisar,Yes (500),500,0,0,0,500,0,0,0,Yes,No,Yes,No,Yes,"6:56 AM 5th Aug,21",2021-08-05 06:56,7
Churamani Hospital,CAMP CHOWK HISAR,Yes (37),5,2,30,5,5,2,30,5,No,No,No,No,No,"12:50 PM 28th Sep,21",2021-09-28 12:50,7
District Civil Hospital Hisar,Sirsa Road Hisar,Yes (83),80,0,3,17,80,0,3,17,Yes,Yes,Yes,Yes,Yes,"9:42 AM 20th Sep,21",2021-09-20 09:42,7
DR. ANANTRAM JANTA HOSPITAL PVT LTD BARWALA,Civil Hospital Road Barwala,Yes (17),17,0,0,3,17,0,0,3,Yes,No,Yes,Yes,Yes,"12:37 PM 28th Jul,21",2021-07-28 12:37,7
Geetanjali Hospital,Model Town Hisar,Yes (47),40,0,7,5,40,0,7,5,Yes,Yes,Yes,Yes,Yes,"2:37 PM 28th Sep,21",2021-09-28 14:37,7
Goswami Hospital,"NEAR BUS STAND, RISHI NAGAR",Yes (9),4,5,0,1,4,5,0,1,Yes,No,Yes,Yes,Yes,"7:04 AM 4th Aug,21",2021-08-04 07:04,7
Gupta Hospital Hisar,Sector 14 Hisar,Yes (35),30,0,5,0,30,0,5,0,Yes,Yes,Yes,No,Yes,"9:18 AM 24th Oct,21",2021-10-24 09:18,7
"GURU JAMBHESHWAR MULTISPECIALITY HOSPITAL, AGROHA","ADAMPUR ROAD, AGROHA",Yes (14),9,3,2,1,9,3,2,1,Yes,No,Yes,Yes,Yes,"10:53 AM 16th Sep,21",2021-09-16 10:53,7
Holy Help Hospital,Tosham Road Hisar,Yes (39),25,6,8,1,25,6,8,1,Yes,No,Yes,Yes,Yes,"12:37 PM 28th Jul,21",2021-07-28 12:37,7
Janki Children Hospital Hisar,Near Sewak Sabha Hopsital Hisar,Yes (3),0,1,2,2,0,1,2,2,Yes,No,Yes,Yes,Yes,"12:39 PM 28th Jul,21",2021-07-28 12:39,7
KARTIK HOSPITAL,"NEAR SEWAK SABHA HOSPITAL AND  BUDLA SANT MANDIR, NEAR BUS STAND HISAR",Yes (15),8,5,2,2,8,5,2,2,Yes,No,Yes,To Be Updated,To Be Updated,"12:51 PM 16th Sep,21",2021-09-16 12:51,7
Mahatma Gandhi Hospital,,Yes (42),19,13,10,8,19,13,10,8,Yes,Yes,Yes,Yes,Yes,"12:54 PM 28th Sep,21",2021-09-28 12:54,7
MALIK HOSPITAL,"145A UTTAM NAGAR, HANSI",Yes (7),7,0,0,3,7,0,0,3,Yes,Yes,No,To Be Updated,To Be Updated,"12:54 PM 28th Sep,21",2021-09-28 12:54,7
MAMC Agroha,"Maharaj Aggarsin Medical College, VPO Agroha",Yes (140),85,15,40,60,85,15,40,60,To Be Updated,To Be Updated,To Be Updated,To Be Updated,To Be Updated,"9:09 AM 14th Oct,21",2021-10-14 09:09,7
Military Hospital Hisar,Cantt Hisar,Yes (57),15,40,2,3,15,42,2,3,Yes,To Be Updated,Yes,Yes,Yes,"4:05 PM 29th Oct,21",2021-10-29 16:05,7
NEKIRAM HOSPITAL,OPP BUS STAND HANSI,Yes (5),2,0,3,3,2,0,3,3,Yes,No,Yes,To Be Updated,To Be Updated,"7:09 AM 14th Aug,21",2021-08-14 07:09,7
Noble Super Specialty Hospital,Hisar,Yes (19),12,0,7,1,12,0,7,1,Yes,No,Yes,To Be Updated,Yes,"12:55 PM 28th Sep,21",2021-09-28 12:55,7
OPJindal Institute of Cancer &amp; Research Hospital,Model Town Hisar,Yes (145),100,4,41,45,100,4,41,45,Yes,No,Yes,Yes,Yes,"12:36 PM 28th Jul,21",2021-07-28 12:36,7
PARDEEP KANSAL MULTISPECIALITY HOSPITAL FOR CHILDREN,"25- Inderprastha Colony, Hisar",Yes (13),0,6,7,3,0,6,7,3,Yes,No,Yes,Yes,Yes,"12:38 PM 28th Jul,21",2021-07-28 12:38,7
Parnami Hospital,Hisar,Yes (28),21,5,2,2,21,5,2,2,Yes,Yes,Yes,Yes,Yes,"10:18 AM 27th Sep,21",2021-09-27 10:18,7
Ravindra Hospital Hisar,Model Town HISAR,Yes (21),19,0,2,1,19,0,2,1,Yes,No,Yes,Yes,Yes,"12:25 PM 14th Sep,21",2021-09-14 12:25,7
SAANVI HOSPITAL,"CHC ROAD, BARWALA",Yes (9),5,0,4,1,5,0,4,1,Yes,No,Yes,To Be Updated,To Be Updated,"7:01 AM 31st Aug,21",2021-08-31 07:01,7
SAMAYARA HOSPITAL,"KALI DEVI CHOWK. OPP BHALLA PETROL PUMP, HANSI",Yes (9),4,0,5,1,4,0,5,1,Yes,No,Yes,To Be Updated,To Be Updated,"7:12 AM 26th Jun,21",2021-06-26 07:12,7
Sapra Hospital,Rajgarh Road Hisar,Yes (28),19,3,6,12,19,3,6,12,Yes,Yes,Yes,No,Yes,"11:34 AM 24th Sep,21",2021-09-24 11:34,7
"Sarvodya Hospital, Hisar",Delhi Road Hisar,Yes (32),24,7,1,3,24,7,1,3,Yes,Yes,Yes,Yes,Yes,"10:17 AM 27th Sep,21",2021-09-27 10:17,7
Sewak Sabha Hospital,Near Bus Stand Hisar,Yes (27),16,3,8,1,16,3,8,1,Yes,Yes,Yes,Yes,Yes,"10:18 AM 27th Sep,21",2021-09-27 10:18,7
Shanti Devi Hospital,Delhi Road Hisar,Yes (38),26,0,12,2,26,0,12,2,Yes,No,Yes,Yes,Yes,"10:15 AM 27th Sep,21",2021-09-27 10:15,7
Shri Kali Devi Hospital Hansi,Delhi Road Hansi,Yes (13),8,0,5,0,8,0,5,0,Yes,No,Yes,Yes,Yes,"7:18 AM 20th Jun,21",2021-06-20 07:18,7
SINGLA MULTISPECIALITY HOSPITAL,"RISHI NAGAR, GALI NO. 1, NEAR BUS STAND, HISAR",Yes (19),17,0,2,1,17,0,2,1,Yes,No,Yes,Yes,Yes,"12:49 PM 27th Sep,21",2021-09-27 12:49,7
SL Minda Hospital,VPO Bagla,Yes (8),6,0,2,2,6,0,2,2,Yes,No,Yes,Yes,Yes,"12:51 PM 28th Sep,21",2021-09-28 12:51,7
Sonakshi Children Hospital Hansi,"G T Road, Near Kali Devi Mandir, Opp Bhalla Patrol Pump, Hansi",Yes (13),9,0,4,1,9,0,4,1,Yes,No,Yes,Yes,Yes,"7:12 AM 26th Jun,21",2021-06-26 07:12,7
Sukhda Multispeciality Hospital,Dabra Chowk Hisar,Yes (68),46,4,18,6,46,4,18,6,Yes,Yes,Yes,Yes,Yes,"7:03 AM 19th Aug,21",2021-08-19 07:03,7
Vardaan Hospital Hisar,Hisar,Yes (21),9,1,11,2,9,1,11,2,Yes,Yes,Yes,Yes,Yes,"5:25 PM 21st Oct,21",2021-10-21 17:25,7
Aarti Hospital,"A-628, Near Hanuman Mandir, Dabua Pali Road, NIT Faridabad",Yes (23),5,15,3,0,5,15,3,0,Yes,Yes,Yes,Yes,Yes,"10:25 AM 22nd Sep,21",2021-09-22 10:25,4
Aastha Hospital,"SCF -2, Ashoka Enclave Main Rd, Sector 35, Faridabad",Yes (14),10,4,0,0,10,4,0,0,Yes,No,Yes,Yes,Yes,"10:39 AM 20th Sep,21",2021-09-20 10:39,4
Al-Falah Hospital,"Al Falah university Campus, Dhouj",Yes (77),50,25,2,2,50,25,2,2,Yes,Yes,Yes,Yes,Yes,"9:34 AM 6th Dec,21",2021-12-06 09:34,4
Anshu Hospital,"Shiv Colony Sehatpur Road, Palla No. 1, Faridabad",Yes (20),10,10,0,0,10,10,0,0,Yes,No,Yes,No,No,"10:27 AM 15th Sep,21",2021-09-15 10:27,4
Arise Healthcare,"SCO: C 3185, Near Corporation Bank, Green Field Colony, Faridabad",Yes (16),2,7,7,2,2,7,7,2,Yes,Yes,Yes,No,No,"11:36 AM 3rd Dec,21",2021-12-03 11:36,4
Arsh Hospital,"Opp. Era Redwood Residency, Tigaon Rd, Sector 78, Faridabad,",Yes (65),40,5,20,6,40,5,20,6,Yes,Yes,Yes,Yes,Yes,"11:15 AM 13th Oct,21",2021-10-13 11:15,4
Asian Fidelis Multispeciality Hospital,"RPS Savana, RPS City, Sector-88, Faridabad",Yes (50),40,0,10,2,40,0,10,2,Yes,Yes,Yes,Yes,Yes,"10:14 AM 2nd Nov,21",2021-11-02 10:14,4
Asian Hospital,"Badkal Flyover Road, Sector  21 A Faridabad",Yes (129),89,0,40,14,89,0,40,14,Yes,Yes,Yes,Yes,Yes,"12:11 PM 5th Dec,21",2021-12-05 12:11,4
B.K. Hospital Faridabad,B.K. Hospital Faridabad B K Chowk FBD,Yes (100),64,25,11,11,64,25,11,11,Yes,Yes,Yes,Yes,Yes,"9:32 AM 4th Dec,21",2021-12-04 09:32,4
Bhavya Kalyani Hospital,"Mohna Road, Near Aanand Bakery, Ballabgarh, Faridabad",Yes (17),5,9,3,0,5,9,3,0,Yes,To Be Updated,To Be Updated,To Be Updated,To Be Updated,"5:51 PM 3rd Sep,21",2021-09-03 17:51,4
Chugh Hospital,"5L-164, K.C. Road N.I.T. Faridabad",Yes (18),4,14,0,0,4,14,0,0,To Be Updated,To Be Updated,To Be Updated,To Be Updated,To Be Updated,"12:58 PM 2nd Aug,21",2021-08-02 12:58,4
D.M. Hospital,"89-A, NH-5, Railway Road, Near Police Thana, NIT, Faridabad",Yes (28),10,10,8,1,10,10,8,1,Yes,No,No,Yes,Yes,"10:28 AM 25th Sep,21",2021-09-25 10:28,4
Doctor Today Multispecialty Hospital,"5-C/2,B.P., Railway Road,, Near Bankey Bihari Mandir,, next to IDBI Bank, Faridabad",Yes (40),35,0,5,2,35,0,5,2,Yes,No,Yes,Yes,Yes,"11:45 AM 11th Sep,21",2021-09-11 11:45,4
Dr. Harish Hospital,"701, Sector 8, YMCA Road, Faridabad",Yes (7),5,0,2,0,5,0,2,0,Yes,No,Yes,Yes,Yes,"10:32 AM 23rd Nov,21",2021-11-23 10:32,4
Durga Multispeciality Hospital,"Shri Bankey Bihari Mandir Complex, Neelam-Railway Road, NIT 5, Faridabad",Yes (30),22,0,8,0,22,0,8,0,No,No,No,No,No,"9:27 AM 2nd Sep,21",2021-09-02 09:27,4
"ESIC Medical College, Faridabad","NH-3, NIT Behind BK Hospital, Haryana",Yes (580),150,350,80,50,150,350,80,50,Yes,Yes,Yes,Yes,Yes,"12:36 PM 5th Dec,21",2021-12-05 12:36,4
Fortis Escort Hospital,"Neelam Bata Rd, opp. Neelam Cinema, AC Nagar, New Industrial Town, Faridabad,",Yes (69),55,0,14,7,55,0,14,7,Yes,Yes,Yes,Yes,Yes,"10:10 AM 4th Dec,21",2021-12-04 10:10,4
