name,address,Availability_availability_of_beds,Availability_oxygen_beds,Availability_non_oxygen_beds,Availability_i_c_u_beds,Availability_ventilators,Allocated_oxygen_beds,Allocated_non_oxygen_beds,Allocated_i_c_u,Allocated_ventilators,Availability_availability_of_oxygen,Availability_antiviral_remdesivir_etc_,Availability_steroids,Availability_anticoagulant,Availability_antipyretic,updated_on_unparsed,updated_on,city
Advanta Super Speciality Hospital,Near Power House,Yes (39),25,0,14,4,25,0,14,4,Yes,No,Yes,Yes,Yes,"5:05 PM 14th Jul,21",2021-07-14 17:05,19
ARS Holy Heart Advanced Cardiac care &amp; Research Centre,"330, Vinay Nagar Rohtak, Near Delhi Bypass Rohtak",Yes (20),0,0,20,2,0,0,20,2,Yes,No,No,No,No,"9:25 AM 1st Jul,21",2021-07-01 09:25,19
CHC Chiri,"VOP Chiri, Meham Gohana Road, Distt. Rohtak Haryana",Yes (10),10,0,0,0,10,0,0,0,Yes,Yes,Yes,Yes,Yes,"4:01 PM 15th Jul,21",2021-07-15 16:01,19
CHC Kahanaur,"Near Sarva haryana Gramin Bank, Opp. Banquet hall, Nigana Road, Kahanaur",Yes (10),4,6,0,0,4,6,0,0,Yes,No,Yes,No,Yes,"9:11 AM 16th Jul,21",2021-07-16 09:11,19
CHC kalanaur,"Police Station, Bhiwani-Rohtak Road , Near Kalanaur kalan, Kalanaur,",Yes (10),10,0,0,0,10,0,0,0,Yes,No,Yes,No,Yes,"1:54 PM 26th Jun,21",2021-06-26 13:54,19
CHC Kiloi,"VPO Kiloi, Water Works, Distt. Rohtak",Yes (10),5,5,0,0,5,5,0,0,Yes,No,Yes,No,Yes,"9:41 AM 1st Jul,21",2021-07-01 09:41,19
CHC Madina,"VPO Madina, Hisar Road Distt. Rohtak, Haryana",Yes (10),0,10,0,0,0,10,0,0,Yes,No,No,No,Yes,"9:32 AM 10th Jul,21",2021-07-10 09:32,19
CHC Meham,"Near ITI, Meham Distt. Rohtak",Yes (10),10,0,0,0,10,0,0,0,Yes,No,Yes,No,Yes,"10:56 AM 30th Jul,21",2021-07-30 10:56,19
CHC Sampla,"Gadi Sampla, Rohtak, SH-20, Jhajjar Sampla Road, Sampla, Sampla, Haryana 124501",Yes (10),0,10,0,0,0,10,0,0,No,No,Yes,No,Yes,"4:20 PM 8th Aug,21",2021-08-08 16:20,19
"Civil Hospital, Rohtak",Subash Road,Yes (71),40,24,7,5,40,24,7,5,Yes,Yes,Yes,Yes,Yes,"9:15 AM 26th Jun,21",2021-06-26 09:15,19
Holy Heart Super speciality Hospital,Vinay Nagar Delhi Bye pass,Yes (57),25,5,27,6,25,5,27,6,Yes,No,Yes,Yes,Yes,"9:16 AM 1st Jul,21",2021-07-01 09:16,19
"Hridaya Nilayam Heart, Lung &amp; vascular Institute","5, Raj Garden, Delhi Bypass, Rohtak",Yes (25),0,0,25,2,0,0,25,2,To Be Updated,To Be Updated,To Be Updated,To Be Updated,To Be Updated,"8:02 AM 16th Jun,21",2021-06-16 08:02,19
Joyline Multispeciality,"Surajmal Colony, Sunarian Road, Opposite Birgadier Muktram Statue Rohtak",Yes (20),15,0,5,1,15,0,5,1,Yes,Yes,Yes,Yes,Yes,"4:09 PM 8th Aug,21",2021-08-08 16:09,19
Kainos Hospital,Near Kheri Sadh Village Outer Bye Pass,Yes (70),26,10,34,17,26,10,34,17,Yes,No,Yes,Yes,Yes,"9:14 AM 2nd Jul,21",2021-07-02 09:14,19
Life Care Hospital,Subash Nagar,Yes (50),30,0,20,6,30,0,20,6,Yes,No,Yes,Yes,Yes,"6:03 PM 15th Jul,21",2021-07-15 18:03,19
Maan Hospital,Bhagwan Colony Near Radio Station,Yes (45),29,0,16,6,29,0,16,6,Yes,No,Yes,Yes,Yes,"9:56 AM 21st Jun,21",2021-06-21 09:56,19
Mansarover Hospital,Mansarover Colony Near Park,Yes (30),20,0,10,7,20,0,10,7,Yes,No,Yes,Yes,Yes,"9:49 AM 5th Jul,21",2021-07-05 09:49,19
Neurocentre Super Speciality Hospital,"Kalawati Bulding, Near Power House Rohtak",Yes (23),4,6,13,2,4,6,13,2,Yes,No,Yes,Yes,Yes,"4:18 PM 27th Jun,21",2021-06-27 16:18,19
Noble Heart Super Speciality Hospital,Near Raj Garden Delhi Bye Pass,Yes (34),26,1,7,6,26,1,7,6,Yes,No,Yes,Yes,Yes,"9:36 AM 21st Jun,21",2021-06-21 09:36,19
Oscar Super Speciality Trauma Center,"Medical Moad, Daryao Singh Nagar,",Yes (41),23,3,15,2,23,3,15,2,Yes,Yes,Yes,Yes,Yes,"9:51 AM 21st Jun,21",2021-06-21 09:51,19
Oxygen Hospital,Islam Pura Daries Hisar Road,Yes (30),15,10,5,4,15,10,5,4,Yes,No,Yes,Yes,Yes,"10:49 AM 23rd Jun,21",2021-06-23 10:49,19
PGIMS Rohtak,"Pt.Bhagwat Dayal PGIMS, Medical Rd, Rohtak, Haryana",Yes (566),451,0,115,115,451,0,115,115,Yes,Yes,Yes,Yes,Yes,"9:53 AM 8th Aug,21",2021-08-08 09:53,19
Positron Hospital,Suncity Sector 35,Yes (32),0,16,16,4,0,16,16,4,Yes,No,No,Yes,Yes,"5:02 PM 28th Jun,21",2021-06-28 17:02,19
Pragati Hospital,"Sukhpura Chowk, Gohana Road, opp. Ladhot Road Rohtak",Yes (15),11,0,4,1,11,0,4,1,Yes,No,Yes,Yes,Yes,"5:06 PM 14th Jul,21",2021-07-14 17:06,19
"Sanghi Nursing Home, Rohtak, Haryana","Chotu Ram Chowk, Civil Road, Arya Nagar, Rohtak, Haryana",Yes (14),10,0,4,4,10,0,4,4,Yes,Yes,Yes,Yes,Yes,"10:42 AM 27th Jun,21",2021-06-27 10:42,19
Shivam Liver &amp; Gastro Super Speciality Hospital,"CIVIL ROAD NEAR SHANT MAI CHOWK, Rohtak, Haryana - 124001, India",Yes (9),5,0,4,1,5,0,4,1,Yes,No,Yes,Yes,Yes,"8:36 AM 31st Jul,21",2021-07-31 08:36,19
Sunflag Global Hospital,Bharat Colony Near Sheela Bye Pass,Yes (35),20,0,15,5,20,0,15,5,Yes,No,Yes,Yes,Yes,"9:27 AM 25th Jun,21",2021-06-25 09:27,19
Aarti Hospital,"A-628, Near Hanuman Mandir, Dabua Pali Road, NIT Faridabad",Yes (23),5,15,3,0,5,15,3,0,Yes,Yes,Yes,Yes,Yes,"9:10 AM 8th Aug,21",2021-08-08 09:10,4
Aastha Hospital,"SCF -2, Ashoka Enclave Main Rd, Sector 35, Faridabad",Yes (14),10,4,0,0,10,4,0,0,Yes,No,Yes,Yes,Yes,"10:28 AM 5th Aug,21",2021-08-05 10:28,4
Al-Falah Hospital,"Al Falah university Campus, Dhouj",Yes (77),50,25,2,2,50,25,2,2,Yes,Yes,Yes,Yes,Yes,"12:21 PM 8th Aug,21",2021-08-08 12:21,4
Anshu Hospital,"Shiv Colony Sehatpur Road, Palla No. 1, Faridabad",Yes (20),10,10,0,0,10,10,0,0,Yes,No,Yes,No,No,"5:35 PM 7th Aug,21",2021-08-07 17:35,4
Arise Healthcare,"SCO: C 3185, Near Corporation Bank, Green Field Colony, Faridabad",Yes (16),2,7,7,2,2,7,7,2,Yes,Yes,Yes,No,No,"11:12 AM 7th Aug,21",2021-08-07 11:12,4
Arsh Hospital,"Opp. Era Redwood Residency, Tigaon Rd, Sector 78, Faridabad,",Yes (64),40,5,19,6,40,5,20,6,Yes,Yes,Yes,Yes,Yes,"9:57 AM 8th Aug,21",2021-08-08 09:57,4
Asian Fidelis Multispeciality Hospital,"RPS Savana, RPS City, Sector-88, Faridabad",Yes (50),40,0,10,2,40,0,10,2,Yes,Yes,Yes,Yes,Yes,"9:19 AM 4th Aug,21",2021-08-04 09:19,4
Asian Hospital,"Badkal Flyover Road, Sector  21 A Faridabad",Yes (129),89,0,40,14,89,0,40,14,Yes,Yes,Yes,Yes,Yes,"2:41 PM 8th Aug,21",2021-08-08 14:41,4
B.K. Hospital Faridabad,B.K. Hospital Faridabad B K Chowk FBD,Yes (100),64,25,11,11,64,25,11,11,Yes,Yes,Yes,Yes,Yes,"10:18 AM 3rd Aug,21",2021-08-03 10:18,4
Bhavya Kalyani Hospital,"Mohna Road, Near Aanand Bakery, Ballabgarh, Faridabad",Yes (17),5,9,3,0,5,9,3,0,Yes,To Be Updated,To Be Updated,To Be Updated,To Be Updated,"7:29 PM 6th Aug,21",2021-08-06 19:29,4
Chugh Hospital,"5L-164, K.C. Road N.I.T. Faridabad",Yes (18),4,14,0,0,4,14,0,0,To Be Updated,To Be Updated,To Be Updated,To Be Updated,To Be Updated,"12:58 PM 2nd Aug,21",2021-08-02 12:58,4
D.M. Hospital,"89-A, NH-5, Railway Road, Near Police Thana, NIT, Faridabad",Yes (28),10,10,8,1,10,10,8,1,Yes,No,No,Yes,Yes,"11:20 AM 8th Aug,21",2021-08-08 11:20,4
Doctor Today Multispecialty Hospital,"5-C/2,B.P., Railway Road,, Near Bankey Bihari Mandir,, next to IDBI Bank, Faridabad",Yes (40),35,0,5,2,35,0,5,2,Yes,No,Yes,Yes,Yes,"10:28 AM 7th Aug,21",2021-08-07 10:28,4
Dr. Harish Hospital,"701, Sector 8, YMCA Road, Faridabad",Yes (7),5,0,2,0,5,0,2,0,Yes,No,Yes,Yes,Yes,"5:18 PM 8th Aug,21",2021-08-08 17:18,4
Durga Multispeciality Hospital,"Shri Bankey Bihari Mandir Complex, Neelam-Railway Road, NIT 5, Faridabad",Yes (30),22,0,8,0,22,0,8,0,No,No,No,No,No,"11:26 AM 7th Aug,21",2021-08-07 11:26,4
"ESIC Medical College, Faridabad","NH-3, NIT Behind BK Hospital, Haryana",Yes (576),150,346,80,50,150,350,80,50,Yes,Yes,Yes,Yes,Yes,"11:31 AM 8th Aug,21",2021-08-08 11:31,4
Fortis Escort Hospital,"Neelam Bata Rd, opp. Neelam Cinema, AC Nagar, New Industrial Town, Faridabad,",Yes (69),55,0,14,7,55,0,14,7,Yes,Yes,Yes,Yes,Yes,"2:13 PM 7th Aug,21",2021-08-07 14:13,4
Gaurav Hospital,"Rajeev Colony, Samaypur Road, Ballabgarh, Faridabad",Yes (15),3,2,10,1,3,2,10,1,Yes,To Be Updated,Yes,To Be Updated,To Be Updated,"10:50 AM 8th Aug,21",2021-08-08 10:50,4
Geeta Hospital,"Opposite Huda Market and Community Centre, Sector 28, Faridabad",Yes (18),8,0,10,2,8,0,10,2,Yes,No,Yes,Yes,Yes,"11:58 AM 15th Jul,21",2021-07-15 11:58,4
Geetanjali Multispeciality Hospital,"D-635, 60 Feet Rd, Chawla Colony, Ballabhgarh, Faridabad",Yes (23),20,3,0,0,20,3,0,0,Yes,To Be Updated,Yes,To Be Updated,To Be Updated,"9:41 AM 4th Aug,21",2021-08-04 09:41,4
Goyal Hospital,"Plot No. 2 opposite hanuman temple Sec 8, Surdas Park",Yes (18),12,0,6,2,12,0,6,2,No,Yes,Yes,Yes,Yes,"10:24 AM 7th Aug,21",2021-08-07 10:24,4
Handa Medical Center,"Site No-1, Sector 16, Opp Sagar Cinema, Faridabad",No (0),0,0,0,0,0,0,0,0,No,No,No,To Be Updated,No,"1:06 PM 29th Jun,21",2021-06-29 13:06,4
Heritage Hospital,3C-62B/BP NIT Faridabad,Yes (15),11,0,4,1,11,0,4,1,To Be Updated,To Be Updated,To Be Updated,To Be Updated,To Be Updated,"4:03 PM 5th Aug,21",2021-08-05 16:03,4
IBS Ashwani Hospital,"Plot No 8 D/1, YMCA Rd, Pocket D, Sector 11, Faridabad",Yes (35),22,5,8,2,22,5,8,2,No,To Be Updated,To Be Updated,To Be Updated,To Be Updated,"9:29 AM 7th Aug,21",2021-08-07 09:29,4
Janak Hospital,Indira complex Neharpar Kheri Road Faridabad,Yes (27),15,6,6,0,15,6,6,0,Yes,No,Yes,Yes,Yes,"2:59 PM 6th Aug,21",2021-08-06 14:59,4
Kant Multispeciality Hospital Pvt Ltd,"Plot no. 167, Indra Complex, Kheri Road, Greater, near Kheri Pul Bridge, Sector 87, Neharpar Faridabad, Faridabad, Haryana 121002",Yes (23),18,0,5,1,18,0,5,1,To Be Updated,No,To Be Updated,To Be Updated,To Be Updated,"10:31 AM 7th Aug,21",2021-08-07 10:31,4
Kedar Hospital,"3B/3, B.P , Near DAV college, NIT., Faridabad,",Yes (49),31,6,12,1,31,6,12,1,Yes,Yes,Yes,Yes,Yes,"9:08 AM 8th Aug,21",2021-08-08 09:08,4
Kedar Hospital Multispeciality,Gali 7 Krishna Colony Sec25 Faridabad,Yes (30),10,15,5,0,10,15,5,0,Yes,No,Yes,Yes,Yes,"8:57 AM 4th Aug,21",2021-08-04 08:57,4
Krishna Medical Centre,"773, Sector-19, Faridabad",Yes (10),5,0,5,0,5,0,5,0,Yes,Yes,Yes,Yes,Yes,"11:53 AM 18th Jun,21",2021-06-18 11:53,4
Life Hospital,Opp Hanuman Mandir Sec 8 Faridabad,Yes (10),4,0,6,1,4,0,6,1,Yes,Yes,Yes,Yes,Yes,"8:06 AM 16th Jun,21",2021-06-16 08:06,4
Lotus Hospital,"Plot-2, Jeevan Nagar, Opp. Lal Kothi, Main Ballabgarh Sohna Road, Faridabad",Yes (20),12,0,8,1,12,0,8,1,Yes,No,Yes,Yes,Yes,"10:46 AM 8th Aug,21",2021-08-08 10:46,4
Madhav Hospital,"Building no 16, Block E, and, New Industrial Twp 5, Faridabad, Haryana 121001",Yes (28),0,0,28,2,0,0,28,2,To Be Updated,No,To Be Updated,To Be Updated,To Be Updated,"12:45 PM 21st Jul,21",2021-07-21 12:45,4
Manavta Hospital,"Plot No-494, Near Women ITI, Uncha Gaon Prem Nagar, Mohna Road, Ballabgarh, Faridabad",Yes (31),10,10,11,3,10,10,11,3,To Be Updated,To Be Updated,To Be Updated,To Be Updated,To Be Updated,"9:23 AM 8th Aug,21",2021-08-08 09:23,4
Manvi Medical Centre,"New Bharat Colony, Opp. Chaddar Godam, Near Mahaban Farm, Kheri Road, Greater Faridabad",Yes (9),7,0,2,0,7,0,2,0,To Be Updated,No,To Be Updated,To Be Updated,To Be Updated,"3:43 PM 8th Aug,21",2021-08-08 15:43,4
Medicheck Hospital,"Block C, Plot Number 76, Shahid Bhagat Singh Marg, near Bata Flyover, New Industrial Town, Faridabad",Yes (64),52,0,12,3,52,0,12,3,Yes,No,Yes,Yes,Yes,"1:44 PM 14th Jul,21",2021-07-14 13:44,4
Medstar Hospital,"Om Enclave Part 1, Near Toll Tax, Agwanpur Road, Faridabad",Yes (7),5,2,0,0,5,2,0,0,To Be Updated,To Be Updated,To Be Updated,To Be Updated,To Be Updated,"4:25 PM 8th Aug,21",2021-08-08 16:25,4
Medwin Hospital,"Plot No. 2, Jeevan Nagar, Sohna Road Gounchi, Sector 55, Faridabad",Yes (20),2,12,6,0,2,12,6,0,To Be Updated,No,Yes,Yes,Yes,"10:16 AM 8th Aug,21",2021-08-08 10:16,4
Metro Hospital Medicare,"Metro Heart Institute with Multispeciality Sector 16 A, Faridabad",Yes (145),80,45,20,11,80,45,20,11,Yes,Yes,Yes,Yes,Yes,"10:32 AM 8th Aug,21",2021-08-08 10:32,4
National Institute Of Medical Sciences,"Sector -23A,?Faridabad,?",Yes (28),15,4,9,2,15,4,9,2,Yes,No,Yes,Yes,Yes,"10:42 AM 29th Jul,21",2021-07-29 10:42,4
Ortho 1 Hospital,"1331, Near Community Centre, Sector 55, Faridabad",Yes (30),8,12,10,1,8,12,10,1,Yes,No,Yes,Yes,Yes,"9:34 PM 7th Aug,21",2021-08-07 21:34,4
Park Hospital Faridabad,"J Block, Sector 10 HBC, opposite Court, Faridabad",Yes (45),10,10,25,5,10,10,25,5,Yes,Yes,Yes,Yes,Yes,"10:33 AM 8th Aug,21",2021-08-08 10:33,4
Pawan Hospital Unit-1,"Samaypur Road Near Sector 56, Ballabhgarh, Faridabad",Yes (45),31,0,14,7,31,0,14,7,To Be Updated,To Be Updated,To Be Updated,To Be Updated,To Be Updated,"9:52 AM 7th Aug,21",2021-08-07 09:52,4
Pawan Hospital Unit-2,"Plot No. 10, Jawahar Colony, Near Disposal Chowk, Faridabad",Yes (11),0,0,11,0,0,0,11,0,To Be Updated,To Be Updated,To Be Updated,To Be Updated,To Be Updated,"10:34 AM 8th Aug,21",2021-08-08 10:34,4
Prachi Hospital,Opp Chimni Bai Dharmshala Faridabad,Yes (17),10,2,5,1,10,2,5,1,Yes,No,Yes,Yes,Yes,"10:34 AM 8th Aug,21",2021-08-08 10:34,4
QRG Central,"Plot No, 69, Mathura Rd, Sector 20 A, New Industrial Town, Faridabad",Yes (10),6,0,4,2,6,0,4,2,Yes,Yes,Yes,Yes,Yes,"10:30 AM 8th Aug,21",2021-08-08 10:30,4
QRG Hospital Medicare,"Ambedkar Marg, QRG Healthcity, Sector 16, Faridabad",Yes (122),104,0,18,7,104,0,18,7,Yes,Yes,Yes,Yes,Yes,"8:39 AM 8th Aug,21",2021-08-08 08:39,4
Raghav Hospital,Kheri Road Sec 87 Greater Faridabad,Yes (23),17,3,3,1,17,3,3,1,Yes,No,Yes,Yes,Yes,"8:30 AM 8th Aug,21",2021-08-08 08:30,4
Raj Nursing Home,"CLINIC SITE NO-6, Sector 3, Faridabad",Yes (17),13,0,4,1,13,0,4,1,Yes,No,Yes,Yes,Yes,"9:59 AM 30th Jul,21",2021-07-30 09:59,4
Ronak Hospital,"Dabua Pali Road, Near Ganga Ram Devta Mandir, NIT, Faridabad",Yes (50),20,20,10,3,20,20,10,3,Yes,Yes,Yes,Yes,Yes,"1:29 PM 25th Jul,21",2021-07-25 13:29,4
Samrat Hospital,"180, Sanjay Colony, Delhi Mathura Road, JCB Chowk, Ballabgarh, Faridabad",Yes (20),10,0,10,0,10,0,10,0,To Be Updated,To Be Updated,To Be Updated,To Be Updated,To Be Updated,"9:44 AM 6th Aug,21",2021-08-06 09:44,4
Sanjeevan Multispeciality Hospital,"D-947, 60 Feet Road, Opp. Shiv Mandir, Chawla Colony, Ballabgarh, Faridabad",Yes (17),7,2,8,0,7,2,8,0,No,Yes,Yes,Yes,Yes,"10:24 AM 31st Jul,21",2021-07-31 10:24,4
Santosh Multispeciality Hospital,"Shop No. 3F, 139, Metro Rd, New Industrial Township 2b, Block F, New Industrial Twp 3, New Industrial Town, Faridabad,",Yes (60),40,10,10,1,40,10,10,1,Yes,No,Yes,Yes,Yes,"1:23 PM 12th Jul,21",2021-07-12 13:23,4
Sarvodya Hospital Sector-8,"Sector-8, YMCA Rd, near Escorts Mujesar Metro Station, Sector 7, Faridabad",Yes (150),125,0,25,5,125,0,25,5,Yes,Yes,Yes,Yes,Yes,"10:37 AM 17th Jul,21",2021-07-17 10:37,4
Sarvodya Hospital Sector 19,"Gopi Colony, Old Faridabad, Faridabad",Yes (38),28,0,10,4,28,0,10,4,Yes,Yes,Yes,Yes,To Be Updated,"12:57 PM 30th Jul,21",2021-07-30 12:57,4
Sattya Hospital,"376, IP Colony, Sector 32-33 Faridabad",Yes (10),6,0,4,2,6,0,4,2,Yes,To Be Updated,To Be Updated,To Be Updated,To Be Updated,"1:50 PM 7th Aug,21",2021-08-07 13:50,4
Shankar Medicare Center,Sec 28 Faridabad,Yes (35),15,20,0,0,15,20,0,0,Yes,Yes,Yes,Yes,Yes,"10:59 AM 7th Aug,21",2021-08-07 10:59,4
Shanti Devi Memorial Hospital,"Kheri More Near, Piyush Heights, Sector 89, Faridabad",Yes (25),14,8,3,2,14,8,3,2,Yes,No,Yes,Yes,Yes,"10:21 AM 26th Jul,21",2021-07-26 10:21,4
Shivalik Hospital Unit 1,Huda Market Sector-37 Faridabad,Yes (7),0,3,4,0,0,3,4,0,Yes,No,Yes,Yes,Yes,"10:18 AM 8th Aug,21",2021-08-08 10:18,4
Shivalik Hospital Unit 2,"Sehatpur, Opp. Sec-91 Faridabad",Yes (2),0,0,2,0,0,0,2,0,Yes,No,Yes,Yes,Yes,"9:36 AM 5th Aug,21",2021-08-05 09:36,4
"Shri Atal Bihari Vajpayee Government Medical College, Chhainsa","Village  Chhainsa, Faridabad",Yes (100),100,0,0,0,100,0,0,0,Yes,Yes,Yes,No,Yes,"9:01 AM 7th Aug,21",2021-08-07 09:01,4
Siddhi Vinayak Aspataal,"MCF-8280, Main Sohna Road, Near Syndicate Bank/Lal Kothi, Ballabgarh, Faridabad",Yes (26),10,6,10,1,10,6,10,1,Yes,Yes,To Be Updated,To Be Updated,To Be Updated,"11:22 AM 15th Jul,21",2021-07-15 11:22,4
SMS Hospital,"Clinic No. 9, Sector-3, Near Huda Market, Faridabad",Yes (10),5,0,5,3,5,0,5,3,Yes,No,Yes,Yes,Yes,"11:32 AM 3rd Aug,21",2021-08-03 11:32,4
SRU Multispeciality Hospital,"Sunder Colony, Nangla Gujran, Behind Rawal International School, Ballabgarh, Faridabad",Yes (17),14,0,3,0,14,0,3,0,Yes,No,Yes,No,No,"11:09 AM 6th Aug,21",2021-08-06 11:09,4
Sunrise Hospital,"3C-63, BP, NIT Faridabad",Yes (28),25,0,3,0,25,0,3,0,Yes,No,Yes,Yes,Yes,"10:15 AM 6th Aug,21",2021-08-06 10:15,4
Sunshine Hospital,"Sec 64 Sahupura Road, Unchagaon Ballabgarh",Yes (11),8,0,3,0,8,0,3,0,Yes,No,Yes,Yes,Yes,"9:16 AM 8th Aug,21",2021-08-08 09:16,4
Supreme Hospital,"Suraj Kund Rd, Charmwood Village, Faridabad",Yes (22),20,0,2,1,20,0,2,1,To Be Updated,To Be Updated,To Be Updated,To Be Updated,To Be Updated,"10:08 AM 31st Jul,21",2021-07-31 10:08,4
Suryodaya Hospital,"Chandiwala Bagh, RPS Road, Sector 88 Greater Faridabad",Yes (11),9,0,2,2,9,0,2,2,To Be Updated,To Be Updated,To Be Updated,To Be Updated,To Be Updated,"12:18 PM 25th Jul,21",2021-07-25 12:18,4
Urocare Apolo Multi and Super Speciality Hospital,"H.No 78, Behind Girls College, Sector-2, Ballabgarh, Faridabad",Yes (8),0,6,2,0,0,6,2,0,Yes,No,Yes,Yes,Yes,"11:10 AM 26th Jul,21",2021-07-26 11:10,4
V Care Multispeciality Health Center,"Plot No. V7, Near Police Station, BPTP Park Land, Sector-76, Faridabad",Yes (10),7,0,3,2,7,0,3,2,Yes,No,Yes,Yes,Yes,"1:58 PM 4th Aug,21",2021-08-04 13:58,4
Vardan Hospital,"Opp. Gurudwara, Adarsh Nagar, Main Malerna Road, Ballabgarh, Faridabad",Yes (15),15,0,0,0,15,0,0,0,To Be Updated,To Be Updated,To Be Updated,To Be Updated,To Be Updated,"2:42 PM 23rd Jun,21",2021-06-23 14:42,4
Vedanta Hospital,"B-5,Central Green,Near I.T, BK Chowk, New Industrial Town, Faridabad",Yes (30),10,12,8,1,10,12,8,1,Yes,No,Yes,Yes,Yes,"9:32 AM 8th Aug,21",2021-08-08 09:32,4
Vibal Hospital Pvt. Ltd.,"Sector-21D, Huda Market, Faridabad",Yes (18),10,0,8,1,10,0,8,1,Yes,Yes,Yes,Yes,Yes,"11:35 AM 4th Aug,21",2021-08-04 11:35,4
ABLE HOSPITAL,,Yes (37),10,25,2,2,10,25,2,5,Yes,No,Yes,Yes,Yes,"3:08 PM 26th May,21",2021-05-26 15:08,15
Apex Hospital,"Prakash Vihar, Delhi Mathura Road, Palwal, Haryana",Yes (19),13,0,6,2,13,0,6,2,Yes,No,Yes,Yes,Yes,"10:07 AM 31st May,21",2021-05-31 10:07,15
ATLAS HOSPITAL,"Palwal, Haryana",Yes (14),1,11,2,2,2,11,2,2,To Be Updated,To Be Updated,To Be Updated,To Be Updated,To Be Updated,"11:02 AM 29th May,21",2021-05-29 11:02,15
BIKAL HOSPITAL,"PALWAL, HARYANA",Yes (21),13,5,3,0,13,5,3,0,Yes,No,Yes,Yes,Yes,"2:57 PM 23rd Jun,21",2021-06-23 14:57,15
CHC Alawalpur,CHC Alawalpur,Yes (17),1,16,0,0,4,16,0,0,To Be Updated,To Be Updated,To Be Updated,To Be Updated,To Be Updated,"6:55 PM 18th May,21",2021-05-18 18:55,15
Civil Hospital Palwal,"Civil Hospital, palwal",Yes (110),103,0,7,7,103,0,7,7,Yes,To Be Updated,To Be Updated,To Be Updated,To Be Updated,"8:22 AM 8th Aug,21",2021-08-08 08:22,15
COSMOS HOSPITAL,PALWAL,Yes (10),5,5,0,0,5,5,0,0,To Be Updated,To Be Updated,To Be Updated,To Be Updated,To Be Updated,"12:02 PM 16th May,21",2021-05-16 12:02,15
GALAXY HOSPITAL,HUDA SECTOR 2,Yes (21),5,0,16,11,5,0,16,11,Yes,No,Yes,Yes,Yes,"5:22 PM 16th Jun,21",2021-06-16 17:22,15
"Gurunanak Hospital, Palwal","NH2, Near Bus Stand, Shiv Colony, Palwal Haryana",Yes (37),18,4,15,3,18,4,15,3,Yes,Yes,Yes,Yes,Yes,"5:07 PM 7th Jun,21",2021-06-07 17:07,15
JINDAL HOSPITAL,"Palwal, Haryana",Yes (15),10,2,3,0,10,2,3,0,To Be Updated,No,Yes,Yes,Yes,"12:53 PM 19th May,21",2021-05-19 12:53,15
NIDHI HOSPITAL,"Palwal, Haryana",Yes (12),2,7,3,0,2,7,3,0,Yes,No,Yes,Yes,Yes,"12:42 PM 19th May,21",2021-05-19 12:42,15
Palwal Hospital,"Moti Colony, Palwal, Haryana",Yes (22),0,6,16,1,0,6,16,1,Yes,No,Yes,Yes,Yes,"2:19 PM 28th May,21",2021-05-28 14:19,15
RAHUL HOSPITAL,PALWAL,Yes (15),7,5,3,0,7,5,3,0,Yes,No,Yes,Yes,Yes,"4:20 PM 13th May,21",2021-05-13 16:20,15
Sachin Hospital,"New Sohna Road, Near Panchwati Chowk, Palwal Haryana",Yes (28),10,5,13,2,10,5,13,2,Yes,Yes,Yes,Yes,Yes,"9:29 AM 14th Jun,21",2021-06-14 09:29,15
SDH Hodal,SDH Hodal,Yes (20),10,10,0,0,10,10,0,0,Yes,No,Yes,Yes,Yes,"11:45 AM 1st Jun,21",2021-06-01 11:45,15
Shri. Satya Sai Sanjivani Hospital Palwal,"Palwal, Haryana",Yes (23),4,16,3,2,4,17,4,2,Yes,No,Yes,Yes,Yes,"5:13 PM 2nd Jun,21",2021-06-02 17:13,15
SRI SAI HOSPITAL,"Palwal, Haryana",Yes (6),0,6,0,0,0,6,0,0,Yes,No,Yes,Yes,Yes,"10:08 AM 2nd Jun,21",2021-06-02 10:08,15
VASHU HOSPITAL,,Yes (10),10,0,0,0,10,0,0,0,Yes,No,Yes,Yes,Yes,"12:53 PM 19th May,21",2021-05-19 12:53,15
"AAROGYAM HOSPITAL, Kurukshetra","NEAR OLD BUS STAND, THANESAR, KURUSKHETRA",Yes (67),40,12,15,27,40,12,15,27,Yes,Yes,Yes,Yes,Yes,"3:27 PM 8th Aug,21",2021-08-08 15:27,12
"ADESH MEDICAL COLLEGE, SHAHBAD MOHRI KURUKSHETRA.","VILL. MOHRI, SHAHBAD, KURUSHETRA",Yes (105),30,70,5,11,30,70,5,11,Yes,Yes,Yes,Yes,Yes,"3:29 PM 8th Aug,21",2021-08-08 15:29,12
AGGARWAL NURSING HOME,"SALARPUR ROAD, THANESAR, KURUKSHETRA.",Yes (30),20,7,3,7,20,7,3,7,Yes,Yes,Yes,Yes,Yes,"3:27 PM 8th Aug,21",2021-08-08 15:27,12
B.S. HEART CARE,"OPP. NEW BUS STAND, KURUKSHETRA.",Yes (26),18,0,8,20,18,0,8,20,Yes,Yes,Yes,Yes,Yes,"3:26 PM 8th Aug,21",2021-08-08 15:26,12
"CYGNUS HOSPITAL, Kurukshetra","NEAR OLD BUS STAND, THANESAR, KURUSKHETRA",Yes (12),7,4,1,4,7,4,1,4,Yes,Yes,Yes,Yes,Yes,"3:27 PM 8th Aug,21",2021-08-08 15:27,12
KURUKSHETRA NURSING HOME,,Yes (19),18,0,1,2,18,0,1,2,Yes,Yes,Yes,Yes,Yes,"3:29 PM 8th Aug,21",2021-08-08 15:29,12
LNJP CIVIL HOSPITAL.,LNJP HOSPITAL KURUKSHETRA.,Yes (95),60,30,5,5,60,30,5,5,Yes,Yes,Yes,Yes,Yes,"3:26 PM 8th Aug,21",2021-08-08 15:26,12
MIRI PIRI SHAHBAD,"SHAHBAD, KURUKSHETRA",Yes (14),10,0,4,4,10,0,4,4,Yes,Yes,Yes,Yes,Yes,"3:28 PM 8th Aug,21",2021-08-08 15:28,12
Nirogi Hospital,Shahabad Kurukshetra,Yes (7),5,2,0,3,5,2,0,3,Yes,Yes,Yes,Yes,Yes,"3:29 PM 8th Aug,21",2021-08-08 15:29,12
"Saraswati Mission Hospital, Kurukshetra","Theme Park Road, Kurukshetra",Yes (20),4,0,16,2,4,0,16,2,Yes,Yes,Yes,Yes,Yes,"3:30 PM 8th Aug,21",2021-08-08 15:30,12
"Saraswati Mission Hospital, Pehowa","Ambala Road Dist. Kurukshetra, Pehowa, Haryana 136128",Yes (22),20,0,2,5,20,0,2,5,Yes,No,Yes,To Be Updated,Yes,"3:26 PM 8th Aug,21",2021-08-08 15:26,12
"SIDHARTH HOSPITAL, SHAHBAD","SHAHBAD, KURUKSHETRA",Yes (16),8,4,4,3,8,4,4,3,Yes,Yes,Yes,Yes,Yes,"3:28 PM 8th Aug,21",2021-08-08 15:28,12
VERMA HOSPITAL,LADWA,Yes (14),9,3,2,2,9,3,2,2,Yes,Yes,Yes,Yes,Yes,"3:28 PM 8th Aug,21",2021-08-08 15:28,12
ANUJ HOSPITAL SAFIDON,safidon panipat road,Yes (30),2,18,10,0,2,18,10,0,Yes,No,Yes,Yes,Yes,"8:40 AM 30th Jun,21",2021-06-30 08:40,9
Balaji Hospital Jind,Rohtak Road Jind,Yes (48),32,16,0,0,32,16,0,0,Yes,No,Yes,Yes,Yes,"8:39 AM 30th Jun,21",2021-06-30 08:39,9
CHC Alewa,"Alewa 2 Sub Health Centre, Alewa Chc Alewa, Alewa, Jind",Yes (15),15,0,0,0,15,0,0,0,Yes,No,Yes,No,Yes,"8:41 AM 30th Jun,21",2021-06-30 08:41,9
CHC Julana,Julana,Yes (26),20,6,0,0,20,6,0,0,Yes,No,Yes,Yes,Yes,"8:38 AM 30th Jun,21",2021-06-30 08:38,9
District Civil Hospital Jind (NEW+OLD),Hosptial,Yes (170),150,0,20,12,150,0,20,12,Yes,Yes,Yes,Yes,Yes,"8:36 AM 30th Jun,21",2021-06-30 08:36,9
Gangaputra Ayurvedic Medical College Jind,Kandela,Yes (100),60,15,25,3,60,15,25,3,Yes,No,Yes,Yes,Yes,"8:39 AM 30th Jun,21",2021-06-30 08:39,9
JIND HEART HOSPITAL,GOHANA BYPASS ROHTAK ROAD JIND,Yes (17),12,0,5,1,12,0,5,1,Yes,No,No,No,No,"8:39 AM 30th Jun,21",2021-06-30 08:39,9
Malik Hospital,Rohtak Road Jind,Yes (8),4,0,4,3,4,0,4,3,Yes,No,Yes,Yes,Yes,"8:39 AM 30th Jun,21",2021-06-30 08:39,9
Meenakashi Jain Hospital,Near Bus Stand,Yes (22),15,2,5,1,15,2,5,1,Yes,No,Yes,Yes,Yes,"8:39 AM 30th Jun,21",2021-06-30 08:39,9
RAJ HOSPITAL ROHTAK RAOD JIND,ROHTAK ROAD JIND,Yes (15),8,5,2,2,8,5,2,2,Yes,No,Yes,Yes,Yes,"9:27 AM 6th Jul,21",2021-07-06 09:27,9
Sarvodhya Hospital Jind,Jind,Yes (20),20,0,0,2,20,0,0,2,Yes,No,Yes,No,No,"8:39 AM 30th Jun,21",2021-06-30 08:39,9
SDH Narwana,Narwana,Yes (32),20,12,0,0,20,12,0,0,Yes,No,Yes,Yes,Yes,"8:39 AM 30th Jun,21",2021-06-30 08:39,9
SDH Safidon,Safidon,Yes (34),20,14,0,0,20,14,0,0,Yes,No,Yes,No,Yes,"8:41 AM 30th Jun,21",2021-06-30 08:41,9
SDH UCHANA,Uchana,Yes (55),20,35,0,0,20,35,0,0,Yes,No,No,No,Yes,"8:38 AM 30th Jun,21",2021-06-30 08:38,9
Shri Gyani Ram Mamorial Hospital,Safidon,Yes (25),10,5,10,0,10,5,10,0,Yes,No,Yes,Yes,Yes,"8:38 AM 30th Jun,21",2021-06-30 08:38,9
DCHC Barara,,Yes (50),50,0,0,0,50,0,0,0,To Be Updated,To Be Updated,To Be Updated,To Be Updated,To Be Updated,"10:54 AM 4th Aug,21",2021-08-04 10:54,1
DCHC Mullana,,Yes (50),50,0,0,0,50,0,0,0,To Be Updated,To Be Updated,To Be Updated,To Be Updated,To Be Updated,"10:54 AM 4th Aug,21",2021-08-04 10:54,1
District Civil Hospital,Ambala City,Yes (134),111,0,23,11,116,0,23,11,Yes,Yes,Yes,Yes,Yes,"10:53 AM 4th Aug,21",2021-08-04 10:53,1
District Civil Hospital Ambala Cantt,Ambala Cantt,Yes (90),77,0,13,7,80,0,13,7,Yes,Yes,Yes,Yes,Yes,"10:53 AM 4th Aug,21",2021-08-04 10:53,1
Guardian Hospital,AMBALA JAGADHARI ROAD AMBALA CANTT,Yes (23),15,3,5,3,15,3,5,3,Yes,Yes,Yes,Yes,Yes,"10:54 AM 4th Aug,21",2021-08-04 10:54,1
Ishwar Hospital,,Yes (16),16,0,0,0,16,0,0,0,Yes,Yes,Yes,Yes,Yes,"10:54 AM 4th Aug,21",2021-08-04 10:54,1
Kuldeep Hospital,,Yes (10),8,0,2,0,8,0,2,0,To Be Updated,To Be Updated,To Be Updated,To Be Updated,To Be Updated,"10:54 AM 4th Aug,21",2021-08-04 10:54,1
Mehndiratta Hospital,"#106, manali house, near central jail,  ambala city",Yes (30),25,0,5,1,25,0,5,1,Yes,No,Yes,Yes,Yes,"10:53 AM 4th Aug,21",2021-08-04 10:53,1
Military Hospital,Ambala Cantonment,Yes (160),60,85,15,15,60,85,15,15,To Be Updated,To Be Updated,To Be Updated,To Be Updated,To Be Updated,"10:52 AM 4th Aug,21",2021-08-04 10:52,1
MM Medical College Pvt,MMIMSR Mullana Ambala,Yes (200),116,70,14,10,116,70,14,10,Yes,Yes,Yes,Yes,Yes,"10:52 AM 4th Aug,21",2021-08-04 10:52,1
Park Healing Touch Hospital,"Sultanpur Chowk, Nr Dhulkot Barrier, Ambala Chandigarh Expy. Ambala",Yes (48),28,0,20,10,30,0,20,10,Yes,Yes,Yes,Yes,Yes,"10:53 AM 4th Aug,21",2021-08-04 10:53,1
Philedelphia mission Hospital pvt,"Mission Compound, Ambala City",Yes (99),91,0,8,2,92,0,8,2,Yes,No,Yes,Yes,Yes,"10:52 AM 4th Aug,21",2021-08-04 10:52,1
Railways Hospital,"Railway Hospital, railway colony,  Ambala Cantt",Yes (35),30,0,5,0,30,0,5,0,Yes,No,Yes,Yes,Yes,"6:23 AM 5th Aug,21",2021-08-05 06:23,1
