name,address,Availability_availability_of_beds,Availability_oxygen_beds,Availability_non_oxygen_beds,Availability_i_c_u_beds,Availability_ventilators,Allocated_oxygen_beds,Allocated_non_oxygen_beds,Allocated_i_c_u,Allocated_ventilators,Availability_availability_of_oxygen,Availability_antiviral_remdesivir_etc_,Availability_steroids,Availability_anticoagulant,Availability_antipyretic,updated_on_unparsed,updated_on,city
Gaurav Hospital,"Rajeev Colony, Samaypur Road, Ballabgarh, Faridabad",Yes (15),3,2,10,1,3,2,10,1,Yes,To Be Updated,Yes,To Be Updated,To Be Updated,"9:35 AM 26th Aug,21",2021-08-26 09:35,4
Geeta Hospital,"Opposite Huda Market and Community Centre, Sector 28, Faridabad",Yes (18),8,0,10,2,8,0,10,2,Yes,No,Yes,Yes,Yes,"11:13 AM 30th Oct,21",2021-10-30 11:13,4
Geetanjali Multispeciality Hospital,"D-635, 60 Feet Rd, Chawla Colony, Ballabhgarh, Faridabad",Yes (23),20,3,0,0,20,3,0,0,Yes,To Be Updated,Yes,Yes,To Be Updated,"2:44 PM 27th Aug,21",2021-08-27 14:44,4
Goyal Hospital,"Plot No. 2 opposite hanuman temple Sec 8, Surdas Park",Yes (18),12,0,6,2,12,0,6,2,No,Yes,Yes,Yes,Yes,"10:40 AM 5th Oct,21",2021-10-05 10:40,4
Handa Medical Center,"Site No-1, Sector 16, Opp Sagar Cinema, Faridabad",No (0),0,0,0,0,0,0,0,0,No,No,No,To Be Updated,No,"1:06 PM 29th Jun,21",2021-06-29 13:06,4
Heritage Hospital,3C-62B/BP NIT Faridabad,Yes (15),11,0,4,1,11,0,4,1,To Be Updated,To Be Updated,To Be Updated,To Be Updated,To Be Updated,"1:49 PM 8th Sep,21",2021-09-08 13:49,4
IBS Ashwani Hospital,"Plot No 8 D/1, YMCA Rd, Pocket D, Sector 11, Faridabad",Yes (35),22,5,8,2,22,5,8,2,No,To Be Updated,To Be Updated,To Be Updated,To Be Updated,"10:59 AM 19th Oct,21",2021-10-19 10:59,4
Janak Hospital,Indira complex Neharpar Kheri Road Faridabad,Yes (27),15,6,6,0,15,6,6,0,Yes,No,Yes,Yes,Yes,"10:42 AM 7th Sep,21",2021-09-07 10:42,4
Kant Multispeciality Hospital Pvt Ltd,"Plot no. 167, Indra Complex, Kheri Road, Greater, near Kheri Pul Bridge, Sector 87, Neharpar Faridabad, Faridabad, Haryana 121002",Yes (23),18,0,5,1,18,0,5,1,To Be Updated,No,To Be Updated,To Be Updated,To Be Updated,"11:05 AM 28th Aug,21",2021-08-28 11:05,4
Kedar Hospital,"3B/3, B.P , Near DAV college, NIT., Faridabad,",Yes (49),31,6,12,1,31,6,12,1,Yes,Yes,Yes,Yes,Yes,"10:25 AM 22nd Sep,21",2021-09-22 10:25,4
Kedar Hospital Multispeciality,Gali 7 Krishna Colony Sec25 Faridabad,Yes (30),10,15,5,0,10,15,5,0,Yes,No,Yes,Yes,Yes,"10:24 AM 22nd Sep,21",2021-09-22 10:24,4
Krishna Medical Centre,"773, Sector-19, Faridabad",Yes (10),5,0,5,0,5,0,5,0,Yes,Yes,Yes,Yes,Yes,"11:53 AM 18th Jun,21",2021-06-18 11:53,4
Life Hospital,Opp Hanuman Mandir Sec 8 Faridabad,Yes (10),4,0,6,1,4,0,6,1,Yes,Yes,Yes,Yes,Yes,"8:06 AM 16th Jun,21",2021-06-16 08:06,4
Lotus Hospital,"Plot-2, Jeevan Nagar, Opp. Lal Kothi, Main Ballabgarh Sohna Road, Faridabad",Yes (20),12,0,8,1,12,0,8,1,Yes,No,Yes,Yes,Yes,"12:58 PM 12th Oct,21",2021-10-12 12:58,4
Madhav Hospital,"Building no 16, Block E, and, New Industrial Twp 5, Faridabad, Haryana 121001",Yes (28),0,0,28,2,0,0,28,2,To Be Updated,No,To Be Updated,To Be Updated,To Be Updated,"12:45 PM 21st Jul,21",2021-07-21 12:45,4
Manavta Hospital,"Plot No-494, Near Women ITI, Uncha Gaon Prem Nagar, Mohna Road, Ballabgarh, Faridabad",Yes (31),10,10,11,3,10,10,11,3,To Be Updated,To Be Updated,To Be Updated,To Be Updated,To Be Updated,"10:06 AM 6th Sep,21",2021-09-06 10:06,4
Manvi Medical Centre,"New Bharat Colony, Opp. Chaddar Godam, Near Mahaban Farm, Kheri Road, Greater Faridabad",Yes (9),7,0,2,0,7,0,2,0,Yes,No,Yes,Yes,Yes,"3:19 PM 19th Sep,21",2021-09-19 15:19,4
Medicheck Hospital,"Block C, Plot Number 76, Shahid Bhagat Singh Marg, near Bata Flyover, New Industrial Town, Faridabad",Yes (64),52,0,12,3,52,0,12,3,Yes,No,Yes,Yes,Yes,"1:44 PM 14th Jul,21",2021-07-14 13:44,4
Medstar Hospital,"Om Enclave Part 1, Near Toll Tax, Agwanpur Road, Faridabad",Yes (7),5,2,0,0,5,2,0,0,To Be Updated,To Be Updated,To Be Updated,To Be Updated,To Be Updated,"10:00 AM 9th Sep,21",2021-09-09 10:00,4
Medwin Hospital,"Plot No. 2, Jeevan Nagar, Sohna Road Gounchi, Sector 55, Faridabad",Yes (20),2,12,6,0,2,12,6,0,To Be Updated,No,Yes,Yes,Yes,"9:39 AM 19th Oct,21",2021-10-19 09:39,4
Metro Hospital Medicare,"Metro Heart Institute with Multispeciality Sector 16 A, Faridabad",Yes (145),80,45,20,11,80,45,20,11,Yes,Yes,Yes,Yes,Yes,"10:50 AM 6th Dec,21",2021-12-06 10:50,4
National Institute Of Medical Sciences,"Sector -23A,?Faridabad,?",Yes (28),15,4,9,2,15,4,9,2,Yes,No,Yes,Yes,Yes,"3:36 PM 27th Aug,21",2021-08-27 15:36,4
Ortho 1 Hospital,"1331, Near Community Centre, Sector 55, Faridabad",Yes (30),8,12,10,1,8,12,10,1,Yes,No,Yes,Yes,Yes,"9:46 PM 30th Oct,21",2021-10-30 21:46,4
Park Hospital Faridabad,"J Block, Sector 10 HBC, opposite Court, Faridabad",Yes (45),10,10,25,5,10,10,25,5,Yes,No,Yes,Yes,Yes,"9:20 AM 6th Dec,21",2021-12-06 09:20,4
Pawan Hospital Unit-1,"Samaypur Road Near Sector 56, Ballabhgarh, Faridabad",Yes (45),31,0,14,7,31,0,14,7,To Be Updated,To Be Updated,To Be Updated,To Be Updated,To Be Updated,"10:55 AM 5th Dec,21",2021-12-05 10:55,4
Pawan Hospital Unit-2,"Plot No. 10, Jawahar Colony, Near Disposal Chowk, Faridabad",Yes (11),0,0,11,0,0,0,11,0,To Be Updated,To Be Updated,To Be Updated,To Be Updated,To Be Updated,"10:59 AM 5th Dec,21",2021-12-05 10:59,4
Prachi Hospital,Opp Chimni Bai Dharmshala Faridabad,Yes (17),10,2,5,1,10,2,5,1,Yes,No,Yes,Yes,Yes,"10:27 AM 6th Sep,21",2021-09-06 10:27,4
QRG Central,"Plot No, 69, Mathura Rd, Sector 20 A, New Industrial Town, Faridabad",Yes (10),6,0,4,2,6,0,4,2,Yes,Yes,Yes,Yes,Yes,"5:10 PM 29th Nov,21",2021-11-29 17:10,4
QRG Hospital Medicare,"Ambedkar Marg, QRG Healthcity, Sector 16, Faridabad",Yes (122),104,0,18,7,104,0,18,7,Yes,Yes,Yes,Yes,Yes,"9:15 AM 27th Nov,21",2021-11-27 09:15,4
Raghav Hospital,Kheri Road Sec 87 Greater Faridabad,Yes (23),17,3,3,1,17,3,3,1,Yes,No,Yes,Yes,Yes,"3:04 PM 6th Oct,21",2021-10-06 15:04,4
Raj Nursing Home,"CLINIC SITE NO-6, Sector 3, Faridabad",Yes (17),13,0,4,1,13,0,4,1,Yes,No,Yes,Yes,Yes,"9:52 AM 5th Sep,21",2021-09-05 09:52,4
Ronak Hospital,"Dabua Pali Road, Near Ganga Ram Devta Mandir, NIT, Faridabad",Yes (50),20,20,10,3,20,20,10,3,Yes,Yes,Yes,Yes,Yes,"2:06 PM 6th Oct,21",2021-10-06 14:06,4
Samrat Hospital,"180, Sanjay Colony, Delhi Mathura Road, JCB Chowk, Ballabgarh, Faridabad",Yes (20),10,0,10,0,10,0,10,0,To Be Updated,To Be Updated,To Be Updated,To Be Updated,To Be Updated,"2:15 PM 6th Oct,21",2021-10-06 14:15,4
Sanjeevan Multispeciality Hospital,"D-947, 60 Feet Road, Opp. Shiv Mandir, Chawla Colony, Ballabgarh, Faridabad",Yes (17),7,2,8,0,7,2,8,0,No,Yes,Yes,Yes,Yes,"12:04 PM 24th Sep,21",2021-09-24 12:04,4
Santosh Multispeciality Hospital,"Shop No. 3F, 139, Metro Rd, New Industrial Township 2b, Block F, New Industrial Twp 3, New Industrial Town, Faridabad,",Yes (60),40,10,10,1,40,10,10,1,Yes,No,Yes,Yes,Yes,"1:23 PM 12th Jul,21",2021-07-12 13:23,4
Sarvodya Hospital Sector-8,"Sector-8, YMCA Rd, near Escorts Mujesar Metro Station, Sector 7, Faridabad",Yes (150),125,0,25,5,125,0,25,5,Yes,Yes,Yes,Yes,Yes,"10:37 AM 17th Jul,21",2021-07-17 10:37,4
Sarvodya Hospital Sector 19,"Gopi Colony, Old Faridabad, Faridabad",Yes (38),28,0,10,4,28,0,10,4,Yes,Yes,Yes,Yes,To Be Updated,"1:33 PM 29th Sep,21",2021-09-29 13:33,4
Sattya Hospital,"376, IP Colony, Sector 32-33 Faridabad",Yes (10),6,0,4,2,6,0,4,2,Yes,To Be Updated,To Be Updated,To Be Updated,To Be Updated,"11:17 AM 19th Oct,21",2021-10-19 11:17,4
Shankar Medicare Center,Sec 28 Faridabad,Yes (35),15,20,0,0,15,20,0,0,Yes,Yes,Yes,Yes,Yes,"11:34 AM 25th Oct,21",2021-10-25 11:34,4
Shanti Devi Memorial Hospital,"Kheri More Near, Piyush Heights, Sector 89, Faridabad",Yes (25),14,8,3,2,14,8,3,2,Yes,No,Yes,Yes,Yes,"11:56 AM 8th Nov,21",2021-11-08 11:56,4
Shivalik Hospital Unit 1,Huda Market Sector-37 Faridabad,Yes (7),0,3,4,0,0,3,4,0,Yes,No,Yes,Yes,Yes,"10:18 AM 19th Oct,21",2021-10-19 10:18,4
Shivalik Hospital Unit 2,"Sehatpur, Opp. Sec-91 Faridabad",Yes (2),0,0,2,0,0,0,2,0,Yes,No,Yes,Yes,Yes,"10:18 AM 19th Oct,21",2021-10-19 10:18,4
"Shri Atal Bihari Vajpayee Government Medical College, Chhainsa","Village  Chhainsa, Faridabad",Yes (100),100,0,0,0,100,0,0,0,Yes,Yes,Yes,No,Yes,"12:03 PM 2nd Dec,21",2021-12-02 12:03,4
Siddhi Vinayak Aspataal,"MCF-8280, Main Sohna Road, Near Syndicate Bank/Lal Kothi, Ballabgarh, Faridabad",Yes (26),10,6,10,1,10,6,10,1,Yes,Yes,To Be Updated,To Be Updated,To Be Updated,"11:22 AM 15th Jul,21",2021-07-15 11:22,4
SMS Hospital,"Clinic No. 9, Sector-3, Near Huda Market, Faridabad",Yes (10),5,0,5,3,5,0,5,3,Yes,No,Yes,Yes,Yes,"10:24 AM 21st Sep,21",2021-09-21 10:24,4
SRU Multispeciality Hospital,"Sunder Colony, Nangla Gujran, Behind Rawal International School, Ballabgarh, Faridabad",Yes (17),14,0,3,0,14,0,3,0,To Be Updated,To Be Updated,To Be Updated,To Be Updated,To Be Updated,"9:35 AM 13th Sep,21",2021-09-13 09:35,4
Sunrise Hospital,"3C-63, BP, NIT Faridabad",Yes (28),25,0,3,0,25,0,3,0,Yes,No,Yes,Yes,Yes,"10:27 AM 29th Nov,21",2021-11-29 10:27,4
Sunshine Hospital,"Sec 64 Sahupura Road, Unchagaon Ballabgarh",Yes (11),8,0,3,0,8,0,3,0,Yes,No,Yes,Yes,Yes,"1:46 PM 24th Sep,21",2021-09-24 13:46,4
Supreme Hospital,"Suraj Kund Rd, Charmwood Village, Faridabad",Yes (22),20,0,2,1,20,0,2,1,To Be Updated,To Be Updated,To Be Updated,To Be Updated,To Be Updated,"10:08 AM 31st Jul,21",2021-07-31 10:08,4
Suryodaya Hospital,"Chandiwala Bagh, RPS Road, Sector 88 Greater Faridabad",Yes (11),9,0,2,2,9,0,2,2,To Be Updated,To Be Updated,To Be Updated,To Be Updated,To Be Updated,"1:16 PM 12th Aug,21",2021-08-12 13:16,4
Urocare Apolo Multi and Super Speciality Hospital,"H.No 78, Behind Girls College, Sector-2, Ballabgarh, Faridabad",Yes (8),0,6,2,0,0,6,2,0,Yes,No,Yes,Yes,Yes,"5:38 PM 13th Sep,21",2021-09-13 17:38,4
V Care Multispeciality Health Center,"Plot No. V7, Near Police Station, BPTP Park Land, Sector-76, Faridabad",Yes (10),7,0,3,2,7,0,3,2,Yes,No,Yes,Yes,Yes,"10:00 PM 27th Aug,21",2021-08-27 22:00,4
Vardan Hospital,"Opp. Gurudwara, Adarsh Nagar, Main Malerna Road, Ballabgarh, Faridabad",Yes (15),15,0,0,0,15,0,0,0,To Be Updated,To Be Updated,To Be Updated,To Be Updated,To Be Updated,"2:42 PM 23rd Jun,21",2021-06-23 14:42,4
Vedanta Hospital,"B-5,Central Green,Near I.T, BK Chowk, New Industrial Town, Faridabad",Yes (30),10,12,8,1,10,12,8,1,Yes,No,Yes,Yes,Yes,"9:17 AM 9th Oct,21",2021-10-09 09:17,4
Vibal Hospital Pvt. Ltd.,"Sector-21D, Huda Market, Faridabad",Yes (18),10,0,8,1,10,0,8,1,Yes,Yes,Yes,Yes,Yes,"7:46 PM 2nd Sep,21",2021-09-02 19:46,4
Zenith Hospital (P) Ltd.,187/1 Yadav Colony Mohana Road NEar Yadav DairyBallabgarh,Yes (13),10,0,3,3,10,0,3,3,Yes,No,No,No,Yes,"11:07 AM 6th Oct,21",2021-10-06 11:07,4
"Aditya Neuro &amp; Spine Hospital, Rewari","Circular Rd, near Kanod gate, Raam Bagh Mahalla, Rewari, Haryana",Yes (10),8,0,2,2,8,0,2,2,Yes,No,Yes,Yes,Yes,"11:46 AM 28th May,21",2021-05-28 11:46,18
Advance Hospital,"Bawal Road, Model Town",Yes (8),5,0,3,0,5,0,6,1,Yes,No,Yes,Yes,Yes,"5:43 PM 25th May,21",2021-05-25 17:43,18
"Apex Hospital, Dharuhera","Plot No.5, Sector 6, Dharuhera, Haryana 123106",Yes (10),6,0,4,1,6,0,4,1,Yes,No,Yes,Yes,Yes,"12:08 PM 28th May,21",2021-05-28 12:08,18
Apollo Rewari/Family Health Edge Hospital,"Garhi Bolni Rd, near Public Health Office, krishna Nagar, Rewari, Haryana",Yes (27),17,3,7,0,17,3,7,0,Yes,No,Yes,Yes,Yes,"2:38 PM 3rd Jun,21",2021-06-03 14:38,18
Capt. Nand Lal Hospital,"Circular Road near Government Girls Senior Secondary School naiwali, chowk, Rewari",Yes (20),6,10,4,1,11,10,8,1,Yes,No,Yes,Yes,Yes,"11:54 PM 15th May,21",2021-05-15 23:54,18
Civil Hospital rewari,"Kayasthwara Mohalla, Rewari, Haryana",Yes (63),39,16,8,4,40,16,8,4,Yes,Yes,Yes,Yes,Yes,"10:54 AM 30th Jun,21",2021-06-30 10:54,18
Cygnus Hospital Rewari,"Opposite Civil Hospital Mohola, Sanghi Ka Bass, Rewari, Haryana",Yes (32),21,7,4,1,26,7,9,2,Yes,No,Yes,No,Yes,"9:58 AM 28th May,21",2021-05-28 09:58,18
Devjyoti Hospital,"Ambedkar chowk, near Bus Stand, Rewari, Haryana",Yes (14),7,2,5,1,7,2,6,2,Yes,No,Yes,Yes,Yes,"10:10 AM 8th Jun,21",2021-06-08 10:10,18
Dr. K.K. NAGAR HOSPITAL,"317, Near Shishu Shala School, Model Town, Rewari, Haryana",Yes (12),2,0,10,0,2,0,10,0,Yes,No,Yes,Yes,Yes,"9:22 AM 22nd Jun,21",2021-06-22 09:22,18
Dr. Vijay Pal Yadav Hospital,"Near Ambedker chowk, Rewari",Yes (7),2,2,3,0,3,3,4,0,Yes,No,Yes,Yes,Yes,"9:52 AM 23rd May,21",2021-05-23 09:52,18
Kamla Nursing Home/Kalawati Hospital,"201, Model Town, Rewari, Near Bus Stand, Opposite Bal Bhawan, Shivam Chowk",Yes (17),12,0,5,5,14,0,9,6,Yes,No,Yes,Yes,Yes,"6:47 PM 27th May,21",2021-05-27 18:47,18
Katyal Hospital,"Katyal Hospital, KANOD GATE, CIRCULAR ROAD, Rewari, Haryana, India",Yes (21),9,6,6,0,12,6,10,1,Yes,No,Yes,Yes,Yes,"9:04 AM 10th Jun,21",2021-06-10 09:04,18
Maars Hospital,"Garhi Bolni Rd, near PWD Office, Sector 19, Rewari, Haryana",Yes (15),15,0,0,0,15,0,0,0,Yes,No,Yes,Yes,No,"10:21 AM 29th Jun,21",2021-06-29 10:21,18
"Manasavi Hospital, Rewari",,Yes (10),10,0,0,0,10,0,0,0,Yes,No,Yes,No,Yes,"12:12 PM 28th May,21",2021-05-28 12:12,18
Matrika Hospital,"Matrika Hospital, Ranbir Singh Huda Chowk, Bawal-Rewari Rd, Rewari, Haryana",Yes (23),12,0,11,1,16,0,14,3,Yes,No,No,Yes,Yes,"10:27 AM 28th May,21",2021-05-28 10:27,18
Mediom Hospital/Medcare Hospital,"Sohna Rd, near Municipal Corporation, Dharuhera, Haryana",Yes (4),3,Beds Over Utilized 1,1,0,8,0,4,1,Yes,No,Yes,Yes,Yes,"6:58 PM 23rd May,21",2021-05-23 18:58,18
Om Hospital,"Om Hospital, Nandrampur Bass Rd, Dharuhera, Haryana",Yes (24),12,4,8,0,12,4,8,0,Yes,No,Yes,Yes,Yes,"7:36 PM 2nd Jun,21",2021-06-02 19:36,18
Pushpanjli Hospital Rewari,"Rajesh Pilot Chowk, Rewari, Haryana",No (0),0,0,0,0,40,12,10,3,No,No,Yes,Yes,Yes,"4:33 PM 25th May,21",2021-05-25 16:33,18
R. B. Yadav Hospital,"Dr. R B Yadav Hospital, Circular Rd Jainpuri, Kayasthwara Mohalla, Rewari, Haryana",Yes (22),8,6,8,2,8,6,8,2,Yes,No,Yes,Yes,Yes,"9:25 AM 8th Jun,21",2021-06-08 09:25,18
Samrat Hospital,Near Azad Chowk Rewari,Yes (9),5,0,4,3,5,0,10,3,Yes,No,Yes,Yes,Yes,"5:44 PM 25th May,21",2021-05-25 17:44,18
SDH Kosli,"Kosli, Rewari, Haryana",Yes (31),11,20,0,0,20,20,0,0,Yes,No,No,No,No,"4:32 PM 25th May,21",2021-05-25 16:32,18
Shanti Yadav Hospital,"Bawal-Rewari Rd Model Town, Rewari, Haryana",Yes (28),16,8,4,1,19,10,4,1,Yes,No,Yes,No,No,"9:37 AM 26th May,21",2021-05-26 09:37,18
Sheela Neuro &amp; Multi. Superspeciality Hospital,"Sheela Neuro Multi-Super Speciality Hospital, Opposite Jain Public School, Circular Road, Rewari",Yes (32),15,15,2,0,15,15,3,1,Yes,No,Yes,Yes,No,"5:47 PM 25th May,21",2021-05-25 17:47,18
Shri Ashwani Sexena Hospital,"343-L, Model town Rewari",Yes (10),7,3,0,0,7,3,0,0,Yes,No,Yes,Yes,Yes,"9:06 AM 7th Sep,21",2021-09-07 09:06,18
SMCC Hospital,"Sector 5 Rewari, Haryana",Yes (13),2,0,11,1,2,0,11,1,Yes,No,Yes,Yes,Yes,"6:10 PM 28th Jun,21",2021-06-28 18:10,18
Surendra Hospital Bawal,"Circuar Road, Rewari, Haryana",Yes (11),5,2,4,0,5,2,5,0,Yes,No,Yes,No,Yes,"7:19 PM 9th Jun,21",2021-06-09 19:19,18
"Sushma Devi Hospital, Bawal","Rewari Road, Bawal, Rewari, Near Power House & Bharat Petrol Pump",Yes (18),9,9,0,0,9,9,0,0,Yes,No,Yes,Yes,Yes,"10:29 AM 1st Jun,21",2021-06-01 10:29,18
Vedanta Hospital,"Circulare Road, Near Nirankari Satsang Bhavan Dharuhera, Chungi, Rewari, Haryana",Yes (29),0,7,22,0,0,7,30,0,Yes,No,Yes,Yes,Yes,"4:42 PM 25th May,21",2021-05-25 16:42,18
Virat Hospital,"Circular Rd, Near Oriental Bank of Commerce, Madhu Vihar, Rewari, Haryana",Yes (100),63,10,27,2,63,10,27,2,Yes,No,Yes,Yes,Yes,"9:42 AM 10th Jul,21",2021-07-10 09:42,18
Yaduvanshi Hospital,"Maharana Pratap Chowk, Model Town, Rewari, Haryana",Yes (19),14,0,5,2,14,0,5,2,Yes,No,Yes,Yes,No,"9:09 AM 6th Jul,21",2021-07-06 09:09,18
DCHC Barara,,Yes (50),50,0,0,0,50,0,0,0,To Be Updated,To Be Updated,To Be Updated,To Be Updated,To Be Updated,"10:54 AM 4th Aug,21",2021-08-04 10:54,1
DCHC Mullana,,Yes (50),50,0,0,0,50,0,0,0,To Be Updated,To Be Updated,To Be Updated,To Be Updated,To Be Updated,"10:54 AM 4th Aug,21",2021-08-04 10:54,1
District Civil Hospital,Ambala City,Yes (134),111,0,23,11,116,0,23,11,Yes,Yes,Yes,Yes,Yes,"10:53 AM 4th Aug,21",2021-08-04 10:53,1
District Civil Hospital Ambala Cantt,Ambala Cantt,Yes (90),77,0,13,7,80,0,13,7,Yes,Yes,Yes,Yes,Yes,"10:53 AM 4th Aug,21",2021-08-04 10:53,1
Guardian Hospital,AMBALA JAGADHARI ROAD AMBALA CANTT,Yes (23),15,3,5,3,15,3,5,3,Yes,Yes,Yes,Yes,Yes,"10:54 AM 4th Aug,21",2021-08-04 10:54,1
Ishwar Hospital,,Yes (16),16,0,0,0,16,0,0,0,Yes,Yes,Yes,Yes,Yes,"10:54 AM 4th Aug,21",2021-08-04 10:54,1
Kuldeep Hospital,,Yes (10),8,0,2,0,8,0,2,0,To Be Updated,To Be Updated,To Be Updated,To Be Updated,To Be Updated,"10:54 AM 4th Aug,21",2021-08-04 10:54,1
Mehndiratta Hospital,"#106, manali house, near central jail,  ambala city",Yes (30),25,0,5,1,25,0,5,1,Yes,No,Yes,Yes,Yes,"10:53 AM 4th Aug,21",2021-08-04 10:53,1
Military Hospital,Ambala Cantonment,Yes (160),60,85,15,15,60,85,15,15,To Be Updated,To Be Updated,To Be Updated,To Be Updated,To Be Updated,"10:52 AM 4th Aug,21",2021-08-04 10:52,1
MM Medical College Pvt,MMIMSR Mullana Ambala,Yes (200),116,70,14,10,116,70,14,10,Yes,Yes,Yes,Yes,Yes,"10:52 AM 4th Aug,21",2021-08-04 10:52,1
Park Healing Touch Hospital,"Sultanpur Chowk, Nr Dhulkot Barrier, Ambala Chandigarh Expy. Ambala",Yes (50),30,Beds Over Utilized 8,20,10,30,0,20,10,Yes,Yes,Yes,Yes,Yes,"1:34 PM 18th Sep,21",2021-09-18 13:34,1
Philedelphia mission Hospital pvt,"Mission Compound, Ambala City",Yes (99),91,0,8,2,92,0,8,2,Yes,No,Yes,Yes,Yes,"10:52 AM 4th Aug,21",2021-08-04 10:52,1
Railways Hospital,"Railway Hospital, railway colony,  Ambala Cantt",Yes (35),30,0,5,0,30,0,5,0,Yes,No,Yes,Yes,Yes,"6:04 AM 6th Dec,21",2021-12-06 06:04,1
Rotary Hospital Ambala cantt Pvt,"Rambagh road, Opp Dusshera ground, Ambala Cantt",Yes (20),15,0,5,2,15,0,5,2,Yes,No,Yes,Yes,Yes,"10:52 AM 4th Aug,21",2021-08-04 10:52,1
Sant Hospital,,Yes (13),10,0,3,1,10,0,3,1,To Be Updated,To Be Updated,To Be Updated,To Be Updated,To Be Updated,"10:53 AM 4th Aug,21",2021-08-04 10:53,1
SDH Naraingarh,,Yes (50),50,0,0,0,50,0,0,0,To Be Updated,To Be Updated,To Be Updated,To Be Updated,To Be Updated,"10:53 AM 4th Aug,21",2021-08-04 10:53,1
Yafe Indoor Hospital,,Yes (14),9,5,0,0,9,6,0,0,To Be Updated,To Be Updated,To Be Updated,To Be Updated,To Be Updated,"10:54 AM 4th Aug,21",2021-08-04 10:54,1
ASHIRWAD BHAGAT HOSPITAL,"Old DC Rd, near bhagat hospital, Sonipat, Haryana 131001",Yes (15),12,0,3,1,12,0,3,1,Yes,Yes,Yes,Yes,Yes,"11:47 AM 17th Jun,21",2021-06-17 11:47,21
Bhagwan Dass Hospital,"Near Shahpur Turk, block-E, omaxe city, Sector 18, Sonipat, Haryana 131001",Yes (40),27,0,13,2,27,0,13,2,Yes,No,Yes,Yes,Yes,"11:47 AM 17th Jun,21",2021-06-17 11:47,21
"BPS MEDICAL COLLEGE KHANPUR , SONIPAT ( 01263283088)","Ganaur - Gohana Rd, Khanpur Kalan, Haryana",Yes (300),170,80,50,50,170,80,50,50,Yes,Yes,Yes,Yes,Yes,"7:53 AM 16th Aug,21",2021-08-16 07:53,21
CHC GANUR,CHC GANUR,Yes (8),8,0,0,0,8,0,0,0,Yes,No,Yes,Yes,Yes,"11:48 AM 17th Jun,21",2021-06-17 11:48,21
CHC Kharkhoda,"SH 20, Kharkhoda, Haryana 131402",Yes (10),5,5,0,0,5,5,0,0,To Be Updated,To Be Updated,Yes,Yes,Yes,"11:49 AM 17th Jun,21",2021-06-17 11:49,21
"CHC, JUAN, SONIPAT, HARYANA","CHC, JUAN, SONIPAT, HARYANACHC, JUAN, SONIPAT, HARYANA, 131024",Yes (5),3,2,0,0,3,2,0,0,Yes,No,Yes,Yes,Yes,"11:56 AM 17th Jun,21",2021-06-17 11:56,21
"Civil Hospital, Sonipat (9050007668 )","Delhi Road, Near Maharana Pratap Chowk, Sonipat, Haryana 131001",Yes (192),182,0,10,10,190,0,10,10,Yes,Yes,Yes,Yes,Yes,"11:49 AM 17th Jun,21",2021-06-17 11:49,21
"CYGNUS HOSPITAL, Sonipat","Old Rohtak Rd, near Hindu College of Engineering, Industrial Area, Sonipat, Haryana 131001",Yes (20),18,0,2,1,18,0,2,1,Yes,No,Yes,Yes,Yes,"4:07 PM 25th Jun,21",2021-06-25 16:07,21
Dayanand Hospital-Sonepat,"Kakroi Rd, Prem Nagar, West Ram Nagar, Sonipat, Haryana",Yes (25),20,0,5,1,20,0,5,1,Yes,No,Yes,Yes,Yes,"11:32 AM 17th Jun,21",2021-06-17 11:32,21
FIIMS Hospital,"Road, Bahalgarh, Sonipat, Haryana 131304",Yes (99),63,0,36,6,63,0,37,8,Yes,No,Yes,Yes,Yes,"11:50 AM 17th Jun,21",2021-06-17 11:50,21
GAJRAJ HOSPITAL,"Bus Stand, Gajraj Hospital Road, Near, Gohana, Haryana 131301",Yes (20),20,0,0,0,20,0,0,0,Yes,To Be Updated,Yes,Yes,Yes,"11:51 AM 17th Jun,21",2021-06-17 11:51,21
HARYANA HOSPITAL,"Vivekanand Chowk, Delhi Rd, behind Bullet Showroom, Janta Colony, Sonipat, Haryana 131001",Yes (2),1,0,1,1,1,0,1,1,Yes,No,No,No,Yes,"8:46 AM 22nd Jun,21",2021-06-22 08:46,21
MEMORIAL HOSPITAL,"SH 11, near Mama Bhanja Chowk, Nandwani Nagar, Anand Nagar,, Sonipat, Haryana 131001",Yes (20),16,0,4,2,16,0,4,2,Yes,No,Yes,Yes,Yes,"9:40 AM 6th Jul,21",2021-07-06 09:40,21
NIDAAN HOSPITAL PVT.,"Murthal Rd, Sonipat, Haryana 131001",No (0),0,0,0,0,0,0,0,0,Yes,No,Yes,Yes,Yes,"11:52 AM 17th Jun,21",2021-06-17 11:52,21
OSCAR HOSPITAL,"SH 11, Lakshmi Nagar, Sonipat, Haryana 131001",Yes (20),12,0,8,2,12,0,8,2,Yes,No,Yes,Yes,Yes,"11:52 AM 17th Jun,21",2021-06-17 11:52,21
PHC PURKHAS,"Purkhas, Haryana 131102",Yes (30),0,30,0,0,0,30,0,0,To Be Updated,To Be Updated,To Be Updated,To Be Updated,To Be Updated,"11:52 AM 17th Jun,21",2021-06-17 11:52,21
"SANJIVNI HOSPITAL, SONIPAT","Mehlana Rd, Malviya Nagar, Sonipat, Haryana 131304",Yes (15),14,0,1,1,14,0,1,1,Yes,No,Yes,Yes,Yes,"6:22 PM 27th Jun,21",2021-06-27 18:22,21
SAXSENA HOSPITAL,"112/113, T.P. Scheme, Delhi Rd, Sonipat, Haryana 131304",Yes (23),18,0,5,2,18,0,5,2,Yes,No,Yes,Yes,Yes,"10:37 AM 2nd Jul,21",2021-07-02 10:37,21
SDH GOHANA,"Devi Nagar, Uttam Nagar, Gohana, Haryana 131301",Yes (10),10,0,0,0,10,0,0,0,Yes,Yes,Yes,Yes,Yes,"11:48 AM 17th Jun,21",2021-06-17 11:48,21
SITA HOSPITAL SONIPAT,"Railway Rd, Ganaur, Haryana 131101",Yes (20),20,0,0,0,20,0,0,0,Yes,No,Yes,Yes,Yes,"1:15 PM 26th Jun,21",2021-06-26 13:15,21
SUNHERI DEVI HOSPITAL,"Mission Rd, Dev Nagar, Sonipat, Haryana 131001",Yes (20),15,0,5,1,15,0,5,1,Yes,No,Yes,Yes,Yes,"11:53 AM 17th Jun,21",2021-06-17 11:53,21
TULIP HOSPITAL,"T. P. Scheme, no.15, Delhi Rd, Vivekanand chowk, Sonipat, Haryana 131001",Yes (20),0,0,20,5,0,0,20,5,Yes,No,Yes,Yes,Yes,"11:38 AM 25th Jun,21",2021-06-25 11:38,21
Balaji Gautam Hospital,"Model Colony, East Bhatia Nagar, Yamuna Nagar, Haryana",Yes (12),7,2,3,0,7,2,3,0,Yes,No,Yes,Yes,Yes,"11:29 PM 4th Dec,21",2021-12-04 23:29,22
Ch Lekh Raj Multispeciality Hospital,Vill Gadhauli Yamuna Nagar,Yes (150),140,0,10,5,140,0,10,5,Yes,Yes,Yes,Yes,Yes,"9:53 AM 27th Aug,21",2021-08-27 09:53,22
CHC Bilaspur,CHC Bilaspur,Yes (23),8,15,0,0,8,17,0,0,Yes,No,Yes,No,Yes,"8:55 AM 27th Sep,21",2021-09-27 08:55,22
CHC Chhachharuli,CHC Chhachharuli,Yes (30),10,20,0,0,10,20,0,0,Yes,No,Yes,Yes,Yes,"9:41 AM 27th Aug,21",2021-08-27 09:41,22
CHC Naharpur,Naharpur Yamuna Nagar,Yes (10),10,0,0,0,10,0,0,0,Yes,No,No,No,Yes,"9:54 AM 27th Aug,21",2021-08-27 09:54,22
CHC Partap Nagar,CHC Partap Nagar,Yes (16),6,10,0,0,6,10,0,0,Yes,No,Yes,No,Yes,"9:41 AM 27th Aug,21",2021-08-27 09:41,22
CHC Radaur,Radaur Yamuna Nagar,Yes (20),10,10,0,0,10,10,0,0,Yes,No,Yes,Yes,Yes,"9:53 AM 27th Aug,21",2021-08-27 09:53,22
CHC Saraswati Nagar,CHC Saraswati Nagar,Yes (25),14,11,0,0,14,11,0,0,Yes,No,Yes,No,Yes,"9:41 AM 27th Aug,21",2021-08-27 09:41,22
DABRA HOSPITAL Yamunanagar,DABRA HOSPITAL,Yes (23),11,8,4,2,11,8,4,2,No,No,No,No,No,"9:42 AM 27th Aug,21",2021-08-27 09:42,22
ESI Hospital,"ESI Hospital, Jagadhri",Yes (58),36,0,22,0,36,0,22,0,Yes,No,Yes,Yes,Yes,"9:40 AM 27th Aug,21",2021-08-27 09:40,22
Gaba Hospital,Gaba Hospital Yamunanagar,Yes (45),20,10,15,5,20,10,15,5,Yes,No,Yes,Yes,Yes,"9:12 AM 17th Sep,21",2021-09-17 09:12,22
GULATI HOSPITAL,GULATI HOSPITAL,Yes (32),23,3,6,0,25,3,6,0,Yes,No,Yes,Yes,Yes,"9:49 AM 27th Aug,21",2021-08-27 09:49,22
Heart Care Center Hospital,Near Lal Dwara Mandir Yamuna Nagar,Yes (19),2,2,15,7,2,2,15,7,Yes,No,Yes,Yes,Yes,"9:40 AM 27th Aug,21",2021-08-27 09:40,22
JP Hospital Pvt,"Jagadhri Rd, near Luxmi Theater, Vishwakarma Mohalla, Yamuna Nagar,HARAYANA Haryana",Yes (43),15,15,13,2,15,15,13,2,Yes,No,Yes,Yes,Yes,"9:40 AM 27th Aug,21",2021-08-27 09:40,22
KAPOOR HOSPITAL,"SH 6A Indira Colony Jagadhri, yamunanagart ,Haryana",Yes (12),4,0,8,0,4,0,8,0,Yes,No,Yes,Yes,Yes,"9:51 AM 27th Aug,21",2021-08-27 09:51,22
KESHWANI HOSPITAL,"Jagadhri - Yamuna Nagar Rd, Tagore Garden, Yamuna Nagar, Haryana",Yes (10),10,0,0,0,10,0,0,0,Yes,No,Yes,Yes,Yes,"9:54 AM 27th Aug,21",2021-08-27 09:54,22
Maxxwell Hospital,Jagadhari Yamuna Nagar,Yes (17),11,0,6,0,11,0,6,0,Yes,No,Yes,Yes,Yes,"9:49 AM 27th Aug,21",2021-08-27 09:49,22
Mukand Lal District Civil Hospital Yamunanagar,Mukand Lal District Civil Hospital YNR,Yes (24),15,9,0,5,18,9,0,5,Yes,No,Yes,Yes,Yes,"10:16 AM 9th Oct,21",2021-10-09 10:16,22
NIRMAL HOSPITAL,"199, Radaur Rd, near nirmal hospital, camp, Garhi Gujran, Haryana",Yes (20),13,1,6,0,13,1,6,0,Yes,No,Yes,Yes,Yes,"9:40 AM 27th Aug,21",2021-08-27 09:40,22
RK Gupta,opp DAV Sr Sec School Near Madhu Hotel YNR,Yes (17),0,2,15,0,0,2,15,0,Yes,Yes,Yes,Yes,Yes,"9:54 AM 27th Aug,21",2021-08-27 09:54,22
SABBARWAL HOSPITAL,"Gulab Nagar, Jagadhri, Haryana",Yes (12),6,0,6,0,6,0,6,0,Yes,No,Yes,Yes,Yes,"9:53 AM 27th Aug,21",2021-08-27 09:53,22
Sachdeva Hospital,"2227, Civil Lines Rd, Sri Nagar Colony, Civil Lines, Gomti Mohalla, Jagadhri, Haryana",Yes (28),16,8,4,0,16,8,4,0,Yes,No,Yes,Yes,Yes,"9:54 AM 27th Aug,21",2021-08-27 09:54,22
Santosh Hospital,"Santosh Hospital  Kanhaiya Sahib Chowk, near Govt.School, Harbanspura Colony, Gobind Pura, Yamuna Nagar, Haryana",Yes (28),5,9,14,2,5,9,14,2,Yes,No,Yes,Yes,Yes,"9:40 AM 27th Aug,21",2021-08-27 09:40,22
SHARMA HOSPITAL,Near Agarsain Chowk Jagadhri,Yes (12),12,0,0,0,12,0,0,0,Yes,No,Yes,Yes,Yes,"9:53 AM 27th Aug,21",2021-08-27 09:53,22
Shree Medical Care Hospital,"359/2, Jain nagar, Jagadhri, Haryana",Yes (15),15,0,0,0,15,0,0,0,Yes,Yes,Yes,Yes,Yes,"9:56 AM 27th Aug,21",2021-08-27 09:56,22
Shureshtha Hospital,Model Colony YNR,Yes (11),9,0,2,0,9,0,2,0,Yes,No,Yes,Yes,Yes,"9:53 AM 27th Aug,21",2021-08-27 09:53,22
SP Hospital Jag,S.P Hospital Jag,Yes (7),4,0,3,1,4,0,3,1,Yes,No,Yes,Yes,Yes,"9:49 AM 27th Aug,21",2021-08-27 09:49,22
