name,address,Availability_availability_of_beds,Availability_oxygen_beds,Availability_non_oxygen_beds,Availability_i_c_u_beds,Availability_ventilators,Allocated_oxygen_beds,Allocated_non_oxygen_beds,Allocated_i_c_u,Allocated_ventilators,Availability_availability_of_oxygen,Availability_antiviral_remdesivir_etc_,Availability_steroids,Availability_anticoagulant,Availability_antipyretic,updated_on_unparsed,updated_on,city
Adiyogi Arogya Avenue,"232, Subhash Nagar, Near civil hospital back gate, Jhajjar",Yes (15),7,2,6,1,7,2,6,1,To Be Updated,To Be Updated,Yes,Yes,Yes,"1:02 PM 14th Jun,21",2021-06-14 13:02,8
"Advanta Hospital, Jhajjar city","Silani Gate, Jhajjar, Haryana",Yes (50),24,10,16,1,24,10,16,1,Yes,To Be Updated,Yes,To Be Updated,Yes,"4:38 PM 9th Jun,21",2021-06-09 16:38,8
"Brahm Shakti Sanjivani Hospital, B.garh","Opp. BSNL Exchange, Delhi - Rohtak Road, NH9, Bahadurgarh, Haryana",Yes (100),60,20,20,3,60,20,20,3,Yes,No,Yes,Yes,Yes,"11:02 AM 15th Jun,21",2021-06-15 11:02,8
Civil Hospital Jhajjar,"Jhajjar, NH-71, Jhajjar Rohtak Road, Jhajjar, Jhajjar, Haryana",Yes (38),33,0,5,5,33,0,5,5,Yes,To Be Updated,To Be Updated,To Be Updated,To Be Updated,"8:53 AM 7th Sep,21",2021-09-07 08:53,8
"Delhi Hospital, Bahadurgarh","Rohtak Rd, near Shyamji Complex, Ram Nagar, Bahadurgarh, Haryana",Yes (50),20,20,10,2,20,20,10,2,Yes,No,Yes,Yes,Yes,"2:45 PM 1st Jun,21",2021-06-01 14:45,8
Dr. Sanjay Multi Speciality Hospital,INFRONT OF CIVIL HOSPITAL BAHADURGARH,Yes (61),45,10,6,1,45,10,6,1,Yes,No,No,To Be Updated,To Be Updated,"3:29 PM 30th Jun,21",2021-06-30 15:29,8
"Jeewan Jyoti Hospital, Bahadurgarh","Rohtak Rd, MIE Part-B, Bahadurgarh, Haryana",Yes (143),70,68,5,4,70,68,5,4,Yes,To Be Updated,To Be Updated,To Be Updated,To Be Updated,"11:19 AM 15th Jun,21",2021-06-15 11:19,8
"JK Hospital, Bahadurgarh","Bahadurgarh,, Bahamnoli, Bahadurgarh, Haryana",Yes (44),5,31,8,0,5,31,8,0,Yes,To Be Updated,Yes,Yes,Yes,"10:46 AM 17th Jun,21",2021-06-17 10:46,8
"Medicare Super Speciality Hospiatl &amp; Trauma Centre, Jhajjar City","Dadri road Jhajjar, Jhajjar, Haryana",Yes (50),15,23,12,3,15,23,12,3,Yes,To Be Updated,Yes,To Be Updated,Yes,"3:20 PM 15th Jul,21",2021-07-15 15:20,8
"Mission Hospital, Bahadurgarh","Near main Bus Stand & City Metro Station, Rohtak Rd, Bahadurgarh, Jhajjar ,Haryana",Yes (33),25,0,8,4,25,0,8,4,To Be Updated,No,Yes,Yes,No,"10:26 AM 13th Jun,21",2021-06-13 10:26,8
"Oscar Hospital, JJR city","Civil Road,Opp Civil Hospital, Jhajjar, Haryana",Yes (80),8,58,14,1,8,58,14,1,To Be Updated,To Be Updated,To Be Updated,To Be Updated,To Be Updated,"10:08 AM 16th Jun,21",2021-06-16 10:08,8
Oxymus Hospital,"Opposite Civil Hospital, Near Metro Pollar No. 876 Delhi Rohtak Road, Bahadurgarh",Yes (10),4,0,6,0,4,0,6,0,Yes,No,No,No,No,"5:58 PM 6th Jun,21",2021-06-06 17:58,8
"Rana Hospital, Bahadurgarh","OPP. REST HOUSE,OLD BARAHI ROAD, BAHADURGARH",Yes (25),18,0,7,2,18,0,7,2,To Be Updated,To Be Updated,No,No,Yes,"8:47 AM 22nd Jun,21",2021-06-22 08:47,8
"RJ Super Speciality Hospital, B.garh","Delhi - Rohtak Rd, Near Rajesh Joon Office, Dalbir Nagar, Bahadurgarh, Haryana",Yes (17),10,5,2,1,10,5,2,1,Yes,No,Yes,Yes,Yes,"5:05 PM 1st Jul,21",2021-07-01 17:05,8
RS GAUR GLOBAL MULTISPECIALITY HOSPITAL,"Jhajjar Road Netaji Subhash Vihar, Haryana",Yes (33),19,7,7,2,19,7,7,2,Yes,No,Yes,Yes,Yes,"10:19 AM 15th Jun,21",2021-06-15 10:19,8
"SDH, Bahadurgarh","Madhya Marg, Old Industrial Area, Bahadurgarh, Haryana",Yes (35),27,0,8,8,27,0,8,8,Yes,Yes,Yes,No,Yes,"12:46 PM 15th Jun,21",2021-06-15 12:46,8
"Shivam Hospital, B.garh","Line Par, Shastri Nagar, Netaji Nagar, Bahadurgarh, Haryana",Yes (51),30,15,6,1,30,15,6,1,Yes,No,Yes,Yes,Yes,"4:57 PM 13th Jun,21",2021-06-13 16:57,8
"Swastik Hospital, Bahadurgarh","Jhajjar Rd, Shakti Nagar, Sakti Nagar, Bahadurgarh, Haryana",Yes (40),26,4,10,2,26,4,10,2,Yes,No,Yes,Yes,Yes,"9:19 AM 17th Jun,21",2021-06-17 09:19,8
World College Of Medical Sciences And Hospital,"Jhajjar Sampla Road, Gurwar, Jhajjar, Haryana",Yes (250),90,135,25,4,90,135,25,4,Yes,Yes,Yes,Yes,Yes,"9:05 PM 18th Jun,21",2021-06-18 21:05,8
ASHIRWAD BHAGAT HOSPITAL,"Old DC Rd, near bhagat hospital, Sonipat, Haryana 131001",Yes (15),12,0,3,1,12,0,3,1,Yes,Yes,Yes,Yes,Yes,"11:47 AM 17th Jun,21",2021-06-17 11:47,21
Bhagwan Dass Hospital,"Near Shahpur Turk, block-E, omaxe city, Sector 18, Sonipat, Haryana 131001",Yes (40),27,0,13,2,27,0,13,2,Yes,No,Yes,Yes,Yes,"11:47 AM 17th Jun,21",2021-06-17 11:47,21
"BPS MEDICAL COLLEGE KHANPUR , SONIPAT ( 01263283088)","Ganaur - Gohana Rd, Khanpur Kalan, Haryana",Yes (300),170,80,50,50,170,80,50,50,Yes,Yes,Yes,Yes,Yes,"7:53 AM 16th Aug,21",2021-08-16 07:53,21
CHC GANUR,CHC GANUR,Yes (8),8,0,0,0,8,0,0,0,Yes,No,Yes,Yes,Yes,"11:48 AM 17th Jun,21",2021-06-17 11:48,21
CHC Kharkhoda,"SH 20, Kharkhoda, Haryana 131402",Yes (10),5,5,0,0,5,5,0,0,To Be Updated,To Be Updated,Yes,Yes,Yes,"11:49 AM 17th Jun,21",2021-06-17 11:49,21
"CHC, JUAN, SONIPAT, HARYANA","CHC, JUAN, SONIPAT, HARYANACHC, JUAN, SONIPAT, HARYANA, 131024",Yes (5),3,2,0,0,3,2,0,0,Yes,No,Yes,Yes,Yes,"11:56 AM 17th Jun,21",2021-06-17 11:56,21
"Civil Hospital, Sonipat (9050007668 )","Delhi Road, Near Maharana Pratap Chowk, Sonipat, Haryana 131001",Yes (192),182,0,10,10,190,0,10,10,Yes,Yes,Yes,Yes,Yes,"11:49 AM 17th Jun,21",2021-06-17 11:49,21
"CYGNUS HOSPITAL, Sonipat","Old Rohtak Rd, near Hindu College of Engineering, Industrial Area, Sonipat, Haryana 131001",Yes (20),18,0,2,1,18,0,2,1,Yes,No,Yes,Yes,Yes,"4:07 PM 25th Jun,21",2021-06-25 16:07,21
Dayanand Hospital-Sonepat,"Kakroi Rd, Prem Nagar, West Ram Nagar, Sonipat, Haryana",Yes (25),20,0,5,1,20,0,5,1,Yes,No,Yes,Yes,Yes,"11:32 AM 17th Jun,21",2021-06-17 11:32,21
FIIMS Hospital,"Road, Bahalgarh, Sonipat, Haryana 131304",Yes (99),63,0,36,6,63,0,37,8,Yes,No,Yes,Yes,Yes,"11:50 AM 17th Jun,21",2021-06-17 11:50,21
GAJRAJ HOSPITAL,"Bus Stand, Gajraj Hospital Road, Near, Gohana, Haryana 131301",Yes (20),20,0,0,0,20,0,0,0,Yes,To Be Updated,Yes,Yes,Yes,"11:51 AM 17th Jun,21",2021-06-17 11:51,21
HARYANA HOSPITAL,"Vivekanand Chowk, Delhi Rd, behind Bullet Showroom, Janta Colony, Sonipat, Haryana 131001",Yes (2),1,0,1,1,1,0,1,1,Yes,No,No,No,Yes,"8:46 AM 22nd Jun,21",2021-06-22 08:46,21
MEMORIAL HOSPITAL,"SH 11, near Mama Bhanja Chowk, Nandwani Nagar, Anand Nagar,, Sonipat, Haryana 131001",Yes (20),16,0,4,2,16,0,4,2,Yes,No,Yes,Yes,Yes,"9:40 AM 6th Jul,21",2021-07-06 09:40,21
NIDAAN HOSPITAL PVT.,"Murthal Rd, Sonipat, Haryana 131001",No (0),0,0,0,0,0,0,0,0,Yes,No,Yes,Yes,Yes,"11:52 AM 17th Jun,21",2021-06-17 11:52,21
OSCAR HOSPITAL,"SH 11, Lakshmi Nagar, Sonipat, Haryana 131001",Yes (20),12,0,8,2,12,0,8,2,Yes,No,Yes,Yes,Yes,"11:52 AM 17th Jun,21",2021-06-17 11:52,21
PHC PURKHAS,"Purkhas, Haryana 131102",Yes (30),0,30,0,0,0,30,0,0,To Be Updated,To Be Updated,To Be Updated,To Be Updated,To Be Updated,"11:52 AM 17th Jun,21",2021-06-17 11:52,21
"SANJIVNI HOSPITAL, SONIPAT","Mehlana Rd, Malviya Nagar, Sonipat, Haryana 131304",Yes (15),14,0,1,1,14,0,1,1,Yes,No,Yes,Yes,Yes,"6:22 PM 27th Jun,21",2021-06-27 18:22,21
SAXSENA HOSPITAL,"112/113, T.P. Scheme, Delhi Rd, Sonipat, Haryana 131304",Yes (23),18,0,5,2,18,0,5,2,Yes,No,Yes,Yes,Yes,"10:37 AM 2nd Jul,21",2021-07-02 10:37,21
SDH GOHANA,"Devi Nagar, Uttam Nagar, Gohana, Haryana 131301",Yes (10),10,0,0,0,10,0,0,0,Yes,Yes,Yes,Yes,Yes,"11:48 AM 17th Jun,21",2021-06-17 11:48,21
SITA HOSPITAL SONIPAT,"Railway Rd, Ganaur, Haryana 131101",Yes (20),20,0,0,0,20,0,0,0,Yes,No,Yes,Yes,Yes,"1:15 PM 26th Jun,21",2021-06-26 13:15,21
SUNHERI DEVI HOSPITAL,"Mission Rd, Dev Nagar, Sonipat, Haryana 131001",Yes (20),15,0,5,1,15,0,5,1,Yes,No,Yes,Yes,Yes,"11:53 AM 17th Jun,21",2021-06-17 11:53,21
TULIP HOSPITAL,"T. P. Scheme, no.15, Delhi Rd, Vivekanand chowk, Sonipat, Haryana 131001",Yes (20),0,0,20,5,0,0,20,5,Yes,No,Yes,Yes,Yes,"11:38 AM 25th Jun,21",2021-06-25 11:38,21
"AADHAR Hospital, Hisar",Tosham Road Hisar,Yes (44),26,6,12,6,26,6,12,6,Yes,No,Yes,Yes,Yes,"6:59 AM 7th Sep,21",2021-09-07 06:59,7
Bharat Multispeciality Hospital,Hisar,Yes (26),24,0,2,2,24,0,2,2,Yes,No,Yes,Yes,Yes,"12:54 PM 28th Sep,21",2021-09-28 12:54,7
Central Medical Centre (CMC),CMC Hospital Delhi Road Hisar,Yes (62),47,5,10,3,47,5,10,3,Yes,Yes,Yes,Yes,Yes,"1:16 PM 24th Sep,21",2021-09-24 13:16,7
Ch. Devi Lal Sanjeevani Make Shift Covid Hopsital Hisar,Near Jindal School Hisar,Yes (500),500,0,0,0,500,0,0,0,Yes,No,Yes,No,Yes,"6:56 AM 5th Aug,21",2021-08-05 06:56,7
Churamani Hospital,CAMP CHOWK HISAR,Yes (37),5,2,30,5,5,2,30,5,No,No,No,No,No,"12:50 PM 28th Sep,21",2021-09-28 12:50,7
District Civil Hospital Hisar,Sirsa Road Hisar,Yes (83),80,0,3,17,80,0,3,17,Yes,Yes,Yes,Yes,Yes,"9:42 AM 20th Sep,21",2021-09-20 09:42,7
DR. ANANTRAM JANTA HOSPITAL PVT LTD BARWALA,Civil Hospital Road Barwala,Yes (17),17,0,0,3,17,0,0,3,Yes,No,Yes,Yes,Yes,"12:37 PM 28th Jul,21",2021-07-28 12:37,7
Geetanjali Hospital,Model Town Hisar,Yes (47),40,0,7,5,40,0,7,5,Yes,Yes,Yes,Yes,Yes,"2:37 PM 28th Sep,21",2021-09-28 14:37,7
Goswami Hospital,"NEAR BUS STAND, RISHI NAGAR",Yes (9),4,5,0,1,4,5,0,1,Yes,No,Yes,Yes,Yes,"7:04 AM 4th Aug,21",2021-08-04 07:04,7
Gupta Hospital Hisar,Sector 14 Hisar,Yes (35),30,0,5,0,30,0,5,0,Yes,Yes,Yes,No,Yes,"9:18 AM 24th Oct,21",2021-10-24 09:18,7
"GURU JAMBHESHWAR MULTISPECIALITY HOSPITAL, AGROHA","ADAMPUR ROAD, AGROHA",Yes (14),9,3,2,1,9,3,2,1,Yes,No,Yes,Yes,Yes,"10:53 AM 16th Sep,21",2021-09-16 10:53,7
Holy Help Hospital,Tosham Road Hisar,Yes (39),25,6,8,1,25,6,8,1,Yes,No,Yes,Yes,Yes,"12:37 PM 28th Jul,21",2021-07-28 12:37,7
Janki Children Hospital Hisar,Near Sewak Sabha Hopsital Hisar,Yes (3),0,1,2,2,0,1,2,2,Yes,No,Yes,Yes,Yes,"12:39 PM 28th Jul,21",2021-07-28 12:39,7
KARTIK HOSPITAL,"NEAR SEWAK SABHA HOSPITAL AND  BUDLA SANT MANDIR, NEAR BUS STAND HISAR",Yes (15),8,5,2,2,8,5,2,2,Yes,No,Yes,To Be Updated,To Be Updated,"12:51 PM 16th Sep,21",2021-09-16 12:51,7
Mahatma Gandhi Hospital,,Yes (42),19,13,10,8,19,13,10,8,Yes,Yes,Yes,Yes,Yes,"12:54 PM 28th Sep,21",2021-09-28 12:54,7
MALIK HOSPITAL,"145A UTTAM NAGAR, HANSI",Yes (7),7,0,0,3,7,0,0,3,Yes,Yes,No,To Be Updated,To Be Updated,"12:54 PM 28th Sep,21",2021-09-28 12:54,7
MAMC Agroha,"Maharaj Aggarsin Medical College, VPO Agroha",Yes (140),85,15,40,60,85,15,40,60,To Be Updated,To Be Updated,To Be Updated,To Be Updated,To Be Updated,"9:09 AM 14th Oct,21",2021-10-14 09:09,7
Military Hospital Hisar,Cantt Hisar,Yes (57),15,40,2,3,15,42,2,3,Yes,To Be Updated,Yes,Yes,Yes,"4:05 PM 29th Oct,21",2021-10-29 16:05,7
NEKIRAM HOSPITAL,OPP BUS STAND HANSI,Yes (5),2,0,3,3,2,0,3,3,Yes,No,Yes,To Be Updated,To Be Updated,"7:09 AM 14th Aug,21",2021-08-14 07:09,7
Noble Super Specialty Hospital,Hisar,Yes (19),12,0,7,1,12,0,7,1,Yes,No,Yes,To Be Updated,Yes,"12:55 PM 28th Sep,21",2021-09-28 12:55,7
OPJindal Institute of Cancer &amp; Research Hospital,Model Town Hisar,Yes (145),100,4,41,45,100,4,41,45,Yes,No,Yes,Yes,Yes,"12:36 PM 28th Jul,21",2021-07-28 12:36,7
PARDEEP KANSAL MULTISPECIALITY HOSPITAL FOR CHILDREN,"25- Inderprastha Colony, Hisar",Yes (13),0,6,7,3,0,6,7,3,Yes,No,Yes,Yes,Yes,"12:38 PM 28th Jul,21",2021-07-28 12:38,7
Parnami Hospital,Hisar,Yes (28),21,5,2,2,21,5,2,2,Yes,Yes,Yes,Yes,Yes,"10:18 AM 27th Sep,21",2021-09-27 10:18,7
Ravindra Hospital Hisar,Model Town HISAR,Yes (21),19,0,2,1,19,0,2,1,Yes,No,Yes,Yes,Yes,"12:25 PM 14th Sep,21",2021-09-14 12:25,7
SAANVI HOSPITAL,"CHC ROAD, BARWALA",Yes (9),5,0,4,1,5,0,4,1,Yes,No,Yes,To Be Updated,To Be Updated,"7:01 AM 31st Aug,21",2021-08-31 07:01,7
SAMAYARA HOSPITAL,"KALI DEVI CHOWK. OPP BHALLA PETROL PUMP, HANSI",Yes (9),4,0,5,1,4,0,5,1,Yes,No,Yes,To Be Updated,To Be Updated,"7:12 AM 26th Jun,21",2021-06-26 07:12,7
Sapra Hospital,Rajgarh Road Hisar,Yes (28),19,3,6,12,19,3,6,12,Yes,Yes,Yes,No,Yes,"11:34 AM 24th Sep,21",2021-09-24 11:34,7
"Sarvodya Hospital, Hisar",Delhi Road Hisar,Yes (32),24,7,1,3,24,7,1,3,Yes,Yes,Yes,Yes,Yes,"10:17 AM 27th Sep,21",2021-09-27 10:17,7
Sewak Sabha Hospital,Near Bus Stand Hisar,Yes (27),16,3,8,1,16,3,8,1,Yes,Yes,Yes,Yes,Yes,"10:18 AM 27th Sep,21",2021-09-27 10:18,7
Shanti Devi Hospital,Delhi Road Hisar,Yes (38),26,0,12,2,26,0,12,2,Yes,No,Yes,Yes,Yes,"10:15 AM 27th Sep,21",2021-09-27 10:15,7
Shri Kali Devi Hospital Hansi,Delhi Road Hansi,Yes (13),8,0,5,0,8,0,5,0,Yes,No,Yes,Yes,Yes,"7:18 AM 20th Jun,21",2021-06-20 07:18,7
SINGLA MULTISPECIALITY HOSPITAL,"RISHI NAGAR, GALI NO. 1, NEAR BUS STAND, HISAR",Yes (19),17,0,2,1,17,0,2,1,Yes,No,Yes,Yes,Yes,"12:49 PM 27th Sep,21",2021-09-27 12:49,7
SL Minda Hospital,VPO Bagla,Yes (8),6,0,2,2,6,0,2,2,Yes,No,Yes,Yes,Yes,"12:51 PM 28th Sep,21",2021-09-28 12:51,7
Sonakshi Children Hospital Hansi,"G T Road, Near Kali Devi Mandir, Opp Bhalla Patrol Pump, Hansi",Yes (13),9,0,4,1,9,0,4,1,Yes,No,Yes,Yes,Yes,"7:12 AM 26th Jun,21",2021-06-26 07:12,7
Sukhda Multispeciality Hospital,Dabra Chowk Hisar,Yes (68),46,4,18,6,46,4,18,6,Yes,Yes,Yes,Yes,Yes,"7:03 AM 19th Aug,21",2021-08-19 07:03,7
Vardaan Hospital Hisar,Hisar,Yes (21),9,1,11,2,9,1,11,2,Yes,Yes,Yes,Yes,Yes,"5:25 PM 21st Oct,21",2021-10-21 17:25,7
ABLE HOSPITAL,,Yes (37),10,25,2,2,10,25,2,5,Yes,No,Yes,Yes,Yes,"3:08 PM 26th May,21",2021-05-26 15:08,15
Apex Hospital,"Prakash Vihar, Delhi Mathura Road, Palwal, Haryana",Yes (19),13,0,6,2,13,0,6,2,Yes,No,Yes,Yes,Yes,"10:07 AM 31st May,21",2021-05-31 10:07,15
ATLAS HOSPITAL,"Palwal, Haryana",Yes (14),1,11,2,2,2,11,2,2,To Be Updated,To Be Updated,To Be Updated,To Be Updated,To Be Updated,"11:02 AM 29th May,21",2021-05-29 11:02,15
BIKAL HOSPITAL,"PALWAL, HARYANA",Yes (21),13,5,3,0,13,5,3,0,Yes,No,Yes,Yes,Yes,"2:57 PM 23rd Jun,21",2021-06-23 14:57,15
CHC Alawalpur,CHC Alawalpur,Yes (17),1,16,0,0,4,16,0,0,To Be Updated,To Be Updated,To Be Updated,To Be Updated,To Be Updated,"6:55 PM 18th May,21",2021-05-18 18:55,15
Civil Hospital Palwal,"Civil Hospital, palwal",Yes (110),103,0,7,7,103,0,7,7,Yes,To Be Updated,To Be Updated,To Be Updated,To Be Updated,"12:24 PM 20th Dec,21",2021-12-20 12:24,15
COSMOS HOSPITAL,PALWAL,Yes (10),5,5,0,0,5,5,0,0,To Be Updated,To Be Updated,To Be Updated,To Be Updated,To Be Updated,"12:02 PM 16th May,21",2021-05-16 12:02,15
GALAXY HOSPITAL,HUDA SECTOR 2,Yes (21),5,0,16,11,5,0,16,11,Yes,No,Yes,Yes,Yes,"5:22 PM 16th Jun,21",2021-06-16 17:22,15
"Gurunanak Hospital, Palwal","NH2, Near Bus Stand, Shiv Colony, Palwal Haryana",Yes (37),18,4,15,3,18,4,15,3,Yes,Yes,Yes,Yes,Yes,"5:07 PM 7th Jun,21",2021-06-07 17:07,15
JINDAL HOSPITAL,"Palwal, Haryana",Yes (15),10,2,3,0,10,2,3,0,To Be Updated,No,Yes,Yes,Yes,"12:53 PM 19th May,21",2021-05-19 12:53,15
NIDHI HOSPITAL,"Palwal, Haryana",Yes (12),2,7,3,0,2,7,3,0,Yes,No,Yes,Yes,Yes,"12:42 PM 19th May,21",2021-05-19 12:42,15
Palwal Hospital,"Moti Colony, Palwal, Haryana",Yes (22),0,6,16,1,0,6,16,1,Yes,No,Yes,Yes,Yes,"2:19 PM 28th May,21",2021-05-28 14:19,15
RAHUL HOSPITAL,PALWAL,Yes (15),7,5,3,0,7,5,3,0,Yes,No,Yes,Yes,Yes,"4:20 PM 13th May,21",2021-05-13 16:20,15
Sachin Hospital,"New Sohna Road, Near Panchwati Chowk, Palwal Haryana",Yes (28),10,5,13,2,10,5,13,2,Yes,Yes,Yes,Yes,Yes,"9:29 AM 14th Jun,21",2021-06-14 09:29,15
SDH Hodal,SDH Hodal,Yes (20),10,10,0,0,10,10,0,0,Yes,No,Yes,Yes,Yes,"11:45 AM 1st Jun,21",2021-06-01 11:45,15
Shri. Satya Sai Sanjivani Hospital Palwal,"Palwal, Haryana",Yes (23),4,16,3,2,4,17,4,2,Yes,No,Yes,Yes,Yes,"5:13 PM 2nd Jun,21",2021-06-02 17:13,15
SRI SAI HOSPITAL,"Palwal, Haryana",Yes (6),0,6,0,0,0,6,0,0,Yes,No,Yes,Yes,Yes,"10:08 AM 2nd Jun,21",2021-06-02 10:08,15
VASHU HOSPITAL,,Yes (10),10,0,0,0,10,0,0,0,Yes,No,Yes,Yes,Yes,"12:53 PM 19th May,21",2021-05-19 12:53,15
Anchal Multispeciality Hospital,"Anchal Multi speciality Hospital, Krishna Colony, Bhiwani, Haryana 127027",Yes (35),25,0,10,2,25,0,10,2,Yes,Yes,Yes,Yes,Yes,"11:34 AM 5th Jul,21",2021-07-05 11:34,2
Ch. Bansilal Govt Hospital,"Bansi Lal General Hospital, Ghanta Ghar Chowk, SH 17, Krishna Colony, Bhiwani, Haryana 127021",Yes (171),139,5,27,16,139,5,28,16,Yes,Yes,Yes,Yes,Yes,"11:20 AM 5th Jul,21",2021-07-05 11:20,2
Chugh Hospital,"Meham Gate, Circular Road, Bhiwani",Yes (20),20,0,0,0,20,0,0,0,Yes,Yes,Yes,Yes,Yes,"12:08 PM 5th Jul,21",2021-07-05 12:08,2
ESI Hospital Bhiwani,"Stadium Rd, Housing Board Colony, Bhiwani, Haryana 127021",Yes (40),0,40,0,0,0,40,0,0,No,No,Yes,Yes,Yes,"11:34 AM 5th Jul,21",2021-07-05 11:34,2
Ganpatrai Hospital,"SH 17, Bank Colony, Bound Kalan, Krishna Colony, Bhiwani, Haryana 127021",Yes (10),4,4,2,1,4,4,2,1,Yes,No,Yes,Yes,Yes,"11:34 AM 5th Jul,21",2021-07-05 11:34,2
Jangra Multispecilaity Hospital,"Bank Colony, Old Bharat Nagar, Bhiwani, Haryana 127021",Yes (10),7,3,0,0,7,3,0,0,Yes,No,Yes,Yes,Yes,"12:06 PM 5th Jul,21",2021-07-05 12:06,2
Jeevan Nursing Home-Bhiwani,Rohtak gate Bhiwani,Yes (10),3,4,3,0,3,4,3,0,Yes,Yes,Yes,Yes,Yes,"12:09 PM 5th Jul,21",2021-07-05 12:09,2
Jeevanrekha Hospital,Near Railway Road Bhiwani,Yes (30),25,0,5,1,25,0,5,1,To Be Updated,To Be Updated,To Be Updated,To Be Updated,To Be Updated,"12:09 PM 5th Jul,21",2021-07-05 12:09,2
Kadam Hospital,"Bank Colony Near New Bus Stand, Bhiwani",Yes (45),11,0,34,1,11,0,34,1,Yes,Yes,Yes,Yes,Yes,"11:34 AM 5th Jul,21",2021-07-05 11:34,2
Krishan Lal Jalan Hospital,"Jalan Nagar, M.C.Colony, Bhiwani, Haryana 127021",Yes (40),20,20,0,0,20,20,0,0,Yes,Yes,Yes,Yes,Yes,"12:06 PM 5th Jul,21",2021-07-05 12:06,2
Life Line Hospital,"Circular Rd, M.C.Colony, Bhiwani, Haryana 127021",Yes (27),21,0,6,0,21,0,6,0,Yes,Yes,Yes,Yes,Yes,"12:06 PM 5th Jul,21",2021-07-05 12:06,2
RPS HOSPITAL,,Yes (24),4,16,4,0,4,16,4,0,Yes,No,Yes,Yes,Yes,"12:06 PM 5th Jul,21",2021-07-05 12:06,2
Sharma Nursing and Maternity Home Tosham,Siwani Road Tosham,Yes (10),7,0,3,2,7,0,3,2,Yes,Yes,To Be Updated,Yes,Yes,"12:09 PM 5th Jul,21",2021-07-05 12:09,2
Shree Ganesha Hospital,"Dadri Gate, Bhiwani",Yes (13),6,3,4,0,6,3,4,0,Yes,Yes,Yes,Yes,Yes,"12:08 PM 5th Jul,21",2021-07-05 12:08,2
"SHRI BABA YOGI NETANATH HOSPITAL , LOHANI ,BHIWANI",VPO Lohani,Yes (50),35,5,10,2,35,5,10,2,Yes,Yes,Yes,Yes,Yes,"12:09 PM 5th Jul,21",2021-07-05 12:09,2
Shri Ram Hospital,Siwani,Yes (11),0,0,11,4,0,0,11,4,To Be Updated,To Be Updated,To Be Updated,To Be Updated,To Be Updated,"12:09 PM 5th Jul,21",2021-07-05 12:09,2
SMSG Multispeciality Hospital,"Rohtak Gate, Bhiwani",Yes (30),2,17,11,2,2,17,11,2,Yes,Yes,Yes,Yes,Yes,"12:08 PM 5th Jul,21",2021-07-05 12:08,2
Spes Hospital,"Circular Rd, Bound Kalan, M.C.Colony, Bhiwani, Haryana 127021",Yes (22),4,6,12,1,4,6,12,1,Yes,Yes,Yes,Yes,Yes,"12:07 PM 5th Jul,21",2021-07-05 12:07,2
GH Charkhi Dadri,"Near Loharu Chowk,Charkhi Dadri",Yes (51),35,15,1,11,35,15,1,11,Yes,Yes,Yes,Yes,Yes,"3:39 PM 21st Jun,21",2021-06-21 15:39,3
Jaihind Hospital,Charkhi Dadri,Yes (13),7,1,5,0,7,1,5,0,Yes,Yes,Yes,To Be Updated,To Be Updated,"3:41 PM 21st Jun,21",2021-06-21 15:41,3
Murari Lal Rasiwasia Ayurvedic Hospital,"Delhi Road,Near Janta College",Yes (70),60,10,0,0,60,10,0,0,Yes,Yes,Yes,Yes,Yes,"3:39 PM 21st Jun,21",2021-06-21 15:39,3
Oscar Hospital,Charkhi Dadri,Yes (20),0,0,20,0,0,0,20,0,To Be Updated,To Be Updated,To Be Updated,To Be Updated,To Be Updated,"3:40 PM 21st Jun,21",2021-06-21 15:40,3
Pradhan Medicare Centre,"Loharu Rd, Charkhi Dadri, Haryana",Yes (17),14,0,3,0,14,0,3,0,To Be Updated,Yes,Yes,Yes,Yes,"3:39 PM 21st Jun,21",2021-06-21 15:39,3
Sunflag Hospital,Charkhi Dadri,Yes (12),6,0,6,0,6,0,6,0,To Be Updated,To Be Updated,To Be Updated,To Be Updated,To Be Updated,"3:40 PM 21st Jun,21",2021-06-21 15:40,3
Advanta Super Speciality Hospital,Near Power House,Yes (39),25,0,14,4,25,0,14,4,Yes,No,Yes,Yes,Yes,"5:05 PM 14th Jul,21",2021-07-14 17:05,19
ARS Holy Heart Advanced Cardiac care &amp; Research Centre,"330, Vinay Nagar Rohtak, Near Delhi Bypass Rohtak",Yes (20),0,0,20,2,0,0,20,2,Yes,No,No,No,No,"9:25 AM 1st Jul,21",2021-07-01 09:25,19
CHC Chiri,"VOP Chiri, Meham Gohana Road, Distt. Rohtak Haryana",Yes (10),10,0,0,0,10,0,0,0,Yes,Yes,Yes,Yes,Yes,"4:01 PM 15th Jul,21",2021-07-15 16:01,19
CHC Kahanaur,"Near Sarva haryana Gramin Bank, Opp. Banquet hall, Nigana Road, Kahanaur",Yes (10),4,6,0,0,4,6,0,0,Yes,No,Yes,No,Yes,"9:11 AM 16th Jul,21",2021-07-16 09:11,19
CHC kalanaur,"Police Station, Bhiwani-Rohtak Road , Near Kalanaur kalan, Kalanaur,",Yes (10),10,0,0,0,10,0,0,0,Yes,No,Yes,No,Yes,"1:54 PM 26th Jun,21",2021-06-26 13:54,19
CHC Kiloi,"VPO Kiloi, Water Works, Distt. Rohtak",Yes (10),5,5,0,0,5,5,0,0,Yes,No,Yes,No,Yes,"9:41 AM 1st Jul,21",2021-07-01 09:41,19
CHC Madina,"VPO Madina, Hisar Road Distt. Rohtak, Haryana",Yes (10),0,10,0,0,0,10,0,0,Yes,No,No,No,Yes,"9:32 AM 10th Jul,21",2021-07-10 09:32,19
CHC Meham,"Near ITI, Meham Distt. Rohtak",Yes (10),10,0,0,0,10,0,0,0,Yes,No,Yes,No,Yes,"10:56 AM 30th Jul,21",2021-07-30 10:56,19
CHC Sampla,"Gadi Sampla, Rohtak, SH-20, Jhajjar Sampla Road, Sampla, Sampla, Haryana 124501",Yes (10),0,10,0,0,0,10,0,0,No,No,Yes,No,Yes,"8:15 AM 5th Oct,21",2021-10-05 08:15,19
"Civil Hospital, Rohtak",Subash Road,Yes (71),40,24,7,5,40,24,7,5,Yes,Yes,Yes,Yes,Yes,"9:15 AM 26th Jun,21",2021-06-26 09:15,19
Holy Heart Super speciality Hospital,Vinay Nagar Delhi Bye pass,Yes (57),25,5,27,6,25,5,27,6,Yes,No,Yes,Yes,Yes,"9:16 AM 1st Jul,21",2021-07-01 09:16,19
"Hridaya Nilayam Heart, Lung &amp; vascular Institute","5, Raj Garden, Delhi Bypass, Rohtak",Yes (25),0,0,25,2,0,0,25,2,To Be Updated,To Be Updated,To Be Updated,To Be Updated,To Be Updated,"8:02 AM 16th Jun,21",2021-06-16 08:02,19
Joyline Multispeciality,"Surajmal Colony, Sunarian Road, Opposite Birgadier Muktram Statue Rohtak",Yes (20),15,0,5,1,15,0,5,1,Yes,Yes,Yes,Yes,Yes,"10:33 AM 21st Nov,21",2021-11-21 10:33,19
Kainos Hospital,Near Kheri Sadh Village Outer Bye Pass,Yes (70),26,10,34,17,26,10,34,17,Yes,No,Yes,Yes,Yes,"9:14 AM 2nd Jul,21",2021-07-02 09:14,19
Life Care Hospital,Subash Nagar,Yes (50),30,0,20,6,30,0,20,6,Yes,No,Yes,Yes,Yes,"6:03 PM 15th Jul,21",2021-07-15 18:03,19
Maan Hospital,Bhagwan Colony Near Radio Station,Yes (45),29,0,16,6,29,0,16,6,Yes,No,Yes,Yes,Yes,"9:56 AM 21st Jun,21",2021-06-21 09:56,19
Mansarover Hospital,Mansarover Colony Near Park,Yes (30),20,0,10,7,20,0,10,7,Yes,No,Yes,Yes,Yes,"9:49 AM 5th Jul,21",2021-07-05 09:49,19
Neurocentre Super Speciality Hospital,"Kalawati Bulding, Near Power House Rohtak",Yes (23),4,6,13,2,4,6,13,2,Yes,No,Yes,Yes,Yes,"4:18 PM 27th Jun,21",2021-06-27 16:18,19
Noble Heart Super Speciality Hospital,Near Raj Garden Delhi Bye Pass,Yes (34),26,1,7,6,26,1,7,6,Yes,No,Yes,Yes,Yes,"9:36 AM 21st Jun,21",2021-06-21 09:36,19
Oscar Super Speciality Trauma Center,"Medical Moad, Daryao Singh Nagar,",Yes (41),23,3,15,2,23,3,15,2,Yes,Yes,Yes,Yes,Yes,"9:51 AM 21st Jun,21",2021-06-21 09:51,19
Oxygen Hospital,Islam Pura Daries Hisar Road,Yes (30),15,10,5,4,15,10,5,4,Yes,No,Yes,Yes,Yes,"10:49 AM 23rd Jun,21",2021-06-23 10:49,19
PGIMS Rohtak,"Pt.Bhagwat Dayal PGIMS, Medical Rd, Rohtak, Haryana",Yes (565),451,0,114,114,451,0,115,115,Yes,Yes,Yes,Yes,Yes,"9:26 AM 24th Dec,21",2021-12-24 09:26,19
Positron Hospital,Suncity Sector 35,Yes (32),0,16,16,4,0,16,16,4,Yes,No,No,Yes,Yes,"5:02 PM 28th Jun,21",2021-06-28 17:02,19
Pragati Hospital,"Sukhpura Chowk, Gohana Road, opp. Ladhot Road Rohtak",Yes (15),11,0,4,1,11,0,4,1,Yes,No,Yes,Yes,Yes,"5:06 PM 14th Jul,21",2021-07-14 17:06,19
"Sanghi Nursing Home, Rohtak, Haryana","Chotu Ram Chowk, Civil Road, Arya Nagar, Rohtak, Haryana",Yes (14),10,0,4,4,10,0,4,4,Yes,Yes,Yes,Yes,Yes,"10:42 AM 27th Jun,21",2021-06-27 10:42,19
Shivam Liver &amp; Gastro Super Speciality Hospital,"CIVIL ROAD NEAR SHANT MAI CHOWK, Rohtak, Haryana - 124001, India",Yes (9),5,0,4,1,5,0,4,1,Yes,No,Yes,Yes,Yes,"8:36 AM 31st Jul,21",2021-07-31 08:36,19
Sunflag Global Hospital,Bharat Colony Near Sheela Bye Pass,Yes (35),20,0,15,5,20,0,15,5,Yes,No,Yes,Yes,Yes,"9:27 AM 25th Jun,21",2021-06-25 09:27,19
Aashirwad Hospital,101 Devi Murti Colony Panipat,Yes (9),2,0,7,1,2,0,7,1,Yes,No,Yes,Yes,Yes,"10:46 AM 21st Dec,21",2021-12-21 10:46,17
Aayushmaan Bhav Hospital,"GT Road Sewah, Near Police Line Panipat",Yes (15),5,4,6,2,5,4,6,2,Yes,No,Yes,Yes,Yes,"10:42 AM 21st Dec,21",2021-12-21 10:42,17
APEX HOSPITAL &amp; TRAUMA CENTRE,SANOLI ROAD BABAIL NAKA,Yes (35),9,0,26,2,9,0,26,2,Yes,No,Yes,Yes,Yes,"10:44 AM 21st Dec,21",2021-12-21 10:44,17
CHC Dadlana,"VPO Dadlana, Panipat",Yes (8),0,8,0,0,0,8,0,0,No,No,No,No,Yes,"10:43 AM 21st Dec,21",2021-12-21 10:43,17
CHC Khotpura,VPO Khotpura Panipat,Yes (9),0,9,0,0,0,9,0,0,No,No,No,No,No,"10:43 AM 21st Dec,21",2021-12-21 10:43,17
Chhabra Hospital,A-1 Narain Singh Park,Yes (11),6,0,5,1,6,0,5,1,Yes,No,Yes,Yes,Yes,"10:46 AM 21st Dec,21",2021-12-21 10:46,17
Civil Hospital panipat,Civil Hospital GT Road Panipat,Yes (104),74,20,10,4,74,20,10,4,Yes,Yes,Yes,Yes,Yes,"10:43 AM 21st Dec,21",2021-12-21 10:43,17
Cygnus Hospital panipat,Cygnus Hospital Near Devi Mndir Panipat,Yes (17),12,0,5,4,12,0,5,4,Yes,No,Yes,Yes,Yes,"10:43 AM 21st Dec,21",2021-12-21 10:43,17
GALAXY HOSPITAL,ASSAND ROAD PANIPAT,Yes (15),7,0,8,2,7,0,8,2,Yes,No,Yes,Yes,Yes,"10:44 AM 21st Dec,21",2021-12-21 10:44,17
Guru Teg Bhadur Sanjeevani Hospital,"Village Bal Jatan Near Panipat Refinary, Panipat",Yes (314),307,7,0,0,307,7,0,0,Yes,No,Yes,Yes,Yes,"10:46 AM 21st Dec,21",2021-12-21 10:46,17
Hyderabadi General Hospital &amp; Nursing Home,"Sanoli Road, Near Sanjay, Chowk, Panipat",Yes (10),0,0,10,2,0,0,10,2,Yes,No,Yes,Yes,Yes,"10:46 AM 21st Dec,21",2021-12-21 10:46,17
IBM HOSPITAL &amp; TRAUMA CENTRE,NEAR BHIM GODA MANDIR SANOLI ROAD,Yes (24),12,0,12,2,12,0,12,2,Yes,No,Yes,Yes,Yes,"10:44 AM 21st Dec,21",2021-12-21 10:44,17
LHDM &amp; Prem Hospital,Prem Hospital Opp. Bus Stand Panipat,Yes (80),71,0,9,6,71,0,9,6,Yes,Yes,Yes,Yes,Yes,"10:43 AM 21st Dec,21",2021-12-21 10:43,17
MAX PLUS HOSPITAL,NEAR MALIK PETROL PUMP SANOLI ROAD,Yes (15),8,0,7,3,8,0,7,3,Yes,No,Yes,Yes,Yes,"10:44 AM 21st Dec,21",2021-12-21 10:44,17
NC Medical College,NC Medical Colllage Israna,Yes (530),42,483,5,4,42,483,5,4,Yes,No,Yes,Yes,Yes,"10:42 AM 21st Dec,21",2021-12-21 10:42,17
Park Hospital GT road panipat,"GT Road Sewah, Paniapt",Yes (82),52,14,16,2,52,14,16,2,Yes,Yes,Yes,Yes,Yes,"10:42 AM 21st Dec,21",2021-12-21 10:42,17
