name,address,Availability_availability_of_beds,Availability_oxygen_beds,Availability_non_oxygen_beds,Availability_i_c_u_beds,Availability_ventilators,Allocated_oxygen_beds,Allocated_non_oxygen_beds,Allocated_i_c_u,Allocated_ventilators,Availability_availability_of_oxygen,Availability_antiviral_remdesivir_etc_,Availability_steroids,Availability_anticoagulant,Availability_antipyretic,updated_on,city
PGIMS Rohtak,"Pt.Bhagwat Dayal PGIMS, Medical Rd, Rohtak, Haryana",Yes (49),49,0,0,0,299,0,112,112,Yes,Yes,Yes,Yes,Yes,2021-05-12 11:30,19
Positron Hospital,Suncity Sector 35,Yes (16),12,0,4,0,16,0,16,4,Yes,No,Yes,Yes,Yes,2021-05-12 16:37,19
Pragati Hospital,"Sukhpura Chowk, Gohana Road, opp. Ladhot Road Rohtak",No (0),0,0,0,1,11,0,4,1,Yes,No,Yes,Yes,Yes,2021-05-12 17:07,19
"Sanghi Nursing Home, Rohtak, Haryana","Chotu Ram Chowk, Civil Road, Arya Nagar, Rohtak, Haryana",No (0),0,0,0,4,10,0,4,4,Yes,No,Yes,Yes,Yes,2021-05-12 08:34,19
Shivam Liver &amp; Gastro Super Speciality Hospital,"CIVIL ROAD NEAR SHANT MAI CHOWK, Rohtak, Haryana - 124001, India",Yes (1),1,0,Beds Over Utilized 2,0,3,0,2,1,Yes,No,Yes,Yes,Yes,2021-05-12 17:00,19
Sunflag Global Hospital,Bharat Colony Near Sheela Bye Pass,Yes (6),1,0,5,0,33,0,12,5,Yes,No,Yes,Yes,No,2021-05-12 16:22,19
Civil Hospital Fatehabad,Near Bus Stand Fatehabad,No (0),0,0,0,0,34,0,6,6,Yes,Yes,Yes,Yes,Yes,2021-05-12 16:37,5
Civil Hospital Ratia,"Dera Surjanhar, Ratia, Fatehabad",No (0),0,0,0,2,18,0,0,2,Yes,No,No,No,Yes,2021-05-12 14:21,5
"Civil Hospital, Tohana",Opposite New Sabzi Mandi Tohana,Yes (3),0,3,0,1,27,3,0,3,Yes,No,Yes,Yes,Yes,2021-05-12 12:11,5
Community Health Center Bhattu,"Surya Nagar, Bhattu Mandi near Railway Station",Yes (18),2,16,0,0,12,18,0,0,Yes,No,Yes,No,Yes,2021-05-12 15:51,5
Community Health Center Bhuna,CHC Bhuna,Yes (13),0,13,0,0,12,18,0,0,Yes,To Be Updated,To Be Updated,To Be Updated,To Be Updated,2021-05-12 11:31,5
Community Health Center JAKHAL,Near SBI Bank Jakhal,Yes (2),2,0,0,0,12,0,0,0,Yes,No,No,No,Yes,2021-05-12 14:40,5
"Gupta Children Hospital, Ratia","Aggarwal Colony, Ratia",Yes (9),7,0,2,1,7,8,2,1,Yes,No,Yes,Yes,No,2021-05-12 14:02,5
Kaushal Hospital,"Near Harvinder Singh Petrol Pump, Hisar Road, Fatehabad",Yes (20),1,18,1,0,12,18,6,2,No,No,Yes,Yes,Yes,2021-05-12 14:05,5
"Manav Sewa Sangam Hospital, Tohana",Near Truck Union,Yes (2),2,0,0,0,15,0,0,0,Yes,No,Yes,No,Yes,2021-05-12 14:50,5
Miglani Hospital,"Employees Colony, Ratia,",Yes (12),10,2,0,0,15,2,7,7,Yes,Yes,Yes,Yes,Yes,2021-05-12 17:04,5
Rajasthan Medical Centre (RMC) Hospital Tohana,Kenchi Chowk Tohana,No (0),0,0,0,0,11,0,2,2,Yes,No,Yes,Yes,Yes,2021-05-12 14:10,5
Sadhbhawdna Hospital Fatehabad,Near Court Complex Hisar Road Fatehabad,Yes (14),0,14,0,0,5,20,7,3,Yes,No,Yes,Yes,Yes,2021-05-12 17:27,5
Sanjeevani Hospital Fatehabad,"Goshala Road, near Ashirbad Pelace",Yes (15),11,0,4,3,11,0,4,3,To Be Updated,To Be Updated,To Be Updated,To Be Updated,To Be Updated,2021-05-12 15:29,5
Sanjeevani Hospital Tohana,"Kenchi Chock, Tohana",No (0),0,0,0,0,0,6,12,2,Yes,No,Yes,Yes,Yes,2021-05-12 13:56,5
"Singla Hospital , fatehabad","Bhattu Road, Batra Colony, Fatehabad",Yes (6),4,2,0,0,5,8,0,0,No,No,Yes,Yes,Yes,2021-05-12 14:45,5
WadhwaMaternity and surgical Hospital Fatehabad,"Near Papiha Park, Fatehabad",Yes (5),1,0,4,0,1,0,7,1,Yes,No,Yes,Yes,Yes,2021-05-12 15:34,5
GH Charkhi Dadri,"Near Loharu Chowk,Charkhi Dadri",No (0),0,0,0,0,35,15,12,11,Yes,Yes,Yes,Yes,Yes,2021-05-12 14:27,3
Jaihind Hospital,Charkhi Dadri,Yes (1),1,0,0,0,8,0,5,0,To Be Updated,To Be Updated,To Be Updated,To Be Updated,To Be Updated,2021-05-09 15:37,3
Murari Lal Rasiwasia Ayurvedic Hospital,"Delhi Road,Near Janta College",Yes (15),15,0,0,0,60,0,0,0,Yes,Yes,Yes,Yes,Yes,2021-05-12 14:26,3
Oscar Hospital,Charkhi Dadri,Yes (2),0,0,2,0,0,0,20,0,To Be Updated,To Be Updated,To Be Updated,To Be Updated,To Be Updated,2021-05-12 14:37,3
Pradhan Medicare Centre,"Loharu Rd, Charkhi Dadri, Haryana",Yes (1),0,0,1,0,18,2,3,0,To Be Updated,To Be Updated,To Be Updated,To Be Updated,To Be Updated,2021-05-12 14:31,3
Sunflag Hospital,Charkhi Dadri,No (0),0,0,0,0,6,0,6,0,To Be Updated,To Be Updated,To Be Updated,To Be Updated,To Be Updated,2021-05-09 15:36,3
Apollo Rewari/Family Health Edge Hospital,"Garhi Bolni Rd, near Public Health Office, krishna Nagar, Rewari, Haryana",No (0),Beds Over Utilized 5,Beds Over Utilized 3,0,0,4,0,0,0,Yes,No,Yes,Yes,Yes,2021-05-11 18:15,18
Capt. Nand Lal Hospital,"Circular Road near Government Girls Senior Secondary School naiwali, chowk, Rewari",Yes (28),10,10,8,1,10,10,8,1,Yes,No,Yes,Yes,Yes,2021-05-12 14:48,18
Civil Hospital rewari,"Kayasthwara Mohalla, Rewari, Haryana",No (0),Beds Over Utilized 5,0,0,0,44,0,3,8,Yes,Yes,Yes,Yes,Yes,2021-05-11 21:52,18
Cygnus Hospital,"Opposite Civil Hospital Mohola, Sanghi Ka Bass, Rewari, Haryana",No (0),Beds Over Utilized 6,Beds Over Utilized 2,0,0,15,0,9,2,Yes,No,Yes,Yes,Yes,2021-05-12 09:42,18
Devjyoti Hospital,"Ambedkar chowk, near Bus Stand, Rewari, Haryana",No (0),0,0,0,Beds Over Utilized 1,7,2,5,1,Yes,No,Yes,Yes,Yes,2021-05-12 11:37,18
Dr. K.K. NAGAR HOSPITAL,"317, Near Shishu Shala School, Model Town, Rewari, Haryana",Yes (1),1,0,Beds Over Utilized 5,1,3,0,5,1,Yes,No,Yes,Yes,Yes,2021-05-12 10:11,18
Kamla Nursing Home/Kalawati Hospital,"201, Model Town, Rewari, Near Bus Stand, Opposite Bal Bhawan, Shivam Chowk",No (0),Beds Over Utilized 5,0,Beds Over Utilized 3,5,5,0,5,6,Yes,No,Yes,Yes,Yes,2021-05-12 12:44,18
Katyal Hospital,"Katyal Hospital, KANOD GATE, CIRCULAR ROAD, Rewari, Haryana, India",Yes (1),0,1,Beds Over Utilized 3,0,12,6,7,1,Yes,No,Yes,Yes,Yes,2021-05-12 14:51,18
Maars Hospital,"Garhi Bolni Rd, near PWD Office, Sector 19, Rewari, Haryana",No (0),Beds Over Utilized 2,0,0,0,11,0,0,0,Yes,No,Yes,Yes,No,2021-05-12 10:33,18
Matrika Hospital,"Matrika Hospital, Ranbir Singh Huda Chowk, Bawal-Rewari Rd, Rewari, Haryana",Yes (1),1,0,Beds Over Utilized 1,0,14,0,14,3,Yes,No,Yes,Yes,Yes,2021-05-12 13:35,18
Mediom Hospital/Medcare Hospital,"Sohna Rd, near Municipal Corporation, Dharuhera, Haryana",Yes (4),3,Beds Over Utilized 1,1,0,8,0,4,1,Yes,No,Yes,Yes,Yes,2021-05-09 16:14,18
Om Hospital,"Om Hospital, Nandrampur Bass Rd, Dharuhera, Haryana",Yes (3),3,0,0,0,10,2,3,0,Yes,No,Yes,Yes,Yes,2021-05-11 12:40,18
Pushpanjli Hospital Rewari,"Rajesh Pilot Chowk, Rewari, Haryana",No (0),0,0,0,0,25,10,10,3,No,No,Yes,Yes,Yes,2021-05-09 18:20,18
R. B. Yadav Hospital,"Dr. R B Yadav Hospital, Circular Rd Jainpuri, Kayasthwara Mohalla, Rewari, Haryana",Yes (4),4,0,0,0,8,6,8,2,Yes,No,Yes,Yes,Yes,2021-05-12 12:01,18
SDH Kosli,"Kosli, Rewari, Haryana",Yes (25),Beds Over Utilized 3,25,0,0,20,25,0,0,Yes,No,No,No,No,2021-05-12 09:54,18
Shanti Yadav Hospital,"Bawal-Rewari Rd Model Town, Rewari, Haryana",Yes (11),3,8,0,0,19,10,4,0,Yes,No,Yes,No,No,2021-05-12 10:01,18
SMCC Hospital,"Sector 5 Rewari, Haryana",No (0),Beds Over Utilized 2,0,0,1,0,0,11,1,Yes,Yes,Yes,Yes,Yes,2021-05-12 17:16,18
"Sushma Devi Hospital, Bawal","Rewari Road, Bawal, Rewari, Near Power House & Bharat Petrol Pump",Yes (11),3,8,0,0,8,10,0,0,Yes,No,Yes,Yes,Yes,2021-05-12 14:02,18
Vedanta Hospital,"Circulare Road, Near Nirankari Satsang Bhavan Dharuhera, Chungi, Rewari, Haryana",No (0),Beds Over Utilized 11,Beds Over Utilized 4,0,Beds Over Utilized 4,13,0,0,0,Yes,No,Yes,Yes,Yes,2021-05-10 17:25,18
Virat Hospital,"Circular Rd, Near Oriental Bank of Commerce, Madhu Vihar, Rewari, Haryana",No (0),Beds Over Utilized 27,Beds Over Utilized 1,0,Beds Over Utilized 1,33,0,27,2,Yes,No,Yes,Yes,Yes,2021-05-12 10:03,18
Yaduvanshi Hospital,"Maharana Pratap Chowk, Model Town, Rewari, Haryana",No (0),0,0,Beds Over Utilized 1,0,15,0,4,0,Yes,No,Yes,Yes,No,2021-05-12 16:18,18
"AAROGYAM HOSPITAL, Kurukshetra","NEAR OLD BUS STAND, THANESAR, KURUSKHETRA",Yes (12),6,6,0,2,40,12,15,27,Yes,Yes,Yes,Yes,Yes,2021-05-12 16:09,12
"ADESH MEDICAL COLLEGE, SHAHBAD MOHRI KURUKSHETRA.","VILL. MOHRI, SHAHBAD, KURUSHETRA",Yes (96),27,68,1,5,30,70,5,11,Yes,Yes,Yes,Yes,Yes,2021-05-12 16:13,12
"AGGARSAIN HOSPITAL, Kurukshetra","SECTOR-7, KURUKSHETRA.",Yes (10),10,0,0,1,10,0,0,1,Yes,Yes,Yes,Yes,Yes,2021-05-12 16:16,12
AGGARWAL NURSING HOME,"SALARPUR ROAD, THANESAR, KURUKSHETRA.",Yes (6),3,0,3,0,20,7,3,7,Yes,Yes,Yes,Yes,Yes,2021-05-12 16:08,12
B.S. HEART CARE,"OPP. NEW BUS STAND, KURUKSHETRA.",Yes (18),18,0,0,18,18,0,8,20,Yes,Yes,Yes,Yes,Yes,2021-05-12 15:45,12
"CYGNUS HOSPITAL, Kurukshetra","NEAR OLD BUS STAND, THANESAR, KURUSKHETRA",Yes (2),2,0,0,0,7,4,1,4,Yes,Yes,Yes,Yes,Yes,2021-05-12 16:09,12
KURUKSHETRA NURSING HOME,,Yes (11),11,0,0,0,18,0,1,2,Yes,Yes,Yes,Yes,Yes,2021-05-12 16:12,12
LNJP CIVIL HOSPITAL.,LNJP HOSPITAL KURUKSHETRA.,Yes (28),28,0,0,0,100,0,0,0,Yes,Yes,Yes,Yes,Yes,2021-05-12 16:26,12
MIRI PIRI SHAHBAD,"SHAHBAD, KURUKSHETRA",Yes (5),3,0,2,1,10,0,4,4,Yes,Yes,Yes,Yes,Yes,2021-05-12 16:10,12
Nirogi Hospital,Shahabad Kurukshetra,Yes (5),3,2,0,3,5,2,0,3,Yes,Yes,Yes,Yes,Yes,2021-05-12 16:14,12
Saraswati Mission Hospital,"Ambala Road Dist. Kurukshetra, Pehowa, Haryana 136128",Yes (3),1,0,2,2,20,0,2,5,Yes,No,Yes,Yes,Yes,2021-05-12 16:06,12
"SIDHARTH HOSPITAL, SHAHBAD","SHAHBAD, KURUKSHETRA",Yes (8),1,7,0,1,8,7,4,3,To Be Updated,No,To Be Updated,To Be Updated,To Be Updated,2021-05-12 16:15,12
"SIMSS, Kurukshetra",,Yes (6),6,0,0,3,6,0,0,3,Yes,Yes,Yes,Yes,Yes,2021-05-12 16:16,12
VERMA HOSPITAL,LADWA,Yes (2),0,2,0,0,9,2,2,2,Yes,No,Yes,Yes,Yes,2021-05-12 16:11,12
Alchemist Hospital panchkula,Sector 21 Panchkula,No (0),0,0,0,0,41,0,11,4,Yes,Yes,Yes,Yes,Yes,2021-05-12 10:40,16
Alchemist Ojas Hospital,"H1  SEctor 26, Panchkula Ext, Panchkula",Yes (4),4,0,0,2,54,0,17,8,Yes,Yes,Yes,Yes,Yes,2021-05-12 10:40,16
Civil Hospital Panchkula,sector 6 Panchkula,Yes (12),0,12,0,0,203,23,8,6,Yes,Yes,Yes,Yes,Yes,2021-05-12 10:38,16
Paras Hospital Pvt,"Plot no 2, sec 22, panchkula",Yes (4),1,0,3,0,39,10,40,10,Yes,Yes,Yes,Yes,Yes,2021-05-12 10:39,16
Cygnus Multispecialty Hospital Kaithal,"Huda Bypass Road, Sector 20, Kaithal, Haryana",No (0),0,0,0,0,28,0,12,2,Yes,No,Yes,Yes,Yes,2021-05-11 16:06,10
District Hospital Kaithal,"Huda Sec 18, Kaithal",Yes (9),0,9,0,1,80,27,8,5,Yes,Yes,Yes,Yes,Yes,2021-05-12 09:10,10
SDH Guhla,SDH Guhla,Yes (69),29,40,0,0,29,41,0,0,Yes,No,Yes,No,Yes,2021-05-12 16:09,10
Shah Multispecialty Hospital Kaithal,"opp.old, bus stand, Jind - Kaithal Rd, Amar Garh Colony, Kaithal, Haryana",Yes (19),7,11,1,4,51,11,15,10,Yes,No,Yes,Yes,Yes,2021-05-11 08:57,10
Aarti Hospital,"A-628, Near Hanuman Mandir, Dabua Pali Road, NIT Faridabad",Yes (23),5,15,3,0,5,15,3,0,To Be Updated,To Be Updated,To Be Updated,To Be Updated,To Be Updated,2021-05-11 15:11,4
Aastha Hospital,"SCF -2, Ashoka Enclave Main Rd, Sector 35, Faridabad",Yes (7),5,2,0,0,10,4,0,0,Yes,No,Yes,Yes,Yes,2021-05-12 12:33,4
Al-Falah Hospital,"Al Falah university Campus, Dhouj",Yes (46),30,16,0,0,50,25,2,2,Yes,Yes,Yes,Yes,Yes,2021-05-12 15:27,4
Anshu Hospital,"Shiv Colony Sehatpur Road, Palla No. 1, Faridabad",Yes (12),7,5,0,0,10,10,0,0,No,To Be Updated,To Be Updated,To Be Updated,To Be Updated,2021-05-12 09:47,4
Apurva Hospital,"2N/74, B.P. Near 2-3 Gole ChakKar, NIT Faridabad",Yes (7),5,2,0,1,8,2,0,1,Yes,Yes,To Be Updated,To Be Updated,To Be Updated,2021-05-12 15:37,4
Arise Healthcare,"SCO: C 3185, Near Corporation Bank, Green Field Colony, Faridabad",Yes (8),0,6,2,1,2,7,7,2,Yes,No,No,No,No,2021-05-12 14:13,4
Arsh Hospital,"Opp. Era Redwood Residency, Tigaon Rd, Sector 78, Faridabad,",Yes (22),20,2,0,4,40,5,20,6,Yes,No,Yes,Yes,Yes,2021-05-12 08:35,4
Asian Hospital,"Badkal Flyover Road, Sector  21 A Faridabad",No (0),Beds Over Utilized 15,0,0,Beds Over Utilized 8,82,0,53,14,Yes,Yes,Yes,Yes,Yes,2021-05-12 12:56,4
B.K. Hospital Faridabad,B.K. Hospital Faridabad B K Chowk FBD,Yes (56),31,25,0,0,64,25,11,11,No,Yes,Yes,Yes,Yes,2021-05-12 14:39,4
Bhavya Kalyani Hospital,"Mohna Road, Near Aanand Bakery, Ballabgarh, Faridabad",Yes (12),3,8,1,0,5,9,3,0,Yes,To Be Updated,To Be Updated,To Be Updated,To Be Updated,2021-05-11 14:50,4
Chugh Hospital,"5L-164, K.C. Road N.I.T. Faridabad",Yes (6),1,5,0,0,4,14,0,0,To Be Updated,To Be Updated,To Be Updated,To Be Updated,To Be Updated,2021-05-12 11:25,4
D.M. Hospital,"89-A, NH-5, Railway Road, Near Police Thana, NIT, Faridabad",No (0),0,0,0,0,10,10,8,1,No,No,Yes,Yes,Yes,2021-05-12 11:08,4
Doctor Today Multispecialty Hospital,"5-C/2,B.P., Railway Road,, Near Bankey Bihari Mandir,, next to IDBI Bank, Faridabad",Yes (20),20,0,0,1,35,0,5,2,Yes,No,Yes,Yes,Yes,2021-05-12 16:34,4
Dr. Harish Hospital,"701, Sector 8, YMCA Road, Faridabad",Yes (1),1,0,0,0,5,0,2,0,Yes,No,Yes,Yes,Yes,2021-05-12 11:41,4
Durga Multispeciality Hospital,"Shri Bankey Bihari Mandir Complex, Neelam-Railway Road, NIT 5, Faridabad",Yes (27),21,0,6,0,22,0,8,0,No,No,Yes,Yes,Yes,2021-05-11 12:44,4
"ESIC Medical College, Faridabad","NH-3, NIT Behind BK Hospital, Haryana",Yes (346),0,346,0,0,150,350,80,50,Yes,Yes,Yes,Yes,Yes,2021-05-12 07:36,4
Fortis Escort Hospital,"Neelam Bata Rd, opp. Neelam Cinema, AC Nagar, New Industrial Town, Faridabad,",Yes (3),3,0,0,Beds Over Utilized 2,55,0,14,7,Yes,Yes,Yes,Yes,Yes,2021-05-12 11:01,4
Gaurav Hospital,"Rajeev Colony, Samaypur Road, Ballabgarh, Faridabad",Yes (4),Beds Over Utilized 12,2,2,1,3,2,10,1,To Be Updated,To Be Updated,To Be Updated,To Be Updated,To Be Updated,2021-05-12 12:23,4
Geeta Hospital,"Opposite Huda Market and Community Centre, Sector 28, Faridabad",Yes (13),6,0,7,1,8,0,10,2,Yes,No,Yes,Yes,Yes,2021-05-12 10:32,4
Geetanjali Multispeciality Hospital,"D-635, 60 Feet Rd, Chawla Colony, Ballabhgarh, Faridabad",Yes (11),11,0,0,0,20,3,0,0,Yes,To Be Updated,Yes,To Be Updated,To Be Updated,2021-05-08 15:28,4
Goyal Hospital,"Plot No. 2 opposite hanuman temple Sec 8, Surdas Park",No (0),0,0,0,0,12,0,6,2,No,Yes,Yes,Yes,Yes,2021-05-12 10:48,4
Handa Medical Center,"Site No-1, Sector 16, Opp Sagar Cinema, Faridabad",No (0),0,0,0,0,0,0,0,0,No,No,No,To Be Updated,No,2021-05-11 14:08,4
Heritage Hospital,3C-62B/BP NIT Faridabad,Yes (15),11,0,4,1,11,0,4,1,To Be Updated,To Be Updated,To Be Updated,To Be Updated,To Be Updated,2021-05-11 15:18,4
IBS Ashwani Hospital,"Plot No 8 D/1, YMCA Rd, Pocket D, Sector 11, Faridabad",Yes (14),3,5,6,2,18,5,12,2,No,To Be Updated,To Be Updated,To Be Updated,To Be Updated,2021-05-12 10:54,4
Janak Hospital,Indira complex Neharpar Kheri Road Faridabad,Yes (7),1,4,2,0,15,6,6,0,Yes,No,Yes,Yes,Yes,2021-05-12 11:19,4
Kant Multispeciality Hospital Pvt Ltd,"Plot no. 167, Indra Complex, Kheri Road, Greater, near Kheri Pul Bridge, Sector 87, Neharpar Faridabad, Faridabad, Haryana 121002",Yes (18),16,0,2,0,18,0,5,1,No,Yes,To Be Updated,To Be Updated,To Be Updated,2021-05-12 11:10,4
Kedar Hospital,"3B/3, B.P , Near DAV college, NIT., Faridabad,",Yes (49),31,6,12,1,31,6,12,1,To Be Updated,To Be Updated,To Be Updated,To Be Updated,To Be Updated,2021-05-12 08:16,4
Kedar Hospital Multispeciality,Gali 7 Krishna Colony Sec25 Faridabad,Yes (21),8,13,0,0,10,15,5,0,Yes,No,Yes,Yes,Yes,2021-05-12 08:12,4
Krishna Medical Centre,"773, Sector-19, Faridabad",Yes (10),5,0,5,0,5,0,5,0,To Be Updated,To Be Updated,To Be Updated,To Be Updated,To Be Updated,2021-05-11 15:16,4
Life Hospital,Opp Hanuman Mandir Sec 8 Faridabad,Yes (6),4,0,2,1,4,0,6,1,Yes,Yes,Yes,Yes,Yes,2021-05-12 09:46,4
Lotus Hospital,"Plot-2, Jeevan Nagar, Opp. Lal Kothi, Main Ballabgarh Sohna Road, Faridabad",Yes (10),8,0,2,0,12,0,8,1,Yes,No,Yes,Yes,Yes,2021-05-12 16:26,4
Madhav Hospital,"Building no 16, Block E, and, New Industrial Twp 5, Faridabad, Haryana 121001",Yes (14),Beds Over Utilized 1,0,14,2,0,0,28,2,To Be Updated,No,To Be Updated,To Be Updated,To Be Updated,2021-05-11 17:57,4
Manavta Hospital,"Plot No-494, Near Women ITI, Uncha Gaon Prem Nagar, Mohna Road, Ballabgarh, Faridabad",Yes (10),0,9,1,3,10,10,11,3,To Be Updated,To Be Updated,To Be Updated,To Be Updated,To Be Updated,2021-05-12 09:47,4
Manvi Medical Centre,"New Bharat Colony, Opp. Chaddar Godam, Near Mahaban Farm, Kheri Road, Greater Faridabad",Yes (2),2,0,0,0,7,0,2,0,Yes,No,Yes,To Be Updated,To Be Updated,2021-05-12 16:13,4
Medicheck Hospital,"Block C, Plot Number 76, Shahid Bhagat Singh Marg, near Bata Flyover, New Industrial Town, Faridabad",Yes (4),4,Beds Over Utilized 7,0,0,52,0,12,3,Yes,No,Yes,Yes,Yes,2021-05-12 11:16,4
Medicheck Ortho Hospital,"Behind Community Centre, HBH Colony, Sector 46, Faridabad",Yes (13),13,0,0,0,13,0,0,0,To Be Updated,To Be Updated,To Be Updated,To Be Updated,To Be Updated,2021-05-12 09:49,4
Medstar Hospital,"Om Enclave Part 1, Near Toll Tax, Agwanpur Road, Faridabad",Yes (4),2,2,0,0,5,2,0,0,No,No,Yes,Yes,Yes,2021-05-12 09:24,4
Medwin Hospital,"Plot No. 2, Jeevan Nagar, Sohna Road Gounchi, Sector 55, Faridabad",Yes (15),1,12,2,0,2,12,6,0,To Be Updated,No,Yes,Yes,Yes,2021-05-12 11:49,4
Metro Hospital Medicare,"Metro Heart Institute with Multispeciality Sector 16 A, Faridabad",Yes (3),3,0,0,0,170,0,43,11,Yes,No,Yes,Yes,Yes,2021-05-12 17:21,4
National Institute Of Medical Sciences,"Sector -23A,?Faridabad,?",Yes (5),3,0,2,2,15,4,9,2,Yes,No,Yes,Yes,Yes,2021-05-10 21:10,4
Ortho 1 Hospital,"1331, Near Community Centre, Sector 55, Faridabad",Yes (28),7,12,9,1,8,12,10,1,Yes,No,Yes,Yes,Yes,2021-05-12 11:10,4
Park Hospital,"J Block, Sector 10 HBC, opposite Court, Faridabad",Yes (1),0,0,1,4,10,10,25,5,Yes,No,Yes,Yes,Yes,2021-05-12 12:47,4
Pawan Hospital Unit-1,"Samaypur Road Near Sector 56, Ballabhgarh, Faridabad",Yes (11),10,0,1,0,31,0,14,7,To Be Updated,To Be Updated,To Be Updated,To Be Updated,To Be Updated,2021-05-12 09:13,4
Pawan Hospital Unit-2,"Plot No. 10, Jawahar Colony, Near Disposal Chowk, Faridabad",Yes (2),0,0,2,0,0,0,11,0,To Be Updated,To Be Updated,To Be Updated,To Be Updated,To Be Updated,2021-05-12 09:12,4
Prachi Hospital,Opp Chimni Bai Dharmshala Faridabad,Yes (9),6,2,1,1,10,2,5,1,Yes,To Be Updated,To Be Updated,To Be Updated,To Be Updated,2021-05-12 12:26,4
QRG Central,"Plot No, 69, Mathura Rd, Sector 20 A, New Industrial Town, Faridabad",No (0),0,0,0,0,105,0,39,11,Yes,Yes,Yes,Yes,Yes,2021-05-12 11:29,4
QRG Hospital Medicare,"Ambedkar Marg, QRG Healthcity, Sector 16, Faridabad",No (0),0,0,0,0,165,0,43,14,Yes,Yes,Yes,Yes,Yes,2021-05-12 11:19,4
Raghav Hospital,Kheri Road Sec 87 Greater Faridabad,Yes (14),14,0,0,1,17,3,3,1,Yes,No,Yes,Yes,Yes,2021-05-12 09:33,4
Raj Nursing Home,"CLINIC SITE NO-6, Sector 3, Faridabad",Yes (1),0,Beds Over Utilized 10,1,0,13,0,4,1,Yes,No,Yes,Yes,Yes,2021-05-12 11:10,4
Ronak Hospital,"Dabua Pali Road, Near Ganga Ram Devta Mandir, NIT, Faridabad",Yes (44),20,19,5,3,20,20,10,3,Yes,Yes,Yes,Yes,Yes,2021-05-12 14:52,4
Royal’s Hotel,"3-B-14, Ground Floor NIT Faridabad",Yes (50),50,0,0,0,50,0,0,0,To Be Updated,To Be Updated,To Be Updated,To Be Updated,To Be Updated,2021-05-12 15:56,4
Samrat Hospital,"180, Sanjay Colony, Delhi Mathura Road, JCB Chowk, Ballabgarh, Faridabad",Yes (20),10,0,10,0,10,0,10,0,To Be Updated,To Be Updated,To Be Updated,To Be Updated,To Be Updated,2021-05-11 15:13,4
Sanjeevan Multispeciality Hospital,"D-947, 60 Feet Road, Opp. Shiv Mandir, Chawla Colony, Ballabgarh, Faridabad",Yes (10),5,2,3,0,7,2,8,0,No,No,Yes,Yes,Yes,2021-05-12 15:19,4
Santosh Multispeciality Hospital,"Shop No. 3F, 139, Metro Rd, New Industrial Township 2b, Block F, New Industrial Twp 3, New Industrial Town, Faridabad,",Yes (25),20,5,0,1,40,10,10,1,No,No,Yes,Yes,Yes,2021-05-12 11:09,4
"Sarvodya Hospital, Sector 8","Sector-8, YMCA Rd, near Escorts Mujesar Metro Station, Sector 7, Faridabad",Yes (14),14,0,Beds Over Utilized 15,Beds Over Utilized 2,138,0,25,5,Yes,Yes,Yes,Yes,Yes,2021-05-12 10:26,4
Sarvodya Sector 19,"Gopi Colony, Old Faridabad, Faridabad",Yes (2),0,0,2,0,28,0,10,4,Yes,Yes,Yes,Yes,To Be Updated,2021-05-12 11:15,4
Sattya Hospital,"376, IP Colony, Sector 32-33 Faridabad",Yes (10),6,0,4,2,6,0,4,2,To Be Updated,To Be Updated,To Be Updated,To Be Updated,To Be Updated,2021-05-11 17:26,4
Shankar Medicare Center,Sec 28 Faridabad,Yes (30),10,20,0,0,15,20,0,0,Yes,To Be Updated,Yes,Yes,Yes,2021-05-12 11:54,4
Shanti Devi Memorial Hospital,"Kheri More Near, Piyush Heights, Sector 89, Faridabad",Yes (9),0,8,1,0,14,8,3,2,Yes,No,Yes,Yes,Yes,2021-05-12 09:53,4
Shivalik Hospital Unit 1,Huda Market Sector-37 Faridabad,Yes (1),0,Beds Over Utilized 4,1,0,0,3,4,0,Yes,No,Yes,Yes,Yes,2021-05-12 10:38,4
Shivalik Hospital Unit 2,"Sehatpur, Opp. Sec-91 Faridabad",Yes (1),0,Beds Over Utilized 5,1,0,0,0,2,0,Yes,No,Yes,Yes,Yes,2021-05-12 10:55,4
Siddhi Vinayak Aspataal,"MCF-8280, Main Sohna Road, Near Syndicate Bank/Lal Kothi, Ballabgarh, Faridabad",Yes (18),7,5,6,1,10,6,10,1,Yes,To Be Updated,To Be Updated,To Be Updated,To Be Updated,2021-05-12 11:04,4
SMS Hospital,"Clinic No. 9, Sector-3, Near Huda Market, Faridabad",Yes (6),5,0,1,1,5,0,5,3,Yes,No,Yes,Yes,Yes,2021-05-12 13:47,4
SRU Multispeciality Hospital,"Sunder Colony, Nangla Gujran, Behind Rawal International School, Ballabgarh, Faridabad",Yes (11),11,Beds Over Utilized 4,0,0,14,0,3,0,Yes,No,Yes,No,No,2021-05-12 10:13,4
Sunrise Hospital,"3C-63, BP, NIT Faridabad",Yes (18),17,0,1,0,25,0,3,0,Yes,No,Yes,Yes,Yes,2021-05-12 12:02,4
Sunshine Hospital,"Sec 64 Sahupura Road, Unchagaon Ballabgarh",Yes (4),4,0,0,0,8,0,3,0,Yes,No,Yes,Yes,Yes,2021-05-12 12:42,4
Supreme Hospital,"Suraj Kund Rd, Charmwood Village, Faridabad",Yes (19),17,0,2,1,20,0,2,1,To Be Updated,To Be Updated,To Be Updated,To Be Updated,To Be Updated,2021-05-12 11:08,4
Urocare Apolo Multi and Super Speciality Hospital,"H.No 78, Behind Girls College, Sector-2, Ballabgarh, Faridabad",Yes (5),0,5,0,0,0,6,2,0,Yes,No,Yes,Yes,Yes,2021-05-12 14:41,4
V Care Multispeciality Health Center,"Plot No. V7, Near Police Station, BPTP Park Land, Sector-76, Faridabad",Yes (5),4,0,1,1,7,0,3,2,Yes,No,Yes,Yes,Yes,2021-05-12 13:04,4
Vardan Hospital,"Opp. Gurudwara, Adarsh Nagar, Main Malerna Road, Ballabgarh, Faridabad",Yes (15),15,0,0,0,15,0,0,0,To Be Updated,To Be Updated,To Be Updated,To Be Updated,To Be Updated,2021-05-11 15:12,4
Vedanta Hospital,"B-5,Central Green,Near I.T, BK Chowk, New Industrial Town, Faridabad",Yes (7),0,7,0,1,10,12,8,1,Yes,No,Yes,Yes,Yes,2021-05-12 12:12,4
Vibal Hospital Pvt. Ltd.,"Sector-21D, Huda Market, Faridabad",Yes (9),9,0,Beds Over Utilized 2,0,10,0,8,1,Yes,Yes,Yes,Yes,Yes,2021-05-12 16:15,4
Zenith Hospital (P) Ltd.,187/1 Yadav Colony Mohana Road NEar Yadav DairyBallabgarh,Yes (26),25,0,1,2,30,0,4,2,Yes,No,Yes,Yes,Yes,2021-05-12 15:35,4
"Aarogyam Hospital, Gurugram","Ward Number 15, Gurgaon, SH-13, Gurgaon Sohna Road, Sohna, Sohna, Haryana",Yes (5),4,0,1,0,20,0,4,1,To Be Updated,To Be Updated,To Be Updated,To Be Updated,To Be Updated,2021-05-09 08:58,6
Aarvy Hospital,"530/18 Civil Lines Opp Nehru Stadium, Gurugram",No (0),0,0,0,0,12,0,4,0,To Be Updated,To Be Updated,To Be Updated,To Be Updated,To Be Updated,2021-05-08 15:35,6
Alfaa Hospital,"Basai Village, Sector 9B, Gurugram, Haryana",Yes (8),4,4,0,0,8,4,3,0,Yes,No,Yes,Yes,Yes,2021-05-11 16:24,6
Anand multispeciality hospital,"Plot no. 29, Sector 56, Gurugram, Haryana",Yes (1),1,0,0,0,6,0,3,1,Yes,No,Yes,Yes,Yes,2021-05-12 07:37,6
Artemis Hospital,"Sector 51, Gurugram",Yes (10),10,0,0,0,146,0,45,30,Yes,Yes,Yes,Yes,Yes,2021-05-12 17:06,6
Aryan Hospital Gurugram,Old Railway Road Gurugram,Yes (2),2,0,0,0,43,0,17,4,Yes,Yes,Yes,Yes,Yes,2021-05-12 11:00,6
Bhanot Hospital,"188/18, Jharsa Rd, Gurugram, Haryana",Yes (2),2,0,0,0,5,0,0,0,Yes,No,Yes,Yes,Yes,2021-05-12 14:42,6
C K Birla Hospital,"Block J, CK Birla Hospital, Mayfield Garden, Sector 51, Gurugram",Yes (2),2,0,0,0,13,0,3,2,Yes,Yes,Yes,Yes,Yes,2021-05-12 10:39,6
Center of Diabetes &amp; Allied Science,"50, Sohna Rd, Rosewood City, Ghasola, Sector 49, Gurugram, Haryana 122001",Yes (11),8,0,3,3,18,0,8,3,To Be Updated,To Be Updated,To Be Updated,To Be Updated,To Be Updated,2021-05-11 19:47,6
Chauhan hospital,Tauru road near chungi no 4 pataudi,Yes (5),4,0,1,0,7,0,3,0,Yes,No,Yes,Yes,Yes,2021-05-10 19:21,6
Chirag Hospital,"3236/31 Rajendra Park, Sector 105, Gurugram, Haryana",No (0),0,0,0,0,23,0,7,2,No,No,To Be Updated,To Be Updated,To Be Updated,2021-05-08 17:24,6
Civil Hospital gurugram,"Sector 10A,Gurugram",Yes (2),2,0,0,0,43,0,4,4,To Be Updated,To Be Updated,To Be Updated,To Be Updated,To Be Updated,2021-05-10 20:11,6
Cloudnine Hospital,"Plot No. A-2 MSJ House, Vikas Marg, beside SS Plaza, Mayfield Garden, Sector 47, Gurugram",Yes (11),0,11,0,0,4,14,0,0,Yes,No,Yes,No,Yes,2021-05-12 08:35,6
Colombia Asia Hospital,"Ansal Plaza Near Gol Chakkar, Block F, Palam Vihar, Gurugram",No (0),0,0,0,0,43,0,6,6,Yes,Yes,Yes,Yes,Yes,2021-05-12 16:27,6
Ektaa hospital,"Main Sohna Road ,Near Community Centre ,Badshahpur, Gurugram, Haryana",Yes (1),1,0,0,0,6,0,0,0,Yes,No,Yes,Yes,Yes,2021-05-11 20:05,6
ESI Hospital Gurugram,"769, Near Mothers Pride School, sector 9A, Gurugram, Haryana",Yes (41),9,32,0,0,40,32,0,0,Yes,Yes,Yes,Yes,Yes,2021-05-12 14:12,6
Fortis Hospital,"Opposite Huda City Metro Station, Sector 44, Gurugram",No (0),0,0,0,0,125,15,60,25,Yes,Yes,Yes,Yes,Yes,2021-05-11 14:01,6
"Geetanjali Hospital, Gurugram","Pataudi Rd, Pataudi, Haryana",Yes (15),9,0,6,0,10,0,8,0,Yes,No,Yes,Yes,Yes,2021-05-10 15:04,6
Genesis Hospital,"sector 84, near Dps school, Gurugram, Haryana",Yes (4),1,0,3,0,5,0,7,2,Yes,Yes,Yes,Yes,Yes,2021-05-12 14:16,6
Girraj ji children hospital,"Sector 13 Rd, Prem Nagar, Sector 13, Gurugram, Haryana",No (0),0,0,0,0,0,0,0,0,To Be Updated,To Be Updated,To Be Updated,To Be Updated,To Be Updated,2021-05-05 02:07,6
K.K Health Care Centre,"238, Sector 5, Gurugram, Haryana",Yes (5),0,5,0,0,4,6,0,0,Yes,No,Yes,Yes,Yes,2021-05-12 08:36,6
Kalyani Hospital,"Mehrauli-Gurgaon Rd, Anamika Enclave, Sector 14, Gurugram",No (0),0,0,0,0,30,0,1,1,Yes,To Be Updated,Yes,Yes,Yes,2021-05-12 11:40,6
Kamal hospital and maternity centre,"Sector 66-68, Sohna Road, Badshahpur, Gurugram, Haryana",Yes (4),3,0,1,0,5,0,6,1,Yes,No,Yes,Yes,Yes,2021-05-12 12:01,6
Kamla Hospital,"Pataudi Road NEAR RADHA SWAMI SATSANG BHAVAN, Kadipur Industrial Area, Sector 37C, Gurugram",Yes (6),0,6,0,0,13,7,3,0,No,No,Yes,Yes,Yes,2021-05-12 15:09,6
