name,address,Availability_availability_of_beds,Availability_oxygen_beds,Availability_non_oxygen_beds,Availability_i_c_u_beds,Availability_ventilators,Allocated_oxygen_beds,Allocated_non_oxygen_beds,Allocated_i_c_u,Allocated_ventilators,Availability_availability_of_oxygen,Availability_antiviral_remdesivir_etc_,Availability_steroids,Availability_anticoagulant,Availability_antipyretic,updated_on_unparsed,updated_on,city
Aashirwad Hospital,101 Devi Murti Colony Panipat,Yes (9),2,0,7,1,2,0,7,1,Yes,No,Yes,Yes,Yes,"10:00 AM 1st Aug,21",2021-08-01 10:00,17
Aayushmaan Bhav Hospital,"GT Road Sewah, Near Police Line Panipat",Yes (15),5,4,6,2,5,4,6,2,Yes,No,Yes,Yes,Yes,"9:54 AM 1st Aug,21",2021-08-01 09:54,17
APEX HOSPITAL &amp; TRAUMA CENTRE,SANOLI ROAD BABAIL NAKA,Yes (35),9,0,26,2,9,0,26,2,No,No,Yes,Yes,Yes,"9:57 AM 1st Aug,21",2021-08-01 09:57,17
CHC Dadlana,"VPO Dadlana, Panipat",Yes (8),0,8,0,0,0,8,0,0,No,No,No,No,Yes,"9:55 AM 1st Aug,21",2021-08-01 09:55,17
CHC Khotpura,VPO Khotpura Panipat,Yes (9),0,9,0,0,0,9,0,0,No,No,No,No,No,"9:56 AM 1st Aug,21",2021-08-01 09:56,17
Chhabra Hospital,A-1 Narain Singh Park,Yes (11),6,0,5,1,6,0,5,1,Yes,No,Yes,Yes,Yes,"10:01 AM 1st Aug,21",2021-08-01 10:01,17
Civil Hospital panipat,Civil Hospital GT Road Panipat,Yes (103),74,20,9,4,74,20,10,4,Yes,Yes,Yes,Yes,Yes,"9:55 AM 1st Aug,21",2021-08-01 09:55,17
Cygnus Hospital panipat,Cygnus Hospital Near Devi Mndir Panipat,Yes (17),12,0,5,4,12,0,5,4,Yes,No,Yes,Yes,Yes,"9:56 AM 1st Aug,21",2021-08-01 09:56,17
GALAXY HOSPITAL,ASSAND ROAD PANIPAT,Yes (15),7,0,8,2,7,0,8,2,Yes,No,Yes,Yes,Yes,"9:57 AM 1st Aug,21",2021-08-01 09:57,17
Guru Teg Bhadur Sanjeevani Hospital,"Village Bal Jatan Near Panipat Refinary, Panipat",Yes (314),307,7,0,0,307,7,0,0,Yes,No,Yes,Yes,Yes,"10:01 AM 1st Aug,21",2021-08-01 10:01,17
Hyderabadi General Hospital &amp; Nursing Home,"Sanoli Road, Near Sanjay, Chowk, Panipat",Yes (10),0,0,10,2,0,0,10,2,Yes,No,Yes,Yes,Yes,"10:01 AM 1st Aug,21",2021-08-01 10:01,17
IBM HOSPITAL &amp; TRAUMA CENTRE,NEAR BHIM GODA MANDIR SANOLI ROAD,Yes (24),12,0,12,2,12,0,12,2,Yes,No,Yes,Yes,Yes,"9:56 AM 1st Aug,21",2021-08-01 09:56,17
LHDM &amp; Prem Hospital,Prem Hospital Opp. Bus Stand Panipat,Yes (80),71,0,9,6,71,0,9,6,Yes,Yes,Yes,Yes,Yes,"9:55 AM 1st Aug,21",2021-08-01 09:55,17
MAX PLUS HOSPITAL,NEAR MALIK PETROL PUMP SANOLI ROAD,Yes (15),8,0,7,3,8,0,7,3,Yes,No,Yes,Yes,Yes,"9:56 AM 1st Aug,21",2021-08-01 09:56,17
NC Medical College,NC Medical Colllage Israna,Yes (530),42,483,5,4,42,483,5,4,Yes,No,Yes,Yes,Yes,"9:54 AM 1st Aug,21",2021-08-01 09:54,17
Park Hospital GT road panipat,"GT Road Sewah, Paniapt",Yes (82),52,14,16,2,52,14,16,2,Yes,Yes,Yes,Yes,Yes,"9:54 AM 1st Aug,21",2021-08-01 09:54,17
Prime Hospital Health Leaders,"Opp. Gangapuri Road, Sanoli Road Panipat",Yes (20),14,2,4,4,14,2,4,4,Yes,No,Yes,Yes,Yes,"9:59 AM 1st Aug,21",2021-08-01 09:59,17
Rainbow Hospital,152-R Model Town Panipat,Yes (9),6,0,3,1,6,0,3,1,Yes,No,Yes,Yes,Yes,"10:00 AM 1st Aug,21",2021-08-01 10:00,17
SDH Samalkha,G.T Road Samalkha,Yes (50),30,20,0,0,30,20,0,0,No,No,Yes,No,Yes,"9:55 AM 1st Aug,21",2021-08-01 09:55,17
shobhit Hospital,"adjacent canara bank, tahsil camp",Yes (19),12,2,5,1,12,2,5,1,Yes,No,Yes,Yes,Yes,"9:56 AM 1st Aug,21",2021-08-01 09:56,17
Shree Badri Das Hospital and ICU Care Centre,Assandh Road Panipat,Yes (11),8,0,3,1,8,0,3,1,Yes,No,Yes,Yes,Yes,"2:11 PM 1st Aug,21",2021-08-01 14:11,17
Shree Balajee Multispeciality Hospital,Aggarsan Colony Assandh Road Panipat,Yes (10),4,0,6,2,4,0,6,2,Yes,Yes,Yes,Yes,Yes,"10:00 AM 1st Aug,21",2021-08-01 10:00,17
Shubham Hospital,"202 New Sukhdev Nagar, Panipat",Yes (9),6,0,3,3,6,0,3,3,Yes,No,Yes,Yes,Yes,"10:01 AM 1st Aug,21",2021-08-01 10:01,17
"AAROGYAM HOSPITAL, Kurukshetra","NEAR OLD BUS STAND, THANESAR, KURUSKHETRA",Yes (67),40,12,15,27,40,12,15,27,Yes,Yes,Yes,Yes,Yes,"3:23 PM 1st Aug,21",2021-08-01 15:23,12
"ADESH MEDICAL COLLEGE, SHAHBAD MOHRI KURUKSHETRA.","VILL. MOHRI, SHAHBAD, KURUSHETRA",Yes (105),30,70,5,11,30,70,5,11,Yes,Yes,Yes,Yes,Yes,"3:26 PM 1st Aug,21",2021-08-01 15:26,12
AGGARWAL NURSING HOME,"SALARPUR ROAD, THANESAR, KURUKSHETRA.",Yes (30),20,7,3,7,20,7,3,7,Yes,Yes,Yes,Yes,Yes,"3:23 PM 1st Aug,21",2021-08-01 15:23,12
B.S. HEART CARE,"OPP. NEW BUS STAND, KURUKSHETRA.",Yes (26),18,0,8,20,18,0,8,20,Yes,Yes,Yes,Yes,Yes,"3:23 PM 1st Aug,21",2021-08-01 15:23,12
"CYGNUS HOSPITAL, Kurukshetra","NEAR OLD BUS STAND, THANESAR, KURUSKHETRA",Yes (12),7,4,1,4,7,4,1,4,Yes,Yes,Yes,Yes,Yes,"3:24 PM 1st Aug,21",2021-08-01 15:24,12
KURUKSHETRA NURSING HOME,,Yes (19),18,0,1,2,18,0,1,2,Yes,Yes,Yes,Yes,Yes,"3:25 PM 1st Aug,21",2021-08-01 15:25,12
LNJP CIVIL HOSPITAL.,LNJP HOSPITAL KURUKSHETRA.,Yes (94),60,29,5,5,60,30,5,5,Yes,Yes,Yes,Yes,Yes,"3:23 PM 1st Aug,21",2021-08-01 15:23,12
MIRI PIRI SHAHBAD,"SHAHBAD, KURUKSHETRA",Yes (14),10,0,4,4,10,0,4,4,Yes,Yes,Yes,Yes,Yes,"3:24 PM 1st Aug,21",2021-08-01 15:24,12
Nirogi Hospital,Shahabad Kurukshetra,Yes (7),5,2,0,3,5,2,0,3,Yes,Yes,Yes,Yes,Yes,"3:26 PM 1st Aug,21",2021-08-01 15:26,12
"Saraswati Mission Hospital, Kurukshetra","Theme Park Road, Kurukshetra",Yes (20),4,0,16,2,4,0,16,2,Yes,Yes,Yes,Yes,Yes,"3:28 PM 1st Aug,21",2021-08-01 15:28,12
"Saraswati Mission Hospital, Pehowa","Ambala Road Dist. Kurukshetra, Pehowa, Haryana 136128",Yes (22),20,0,2,5,20,0,2,5,Yes,No,Yes,To Be Updated,Yes,"3:23 PM 1st Aug,21",2021-08-01 15:23,12
"SIDHARTH HOSPITAL, SHAHBAD","SHAHBAD, KURUKSHETRA",Yes (16),8,4,4,3,8,4,4,3,Yes,Yes,Yes,Yes,Yes,"3:25 PM 1st Aug,21",2021-08-01 15:25,12
VERMA HOSPITAL,LADWA,Yes (14),9,3,2,2,9,3,2,2,Yes,Yes,Yes,Yes,Yes,"3:25 PM 1st Aug,21",2021-08-01 15:25,12
ASHIRWAD BHAGAT HOSPITAL,"Old DC Rd, near bhagat hospital, Sonipat, Haryana 131001",Yes (15),12,0,3,1,12,0,3,1,Yes,Yes,Yes,Yes,Yes,"11:47 AM 17th Jun,21",2021-06-17 11:47,21
Bhagwan Dass Hospital,"Near Shahpur Turk, block-E, omaxe city, Sector 18, Sonipat, Haryana 131001",Yes (40),27,0,13,2,27,0,13,2,Yes,No,Yes,Yes,Yes,"11:47 AM 17th Jun,21",2021-06-17 11:47,21
"BPS MEDICAL COLLEGE KHANPUR , SONIPAT ( 01263283088)","Ganaur - Gohana Rd, Khanpur Kalan, Haryana",Yes (299),170,80,49,49,170,80,50,50,Yes,Yes,Yes,Yes,Yes,"7:12 AM 29th Jul,21",2021-07-29 07:12,21
CHC GANUR,CHC GANUR,Yes (8),8,0,0,0,8,0,0,0,Yes,No,Yes,Yes,Yes,"11:48 AM 17th Jun,21",2021-06-17 11:48,21
CHC Kharkhoda,"SH 20, Kharkhoda, Haryana 131402",Yes (10),5,5,0,0,5,5,0,0,To Be Updated,To Be Updated,Yes,Yes,Yes,"11:49 AM 17th Jun,21",2021-06-17 11:49,21
"CHC, JUAN, SONIPAT, HARYANA","CHC, JUAN, SONIPAT, HARYANACHC, JUAN, SONIPAT, HARYANA, 131024",Yes (5),3,2,0,0,3,2,0,0,Yes,No,Yes,Yes,Yes,"11:56 AM 17th Jun,21",2021-06-17 11:56,21
"Civil Hospital, Sonipat (9050007668 )","Delhi Road, Near Maharana Pratap Chowk, Sonipat, Haryana 131001",Yes (192),182,0,10,10,190,0,10,10,Yes,Yes,Yes,Yes,Yes,"11:49 AM 17th Jun,21",2021-06-17 11:49,21
"CYGNUS HOSPITAL, Sonipat","Old Rohtak Rd, near Hindu College of Engineering, Industrial Area, Sonipat, Haryana 131001",Yes (20),18,0,2,1,18,0,2,1,Yes,No,Yes,Yes,Yes,"4:07 PM 25th Jun,21",2021-06-25 16:07,21
Dayanand Hospital-Sonepat,"Kakroi Rd, Prem Nagar, West Ram Nagar, Sonipat, Haryana",Yes (25),20,0,5,1,20,0,5,1,Yes,No,Yes,Yes,Yes,"11:32 AM 17th Jun,21",2021-06-17 11:32,21
FIIMS Hospital,"Road, Bahalgarh, Sonipat, Haryana 131304",Yes (99),63,0,36,6,63,0,37,8,Yes,No,Yes,Yes,Yes,"11:50 AM 17th Jun,21",2021-06-17 11:50,21
GAJRAJ HOSPITAL,"Bus Stand, Gajraj Hospital Road, Near, Gohana, Haryana 131301",Yes (20),20,0,0,0,20,0,0,0,Yes,To Be Updated,Yes,Yes,Yes,"11:51 AM 17th Jun,21",2021-06-17 11:51,21
HARYANA HOSPITAL,"Vivekanand Chowk, Delhi Rd, behind Bullet Showroom, Janta Colony, Sonipat, Haryana 131001",Yes (2),1,0,1,1,1,0,1,1,Yes,No,No,No,Yes,"8:46 AM 22nd Jun,21",2021-06-22 08:46,21
MEMORIAL HOSPITAL,"SH 11, near Mama Bhanja Chowk, Nandwani Nagar, Anand Nagar,, Sonipat, Haryana 131001",Yes (20),16,0,4,2,16,0,4,2,Yes,No,Yes,Yes,Yes,"9:40 AM 6th Jul,21",2021-07-06 09:40,21
NIDAAN HOSPITAL PVT.,"Murthal Rd, Sonipat, Haryana 131001",No (0),0,0,0,0,0,0,0,0,Yes,No,Yes,Yes,Yes,"11:52 AM 17th Jun,21",2021-06-17 11:52,21
OSCAR HOSPITAL,"SH 11, Lakshmi Nagar, Sonipat, Haryana 131001",Yes (20),12,0,8,2,12,0,8,2,Yes,No,Yes,Yes,Yes,"11:52 AM 17th Jun,21",2021-06-17 11:52,21
PHC PURKHAS,"Purkhas, Haryana 131102",Yes (30),0,30,0,0,0,30,0,0,To Be Updated,To Be Updated,To Be Updated,To Be Updated,To Be Updated,"11:52 AM 17th Jun,21",2021-06-17 11:52,21
"SANJIVNI HOSPITAL, SONIPAT","Mehlana Rd, Malviya Nagar, Sonipat, Haryana 131304",Yes (15),14,0,1,1,14,0,1,1,Yes,No,Yes,Yes,Yes,"6:22 PM 27th Jun,21",2021-06-27 18:22,21
SAXSENA HOSPITAL,"112/113, T.P. Scheme, Delhi Rd, Sonipat, Haryana 131304",Yes (23),18,0,5,2,18,0,5,2,Yes,No,Yes,Yes,Yes,"10:37 AM 2nd Jul,21",2021-07-02 10:37,21
SDH GOHANA,"Devi Nagar, Uttam Nagar, Gohana, Haryana 131301",Yes (10),10,0,0,0,10,0,0,0,Yes,Yes,Yes,Yes,Yes,"11:48 AM 17th Jun,21",2021-06-17 11:48,21
SITA HOSPITAL SONIPAT,"Railway Rd, Ganaur, Haryana 131101",Yes (20),20,0,0,0,20,0,0,0,Yes,No,Yes,Yes,Yes,"1:15 PM 26th Jun,21",2021-06-26 13:15,21
SUNHERI DEVI HOSPITAL,"Mission Rd, Dev Nagar, Sonipat, Haryana 131001",Yes (20),15,0,5,1,15,0,5,1,Yes,No,Yes,Yes,Yes,"11:53 AM 17th Jun,21",2021-06-17 11:53,21
TULIP HOSPITAL,"T. P. Scheme, no.15, Delhi Rd, Vivekanand chowk, Sonipat, Haryana 131001",Yes (20),0,0,20,5,0,0,20,5,Yes,No,Yes,Yes,Yes,"11:38 AM 25th Jun,21",2021-06-25 11:38,21
"Ayurvedic Medical College, Patikra",HUDA Sec. 1 Narnaul,Yes (192),35,157,0,0,40,160,0,0,Yes,Yes,Yes,Yes,Yes,"4:32 PM 9th Jun,21",2021-06-09 16:32,13
CHC ATELI,CHC ATELI,Yes (20),15,5,0,0,15,5,0,0,Yes,Yes,Yes,Yes,Yes,"4:33 PM 9th Jun,21",2021-06-09 16:33,13
CHC Kanina,Kanina,Yes (27),15,12,0,0,15,12,0,0,To Be Updated,To Be Updated,To Be Updated,To Be Updated,To Be Updated,"9:48 PM 6th Jun,21",2021-06-06 21:48,13
CHC Nangal Chaudhary,chc nangal choudhary,Yes (10),5,5,0,0,5,5,0,0,No,Yes,Yes,Yes,Yes,"3:54 PM 2nd Jun,21",2021-06-02 15:54,13
CHC Sehlang,CHC SEHLANG,Yes (9),5,4,0,0,5,4,0,0,Yes,Yes,Yes,Yes,Yes,"8:50 AM 28th Jun,21",2021-06-28 08:50,13
Civil Hospital Narnaul,"Housing Board, Narnaul",Yes (77),77,0,0,8,80,0,0,10,Yes,Yes,Yes,Yes,Yes,"4:31 PM 9th Jun,21",2021-06-09 16:31,13
Jaipur Heart &amp; Multi Speciality Hospital,"Opp. Sadar Thana, Narnaul",Yes (13),6,3,4,2,6,3,4,2,Yes,Yes,Yes,Yes,Yes,"9:39 AM 1st Aug,21",2021-08-01 09:39,13
LAXMI NARAYANAN,"Laxmi Narayanan Hospital , Narnaul Road Mahendergarh",Yes (10),6,0,4,1,6,0,4,1,Yes,Yes,Yes,Yes,Yes,"9:33 AM 6th Jun,21",2021-06-06 09:33,13
Nihal Hospital Kanina,Kanina Main Bus Stand,Yes (13),12,0,1,1,13,0,1,1,Yes,Yes,Yes,Yes,Yes,"10:31 AM 21st Jun,21",2021-06-21 10:31,13
Rainbow Multispecialty hospital and trauma Centre,"Singhana road, Narnaul",Yes (13),4,3,6,2,4,3,6,2,Yes,No,Yes,Yes,Yes,"11:59 PM 17th Jun,21",2021-06-17 23:59,13
Sammat Memorial Hospital,"Sastri colony, near bus stand, mahendergarh",Yes (13),10,0,3,2,10,0,3,2,Yes,No,Yes,Yes,Yes,"4:48 PM 24th Jun,21",2021-06-24 16:48,13
Sanwedna Hospital Narnaul,"HUDA Sector 1, Narnaul",Yes (26),17,0,9,1,25,0,9,1,Yes,Yes,Yes,Yes,Yes,"10:40 AM 1st Jun,21",2021-06-01 10:40,13
SDH Mahendergarh,SDH Mahendergarh,Yes (20),20,0,0,5,20,0,0,5,Yes,Yes,Yes,Yes,Yes,"4:33 PM 9th Jun,21",2021-06-09 16:33,13
Shanti Hospital Narnaul,Shanti Hospital Narnaul,Yes (22),9,7,6,2,9,7,7,2,Yes,Yes,Yes,Yes,Yes,"10:22 AM 3rd Jun,21",2021-06-03 10:22,13
Sheela Multi Superspeciality Hospital,Behind Bus Stand Mahindergarh,Yes (9),6,0,3,1,6,0,3,1,Yes,No,Yes,Yes,Yes,"4:33 PM 9th Jun,21",2021-06-09 16:33,13
Shri Arvind Heart and Multispecialty Hospital,"Rao Tula Ram Chowk, Dadri Road Mahendergarh",Yes (17),9,5,3,3,9,5,3,3,Yes,Yes,Yes,Yes,Yes,"5:19 PM 12th Jun,21",2021-06-12 17:19,13
Tanwar Health Care MGarh,,Yes (9),5,0,4,1,5,0,4,1,Yes,No,Yes,Yes,Yes,"11:33 PM 15th Jun,21",2021-06-15 23:33,13
Vijay Hospital Narnaul,"HUDA Sector 1, Narnaul",Yes (22),8,0,14,2,8,0,15,2,Yes,Yes,Yes,Yes,Yes,"9:22 AM 8th Jun,21",2021-06-08 09:22,13
Cygnus Multispecialty Hospital Kaithal,"Huda Bypass Road, Sector 20, Kaithal, Haryana",Yes (40),28,0,12,2,28,0,12,2,Yes,No,Yes,Yes,Yes,"1:02 PM 18th Jul,21",2021-07-18 13:02,10
District Civil Hospital Kaithal,"Huda Sec 18, Kaithal",Yes (112),77,15,20,18,80,15,20,18,Yes,Yes,Yes,Yes,Yes,"8:29 AM 23rd Jul,21",2021-07-23 08:29,10
SDH Guhla,SDH Guhla,Yes (70),35,35,0,5,35,35,0,5,Yes,No,Yes,No,Yes,"9:15 AM 27th Jul,21",2021-07-27 09:15,10
Shah Multispecialty Hospital Kaithal,"opp.old, bus stand, Jind - Kaithal Rd, Amar Garh Colony, Kaithal, Haryana",Yes (76),50,11,15,10,51,11,15,10,Yes,No,Yes,Yes,Yes,"1:06 PM 29th Jul,21",2021-07-29 13:06,10
Adiyogi Arogya Avenue,"232, Subhash Nagar, Near civil hospital back gate, Jhajjar",Yes (15),7,2,6,1,7,2,6,1,To Be Updated,To Be Updated,Yes,Yes,Yes,"1:02 PM 14th Jun,21",2021-06-14 13:02,8
"Advanta Hospital, Jhajjar city","Silani Gate, Jhajjar, Haryana",Yes (50),24,10,16,1,24,10,16,1,Yes,To Be Updated,Yes,To Be Updated,Yes,"4:38 PM 9th Jun,21",2021-06-09 16:38,8
"Brahm Shakti Sanjivani Hospital, B.garh","Opp. BSNL Exchange, Delhi - Rohtak Road, NH9, Bahadurgarh, Haryana",Yes (100),60,20,20,3,60,20,20,3,Yes,No,Yes,Yes,Yes,"11:02 AM 15th Jun,21",2021-06-15 11:02,8
Civil Hospital Jhajjar,"Jhajjar, NH-71, Jhajjar Rohtak Road, Jhajjar, Jhajjar, Haryana",Yes (38),33,0,5,5,33,0,5,5,Yes,To Be Updated,To Be Updated,To Be Updated,To Be Updated,"9:43 AM 31st Jul,21",2021-07-31 09:43,8
"Delhi Hospital, Bahadurgarh","Rohtak Rd, near Shyamji Complex, Ram Nagar, Bahadurgarh, Haryana",Yes (50),20,20,10,2,20,20,10,2,Yes,No,Yes,Yes,Yes,"2:45 PM 1st Jun,21",2021-06-01 14:45,8
Dr. Sanjay Multi Speciality Hospital,INFRONT OF CIVIL HOSPITAL BAHADURGARH,Yes (61),45,10,6,1,45,10,6,1,Yes,No,No,To Be Updated,To Be Updated,"3:29 PM 30th Jun,21",2021-06-30 15:29,8
"Jeewan Jyoti Hospital, Bahadurgarh","Rohtak Rd, MIE Part-B, Bahadurgarh, Haryana",Yes (143),70,68,5,4,70,68,5,4,Yes,To Be Updated,To Be Updated,To Be Updated,To Be Updated,"11:19 AM 15th Jun,21",2021-06-15 11:19,8
"JK Hospital, Bahadurgarh","Bahadurgarh,, Bahamnoli, Bahadurgarh, Haryana",Yes (44),5,31,8,0,5,31,8,0,Yes,To Be Updated,Yes,Yes,Yes,"10:46 AM 17th Jun,21",2021-06-17 10:46,8
"Medicare Super Speciality Hospiatl &amp; Trauma Centre, Jhajjar City","Dadri road Jhajjar, Jhajjar, Haryana",Yes (50),15,23,12,3,15,23,12,3,Yes,To Be Updated,Yes,To Be Updated,Yes,"3:20 PM 15th Jul,21",2021-07-15 15:20,8
"Mission Hospital, Bahadurgarh","Near main Bus Stand & City Metro Station, Rohtak Rd, Bahadurgarh, Jhajjar ,Haryana",Yes (33),25,0,8,4,25,0,8,4,To Be Updated,No,Yes,Yes,No,"10:26 AM 13th Jun,21",2021-06-13 10:26,8
"Oscar Hospital, JJR city","Civil Road,Opp Civil Hospital, Jhajjar, Haryana",Yes (80),8,58,14,1,8,58,14,1,To Be Updated,To Be Updated,To Be Updated,To Be Updated,To Be Updated,"10:08 AM 16th Jun,21",2021-06-16 10:08,8
Oxymus Hospital,"Opposite Civil Hospital, Near Metro Pollar No. 876 Delhi Rohtak Road, Bahadurgarh",Yes (10),4,0,6,0,4,0,6,0,Yes,No,No,No,No,"5:58 PM 6th Jun,21",2021-06-06 17:58,8
"Rana Hospital, Bahadurgarh","OPP. REST HOUSE,OLD BARAHI ROAD, BAHADURGARH",Yes (25),18,0,7,2,18,0,7,2,To Be Updated,To Be Updated,No,No,Yes,"8:47 AM 22nd Jun,21",2021-06-22 08:47,8
"RJ Super Speciality Hospital, B.garh","Delhi - Rohtak Rd, Near Rajesh Joon Office, Dalbir Nagar, Bahadurgarh, Haryana",Yes (17),10,5,2,1,10,5,2,1,Yes,No,Yes,Yes,Yes,"5:05 PM 1st Jul,21",2021-07-01 17:05,8
RS GAUR GLOBAL MULTISPECIALITY HOSPITAL,"Jhajjar Road Netaji Subhash Vihar, Haryana",Yes (33),19,7,7,2,19,7,7,2,Yes,No,Yes,Yes,Yes,"10:19 AM 15th Jun,21",2021-06-15 10:19,8
"SDH, Bahadurgarh","Madhya Marg, Old Industrial Area, Bahadurgarh, Haryana",Yes (35),27,0,8,8,27,0,8,8,Yes,Yes,Yes,No,Yes,"12:46 PM 15th Jun,21",2021-06-15 12:46,8
"Shivam Hospital, B.garh","Line Par, Shastri Nagar, Netaji Nagar, Bahadurgarh, Haryana",Yes (51),30,15,6,1,30,15,6,1,Yes,No,Yes,Yes,Yes,"4:57 PM 13th Jun,21",2021-06-13 16:57,8
"Swastik Hospital, Bahadurgarh","Jhajjar Rd, Shakti Nagar, Sakti Nagar, Bahadurgarh, Haryana",Yes (40),26,4,10,2,26,4,10,2,Yes,No,Yes,Yes,Yes,"9:19 AM 17th Jun,21",2021-06-17 09:19,8
World College Of Medical Sciences And Hospital,"Jhajjar Sampla Road, Gurwar, Jhajjar, Haryana",Yes (250),90,135,25,4,90,135,25,4,Yes,Yes,Yes,Yes,Yes,"9:05 PM 18th Jun,21",2021-06-18 21:05,8
"AADHAR Hospital, Hisar",Tosham Road Hisar,Yes (44),26,6,12,6,26,6,12,6,Yes,No,Yes,Yes,Yes,"7:28 AM 1st Aug,21",2021-08-01 07:28,7
Bharat Multispeciality Hospital,Hisar,Yes (26),24,0,2,2,24,0,2,2,Yes,No,Yes,Yes,Yes,"1:13 PM 1st Aug,21",2021-08-01 13:13,7
Central Medical Centre (CMC),CMC Hospital Delhi Road Hisar,Yes (62),47,5,10,3,47,5,10,3,Yes,Yes,Yes,Yes,Yes,"7:04 PM 1st Aug,21",2021-08-01 19:04,7
Ch. Devi Lal Sanjeevani Make Shift Covid Hopsital Hisar,Near Jindal School Hisar,Yes (500),500,0,0,0,500,0,0,0,Yes,No,Yes,No,Yes,"10:20 AM 29th Jul,21",2021-07-29 10:20,7
Churamani Hospital,CAMP CHOWK HISAR,Yes (37),5,2,30,5,5,2,30,5,No,No,No,No,No,"12:38 PM 28th Jul,21",2021-07-28 12:38,7
District Civil Hospital Hisar,Sirsa Road Hisar,Yes (70),70,0,0,7,70,0,0,7,Yes,Yes,Yes,Yes,Yes,"7:27 AM 1st Aug,21",2021-08-01 07:27,7
DR. ANANTRAM JANTA HOSPITAL PVT LTD BARWALA,Civil Hospital Road Barwala,Yes (17),17,0,0,3,17,0,0,3,Yes,No,Yes,Yes,Yes,"12:37 PM 28th Jul,21",2021-07-28 12:37,7
Geetanjali Hospital,Model Town Hisar,Yes (47),40,0,7,5,40,0,7,5,Yes,Yes,Yes,Yes,Yes,"7:05 PM 1st Aug,21",2021-08-01 19:05,7
Goswami Hospital,"NEAR BUS STAND, RISHI NAGAR",Yes (9),4,5,0,1,4,5,0,1,Yes,No,Yes,Yes,Yes,"7:06 PM 1st Aug,21",2021-08-01 19:06,7
Gupta Hospital Hisar,Sector 14 Hisar,Yes (35),30,0,5,0,30,0,5,0,Yes,Yes,Yes,No,Yes,"7:04 PM 1st Aug,21",2021-08-01 19:04,7
"GURU JAMBHESHWAR MULTISPECIALITY HOSPITAL, AGROHA","ADAMPUR ROAD, AGROHA",Yes (14),9,3,2,1,9,3,2,1,Yes,No,Yes,Yes,Yes,"7:06 PM 1st Aug,21",2021-08-01 19:06,7
Holy Help Hospital,Tosham Road Hisar,Yes (39),25,6,8,1,25,6,8,1,Yes,No,Yes,Yes,Yes,"12:37 PM 28th Jul,21",2021-07-28 12:37,7
Janki Children Hospital Hisar,Near Sewak Sabha Hopsital Hisar,Yes (3),0,1,2,2,0,1,2,2,Yes,No,Yes,Yes,Yes,"12:39 PM 28th Jul,21",2021-07-28 12:39,7
KARTIK HOSPITAL,"NEAR SEWAK SABHA HOSPITAL AND  BUDLA SANT MANDIR, NEAR BUS STAND HISAR",Yes (15),8,5,2,2,8,5,2,2,Yes,No,Yes,To Be Updated,To Be Updated,"7:31 AM 1st Aug,21",2021-08-01 07:31,7
Mahatma Gandhi Hospital,,Yes (42),19,13,10,8,19,13,10,8,Yes,Yes,Yes,Yes,Yes,"7:05 PM 1st Aug,21",2021-08-01 19:05,7
MALIK HOSPITAL,"145A UTTAM NAGAR, HANSI",Yes (7),7,0,0,3,7,0,0,3,Yes,Yes,No,To Be Updated,To Be Updated,"7:06 PM 1st Aug,21",2021-08-01 19:06,7
MAMC Agroha,"Maharaj Aggarsin Medical College, VPO Agroha",Yes (140),85,15,40,44,85,15,40,44,Yes,Yes,Yes,Yes,Yes,"7:26 AM 1st Aug,21",2021-08-01 07:26,7
Military Hospital Hisar,Cantt Hisar,Yes (53),16,35,2,3,16,42,2,3,Yes,To Be Updated,Yes,Yes,Yes,"7:07 PM 28th Jul,21",2021-07-28 19:07,7
NEKIRAM HOSPITAL,OPP BUS STAND HANSI,Yes (5),2,0,3,3,2,0,3,3,Yes,No,Yes,To Be Updated,To Be Updated,"7:30 AM 1st Aug,21",2021-08-01 07:30,7
Noble Super Specialty Hospital,Hisar,Yes (19),12,0,7,1,12,0,7,1,Yes,No,Yes,To Be Updated,Yes,"7:21 AM 29th Jul,21",2021-07-29 07:21,7
OPJindal Institute of Cancer &amp; Research Hospital,Model Town Hisar,Yes (145),100,4,41,45,100,4,41,45,Yes,No,Yes,Yes,Yes,"12:36 PM 28th Jul,21",2021-07-28 12:36,7
PARDEEP KANSAL MULTISPECIALITY HOSPITAL FOR CHILDREN,"25- Inderprastha Colony, Hisar",Yes (13),0,6,7,3,0,6,7,3,Yes,No,Yes,Yes,Yes,"12:38 PM 28th Jul,21",2021-07-28 12:38,7
Parnami Hospital,Hisar,Yes (28),21,5,2,2,21,5,2,2,Yes,Yes,Yes,Yes,Yes,"7:26 AM 1st Aug,21",2021-08-01 07:26,7
Ravindra Hospital Hisar,Model Town HISAR,Yes (21),19,0,2,1,19,0,2,1,Yes,No,Yes,Yes,Yes,"12:37 PM 28th Jul,21",2021-07-28 12:37,7
SAANVI HOSPITAL,"CHC ROAD, BARWALA",Yes (9),5,0,4,1,5,0,4,1,Yes,No,Yes,To Be Updated,To Be Updated,"7:06 PM 1st Aug,21",2021-08-01 19:06,7
SAMAYARA HOSPITAL,"KALI DEVI CHOWK. OPP BHALLA PETROL PUMP, HANSI",Yes (9),4,0,5,1,4,0,5,1,Yes,No,Yes,To Be Updated,To Be Updated,"7:12 AM 26th Jun,21",2021-06-26 07:12,7
Sapra Hospital,Rajgarh Road Hisar,Yes (28),19,3,6,12,19,3,6,12,Yes,Yes,Yes,No,Yes,"7:17 AM 31st Jul,21",2021-07-31 07:17,7
"Sarvodya Hospital, Hisar",Delhi Road Hisar,Yes (32),24,7,1,3,24,7,1,3,Yes,Yes,Yes,Yes,Yes,"7:05 PM 1st Aug,21",2021-08-01 19:05,7
Sewak Sabha Hospital,Near Bus Stand Hisar,Yes (27),16,3,8,1,16,3,8,1,Yes,Yes,Yes,Yes,Yes,"7:04 PM 1st Aug,21",2021-08-01 19:04,7
Shanti Devi Hospital,Delhi Road Hisar,Yes (38),26,0,12,2,26,0,12,2,Yes,No,Yes,Yes,Yes,"7:05 PM 1st Aug,21",2021-08-01 19:05,7
Shri Kali Devi Hospital Hansi,Delhi Road Hansi,Yes (13),8,0,5,0,8,0,5,0,Yes,No,Yes,Yes,Yes,"7:18 AM 20th Jun,21",2021-06-20 07:18,7
SINGLA MULTISPECIALITY HOSPITAL,"RISHI NAGAR, GALI NO. 1, NEAR BUS STAND, HISAR",Yes (19),17,0,2,1,17,0,2,1,Yes,No,Yes,Yes,Yes,"7:05 PM 1st Aug,21",2021-08-01 19:05,7
SL Minda Hospital,VPO Bagla,Yes (8),6,0,2,2,6,0,2,2,Yes,No,Yes,Yes,Yes,"7:27 AM 1st Aug,21",2021-08-01 07:27,7
Sonakshi Children Hospital Hansi,"G T Road, Near Kali Devi Mandir, Opp Bhalla Patrol Pump, Hansi",Yes (13),9,0,4,1,9,0,4,1,Yes,No,Yes,Yes,Yes,"7:12 AM 26th Jun,21",2021-06-26 07:12,7
Sukhda Multispeciality Hospital,Dabra Chowk Hisar,Yes (67),46,4,17,6,46,4,18,6,Yes,Yes,Yes,Yes,Yes,"7:27 AM 1st Aug,21",2021-08-01 07:27,7
Vardaan Hospital Hisar,Hisar,Yes (21),9,1,11,2,9,1,11,2,Yes,Yes,Yes,Yes,Yes,"12:36 PM 28th Jul,21",2021-07-28 12:36,7
Amar Hospotal,Assandh,No (0),0,0,0,0,0,0,0,0,Yes,Yes,Yes,Yes,Yes,"3:37 PM 5th Jul,21",2021-07-05 15:37,11
"AMRITDHARA, Chaura Bazar","Near ITI Chowk, Gahoon Vihar, Karnal, Haryana",Yes (4),4,0,0,0,38,0,26,2,Yes,No,Yes,Yes,Yes,"3:33 PM 5th Jul,21",2021-07-05 15:33,11
Arpana Hospital,"G.T. Road, Madhuban, Karnal, Karnal, Haryana",Yes (18),16,0,2,1,16,0,2,1,Yes,No,Yes,Yes,Yes,"11:52 AM 26th Jul,21",2021-07-26 11:52,11
Arsh Hospital,Opp. Kalpana Chawla Medical College,Yes (15),9,0,6,0,9,0,6,0,Yes,Yes,Yes,Yes,Yes,"3:36 PM 5th Jul,21",2021-07-05 15:36,11
CHC Assandh,"Assandh, Assandh Ruralpart, Haryana",Yes (10),10,0,0,0,10,0,0,0,Yes,No,Yes,No,Yes,"3:32 PM 5th Jul,21",2021-07-05 15:32,11
CHC Gharaunda,"Balinagar, Gharaunda, Haryana",Yes (10),10,0,0,0,10,0,0,0,Yes,No,Yes,No,Yes,"3:32 PM 5th Jul,21",2021-07-05 15:32,11
CHC Kunjpura,Village Kunjpura,Yes (11),11,0,0,0,11,0,0,0,To Be Updated,Yes,Yes,Yes,Yes,"3:36 PM 5th Jul,21",2021-07-05 15:36,11
CHC Nissing,"SH 8, Gondar, Nissing, Haryana",Yes (10),10,0,0,0,10,0,0,0,Yes,No,Yes,No,Yes,"3:32 PM 5th Jul,21",2021-07-05 15:32,11
CHC Taraori,CHC Taraori,Yes (6),6,0,0,0,6,0,0,0,Yes,No,Yes,No,Yes,"3:39 PM 5th Jul,21",2021-07-05 15:39,11
Dr. Gian Bhushan Hospital,"Kunjpura Rd Old Char Chaman Dyal Singh Colony Karnal  132001 Republic of,",Yes (8),3,0,5,0,6,0,5,0,Yes,No,No,No,No,"3:34 PM 5th Jul,21",2021-07-05 15:34,11
Ishwar Kirpa Hospital,"Ishwar Kirpa Hospital, Sector -14",Yes (20),14,0,6,0,14,0,7,0,Yes,No,Yes,Yes,Yes,"5:43 PM 11th Jul,21",2021-07-11 17:43,11
"Kalpana Chawla Government Medical College, Karnal","Model Town, Karnal, Haryana",Yes (2),1,0,1,0,200,0,80,80,Yes,Yes,Yes,Yes,Yes,"3:33 PM 5th Jul,21",2021-07-05 15:33,11
Karnal Nursing Home,"26 Duggal Colony, Karnal",Yes (16),8,0,8,0,8,0,10,0,Yes,To Be Updated,Yes,Yes,Yes,"3:38 PM 5th Jul,21",2021-07-05 15:38,11
Maxxwell Hospital Indri,Near Budhnath Dera Ward No 1,Yes (15),10,0,5,3,10,0,5,3,Yes,Yes,Yes,Yes,Yes,"3:35 PM 5th Jul,21",2021-07-05 15:35,11
Park Hospital karnal,"CHD City, NH-1, Sector 45, Karnal, Haryana",Yes (30),10,0,20,2,10,0,20,2,To Be Updated,To Be Updated,To Be Updated,To Be Updated,To Be Updated,"3:32 PM 5th Jul,21",2021-07-05 15:32,11
Rama Superspeciality Hospital,Civil Hosp Chowk Karnal,No (0),0,0,0,0,8,0,6,0,Yes,No,Yes,Yes,Yes,"3:37 PM 5th Jul,21",2021-07-05 15:37,11
RP Welltar Hospital,"Vill. Bastara, District Karnal",Yes (17),9,4,4,1,10,4,4,1,Yes,No,Yes,No,Yes,"3:34 PM 5th Jul,21",2021-07-05 15:34,11
Sanidhya Nursing Home,"indri, Karnal",Yes (15),10,0,5,0,10,0,5,0,To Be Updated,Yes,Yes,Yes,Yes,"3:35 PM 5th Jul,21",2021-07-05 15:35,11
"Sanjiv Bansal Cygnus Hospital , Karnal","Railway Rd, Ibrahim Mandi, Karnal, Haryana",Yes (19),17,0,2,2,20,0,5,2,Yes,Yes,Yes,Yes,Yes,"9:52 AM 17th Jul,21",2021-07-17 09:52,11
Sarvodya Hospital Karnal,"Sector 14, Near Tau Devi Lal Chowk",Yes (22),12,0,10,0,12,0,10,0,Yes,Yes,Yes,Yes,Yes,"3:38 PM 5th Jul,21",2021-07-05 15:38,11
SDH Nilokheri,SDH Nilokheri,Yes (10),10,0,0,0,10,0,0,0,Yes,No,Yes,No,Yes,"3:39 PM 5th Jul,21",2021-07-05 15:39,11
Shri Ram Chand Memorial Hospital,"12, Ashoka colony,Opp Kalpana Chawla hospital, Karnal, Haryana",No (0),0,0,0,0,8,0,7,3,Yes,No,Yes,Yes,Yes,"3:34 PM 5th Jul,21",2021-07-05 15:34,11
Shri Sanatan Dharam Mahabir Dal,"Kunjpura Road, Karnal Near Sanatan Dharam Mandir",Yes (12),12,0,0,0,12,0,0,0,Yes,Yes,Yes,Yes,Yes,"3:34 PM 5th Jul,21",2021-07-05 15:34,11
SS Hospital,"Sector 14, Karnal",Yes (14),7,0,7,0,7,0,7,0,Yes,To Be Updated,Yes,Yes,Yes,"3:37 PM 5th Jul,21",2021-07-05 15:37,11
Swastik Hospital,Swastic Hospital Opp DCH,Yes (19),10,0,9,0,10,0,9,0,Yes,No,Yes,Yes,Yes,"3:38 PM 5th Jul,21",2021-07-05 15:38,11
Virk Hospital Karnal,"363-364, Randhir lane, near Dyal Singh College, Karnal, Haryana",Yes (45),37,0,8,1,37,0,8,1,Yes,Yes,Yes,Yes,Yes,"12:34 PM 1st Aug,21",2021-08-01 12:34,11
Civil Hospital Fatehabad,Near Bus Stand Fatehabad,Yes (46),20,0,26,6,20,0,26,6,Yes,Yes,Yes,Yes,Yes,"3:02 PM 1st Jul,21",2021-07-01 15:02,5
Civil Hospital Ratia,"Dera Surjanhar, Ratia, Fatehabad",Yes (18),5,0,13,3,5,0,13,3,Yes,Yes,Yes,Yes,Yes,"3:04 PM 1st Jul,21",2021-07-01 15:04,5
"Civil Hospital, Tohana",Opposite New Sabzi Mandi Tohana,Yes (27),10,3,14,2,10,3,14,2,Yes,Yes,Yes,Yes,Yes,"3:04 PM 1st Jul,21",2021-07-01 15:04,5
Community Health Center Bhattu,"Surya Nagar, Bhattu Mandi near Railway Station",Yes (12),4,2,6,0,4,2,6,0,Yes,Yes,Yes,Yes,Yes,"3:06 PM 1st Jul,21",2021-07-01 15:06,5
Community Health Center Bhuna,CHC Bhuna,Yes (30),16,14,0,0,16,14,0,0,Yes,No,Yes,Yes,Yes,"3:05 PM 1st Jul,21",2021-07-01 15:05,5
Community Health Center JAKHAL,Near SBI Bank Jakhal,Yes (12),6,0,6,0,6,0,6,0,Yes,Yes,Yes,Yes,Yes,"3:05 PM 1st Jul,21",2021-07-01 15:05,5
