name,address,Availability_availability_of_beds,Availability_oxygen_beds,Availability_non_oxygen_beds,Availability_i_c_u_beds,Availability_ventilators,Allocated_oxygen_beds,Allocated_non_oxygen_beds,Allocated_i_c_u,Allocated_ventilators,Availability_availability_of_oxygen,Availability_antiviral_remdesivir_etc_,Availability_steroids,Availability_anticoagulant,Availability_antipyretic,updated_on,city
Kathuria Hospital,"9/8, Modal Town, Opp. S.D. School, Khandsa Road, Gurugram",Yes (10),6,0,4,0,8,0,12,2,To Be Updated,To Be Updated,To Be Updated,To Be Updated,To Be Updated,2021-05-12 11:21,6
Life Aid Medical Centre,"1097, Sector 40, Gurugram",No (0),0,0,0,0,10,0,4,0,To Be Updated,To Be Updated,To Be Updated,To Be Updated,To Be Updated,2021-05-02 19:35,6
LOTUS HOSPITAL,"389, 3, Mata Rd, Prem Nagar, Sector 13, Gurugram, Haryana",No (0),0,0,0,0,7,0,3,0,Yes,No,Yes,Yes,Yes,2021-05-12 15:07,6
Madalasa Hospital,"NH-3,BEHIND HUDA MARKET,SECTOR-46,GURGAON,HARYANA",Yes (1),1,0,0,0,10,0,6,0,To Be Updated,To Be Updated,To Be Updated,To Be Updated,To Be Updated,2021-05-09 09:05,6
MAHADEV HOSPITAL,"876, 2, Mata Rd, near Bus Stand, Rajiv Nagar, Sector 12, Gurugram, Haryana",Yes (17),11,0,6,0,12,0,8,1,Yes,No,Yes,Yes,Yes,2021-05-12 15:32,6
Mamta Hospital,"877/2, Mata Road,Near Haryana Roadways Workshop, Gurugram",Yes (15),11,0,4,0,20,0,7,1,No,No,Yes,Yes,Yes,2021-05-12 17:04,6
Mangalam Hospital,"Gandhi Nagar Rd, Gandhi Nagar, Sector 11, Gurugram, Haryana",Yes (7),7,Beds Over Utilized 1,0,0,9,0,0,0,Yes,No,Yes,Yes,Yes,2021-05-11 22:42,6
Max Hospital,"B Block, Sushant Lok 1, Near Huda City Centre, Gurugram",No (0),0,0,0,0,58,0,14,6,Yes,Yes,Yes,Yes,Yes,2021-05-12 17:22,6
Mayom Hospital,"D-Block, 19, South City Rd Number 1, Block G, South City I, Sector 41, Gurugram",No (0),0,0,0,0,54,5,12,4,Yes,No,Yes,Yes,Yes,2021-05-12 08:43,6
Medanta the Medicity,"CH Baktawar Singh Rd, Near Olympus, Medicity, Islampur Colony, Sector 38, Gurugram",No (0),0,0,0,Beds Over Utilized 27,246,0,155,40,Yes,Yes,Yes,Yes,Yes,2021-05-12 10:55,6
Medeor Hospital,"Plot no 2, Sector 5, IMT Manesar, Gurugram",Yes (19),19,0,0,0,42,0,18,11,Yes,No,Yes,No,Yes,2021-05-12 10:00,6
MEDOX HOSPITAL,"Bhondsi, Sohna Rd, Gurugram, Haryana",Yes (5),5,0,0,0,25,0,4,2,To Be Updated,To Be Updated,To Be Updated,To Be Updated,To Be Updated,2021-05-05 03:01,6
Metro Hospital,"H Block, Chauma Village, Sector 1, Palam Vihar, Gurugram",Yes (21),21,0,0,0,40,0,28,8,Yes,No,Yes,Yes,Yes,2021-05-12 11:37,6
Naryana Hospital,"Plot 3201, Block - V, DLF Phase - III, Nathupur, Sector 24, Gurugram",No (0),0,0,0,0,35,13,14,6,Yes,Yes,Yes,Yes,Yes,2021-05-12 09:57,6
Orbit Hospital,"Sec 32, Main Jharsa Road, Gurugram",Yes (4),0,0,4,0,12,0,4,0,No,No,Yes,Yes,Yes,2021-05-12 08:38,6
Paras Hospital,"Phase- I, Paras Hospitals, C-1, Sushant Lok Phase I, Sector 43, Gurugram",No (0),0,0,0,0,117,14,46,14,Yes,Yes,Yes,Yes,Yes,2021-05-12 10:44,6
Park Hospital,"Q Block South City 2, Sohna Rd, Main, Sector 47, Gurugram",No (0),0,0,0,0,12,0,58,30,Yes,No,Yes,Yes,Yes,2021-05-12 08:27,6
Polaris Hospital,"Opp. Raheja Mall, Sohna Road, Sector-48,Gurugram, near Vipul Business Park, Gurugram",Yes (4),Beds Over Utilized 1,4,0,0,4,12,0,0,No,No,No,No,To Be Updated,2021-05-12 12:34,6
"Poly Clinic Sector 31, Gurugram","388, LIG Colony, Sector 31, Gurugram",Yes (7),6,1,0,0,7,3,0,0,Yes,No,No,No,Yes,2021-05-12 11:05,6
Prakash Hospital and Trauma Centre,"NH 8, Manesar Bus Stand, Manesar, Gurugram",Yes (19),7,12,0,0,16,15,5,0,To Be Updated,No,Yes,Yes,Yes,2021-05-12 10:12,6
Pushpanjali Hospital,"Civil Line Road, near Rajiv Chowk, Gurugram",Yes (16),12,0,4,0,18,0,15,2,Yes,No,Yes,Yes,Yes,2021-05-12 10:29,6
RBS HOSPITAL,"U Block, DLF Phase 3 Rao Balbir Singh, Market, U-37 Rd, Nathupur, Sector 24, Gurugram, Haryana",Yes (7),6,Beds Over Utilized 3,1,0,10,0,5,1,Yes,No,Yes,To Be Updated,To Be Updated,2021-05-11 19:28,6
Safe Hands Hospital,"Plot No. 68-P, Sector 46, Gurugram, Haryana",No (0),0,0,0,0,5,0,3,1,To Be Updated,To Be Updated,To Be Updated,To Be Updated,To Be Updated,2021-05-10 08:05,6
SAI SIDDHI HOSPITAL,"82-P, Residency Green, Jal Vihar Colony, Sector 46, Gurugram, Haryana",No (0),0,0,0,0,4,0,6,0,To Be Updated,To Be Updated,To Be Updated,To Be Updated,To Be Updated,2021-05-05 03:31,6
Samvit Health Care,"1, Sohna Rd, Islampur Village, Sector 38, Gurugram, Haryana",Yes (5),3,2,0,0,8,6,3,0,To Be Updated,To Be Updated,To Be Updated,To Be Updated,To Be Updated,2021-05-12 15:23,6
Sanjeevani hospital,"Near Radha Krishan Mandir, Sohna - Gurgaon Rd, opposite Corporation Bank, Badshahpur, Sector 66, Gurugram, Haryana",Yes (7),5,0,2,1,15,0,5,1,To Be Updated,Yes,Yes,Yes,Yes,2021-05-11 09:13,6
Sarvodya Hospital,"1031/1, Old Railway Rd, Sector 5, Gurugram, Haryana",No (0),0,0,0,0,14,0,6,1,To Be Updated,To Be Updated,To Be Updated,To Be Updated,To Be Updated,2021-05-11 16:52,6
Satyam Medicare Hospital,C-2 17 dlf phase 1 Arjun marg,Yes (19),18,0,1,0,21,0,4,1,Yes,No,No,No,No,2021-05-12 16:51,6
Sethi Hospital,"02, 301, 4, Basai Rd, Model Town, Gurugram",Yes (4),2,0,2,0,18,0,4,0,No,To Be Updated,Yes,Yes,To Be Updated,2021-05-12 12:28,6
"SGT Medical College &amp; Research Institute, Budhera","C/o Shree Guru Gobind Singh Tricentenary University, Inner College Road, Budhera, Gurugram",Yes (310),15,295,0,0,50,300,10,10,No,No,Yes,Yes,Yes,2021-05-12 16:15,6
Shaan foundation,"521A, second floor, Saini market, Choma",Yes (20),20,0,0,0,20,0,0,0,Yes,To Be Updated,To Be Updated,To Be Updated,To Be Updated,2021-05-09 16:49,6
Sheetla Hospital,"Near DSD College, New Railway Road, Gurugram",Yes (14),9,5,0,0,21,5,5,0,Yes,Yes,Yes,Yes,Yes,2021-05-12 17:13,6
Shri Govind Hospital,"601, 20, Madanpuri Rd, Manohar Nagar, Sector 7, Gurugram",Yes (15),6,9,0,0,14,10,0,0,Yes,No,Yes,Yes,Yes,2021-05-11 17:24,6
Signature Hospital,"Near Euro International School, Sector 37D, Gurugram",Yes (6),6,0,0,0,14,30,14,5,Yes,Yes,Yes,Yes,Yes,2021-05-12 11:05,6
SPES HOSPITAL,"369/20 SHANTI NAGAR SEC- 11, GURGAON",Yes (14),8,0,6,2,15,0,13,3,No,No,Yes,No,No,2021-05-10 10:38,6
Sunrise Hospital,"Near Sector 10 A, Gurugram",Yes (26),15,11,0,0,18,11,15,6,Yes,No,Yes,Yes,Yes,2021-05-12 16:57,6
Thakral Hospital and Fertility Center,"316 16, Sohna Alwar, Road, behind Petrol Pump, Shivaji Nagar, Sector 11, Gurugram, Haryana 122001",No (0),0,0,0,0,0,0,0,0,To Be Updated,To Be Updated,To Be Updated,To Be Updated,To Be Updated,2021-05-05 02:12,6
Triveni hospital,"Near Canara Bank, Near Dhobi Ghaat, Old Railway Rd, Sector 8, Gurugram, Haryana",Yes (17),14,0,3,0,14,0,6,0,Yes,No,Yes,Yes,Yes,2021-05-11 13:46,6
Tulasi Healthcare,"Sector 64, next to Shriram millennium school, Gurugram, Haryana",Yes (11),0,11,0,0,0,20,0,0,Yes,No,Yes,Yes,No,2021-05-12 13:28,6
Umkal Hospital,"A-5/20 Sushant Lok-1, Gurugram",Yes (13),0,13,0,0,12,18,7,2,Yes,Yes,Yes,Yes,Yes,2021-05-11 14:25,6
Vaishnavi nursing home,"Delhi - Jaipur Expy, Sector 33, Gurugram, Haryana",Yes (3),0,3,0,0,2,4,0,0,Yes,No,Yes,Yes,Yes,2021-05-11 20:24,6
Vardan Hospital gurgaon,"Opposite Devi Lal Stadium, Ward # 5, Sohna Gurugram",Yes (8),8,0,0,0,17,0,5,1,Yes,No,Yes,No,Yes,2021-05-12 17:21,6
Vardhman Medicare Centre,"239, Sector 5, Gurugram, Haryana 122001",No (0),0,0,0,0,0,0,0,0,To Be Updated,To Be Updated,To Be Updated,To Be Updated,To Be Updated,2021-05-09 09:03,6
Vedic hospital,L c Umang Bhardwaj chowk main Pataudi road gurugram,No (0),0,0,0,0,15,0,5,1,To Be Updated,To Be Updated,To Be Updated,To Be Updated,To Be Updated,2021-05-11 16:59,6
VS hospital,Hayatpur chowk sec 93 ggn,Yes (2),2,0,0,0,10,0,4,0,To Be Updated,To Be Updated,To Be Updated,To Be Updated,To Be Updated,2021-05-12 14:00,6
W.Pratiksha Hospital,"Golf Course Ext Rd, Sushant Lok-II, Shushant Lok 2, Sector 56, Gurugram",No (0),0,0,0,0,21,0,9,2,Yes,Yes,Yes,Yes,Yes,2021-05-12 15:54,6
Yashroop Hospital,"12-P, Sector 9, Neki Ram Marg, Gurugram,",Yes (13),13,0,0,0,13,0,0,0,No,No,No,No,Yes,2021-05-12 10:55,6
BALAJI HOSPITAL,"Yamuna Nagar, Haryana",Yes (2),2,0,0,0,10,2,0,0,Yes,No,Yes,Yes,Yes,2021-05-12 11:37,22
Ch Lekh Raj Multispeciality Hospital,Vill Gadhauli Yamuna Nagar,Yes (132),68,0,64,0,80,0,70,0,Yes,No,Yes,Yes,Yes,2021-05-12 11:35,22
CHC Bilaspur,CHC Bilaspur,Yes (11),5,6,0,0,8,17,0,0,Yes,No,Yes,No,Yes,2021-05-12 11:30,22
CHC Chhachharuli,CHC Chhachharuli,Yes (14),5,9,0,0,10,20,0,0,Yes,No,Yes,Yes,Yes,2021-05-12 11:30,22
CHC Naharpur,Naharpur Yamuna Nagar,No (0),0,0,0,0,0,0,0,0,Yes,No,Yes,Yes,Yes,2021-05-12 11:35,22
CHC Partap Nagar,CHC Partap Nagar,Yes (16),10,6,0,0,10,10,0,0,Yes,No,No,No,Yes,2021-05-12 11:53,22
CHC Radaur,Radaur Yamuna Nagar,Yes (10),10,0,0,0,10,0,0,0,Yes,No,Yes,Yes,Yes,2021-05-12 11:35,22
CHC Saraswati Nagar,CHC Saraswati Nagar,Yes (3),3,0,0,0,14,11,0,0,Yes,No,Yes,No,Yes,2021-05-12 11:31,22
DABRA HOSPITAL Yamunanagar,DABRA HOSPITAL,No (0),0,0,0,0,11,8,4,2,No,No,No,No,No,2021-05-12 11:31,22
ESI Hospital,"ESI Hospital, Jagadhri",Yes (20),2,12,6,0,46,12,6,0,Yes,No,Yes,Yes,Yes,2021-05-12 11:28,22
Gaba Hospital,Gaba Hospital Yamunanagar,Yes (8),0,8,0,0,100,25,20,5,Yes,Yes,Yes,Yes,Yes,2021-05-12 11:28,22
GULATI HOSPITAL,GULATI HOSPITAL,No (0),0,0,0,0,27,3,4,0,Yes,No,Yes,Yes,Yes,2021-05-12 11:31,22
Heart Care Center Hospital,Near Lal Dwara Mandir Yamuna Nagar,Yes (7),0,1,6,0,2,1,19,7,Yes,No,Yes,Yes,Yes,2021-05-12 11:29,22
JP Hospital Pvt,"Jagadhri Rd, near Luxmi Theater, Vishwakarma Mohalla, Yamuna Nagar,HARAYANA Haryana",No (0),0,0,0,0,15,15,13,2,Yes,No,Yes,Yes,Yes,2021-05-12 11:29,22
KAPOOR HOSPITAL,"SH 6A Indira Colony Jagadhri, yamunanagart ,Haryana",Yes (3),2,0,1,0,4,0,8,0,Yes,No,Yes,Yes,Yes,2021-05-12 11:34,22
KESHWANI HOSPITAL,"Jagadhri - Yamuna Nagar Rd, Tagore Garden, Yamuna Nagar, Haryana",No (0),0,0,0,0,10,0,0,0,Yes,No,Yes,Yes,Yes,2021-05-12 11:37,22
Maxxwell Hospital,Jagadhari Yamuna Nagar,Yes (11),6,1,4,0,10,1,6,0,Yes,No,Yes,Yes,Yes,2021-05-12 11:32,22
Mukand Lal District Civil Hospital Yamunanagar,Mukand Lal District Civil Hospital YNR,Yes (7),4,3,0,1,4,5,0,5,Yes,No,Yes,Yes,Yes,2021-05-12 11:32,22
NIRMAL HOSPITAL,"199, Radaur Rd, near nirmal hospital, camp, Garhi Gujran, Haryana",Yes (5),5,0,0,0,13,1,6,0,Yes,No,Yes,Yes,Yes,2021-05-12 11:29,22
RK Gupta,opp DAV Sr Sec School Near Madhu Hotel YNR,Yes (1),0,1,0,0,16,2,0,0,Yes,Yes,Yes,Yes,Yes,2021-05-12 11:36,22
SABBARWAL HOSPITAL,"Gulab Nagar, Jagadhri, Haryana",No (0),0,0,0,0,6,1,6,0,Yes,No,Yes,Yes,Yes,2021-05-12 11:34,22
Sachdeva Hospital,"2227, Civil Lines Rd, Sri Nagar Colony, Civil Lines, Gomti Mohalla, Jagadhri, Haryana",Yes (8),0,8,0,0,15,10,3,0,Yes,No,Yes,Yes,Yes,2021-05-12 11:37,22
Santosh Hospital,"Santosh Hospital  Kanhaiya Sahib Chowk, near Govt.School, Harbanspura Colony, Gobind Pura, Yamuna Nagar, Haryana",Yes (1),0,1,0,0,5,9,14,2,Yes,No,Yes,Yes,Yes,2021-05-12 11:13,22
SHARMA HOSPITAL,Near Agarsain Chowk Jagadhri,No (0),0,0,0,0,12,0,0,0,Yes,No,Yes,Yes,Yes,2021-05-12 11:34,22
Shureshtha Hospital,Model Colony YNR,No (0),0,0,0,0,9,1,2,0,Yes,No,Yes,Yes,Yes,2021-05-12 11:36,22
SP Hospital Jag,S.P Hospital Jag,No (0),0,0,0,0,4,0,3,1,Yes,No,Yes,Yes,Yes,2021-05-12 11:33,22
Swami Vivekanand Hospital Yamunanagar,"Swami Vivekanand Hospital,Yamuna Nagar, Haryana",Yes (15),9,6,0,0,20,10,19,1,Yes,No,Yes,Yes,Yes,2021-05-12 11:33,22
tejli stadium,64 A Tejli,Yes (43),5,38,0,0,15,61,0,0,Yes,No,No,No,Yes,2021-05-12 11:33,22
VARDAAN HOSPITAL,OPP KOHLI HOSPITAL NEAR AGARSEN COLLEGE JAGADHRI,Yes (3),3,0,0,0,8,2,0,0,Yes,No,Yes,Yes,Yes,2021-05-12 11:37,22
WARYAM SINGH HOSPITAL,NEAR CIVIL HOSPITAL YAMUNA NAGAR,Yes (16),0,16,0,0,18,35,2,0,Yes,Yes,Yes,Yes,Yes,2021-05-12 11:35,22