name,address,Availability_availability_of_beds,Availability_oxygen_beds,Availability_non_oxygen_beds,Availability_i_c_u_beds,Availability_ventilators,Allocated_oxygen_beds,Allocated_non_oxygen_beds,Allocated_i_c_u,Allocated_ventilators,Availability_availability_of_oxygen,Availability_antiviral_remdesivir_etc_,Availability_steroids,Availability_anticoagulant,Availability_antipyretic,updated_on_unparsed,updated_on,city
GH Charkhi Dadri,"Near Loharu Chowk,Charkhi Dadri",Yes (51),35,15,1,11,35,15,1,11,Yes,Yes,Yes,Yes,Yes,"3:39 PM 21st Jun,21",2021-06-21 15:39,3
Jaihind Hospital,Charkhi Dadri,Yes (13),7,1,5,0,7,1,5,0,Yes,Yes,Yes,To Be Updated,To Be Updated,"3:41 PM 21st Jun,21",2021-06-21 15:41,3
Murari Lal Rasiwasia Ayurvedic Hospital,"Delhi Road,Near Janta College",Yes (70),60,10,0,0,60,10,0,0,Yes,Yes,Yes,Yes,Yes,"3:39 PM 21st Jun,21",2021-06-21 15:39,3
Oscar Hospital,Charkhi Dadri,Yes (20),0,0,20,0,0,0,20,0,To Be Updated,To Be Updated,To Be Updated,To Be Updated,To Be Updated,"3:40 PM 21st Jun,21",2021-06-21 15:40,3
Pradhan Medicare Centre,"Loharu Rd, Charkhi Dadri, Haryana",Yes (17),14,0,3,0,14,0,3,0,To Be Updated,Yes,Yes,Yes,Yes,"3:39 PM 21st Jun,21",2021-06-21 15:39,3
Sunflag Hospital,Charkhi Dadri,Yes (12),6,0,6,0,6,0,6,0,To Be Updated,To Be Updated,To Be Updated,To Be Updated,To Be Updated,"3:40 PM 21st Jun,21",2021-06-21 15:40,3
Alchemist Hospital panchkula,Sector 21 Panchkula,Yes (16),12,0,4,3,15,0,4,3,Yes,Yes,Yes,Yes,Yes,"9:46 AM 24th Jun,21",2021-06-24 09:46,16
Alchemist Ojas Hospital,"H1  SEctor 26, Panchkula Ext, Panchkula",Yes (66),54,0,12,3,54,0,13,4,Yes,Yes,Yes,Yes,Yes,"9:47 AM 24th Jun,21",2021-06-24 09:47,16
Civil Hospital Panchkula,sector 6 Panchkula,Yes (49),42,5,2,5,45,8,10,10,Yes,Yes,Yes,Yes,Yes,"9:45 AM 24th Jun,21",2021-06-24 09:45,16
JN Shory Hospital,Pinjore,Yes (24),18,6,0,0,18,6,0,0,Yes,No,Yes,Yes,Yes,"9:47 AM 24th Jun,21",2021-06-24 09:47,16
Kare Partners Hospital,"Sector 2, Panchkula",Yes (13),13,0,0,0,13,0,0,0,Yes,No,Yes,Yes,Yes,"9:47 AM 24th Jun,21",2021-06-24 09:47,16
Paras Hospital Pvt,"Plot no 2, sec 22, panchkula",Yes (19),2,0,17,6,2,0,17,6,Yes,Yes,Yes,Yes,Yes,"9:46 AM 24th Jun,21",2021-06-24 09:46,16
Wings Hospital,Sector 25 Panchkula,Yes (31),15,11,5,0,15,11,5,0,Yes,No,Yes,Yes,Yes,"9:47 AM 24th Jun,21",2021-06-24 09:47,16
Civil Hospital Fatehabad,Near Bus Stand Fatehabad,Yes (46),20,0,26,6,20,0,26,6,Yes,Yes,Yes,Yes,Yes,"3:02 PM 1st Jul,21",2021-07-01 15:02,5
Civil Hospital Ratia,"Dera Surjanhar, Ratia, Fatehabad",Yes (18),5,0,13,3,5,0,13,3,Yes,Yes,Yes,Yes,Yes,"3:04 PM 1st Jul,21",2021-07-01 15:04,5
"Civil Hospital, Tohana",Opposite New Sabzi Mandi Tohana,Yes (27),10,3,14,2,10,3,14,2,Yes,Yes,Yes,Yes,Yes,"3:04 PM 1st Jul,21",2021-07-01 15:04,5
Community Health Center Bhattu,"Surya Nagar, Bhattu Mandi near Railway Station",Yes (12),4,2,6,0,4,2,6,0,Yes,Yes,Yes,Yes,Yes,"3:06 PM 1st Jul,21",2021-07-01 15:06,5
Community Health Center Bhuna,CHC Bhuna,Yes (30),16,14,0,0,16,14,0,0,Yes,No,Yes,Yes,Yes,"3:05 PM 1st Jul,21",2021-07-01 15:05,5
Community Health Center JAKHAL,Near SBI Bank Jakhal,Yes (12),6,0,6,0,6,0,6,0,Yes,Yes,Yes,Yes,Yes,"3:05 PM 1st Jul,21",2021-07-01 15:05,5
"Gupta Children Hospital, Ratia","Aggarwal Colony, Ratia",Yes (16),6,8,2,1,6,8,2,1,Yes,Yes,Yes,Yes,Yes,"3:06 PM 1st Jul,21",2021-07-01 15:06,5
Kaushal Hospital,"Near Harvinder Singh Petrol Pump, Hisar Road, Fatehabad",Yes (18),12,0,6,4,12,0,6,4,Yes,Yes,Yes,Yes,Yes,"3:06 PM 1st Jul,21",2021-07-01 15:06,5
"Manav Sewa Sangam Hospital, Tohana",Near Truck Union,Yes (15),15,0,0,0,15,0,0,0,Yes,Yes,Yes,Yes,Yes,"11:01 AM 8th Jun,21",2021-06-08 11:01,5
Miglani Hospital,"Employees Colony, Ratia,",Yes (24),15,2,7,7,15,2,7,7,Yes,Yes,Yes,Yes,Yes,"3:05 PM 1st Jul,21",2021-07-01 15:05,5
Rajasthan Medical Centre (RMC) Hospital Tohana,Kenchi Chowk Tohana,Yes (15),11,0,4,2,11,0,4,2,Yes,Yes,Yes,Yes,Yes,"10:40 AM 16th Jun,21",2021-06-16 10:40,5
Sadhbhawdna Hospital Fatehabad,Near Court Complex Hisar Road Fatehabad,Yes (50),15,20,15,5,15,20,15,5,Yes,Yes,Yes,Yes,Yes,"3:04 PM 1st Jul,21",2021-07-01 15:04,5
Sanjeevani Hospital Fatehabad,"Goshala Road, near Ashirbad Pelace",Yes (10),6,0,4,3,6,0,4,3,Yes,Yes,Yes,Yes,Yes,"3:07 PM 1st Jul,21",2021-07-01 15:07,5
Sanjeevani Hospital Tohana,"Kenchi Chock, Tohana",Yes (18),0,6,12,2,0,6,12,2,Yes,Yes,Yes,Yes,Yes,"3:05 PM 1st Jul,21",2021-07-01 15:05,5
"Singla Hospital , fatehabad","Bhattu Road, Batra Colony, Fatehabad",Yes (13),5,8,0,0,5,8,0,0,Yes,Yes,Yes,Yes,Yes,"3:06 PM 1st Jul,21",2021-07-01 15:06,5
WadhwaMaternity and surgical Hospital Fatehabad,"Near Papiha Park, Fatehabad",Yes (8),1,0,7,1,1,0,7,1,Yes,Yes,Yes,Yes,Yes,"3:04 PM 1st Jul,21",2021-07-01 15:04,5
"Ayurvedic Medical College, Patikra",HUDA Sec. 1 Narnaul,Yes (192),35,157,0,0,40,160,0,0,Yes,Yes,Yes,Yes,Yes,"4:32 PM 9th Jun,21",2021-06-09 16:32,13
CHC ATELI,CHC ATELI,Yes (20),15,5,0,0,15,5,0,0,Yes,Yes,Yes,Yes,Yes,"4:33 PM 9th Jun,21",2021-06-09 16:33,13
CHC Kanina,Kanina,Yes (27),15,12,0,0,15,12,0,0,To Be Updated,To Be Updated,To Be Updated,To Be Updated,To Be Updated,"9:48 PM 6th Jun,21",2021-06-06 21:48,13
CHC Nangal Chaudhary,chc nangal choudhary,Yes (10),5,5,0,0,5,5,0,0,No,Yes,Yes,Yes,Yes,"3:54 PM 2nd Jun,21",2021-06-02 15:54,13
CHC Sehlang,CHC SEHLANG,Yes (9),5,4,0,0,5,4,0,0,Yes,Yes,Yes,Yes,Yes,"8:50 AM 28th Jun,21",2021-06-28 08:50,13
Civil Hospital Narnaul,"Housing Board, Narnaul",Yes (77),77,0,0,8,80,0,0,10,Yes,Yes,Yes,Yes,Yes,"4:31 PM 9th Jun,21",2021-06-09 16:31,13
Jaipur Heart &amp; Multi Speciality Hospital,"Opp. Sadar Thana, Narnaul",Yes (13),6,3,4,2,6,3,4,2,Yes,Yes,Yes,Yes,Yes,"9:10 AM 7th Aug,21",2021-08-07 09:10,13
LAXMI NARAYANAN,"Laxmi Narayanan Hospital , Narnaul Road Mahendergarh",Yes (10),6,0,4,1,6,0,4,1,Yes,Yes,Yes,Yes,Yes,"9:33 AM 6th Jun,21",2021-06-06 09:33,13
Nihal Hospital Kanina,Kanina Main Bus Stand,Yes (13),12,0,1,1,13,0,1,1,Yes,Yes,Yes,Yes,Yes,"10:31 AM 21st Jun,21",2021-06-21 10:31,13
Rainbow Multispecialty hospital and trauma Centre,"Singhana road, Narnaul",Yes (13),4,3,6,2,4,3,6,2,Yes,No,Yes,Yes,Yes,"11:59 PM 17th Jun,21",2021-06-17 23:59,13
Sammat Memorial Hospital,"Sastri colony, near bus stand, mahendergarh",Yes (13),10,0,3,2,10,0,3,2,Yes,No,Yes,Yes,Yes,"4:48 PM 24th Jun,21",2021-06-24 16:48,13
Sanwedna Hospital Narnaul,"HUDA Sector 1, Narnaul",Yes (26),17,0,9,1,25,0,9,1,Yes,Yes,Yes,Yes,Yes,"10:40 AM 1st Jun,21",2021-06-01 10:40,13
SDH Mahendergarh,SDH Mahendergarh,Yes (20),20,0,0,5,20,0,0,5,Yes,Yes,Yes,Yes,Yes,"4:33 PM 9th Jun,21",2021-06-09 16:33,13
Shanti Hospital Narnaul,Shanti Hospital Narnaul,Yes (22),9,7,6,2,9,7,7,2,Yes,Yes,Yes,Yes,Yes,"10:22 AM 3rd Jun,21",2021-06-03 10:22,13
Sheela Multi Superspeciality Hospital,Behind Bus Stand Mahindergarh,Yes (9),6,0,3,1,6,0,3,1,Yes,No,Yes,Yes,Yes,"4:33 PM 9th Jun,21",2021-06-09 16:33,13
Shri Arvind Heart and Multispecialty Hospital,"Rao Tula Ram Chowk, Dadri Road Mahendergarh",Yes (17),9,5,3,3,9,5,3,3,Yes,Yes,Yes,Yes,Yes,"5:19 PM 12th Jun,21",2021-06-12 17:19,13
Tanwar Health Care MGarh,,Yes (9),5,0,4,1,5,0,4,1,Yes,No,Yes,Yes,Yes,"11:33 PM 15th Jun,21",2021-06-15 23:33,13
Vijay Hospital Narnaul,"HUDA Sector 1, Narnaul",Yes (22),8,0,14,2,8,0,15,2,Yes,Yes,Yes,Yes,Yes,"9:22 AM 8th Jun,21",2021-06-08 09:22,13
Cygnus Multispecialty Hospital Kaithal,"Huda Bypass Road, Sector 20, Kaithal, Haryana",Yes (40),28,0,12,2,28,0,12,2,Yes,No,Yes,Yes,Yes,"1:02 PM 18th Jul,21",2021-07-18 13:02,10
District Civil Hospital Kaithal,"Huda Sec 18, Kaithal",Yes (115),80,15,20,18,80,15,20,18,Yes,Yes,Yes,Yes,Yes,"11:59 AM 9th Aug,21",2021-08-09 11:59,10
SDH Guhla,SDH Guhla,Yes (70),35,35,0,5,35,35,0,5,Yes,No,Yes,No,Yes,"9:45 AM 16th Aug,21",2021-08-16 09:45,10
Shah Multispecialty Hospital Kaithal,"opp.old, bus stand, Jind - Kaithal Rd, Amar Garh Colony, Kaithal, Haryana",Yes (76),50,11,15,10,51,11,15,10,Yes,No,Yes,Yes,Yes,"2:00 PM 30th Sep,21",2021-09-30 14:00,10
"AAROGYAM HOSPITAL, Kurukshetra","NEAR OLD BUS STAND, THANESAR, KURUSKHETRA",Yes (67),40,12,15,27,40,12,15,27,Yes,Yes,Yes,Yes,Yes,"10:25 AM 28th Oct,21",2021-10-28 10:25,12
"ADESH MEDICAL COLLEGE, SHAHBAD MOHRI KURUKSHETRA.","VILL. MOHRI, SHAHBAD, KURUSHETRA",Yes (105),30,70,5,11,30,70,5,11,Yes,Yes,Yes,Yes,Yes,"10:26 AM 28th Oct,21",2021-10-28 10:26,12
AGGARWAL NURSING HOME,"SALARPUR ROAD, THANESAR, KURUKSHETRA.",No (0),0,0,0,0,0,0,0,0,Yes,Yes,Yes,Yes,Yes,"10:25 AM 28th Oct,21",2021-10-28 10:25,12
B.S. HEART CARE,"OPP. NEW BUS STAND, KURUKSHETRA.",Yes (26),18,0,8,20,18,0,8,20,Yes,Yes,Yes,Yes,Yes,"10:25 AM 28th Oct,21",2021-10-28 10:25,12
"CYGNUS HOSPITAL, Kurukshetra","NEAR OLD BUS STAND, THANESAR, KURUSKHETRA",Yes (12),7,4,1,4,7,4,1,4,Yes,Yes,Yes,Yes,Yes,"10:25 AM 28th Oct,21",2021-10-28 10:25,12
KURUKSHETRA NURSING HOME,,Yes (19),18,0,1,2,18,0,1,2,Yes,Yes,Yes,Yes,Yes,"10:25 AM 28th Oct,21",2021-10-28 10:25,12
LNJP CIVIL HOSPITAL.,LNJP HOSPITAL KURUKSHETRA.,Yes (94),60,29,5,5,60,30,5,5,Yes,Yes,Yes,Yes,Yes,"3:41 PM 3rd Dec,21",2021-12-03 15:41,12
MIRI PIRI SHAHBAD,"SHAHBAD, KURUKSHETRA",Yes (14),10,0,4,4,10,0,4,4,Yes,Yes,Yes,Yes,Yes,"10:25 AM 28th Oct,21",2021-10-28 10:25,12
Nirogi Hospital,Shahabad Kurukshetra,Yes (7),5,2,0,3,5,2,0,3,Yes,Yes,Yes,Yes,Yes,"9:39 AM 25th Oct,21",2021-10-25 09:39,12
"Saraswati Mission Hospital, Kurukshetra","Theme Park Road, Kurukshetra",Yes (20),4,0,16,2,4,0,16,2,Yes,Yes,Yes,Yes,Yes,"10:26 AM 28th Oct,21",2021-10-28 10:26,12
"Saraswati Mission Hospital, Pehowa","Ambala Road Dist. Kurukshetra, Pehowa, Haryana 136128",Yes (22),20,0,2,5,20,0,2,5,Yes,No,Yes,To Be Updated,Yes,"10:25 AM 28th Oct,21",2021-10-28 10:25,12
"SIDHARTH HOSPITAL, SHAHBAD","SHAHBAD, KURUKSHETRA",Yes (16),8,4,4,3,8,4,4,3,Yes,Yes,Yes,Yes,Yes,"10:25 AM 28th Oct,21",2021-10-28 10:25,12
VERMA HOSPITAL,LADWA,Yes (14),9,3,2,2,9,3,2,2,Yes,Yes,Yes,Yes,Yes,"10:25 AM 28th Oct,21",2021-10-28 10:25,12
"Aditya Neuro &amp; Spine Hospital, Rewari","Circular Rd, near Kanod gate, Raam Bagh Mahalla, Rewari, Haryana",Yes (10),8,0,2,2,8,0,2,2,Yes,No,Yes,Yes,Yes,"11:46 AM 28th May,21",2021-05-28 11:46,18
Advance Hospital,"Bawal Road, Model Town",Yes (8),5,0,3,0,5,0,6,1,Yes,No,Yes,Yes,Yes,"5:43 PM 25th May,21",2021-05-25 17:43,18
"Apex Hospital, Dharuhera","Plot No.5, Sector 6, Dharuhera, Haryana 123106",Yes (10),6,0,4,1,6,0,4,1,Yes,No,Yes,Yes,Yes,"12:08 PM 28th May,21",2021-05-28 12:08,18
Apollo Rewari/Family Health Edge Hospital,"Garhi Bolni Rd, near Public Health Office, krishna Nagar, Rewari, Haryana",Yes (27),17,3,7,0,17,3,7,0,Yes,No,Yes,Yes,Yes,"2:38 PM 3rd Jun,21",2021-06-03 14:38,18
Capt. Nand Lal Hospital,"Circular Road near Government Girls Senior Secondary School naiwali, chowk, Rewari",Yes (20),6,10,4,1,11,10,8,1,Yes,No,Yes,Yes,Yes,"11:54 PM 15th May,21",2021-05-15 23:54,18
Civil Hospital rewari,"Kayasthwara Mohalla, Rewari, Haryana",Yes (63),39,16,8,4,40,16,8,4,Yes,Yes,Yes,Yes,Yes,"10:54 AM 30th Jun,21",2021-06-30 10:54,18
Cygnus Hospital Rewari,"Opposite Civil Hospital Mohola, Sanghi Ka Bass, Rewari, Haryana",Yes (32),21,7,4,1,26,7,9,2,Yes,No,Yes,No,Yes,"9:58 AM 28th May,21",2021-05-28 09:58,18
Devjyoti Hospital,"Ambedkar chowk, near Bus Stand, Rewari, Haryana",Yes (14),7,2,5,1,7,2,6,2,Yes,No,Yes,Yes,Yes,"10:10 AM 8th Jun,21",2021-06-08 10:10,18
Dr. K.K. NAGAR HOSPITAL,"317, Near Shishu Shala School, Model Town, Rewari, Haryana",Yes (12),2,0,10,0,2,0,10,0,Yes,No,Yes,Yes,Yes,"9:22 AM 22nd Jun,21",2021-06-22 09:22,18
Dr. Vijay Pal Yadav Hospital,"Near Ambedker chowk, Rewari",Yes (7),2,2,3,0,3,3,4,0,Yes,No,Yes,Yes,Yes,"9:52 AM 23rd May,21",2021-05-23 09:52,18
Kamla Nursing Home/Kalawati Hospital,"201, Model Town, Rewari, Near Bus Stand, Opposite Bal Bhawan, Shivam Chowk",Yes (17),12,0,5,5,14,0,9,6,Yes,No,Yes,Yes,Yes,"6:47 PM 27th May,21",2021-05-27 18:47,18
Katyal Hospital,"Katyal Hospital, KANOD GATE, CIRCULAR ROAD, Rewari, Haryana, India",Yes (21),9,6,6,0,12,6,10,1,Yes,No,Yes,Yes,Yes,"9:04 AM 10th Jun,21",2021-06-10 09:04,18
Maars Hospital,"Garhi Bolni Rd, near PWD Office, Sector 19, Rewari, Haryana",Yes (15),15,0,0,0,15,0,0,0,Yes,No,Yes,Yes,No,"10:21 AM 29th Jun,21",2021-06-29 10:21,18
"Manasavi Hospital, Rewari",,Yes (10),10,0,0,0,10,0,0,0,Yes,No,Yes,No,Yes,"12:12 PM 28th May,21",2021-05-28 12:12,18
Matrika Hospital,"Matrika Hospital, Ranbir Singh Huda Chowk, Bawal-Rewari Rd, Rewari, Haryana",Yes (23),12,0,11,1,16,0,14,3,Yes,No,No,Yes,Yes,"10:27 AM 28th May,21",2021-05-28 10:27,18
Mediom Hospital/Medcare Hospital,"Sohna Rd, near Municipal Corporation, Dharuhera, Haryana",Yes (4),3,Beds Over Utilized 1,1,0,8,0,4,1,Yes,No,Yes,Yes,Yes,"6:58 PM 23rd May,21",2021-05-23 18:58,18
Om Hospital,"Om Hospital, Nandrampur Bass Rd, Dharuhera, Haryana",Yes (24),12,4,8,0,12,4,8,0,Yes,No,Yes,Yes,Yes,"7:36 PM 2nd Jun,21",2021-06-02 19:36,18
Pushpanjli Hospital Rewari,"Rajesh Pilot Chowk, Rewari, Haryana",No (0),0,0,0,0,40,12,10,3,No,No,Yes,Yes,Yes,"4:33 PM 25th May,21",2021-05-25 16:33,18
R. B. Yadav Hospital,"Dr. R B Yadav Hospital, Circular Rd Jainpuri, Kayasthwara Mohalla, Rewari, Haryana",Yes (22),8,6,8,2,8,6,8,2,Yes,No,Yes,Yes,Yes,"9:25 AM 8th Jun,21",2021-06-08 09:25,18
Samrat Hospital,Near Azad Chowk Rewari,Yes (9),5,0,4,3,5,0,10,3,Yes,No,Yes,Yes,Yes,"5:44 PM 25th May,21",2021-05-25 17:44,18
SDH Kosli,"Kosli, Rewari, Haryana",Yes (31),11,20,0,0,20,20,0,0,Yes,No,No,No,No,"4:32 PM 25th May,21",2021-05-25 16:32,18
Shanti Yadav Hospital,"Bawal-Rewari Rd Model Town, Rewari, Haryana",Yes (28),16,8,4,1,19,10,4,1,Yes,No,Yes,No,No,"9:37 AM 26th May,21",2021-05-26 09:37,18
Sheela Neuro &amp; Multi. Superspeciality Hospital,"Sheela Neuro Multi-Super Speciality Hospital, Opposite Jain Public School, Circular Road, Rewari",Yes (32),15,15,2,0,15,15,3,1,Yes,No,Yes,Yes,No,"5:47 PM 25th May,21",2021-05-25 17:47,18
Shri Ashwani Sexena Hospital,"343-L, Model town Rewari",Yes (10),7,3,0,0,7,3,0,0,Yes,No,Yes,Yes,Yes,"9:06 AM 7th Sep,21",2021-09-07 09:06,18
SMCC Hospital,"Sector 5 Rewari, Haryana",Yes (13),2,0,11,1,2,0,11,1,Yes,No,Yes,Yes,Yes,"6:10 PM 28th Jun,21",2021-06-28 18:10,18
Surendra Hospital Bawal,"Circuar Road, Rewari, Haryana",Yes (11),5,2,4,0,5,2,5,0,Yes,No,Yes,No,Yes,"7:19 PM 9th Jun,21",2021-06-09 19:19,18
"Sushma Devi Hospital, Bawal","Rewari Road, Bawal, Rewari, Near Power House & Bharat Petrol Pump",Yes (18),9,9,0,0,9,9,0,0,Yes,No,Yes,Yes,Yes,"10:29 AM 1st Jun,21",2021-06-01 10:29,18
Vedanta Hospital,"Circulare Road, Near Nirankari Satsang Bhavan Dharuhera, Chungi, Rewari, Haryana",Yes (29),0,7,22,0,0,7,30,0,Yes,No,Yes,Yes,Yes,"4:42 PM 25th May,21",2021-05-25 16:42,18
Virat Hospital,"Circular Rd, Near Oriental Bank of Commerce, Madhu Vihar, Rewari, Haryana",Yes (100),63,10,27,2,63,10,27,2,Yes,No,Yes,Yes,Yes,"9:42 AM 10th Jul,21",2021-07-10 09:42,18
Yaduvanshi Hospital,"Maharana Pratap Chowk, Model Town, Rewari, Haryana",Yes (19),14,0,5,2,14,0,5,2,Yes,No,Yes,Yes,No,"9:09 AM 6th Jul,21",2021-07-06 09:09,18
ABLE HOSPITAL,,Yes (37),10,25,2,2,10,25,2,5,Yes,No,Yes,Yes,Yes,"3:08 PM 26th May,21",2021-05-26 15:08,15
Apex Hospital,"Prakash Vihar, Delhi Mathura Road, Palwal, Haryana",Yes (19),13,0,6,2,13,0,6,2,Yes,No,Yes,Yes,Yes,"10:07 AM 31st May,21",2021-05-31 10:07,15
ATLAS HOSPITAL,"Palwal, Haryana",Yes (14),1,11,2,2,2,11,2,2,To Be Updated,To Be Updated,To Be Updated,To Be Updated,To Be Updated,"11:02 AM 29th May,21",2021-05-29 11:02,15
BIKAL HOSPITAL,"PALWAL, HARYANA",Yes (21),13,5,3,0,13,5,3,0,Yes,No,Yes,Yes,Yes,"2:57 PM 23rd Jun,21",2021-06-23 14:57,15
CHC Alawalpur,CHC Alawalpur,Yes (17),1,16,0,0,4,16,0,0,To Be Updated,To Be Updated,To Be Updated,To Be Updated,To Be Updated,"6:55 PM 18th May,21",2021-05-18 18:55,15
Civil Hospital Palwal,"Civil Hospital, palwal",Yes (110),103,0,7,7,103,0,7,7,Yes,To Be Updated,To Be Updated,To Be Updated,To Be Updated,"11:32 AM 10th Dec,21",2021-12-10 11:32,15
COSMOS HOSPITAL,PALWAL,Yes (10),5,5,0,0,5,5,0,0,To Be Updated,To Be Updated,To Be Updated,To Be Updated,To Be Updated,"12:02 PM 16th May,21",2021-05-16 12:02,15
GALAXY HOSPITAL,HUDA SECTOR 2,Yes (21),5,0,16,11,5,0,16,11,Yes,No,Yes,Yes,Yes,"5:22 PM 16th Jun,21",2021-06-16 17:22,15
"Gurunanak Hospital, Palwal","NH2, Near Bus Stand, Shiv Colony, Palwal Haryana",Yes (37),18,4,15,3,18,4,15,3,Yes,Yes,Yes,Yes,Yes,"5:07 PM 7th Jun,21",2021-06-07 17:07,15
JINDAL HOSPITAL,"Palwal, Haryana",Yes (15),10,2,3,0,10,2,3,0,To Be Updated,No,Yes,Yes,Yes,"12:53 PM 19th May,21",2021-05-19 12:53,15
NIDHI HOSPITAL,"Palwal, Haryana",Yes (12),2,7,3,0,2,7,3,0,Yes,No,Yes,Yes,Yes,"12:42 PM 19th May,21",2021-05-19 12:42,15
Palwal Hospital,"Moti Colony, Palwal, Haryana",Yes (22),0,6,16,1,0,6,16,1,Yes,No,Yes,Yes,Yes,"2:19 PM 28th May,21",2021-05-28 14:19,15
RAHUL HOSPITAL,PALWAL,Yes (15),7,5,3,0,7,5,3,0,Yes,No,Yes,Yes,Yes,"4:20 PM 13th May,21",2021-05-13 16:20,15
Sachin Hospital,"New Sohna Road, Near Panchwati Chowk, Palwal Haryana",Yes (28),10,5,13,2,10,5,13,2,Yes,Yes,Yes,Yes,Yes,"9:29 AM 14th Jun,21",2021-06-14 09:29,15
SDH Hodal,SDH Hodal,Yes (20),10,10,0,0,10,10,0,0,Yes,No,Yes,Yes,Yes,"11:45 AM 1st Jun,21",2021-06-01 11:45,15
Shri. Satya Sai Sanjivani Hospital Palwal,"Palwal, Haryana",Yes (23),4,16,3,2,4,17,4,2,Yes,No,Yes,Yes,Yes,"5:13 PM 2nd Jun,21",2021-06-02 17:13,15
SRI SAI HOSPITAL,"Palwal, Haryana",Yes (6),0,6,0,0,0,6,0,0,Yes,No,Yes,Yes,Yes,"10:08 AM 2nd Jun,21",2021-06-02 10:08,15
VASHU HOSPITAL,,Yes (10),10,0,0,0,10,0,0,0,Yes,No,Yes,Yes,Yes,"12:53 PM 19th May,21",2021-05-19 12:53,15
Advanta Super Speciality Hospital,Near Power House,Yes (39),25,0,14,4,25,0,14,4,Yes,No,Yes,Yes,Yes,"5:05 PM 14th Jul,21",2021-07-14 17:05,19
ARS Holy Heart Advanced Cardiac care &amp; Research Centre,"330, Vinay Nagar Rohtak, Near Delhi Bypass Rohtak",Yes (20),0,0,20,2,0,0,20,2,Yes,No,No,No,No,"9:25 AM 1st Jul,21",2021-07-01 09:25,19
CHC Chiri,"VOP Chiri, Meham Gohana Road, Distt. Rohtak Haryana",Yes (10),10,0,0,0,10,0,0,0,Yes,Yes,Yes,Yes,Yes,"4:01 PM 15th Jul,21",2021-07-15 16:01,19
CHC Kahanaur,"Near Sarva haryana Gramin Bank, Opp. Banquet hall, Nigana Road, Kahanaur",Yes (10),4,6,0,0,4,6,0,0,Yes,No,Yes,No,Yes,"9:11 AM 16th Jul,21",2021-07-16 09:11,19
CHC kalanaur,"Police Station, Bhiwani-Rohtak Road , Near Kalanaur kalan, Kalanaur,",Yes (10),10,0,0,0,10,0,0,0,Yes,No,Yes,No,Yes,"1:54 PM 26th Jun,21",2021-06-26 13:54,19
CHC Kiloi,"VPO Kiloi, Water Works, Distt. Rohtak",Yes (10),5,5,0,0,5,5,0,0,Yes,No,Yes,No,Yes,"9:41 AM 1st Jul,21",2021-07-01 09:41,19
CHC Madina,"VPO Madina, Hisar Road Distt. Rohtak, Haryana",Yes (10),0,10,0,0,0,10,0,0,Yes,No,No,No,Yes,"9:32 AM 10th Jul,21",2021-07-10 09:32,19
CHC Meham,"Near ITI, Meham Distt. Rohtak",Yes (10),10,0,0,0,10,0,0,0,Yes,No,Yes,No,Yes,"10:56 AM 30th Jul,21",2021-07-30 10:56,19
CHC Sampla,"Gadi Sampla, Rohtak, SH-20, Jhajjar Sampla Road, Sampla, Sampla, Haryana 124501",Yes (10),0,10,0,0,0,10,0,0,No,No,Yes,No,Yes,"8:15 AM 5th Oct,21",2021-10-05 08:15,19
"Civil Hospital, Rohtak",Subash Road,Yes (71),40,24,7,5,40,24,7,5,Yes,Yes,Yes,Yes,Yes,"9:15 AM 26th Jun,21",2021-06-26 09:15,19
Holy Heart Super speciality Hospital,Vinay Nagar Delhi Bye pass,Yes (57),25,5,27,6,25,5,27,6,Yes,No,Yes,Yes,Yes,"9:16 AM 1st Jul,21",2021-07-01 09:16,19
"Hridaya Nilayam Heart, Lung &amp; vascular Institute","5, Raj Garden, Delhi Bypass, Rohtak",Yes (25),0,0,25,2,0,0,25,2,To Be Updated,To Be Updated,To Be Updated,To Be Updated,To Be Updated,"8:02 AM 16th Jun,21",2021-06-16 08:02,19
Joyline Multispeciality,"Surajmal Colony, Sunarian Road, Opposite Birgadier Muktram Statue Rohtak",Yes (20),15,0,5,1,15,0,5,1,Yes,Yes,Yes,Yes,Yes,"10:33 AM 21st Nov,21",2021-11-21 10:33,19
Kainos Hospital,Near Kheri Sadh Village Outer Bye Pass,Yes (70),26,10,34,17,26,10,34,17,Yes,No,Yes,Yes,Yes,"9:14 AM 2nd Jul,21",2021-07-02 09:14,19
Life Care Hospital,Subash Nagar,Yes (50),30,0,20,6,30,0,20,6,Yes,No,Yes,Yes,Yes,"6:03 PM 15th Jul,21",2021-07-15 18:03,19
Maan Hospital,Bhagwan Colony Near Radio Station,Yes (45),29,0,16,6,29,0,16,6,Yes,No,Yes,Yes,Yes,"9:56 AM 21st Jun,21",2021-06-21 09:56,19
Mansarover Hospital,Mansarover Colony Near Park,Yes (30),20,0,10,7,20,0,10,7,Yes,No,Yes,Yes,Yes,"9:49 AM 5th Jul,21",2021-07-05 09:49,19
Neurocentre Super Speciality Hospital,"Kalawati Bulding, Near Power House Rohtak",Yes (23),4,6,13,2,4,6,13,2,Yes,No,Yes,Yes,Yes,"4:18 PM 27th Jun,21",2021-06-27 16:18,19
Noble Heart Super Speciality Hospital,Near Raj Garden Delhi Bye Pass,Yes (34),26,1,7,6,26,1,7,6,Yes,No,Yes,Yes,Yes,"9:36 AM 21st Jun,21",2021-06-21 09:36,19
Oscar Super Speciality Trauma Center,"Medical Moad, Daryao Singh Nagar,",Yes (41),23,3,15,2,23,3,15,2,Yes,Yes,Yes,Yes,Yes,"9:51 AM 21st Jun,21",2021-06-21 09:51,19
Oxygen Hospital,Islam Pura Daries Hisar Road,Yes (30),15,10,5,4,15,10,5,4,Yes,No,Yes,Yes,Yes,"10:49 AM 23rd Jun,21",2021-06-23 10:49,19
PGIMS Rohtak,"Pt.Bhagwat Dayal PGIMS, Medical Rd, Rohtak, Haryana",Yes (566),451,0,115,115,451,0,115,115,Yes,Yes,Yes,Yes,Yes,"9:07 AM 10th Dec,21",2021-12-10 09:07,19
Positron Hospital,Suncity Sector 35,Yes (32),0,16,16,4,0,16,16,4,Yes,No,No,Yes,Yes,"5:02 PM 28th Jun,21",2021-06-28 17:02,19
Pragati Hospital,"Sukhpura Chowk, Gohana Road, opp. Ladhot Road Rohtak",Yes (15),11,0,4,1,11,0,4,1,Yes,No,Yes,Yes,Yes,"5:06 PM 14th Jul,21",2021-07-14 17:06,19
"Sanghi Nursing Home, Rohtak, Haryana","Chotu Ram Chowk, Civil Road, Arya Nagar, Rohtak, Haryana",Yes (14),10,0,4,4,10,0,4,4,Yes,Yes,Yes,Yes,Yes,"10:42 AM 27th Jun,21",2021-06-27 10:42,19
Shivam Liver &amp; Gastro Super Speciality Hospital,"CIVIL ROAD NEAR SHANT MAI CHOWK, Rohtak, Haryana - 124001, India",Yes (9),5,0,4,1,5,0,4,1,Yes,No,Yes,Yes,Yes,"8:36 AM 31st Jul,21",2021-07-31 08:36,19
Sunflag Global Hospital,Bharat Colony Near Sheela Bye Pass,Yes (35),20,0,15,5,20,0,15,5,Yes,No,Yes,Yes,Yes,"9:27 AM 25th Jun,21",2021-06-25 09:27,19
Balaji Gautam Hospital,"Model Colony, East Bhatia Nagar, Yamuna Nagar, Haryana",Yes (12),7,2,3,0,7,2,3,0,Yes,No,Yes,Yes,Yes,"11:29 PM 4th Dec,21",2021-12-04 23:29,22
Ch Lekh Raj Multispeciality Hospital,Vill Gadhauli Yamuna Nagar,Yes (150),140,0,10,5,140,0,10,5,Yes,Yes,Yes,Yes,Yes,"9:53 AM 27th Aug,21",2021-08-27 09:53,22
CHC Bilaspur,CHC Bilaspur,Yes (23),8,15,0,0,8,17,0,0,Yes,No,Yes,No,Yes,"8:55 AM 27th Sep,21",2021-09-27 08:55,22
CHC Chhachharuli,CHC Chhachharuli,Yes (30),10,20,0,0,10,20,0,0,Yes,No,Yes,Yes,Yes,"9:41 AM 27th Aug,21",2021-08-27 09:41,22
CHC Naharpur,Naharpur Yamuna Nagar,Yes (10),10,0,0,0,10,0,0,0,Yes,No,No,No,Yes,"9:54 AM 27th Aug,21",2021-08-27 09:54,22
CHC Partap Nagar,CHC Partap Nagar,Yes (16),6,10,0,0,6,10,0,0,Yes,No,Yes,No,Yes,"9:41 AM 27th Aug,21",2021-08-27 09:41,22
CHC Radaur,Radaur Yamuna Nagar,Yes (20),10,10,0,0,10,10,0,0,Yes,No,Yes,Yes,Yes,"9:53 AM 27th Aug,21",2021-08-27 09:53,22
CHC Saraswati Nagar,CHC Saraswati Nagar,Yes (25),14,11,0,0,14,11,0,0,Yes,No,Yes,No,Yes,"9:41 AM 27th Aug,21",2021-08-27 09:41,22
DABRA HOSPITAL Yamunanagar,DABRA HOSPITAL,Yes (23),11,8,4,2,11,8,4,2,No,No,No,No,No,"9:42 AM 27th Aug,21",2021-08-27 09:42,22
ESI Hospital,"ESI Hospital, Jagadhri",Yes (58),36,0,22,0,36,0,22,0,Yes,No,Yes,Yes,Yes,"9:40 AM 27th Aug,21",2021-08-27 09:40,22
Gaba Hospital,Gaba Hospital Yamunanagar,Yes (45),20,10,15,5,20,10,15,5,Yes,No,Yes,Yes,Yes,"9:12 AM 17th Sep,21",2021-09-17 09:12,22
GULATI HOSPITAL,GULATI HOSPITAL,Yes (32),23,3,6,0,25,3,6,0,Yes,No,Yes,Yes,Yes,"9:49 AM 27th Aug,21",2021-08-27 09:49,22
Heart Care Center Hospital,Near Lal Dwara Mandir Yamuna Nagar,Yes (19),2,2,15,7,2,2,15,7,Yes,No,Yes,Yes,Yes,"9:40 AM 27th Aug,21",2021-08-27 09:40,22
JP Hospital Pvt,"Jagadhri Rd, near Luxmi Theater, Vishwakarma Mohalla, Yamuna Nagar,HARAYANA Haryana",Yes (43),15,15,13,2,15,15,13,2,Yes,No,Yes,Yes,Yes,"9:40 AM 27th Aug,21",2021-08-27 09:40,22
KAPOOR HOSPITAL,"SH 6A Indira Colony Jagadhri, yamunanagart ,Haryana",Yes (12),4,0,8,0,4,0,8,0,Yes,No,Yes,Yes,Yes,"9:51 AM 27th Aug,21",2021-08-27 09:51,22
KESHWANI HOSPITAL,"Jagadhri - Yamuna Nagar Rd, Tagore Garden, Yamuna Nagar, Haryana",Yes (10),10,0,0,0,10,0,0,0,Yes,No,Yes,Yes,Yes,"9:54 AM 27th Aug,21",2021-08-27 09:54,22
Maxxwell Hospital,Jagadhari Yamuna Nagar,Yes (17),11,0,6,0,11,0,6,0,Yes,No,Yes,Yes,Yes,"9:49 AM 27th Aug,21",2021-08-27 09:49,22
Mukand Lal District Civil Hospital Yamunanagar,Mukand Lal District Civil Hospital YNR,Yes (24),15,9,0,5,18,9,0,5,Yes,No,Yes,Yes,Yes,"10:16 AM 9th Oct,21",2021-10-09 10:16,22
NIRMAL HOSPITAL,"199, Radaur Rd, near nirmal hospital, camp, Garhi Gujran, Haryana",Yes (20),13,1,6,0,13,1,6,0,Yes,No,Yes,Yes,Yes,"9:40 AM 27th Aug,21",2021-08-27 09:40,22
RK Gupta,opp DAV Sr Sec School Near Madhu Hotel YNR,Yes (17),0,2,15,0,0,2,15,0,Yes,Yes,Yes,Yes,Yes,"9:54 AM 27th Aug,21",2021-08-27 09:54,22
SABBARWAL HOSPITAL,"Gulab Nagar, Jagadhri, Haryana",Yes (12),6,0,6,0,6,0,6,0,Yes,No,Yes,Yes,Yes,"9:53 AM 27th Aug,21",2021-08-27 09:53,22
Sachdeva Hospital,"2227, Civil Lines Rd, Sri Nagar Colony, Civil Lines, Gomti Mohalla, Jagadhri, Haryana",Yes (28),16,8,4,0,16,8,4,0,Yes,No,Yes,Yes,Yes,"9:54 AM 27th Aug,21",2021-08-27 09:54,22
Santosh Hospital,"Santosh Hospital  Kanhaiya Sahib Chowk, near Govt.School, Harbanspura Colony, Gobind Pura, Yamuna Nagar, Haryana",Yes (28),5,9,14,2,5,9,14,2,Yes,No,Yes,Yes,Yes,"9:40 AM 27th Aug,21",2021-08-27 09:40,22
SHARMA HOSPITAL,Near Agarsain Chowk Jagadhri,Yes (12),12,0,0,0,12,0,0,0,Yes,No,Yes,Yes,Yes,"9:53 AM 27th Aug,21",2021-08-27 09:53,22
Shree Medical Care Hospital,"359/2, Jain nagar, Jagadhri, Haryana",Yes (15),15,0,0,0,15,0,0,0,Yes,Yes,Yes,Yes,Yes,"9:56 AM 27th Aug,21",2021-08-27 09:56,22
Shureshtha Hospital,Model Colony YNR,Yes (11),9,0,2,0,9,0,2,0,Yes,No,Yes,Yes,Yes,"9:53 AM 27th Aug,21",2021-08-27 09:53,22
SP Hospital Jag,S.P Hospital Jag,Yes (7),4,0,3,1,4,0,3,1,Yes,No,Yes,Yes,Yes,"9:49 AM 27th Aug,21",2021-08-27 09:49,22
Swami Vivekanand Hospital Yamunanagar,"Swami Vivekanand Hospital,Yamuna Nagar, Haryana",Yes (49),20,10,19,1,20,10,19,1,Yes,No,Yes,Yes,Yes,"9:50 AM 27th Aug,21",2021-08-27 09:50,22
Swastik Hospital,"Basant Nagar, Yamuna Nagar, Haryana",Yes (6),4,2,0,0,4,2,0,0,Yes,No,Yes,Yes,Yes,"9:55 AM 27th Aug,21",2021-08-27 09:55,22
tejli stadium,64 A Tejli,Yes (76),20,56,0,0,20,56,0,0,Yes,No,No,No,Yes,"9:52 AM 27th Aug,21",2021-08-27 09:52,22
