name,address,Availability_availability_of_beds,Availability_oxygen_beds,Availability_non_oxygen_beds,Availability_i_c_u_beds,Availability_ventilators,Allocated_oxygen_beds,Allocated_non_oxygen_beds,Allocated_i_c_u,Allocated_ventilators,Availability_availability_of_oxygen,Availability_antiviral_remdesivir_etc_,Availability_steroids,Availability_anticoagulant,Availability_antipyretic,updated_on,city
Santosh Hospital,"Santosh Hospital  Kanhaiya Sahib Chowk, near Govt.School, Harbanspura Colony, Gobind Pura, Yamuna Nagar, Haryana",Yes (9),0,7,2,0,5,9,14,2,Yes,No,Yes,Yes,Yes,2021-05-20 11:04,22
SHARMA HOSPITAL,Near Agarsain Chowk Jagadhri,Yes (1),1,0,0,0,12,0,0,0,Yes,No,Yes,Yes,Yes,2021-05-19 17:22,22
Shree Medical Care Hospital,"359/2, Jain nagar, Jagadhri, Haryana",Yes (7),7,0,0,0,15,0,0,0,Yes,Yes,Yes,Yes,Yes,2021-05-19 17:31,22
Shureshtha Hospital,Model Colony YNR,No (0),0,0,0,0,9,1,2,0,Yes,No,Yes,Yes,Yes,2021-05-19 17:27,22
SP Hospital Jag,S.P Hospital Jag,No (0),0,0,0,0,4,0,1,1,Yes,No,Yes,Yes,Yes,2021-05-19 17:19,22
Swami Vivekanand Hospital Yamunanagar,"Swami Vivekanand Hospital,Yamuna Nagar, Haryana",Yes (16),6,10,0,0,20,10,19,1,Yes,No,Yes,Yes,Yes,2021-05-19 17:19,22
tejli stadium,64 A Tejli,Yes (40),4,36,0,0,20,56,0,0,Yes,No,No,No,Yes,2021-05-19 17:20,22
VARDAAN HOSPITAL,OPP KOHLI HOSPITAL NEAR AGARSEN COLLEGE JAGADHRI,Yes (8),6,2,0,0,8,2,0,0,Yes,No,Yes,Yes,Yes,2021-05-19 17:31,22
WARYAM SINGH HOSPITAL,NEAR CIVIL HOSPITAL YAMUNA NAGAR,Yes (7),4,2,1,0,16,2,4,0,Yes,Yes,Yes,Yes,Yes,2021-05-19 17:23,22