name,address,Availability_availability_of_beds,Availability_oxygen_beds,Availability_non_oxygen_beds,Availability_i_c_u_beds,Availability_ventilators,Allocated_oxygen_beds,Allocated_non_oxygen_beds,Allocated_i_c_u,Allocated_ventilators,Availability_availability_of_oxygen,Availability_antiviral_remdesivir_etc_,Availability_steroids,Availability_anticoagulant,Availability_antipyretic,updated_on_unparsed,updated_on,city
"AADHAR Hospital, Hisar",Tosham Road Hisar,Yes (44),26,6,12,6,26,6,12,6,Yes,No,Yes,Yes,Yes,"6:59 AM 7th Sep,21",2021-09-07 06:59,7
Bharat Multispeciality Hospital,Hisar,Yes (26),24,0,2,2,24,0,2,2,Yes,No,Yes,Yes,Yes,"12:54 PM 28th Sep,21",2021-09-28 12:54,7
Central Medical Centre (CMC),CMC Hospital Delhi Road Hisar,Yes (62),47,5,10,3,47,5,10,3,Yes,Yes,Yes,Yes,Yes,"1:16 PM 24th Sep,21",2021-09-24 13:16,7
Ch. Devi Lal Sanjeevani Make Shift Covid Hopsital Hisar,Near Jindal School Hisar,Yes (500),500,0,0,0,500,0,0,0,Yes,No,Yes,No,Yes,"6:56 AM 5th Aug,21",2021-08-05 06:56,7
Churamani Hospital,CAMP CHOWK HISAR,Yes (37),5,2,30,5,5,2,30,5,No,No,No,No,No,"12:50 PM 28th Sep,21",2021-09-28 12:50,7
District Civil Hospital Hisar,Sirsa Road Hisar,Yes (83),80,0,3,17,80,0,3,17,Yes,Yes,Yes,Yes,Yes,"9:42 AM 20th Sep,21",2021-09-20 09:42,7
DR. ANANTRAM JANTA HOSPITAL PVT LTD BARWALA,Civil Hospital Road Barwala,Yes (17),17,0,0,3,17,0,0,3,Yes,No,Yes,Yes,Yes,"12:37 PM 28th Jul,21",2021-07-28 12:37,7
Geetanjali Hospital,Model Town Hisar,Yes (47),40,0,7,5,40,0,7,5,Yes,Yes,Yes,Yes,Yes,"2:37 PM 28th Sep,21",2021-09-28 14:37,7
Goswami Hospital,"NEAR BUS STAND, RISHI NAGAR",Yes (9),4,5,0,1,4,5,0,1,Yes,No,Yes,Yes,Yes,"7:04 AM 4th Aug,21",2021-08-04 07:04,7
Gupta Hospital Hisar,Sector 14 Hisar,Yes (35),30,0,5,0,30,0,5,0,Yes,Yes,Yes,No,Yes,"9:18 AM 24th Oct,21",2021-10-24 09:18,7
"GURU JAMBHESHWAR MULTISPECIALITY HOSPITAL, AGROHA","ADAMPUR ROAD, AGROHA",Yes (14),9,3,2,1,9,3,2,1,Yes,No,Yes,Yes,Yes,"10:53 AM 16th Sep,21",2021-09-16 10:53,7
Holy Help Hospital,Tosham Road Hisar,Yes (39),25,6,8,1,25,6,8,1,Yes,No,Yes,Yes,Yes,"12:37 PM 28th Jul,21",2021-07-28 12:37,7
Janki Children Hospital Hisar,Near Sewak Sabha Hopsital Hisar,Yes (3),0,1,2,2,0,1,2,2,Yes,No,Yes,Yes,Yes,"12:39 PM 28th Jul,21",2021-07-28 12:39,7
KARTIK HOSPITAL,"NEAR SEWAK SABHA HOSPITAL AND  BUDLA SANT MANDIR, NEAR BUS STAND HISAR",Yes (15),8,5,2,2,8,5,2,2,Yes,No,Yes,To Be Updated,To Be Updated,"12:51 PM 16th Sep,21",2021-09-16 12:51,7
Mahatma Gandhi Hospital,,Yes (42),19,13,10,8,19,13,10,8,Yes,Yes,Yes,Yes,Yes,"12:54 PM 28th Sep,21",2021-09-28 12:54,7
MALIK HOSPITAL,"145A UTTAM NAGAR, HANSI",Yes (7),7,0,0,3,7,0,0,3,Yes,Yes,No,To Be Updated,To Be Updated,"12:54 PM 28th Sep,21",2021-09-28 12:54,7
MAMC Agroha,"Maharaj Aggarsin Medical College, VPO Agroha",Yes (140),85,15,40,60,85,15,40,60,To Be Updated,To Be Updated,To Be Updated,To Be Updated,To Be Updated,"9:09 AM 14th Oct,21",2021-10-14 09:09,7
Military Hospital Hisar,Cantt Hisar,Yes (57),15,40,2,3,15,42,2,3,Yes,To Be Updated,Yes,Yes,Yes,"4:05 PM 29th Oct,21",2021-10-29 16:05,7
NEKIRAM HOSPITAL,OPP BUS STAND HANSI,Yes (5),2,0,3,3,2,0,3,3,Yes,No,Yes,To Be Updated,To Be Updated,"7:09 AM 14th Aug,21",2021-08-14 07:09,7
Noble Super Specialty Hospital,Hisar,Yes (19),12,0,7,1,12,0,7,1,Yes,No,Yes,To Be Updated,Yes,"12:55 PM 28th Sep,21",2021-09-28 12:55,7
OPJindal Institute of Cancer &amp; Research Hospital,Model Town Hisar,Yes (145),100,4,41,45,100,4,41,45,Yes,No,Yes,Yes,Yes,"12:36 PM 28th Jul,21",2021-07-28 12:36,7
PARDEEP KANSAL MULTISPECIALITY HOSPITAL FOR CHILDREN,"25- Inderprastha Colony, Hisar",Yes (13),0,6,7,3,0,6,7,3,Yes,No,Yes,Yes,Yes,"12:38 PM 28th Jul,21",2021-07-28 12:38,7
Parnami Hospital,Hisar,Yes (28),21,5,2,2,21,5,2,2,Yes,Yes,Yes,Yes,Yes,"10:18 AM 27th Sep,21",2021-09-27 10:18,7
Ravindra Hospital Hisar,Model Town HISAR,Yes (21),19,0,2,1,19,0,2,1,Yes,No,Yes,Yes,Yes,"12:25 PM 14th Sep,21",2021-09-14 12:25,7
SAANVI HOSPITAL,"CHC ROAD, BARWALA",Yes (9),5,0,4,1,5,0,4,1,Yes,No,Yes,To Be Updated,To Be Updated,"7:01 AM 31st Aug,21",2021-08-31 07:01,7
SAMAYARA HOSPITAL,"KALI DEVI CHOWK. OPP BHALLA PETROL PUMP, HANSI",Yes (9),4,0,5,1,4,0,5,1,Yes,No,Yes,To Be Updated,To Be Updated,"7:12 AM 26th Jun,21",2021-06-26 07:12,7
Sapra Hospital,Rajgarh Road Hisar,Yes (28),19,3,6,12,19,3,6,12,Yes,Yes,Yes,No,Yes,"11:34 AM 24th Sep,21",2021-09-24 11:34,7
"Sarvodya Hospital, Hisar",Delhi Road Hisar,Yes (32),24,7,1,3,24,7,1,3,Yes,Yes,Yes,Yes,Yes,"10:17 AM 27th Sep,21",2021-09-27 10:17,7
Sewak Sabha Hospital,Near Bus Stand Hisar,Yes (27),16,3,8,1,16,3,8,1,Yes,Yes,Yes,Yes,Yes,"10:18 AM 27th Sep,21",2021-09-27 10:18,7
Shanti Devi Hospital,Delhi Road Hisar,Yes (38),26,0,12,2,26,0,12,2,Yes,No,Yes,Yes,Yes,"10:15 AM 27th Sep,21",2021-09-27 10:15,7
Shri Kali Devi Hospital Hansi,Delhi Road Hansi,Yes (13),8,0,5,0,8,0,5,0,Yes,No,Yes,Yes,Yes,"7:18 AM 20th Jun,21",2021-06-20 07:18,7
SINGLA MULTISPECIALITY HOSPITAL,"RISHI NAGAR, GALI NO. 1, NEAR BUS STAND, HISAR",Yes (19),17,0,2,1,17,0,2,1,Yes,No,Yes,Yes,Yes,"12:49 PM 27th Sep,21",2021-09-27 12:49,7
SL Minda Hospital,VPO Bagla,Yes (8),6,0,2,2,6,0,2,2,Yes,No,Yes,Yes,Yes,"12:51 PM 28th Sep,21",2021-09-28 12:51,7
Sonakshi Children Hospital Hansi,"G T Road, Near Kali Devi Mandir, Opp Bhalla Patrol Pump, Hansi",Yes (13),9,0,4,1,9,0,4,1,Yes,No,Yes,Yes,Yes,"7:12 AM 26th Jun,21",2021-06-26 07:12,7
Sukhda Multispeciality Hospital,Dabra Chowk Hisar,Yes (68),46,4,18,6,46,4,18,6,Yes,Yes,Yes,Yes,Yes,"7:03 AM 19th Aug,21",2021-08-19 07:03,7
Vardaan Hospital Hisar,Hisar,Yes (21),9,1,11,2,9,1,11,2,Yes,Yes,Yes,Yes,Yes,"5:25 PM 21st Oct,21",2021-10-21 17:25,7
Adiyogi Arogya Avenue,"232, Subhash Nagar, Near civil hospital back gate, Jhajjar",Yes (15),7,2,6,1,7,2,6,1,To Be Updated,To Be Updated,Yes,Yes,Yes,"1:02 PM 14th Jun,21",2021-06-14 13:02,8
"Advanta Hospital, Jhajjar city","Silani Gate, Jhajjar, Haryana",Yes (50),24,10,16,1,24,10,16,1,Yes,To Be Updated,Yes,To Be Updated,Yes,"4:38 PM 9th Jun,21",2021-06-09 16:38,8
"Brahm Shakti Sanjivani Hospital, B.garh","Opp. BSNL Exchange, Delhi - Rohtak Road, NH9, Bahadurgarh, Haryana",Yes (100),60,20,20,3,60,20,20,3,Yes,No,Yes,Yes,Yes,"11:02 AM 15th Jun,21",2021-06-15 11:02,8
Civil Hospital Jhajjar,"Jhajjar, NH-71, Jhajjar Rohtak Road, Jhajjar, Jhajjar, Haryana",Yes (38),33,0,5,5,33,0,5,5,Yes,To Be Updated,To Be Updated,To Be Updated,To Be Updated,"8:53 AM 7th Sep,21",2021-09-07 08:53,8
"Delhi Hospital, Bahadurgarh","Rohtak Rd, near Shyamji Complex, Ram Nagar, Bahadurgarh, Haryana",Yes (50),20,20,10,2,20,20,10,2,Yes,No,Yes,Yes,Yes,"2:45 PM 1st Jun,21",2021-06-01 14:45,8
Dr. Sanjay Multi Speciality Hospital,INFRONT OF CIVIL HOSPITAL BAHADURGARH,Yes (61),45,10,6,1,45,10,6,1,Yes,No,No,To Be Updated,To Be Updated,"3:29 PM 30th Jun,21",2021-06-30 15:29,8
"Jeewan Jyoti Hospital, Bahadurgarh","Rohtak Rd, MIE Part-B, Bahadurgarh, Haryana",Yes (143),70,68,5,4,70,68,5,4,Yes,To Be Updated,To Be Updated,To Be Updated,To Be Updated,"11:19 AM 15th Jun,21",2021-06-15 11:19,8
"JK Hospital, Bahadurgarh","Bahadurgarh,, Bahamnoli, Bahadurgarh, Haryana",Yes (44),5,31,8,0,5,31,8,0,Yes,To Be Updated,Yes,Yes,Yes,"10:46 AM 17th Jun,21",2021-06-17 10:46,8
"Medicare Super Speciality Hospiatl &amp; Trauma Centre, Jhajjar City","Dadri road Jhajjar, Jhajjar, Haryana",Yes (50),15,23,12,3,15,23,12,3,Yes,To Be Updated,Yes,To Be Updated,Yes,"3:20 PM 15th Jul,21",2021-07-15 15:20,8
"Mission Hospital, Bahadurgarh","Near main Bus Stand & City Metro Station, Rohtak Rd, Bahadurgarh, Jhajjar ,Haryana",Yes (33),25,0,8,4,25,0,8,4,To Be Updated,No,Yes,Yes,No,"10:26 AM 13th Jun,21",2021-06-13 10:26,8
"Oscar Hospital, JJR city","Civil Road,Opp Civil Hospital, Jhajjar, Haryana",Yes (80),8,58,14,1,8,58,14,1,To Be Updated,To Be Updated,To Be Updated,To Be Updated,To Be Updated,"10:08 AM 16th Jun,21",2021-06-16 10:08,8
Oxymus Hospital,"Opposite Civil Hospital, Near Metro Pollar No. 876 Delhi Rohtak Road, Bahadurgarh",Yes (10),4,0,6,0,4,0,6,0,Yes,No,No,No,No,"5:58 PM 6th Jun,21",2021-06-06 17:58,8
"Rana Hospital, Bahadurgarh","OPP. REST HOUSE,OLD BARAHI ROAD, BAHADURGARH",Yes (25),18,0,7,2,18,0,7,2,To Be Updated,To Be Updated,No,No,Yes,"8:47 AM 22nd Jun,21",2021-06-22 08:47,8
"RJ Super Speciality Hospital, B.garh","Delhi - Rohtak Rd, Near Rajesh Joon Office, Dalbir Nagar, Bahadurgarh, Haryana",Yes (17),10,5,2,1,10,5,2,1,Yes,No,Yes,Yes,Yes,"5:05 PM 1st Jul,21",2021-07-01 17:05,8
RS GAUR GLOBAL MULTISPECIALITY HOSPITAL,"Jhajjar Road Netaji Subhash Vihar, Haryana",Yes (33),19,7,7,2,19,7,7,2,Yes,No,Yes,Yes,Yes,"10:19 AM 15th Jun,21",2021-06-15 10:19,8
"SDH, Bahadurgarh","Madhya Marg, Old Industrial Area, Bahadurgarh, Haryana",Yes (35),27,0,8,8,27,0,8,8,Yes,Yes,Yes,No,Yes,"12:46 PM 15th Jun,21",2021-06-15 12:46,8
"Shivam Hospital, B.garh","Line Par, Shastri Nagar, Netaji Nagar, Bahadurgarh, Haryana",Yes (51),30,15,6,1,30,15,6,1,Yes,No,Yes,Yes,Yes,"4:57 PM 13th Jun,21",2021-06-13 16:57,8
"Swastik Hospital, Bahadurgarh","Jhajjar Rd, Shakti Nagar, Sakti Nagar, Bahadurgarh, Haryana",Yes (40),26,4,10,2,26,4,10,2,Yes,No,Yes,Yes,Yes,"9:19 AM 17th Jun,21",2021-06-17 09:19,8
World College Of Medical Sciences And Hospital,"Jhajjar Sampla Road, Gurwar, Jhajjar, Haryana",Yes (250),90,135,25,4,90,135,25,4,Yes,Yes,Yes,Yes,Yes,"9:05 PM 18th Jun,21",2021-06-18 21:05,8
Balaji Gautam Hospital,"Model Colony, East Bhatia Nagar, Yamuna Nagar, Haryana",Yes (12),7,2,3,0,7,2,3,0,Yes,No,Yes,Yes,Yes,"11:29 PM 4th Dec,21",2021-12-04 23:29,22
Ch Lekh Raj Multispeciality Hospital,Vill Gadhauli Yamuna Nagar,Yes (150),140,0,10,5,140,0,10,5,Yes,Yes,Yes,Yes,Yes,"9:53 AM 27th Aug,21",2021-08-27 09:53,22
CHC Bilaspur,CHC Bilaspur,Yes (23),8,15,0,0,8,17,0,0,Yes,No,Yes,No,Yes,"8:55 AM 27th Sep,21",2021-09-27 08:55,22
CHC Chhachharuli,CHC Chhachharuli,Yes (30),10,20,0,0,10,20,0,0,Yes,No,Yes,Yes,Yes,"9:41 AM 27th Aug,21",2021-08-27 09:41,22
CHC Naharpur,Naharpur Yamuna Nagar,Yes (10),10,0,0,0,10,0,0,0,Yes,No,No,No,Yes,"9:54 AM 27th Aug,21",2021-08-27 09:54,22
CHC Partap Nagar,CHC Partap Nagar,Yes (16),6,10,0,0,6,10,0,0,Yes,No,Yes,No,Yes,"9:41 AM 27th Aug,21",2021-08-27 09:41,22
CHC Radaur,Radaur Yamuna Nagar,Yes (20),10,10,0,0,10,10,0,0,Yes,No,Yes,Yes,Yes,"9:53 AM 27th Aug,21",2021-08-27 09:53,22
CHC Saraswati Nagar,CHC Saraswati Nagar,Yes (25),14,11,0,0,14,11,0,0,Yes,No,Yes,No,Yes,"9:41 AM 27th Aug,21",2021-08-27 09:41,22
DABRA HOSPITAL Yamunanagar,DABRA HOSPITAL,Yes (23),11,8,4,2,11,8,4,2,No,No,No,No,No,"9:42 AM 27th Aug,21",2021-08-27 09:42,22
ESI Hospital,"ESI Hospital, Jagadhri",Yes (58),36,0,22,0,36,0,22,0,Yes,No,Yes,Yes,Yes,"9:40 AM 27th Aug,21",2021-08-27 09:40,22
Gaba Hospital,Gaba Hospital Yamunanagar,Yes (45),20,10,15,5,20,10,15,5,Yes,No,Yes,Yes,Yes,"9:12 AM 17th Sep,21",2021-09-17 09:12,22
GULATI HOSPITAL,GULATI HOSPITAL,Yes (32),23,3,6,0,25,3,6,0,Yes,No,Yes,Yes,Yes,"9:49 AM 27th Aug,21",2021-08-27 09:49,22
Heart Care Center Hospital,Near Lal Dwara Mandir Yamuna Nagar,Yes (19),2,2,15,7,2,2,15,7,Yes,No,Yes,Yes,Yes,"9:40 AM 27th Aug,21",2021-08-27 09:40,22
JP Hospital Pvt,"Jagadhri Rd, near Luxmi Theater, Vishwakarma Mohalla, Yamuna Nagar,HARAYANA Haryana",Yes (43),15,15,13,2,15,15,13,2,Yes,No,Yes,Yes,Yes,"9:40 AM 27th Aug,21",2021-08-27 09:40,22
KAPOOR HOSPITAL,"SH 6A Indira Colony Jagadhri, yamunanagart ,Haryana",Yes (12),4,0,8,0,4,0,8,0,Yes,No,Yes,Yes,Yes,"9:51 AM 27th Aug,21",2021-08-27 09:51,22
KESHWANI HOSPITAL,"Jagadhri - Yamuna Nagar Rd, Tagore Garden, Yamuna Nagar, Haryana",Yes (10),10,0,0,0,10,0,0,0,Yes,No,Yes,Yes,Yes,"9:54 AM 27th Aug,21",2021-08-27 09:54,22
Maxxwell Hospital,Jagadhari Yamuna Nagar,Yes (17),11,0,6,0,11,0,6,0,Yes,No,Yes,Yes,Yes,"9:49 AM 27th Aug,21",2021-08-27 09:49,22
Mukand Lal District Civil Hospital Yamunanagar,Mukand Lal District Civil Hospital YNR,Yes (24),15,9,0,5,18,9,0,5,Yes,No,Yes,Yes,Yes,"10:16 AM 9th Oct,21",2021-10-09 10:16,22
NIRMAL HOSPITAL,"199, Radaur Rd, near nirmal hospital, camp, Garhi Gujran, Haryana",Yes (20),13,1,6,0,13,1,6,0,Yes,No,Yes,Yes,Yes,"9:40 AM 27th Aug,21",2021-08-27 09:40,22
RK Gupta,opp DAV Sr Sec School Near Madhu Hotel YNR,Yes (17),0,2,15,0,0,2,15,0,Yes,Yes,Yes,Yes,Yes,"9:54 AM 27th Aug,21",2021-08-27 09:54,22
SABBARWAL HOSPITAL,"Gulab Nagar, Jagadhri, Haryana",Yes (12),6,0,6,0,6,0,6,0,Yes,No,Yes,Yes,Yes,"9:53 AM 27th Aug,21",2021-08-27 09:53,22
Sachdeva Hospital,"2227, Civil Lines Rd, Sri Nagar Colony, Civil Lines, Gomti Mohalla, Jagadhri, Haryana",Yes (28),16,8,4,0,16,8,4,0,Yes,No,Yes,Yes,Yes,"9:54 AM 27th Aug,21",2021-08-27 09:54,22
Santosh Hospital,"Santosh Hospital  Kanhaiya Sahib Chowk, near Govt.School, Harbanspura Colony, Gobind Pura, Yamuna Nagar, Haryana",Yes (28),5,9,14,2,5,9,14,2,Yes,No,Yes,Yes,Yes,"9:40 AM 27th Aug,21",2021-08-27 09:40,22
SHARMA HOSPITAL,Near Agarsain Chowk Jagadhri,Yes (12),12,0,0,0,12,0,0,0,Yes,No,Yes,Yes,Yes,"9:53 AM 27th Aug,21",2021-08-27 09:53,22
Shree Medical Care Hospital,"359/2, Jain nagar, Jagadhri, Haryana",Yes (15),15,0,0,0,15,0,0,0,Yes,Yes,Yes,Yes,Yes,"9:56 AM 27th Aug,21",2021-08-27 09:56,22
Shureshtha Hospital,Model Colony YNR,Yes (11),9,0,2,0,9,0,2,0,Yes,No,Yes,Yes,Yes,"9:53 AM 27th Aug,21",2021-08-27 09:53,22
SP Hospital Jag,S.P Hospital Jag,Yes (7),4,0,3,1,4,0,3,1,Yes,No,Yes,Yes,Yes,"9:49 AM 27th Aug,21",2021-08-27 09:49,22
Swami Vivekanand Hospital Yamunanagar,"Swami Vivekanand Hospital,Yamuna Nagar, Haryana",Yes (49),20,10,19,1,20,10,19,1,Yes,No,Yes,Yes,Yes,"9:50 AM 27th Aug,21",2021-08-27 09:50,22
Swastik Hospital,"Basant Nagar, Yamuna Nagar, Haryana",Yes (6),4,2,0,0,4,2,0,0,Yes,No,Yes,Yes,Yes,"9:55 AM 27th Aug,21",2021-08-27 09:55,22
tejli stadium,64 A Tejli,Yes (76),20,56,0,0,20,56,0,0,Yes,No,No,No,Yes,"9:52 AM 27th Aug,21",2021-08-27 09:52,22
VARDAAN HOSPITAL,OPP KOHLI HOSPITAL NEAR AGARSEN COLLEGE JAGADHRI,Yes (10),8,2,0,0,8,2,0,0,Yes,No,Yes,Yes,Yes,"9:54 AM 27th Aug,21",2021-08-27 09:54,22