name,address,Availability_availability_of_beds,Availability_oxygen_beds,Availability_non_oxygen_beds,Availability_i_c_u_beds,Availability_ventilators,Allocated_oxygen_beds,Allocated_non_oxygen_beds,Allocated_i_c_u,Allocated_ventilators,Availability_availability_of_oxygen,Availability_antiviral_remdesivir_etc_,Availability_steroids,Availability_anticoagulant,Availability_antipyretic,updated_on,city
"AADHAR Hospital, Hisar",Tosham Road Hisar,No (0),0,0,0,0,26,6,12,6,Yes,No,Yes,Yes,Yes,2021-05-11 17:01,7
Bharat Multispeciality Hospital,Hisar,No (0),0,0,0,0,24,0,2,2,Yes,No,Yes,Yes,Yes,2021-05-11 14:17,7
Central Medical Centre (CMC),CMC Hospital Delhi Road Hisar,No (0),0,0,0,0,33,5,10,2,Yes,Yes,Yes,Yes,Yes,2021-05-11 13:35,7
Churamani Hospital,CAMP CHOWK HISAR,No (0),0,0,0,0,2,0,20,5,No,No,No,No,No,2021-05-11 13:34,7
District Civil Hospital Hisar,Sirsa Road Hisar,No (0),Beds Over Utilized 3,0,0,0,71,0,3,9,Yes,Yes,Yes,No,Yes,2021-05-11 20:05,7
DR. ANANTRAM JANTA HOSPITAL PVT LTD BARWALA,Civil Hospital Road Barwala,Yes (20),18,0,2,3,20,0,3,3,Yes,No,Yes,Yes,Yes,2021-05-10 20:56,7
Geetanjali Hospital,Model Town Hisar,No (0),0,0,0,0,40,0,7,5,Yes,No,Yes,Yes,Yes,2021-05-11 15:46,7
Goswami Hospital,"NEAR BUS STAND, RISHI NAGAR",No (0),0,0,0,0,4,5,0,1,Yes,No,Yes,Yes,Yes,2021-05-11 13:36,7
Gupta Hospital Hisar,Sector 14 Hisar,No (0),0,0,0,0,40,0,15,0,Yes,Yes,Yes,No,Yes,2021-05-11 13:31,7
"GURU JAMBHESHWAR MULTISPECIALITY HOSPITAL, AGROHA","ADAMPUR ROAD, AGROHA",No (0),0,0,0,0,9,3,3,1,Yes,Yes,Yes,Yes,Yes,2021-05-11 19:32,7
Holy Help Hospital,Tosham Road Hisar,No (0),Beds Over Utilized 4,Beds Over Utilized 3,Beds Over Utilized 1,0,15,8,8,1,Yes,Yes,Yes,Yes,Yes,2021-05-11 16:05,7
Mahatma Gandhi Hospital,,No (0),0,0,0,0,19,13,18,8,Yes,Yes,Yes,Yes,Yes,2021-05-11 21:30,7
MAMC Agroha,"Maharaj Aggarsin Medical College, VPO Agroha",No (0),0,0,0,0,85,15,40,60,Yes,Yes,Yes,Yes,Yes,2021-05-11 21:25,7
Medi City Hospital,Model Town Hisar,Yes (13),13,0,0,7,13,0,0,7,Yes,No,No,No,No,2021-05-11 21:25,7
Military Hospital Hisar,Cantt Hisar,No (0),0,0,0,0,15,42,2,3,To Be Updated,No,Yes,Yes,Yes,2021-05-11 08:04,7
Noble Super Specialty Hospital,Hisar,No (0),0,0,0,0,12,0,7,1,Yes,No,Yes,To Be Updated,Yes,2021-05-11 13:32,7
OPJindal Institute of Cancer &amp; Research Hospital,Model Town Hisar,No (0),0,0,0,0,96,4,47,37,Yes,No,Yes,Yes,Yes,2021-05-11 18:37,7
PARDEEP KANSAL MULTISPECIALITY HOSPITAL FOR CHILDREN,"25- Inderprastha Colony, Hisar",Yes (4),0,2,2,2,0,6,7,3,Yes,No,Yes,Yes,Yes,2021-05-11 13:28,7
Parnami Hospital,Hisar,Yes (6),4,2,0,0,21,5,2,2,Yes,Yes,Yes,Yes,Yes,2021-05-11 13:35,7
Ravindra Hospital Hisar,Model Town HISAR,No (0),0,0,0,0,21,0,0,1,Yes,No,Yes,Yes,Yes,2021-05-11 13:27,7
Sapra Hospital,Rajgarh Road Hisar,No (0),0,0,0,0,35,3,8,10,Yes,No,Yes,Yes,Yes,2021-05-11 13:31,7
"Sarvodya Hospital, Hisar",Delhi Road Hisar,No (0),0,0,0,0,24,7,4,3,Yes,Yes,Yes,Yes,Yes,2021-05-11 07:57,7
Sewak Sabha Hospital,Near Bus Stand Hisar,No (0),0,0,0,0,16,3,8,1,Yes,Yes,Yes,Yes,Yes,2021-05-11 15:40,7
Shanti Devi Hospital,Delhi Road Hisar,No (0),0,0,0,0,28,0,12,2,Yes,No,Yes,Yes,Yes,2021-05-11 18:40,7
Shri Kali Devi Hospital Hansi,Delhi Road Hansi,Yes (13),8,0,5,0,8,0,5,0,Yes,No,Yes,Yes,Yes,2021-05-10 09:36,7
SINGLA MULTISPECIALITY HOSPITAL,"RISHI NAGAR, GALI NO. 1, NEAR BUS STAND, HISAR",No (0),Beds Over Utilized 4,0,0,0,17,0,2,1,Yes,Yes,Yes,Yes,Yes,2021-05-11 13:25,7
SL Minda Hospital,VPO Bagla,Yes (13),3,10,0,0,3,10,0,0,Yes,No,Yes,Yes,Yes,2021-05-10 11:01,7
Sonakshi Children Hospital Hansi,"G T Road, Near Kali Devi Mandir, Opp Bhalla Patrol Pump, Hansi",No (0),0,0,0,0,9,0,4,1,Yes,No,Yes,Yes,Yes,2021-05-11 14:16,7
Sukhda Multispeciality Hospital,Dabra Chowk Hisar,No (0),0,0,0,0,46,4,18,6,Yes,No,Yes,Yes,Yes,2021-05-11 18:32,7
Vardaan Hospital Hisar,Hisar,Yes (1),0,1,0,0,10,1,11,2,Yes,No,Yes,Yes,Yes,2021-05-11 13:26,7
Civil Hospital Fatehabad,Near Bus Stand Fatehabad,No (0),0,0,0,0,34,0,6,6,Yes,Yes,Yes,Yes,Yes,2021-05-11 16:02,5
Civil Hospital Ratia,"Dera Surjanhar, Ratia, Fatehabad",No (0),0,0,0,2,15,3,0,2,Yes,No,No,No,Yes,2021-05-11 10:23,5
"Civil Hospital, Tohana",Opposite New Sabzi Mandi Tohana,Yes (4),1,3,0,0,22,3,0,2,Yes,No,Yes,Yes,Yes,2021-05-11 14:58,5
Community Health Center Bhattu,"Surya Nagar, Bhattu Mandi near Railway Station",Yes (18),4,14,0,0,12,18,0,0,Yes,No,Yes,No,Yes,2021-05-11 14:26,5
Community Health Center Bhuna,CHC Bhuna,Yes (16),3,13,0,0,15,18,0,0,Yes,To Be Updated,To Be Updated,To Be Updated,To Be Updated,2021-05-11 16:47,5
Community Health Center JAKHAL,Near SBI Bank Jakhal,Yes (7),7,0,0,0,12,0,0,0,Yes,No,No,No,Yes,2021-05-11 19:46,5
"Gupta Children Hospital, Ratia","Aggarwal Colony, Ratia",Yes (17),8,8,1,1,8,8,1,1,Yes,No,Yes,Yes,No,2021-05-11 16:07,5
Kaushal Hospital,"Near Harvinder Singh Petrol Pump, Hisar Road, Fatehabad",Yes (6),4,0,2,4,12,0,6,4,To Be Updated,To Be Updated,To Be Updated,To Be Updated,To Be Updated,2021-05-11 14:35,5
"Manav Sewa Sangam Hospital, Tohana",Near Truck Union,Yes (1),1,0,0,0,15,0,0,0,Yes,No,Yes,No,Yes,2021-05-11 15:42,5
Miglani Hospital,"Employees Colony, Ratia,",Yes (10),8,2,0,0,15,2,7,7,Yes,Yes,Yes,Yes,Yes,2021-05-11 23:08,5
Rajasthan Medical Centre (RMC) Hospital Tohana,Kenchi Chowk Tohana,No (0),0,0,0,0,11,0,2,2,Yes,No,Yes,Yes,Yes,2021-05-11 17:03,5
Sadhbhawdna Hospital Fatehabad,Near Court Complex Hisar Road Fatehabad,Yes (17),0,17,0,Beds Over Utilized 1,5,20,7,2,Yes,No,Yes,Yes,Yes,2021-05-11 14:09,5
Sanjeevani Hospital Fatehabad,"Goshala Road, near Ashirbad Pelace",Yes (15),11,0,4,3,11,0,4,3,To Be Updated,To Be Updated,To Be Updated,To Be Updated,To Be Updated,2021-05-11 19:23,5
Sanjeevani Hospital Tohana,"Kenchi Chock, Tohana",Yes (7),6,0,1,0,6,6,12,2,Yes,No,Yes,Yes,Yes,2021-05-06 16:28,5
"Singla Hospital , fatehabad","Bhattu Road, Batra Colony, Fatehabad",Yes (7),4,3,0,0,5,8,0,0,No,No,Yes,Yes,Yes,2021-05-11 18:28,5
WadhwaMaternity and surgical Hospital Fatehabad,"Near Papiha Park, Fatehabad",Yes (4),0,0,4,0,0,0,7,1,Yes,No,Yes,Yes,Yes,2021-05-11 19:41,5
"AMRITDHARA, Chaura Bazar","Near ITI Chowk, Gahoon Vihar, Karnal, Haryana",Yes (4),4,0,0,0,38,0,26,2,Yes,No,Yes,Yes,Yes,2021-05-11 12:04,11
Arpana Hospital,"G.T. Road, Madhuban, Karnal, Karnal, Haryana",Yes (5),5,0,0,1,16,0,2,1,Yes,No,Yes,Yes,Yes,2021-05-11 16:03,11
CHC Assandh,"Assandh, Assandh Ruralpart, Haryana",Yes (10),10,0,0,0,10,0,0,0,Yes,No,Yes,No,Yes,2021-05-11 15:31,11
CHC Gharaunda,"Balinagar, Gharaunda, Haryana",Yes (10),10,0,0,0,10,0,0,0,Yes,No,Yes,No,Yes,2021-05-11 15:31,11
CHC Nissing,"SH 8, Gondar, Nissing, Haryana",Yes (10),10,0,0,0,10,0,0,0,Yes,No,Yes,No,Yes,2021-05-11 15:31,11
CHC Taraori,CHC Taraori,Yes (6),6,0,0,0,6,0,0,0,Yes,No,Yes,No,Yes,2021-05-11 15:32,11
Dr. Gian Bhushan Hospital,"Kunjpura Rd Old Char Chaman Dyal Singh Colony Karnal  132001 Republic of,",Yes (1),1,0,0,0,6,0,5,0,Yes,No,No,No,No,2021-05-11 07:35,11
Ishwar Kirpa Hospital,"Ishwar Kirpa Hospital, Sector -14",No (0),0,0,0,0,14,0,7,0,Yes,No,Yes,Yes,Yes,2021-05-11 17:19,11
"Kalpana Chawla Government Medical College, Karnal","Model Town, Karnal, Haryana",Yes (2),1,0,1,0,200,0,80,80,Yes,Yes,Yes,Yes,Yes,2021-05-11 09:43,11
Karnal Nursing Home,"26 Duggal Colony, Karnal",Yes (1),1,0,0,0,8,0,10,0,Yes,No,Yes,Yes,Yes,2021-05-11 16:03,11
Park Hospital,"CHD City, NH-1, Sector 45, Karnal, Haryana",No (0),Beds Over Utilized 6,0,Beds Over Utilized 4,0,10,0,20,2,Yes,Yes,Yes,Yes,Yes,2021-05-11 09:39,11
Rama Superspeciality Hospital,Civil Hosp Chowk Karnal,No (0),0,0,0,0,8,0,6,0,Yes,No,Yes,Yes,Yes,2021-05-11 13:37,11
RP Welltar Hospital,"Vill. Bastara, District Karnal",Yes (4),0,4,0,0,10,4,4,1,Yes,No,Yes,Yes,Yes,2021-05-11 09:13,11
"Sanjiv Bansal Cygnus Hospital , Karnal","Railway Rd, Ibrahim Mandi, Karnal, Haryana",No (0),0,0,0,0,20,0,5,2,Yes,No,Yes,Yes,Yes,2021-05-11 09:54,11
Sarvodya Hospital,"Sector 14, Near Tau Devi Lal Chowk",Yes (2),2,0,0,0,12,0,10,0,Yes,Yes,Yes,Yes,Yes,2021-05-11 19:34,11
SDH Nilokheri,SDH Nilokheri,Yes (10),10,0,0,0,10,0,0,0,Yes,No,Yes,No,Yes,2021-05-11 15:31,11
Shri Ram Chand Memorial Hospital,"12, Ashoka colony,Opp Kalpana Chawla hospital, Karnal, Haryana",No (0),0,0,0,0,8,0,7,3,Yes,No,Yes,Yes,Yes,2021-05-11 10:34,11
Shri Sanatan Dharam Mahabir Dal,"Kunjpura Road, Karnal Near Sanatan Dharam Mandir",No (0),0,0,0,0,12,0,0,0,Yes,No,Yes,Yes,Yes,2021-05-11 10:30,11
SS Hospital,"Sector 14, Karnal",No (0),0,0,0,0,7,0,7,0,Yes,To Be Updated,Yes,Yes,Yes,2021-05-11 08:47,11
Swastik Hospital,Swastic Hospital Opp DCH,No (0),0,0,0,0,10,0,9,0,Yes,No,Yes,Yes,Yes,2021-05-12 05:20,11
Virk Hospital Karnal,"363-364, Randhir lane, near Dyal Singh College, Karnal, Haryana",No (0),0,0,0,0,37,0,8,1,Yes,Yes,Yes,Yes,Yes,2021-05-12 00:00,11
"Apex Hospital, Sirsa","Circular Road, Sirsa",Yes (1),1,0,0,0,12,2,3,1,To Be Updated,To Be Updated,To Be Updated,To Be Updated,To Be Updated,2021-05-11 20:59,20
"Astha Hospital, Sirsa",Dabwali Road Sirsa,No (0),0,0,0,0,15,0,5,0,Yes,No,Yes,Yes,Yes,2021-05-11 09:34,20
CIVIL HOSPITAL SIRSA,"Civil Hospital Road, Sirsa",Yes (9),9,0,0,0,59,10,8,11,Yes,Yes,Yes,Yes,Yes,2021-05-10 13:01,20
"Dayal Nursing Home, Sirsa","Dabwali Road, Sirsa",Yes (12),9,3,0,0,9,3,0,0,Yes,To Be Updated,Yes,Yes,Yes,2021-05-09 14:39,20
"Gupta Hospital, Sirsa","Dabwali Road, Sirsa Near Easy Day",Yes (11),1,Beds Over Utilized 2,10,0,4,3,5,0,Yes,To Be Updated,Yes,Yes,Yes,2021-05-10 13:11,20
"Jagdish Nursing Home, Sirsa","Gandhi Market, Parshuram Chowk, Sirsa",Yes (10),Beds Over Utilized 5,4,6,0,0,4,6,1,Yes,No,Yes,Yes,Yes,2021-05-11 22:48,20
"jCD Hospital, Sirsa","JCD Hospital, Barnala Road, Sirsa",Yes (39),2,37,0,0,10,40,0,0,Yes,No,Yes,Yes,Yes,2021-05-11 16:38,20
"Jeevan Jyoti Hospital, Sirsa",Dabwali Road Sirsa,No (0),0,0,0,0,7,1,3,3,Yes,No,Yes,Yes,Yes,2021-05-11 18:50,20
"Khurana Hospital, Sirsa",Dabwali Road Sirsa,Yes (8),6,0,2,0,6,0,3,1,Yes,No,Yes,Yes,Yes,2021-05-11 20:56,20
"Lalgarhia Hospital, Sirsa",Dabwali Road Sirsa,Yes (3),0,0,3,0,15,0,4,1,Yes,Yes,Yes,Yes,Yes,2021-05-11 18:08,20
"Medicare Hospital, Sirsa","Dabwali Road, Sirsa",Yes (4),4,Beds Over Utilized 5,0,0,5,0,6,2,Yes,Yes,Yes,Yes,Yes,2021-05-09 14:35,20
"Metro Health Care Hospital, Sirsa","Near Dena Bank, lal Batti Chowk, Sirsa",Yes (3),Beds Over Utilized 1,Beds Over Utilized 3,3,0,5,0,4,1,Yes,To Be Updated,Yes,Yes,Yes,2021-05-11 08:12,20
"Mittal Hospital, Sirsa","Near Jhunthra Petrol Pump, Dabwali Road Sirsa",Yes (10),8,Beds Over Utilized 3,2,0,12,0,2,0,Yes,To Be Updated,No,Yes,Yes,2021-05-09 14:40,20
"New Life Care Hospital, Sirsa","Dabwali Road, Sirsa",Yes (7),6,Beds Over Utilized 6,1,0,8,0,2,1,Yes,No,Yes,Yes,Yes,2021-05-11 20:57,20
"Poonia COVID Care Center, Sirsa","Near Ambedkar chowk, opposite Seth tula ram dharamshala, Hisar Road, Sirsa, Haryana 125055",Yes (7),0,7,0,0,14,7,3,1,Yes,Yes,Yes,Yes,Yes,2021-05-11 16:33,20
"Sanjeevni Hospital, Sirsa (Wing -2, 1 &amp; 2nd Floor)","Under over bridge, hisar road, sirsa",Yes (15),5,10,0,0,45,30,10,6,Yes,Yes,Yes,Yes,Yes,2021-05-11 17:05,20
"Shah Satnam Dera Hospital (Wing -2, 2nd floor), Sirsa","Begu Road, Sirsa",Yes (49),44,5,0,0,55,31,7,7,Yes,Yes,Yes,Yes,Yes,2021-05-09 13:15,20
"Shivam Hospital, Sirsa",Surkhab Chowk Sirsa,Yes (10),8,0,2,0,14,0,2,2,Yes,To Be Updated,Yes,Yes,Yes,2021-05-11 21:00,20
"SPS Hospital, Sirsa","Near Sangwan Chowk, Dabwali Road, Sirsa",No (0),0,0,0,0,12,0,3,2,Yes,No,Yes,Yes,Yes,2021-05-11 16:35,20
"Suraksha Hospital, Sirsa","Dabwali Rd, opposite Hotel Aroma, Sirsa, Haryana 125055",No (0),0,0,0,0,10,3,4,7,Yes,Yes,Yes,Yes,Yes,2021-05-11 20:57,20
"Swastik Hospital, Sirsa","Ambedkar Chowk, Nandan Vatika, Sirsa,",No (0),0,0,0,0,5,5,4,1,Yes,No,Yes,Yes,Yes,2021-05-11 17:26,20
"Talwar Nursing Home, Sirsa","Under Over Bridge, Hisar Road, Sirsa",Yes (1),0,0,1,0,12,2,1,1,Yes,No,Yes,Yes,Yes,2021-05-11 20:59,20
"Tomar Nursing Home, Sirsa","Nandan Vatika, near surkhab Chock, Hathi park, Agrasain Colony, Sirsa, Haryana 125055",No (0),0,0,0,0,12,1,5,1,Yes,Yes,Yes,Yes,Yes,2021-05-11 20:58,20
"Vardan Hospital, Sirsa","Near Lal Batti Chowk, Sirsa",Yes (1),1,0,0,0,8,1,1,0,Yes,No,Yes,Yes,Yes,2021-05-09 14:37,20
"Ayurvedic Medical College, Patikara","Village- Ptikra, Narnaul",Yes (172),51,121,0,0,75,125,0,0,Yes,Yes,Yes,Yes,Yes,2021-05-11 16:37,13
CHC ATELI,CHC Ateli,Yes (15),5,10,0,0,5,10,0,0,No,Yes,Yes,Yes,Yes,2021-05-11 16:37,13
CHC Kanina,CHC Kanina,Yes (36),7,29,0,0,20,30,0,0,No,No,Yes,Yes,Yes,2021-05-11 16:37,13
CHC Nangal Chaudhary,chc nangal choudhary,Yes (15),5,10,0,0,5,10,0,0,No,Yes,Yes,Yes,Yes,2021-05-11 16:37,13
CHC Sehlang,CHC SEHLANG,Yes (15),5,10,0,0,5,10,0,0,Yes,Yes,Yes,Yes,Yes,2021-05-11 16:37,13
Civil Hospital Narnaul,"Housing Board, Narnaul",Yes (2),2,0,0,2,25,0,0,7,Yes,Yes,Yes,Yes,Yes,2021-05-11 16:35,13
Jaipur Heart &amp; Multi Speciality Hospital,"Opp. Sadar Thana, Narnaul",No (0),0,0,0,1,6,0,6,3,Yes,Yes,Yes,Yes,Yes,2021-05-11 16:39,13
LAXMI NARAYANAN,"Laxmi Narayanan Hospital , Narnaul Road Mahendergarh",No (0),0,0,0,1,6,0,5,1,Yes,No,Yes,Yes,Yes,2021-05-11 17:33,13
Rainbow Multispecialty hospital and trauma Centre,"Singhana road, Narnaul",Yes (5),2,3,0,0,2,3,8,2,Yes,Yes,Yes,Yes,Yes,2021-05-11 16:40,13
Sammat Memorial Hospital,"Sastri colony, near bus stand, mahendergarh",Yes (7),3,4,0,2,10,6,5,2,Yes,No,Yes,Yes,Yes,2021-05-11 16:40,13
Sanwedna Hospital Narnaul,"HUDA Sector 1, Narnaul",Yes (4),3,0,1,1,11,0,10,1,Yes,Yes,Yes,Yes,Yes,2021-05-11 16:37,13
SDH Mahendergarh,SDH Mahendergarh,Yes (7),7,0,0,0,20,0,0,0,Yes,Yes,Yes,Yes,Yes,2021-05-11 16:37,13
Shanti Hospital Narnaul,Shanti Hospital Narnaul,Yes (1),1,0,0,1,9,0,9,2,Yes,Yes,Yes,Yes,Yes,2021-05-11 16:37,13
Sheela Multi Superspeciality Hospital,Behind Bus Stand Mahindergarh,No (0),0,0,0,0,6,0,4,1,Yes,No,Yes,Yes,Yes,2021-05-11 16:40,13
Shri Arvind Heart and Multispecialty Hospital,"Rao Tula Ram Chowk, Dadri Road Mahendergarh",Yes (5),0,5,0,2,6,5,6,3,Yes,Yes,Yes,Yes,Yes,2021-05-11 16:39,13
Vijay Hospital Narnaul,"HUDA Sector 1, Narnaul",No (0),0,0,0,1,8,0,17,2,Yes,Yes,Yes,Yes,Yes,2021-05-11 16:37,13
Alchemist Hospital panchkula,Sector 21 Panchkula,Yes (1),0,0,1,0,41,0,11,4,Yes,Yes,Yes,Yes,Yes,2021-05-11 16:07,16
Alchemist Ojas Hospital,"H1  SEctor 26, Panchkula Ext, Panchkula",No (0),0,0,0,2,54,0,17,8,Yes,Yes,Yes,Yes,Yes,2021-05-11 16:05,16
Civil Hospital Panchkula,sector 6 Panchkula,Yes (9),0,9,0,0,203,23,8,6,Yes,Yes,Yes,Yes,Yes,2021-05-11 16:08,16
Paras Hospital Pvt,"Plot no 2, sec 22, panchkula",Yes (4),3,0,1,0,39,10,40,10,Yes,Yes,Yes,Yes,Yes,2021-05-11 16:04,16
Cygnus Multispecialty Hospital Kaithal,"Huda Bypass Road, Sector 20, Kaithal, Haryana",No (0),0,0,0,0,28,0,12,2,Yes,No,Yes,Yes,Yes,2021-05-11 16:06,10
District Hospital Kaithal,"Huda Sec 18, Kaithal",Yes (14),0,14,0,1,80,27,8,5,Yes,Yes,Yes,Yes,Yes,2021-05-11 16:56,10
SDH Guhla,SDH Guhla,Yes (70),29,41,0,0,29,41,0,0,Yes,No,Yes,No,Yes,2021-05-11 13:19,10
Shah Multispecialty Hospital Kaithal,"opp.old, bus stand, Jind - Kaithal Rd, Amar Garh Colony, Kaithal, Haryana",Yes (19),7,11,1,4,51,11,15,10,Yes,No,Yes,Yes,Yes,2021-05-11 08:57,10
"Advanta Hospital, Jhajjar city","Silani Gate, Jhajjar, Haryana",Yes (12),12,0,0,0,24,10,16,1,Yes,To Be Updated,Yes,To Be Updated,Yes,2021-05-11 20:24,8
"Brahm Shakti Sanjivani Hospital, B.garh","Opp. BSNL Exchange, Delhi - Rohtak Road, NH9, Bahadurgarh, Haryana",Yes (19),2,17,0,0,60,20,20,3,Yes,No,Yes,Yes,Yes,2021-05-11 11:19,8
Civil Hospital Jhajjar,"Jhajjar, NH-71, Jhajjar Rohtak Road, Jhajjar, Jhajjar, Haryana",No (0),0,0,0,0,61,15,0,0,Yes,To Be Updated,Yes,To Be Updated,Yes,2021-05-10 15:00,8
"Delhi Hospital, Bahadurgarh","Rohtak Rd, near Shyamji Complex, Ram Nagar, Bahadurgarh, Haryana",Yes (15),1,14,0,0,20,20,10,2,Yes,No,Yes,Yes,Yes,2021-05-11 18:19,8
Dr. Sanjay Multi Speciality Hospital,INFRONT OF CIVIL HOSPITAL BAHADURGARH,Yes (31),25,5,1,0,45,10,6,1,Yes,No,No,To Be Updated,To Be Updated,2021-05-11 11:10,8
"Jeewan Jyoti Hospital, Bahadurgarh","Rohtak Rd, MIE Part-B, Bahadurgarh, Haryana",Yes (105),44,61,0,2,77,68,10,2,Yes,To Be Updated,To Be Updated,To Be Updated,To Be Updated,2021-05-11 10:46,8
"JK Hospital, Bahadurgarh","Bahadurgarh,, Bahamnoli, Bahadurgarh, Haryana",Yes (11),5,0,6,0,5,0,8,0,Yes,Yes,Yes,Yes,Yes,2021-05-11 11:10,8
"Medicare Super Speciality Hospiatl &amp; Trauma Centre, Jhajjar City","Dadri road Jhajjar, Jhajjar, Haryana",Yes (5),2,3,0,3,15,5,12,3,To Be Updated,To Be Updated,Yes,To Be Updated,Yes,2021-05-11 19:45,8
"Mission Hospital, Bahadurgarh","Near main Bus Stand & City Metro Station, Rohtak Rd, Bahadurgarh, Jhajjar ,Haryana",No (0),0,Beds Over Utilized 10,0,0,14,0,6,1,To Be Updated,No,Yes,Yes,No,2021-05-11 09:38,8
"Oscar Hospital, JJR city","Civil Road,Opp Civil Hospital, Jhajjar, Haryana",Yes (16),3,13,0,1,8,20,14,1,To Be Updated,To Be Updated,To Be Updated,To Be Updated,To Be Updated,2021-05-11 17:14,8
Oxymus Hospital,"Opposite Civil Hospital, Near Metro Pollar No. 876 Delhi Rohtak Road, Bahadurgarh",Yes (6),3,0,3,0,4,0,6,0,Yes,To Be Updated,Yes,Yes,Yes,2021-05-11 19:34,8
"RJ Super Speciality Hospital, B.garh","Delhi - Rohtak Rd, Near Rajesh Joon Office, Dalbir Nagar, Bahadurgarh, Haryana",Yes (60),25,27,8,3,80,27,18,5,Yes,No,Yes,Yes,Yes,2021-05-11 18:09,8
RS GAUR GLOBAL MULTISPECIALITY HOSPITAL,"Jhajjar Road Netaji Subhash Vihar, Haryana",Yes (6),Beds Over Utilized 2,6,0,0,8,12,4,2,Yes,No,Yes,Yes,Yes,2021-05-11 20:25,8
"SDH, Bahadurgarh","Madhya Marg, Old Industrial Area, Bahadurgarh, Haryana",No (0),0,0,0,0,25,12,0,0,Yes,To Be Updated,Yes,To Be Updated,Yes,2021-05-10 15:00,8
"Shivam Hospital, B.garh","Line Par, Shastri Nagar, Netaji Nagar, Bahadurgarh, Haryana",Yes (48),27,17,4,0,49,20,9,1,Yes,No,Yes,Yes,Yes,2021-05-11 11:45,8
"Swastik Hospital, Bahadurgarh","Jhajjar Rd, Shakti Nagar, Sakti Nagar, Bahadurgarh, Haryana",Yes (20),13,7,0,0,38,14,10,1,Yes,No,Yes,Yes,Yes,2021-05-11 12:27,8
World College Of Medical Sciences And Hospital,"Jhajjar Sampla Road, Gurwar, Jhajjar, Haryana",Yes (191),55,135,1,1,90,135,25,4,Yes,Yes,Yes,Yes,Yes,2021-05-11 19:00,8
Aarti Hospital,"A-628, Near Hanuman Mandir, Dabua Pali Road, NIT Faridabad",Yes (23),5,15,3,0,5,15,3,0,To Be Updated,To Be Updated,To Be Updated,To Be Updated,To Be Updated,2021-05-11 15:11,4
Aastha Hospital,"SCF -2, Ashoka Enclave Main Rd, Sector 35, Faridabad",Yes (5),4,1,0,0,10,4,0,0,Yes,No,Yes,Yes,Yes,2021-05-11 23:16,4
Al-Falah Hospital,"Al Falah university Campus, Dhouj",Yes (46),30,16,0,0,50,25,2,2,Yes,Yes,Yes,Yes,Yes,2021-05-11 12:19,4
Anshu Hospital,"Shiv Colony Sehatpur Road, Palla No. 1, Faridabad",Yes (11),6,5,0,0,10,10,0,0,No,To Be Updated,To Be Updated,To Be Updated,To Be Updated,2021-05-11 11:00,4
Apurva Hospital,"2N/74, B.P. Near 2-3 Gole ChakKar, NIT Faridabad",Yes (9),7,2,0,1,8,2,0,1,Yes,To Be Updated,To Be Updated,To Be Updated,To Be Updated,2021-05-11 09:35,4
Arise Healthcare,"SCO: C 3185, Near Corporation Bank, Green Field Colony, Faridabad",Yes (11),1,7,3,1,2,7,7,2,Yes,No,No,No,No,2021-05-11 12:30,4
Arsh Hospital,"Opp. Era Redwood Residency, Tigaon Rd, Sector 78, Faridabad,",Yes (5),0,5,0,3,40,5,20,6,Yes,No,Yes,Yes,Yes,2021-05-11 10:37,4
Asian Hospital,"Badkal Flyover Road, Sector  21 A Faridabad",No (0),Beds Over Utilized 14,0,Beds Over Utilized 1,Beds Over Utilized 3,82,0,53,14,Yes,Yes,Yes,Yes,Yes,2021-05-11 16:18,4
B.K. Hospital Faridabad,B.K. Hospital Faridabad B K Chowk FBD,Yes (45),20,25,0,0,64,25,11,11,No,Yes,Yes,Yes,Yes,2021-05-11 16:14,4
Bhavya Kalyani Hospital,"Mohna Road, Near Aanand Bakery, Ballabgarh, Faridabad",Yes (12),3,8,1,0,5,9,3,0,Yes,To Be Updated,To Be Updated,To Be Updated,To Be Updated,2021-05-11 14:50,4
Chugh Hospital,"5L-164, K.C. Road N.I.T. Faridabad",Yes (3),1,2,0,0,4,14,0,0,To Be Updated,To Be Updated,To Be Updated,To Be Updated,To Be Updated,2021-05-11 11:27,4
D.M. Hospital,"89-A, NH-5, Railway Road, Near Police Thana, NIT, Faridabad",No (0),0,0,0,0,10,10,8,1,No,No,Yes,Yes,Yes,2021-05-11 11:09,4
Doctor Today Multispecialty Hospital,"5-C/2,B.P., Railway Road,, Near Bankey Bihari Mandir,, next to IDBI Bank, Faridabad",Yes (21),21,0,0,1,35,0,5,2,Yes,No,Yes,Yes,Yes,2021-05-11 16:36,4
Dr. Harish Hospital,"701, Sector 8, YMCA Road, Faridabad",Yes (2),2,0,0,0,5,0,2,0,Yes,No,Yes,Yes,Yes,2021-05-11 10:02,4
Durga Multispeciality Hospital,"Shri Bankey Bihari Mandir Complex, Neelam-Railway Road, NIT 5, Faridabad",Yes (27),21,0,6,0,22,0,8,0,No,No,Yes,Yes,Yes,2021-05-11 12:44,4
"ESIC Medical College, Faridabad","NH-3, NIT Behind BK Hospital, Haryana",Yes (312),0,312,0,0,150,350,80,50,Yes,Yes,Yes,Yes,Yes,2021-05-11 07:45,4
Fortis Escort Hospital,"Neelam Bata Rd, opp. Neelam Cinema, AC Nagar, New Industrial Town, Faridabad,",No (0),Beds Over Utilized 2,0,0,Beds Over Utilized 2,55,0,14,7,Yes,Yes,Yes,Yes,Yes,2021-05-11 12:40,4
Gaurav Hospital,"Rajeev Colony, Samaypur Road, Ballabgarh, Faridabad",Yes (7),Beds Over Utilized 12,2,5,1,3,2,10,1,To Be Updated,To Be Updated,To Be Updated,To Be Updated,To Be Updated,2021-05-11 17:07,4
Geeta Hospital,"Opposite Huda Market and Community Centre, Sector 28, Faridabad",Yes (13),6,0,7,1,8,0,10,2,Yes,No,Yes,Yes,Yes,2021-05-11 12:01,4
Geetanjali Multispeciality Hospital,"D-635, 60 Feet Rd, Chawla Colony, Ballabhgarh, Faridabad",Yes (11),11,0,0,0,20,3,0,0,Yes,To Be Updated,Yes,To Be Updated,To Be Updated,2021-05-08 15:28,4
Goyal Hospital,"Plot No. 2 opposite hanuman temple Sec 8, Surdas Park",No (0),0,0,0,0,12,0,6,2,No,Yes,Yes,Yes,Yes,2021-05-11 11:20,4
Handa Medical Center,"Site No-1, Sector 16, Opp Sagar Cinema, Faridabad",No (0),0,0,0,0,0,0,0,0,No,No,No,To Be Updated,No,2021-05-11 14:08,4
Heritage Hospital,3C-62B/BP NIT Faridabad,Yes (15),11,0,4,1,11,0,4,1,To Be Updated,To Be Updated,To Be Updated,To Be Updated,To Be Updated,2021-05-11 15:18,4
IBS Ashwani Hospital,"Plot No 8 D/1, YMCA Rd, Pocket D, Sector 11, Faridabad",Yes (15),8,5,2,2,18,5,12,2,No,To Be Updated,To Be Updated,To Be Updated,To Be Updated,2021-05-11 10:46,4
Janak Hospital,Indira complex Neharpar Kheri Road Faridabad,Yes (9),3,4,2,0,15,6,6,0,Yes,No,Yes,Yes,Yes,2021-05-11 11:02,4
Kant Multispeciality Hospital Pvt Ltd,"Plot no. 167, Indra Complex, Kheri Road, Greater, near Kheri Pul Bridge, Sector 87, Neharpar Faridabad, Faridabad, Haryana 121002",Yes (19),16,0,3,0,18,0,5,1,No,Yes,To Be Updated,To Be Updated,To Be Updated,2021-05-11 10:45,4
Kedar Hospital,"3B/3, B.P , Near DAV college, NIT., Faridabad,",Yes (45),31,6,8,1,31,6,12,1,To Be Updated,To Be Updated,To Be Updated,To Be Updated,To Be Updated,2021-05-11 09:06,4
Kedar Hospital Multispeciality,Gali 7 Krishna Colony Sec25 Faridabad,Yes (18),5,13,0,0,10,15,5,0,Yes,No,Yes,Yes,Yes,2021-05-11 09:08,4
Krishna Medical Centre,"773, Sector-19, Faridabad",Yes (10),5,0,5,0,5,0,5,0,To Be Updated,To Be Updated,To Be Updated,To Be Updated,To Be Updated,2021-05-11 15:16,4
Life Hospital,Opp Hanuman Mandir Sec 8 Faridabad,Yes (5),4,0,1,1,4,0,6,1,Yes,No,Yes,Yes,Yes,2021-05-11 11:30,4
Lotus Hospital,"Plot-2, Jeevan Nagar, Opp. Lal Kothi, Main Ballabgarh Sohna Road, Faridabad",Yes (9),8,0,1,0,12,0,8,1,Yes,No,Yes,Yes,Yes,2021-05-11 23:01,4
Madhav Hospital,"Building no 16, Block E, and, New Industrial Twp 5, Faridabad, Haryana 121001",Yes (14),Beds Over Utilized 1,0,14,2,0,0,28,2,To Be Updated,No,To Be Updated,To Be Updated,To Be Updated,2021-05-11 17:57,4
Manavta Hospital,"Plot No-494, Near Women ITI, Uncha Gaon Prem Nagar, Mohna Road, Ballabgarh, Faridabad",Yes (3),0,2,1,2,10,10,11,3,To Be Updated,To Be Updated,To Be Updated,To Be Updated,To Be Updated,2021-05-11 08:52,4
Manvi Medical Centre,"New Bharat Colony, Opp. Chaddar Godam, Near Mahaban Farm, Kheri Road, Greater Faridabad",Yes (9),7,0,2,0,7,0,2,0,To Be Updated,To Be Updated,To Be Updated,To Be Updated,To Be Updated,2021-05-11 15:14,4
Medicheck Hospital,"Block C, Plot Number 76, Shahid Bhagat Singh Marg, near Bata Flyover, New Industrial Town, Faridabad",Yes (4),4,Beds Over Utilized 7,0,0,52,0,12,3,Yes,No,Yes,Yes,Yes,2021-05-11 11:49,4
Medicheck Ortho Hospital,"Behind Community Centre, HBH Colony, Sector 46, Faridabad",Yes (13),13,0,0,0,13,0,0,0,To Be Updated,To Be Updated,To Be Updated,To Be Updated,To Be Updated,2021-05-11 09:22,4
Medstar Hospital,"Om Enclave Part 1, Near Toll Tax, Agwanpur Road, Faridabad",Yes (5),3,2,0,0,5,2,0,0,No,No,Yes,Yes,Yes,2021-05-11 08:58,4
Medwin Hospital,"Plot No. 2, Jeevan Nagar, Sohna Road Gounchi, Sector 55, Faridabad",Yes (16),1,12,3,0,2,12,6,0,To Be Updated,No,Yes,Yes,Yes,2021-05-11 12:28,4
Metro Hospital Medicare,"Metro Heart Institute with Multispeciality Sector 16 A, Faridabad",Yes (4),4,0,0,0,168,0,39,11,Yes,No,Yes,Yes,Yes,2021-05-11 10:37,4
National Institute Of Medical Sciences,"Sector -23A,?Faridabad,?",Yes (5),3,0,2,2,15,4,9,2,Yes,No,Yes,Yes,Yes,2021-05-10 21:10,4
Ortho 1 Hospital,"1331, Near Community Centre, Sector 55, Faridabad",Yes (28),7,12,9,1,8,12,10,1,Yes,No,Yes,Yes,Yes,2021-05-11 22:16,4
Park Hospital,"J Block, Sector 10 HBC, opposite Court, Faridabad",No (0),0,0,0,5,10,10,25,5,Yes,Yes,Yes,Yes,Yes,2021-05-11 09:47,4
Pawan Hospital Unit-1,"Samaypur Road Near Sector 56, Ballabhgarh, Faridabad",Yes (9),9,0,0,0,31,0,14,7,To Be Updated,To Be Updated,To Be Updated,To Be Updated,To Be Updated,2021-05-11 09:39,4
Pawan Hospital Unit-2,"Plot No. 10, Jawahar Colony, Near Disposal Chowk, Faridabad",Yes (1),0,0,1,0,0,0,11,0,To Be Updated,To Be Updated,To Be Updated,To Be Updated,To Be Updated,2021-05-11 09:38,4
Prachi Hospital,Opp Chimni Bai Dharmshala Faridabad,Yes (9),6,2,1,1,10,2,5,1,Yes,To Be Updated,To Be Updated,To Be Updated,To Be Updated,2021-05-11 16:28,4
QRG Central,"Plot No, 69, Mathura Rd, Sector 20 A, New Industrial Town, Faridabad",No (0),0,0,0,0,105,0,39,11,Yes,Yes,Yes,Yes,Yes,2021-05-11 10:29,4
QRG Hospital Medicare,"Ambedkar Marg, QRG Healthcity, Sector 16, Faridabad",Yes (8),7,0,1,0,165,0,43,14,Yes,Yes,Yes,Yes,Yes,2021-05-11 10:36,4
Raghav Hospital,Kheri Road Sec 87 Greater Faridabad,Yes (14),14,0,0,1,17,3,3,1,Yes,No,Yes,Yes,Yes,2021-05-11 10:05,4
Raj Nursing Home,"CLINIC SITE NO-6, Sector 3, Faridabad",Yes (1),0,Beds Over Utilized 16,1,0,13,0,4,1,Yes,No,Yes,Yes,Yes,2021-05-11 11:33,4
Ronak Hospital,"Dabua Pali Road, Near Ganga Ram Devta Mandir, NIT, Faridabad",Yes (45),20,18,7,3,20,20,10,3,No,Yes,Yes,Yes,Yes,2021-05-11 11:48,4
