name,address,Availability_availability_of_beds,Availability_oxygen_beds,Availability_non_oxygen_beds,Availability_i_c_u_beds,Availability_ventilators,Allocated_oxygen_beds,Allocated_non_oxygen_beds,Allocated_i_c_u,Allocated_ventilators,Availability_availability_of_oxygen,Availability_antiviral_remdesivir_etc_,Availability_steroids,Availability_anticoagulant,Availability_antipyretic,updated_on_unparsed,updated_on,city
Alchemist Hospital panchkula,Sector 21 Panchkula,Yes (16),12,0,4,3,15,0,4,3,Yes,Yes,Yes,Yes,Yes,"9:46 AM 24th Jun,21",2021-06-24 09:46,16
Alchemist Ojas Hospital,"H1  SEctor 26, Panchkula Ext, Panchkula",Yes (66),54,0,12,3,54,0,13,4,Yes,Yes,Yes,Yes,Yes,"9:47 AM 24th Jun,21",2021-06-24 09:47,16
Civil Hospital Panchkula,sector 6 Panchkula,Yes (49),42,5,2,5,45,8,10,10,Yes,Yes,Yes,Yes,Yes,"9:45 AM 24th Jun,21",2021-06-24 09:45,16
JN Shory Hospital,Pinjore,Yes (24),18,6,0,0,18,6,0,0,Yes,No,Yes,Yes,Yes,"9:47 AM 24th Jun,21",2021-06-24 09:47,16
Kare Partners Hospital,"Sector 2, Panchkula",Yes (13),13,0,0,0,13,0,0,0,Yes,No,Yes,Yes,Yes,"9:47 AM 24th Jun,21",2021-06-24 09:47,16
Paras Hospital Pvt,"Plot no 2, sec 22, panchkula",Yes (19),2,0,17,6,2,0,17,6,Yes,Yes,Yes,Yes,Yes,"9:46 AM 24th Jun,21",2021-06-24 09:46,16
Wings Hospital,Sector 25 Panchkula,Yes (31),15,11,5,0,15,11,5,0,Yes,No,Yes,Yes,Yes,"9:47 AM 24th Jun,21",2021-06-24 09:47,16
GH Charkhi Dadri,"Near Loharu Chowk,Charkhi Dadri",Yes (51),35,15,1,11,35,15,1,11,Yes,Yes,Yes,Yes,Yes,"3:39 PM 21st Jun,21",2021-06-21 15:39,3
Jaihind Hospital,Charkhi Dadri,Yes (13),7,1,5,0,7,1,5,0,Yes,Yes,Yes,To Be Updated,To Be Updated,"3:41 PM 21st Jun,21",2021-06-21 15:41,3
Murari Lal Rasiwasia Ayurvedic Hospital,"Delhi Road,Near Janta College",Yes (70),60,10,0,0,60,10,0,0,Yes,Yes,Yes,Yes,Yes,"3:39 PM 21st Jun,21",2021-06-21 15:39,3
Oscar Hospital,Charkhi Dadri,Yes (20),0,0,20,0,0,0,20,0,To Be Updated,To Be Updated,To Be Updated,To Be Updated,To Be Updated,"3:40 PM 21st Jun,21",2021-06-21 15:40,3
Pradhan Medicare Centre,"Loharu Rd, Charkhi Dadri, Haryana",Yes (17),14,0,3,0,14,0,3,0,To Be Updated,Yes,Yes,Yes,Yes,"3:39 PM 21st Jun,21",2021-06-21 15:39,3
Sunflag Hospital,Charkhi Dadri,Yes (12),6,0,6,0,6,0,6,0,To Be Updated,To Be Updated,To Be Updated,To Be Updated,To Be Updated,"3:40 PM 21st Jun,21",2021-06-21 15:40,3
Advanta Super Speciality Hospital,Near Power House,Yes (20),14,1,5,4,14,1,5,4,Yes,No,Yes,Yes,Yes,"9:11 AM 19th Jan,22",2022-01-19 09:11,19
ARS Holy Heart Advanced Cardiac care &amp; Research Centre,"330, Vinay Nagar Rohtak, Near Delhi Bypass Rohtak",Yes (20),0,0,20,2,0,0,20,2,Yes,No,No,No,No,"9:25 AM 1st Jul,21",2021-07-01 09:25,19
CHC Chiri,"VOP Chiri, Meham Gohana Road, Distt. Rohtak Haryana",Yes (10),10,0,0,0,10,0,0,0,Yes,Yes,Yes,Yes,Yes,"4:01 PM 15th Jul,21",2021-07-15 16:01,19
CHC Kahanaur,"Near Sarva haryana Gramin Bank, Opp. Banquet hall, Nigana Road, Kahanaur",Yes (10),4,6,0,0,4,6,0,0,Yes,No,Yes,No,Yes,"2:43 PM 21st Jan,22",2022-01-21 14:43,19
CHC kalanaur,"Police Station, Bhiwani-Rohtak Road , Near Kalanaur kalan, Kalanaur,",Yes (10),10,0,0,0,10,0,0,0,Yes,No,Yes,No,Yes,"1:54 PM 26th Jun,21",2021-06-26 13:54,19
CHC Kiloi,"VPO Kiloi, Water Works, Distt. Rohtak",Yes (10),5,5,0,0,5,5,0,0,Yes,No,Yes,No,Yes,"9:41 AM 1st Jul,21",2021-07-01 09:41,19
CHC Madina,"VPO Madina, Hisar Road Distt. Rohtak, Haryana",Yes (10),0,10,0,0,0,10,0,0,Yes,No,No,No,Yes,"9:32 AM 10th Jul,21",2021-07-10 09:32,19
CHC Meham,"Near ITI, Meham Distt. Rohtak",Yes (10),10,0,0,0,10,0,0,0,Yes,No,Yes,No,Yes,"10:56 AM 30th Jul,21",2021-07-30 10:56,19
CHC Sampla,"Gadi Sampla, Rohtak, SH-20, Jhajjar Sampla Road, Sampla, Sampla, Haryana 124501",Yes (10),0,10,0,0,0,10,0,0,No,No,Yes,No,Yes,"10:29 AM 8th Jan,22",2022-01-08 10:29,19
"Civil Hospital, Rohtak",Subash Road,Yes (71),40,24,7,5,40,24,7,5,Yes,Yes,Yes,Yes,Yes,"2:52 PM 19th Jan,22",2022-01-19 14:52,19
Holy Heart Super speciality Hospital,Vinay Nagar Delhi Bye pass,Yes (34),20,4,10,4,20,5,10,4,Yes,No,Yes,Yes,Yes,"9:09 AM 19th Jan,22",2022-01-19 09:09,19
"Hridaya Nilayam Heart, Lung &amp; vascular Institute","5, Raj Garden, Delhi Bypass, Rohtak",Yes (51),47,0,4,4,47,0,4,4,To Be Updated,To Be Updated,To Be Updated,To Be Updated,To Be Updated,"10:45 AM 16th Jan,22",2022-01-16 10:45,19
Joyline Multispeciality,"Surajmal Colony, Sunarian Road, Opposite Birgadier Muktram Statue Rohtak",Yes (20),15,0,5,1,15,0,5,1,Yes,Yes,Yes,Yes,Yes,"12:54 PM 18th Jan,22",2022-01-18 12:54,19
Kainos Hospital,Near Kheri Sadh Village Outer Bye Pass,Yes (70),26,10,34,17,26,10,34,17,Yes,No,Yes,Yes,Yes,"9:14 AM 2nd Jul,21",2021-07-02 09:14,19
Life Care Hospital,Subash Nagar,Yes (50),20,0,30,7,20,0,30,7,Yes,No,Yes,Yes,Yes,"10:53 AM 16th Jan,22",2022-01-16 10:53,19
Maan Hospital,Bhagwan Colony Near Radio Station,Yes (49),20,12,17,4,20,14,17,4,Yes,No,Yes,Yes,Yes,"9:12 AM 19th Jan,22",2022-01-19 09:12,19
Mansarover Hospital,Mansarover Colony Near Park,Yes (30),20,Beds Over Utilized 1,10,7,20,0,10,7,Yes,No,Yes,Yes,Yes,"9:12 AM 19th Jan,22",2022-01-19 09:12,19
Neurocentre Super Speciality Hospital,"Kalawati Bulding, Near Power House Rohtak",Yes (23),4,6,13,2,4,6,13,2,Yes,No,Yes,Yes,Yes,"4:18 PM 27th Jun,21",2021-06-27 16:18,19
Noble Heart Super Speciality Hospital,Near Raj Garden Delhi Bye Pass,Yes (64),22,6,36,8,22,6,36,8,Yes,No,Yes,Yes,Yes,"10:42 AM 16th Jan,22",2022-01-16 10:42,19
Oscar Super Speciality Trauma Center,"Medical Moad, Daryao Singh Nagar,",Yes (41),23,3,15,2,23,3,15,2,Yes,Yes,Yes,Yes,Yes,"9:51 AM 21st Jun,21",2021-06-21 09:51,19
Oxygen Hospital,Islam Pura Daries Hisar Road,Yes (30),15,10,5,4,15,10,5,4,Yes,No,Yes,Yes,Yes,"10:49 AM 23rd Jun,21",2021-06-23 10:49,19
PGIMS Rohtak,"Pt.Bhagwat Dayal PGIMS, Medical Rd, Rohtak, Haryana",Yes (497),400,0,97,110,451,0,115,115,Yes,Yes,Yes,Yes,Yes,"10:23 AM 23rd Jan,22",2022-01-23 10:23,19
Positron Hospital,Suncity Sector 35,Yes (29),0,14,15,6,0,14,16,6,Yes,No,Yes,Yes,Yes,"4:24 PM 22nd Jan,22",2022-01-22 16:24,19
Pragati Hospital,"Sukhpura Chowk, Gohana Road, opp. Ladhot Road Rohtak",Yes (35),30,0,5,2,30,0,5,2,Yes,No,Yes,Yes,Yes,"10:44 AM 16th Jan,22",2022-01-16 10:44,19
"Sanghi Nursing Home, Rohtak, Haryana","Chotu Ram Chowk, Civil Road, Arya Nagar, Rohtak, Haryana",Yes (14),10,0,4,4,10,0,4,4,Yes,Yes,Yes,Yes,Yes,"11:00 AM 16th Jan,22",2022-01-16 11:00,19
Shivam Liver &amp; Gastro Super Speciality Hospital,"CIVIL ROAD NEAR SHANT MAI CHOWK, Rohtak, Haryana - 124001, India",Yes (9),5,0,4,1,5,0,4,1,Yes,No,Yes,Yes,Yes,"10:50 AM 16th Jan,22",2022-01-16 10:50,19
Sunflag Global Hospital,Bharat Colony Near Sheela Bye Pass,Yes (35),20,Beds Over Utilized 2,15,5,20,0,15,5,Yes,No,Yes,Yes,Yes,"9:14 AM 19th Jan,22",2022-01-19 09:14,19
Anchal Multispeciality Hospital,"Anchal Multi speciality Hospital, Krishna Colony, Bhiwani, Haryana 127027",Yes (35),25,0,10,2,25,0,10,2,Yes,Yes,Yes,Yes,Yes,"11:34 AM 5th Jul,21",2021-07-05 11:34,2
Ch. Bansilal Govt Hospital,"Bansi Lal General Hospital, Ghanta Ghar Chowk, SH 17, Krishna Colony, Bhiwani, Haryana 127021",Yes (171),139,5,27,16,139,5,28,16,Yes,Yes,Yes,Yes,Yes,"11:20 AM 5th Jul,21",2021-07-05 11:20,2
Chugh Hospital,"Meham Gate, Circular Road, Bhiwani",Yes (20),20,0,0,0,20,0,0,0,Yes,Yes,Yes,Yes,Yes,"12:08 PM 5th Jul,21",2021-07-05 12:08,2
ESI Hospital Bhiwani,"Stadium Rd, Housing Board Colony, Bhiwani, Haryana 127021",Yes (40),0,40,0,0,0,40,0,0,No,No,Yes,Yes,Yes,"11:34 AM 5th Jul,21",2021-07-05 11:34,2
Ganpatrai Hospital,"SH 17, Bank Colony, Bound Kalan, Krishna Colony, Bhiwani, Haryana 127021",Yes (10),4,4,2,1,4,4,2,1,Yes,No,Yes,Yes,Yes,"11:34 AM 5th Jul,21",2021-07-05 11:34,2
Jangra Multispecilaity Hospital,"Bank Colony, Old Bharat Nagar, Bhiwani, Haryana 127021",Yes (10),7,3,0,0,7,3,0,0,Yes,No,Yes,Yes,Yes,"12:06 PM 5th Jul,21",2021-07-05 12:06,2
Jeevan Nursing Home-Bhiwani,Rohtak gate Bhiwani,Yes (10),3,4,3,0,3,4,3,0,Yes,Yes,Yes,Yes,Yes,"12:09 PM 5th Jul,21",2021-07-05 12:09,2
Jeevanrekha Hospital,Near Railway Road Bhiwani,Yes (30),25,0,5,1,25,0,5,1,To Be Updated,To Be Updated,To Be Updated,To Be Updated,To Be Updated,"12:09 PM 5th Jul,21",2021-07-05 12:09,2
Kadam Hospital,"Bank Colony Near New Bus Stand, Bhiwani",Yes (45),11,0,34,1,11,0,34,1,Yes,Yes,Yes,Yes,Yes,"11:34 AM 5th Jul,21",2021-07-05 11:34,2
Krishan Lal Jalan Hospital,"Jalan Nagar, M.C.Colony, Bhiwani, Haryana 127021",Yes (40),20,20,0,0,20,20,0,0,Yes,Yes,Yes,Yes,Yes,"12:06 PM 5th Jul,21",2021-07-05 12:06,2
Life Line Hospital,"Circular Rd, M.C.Colony, Bhiwani, Haryana 127021",Yes (27),21,0,6,0,21,0,6,0,Yes,Yes,Yes,Yes,Yes,"12:06 PM 5th Jul,21",2021-07-05 12:06,2
RPS HOSPITAL,,Yes (24),4,16,4,0,4,16,4,0,Yes,No,Yes,Yes,Yes,"12:06 PM 5th Jul,21",2021-07-05 12:06,2
Sharma Nursing and Maternity Home Tosham,Siwani Road Tosham,Yes (10),7,0,3,2,7,0,3,2,Yes,Yes,To Be Updated,Yes,Yes,"12:09 PM 5th Jul,21",2021-07-05 12:09,2
Shree Ganesha Hospital,"Dadri Gate, Bhiwani",Yes (13),6,3,4,0,6,3,4,0,Yes,Yes,Yes,Yes,Yes,"12:08 PM 5th Jul,21",2021-07-05 12:08,2
"SHRI BABA YOGI NETANATH HOSPITAL , LOHANI ,BHIWANI",VPO Lohani,Yes (50),35,5,10,2,35,5,10,2,Yes,Yes,Yes,Yes,Yes,"12:09 PM 5th Jul,21",2021-07-05 12:09,2
Shri Ram Hospital,Siwani,Yes (11),0,0,11,4,0,0,11,4,To Be Updated,To Be Updated,To Be Updated,To Be Updated,To Be Updated,"12:09 PM 5th Jul,21",2021-07-05 12:09,2
SMSG Multispeciality Hospital,"Rohtak Gate, Bhiwani",Yes (30),2,17,11,2,2,17,11,2,Yes,Yes,Yes,Yes,Yes,"12:08 PM 5th Jul,21",2021-07-05 12:08,2
Spes Hospital,"Circular Rd, Bound Kalan, M.C.Colony, Bhiwani, Haryana 127021",Yes (22),4,6,12,1,4,6,12,1,Yes,Yes,Yes,Yes,Yes,"12:07 PM 5th Jul,21",2021-07-05 12:07,2
Cygnus Multispecialty Hospital Kaithal,"Huda Bypass Road, Sector 20, Kaithal, Haryana",Yes (40),28,0,12,2,28,0,12,2,Yes,No,Yes,Yes,Yes,"1:02 PM 18th Jul,21",2021-07-18 13:02,10
District Civil Hospital Kaithal,"Huda Sec 18, Kaithal",Yes (115),80,15,20,18,80,15,20,18,Yes,Yes,Yes,Yes,Yes,"11:59 AM 9th Aug,21",2021-08-09 11:59,10
SDH Guhla,SDH Guhla,Yes (70),35,35,0,5,35,35,0,5,Yes,No,Yes,No,Yes,"9:45 AM 16th Aug,21",2021-08-16 09:45,10
Shah Multispecialty Hospital Kaithal,"opp.old, bus stand, Jind - Kaithal Rd, Amar Garh Colony, Kaithal, Haryana",Yes (74),51,9,14,10,51,11,15,10,Yes,No,Yes,Yes,Yes,"3:58 PM 21st Jan,22",2022-01-21 15:58,10
ASHIRWAD BHAGAT HOSPITAL,"Old DC Rd, near bhagat hospital, Sonipat, Haryana 131001",Yes (15),12,0,3,1,12,0,3,1,Yes,Yes,Yes,Yes,Yes,"11:47 AM 17th Jun,21",2021-06-17 11:47,21
Bhagwan Dass Hospital,"Near Shahpur Turk, block-E, omaxe city, Sector 18, Sonipat, Haryana 131001",Yes (35),22,0,13,2,27,0,13,2,Yes,No,Yes,Yes,Yes,"5:33 PM 21st Jan,22",2022-01-21 17:33,21
"BPS MEDICAL COLLEGE KHANPUR , SONIPAT ( 01263283088)","Ganaur - Gohana Rd, Khanpur Kalan, Haryana",Yes (300),170,80,50,50,170,80,50,50,Yes,Yes,Yes,Yes,Yes,"7:53 AM 16th Aug,21",2021-08-16 07:53,21
CHC GANUR,CHC GANUR,Yes (8),8,0,0,0,8,0,0,0,Yes,No,Yes,Yes,Yes,"11:48 AM 17th Jun,21",2021-06-17 11:48,21
CHC Kharkhoda,"SH 20, Kharkhoda, Haryana 131402",Yes (10),5,5,0,0,5,5,0,0,To Be Updated,To Be Updated,Yes,Yes,Yes,"11:49 AM 17th Jun,21",2021-06-17 11:49,21
"CHC, JUAN, SONIPAT, HARYANA","CHC, JUAN, SONIPAT, HARYANACHC, JUAN, SONIPAT, HARYANA, 131024",Yes (5),3,2,0,0,3,2,0,0,Yes,No,Yes,Yes,Yes,"11:56 AM 17th Jun,21",2021-06-17 11:56,21
"Civil Hospital, Sonipat (9050007668 )","Delhi Road, Near Maharana Pratap Chowk, Sonipat, Haryana 131001",Yes (192),182,0,10,10,190,0,10,10,Yes,Yes,Yes,Yes,Yes,"11:49 AM 17th Jun,21",2021-06-17 11:49,21
"CYGNUS HOSPITAL, Sonipat","Old Rohtak Rd, near Hindu College of Engineering, Industrial Area, Sonipat, Haryana 131001",Yes (20),18,0,2,1,18,0,2,1,Yes,No,Yes,Yes,Yes,"4:07 PM 25th Jun,21",2021-06-25 16:07,21
Dayanand Hospital-Sonepat,"Kakroi Rd, Prem Nagar, West Ram Nagar, Sonipat, Haryana",Yes (40),35,Beds Over Utilized 2,5,3,35,0,5,3,Yes,No,Yes,Yes,Yes,"6:05 PM 18th Jan,22",2022-01-18 18:05,21
FIIMS Hospital,"Road, Bahalgarh, Sonipat, Haryana 131304",Yes (99),63,0,36,6,63,0,37,8,Yes,No,Yes,Yes,Yes,"11:50 AM 17th Jun,21",2021-06-17 11:50,21
GAJRAJ HOSPITAL,"Bus Stand, Gajraj Hospital Road, Near, Gohana, Haryana 131301",Yes (20),20,0,0,0,20,0,0,0,Yes,To Be Updated,Yes,Yes,Yes,"11:51 AM 17th Jun,21",2021-06-17 11:51,21
"GLAXY ONE HOSPITAL, SONIPAT","SH 11, Bahalgarh, Sonipat, Haryana 131021",Yes (18),18,Beds Over Utilized 4,Beds Over Utilized 5,Beds Over Utilized 1,20,0,0,0,Yes,To Be Updated,Yes,Yes,Yes,"6:06 PM 18th Jan,22",2022-01-18 18:06,21
HARYANA HOSPITAL,"Vivekanand Chowk, Delhi Rd, behind Bullet Showroom, Janta Colony, Sonipat, Haryana 131001",Yes (2),1,0,1,1,1,0,1,1,Yes,No,No,No,Yes,"8:46 AM 22nd Jun,21",2021-06-22 08:46,21
MEMORIAL HOSPITAL,"SH 11, near Mama Bhanja Chowk, Nandwani Nagar, Anand Nagar,, Sonipat, Haryana 131001",Yes (20),16,0,4,2,16,0,4,2,Yes,No,Yes,Yes,Yes,"9:40 AM 6th Jul,21",2021-07-06 09:40,21
NIDAAN HOSPITAL PVT.,"Murthal Rd, Sonipat, Haryana 131001",No (0),0,0,0,0,0,0,0,0,Yes,No,Yes,Yes,Yes,"11:52 AM 17th Jun,21",2021-06-17 11:52,21
OSCAR HOSPITAL,"SH 11, Lakshmi Nagar, Sonipat, Haryana 131001",Yes (14),6,0,8,2,7,0,8,2,Yes,No,Yes,Yes,Yes,"6:07 PM 18th Jan,22",2022-01-18 18:07,21
PHC PURKHAS,"Purkhas, Haryana 131102",Yes (30),0,30,0,0,0,30,0,0,To Be Updated,To Be Updated,To Be Updated,To Be Updated,To Be Updated,"11:52 AM 17th Jun,21",2021-06-17 11:52,21
PREMPUSHP MULTISPECIALITY HOSPITAL,"SUBJI MANDI GANAUR,HARYANA SONIPAT 131101",Yes (20),20,0,0,0,20,0,0,0,To Be Updated,No,Yes,Yes,Yes,"5:55 PM 18th Jan,22",2022-01-18 17:55,21
"SANJIVNI HOSPITAL, SONIPAT","Mehlana Rd, Malviya Nagar, Sonipat, Haryana 131304",Yes (15),14,0,1,1,14,0,1,1,Yes,No,Yes,Yes,Yes,"5:43 PM 19th Jan,22",2022-01-19 17:43,21
SAXSENA HOSPITAL,"112/113, T.P. Scheme, Delhi Rd, Sonipat, Haryana 131304",Yes (23),18,0,5,2,18,0,5,2,Yes,No,Yes,Yes,Yes,"10:37 AM 2nd Jul,21",2021-07-02 10:37,21
SDH GOHANA,"Devi Nagar, Uttam Nagar, Gohana, Haryana 131301",Yes (10),10,0,0,0,10,0,0,0,Yes,Yes,Yes,Yes,Yes,"11:48 AM 17th Jun,21",2021-06-17 11:48,21
SITA HOSPITAL SONIPAT,"Railway Rd, Ganaur, Haryana 131101",Yes (20),20,0,0,0,20,0,0,0,Yes,No,Yes,Yes,Yes,"1:15 PM 26th Jun,21",2021-06-26 13:15,21
SUNHERI DEVI HOSPITAL,"Mission Rd, Dev Nagar, Sonipat, Haryana 131001",Yes (20),15,0,5,1,15,0,5,1,Yes,No,Yes,Yes,Yes,"11:53 AM 17th Jun,21",2021-06-17 11:53,21
TULIP HOSPITAL,"T. P. Scheme, no.15, Delhi Rd, Vivekanand chowk, Sonipat, Haryana 131001",Yes (20),0,0,20,5,0,0,20,5,Yes,No,Yes,Yes,Yes,"5:53 PM 18th Jan,22",2022-01-18 17:53,21
ANUJ HOSPITAL SAFIDON,safidon panipat road,Yes (30),2,18,10,0,2,18,10,0,Yes,No,Yes,Yes,Yes,"8:40 AM 30th Jun,21",2021-06-30 08:40,9
Balaji Hospital Jind,Rohtak Road Jind,Yes (48),32,16,0,0,32,16,0,0,Yes,No,Yes,Yes,Yes,"8:39 AM 30th Jun,21",2021-06-30 08:39,9
CHC Alewa,"Alewa 2 Sub Health Centre, Alewa Chc Alewa, Alewa, Jind",Yes (15),15,0,0,0,15,0,0,0,Yes,No,Yes,No,Yes,"8:41 AM 30th Jun,21",2021-06-30 08:41,9
CHC Julana,Julana,Yes (26),20,6,0,0,20,6,0,0,Yes,No,Yes,Yes,Yes,"8:38 AM 30th Jun,21",2021-06-30 08:38,9
District Civil Hospital Jind (NEW+OLD),Hosptial,Yes (170),150,0,20,12,150,0,20,12,Yes,Yes,Yes,Yes,Yes,"8:36 AM 30th Jun,21",2021-06-30 08:36,9
Gangaputra Ayurvedic Medical College Jind,Kandela,Yes (100),60,15,25,3,60,15,25,3,Yes,No,Yes,Yes,Yes,"8:39 AM 30th Jun,21",2021-06-30 08:39,9
JIND HEART HOSPITAL,GOHANA BYPASS ROHTAK ROAD JIND,Yes (17),12,0,5,1,12,0,5,1,Yes,No,No,No,No,"8:39 AM 30th Jun,21",2021-06-30 08:39,9
Malik Hospital,Rohtak Road Jind,Yes (8),4,0,4,3,4,0,4,3,Yes,No,Yes,Yes,Yes,"8:39 AM 30th Jun,21",2021-06-30 08:39,9
Meenakashi Jain Hospital,Near Bus Stand,Yes (22),15,2,5,1,15,2,5,1,Yes,No,Yes,Yes,Yes,"8:39 AM 30th Jun,21",2021-06-30 08:39,9
RAJ HOSPITAL ROHTAK RAOD JIND,ROHTAK ROAD JIND,Yes (15),8,5,2,2,8,5,2,2,Yes,No,Yes,Yes,Yes,"9:27 AM 6th Jul,21",2021-07-06 09:27,9
Sarvodhya Hospital Jind,Jind,Yes (20),20,0,0,2,20,0,0,2,Yes,No,Yes,No,No,"8:39 AM 30th Jun,21",2021-06-30 08:39,9
SDH Narwana,Narwana,Yes (32),20,12,0,0,20,12,0,0,Yes,No,Yes,Yes,Yes,"4:57 PM 19th Jan,22",2022-01-19 16:57,9
SDH Safidon,Safidon,Yes (34),20,14,0,0,20,14,0,0,Yes,No,Yes,No,Yes,"8:41 AM 30th Jun,21",2021-06-30 08:41,9
SDH UCHANA,Uchana,Yes (55),20,35,0,0,20,35,0,0,Yes,No,No,No,Yes,"11:25 AM 22nd Jan,22",2022-01-22 11:25,9
Shri Gyani Ram Mamorial Hospital,Safidon,Yes (25),10,5,10,0,10,5,10,0,Yes,No,Yes,Yes,Yes,"8:38 AM 30th Jun,21",2021-06-30 08:38,9
Balaji Gautam Hospital,"Model Colony, East Bhatia Nagar, Yamuna Nagar, Haryana",Yes (12),7,2,3,0,7,2,3,0,Yes,No,Yes,Yes,Yes,"11:29 PM 4th Dec,21",2021-12-04 23:29,22
Ch Lekh Raj Multispeciality Hospital,Vill Gadhauli Yamuna Nagar,Yes (150),140,0,10,5,140,0,10,5,Yes,Yes,Yes,Yes,Yes,"9:53 AM 27th Aug,21",2021-08-27 09:53,22
CHC Bilaspur,CHC Bilaspur,Yes (23),8,15,0,0,8,17,0,0,Yes,No,Yes,No,Yes,"8:55 AM 27th Sep,21",2021-09-27 08:55,22
CHC Chhachharuli,CHC Chhachharuli,Yes (30),10,20,0,0,10,20,0,0,Yes,No,Yes,Yes,Yes,"9:41 AM 27th Aug,21",2021-08-27 09:41,22
CHC Naharpur,Naharpur Yamuna Nagar,Yes (10),10,0,0,0,10,0,0,0,Yes,No,No,No,Yes,"9:54 AM 27th Aug,21",2021-08-27 09:54,22
CHC Partap Nagar,CHC Partap Nagar,Yes (16),6,10,0,0,6,10,0,0,Yes,No,Yes,No,Yes,"9:41 AM 27th Aug,21",2021-08-27 09:41,22
CHC Radaur,Radaur Yamuna Nagar,Yes (20),10,10,0,0,10,10,0,0,Yes,No,Yes,Yes,Yes,"9:53 AM 27th Aug,21",2021-08-27 09:53,22
CHC Saraswati Nagar,CHC Saraswati Nagar,Yes (25),14,11,0,0,14,11,0,0,Yes,No,Yes,No,Yes,"9:41 AM 27th Aug,21",2021-08-27 09:41,22
DABRA HOSPITAL Yamunanagar,DABRA HOSPITAL,Yes (23),11,8,4,2,11,8,4,2,No,No,No,No,No,"9:42 AM 27th Aug,21",2021-08-27 09:42,22
ESI Hospital,"ESI Hospital, Jagadhri",Yes (58),36,0,22,0,36,0,22,0,Yes,No,Yes,Yes,Yes,"9:40 AM 27th Aug,21",2021-08-27 09:40,22
Gaba Hospital,Gaba Hospital Yamunanagar,Yes (45),20,10,15,5,20,10,15,5,Yes,No,Yes,Yes,Yes,"9:12 AM 17th Sep,21",2021-09-17 09:12,22
GULATI HOSPITAL,GULATI HOSPITAL,Yes (32),23,3,6,0,25,3,6,0,Yes,No,Yes,Yes,Yes,"9:49 AM 27th Aug,21",2021-08-27 09:49,22
Heart Care Center Hospital,Near Lal Dwara Mandir Yamuna Nagar,Yes (19),2,2,15,7,2,2,15,7,Yes,No,Yes,Yes,Yes,"9:40 AM 27th Aug,21",2021-08-27 09:40,22
JP Hospital Pvt,"Jagadhri Rd, near Luxmi Theater, Vishwakarma Mohalla, Yamuna Nagar,HARAYANA Haryana",Yes (43),15,15,13,2,15,15,13,2,Yes,No,Yes,Yes,Yes,"9:40 AM 27th Aug,21",2021-08-27 09:40,22
KAPOOR HOSPITAL,"SH 6A Indira Colony Jagadhri, yamunanagart ,Haryana",Yes (12),4,0,8,0,4,0,8,0,Yes,No,Yes,Yes,Yes,"9:51 AM 27th Aug,21",2021-08-27 09:51,22
KESHWANI HOSPITAL,"Jagadhri - Yamuna Nagar Rd, Tagore Garden, Yamuna Nagar, Haryana",Yes (10),10,0,0,0,10,0,0,0,Yes,No,Yes,Yes,Yes,"9:54 AM 27th Aug,21",2021-08-27 09:54,22
Maxxwell Hospital,Jagadhari Yamuna Nagar,Yes (17),11,0,6,0,11,0,6,0,Yes,No,Yes,Yes,Yes,"9:49 AM 27th Aug,21",2021-08-27 09:49,22
Mukand Lal District Civil Hospital Yamunanagar,Mukand Lal District Civil Hospital YNR,Yes (24),15,9,0,5,18,9,0,5,Yes,No,Yes,Yes,Yes,"10:16 AM 9th Oct,21",2021-10-09 10:16,22
NIRMAL HOSPITAL,"199, Radaur Rd, near nirmal hospital, camp, Garhi Gujran, Haryana",Yes (20),13,1,6,0,13,1,6,0,Yes,No,Yes,Yes,Yes,"9:40 AM 27th Aug,21",2021-08-27 09:40,22
RK Gupta,opp DAV Sr Sec School Near Madhu Hotel YNR,Yes (17),0,2,15,0,0,2,15,0,Yes,Yes,Yes,Yes,Yes,"9:54 AM 27th Aug,21",2021-08-27 09:54,22
SABBARWAL HOSPITAL,"Gulab Nagar, Jagadhri, Haryana",Yes (12),6,0,6,0,6,0,6,0,Yes,No,Yes,Yes,Yes,"9:53 AM 27th Aug,21",2021-08-27 09:53,22
Sachdeva Hospital,"2227, Civil Lines Rd, Sri Nagar Colony, Civil Lines, Gomti Mohalla, Jagadhri, Haryana",Yes (28),16,8,4,0,16,8,4,0,Yes,No,Yes,Yes,Yes,"9:54 AM 27th Aug,21",2021-08-27 09:54,22
Santosh Hospital,"Santosh Hospital  Kanhaiya Sahib Chowk, near Govt.School, Harbanspura Colony, Gobind Pura, Yamuna Nagar, Haryana",Yes (28),5,9,14,2,5,9,14,2,Yes,No,Yes,Yes,Yes,"9:40 AM 27th Aug,21",2021-08-27 09:40,22
SHARMA HOSPITAL,Near Agarsain Chowk Jagadhri,Yes (12),12,0,0,0,12,0,0,0,Yes,No,Yes,Yes,Yes,"9:53 AM 27th Aug,21",2021-08-27 09:53,22
Shree Medical Care Hospital,"359/2, Jain nagar, Jagadhri, Haryana",Yes (15),15,0,0,0,15,0,0,0,Yes,Yes,Yes,Yes,Yes,"9:56 AM 27th Aug,21",2021-08-27 09:56,22
Shureshtha Hospital,Model Colony YNR,Yes (11),9,0,2,0,9,0,2,0,Yes,No,Yes,Yes,Yes,"9:53 AM 27th Aug,21",2021-08-27 09:53,22
SP Hospital Jag,S.P Hospital Jag,Yes (7),4,0,3,1,4,0,3,1,Yes,No,Yes,Yes,Yes,"9:49 AM 27th Aug,21",2021-08-27 09:49,22
Swami Vivekanand Hospital Yamunanagar,"Swami Vivekanand Hospital,Yamuna Nagar, Haryana",Yes (49),20,10,19,1,20,10,19,1,Yes,No,Yes,Yes,Yes,"9:50 AM 27th Aug,21",2021-08-27 09:50,22
Swastik Hospital,"Basant Nagar, Yamuna Nagar, Haryana",Yes (6),4,2,0,0,4,2,0,0,Yes,No,Yes,Yes,Yes,"9:55 AM 27th Aug,21",2021-08-27 09:55,22
tejli stadium,64 A Tejli,Yes (76),20,56,0,0,20,56,0,0,Yes,No,No,No,Yes,"9:52 AM 27th Aug,21",2021-08-27 09:52,22
VARDAAN HOSPITAL,OPP KOHLI HOSPITAL NEAR AGARSEN COLLEGE JAGADHRI,Yes (10),8,2,0,0,8,2,0,0,Yes,No,Yes,Yes,Yes,"9:54 AM 27th Aug,21",2021-08-27 09:54,22