name,address,Availability_availability_of_beds,Availability_oxygen_beds,Availability_non_oxygen_beds,Availability_i_c_u_beds,Availability_ventilators,Allocated_oxygen_beds,Allocated_non_oxygen_beds,Allocated_i_c_u,Allocated_ventilators,Availability_availability_of_oxygen,Availability_antiviral_remdesivir_etc_,Availability_steroids,Availability_anticoagulant,Availability_antipyretic,updated_on_unparsed,updated_on,city
"AADHAR Hospital, Hisar",Tosham Road Hisar,Yes (44),26,6,12,6,26,6,12,6,Yes,No,No,Yes,Yes,"9:40 AM 9th Mar,22",2022-03-09 09:40,7
Amandeep Hospital,ITI CHOWK TOSHAM ROAD HISAR,Yes (5),3,0,2,5,3,0,2,5,To Be Updated,No,No,Yes,Yes,"12:09 PM 17th Mar,22",2022-03-17 12:09,7
Bharat Multispeciality Hospital,Hisar,Yes (26),16,0,10,2,16,0,10,2,Yes,No,Yes,Yes,Yes,"5:11 PM 3rd Mar,22",2022-03-03 17:11,7
Central Medical Centre (CMC),CMC Hospital Delhi Road Hisar,Yes (62),46,7,9,3,46,7,9,3,Yes,Yes,Yes,Yes,Yes,"6:01 PM 4th Mar,22",2022-03-04 18:01,7
Ch. Devi Lal Sanjeevani Make Shift Covid Hopsital Hisar,Near Jindal School Hisar,Yes (200),200,0,0,0,200,0,0,0,Yes,No,Yes,No,Yes,"5:13 PM 3rd Mar,22",2022-03-03 17:13,7
Churamani Hospital,CAMP CHOWK HISAR,Yes (37),5,2,30,5,5,2,30,5,No,No,No,No,No,"1:50 PM 3rd Mar,22",2022-03-03 13:50,7
District Civil Hospital Hisar,Sirsa Road Hisar,Yes (79),79,0,0,20,80,0,0,20,Yes,Yes,Yes,Yes,Yes,"5:11 PM 3rd Mar,22",2022-03-03 17:11,7
DR. ANANTRAM JANTA HOSPITAL PVT LTD BARWALA,Civil Hospital Road Barwala,Yes (17),17,0,0,3,17,0,0,3,Yes,No,Yes,Yes,Yes,"1:50 PM 3rd Mar,22",2022-03-03 13:50,7
Geetanjali Hospital,Model Town Hisar,Yes (48),40,0,8,4,40,0,8,4,Yes,Yes,Yes,Yes,Yes,"5:11 PM 3rd Mar,22",2022-03-03 17:11,7
Goswami Hospital,"NEAR BUS STAND, RISHI NAGAR",Yes (9),4,5,0,1,4,5,0,1,Yes,To Be Updated,To Be Updated,To Be Updated,To Be Updated,"1:50 PM 3rd Mar,22",2022-03-03 13:50,7
Gupta Hospital Hisar,Sector 14 Hisar,Yes (35),30,0,5,0,30,0,5,0,Yes,Yes,Yes,No,Yes,"9:30 AM 6th Mar,22",2022-03-06 09:30,7
"GURU JAMBHESHWAR MULTISPECIALITY HOSPITAL, AGROHA","ADAMPUR ROAD, AGROHA",Yes (14),9,3,2,1,9,3,2,1,Yes,No,Yes,Yes,Yes,"1:50 PM 3rd Mar,22",2022-03-03 13:50,7
Holy Help Hospital,Tosham Road Hisar,Yes (39),25,6,8,1,25,6,8,1,Yes,No,Yes,Yes,Yes,"5:11 PM 3rd Mar,22",2022-03-03 17:11,7
Janki Children Hospital Hisar,Near Sewak Sabha Hopsital Hisar,Yes (2),0,Beds Over Utilized 1,2,2,0,1,2,2,Yes,No,Yes,Yes,Yes,"5:13 PM 3rd Mar,22",2022-03-03 17:13,7
Mahatma Gandhi Hospital,,Yes (42),19,13,10,8,19,13,10,8,To Be Updated,Yes,Yes,Yes,Yes,"8:29 AM 7th Mar,22",2022-03-07 08:29,7
MALIK HOSPITAL,"145A UTTAM NAGAR, HANSI",Yes (7),7,0,0,3,7,0,0,3,Yes,No,Yes,No,No,"5:13 PM 3rd Mar,22",2022-03-03 17:13,7
MAMC Agroha,"Maharaj Aggarsin Medical College, VPO Agroha",Yes (140),85,15,40,60,85,15,40,60,To Be Updated,To Be Updated,To Be Updated,To Be Updated,To Be Updated,"12:08 PM 28th Mar,22",2022-03-28 12:08,7
Military Hospital Hisar,Cantt Hisar,Yes (70),18,52,0,5,18,52,0,5,Yes,To Be Updated,Yes,Yes,Yes,"6:22 PM 5th Apr,22",2022-04-05 18:22,7
NEKIRAM HOSPITAL,OPP BUS STAND HANSI,Yes (5),2,0,3,3,2,0,3,3,To Be Updated,To Be Updated,To Be Updated,To Be Updated,To Be Updated,"5:13 PM 3rd Mar,22",2022-03-03 17:13,7
OPJindal Institute of Cancer &amp; Research Hospital,Model Town Hisar,Yes (144),100,4,40,44,100,4,41,45,Yes,Yes,Yes,Yes,Yes,"7:07 PM 11th Mar,22",2022-03-11 19:07,7
PARDEEP KANSAL MULTISPECIALITY HOSPITAL FOR CHILDREN,"25- Inderprastha Colony, Hisar",Yes (13),0,6,7,3,0,6,7,3,Yes,No,Yes,Yes,Yes,"1:50 PM 3rd Mar,22",2022-03-03 13:50,7
Parnami Hospital,Hisar,Yes (28),21,5,2,2,21,5,2,2,Yes,Yes,Yes,Yes,Yes,"5:11 PM 3rd Mar,22",2022-03-03 17:11,7
Ravindra Hospital Hisar,Model Town HISAR,Yes (21),19,0,2,1,19,0,2,1,Yes,No,Yes,Yes,Yes,"1:50 PM 3rd Mar,22",2022-03-03 13:50,7
SAANVI HOSPITAL,"CHC ROAD, BARWALA",Yes (9),5,0,4,1,5,0,4,1,Yes,No,Yes,To Be Updated,To Be Updated,"5:13 PM 3rd Mar,22",2022-03-03 17:13,7
Sapra Hospital,Rajgarh Road Hisar,Yes (28),19,3,6,12,19,3,6,12,Yes,Yes,Yes,No,Yes,"9:15 AM 2nd Apr,22",2022-04-02 09:15,7
"Sarvodya Hospital, Hisar",Delhi Road Hisar,Yes (22),13,6,3,3,13,6,3,3,Yes,Yes,Yes,Yes,Yes,"5:11 PM 3rd Mar,22",2022-03-03 17:11,7
Sewak Sabha Hospital,Near Bus Stand Hisar,Yes (27),16,3,8,1,16,3,8,1,Yes,Yes,Yes,Yes,Yes,"9:47 AM 5th Apr,22",2022-04-05 09:47,7
Shanti Devi Hospital,Delhi Road Hisar,Yes (38),26,0,12,2,26,0,12,2,Yes,Yes,Yes,Yes,Yes,"5:11 PM 3rd Mar,22",2022-03-03 17:11,7
Shri Kali Devi Hospital Hansi,Delhi Road Hansi,Yes (13),8,0,5,0,8,0,5,0,To Be Updated,No,To Be Updated,Yes,Yes,"5:11 PM 3rd Mar,22",2022-03-03 17:11,7
SINGLA MULTISPECIALITY HOSPITAL,"RISHI NAGAR, GALI NO. 1, NEAR BUS STAND, HISAR",Yes (19),17,0,2,1,17,0,2,1,Yes,No,Yes,Yes,Yes,"1:50 PM 3rd Mar,22",2022-03-03 13:50,7
SL Minda Hospital,VPO Bagla,Yes (8),6,0,2,2,6,0,2,2,Yes,No,Yes,Yes,Yes,"5:11 PM 3rd Mar,22",2022-03-03 17:11,7
Sonakshi Children Hospital Hansi,"G T Road, Near Kali Devi Mandir, Opp Bhalla Patrol Pump, Hansi",Yes (13),9,0,4,1,9,0,4,1,Yes,No,Yes,Yes,Yes,"1:50 PM 3rd Mar,22",2022-03-03 13:50,7
Sukhda Multispeciality Hospital,Dabra Chowk Hisar,Yes (53),31,16,6,6,31,16,6,6,Yes,Yes,Yes,Yes,Yes,"9:30 AM 13th Mar,22",2022-03-13 09:30,7
Vardaan Hospital Hisar,Hisar,Yes (21),9,1,11,2,9,1,11,2,Yes,No,Yes,Yes,Yes,"5:11 PM 3rd Mar,22",2022-03-03 17:11,7
ANUJ HOSPITAL SAFIDON,safidon panipat road,Yes (30),2,18,10,0,2,18,10,0,Yes,No,Yes,Yes,Yes,"5:13 PM 3rd Mar,22",2022-03-03 17:13,9
Balaji Hospital Jind,Rohtak Road Jind,Yes (48),32,16,0,0,32,16,0,0,Yes,No,Yes,Yes,Yes,"5:10 PM 3rd Mar,22",2022-03-03 17:10,9
CHC Alewa,"Alewa 2 Sub Health Centre, Alewa Chc Alewa, Alewa, Jind",Yes (15),15,0,0,0,15,0,0,0,Yes,No,Yes,No,Yes,"5:11 PM 3rd Mar,22",2022-03-03 17:11,9
CHC Julana,Julana,Yes (26),20,6,0,0,20,6,0,0,Yes,No,Yes,Yes,Yes,"5:10 PM 3rd Mar,22",2022-03-03 17:10,9
District Civil Hospital Jind (NEW+OLD),Hosptial,Yes (170),150,0,20,12,150,0,20,12,Yes,Yes,Yes,Yes,Yes,"5:10 PM 3rd Mar,22",2022-03-03 17:10,9
Gangaputra Ayurvedic Medical College Jind,Kandela,Yes (100),60,15,25,3,60,15,25,3,Yes,No,Yes,Yes,Yes,"5:10 PM 3rd Mar,22",2022-03-03 17:10,9
JIND HEART HOSPITAL,GOHANA BYPASS ROHTAK ROAD JIND,Yes (17),12,0,5,1,12,0,5,1,Yes,No,No,No,No,"5:11 PM 3rd Mar,22",2022-03-03 17:11,9
Malik Hospital,Rohtak Road Jind,Yes (8),4,0,4,3,4,0,4,3,Yes,No,Yes,Yes,Yes,"5:10 PM 3rd Mar,22",2022-03-03 17:10,9
Meenakashi Jain Hospital,Near Bus Stand,Yes (22),15,2,5,1,15,2,5,1,Yes,No,Yes,Yes,Yes,"5:10 PM 3rd Mar,22",2022-03-03 17:10,9
RAJ HOSPITAL ROHTAK RAOD JIND,ROHTAK ROAD JIND,Yes (15),8,5,2,2,8,5,2,2,Yes,No,Yes,Yes,Yes,"5:13 PM 3rd Mar,22",2022-03-03 17:13,9
Sarvodhya Hospital Jind,Jind,Yes (20),20,0,0,2,20,0,0,2,Yes,No,Yes,No,No,"5:10 PM 3rd Mar,22",2022-03-03 17:10,9
SDH Narwana,Narwana,Yes (32),20,12,0,0,20,12,0,0,Yes,No,Yes,Yes,Yes,"5:10 PM 3rd Mar,22",2022-03-03 17:10,9
SDH Safidon,Safidon,Yes (34),20,14,0,0,20,14,0,0,Yes,No,Yes,No,Yes,"5:10 PM 3rd Mar,22",2022-03-03 17:10,9
SDH UCHANA,Uchana,Yes (55),20,35,0,0,20,35,0,0,Yes,No,No,No,Yes,"5:10 PM 3rd Mar,22",2022-03-03 17:10,9
Shri Gyani Ram Mamorial Hospital,Safidon,Yes (25),10,5,10,0,10,5,10,0,Yes,No,Yes,Yes,Yes,"5:10 PM 3rd Mar,22",2022-03-03 17:10,9
Aarti Hospital,"A-628, Near Hanuman Mandir, Dabua Pali Road, NIT Faridabad",Yes (23),5,15,3,0,5,15,3,0,Yes,Yes,Yes,Yes,Yes,"5:12 PM 3rd Mar,22",2022-03-03 17:12,4
Aastha Hospital,"SCF -2, Ashoka Enclave Main Rd, Sector 35, Faridabad",Yes (14),10,4,0,0,10,4,0,0,Yes,No,Yes,Yes,Yes,"5:11 PM 3rd Mar,22",2022-03-03 17:11,4
Al-Falah Hospital,"Al Falah university Campus, Dhouj",Yes (77),50,25,2,2,50,25,2,2,Yes,Yes,Yes,Yes,Yes,"9:40 AM 5th Apr,22",2022-04-05 09:40,4
Anshu Hospital,"Shiv Colony Sehatpur Road, Palla No. 1, Faridabad",Yes (20),10,10,0,0,10,10,0,0,Yes,No,Yes,No,No,"10:51 AM 2nd Apr,22",2022-04-02 10:51,4
Arise Healthcare,"SCO: C 3185, Near Corporation Bank, Green Field Colony, Faridabad",Yes (16),2,7,7,2,2,7,7,2,Yes,Yes,Yes,No,No,"5:12 PM 3rd Mar,22",2022-03-03 17:12,4
Arsh Hospital,"Opp. Era Redwood Residency, Tigaon Rd, Sector 78, Faridabad,",Yes (65),40,5,20,6,40,5,20,6,Yes,No,Yes,Yes,Yes,"11:25 AM 11th Mar,22",2022-03-11 11:25,4
Asian Fidelis Multispeciality Hospital,"RPS Savana, RPS City, Sector-88, Faridabad",Yes (50),40,0,10,2,40,0,10,2,Yes,Yes,Yes,Yes,Yes,"9:42 AM 7th Mar,22",2022-03-07 09:42,4
Asian Hospital,"Badkal Flyover Road, Sector  21 A Faridabad",Yes (129),89,0,40,14,89,0,40,14,Yes,Yes,Yes,Yes,Yes,"9:29 AM 5th Apr,22",2022-04-05 09:29,4
B.K. Hospital Faridabad,B.K. Hospital Faridabad B K Chowk FBD,Yes (100),64,25,11,11,64,25,11,11,Yes,Yes,Yes,Yes,Yes,"9:27 AM 5th Apr,22",2022-04-05 09:27,4
Bhavya Kalyani Hospital,"Mohna Road, Near Aanand Bakery, Ballabgarh, Faridabad",Yes (17),5,9,3,0,5,9,3,0,Yes,No,Yes,Yes,Yes,"3:02 PM 1st Apr,22",2022-04-01 15:02,4
Chugh Hospital,"5L-164, K.C. Road N.I.T. Faridabad",Yes (18),4,14,0,0,4,14,0,0,To Be Updated,No,Yes,Yes,Yes,"5:11 PM 3rd Mar,22",2022-03-03 17:11,4
D.M. Hospital,"89-A, NH-5, Railway Road, Near Police Thana, NIT, Faridabad",Yes (28),10,10,8,1,10,10,8,1,Yes,No,No,Yes,Yes,"5:11 PM 3rd Mar,22",2022-03-03 17:11,4
Doctor Today Multispecialty Hospital,"5-C/2,B.P., Railway Road,, Near Bankey Bihari Mandir,, next to IDBI Bank, Faridabad",Yes (40),35,0,5,2,35,0,5,2,Yes,No,Yes,Yes,Yes,"5:11 PM 3rd Mar,22",2022-03-03 17:11,4
Dr. Harish Hospital,"701, Sector 8, YMCA Road, Faridabad",Yes (7),5,0,2,0,5,0,2,0,Yes,No,Yes,Yes,Yes,"12:59 PM 5th Apr,22",2022-04-05 12:59,4
Durga Multispeciality Hospital,"Shri Bankey Bihari Mandir Complex, Neelam-Railway Road, NIT 5, Faridabad",Yes (30),22,0,8,0,22,0,8,0,No,No,No,No,No,"5:12 PM 3rd Mar,22",2022-03-03 17:12,4
"ESIC Medical College, Faridabad","NH-3, NIT Behind BK Hospital, Haryana",Yes (580),150,350,80,50,150,350,80,50,Yes,Yes,Yes,Yes,Yes,"1:13 PM 27th Mar,22",2022-03-27 13:13,4
Fortis Escort Hospital,"Neelam Bata Rd, opp. Neelam Cinema, AC Nagar, New Industrial Town, Faridabad,",Yes (69),55,0,14,7,55,0,14,7,Yes,Yes,Yes,Yes,Yes,"1:14 PM 19th Mar,22",2022-03-19 13:14,4
Gaurav Hospital,"Rajeev Colony, Samaypur Road, Ballabgarh, Faridabad",Yes (15),3,2,10,1,3,2,10,1,Yes,To Be Updated,Yes,To Be Updated,To Be Updated,"5:12 PM 3rd Mar,22",2022-03-03 17:12,4
Geeta Hospital,"Opposite Huda Market and Community Centre, Sector 28, Faridabad",Yes (18),8,0,10,2,8,0,10,2,Yes,No,Yes,Yes,Yes,"5:12 PM 3rd Mar,22",2022-03-03 17:12,4
Geetanjali Multispeciality Hospital,"D-635, 60 Feet Rd, Chawla Colony, Ballabhgarh, Faridabad",Yes (23),20,3,0,0,20,3,0,0,Yes,To Be Updated,Yes,Yes,To Be Updated,"5:11 PM 3rd Mar,22",2022-03-03 17:11,4
Goyal Hospital,"Plot No. 2 opposite hanuman temple Sec 8, Surdas Park",Yes (18),12,0,6,2,12,0,6,2,Yes,Yes,Yes,Yes,Yes,"10:55 AM 14th Mar,22",2022-03-14 10:55,4
Handa Medical Center,"Site No-1, Sector 16, Opp Sagar Cinema, Faridabad",No (0),0,0,0,0,0,0,0,0,No,No,No,To Be Updated,No,"5:11 PM 3rd Mar,22",2022-03-03 17:11,4
Heritage Hospital,3C-62B/BP NIT Faridabad,Yes (15),11,0,4,1,11,0,4,1,To Be Updated,To Be Updated,To Be Updated,To Be Updated,To Be Updated,"5:12 PM 3rd Mar,22",2022-03-03 17:12,4
IBS Ashwani Hospital,"Plot No 8 D/1, YMCA Rd, Pocket D, Sector 11, Faridabad",Yes (35),22,5,8,2,22,5,8,2,To Be Updated,To Be Updated,To Be Updated,To Be Updated,To Be Updated,"5:11 PM 3rd Mar,22",2022-03-03 17:11,4
Janak Hospital,Indira complex Neharpar Kheri Road Faridabad,Yes (27),15,6,6,0,15,6,6,0,Yes,No,Yes,Yes,Yes,"5:12 PM 3rd Mar,22",2022-03-03 17:12,4
Kant Multispeciality Hospital Pvt Ltd,"Plot no. 167, Indra Complex, Kheri Road, Greater, near Kheri Pul Bridge, Sector 87, Neharpar Faridabad, Faridabad, Haryana 121002",Yes (23),18,0,5,1,18,0,5,1,Yes,No,To Be Updated,To Be Updated,To Be Updated,"8:20 AM 5th Apr,22",2022-04-05 08:20,4
Kedar Hospital,"3B/3, B.P , Near DAV college, NIT., Faridabad,",Yes (49),31,6,12,1,31,6,12,1,Yes,Yes,Yes,Yes,Yes,"10:56 AM 16th Mar,22",2022-03-16 10:56,4
Kedar Hospital Multispeciality,Gali 7 Krishna Colony Sec25 Faridabad,Yes (30),10,15,5,0,10,15,5,0,Yes,No,Yes,Yes,Yes,"5:12 PM 3rd Mar,22",2022-03-03 17:12,4
Krishna Medical Centre,"773, Sector-19, Faridabad",Yes (10),5,0,5,0,5,0,5,0,Yes,Yes,Yes,Yes,Yes,"5:12 PM 3rd Mar,22",2022-03-03 17:12,4
Life Hospital,Opp Hanuman Mandir Sec 8 Faridabad,Yes (10),4,0,6,1,4,0,6,1,Yes,Yes,Yes,Yes,Yes,"5:12 PM 3rd Mar,22",2022-03-03 17:12,4
Lotus Hospital,"Plot-2, Jeevan Nagar, Opp. Lal Kothi, Main Ballabgarh Sohna Road, Faridabad",Yes (20),12,0,8,1,12,0,8,1,Yes,No,Yes,Yes,Yes,"11:39 AM 2nd Apr,22",2022-04-02 11:39,4
Madhav Hospital,"Building no 16, Block E, and, New Industrial Twp 5, Faridabad, Haryana 121001",Yes (28),0,0,28,2,0,0,28,2,To Be Updated,No,To Be Updated,To Be Updated,To Be Updated,"5:11 PM 3rd Mar,22",2022-03-03 17:11,4
Manavta Hospital,"Plot No-494, Near Women ITI, Uncha Gaon Prem Nagar, Mohna Road, Ballabgarh, Faridabad",Yes (31),10,10,11,3,10,10,11,3,To Be Updated,To Be Updated,To Be Updated,To Be Updated,To Be Updated,"5:11 PM 3rd Mar,22",2022-03-03 17:11,4
Manvi Medical Centre,"New Bharat Colony, Opp. Chaddar Godam, Near Mahaban Farm, Kheri Road, Greater Faridabad",Yes (9),7,0,2,0,7,0,2,0,Yes,No,Yes,Yes,Yes,"8:48 AM 5th Apr,22",2022-04-05 08:48,4
Medicheck Hospital,"Block C, Plot Number 76, Shahid Bhagat Singh Marg, near Bata Flyover, New Industrial Town, Faridabad",Yes (64),52,0,12,3,52,0,12,3,Yes,No,Yes,Yes,Yes,"5:10 PM 3rd Mar,22",2022-03-03 17:10,4
Medstar Hospital,"Om Enclave Part 1, Near Toll Tax, Agwanpur Road, Faridabad",Yes (7),5,2,0,0,5,2,0,0,Yes,No,Yes,Yes,To Be Updated,"5:11 PM 3rd Mar,22",2022-03-03 17:11,4
Medwin Hospital,"Plot No. 2, Jeevan Nagar, Sohna Road Gounchi, Sector 55, Faridabad",Yes (20),2,12,6,0,2,12,6,0,To Be Updated,No,Yes,Yes,Yes,"12:02 PM 30th Mar,22",2022-03-30 12:02,4
Metro Hospital Medicare,"Metro Heart Institute with Multispeciality Sector 16 A, Faridabad",Yes (145),80,45,20,11,80,45,20,11,Yes,Yes,Yes,Yes,Yes,"12:11 PM 5th Apr,22",2022-04-05 12:11,4
National Institute Of Medical Sciences,"Sector -23A,?Faridabad,?",Yes (28),15,4,9,2,15,4,9,2,Yes,No,Yes,Yes,Yes,"5:10 PM 3rd Mar,22",2022-03-03 17:10,4
Ortho 1 Hospital,"1331, Near Community Centre, Sector 55, Faridabad",Yes (30),8,12,10,1,8,12,10,1,Yes,No,Yes,Yes,Yes,"7:12 AM 5th Apr,22",2022-04-05 07:12,4
Park Hospital Faridabad,"J Block, Sector 10 HBC, opposite Court, Faridabad",Yes (45),10,10,25,5,10,10,25,5,Yes,No,Yes,Yes,Yes,"8:30 AM 5th Apr,22",2022-04-05 08:30,4
Pawan Hospital Unit-1,"Samaypur Road Near Sector 56, Ballabhgarh, Faridabad",Yes (45),31,0,14,7,31,0,14,7,To Be Updated,To Be Updated,To Be Updated,To Be Updated,To Be Updated,"4:06 PM 5th Apr,22",2022-04-05 16:06,4
Pawan Hospital Unit-2,"Plot No. 10, Jawahar Colony, Near Disposal Chowk, Faridabad",Yes (11),0,0,11,0,0,0,11,0,To Be Updated,To Be Updated,To Be Updated,To Be Updated,To Be Updated,"4:05 PM 5th Apr,22",2022-04-05 16:05,4
Prachi Hospital,Opp Chimni Bai Dharmshala Faridabad,Yes (17),10,2,5,1,10,2,5,1,Yes,No,Yes,Yes,Yes,"5:12 PM 3rd Mar,22",2022-03-03 17:12,4
QRG Central,"Plot No, 69, Mathura Rd, Sector 20 A, New Industrial Town, Faridabad",Yes (10),6,0,4,2,6,0,4,2,Yes,Yes,Yes,Yes,Yes,"10:01 AM 5th Apr,22",2022-04-05 10:01,4
QRG Hospital Medicare,"Ambedkar Marg, QRG Healthcity, Sector 16, Faridabad",Yes (122),104,0,18,7,104,0,18,7,Yes,Yes,Yes,Yes,Yes,"2:47 PM 10th Mar,22",2022-03-10 14:47,4
Raghav Hospital,Kheri Road Sec 87 Greater Faridabad,Yes (23),17,3,3,1,17,3,3,1,Yes,No,Yes,Yes,Yes,"5:12 PM 3rd Mar,22",2022-03-03 17:12,4
Raj Nursing Home,"CLINIC SITE NO-6, Sector 3, Faridabad",Yes (17),13,0,4,1,13,0,4,1,Yes,No,Yes,Yes,Yes,"12:04 PM 7th Mar,22",2022-03-07 12:04,4
Ronak Hospital,"Dabua Pali Road, Near Ganga Ram Devta Mandir, NIT, Faridabad",Yes (50),20,20,10,3,20,20,10,3,Yes,Yes,Yes,Yes,Yes,"5:11 PM 3rd Mar,22",2022-03-03 17:11,4
Samrat Hospital,"180, Sanjay Colony, Delhi Mathura Road, JCB Chowk, Ballabgarh, Faridabad",Yes (20),10,0,10,0,10,0,10,0,To Be Updated,To Be Updated,To Be Updated,To Be Updated,To Be Updated,"11:41 AM 21st Mar,22",2022-03-21 11:41,4
Sanjeevan Multispeciality Hospital,"D-947, 60 Feet Road, Opp. Shiv Mandir, Chawla Colony, Ballabgarh, Faridabad",Yes (17),7,2,8,0,7,2,8,0,No,Yes,Yes,Yes,Yes,"5:11 PM 3rd Mar,22",2022-03-03 17:11,4
Santosh Multispeciality Hospital,"Shop No. 3F, 139, Metro Rd, New Industrial Township 2b, Block F, New Industrial Twp 3, New Industrial Town, Faridabad,",Yes (60),40,10,10,1,40,10,10,1,Yes,No,Yes,Yes,Yes,"11:18 AM 8th Mar,22",2022-03-08 11:18,4
Sarvodya Hospital Sector-8,"Sector-8, YMCA Rd, near Escorts Mujesar Metro Station, Sector 7, Faridabad",Yes (150),125,0,25,5,125,0,25,5,Yes,Yes,No,No,Yes,"10:58 AM 5th Apr,22",2022-04-05 10:58,4
Sarvodya Hospital Sector 19,"Gopi Colony, Old Faridabad, Faridabad",Yes (38),28,0,10,4,28,0,10,4,Yes,Yes,Yes,Yes,To Be Updated,"5:10 PM 3rd Mar,22",2022-03-03 17:10,4
Sattya Hospital,"376, IP Colony, Sector 32-33 Faridabad",Yes (10),6,0,4,2,6,0,4,2,Yes,To Be Updated,To Be Updated,To Be Updated,To Be Updated,"5:12 PM 3rd Mar,22",2022-03-03 17:12,4
Shankar Medicare Center,Sec 28 Faridabad,Yes (35),15,20,0,0,15,20,0,0,Yes,Yes,Yes,Yes,Yes,"12:23 PM 5th Apr,22",2022-04-05 12:23,4
Shanti Devi Memorial Hospital,"Kheri More Near, Piyush Heights, Sector 89, Faridabad",Yes (25),14,8,3,2,14,8,3,2,Yes,No,Yes,Yes,Yes,"12:35 PM 5th Apr,22",2022-04-05 12:35,4
Shivalik Hospital Unit 1,Huda Market Sector-37 Faridabad,Yes (7),0,3,4,0,0,3,4,0,Yes,No,Yes,Yes,Yes,"9:23 AM 5th Apr,22",2022-04-05 09:23,4
Shivalik Hospital Unit 2,"Sehatpur, Opp. Sec-91 Faridabad",Yes (2),0,0,2,0,0,0,2,0,Yes,No,Yes,Yes,Yes,"9:23 AM 5th Apr,22",2022-04-05 09:23,4
"Shri Atal Bihari Vajpayee Government Medical College, Chhainsa","Village  Chhainsa, Faridabad",Yes (100),100,0,0,0,100,0,0,0,Yes,Yes,Yes,No,Yes,"5:13 PM 3rd Mar,22",2022-03-03 17:13,4
Siddhi Vinayak Aspataal,"MCF-8280, Main Sohna Road, Near Syndicate Bank/Lal Kothi, Ballabgarh, Faridabad",Yes (26),10,6,10,1,10,6,10,1,Yes,Yes,To Be Updated,To Be Updated,To Be Updated,"5:11 PM 3rd Mar,22",2022-03-03 17:11,4
SMS Hospital,"Clinic No. 9, Sector-3, Near Huda Market, Faridabad",Yes (10),5,0,5,3,5,0,5,3,Yes,No,Yes,Yes,Yes,"5:11 PM 3rd Mar,22",2022-03-03 17:11,4
SRU Multispeciality Hospital,"Sunder Colony, Nangla Gujran, Behind Rawal International School, Ballabgarh, Faridabad",Yes (17),14,0,3,0,14,0,3,0,To Be Updated,To Be Updated,To Be Updated,To Be Updated,To Be Updated,"5:11 PM 3rd Mar,22",2022-03-03 17:11,4
Sunrise Hospital,"3C-63, BP, NIT Faridabad",Yes (28),25,0,3,0,25,0,3,0,Yes,No,Yes,Yes,Yes,"9:39 AM 27th Mar,22",2022-03-27 09:39,4
Sunshine Hospital,"Sec 64 Sahupura Road, Unchagaon Ballabgarh",Yes (11),8,0,3,0,8,0,3,0,Yes,No,Yes,Yes,Yes,"5:12 PM 3rd Mar,22",2022-03-03 17:12,4
Supreme Hospital,"Suraj Kund Rd, Charmwood Village, Faridabad",Yes (22),20,0,2,1,20,0,2,1,To Be Updated,To Be Updated,To Be Updated,To Be Updated,To Be Updated,"5:10 PM 3rd Mar,22",2022-03-03 17:10,4
Suryodaya Hospital,"Chandiwala Bagh, RPS Road, Sector 88 Greater Faridabad",Yes (11),9,0,2,2,9,0,2,2,To Be Updated,To Be Updated,To Be Updated,To Be Updated,To Be Updated,"5:13 PM 3rd Mar,22",2022-03-03 17:13,4
Urocare Apolo Multi and Super Speciality Hospital,"H.No 78, Behind Girls College, Sector-2, Ballabgarh, Faridabad",Yes (8),0,6,2,0,0,6,2,0,Yes,No,Yes,Yes,Yes,"10:38 AM 5th Apr,22",2022-04-05 10:38,4
V Care Multispeciality Health Center,"Plot No. V7, Near Police Station, BPTP Park Land, Sector-76, Faridabad",Yes (10),7,0,3,2,7,0,3,2,Yes,No,Yes,Yes,Yes,"5:11 PM 3rd Mar,22",2022-03-03 17:11,4
Vardan Hospital,"Opp. Gurudwara, Adarsh Nagar, Main Malerna Road, Ballabgarh, Faridabad",Yes (15),15,0,0,0,15,0,0,0,To Be Updated,To Be Updated,To Be Updated,To Be Updated,To Be Updated,"5:12 PM 3rd Mar,22",2022-03-03 17:12,4
Vedanta Hospital,"B-5,Central Green,Near I.T, BK Chowk, New Industrial Town, Faridabad",Yes (30),10,12,8,1,10,12,8,1,Yes,Yes,Yes,Yes,Yes,"5:11 PM 3rd Mar,22",2022-03-03 17:11,4
Vibal Hospital Pvt. Ltd.,"Sector-21D, Huda Market, Faridabad",Yes (18),10,0,8,1,10,0,8,1,Yes,Yes,Yes,Yes,Yes,"5:11 PM 3rd Mar,22",2022-03-03 17:11,4
Zenith Hospital (P) Ltd.,187/1 Yadav Colony Mohana Road NEar Yadav DairyBallabgarh,Yes (13),10,0,3,3,10,0,3,3,Yes,No,No,No,Yes,"9:17 AM 5th Apr,22",2022-04-05 09:17,4
Civil Hospital Fatehabad,Near Bus Stand Fatehabad,Yes (46),20,0,26,6,20,0,26,6,Yes,Yes,Yes,Yes,Yes,"5:10 PM 3rd Mar,22",2022-03-03 17:10,5
Civil Hospital Ratia,"Dera Surjanhar, Ratia, Fatehabad",Yes (18),5,0,13,3,5,0,13,3,Yes,Yes,Yes,Yes,Yes,"5:12 PM 3rd Mar,22",2022-03-03 17:12,5
"Civil Hospital, Tohana",Opposite New Sabzi Mandi Tohana,Yes (27),10,3,14,2,10,3,14,2,Yes,Yes,Yes,Yes,Yes,"5:10 PM 3rd Mar,22",2022-03-03 17:10,5
Community Health Center Bhattu,"Surya Nagar, Bhattu Mandi near Railway Station",Yes (12),4,2,6,0,4,2,6,0,Yes,Yes,Yes,Yes,Yes,"5:12 PM 3rd Mar,22",2022-03-03 17:12,5
Community Health Center Bhuna,CHC Bhuna,Yes (30),16,14,0,0,16,14,0,0,Yes,No,Yes,Yes,Yes,"5:12 PM 3rd Mar,22",2022-03-03 17:12,5
Community Health Center JAKHAL,Near SBI Bank Jakhal,Yes (12),6,0,6,0,6,0,6,0,Yes,Yes,Yes,Yes,Yes,"5:12 PM 3rd Mar,22",2022-03-03 17:12,5
"Gupta Children Hospital, Ratia","Aggarwal Colony, Ratia",Yes (16),6,8,2,1,6,8,2,1,Yes,Yes,Yes,Yes,Yes,"5:12 PM 3rd Mar,22",2022-03-03 17:12,5
Kaushal Hospital,"Near Harvinder Singh Petrol Pump, Hisar Road, Fatehabad",Yes (18),12,0,6,4,12,0,6,4,Yes,Yes,Yes,Yes,Yes,"5:13 PM 3rd Mar,22",2022-03-03 17:13,5
"Manav Sewa Sangam Hospital, Tohana",Near Truck Union,Yes (15),15,0,0,0,15,0,0,0,Yes,Yes,Yes,Yes,Yes,"5:12 PM 3rd Mar,22",2022-03-03 17:12,5
Miglani Hospital,"Employees Colony, Ratia,",Yes (24),15,2,7,7,15,2,7,7,Yes,Yes,Yes,Yes,Yes,"5:12 PM 3rd Mar,22",2022-03-03 17:12,5
Rajasthan Medical Centre (RMC) Hospital Tohana,Kenchi Chowk Tohana,Yes (15),11,0,4,2,11,0,4,2,Yes,Yes,Yes,Yes,Yes,"5:12 PM 3rd Mar,22",2022-03-03 17:12,5
Sadhbhawdna Hospital Fatehabad,Near Court Complex Hisar Road Fatehabad,Yes (50),15,20,15,5,15,20,15,5,Yes,Yes,Yes,Yes,Yes,"5:10 PM 3rd Mar,22",2022-03-03 17:10,5
Sanjeevani Hospital Fatehabad,"Goshala Road, near Ashirbad Pelace",Yes (10),6,0,4,3,6,0,4,3,Yes,Yes,Yes,Yes,Yes,"5:13 PM 3rd Mar,22",2022-03-03 17:13,5
Sanjeevani Hospital Tohana,"Kenchi Chock, Tohana",Yes (18),0,6,12,2,0,6,12,2,Yes,Yes,Yes,Yes,Yes,"5:12 PM 3rd Mar,22",2022-03-03 17:12,5
"Singla Hospital , fatehabad","Bhattu Road, Batra Colony, Fatehabad",Yes (13),5,8,0,0,5,8,0,0,Yes,Yes,Yes,Yes,Yes,"5:12 PM 3rd Mar,22",2022-03-03 17:12,5
WadhwaMaternity and surgical Hospital Fatehabad,"Near Papiha Park, Fatehabad",Yes (8),1,0,7,1,1,0,7,1,Yes,Yes,Yes,Yes,Yes,"5:10 PM 3rd Mar,22",2022-03-03 17:10,5
DCHC Barara,,Yes (50),50,0,0,0,50,0,0,0,To Be Updated,To Be Updated,To Be Updated,To Be Updated,To Be Updated,"5:13 PM 3rd Mar,22",2022-03-03 17:13,1
DCHC Mullana,,Yes (50),50,0,0,0,50,0,0,0,To Be Updated,To Be Updated,To Be Updated,To Be Updated,To Be Updated,"5:12 PM 3rd Mar,22",2022-03-03 17:12,1
District Civil Hospital,Ambala City,Yes (137),114,0,23,11,116,0,23,11,Yes,Yes,Yes,Yes,Yes,"5:11 PM 3rd Mar,22",2022-03-03 17:11,1
District Civil Hospital Ambala Cantt,Ambala Cantt,Yes (91),78,0,13,7,80,0,13,7,Yes,Yes,Yes,Yes,Yes,"5:11 PM 3rd Mar,22",2022-03-03 17:11,1
Guardian Hospital,AMBALA JAGADHARI ROAD AMBALA CANTT,Yes (23),15,3,5,3,15,3,5,3,Yes,Yes,Yes,Yes,Yes,"1:50 PM 3rd Mar,22",2022-03-03 13:50,1
Ishwar Hospital,,Yes (15),15,0,0,0,16,0,0,0,Yes,Yes,Yes,Yes,Yes,"5:12 PM 3rd Mar,22",2022-03-03 17:12,1
Kuldeep Hospital,,Yes (10),8,0,2,0,8,0,2,0,To Be Updated,To Be Updated,To Be Updated,To Be Updated,To Be Updated,"5:13 PM 3rd Mar,22",2022-03-03 17:13,1
Mehndiratta Hospital,"#106, manali house, near central jail,  ambala city",Yes (30),25,0,5,1,25,0,5,1,Yes,No,Yes,Yes,Yes,"5:11 PM 3rd Mar,22",2022-03-03 17:11,1
Military Hospital,Ambala Cantonment,Yes (160),60,85,15,15,60,85,15,15,To Be Updated,To Be Updated,To Be Updated,To Be Updated,To Be Updated,"5:10 PM 3rd Mar,22",2022-03-03 17:10,1
MM Medical College Pvt,MMIMSR Mullana Ambala,Yes (200),116,70,14,10,116,70,14,10,Yes,Yes,Yes,Yes,Yes,"5:10 PM 3rd Mar,22",2022-03-03 17:10,1
Park Healing Touch Hospital,"Sultanpur Chowk, Nr Dhulkot Barrier, Ambala Chandigarh Expy. Ambala",Yes (47),27,0,20,10,30,0,20,10,Yes,Yes,Yes,Yes,Yes,"5:11 PM 3rd Mar,22",2022-03-03 17:11,1
Philedelphia mission Hospital pvt,"Mission Compound, Ambala City",Yes (100),92,0,8,2,92,0,8,2,Yes,No,Yes,Yes,Yes,"5:10 PM 3rd Mar,22",2022-03-03 17:10,1
Railways Hospital,"Railway Hospital, railway colony,  Ambala Cantt",Yes (35),30,0,5,0,30,0,5,0,Yes,Yes,Yes,Yes,Yes,"8:07 AM 5th Apr,22",2022-04-05 08:07,1
Rotary Hospital Ambala cantt Pvt,"Rambagh road, Opp Dusshera ground, Ambala Cantt",Yes (20),15,0,5,2,15,0,5,2,Yes,No,Yes,Yes,Yes,"5:10 PM 3rd Mar,22",2022-03-03 17:10,1
Sant Hospital,,Yes (13),10,0,3,1,10,0,3,1,To Be Updated,To Be Updated,To Be Updated,To Be Updated,To Be Updated,"5:11 PM 3rd Mar,22",2022-03-03 17:11,1
SDH Naraingarh,,Yes (50),50,0,0,0,50,0,0,0,To Be Updated,To Be Updated,To Be Updated,To Be Updated,To Be Updated,"5:11 PM 3rd Mar,22",2022-03-03 17:11,1
Yafe Indoor Hospital,,Yes (14),9,5,0,0,9,6,0,0,To Be Updated,To Be Updated,To Be Updated,To Be Updated,To Be Updated,"5:13 PM 3rd Mar,22",2022-03-03 17:13,1
Advanta Super Speciality Hospital,Near Power House,Yes (20),14,1,5,4,14,1,5,4,Yes,No,Yes,Yes,Yes,"1:50 PM 3rd Mar,22",2022-03-03 13:50,19
ARS Holy Heart Advanced Cardiac care &amp; Research Centre,"330, Vinay Nagar Rohtak, Near Delhi Bypass Rohtak",Yes (20),0,0,20,2,0,0,20,2,Yes,No,No,No,No,"1:50 PM 3rd Mar,22",2022-03-03 13:50,19
CHC Chiri,"VOP Chiri, Meham Gohana Road, Distt. Rohtak Haryana",Yes (10),10,0,0,0,10,0,0,0,Yes,Yes,Yes,Yes,Yes,"1:50 PM 3rd Mar,22",2022-03-03 13:50,19
CHC Kahanaur,"Near Sarva haryana Gramin Bank, Opp. Banquet hall, Nigana Road, Kahanaur",Yes (10),4,6,0,0,4,6,0,0,Yes,No,Yes,No,Yes,"1:50 PM 3rd Mar,22",2022-03-03 13:50,19
CHC kalanaur,"Police Station, Bhiwani-Rohtak Road , Near Kalanaur kalan, Kalanaur,",Yes (10),10,0,0,0,10,0,0,0,Yes,No,Yes,No,Yes,"1:50 PM 3rd Mar,22",2022-03-03 13:50,19
CHC Kiloi,"VPO Kiloi, Water Works, Distt. Rohtak",Yes (10),5,5,0,0,5,5,0,0,Yes,No,Yes,No,Yes,"1:50 PM 3rd Mar,22",2022-03-03 13:50,19
