name,address,Availability_availability_of_beds,Availability_oxygen_beds,Availability_non_oxygen_beds,Availability_i_c_u_beds,Availability_ventilators,Allocated_oxygen_beds,Allocated_non_oxygen_beds,Allocated_i_c_u,Allocated_ventilators,Availability_availability_of_oxygen,Availability_antiviral_remdesivir_etc_,Availability_steroids,Availability_anticoagulant,Availability_antipyretic,updated_on_unparsed,updated_on,city
"Ayurvedic Medical College, Patikra",HUDA Sec. 1 Narnaul,Yes (192),35,157,0,0,40,160,0,0,Yes,Yes,Yes,Yes,Yes,"5:13 PM 7th Jun,22",2022-06-07 17:13,13
CHC ATELI,CHC ATELI,Yes (20),15,5,0,0,15,5,0,0,Yes,Yes,Yes,Yes,Yes,"2:04 PM 15th Jun,22",2022-06-15 14:04,13
CHC Kanina,Kanina,Yes (27),15,12,0,0,15,12,0,0,To Be Updated,To Be Updated,To Be Updated,To Be Updated,To Be Updated,"3:34 PM 15th Jun,22",2022-06-15 15:34,13
CHC Nangal Chaudhary,chc nangal choudhary,Yes (5),Beds Over Utilized 5,5,0,0,5,5,0,0,No,No,Yes,No,Yes,"2:09 PM 15th Jun,22",2022-06-15 14:09,13
CHC Sehlang,CHC SEHLANG,Yes (9),5,4,0,0,5,4,0,0,Yes,Yes,Yes,Yes,Yes,"9:52 AM 21st Jun,22",2022-06-21 09:52,13
Civil Hospital Narnaul,"Housing Board, Narnaul",Yes (80),80,0,0,10,80,0,0,10,Yes,Yes,Yes,Yes,Yes,"10:56 AM 20th Jun,22",2022-06-20 10:56,13
Jaipur Heart &amp; Multi Speciality Hospital,"Opp. Sadar Thana, Narnaul",Yes (13),6,3,4,2,6,3,4,2,Yes,Yes,Yes,Yes,Yes,"5:14 PM 7th Jun,22",2022-06-07 17:14,13
LAXMI NARAYANAN,"Laxmi Narayanan Hospital , Narnaul Road Mahendergarh",Yes (10),6,0,4,1,6,0,4,1,Yes,Yes,Yes,Yes,Yes,"5:15 PM 7th Jun,22",2022-06-07 17:15,13
Nihal Hospital Kanina,Kanina Main Bus Stand,Yes (13),12,0,1,1,13,0,1,1,Yes,Yes,Yes,Yes,Yes,"5:15 PM 7th Jun,22",2022-06-07 17:15,13
Rainbow Multispecialty hospital and trauma Centre,"Singhana road, Narnaul",Yes (13),4,3,6,2,4,3,6,2,Yes,No,Yes,Yes,Yes,"5:14 PM 7th Jun,22",2022-06-07 17:14,13
Sammat Memorial Hospital,"Sastri colony, near bus stand, mahendergarh",Yes (13),10,0,3,2,10,0,3,2,Yes,No,Yes,Yes,Yes,"5:15 PM 7th Jun,22",2022-06-07 17:15,13
Sanwedna Hospital Narnaul,"HUDA Sector 1, Narnaul",Yes (26),17,0,9,1,25,0,9,1,Yes,Yes,Yes,Yes,Yes,"5:13 PM 7th Jun,22",2022-06-07 17:13,13
SDH Mahendergarh,SDH Mahendergarh,Yes (20),20,0,0,5,20,0,0,5,Yes,Yes,Yes,Yes,Yes,"2:31 PM 15th Jun,22",2022-06-15 14:31,13
Shanti Hospital Narnaul,Shanti Hospital Narnaul,Yes (22),9,7,6,2,9,7,7,2,Yes,Yes,Yes,Yes,Yes,"5:13 PM 7th Jun,22",2022-06-07 17:13,13
Sheela Multi Superspeciality Hospital,Behind Bus Stand Mahindergarh,Yes (9),6,0,3,1,6,0,3,1,Yes,No,Yes,Yes,Yes,"5:15 PM 7th Jun,22",2022-06-07 17:15,13
Shri Arvind Heart and Multispecialty Hospital,"Rao Tula Ram Chowk, Dadri Road Mahendergarh",Yes (17),9,5,3,3,9,5,3,3,Yes,Yes,Yes,Yes,Yes,"5:14 PM 7th Jun,22",2022-06-07 17:14,13
Tanwar Health Care MGarh,,Yes (9),5,0,4,1,5,0,4,1,Yes,No,Yes,Yes,Yes,"5:15 PM 7th Jun,22",2022-06-07 17:15,13
Vijay Hospital Narnaul,"HUDA Sector 1, Narnaul",Yes (22),8,0,14,2,8,0,15,2,Yes,Yes,Yes,Yes,Yes,"5:13 PM 7th Jun,22",2022-06-07 17:13,13
"AAROGYAM HOSPITAL, Kurukshetra","NEAR OLD BUS STAND, THANESAR, KURUSKHETRA",Yes (47),12,0,35,15,12,0,35,15,Yes,Yes,Yes,Yes,Yes,"2:46 PM 26th Apr,23",2023-04-26 14:46,12
"ADESH MEDICAL COLLEGE, SHAHBAD MOHRI KURUKSHETRA.","VILL. MOHRI, SHAHBAD, KURUSHETRA",Yes (100),30,70,0,10,30,70,0,10,Yes,Yes,Yes,Yes,Yes,"2:51 PM 26th Apr,23",2023-04-26 14:51,12
AGGARWAL NURSING HOME,"SALARPUR ROAD, THANESAR, KURUKSHETRA.",Yes (21),11,7,3,4,11,7,3,4,Yes,Yes,Yes,Yes,Yes,"2:46 PM 26th Apr,23",2023-04-26 14:46,12
B.S. HEART CARE,"OPP. NEW BUS STAND, KURUKSHETRA.",Yes (45),45,0,0,10,45,0,0,10,Yes,Yes,Yes,Yes,Yes,"2:39 PM 26th Apr,23",2023-04-26 14:39,12
"CYGNUS HOSPITAL, Kurukshetra","NEAR OLD BUS STAND, THANESAR, KURUSKHETRA",Yes (10),8,0,2,4,8,0,2,4,Yes,Yes,Yes,Yes,Yes,"2:47 PM 26th Apr,23",2023-04-26 14:47,12
KURUKSHETRA NURSING HOME,,Yes (18),14,0,4,2,14,0,4,2,Yes,Yes,Yes,Yes,Yes,"2:49 PM 26th Apr,23",2023-04-26 14:49,12
LNJP CIVIL HOSPITAL.,LNJP HOSPITAL KURUKSHETRA.,Yes (42),37,5,0,15,37,5,0,15,Yes,Yes,Yes,Yes,Yes,"2:46 PM 26th Apr,23",2023-04-26 14:46,12
MIRI PIRI SHAHBAD,"SHAHBAD, KURUKSHETRA",Yes (14),10,0,4,4,10,0,4,4,Yes,Yes,Yes,Yes,Yes,"2:48 PM 26th Apr,23",2023-04-26 14:48,12
Nirogi Hospital,Shahabad Kurukshetra,Yes (22),10,10,2,2,10,10,2,2,Yes,Yes,Yes,Yes,Yes,"2:50 PM 26th Apr,23",2023-04-26 14:50,12
"Saraswati Mission Hospital, Kurukshetra","Theme Park Road, Kurukshetra",Yes (46),35,0,11,6,35,0,11,6,Yes,Yes,Yes,Yes,Yes,"2:53 PM 26th Apr,23",2023-04-26 14:53,12
"Saraswati Mission Hospital, Pehowa","Ambala Road Dist. Kurukshetra, Pehowa, Haryana 136128",Yes (46),35,0,11,6,35,0,11,6,Yes,No,Yes,Yes,Yes,"2:39 PM 26th Apr,23",2023-04-26 14:39,12
"SIDHARTH HOSPITAL, SHAHBAD","SHAHBAD, KURUKSHETRA",Yes (12),8,0,4,2,8,0,4,2,Yes,Yes,Yes,Yes,Yes,"2:49 PM 26th Apr,23",2023-04-26 14:49,12
VERMA HOSPITAL,LADWA,Yes (15),9,3,3,1,9,3,3,1,Yes,Yes,Yes,Yes,Yes,"2:48 PM 26th Apr,23",2023-04-26 14:48,12
Aashirwad Hospital,101 Devi Murti Colony Panipat,Yes (9),2,0,7,1,2,0,7,1,Yes,No,Yes,Yes,Yes,"9:59 AM 4th Aug,22",2022-08-04 09:59,17
Aayushmaan Bhav Hospital,"GT Road Sewah, Near Police Line Panipat",Yes (15),5,4,6,2,5,4,6,2,Yes,No,Yes,Yes,Yes,"9:57 AM 4th Aug,22",2022-08-04 09:57,17
APEX HOSPITAL &amp; TRAUMA CENTRE,SANOLI ROAD BABAIL NAKA,Yes (35),9,0,26,2,9,0,26,2,Yes,No,Yes,Yes,Yes,"9:58 AM 4th Aug,22",2022-08-04 09:58,17
CHC Dadlana,"VPO Dadlana, Panipat",Yes (8),0,8,0,0,0,8,0,0,No,No,No,No,Yes,"9:57 AM 4th Aug,22",2022-08-04 09:57,17
CHC Khotpura,VPO Khotpura Panipat,Yes (9),0,9,0,0,0,9,0,0,No,No,No,No,No,"9:58 AM 4th Aug,22",2022-08-04 09:58,17
Chhabra Hospital,A-1 Narain Singh Park,Yes (11),6,0,5,1,6,0,5,1,Yes,No,Yes,Yes,Yes,"10:00 AM 4th Aug,22",2022-08-04 10:00,17
Civil Hospital panipat,Civil Hospital GT Road Panipat,Yes (104),74,20,10,4,74,20,10,4,Yes,Yes,Yes,Yes,Yes,"9:57 AM 4th Aug,22",2022-08-04 09:57,17
Cygnus Hospital panipat,Cygnus Hospital Near Devi Mndir Panipat,Yes (17),12,0,5,4,12,0,5,4,Yes,No,Yes,Yes,Yes,"9:57 AM 4th Aug,22",2022-08-04 09:57,17
GALAXY HOSPITAL,ASSAND ROAD PANIPAT,Yes (15),7,0,8,2,7,0,8,2,Yes,No,Yes,Yes,Yes,"9:58 AM 4th Aug,22",2022-08-04 09:58,17
Hyderabadi General Hospital &amp; Nursing Home,"Sanoli Road, Near Sanjay, Chowk, Panipat",Yes (10),0,0,10,2,0,0,10,2,Yes,No,Yes,Yes,Yes,"9:59 AM 4th Aug,22",2022-08-04 09:59,17
IBM HOSPITAL &amp; TRAUMA CENTRE,NEAR BHIM GODA MANDIR SANOLI ROAD,Yes (24),12,0,12,2,12,0,12,2,Yes,No,Yes,Yes,Yes,"9:58 AM 4th Aug,22",2022-08-04 09:58,17
LHDM &amp; Prem Hospital,Prem Hospital Opp. Bus Stand Panipat,Yes (80),71,0,9,6,71,0,9,6,Yes,Yes,Yes,Yes,Yes,"9:57 AM 4th Aug,22",2022-08-04 09:57,17
MAX PLUS HOSPITAL,NEAR MALIK PETROL PUMP SANOLI ROAD,Yes (15),8,0,7,3,8,0,7,3,Yes,No,Yes,Yes,Yes,"9:58 AM 4th Aug,22",2022-08-04 09:58,17
NC Medical College,NC Medical Colllage Israna,Yes (530),42,483,5,4,42,483,5,4,Yes,No,Yes,Yes,Yes,"9:57 AM 4th Aug,22",2022-08-04 09:57,17
Park Hospital GT road panipat,"GT Road Sewah, Paniapt",Yes (82),52,14,16,2,52,14,16,2,Yes,No,Yes,Yes,Yes,"9:57 AM 4th Aug,22",2022-08-04 09:57,17
Prime Hospital Health Leaders,"Opp. Gangapuri Road, Sanoli Road Panipat",Yes (20),14,2,4,4,14,2,4,4,Yes,No,Yes,Yes,Yes,"9:59 AM 4th Aug,22",2022-08-04 09:59,17
Rainbow Hospital,152-R Model Town Panipat,Yes (9),6,0,3,1,6,0,3,1,Yes,No,Yes,Yes,Yes,"9:59 AM 4th Aug,22",2022-08-04 09:59,17
SDH Samalkha,G.T Road Samalkha,Yes (50),30,20,0,0,30,20,0,0,Yes,No,Yes,No,Yes,"9:57 AM 4th Aug,22",2022-08-04 09:57,17
shobhit Hospital,"adjacent canara bank, tahsil camp",Yes (19),12,2,5,1,12,2,5,1,Yes,No,Yes,Yes,Yes,"9:58 AM 4th Aug,22",2022-08-04 09:58,17
Shree Badri Das Hospital and ICU Care Centre,Assandh Road Panipat,Yes (11),8,0,3,1,8,0,3,1,Yes,No,Yes,Yes,Yes,"9:59 AM 4th Aug,22",2022-08-04 09:59,17
Shree Balajee Multispeciality Hospital,Aggarsan Colony Assandh Road Panipat,Yes (10),4,0,6,2,4,0,6,2,Yes,Yes,Yes,Yes,Yes,"9:59 AM 4th Aug,22",2022-08-04 09:59,17
Shubham Hospital,"202 New Sukhdev Nagar, Panipat",Yes (9),6,0,3,3,6,0,3,3,Yes,No,Yes,Yes,Yes,"10:00 AM 4th Aug,22",2022-08-04 10:00,17
Adiyogi Arogya Avenue,"232, Subhash Nagar, Near civil hospital back gate, Jhajjar",Yes (15),7,2,6,1,7,2,6,1,To Be Updated,To Be Updated,Yes,Yes,Yes,"5:15 PM 7th Jun,22",2022-06-07 17:15,8
"Advanta Hospital, Jhajjar city","Silani Gate, Jhajjar, Haryana",Yes (50),24,10,16,1,24,10,16,1,Yes,To Be Updated,Yes,To Be Updated,Yes,"1:50 PM 3rd Mar,22",2022-03-03 13:50,8
"Brahm Shakti Sanjivani Hospital, B.garh","Opp. BSNL Exchange, Delhi - Rohtak Road, NH9, Bahadurgarh, Haryana",Yes (100),60,20,20,3,60,20,20,3,Yes,No,Yes,Yes,Yes,"5:12 PM 7th Jun,22",2022-06-07 17:12,8
Civil Hospital Jhajjar,"Jhajjar, NH-71, Jhajjar Rohtak Road, Jhajjar, Jhajjar, Haryana",Yes (38),33,0,5,5,33,0,5,5,Yes,To Be Updated,To Be Updated,To Be Updated,To Be Updated,"5:14 PM 7th Jun,22",2022-06-07 17:14,8
"Delhi Hospital, Bahadurgarh","Rohtak Rd, near Shyamji Complex, Ram Nagar, Bahadurgarh, Haryana",Yes (50),20,20,10,2,20,20,10,2,Yes,No,Yes,Yes,Yes,"5:12 PM 7th Jun,22",2022-06-07 17:12,8
Dr. Sanjay Multi Speciality Hospital,INFRONT OF CIVIL HOSPITAL BAHADURGARH,Yes (61),45,10,6,1,45,10,6,1,Yes,No,No,To Be Updated,To Be Updated,"1:50 PM 3rd Mar,22",2022-03-03 13:50,8
"Jeewan Jyoti Hospital, Bahadurgarh","Rohtak Rd, MIE Part-B, Bahadurgarh, Haryana",Yes (143),70,68,5,4,70,68,5,4,Yes,To Be Updated,To Be Updated,To Be Updated,To Be Updated,"6:34 PM 15th Jun,22",2022-06-15 18:34,8
"JK Hospital, Bahadurgarh","Bahadurgarh,, Bahamnoli, Bahadurgarh, Haryana",No (0),0,0,0,0,0,0,0,0,To Be Updated,To Be Updated,To Be Updated,To Be Updated,To Be Updated,"11:42 AM 15th Jun,22",2022-06-15 11:42,8
"Medicare Super Speciality Hospiatl &amp; Trauma Centre, Jhajjar City","Dadri road Jhajjar, Jhajjar, Haryana",Yes (50),15,23,12,3,15,23,12,3,Yes,To Be Updated,Yes,To Be Updated,Yes,"1:50 PM 3rd Mar,22",2022-03-03 13:50,8
"Mission Hospital, Bahadurgarh","Near main Bus Stand & City Metro Station, Rohtak Rd, Bahadurgarh, Jhajjar ,Haryana",Yes (33),25,0,8,4,25,0,8,4,To Be Updated,No,Yes,Yes,No,"1:50 PM 3rd Mar,22",2022-03-03 13:50,8
"Oscar Hospital, JJR city","Civil Road,Opp Civil Hospital, Jhajjar, Haryana",Yes (80),8,58,14,1,8,58,14,1,To Be Updated,To Be Updated,To Be Updated,To Be Updated,To Be Updated,"1:50 PM 3rd Mar,22",2022-03-03 13:50,8
Oxymus Hospital,"Opposite Civil Hospital, Near Metro Pollar No. 876 Delhi Rohtak Road, Bahadurgarh",Yes (10),4,0,6,0,4,0,6,0,Yes,No,No,No,No,"5:15 PM 7th Jun,22",2022-06-07 17:15,8
"Rana Hospital, Bahadurgarh","OPP. REST HOUSE,OLD BARAHI ROAD, BAHADURGARH",Yes (25),18,0,7,2,18,0,7,2,To Be Updated,To Be Updated,No,No,Yes,"5:15 PM 7th Jun,22",2022-06-07 17:15,8
"RJ Super Speciality Hospital, B.garh","Delhi - Rohtak Rd, Near Rajesh Joon Office, Dalbir Nagar, Bahadurgarh, Haryana",Yes (17),10,5,2,1,10,5,2,1,Yes,No,Yes,Yes,Yes,"5:12 PM 7th Jun,22",2022-06-07 17:12,8
RS GAUR GLOBAL MULTISPECIALITY HOSPITAL,"Jhajjar Road Netaji Subhash Vihar, Haryana",Yes (33),19,7,7,2,19,7,7,2,Yes,No,Yes,Yes,Yes,"1:50 PM 3rd Mar,22",2022-03-03 13:50,8
"SDH, Bahadurgarh","Madhya Marg, Old Industrial Area, Bahadurgarh, Haryana",Yes (35),27,0,8,8,27,0,8,8,Yes,Yes,Yes,No,Yes,"1:50 PM 3rd Mar,22",2022-03-03 13:50,8
"Shivam Hospital, B.garh","Line Par, Shastri Nagar, Netaji Nagar, Bahadurgarh, Haryana",Yes (51),30,15,6,1,30,15,6,1,Yes,No,Yes,Yes,Yes,"5:12 PM 7th Jun,22",2022-06-07 17:12,8
"Swastik Hospital, Bahadurgarh","Jhajjar Rd, Shakti Nagar, Sakti Nagar, Bahadurgarh, Haryana",Yes (40),26,4,10,2,26,4,10,2,Yes,No,Yes,Yes,Yes,"1:50 PM 3rd Mar,22",2022-03-03 13:50,8
World College Of Medical Sciences And Hospital,"Jhajjar Sampla Road, Gurwar, Jhajjar, Haryana",Yes (250),90,135,25,4,90,135,25,4,Yes,Yes,Yes,Yes,Yes,"5:12 PM 7th Jun,22",2022-06-07 17:12,8
Civil Hospital Fatehabad,Near Bus Stand Fatehabad,Yes (60),50,0,10,10,50,0,10,10,Yes,Yes,Yes,Yes,Yes,"1:35 PM 19th Apr,23",2023-04-19 13:35,5
Civil Hospital Ratia,"Dera Surjanhar, Ratia, Fatehabad",Yes (51),20,26,5,5,20,26,5,5,Yes,Yes,Yes,Yes,Yes,"1:39 PM 19th Apr,23",2023-04-19 13:39,5
"Civil Hospital, Tohana",Opposite New Sabzi Mandi Tohana,Yes (36),30,0,6,6,30,0,6,6,Yes,Yes,Yes,Yes,Yes,"1:38 PM 19th Apr,23",2023-04-19 13:38,5
Community Health Center Bhattu,"Surya Nagar, Bhattu Mandi near Railway Station",Yes (12),10,2,0,0,10,2,0,0,Yes,Yes,Yes,Yes,Yes,"1:44 PM 19th Apr,23",2023-04-19 13:44,5
Community Health Center Bhuna,CHC Bhuna,Yes (27),12,15,0,0,12,15,0,0,Yes,No,Yes,Yes,Yes,"1:39 PM 19th Apr,23",2023-04-19 13:39,5
Community Health Center JAKHAL,Near SBI Bank Jakhal,Yes (12),12,0,0,0,12,0,0,0,Yes,Yes,Yes,Yes,Yes,"1:44 PM 19th Apr,23",2023-04-19 13:44,5
"Gupta Children Hospital, Ratia","Aggarwal Colony, Ratia",Yes (16),6,8,2,1,6,8,2,1,Yes,Yes,Yes,Yes,Yes,"1:07 PM 3rd Aug,22",2022-08-03 13:07,5
"Manav Sewa Sangam Hospital, Tohana",Near Truck Union,Yes (30),20,10,0,0,20,10,0,0,Yes,Yes,Yes,Yes,Yes,"1:18 PM 3rd Aug,22",2022-08-03 13:18,5
Miglani Hospital,"Employees Colony, Ratia,",Yes (20),15,3,2,2,15,3,2,2,Yes,Yes,Yes,Yes,Yes,"3:26 PM 2nd Aug,22",2022-08-02 15:26,5
Rajasthan Medical Centre (RMC) Hospital Tohana,Kenchi Chowk Tohana,Yes (15),11,0,4,2,11,0,4,2,Yes,Yes,Yes,Yes,Yes,"3:48 PM 2nd Aug,22",2022-08-02 15:48,5
Sadhbhawdna Hospital Fatehabad,Near Court Complex Hisar Road Fatehabad,Yes (50),25,10,15,5,25,10,15,5,Yes,Yes,Yes,Yes,Yes,"11:47 AM 6th Apr,23",2023-04-06 11:47,5
Sanjeevani Hospital Fatehabad,"Goshala Road, near Ashirbad Pelace",Yes (10),6,0,4,3,6,0,4,3,Yes,Yes,Yes,Yes,Yes,"3:44 PM 18th Aug,22",2022-08-18 15:44,5
Sanjeevani Hospital Tohana,"Kenchi Chock, Tohana",Yes (18),0,6,12,2,0,6,12,2,Yes,No,Yes,Yes,Yes,"1:18 PM 3rd Aug,22",2022-08-03 13:18,5
"Singla Hospital , fatehabad","Bhattu Road, Batra Colony, Fatehabad",Yes (13),5,8,0,0,5,8,0,0,Yes,Yes,Yes,Yes,Yes,"3:39 PM 2nd Aug,22",2022-08-02 15:39,5
WadhwaMaternity and surgical Hospital Fatehabad,"Near Papiha Park, Fatehabad",Yes (8),1,0,7,1,1,0,7,1,Yes,Yes,Yes,Yes,Yes,"11:48 AM 6th Apr,23",2023-04-06 11:48,5
"Aditya Neuro &amp; Spine Hospital, Rewari","Circular Rd, near Kanod gate, Raam Bagh Mahalla, Rewari, Haryana",Yes (10),8,0,2,2,8,0,2,2,Yes,No,Yes,Yes,Yes,"10:30 AM 15th Jun,22",2022-06-15 10:30,18
Advance Hospital,"Bawal Road, Model Town",Yes (8),5,0,3,0,5,0,6,1,Yes,No,Yes,Yes,Yes,"10:27 AM 15th Jun,22",2022-06-15 10:27,18
"Apex Hospital, Dharuhera","Plot No.5, Sector 6, Dharuhera, Haryana 123106",Yes (10),6,0,4,1,6,0,4,1,Yes,No,Yes,Yes,Yes,"10:31 AM 15th Jun,22",2022-06-15 10:31,18
Apollo Rewari/Family Health Edge Hospital,"Garhi Bolni Rd, near Public Health Office, krishna Nagar, Rewari, Haryana",Yes (27),17,3,7,0,17,3,7,0,Yes,No,Yes,Yes,Yes,"10:22 AM 15th Jun,22",2022-06-15 10:22,18
Capt. Nand Lal Hospital,"Circular Road near Government Girls Senior Secondary School naiwali, chowk, Rewari",Yes (20),6,10,4,1,11,10,8,1,Yes,No,Yes,Yes,Yes,"10:25 AM 15th Jun,22",2022-06-15 10:25,18
Civil Hospital rewari,"Kayasthwara Mohalla, Rewari, Haryana",Yes (89),59,16,14,4,59,16,14,4,Yes,Yes,Yes,Yes,Yes,"10:39 AM 15th Jun,22",2022-06-15 10:39,18
Cygnus Hospital Rewari,"Opposite Civil Hospital Mohola, Sanghi Ka Bass, Rewari, Haryana",Yes (32),21,7,4,1,26,7,9,2,Yes,No,Yes,No,Yes,"10:21 AM 15th Jun,22",2022-06-15 10:21,18
Devjyoti Hospital,"Ambedkar chowk, near Bus Stand, Rewari, Haryana",Yes (15),7,2,6,Beds Over Utilized 1,7,2,6,0,Yes,No,Yes,Yes,Yes,"10:37 AM 15th Jun,22",2022-06-15 10:37,18
Dr. K.K. NAGAR HOSPITAL,"317, Near Shishu Shala School, Model Town, Rewari, Haryana",Yes (12),2,0,10,0,2,0,10,0,Yes,No,Yes,Yes,Yes,"10:19 AM 15th Jun,22",2022-06-15 10:19,18
Dr. Vijay Pal Yadav Hospital,"Near Ambedker chowk, Rewari",Yes (7),2,2,3,0,3,3,4,0,Yes,No,Yes,Yes,Yes,"10:26 AM 15th Jun,22",2022-06-15 10:26,18
Kamla Nursing Home/Kalawati Hospital,"201, Model Town, Rewari, Near Bus Stand, Opposite Bal Bhawan, Shivam Chowk",Yes (23),14,0,9,6,14,0,9,6,Yes,No,Yes,Yes,Yes,"10:40 AM 15th Jun,22",2022-06-15 10:40,18
Katyal Hospital,"Katyal Hospital, KANOD GATE, CIRCULAR ROAD, Rewari, Haryana, India",Yes (21),9,6,6,0,12,6,10,1,Yes,No,Yes,Yes,Yes,"10:18 AM 15th Jun,22",2022-06-15 10:18,18
Maars Hospital,"Garhi Bolni Rd, near PWD Office, Sector 19, Rewari, Haryana",Yes (15),15,0,0,0,15,0,0,0,Yes,No,Yes,Yes,No,"10:24 AM 15th Jun,22",2022-06-15 10:24,18
"Manasavi Hospital, Rewari",,Yes (10),10,0,0,0,10,0,0,0,Yes,No,Yes,No,Yes,"10:31 AM 15th Jun,22",2022-06-15 10:31,18
Matrika Hospital,"Matrika Hospital, Ranbir Singh Huda Chowk, Bawal-Rewari Rd, Rewari, Haryana",Yes (45),30,0,15,3,30,0,15,3,To Be Updated,To Be Updated,To Be Updated,To Be Updated,To Be Updated,"11:46 AM 18th Jun,22",2022-06-18 11:46,18
Mediom Hospital/Medcare Hospital,"Sohna Rd, near Municipal Corporation, Dharuhera, Haryana",Yes (4),3,Beds Over Utilized 1,1,0,8,0,4,1,Yes,No,Yes,Yes,Yes,"10:19 AM 15th Jun,22",2022-06-15 10:19,18
Om Hospital,"Om Hospital, Nandrampur Bass Rd, Dharuhera, Haryana",Yes (24),12,4,8,0,12,4,8,0,Yes,No,Yes,Yes,Yes,"10:20 AM 15th Jun,22",2022-06-15 10:20,18
Pushpanjli Hospital Rewari,"Rajesh Pilot Chowk, Rewari, Haryana",Yes (80),60,10,10,4,60,10,10,4,No,No,Yes,Yes,Yes,"10:32 AM 15th Jun,22",2022-06-15 10:32,18
R. B. Yadav Hospital,"Dr. R B Yadav Hospital, Circular Rd Jainpuri, Kayasthwara Mohalla, Rewari, Haryana",Yes (22),8,6,8,2,8,6,8,2,Yes,No,Yes,Yes,Yes,"10:18 AM 15th Jun,22",2022-06-15 10:18,18
Samrat Hospital,Near Azad Chowk Rewari,Yes (9),5,0,4,3,5,0,10,3,Yes,No,Yes,Yes,Yes,"10:26 AM 15th Jun,22",2022-06-15 10:26,18
SDH Kosli,"Kosli, Rewari, Haryana",Yes (45),20,20,5,0,20,20,5,0,Yes,No,No,No,No,"10:40 AM 15th Jun,22",2022-06-15 10:40,18
Shanti Yadav Hospital,"Bawal-Rewari Rd Model Town, Rewari, Haryana",Yes (33),19,10,4,0,19,10,4,0,Yes,No,Yes,No,No,"10:35 AM 15th Jun,22",2022-06-15 10:35,18
Sheela Neuro &amp; Multi. Superspeciality Hospital,"Sheela Neuro Multi-Super Speciality Hospital, Opposite Jain Public School, Circular Road, Rewari",Yes (32),15,15,2,0,15,15,3,1,Yes,No,Yes,Yes,No,"10:19 AM 15th Jun,22",2022-06-15 10:19,18
Shri Ashwani Sexena Hospital,"343-L, Model town Rewari",Yes (10),7,3,0,0,7,3,0,0,Yes,No,Yes,Yes,Yes,"10:26 AM 15th Jun,22",2022-06-15 10:26,18
SMCC Hospital,"Sector 5 Rewari, Haryana",Yes (13),2,0,11,1,2,0,11,1,Yes,No,Yes,Yes,Yes,"10:25 AM 15th Jun,22",2022-06-15 10:25,18
Surendra Hospital Bawal,"Circuar Road, Rewari, Haryana",Yes (11),5,2,4,0,5,2,5,0,Yes,No,Yes,No,Yes,"10:27 AM 15th Jun,22",2022-06-15 10:27,18
"Sushma Devi Hospital, Bawal","Rewari Road, Bawal, Rewari, Near Power House & Bharat Petrol Pump",Yes (18),9,9,0,0,9,9,0,0,Yes,No,Yes,Yes,Yes,"10:24 AM 15th Jun,22",2022-06-15 10:24,18
Vedanta Hospital,"Circulare Road, Near Nirankari Satsang Bhavan Dharuhera, Chungi, Rewari, Haryana",Yes (29),0,7,22,0,0,7,30,0,Yes,No,Yes,Yes,Yes,"10:21 AM 15th Jun,22",2022-06-15 10:21,18
Virat Hospital,"Circular Rd, Near Oriental Bank of Commerce, Madhu Vihar, Rewari, Haryana",Yes (100),63,10,27,2,63,10,27,2,To Be Updated,To Be Updated,To Be Updated,To Be Updated,To Be Updated,"10:36 AM 15th Jun,22",2022-06-15 10:36,18
Yaduvanshi Hospital,"Maharana Pratap Chowk, Model Town, Rewari, Haryana",Yes (46),36,0,10,1,36,0,10,1,Yes,No,Yes,Yes,No,"10:34 AM 15th Jun,22",2022-06-15 10:34,18
DCHC Barara,,Yes (50),50,0,0,0,50,0,0,0,To Be Updated,To Be Updated,To Be Updated,To Be Updated,To Be Updated,"10:51 AM 24th Apr,23",2023-04-24 10:51,1
DCHC Mullana,,Yes (50),50,0,0,0,50,0,0,0,To Be Updated,To Be Updated,To Be Updated,To Be Updated,To Be Updated,"10:51 AM 24th Apr,23",2023-04-24 10:51,1
District Civil Hospital,Ambala City,Yes (138),115,0,23,11,116,0,23,11,Yes,Yes,Yes,Yes,Yes,"10:48 AM 24th Apr,23",2023-04-24 10:48,1
District Civil Hospital Ambala Cantt,Ambala Cantt,Yes (93),80,0,13,7,80,0,13,7,Yes,Yes,Yes,Yes,Yes,"10:50 AM 24th Apr,23",2023-04-24 10:50,1
Guardian Hospital,AMBALA JAGADHARI ROAD AMBALA CANTT,Yes (23),15,3,5,3,15,3,5,3,Yes,Yes,Yes,Yes,Yes,"10:51 AM 24th Apr,23",2023-04-24 10:51,1
Ishwar Hospital,,Yes (15),15,0,0,0,16,0,0,0,Yes,Yes,To Be Updated,Yes,Yes,"10:51 AM 24th Apr,23",2023-04-24 10:51,1
Kuldeep Hospital,,Yes (10),8,0,2,0,8,0,2,0,To Be Updated,To Be Updated,To Be Updated,To Be Updated,To Be Updated,"10:51 AM 24th Apr,23",2023-04-24 10:51,1
Mehndiratta Hospital,"#106, manali house, near central jail,  ambala city",Yes (30),25,0,5,1,25,0,5,1,Yes,No,Yes,Yes,Yes,"10:51 AM 24th Apr,23",2023-04-24 10:51,1
Military Hospital,Ambala Cantonment,Yes (160),60,85,15,15,60,85,15,15,To Be Updated,To Be Updated,To Be Updated,To Be Updated,To Be Updated,"10:50 AM 24th Apr,23",2023-04-24 10:50,1
MM Medical College Pvt,MMIMSR Mullana Ambala,Yes (200),116,70,14,10,116,70,14,10,Yes,Yes,Yes,Yes,Yes,"10:50 AM 24th Apr,23",2023-04-24 10:50,1
Park Healing Touch Hospital,"Sultanpur Chowk, Nr Dhulkot Barrier, Ambala Chandigarh Expy. Ambala",Yes (48),28,0,20,10,30,0,20,10,Yes,Yes,Yes,Yes,Yes,"10:48 AM 24th Apr,23",2023-04-24 10:48,1
Philedelphia mission Hospital pvt,"Mission Compound, Ambala City",Yes (100),92,0,8,2,92,0,8,2,Yes,No,Yes,Yes,Yes,"10:49 AM 24th Apr,23",2023-04-24 10:49,1
Railways Hospital,"Railway Hospital, railway colony,  Ambala Cantt",Yes (35),30,0,5,0,30,0,5,0,Yes,Yes,Yes,Yes,Yes,"10:50 AM 24th Apr,23",2023-04-24 10:50,1
Rotary Hospital Ambala cantt Pvt,"Rambagh road, Opp Dusshera ground, Ambala Cantt",Yes (20),15,0,5,2,15,0,5,2,Yes,No,Yes,Yes,Yes,"10:50 AM 24th Apr,23",2023-04-24 10:50,1
Sant Hospital,,Yes (13),10,0,3,1,10,0,3,1,To Be Updated,To Be Updated,To Be Updated,To Be Updated,Yes,"10:51 AM 24th Apr,23",2023-04-24 10:51,1
SDH Naraingarh,,Yes (50),50,0,0,0,50,0,0,0,To Be Updated,To Be Updated,To Be Updated,To Be Updated,To Be Updated,"10:50 AM 24th Apr,23",2023-04-24 10:50,1
Yafe Indoor Hospital,,Yes (15),9,6,0,0,9,6,0,0,To Be Updated,To Be Updated,To Be Updated,To Be Updated,To Be Updated,"10:50 AM 24th Apr,23",2023-04-24 10:50,1
Ch Lekh Raj Multispeciality Hospital,Vill Gadhauli Yamuna Nagar,Yes (150),140,0,10,5,140,0,10,5,Yes,Yes,Yes,Yes,Yes,"2:46 PM 2nd Aug,22",2022-08-02 14:46,22
CHC Bilaspur,CHC Bilaspur,Yes (23),8,15,0,0,8,17,0,0,Yes,No,Yes,No,Yes,"2:42 PM 2nd Aug,22",2022-08-02 14:42,22
CHC Chhachharuli,CHC Chhachharuli,Yes (30),10,20,0,0,10,20,0,0,Yes,No,Yes,Yes,Yes,"2:42 PM 2nd Aug,22",2022-08-02 14:42,22
CHC Naharpur,Naharpur Yamuna Nagar,Yes (10),10,0,0,0,10,0,0,0,Yes,No,No,No,Yes,"2:46 PM 2nd Aug,22",2022-08-02 14:46,22
CHC Partap Nagar,CHC Partap Nagar,Yes (16),6,10,0,0,6,10,0,0,Yes,No,Yes,No,Yes,"2:42 PM 2nd Aug,22",2022-08-02 14:42,22
CHC Radaur,Radaur Yamuna Nagar,Yes (20),10,10,0,0,10,10,0,0,Yes,No,Yes,Yes,Yes,"2:46 PM 2nd Aug,22",2022-08-02 14:46,22
CHC Saraswati Nagar,CHC Saraswati Nagar,Yes (25),14,11,0,0,14,11,0,0,Yes,No,Yes,No,Yes,"2:43 PM 2nd Aug,22",2022-08-02 14:43,22
DABRA HOSPITAL Yamunanagar,DABRA HOSPITAL,Yes (23),11,8,4,2,11,8,4,2,No,No,No,No,No,"2:43 PM 2nd Aug,22",2022-08-02 14:43,22
Gaba Hospital,Gaba Hospital Yamunanagar,Yes (50),20,10,20,4,20,10,20,4,Yes,No,Yes,Yes,Yes,"2:41 PM 2nd Aug,22",2022-08-02 14:41,22
GULATI HOSPITAL,GULATI HOSPITAL,Yes (32),23,3,6,0,25,3,6,0,Yes,No,Yes,Yes,Yes,"2:43 PM 2nd Aug,22",2022-08-02 14:43,22
Indra Hospital,109 OPP ESI HOSPITAL JAGADHRI,Yes (30),20,5,5,2,20,5,5,2,Yes,No,Yes,Yes,Yes,"2:53 PM 2nd Aug,22",2022-08-02 14:53,22
JP Hospital Pvt,"Jagadhri Rd, near Luxmi Theater, Vishwakarma Mohalla, Yamuna Nagar,HARAYANA Haryana",Yes (43),15,15,13,2,15,15,13,2,Yes,No,Yes,Yes,Yes,"2:42 PM 2nd Aug,22",2022-08-02 14:42,22
KAPOOR HOSPITAL,"SH 6A Indira Colony Jagadhri, yamunanagart ,Haryana",Yes (12),4,0,8,0,4,0,8,0,Yes,No,Yes,Yes,Yes,"2:45 PM 2nd Aug,22",2022-08-02 14:45,22
KESHWANI HOSPITAL,"Jagadhri - Yamuna Nagar Rd, Tagore Garden, Yamuna Nagar, Haryana",Yes (10),10,0,0,0,10,0,0,0,Yes,No,Yes,Yes,Yes,"2:47 PM 2nd Aug,22",2022-08-02 14:47,22
Maxxwell Hospital,Jagadhari Yamuna Nagar,Yes (17),11,0,6,0,11,0,6,0,Yes,No,Yes,Yes,Yes,"2:43 PM 2nd Aug,22",2022-08-02 14:43,22
Mukand Lal District Civil Hospital Yamunanagar,Mukand Lal District Civil Hospital YNR,Yes (23),18,5,0,5,18,9,0,5,Yes,No,Yes,Yes,Yes,"2:43 PM 2nd Aug,22",2022-08-02 14:43,22
NIRMAL HOSPITAL,"199, Radaur Rd, near nirmal hospital, camp, Garhi Gujran, Haryana",Yes (20),13,1,6,0,13,1,6,0,Yes,No,Yes,Yes,Yes,"2:42 PM 2nd Aug,22",2022-08-02 14:42,22
RK Gupta,opp DAV Sr Sec School Near Madhu Hotel YNR,Yes (16),4,2,10,0,5,2,10,0,Yes,Yes,Yes,Yes,Yes,"2:46 PM 2nd Aug,22",2022-08-02 14:46,22
SABBARWAL HOSPITAL,"Gulab Nagar, Jagadhri, Haryana",Yes (13),6,1,6,0,6,1,6,0,Yes,No,Yes,Yes,Yes,"2:45 PM 2nd Aug,22",2022-08-02 14:45,22
Sachdeva Hospital,"2227, Civil Lines Rd, Sri Nagar Colony, Civil Lines, Gomti Mohalla, Jagadhri, Haryana",Yes (28),16,8,4,0,16,8,4,0,Yes,No,Yes,Yes,Yes,"2:47 PM 2nd Aug,22",2022-08-02 14:47,22
Santosh Hospital,"Santosh Hospital  Kanhaiya Sahib Chowk, near Govt.School, Harbanspura Colony, Gobind Pura, Yamuna Nagar, Haryana",Yes (28),5,9,14,2,5,9,14,2,Yes,No,Yes,Yes,Yes,"2:40 PM 2nd Aug,22",2022-08-02 14:40,22
SHARMA HOSPITAL,Near Agarsain Chowk Jagadhri,Yes (12),12,0,0,0,12,0,0,0,Yes,No,Yes,Yes,Yes,"2:46 PM 2nd Aug,22",2022-08-02 14:46,22
Shree Medical Care Hospital,"359/2, Jain nagar, Jagadhri, Haryana",Yes (15),15,0,0,0,15,0,0,0,Yes,Yes,Yes,Yes,Yes,"2:47 PM 2nd Aug,22",2022-08-02 14:47,22
Shureshtha Hospital,Model Colony YNR,Yes (12),9,1,2,0,9,1,2,0,Yes,No,Yes,Yes,Yes,"2:47 PM 2nd Aug,22",2022-08-02 14:47,22
SP Hospital Jag,S.P Hospital Jag,Yes (7),4,0,3,1,4,0,3,1,Yes,No,Yes,Yes,Yes,"2:44 PM 2nd Aug,22",2022-08-02 14:44,22
Swami Vivekanand Hospital Yamunanagar,"Swami Vivekanand Hospital,Yamuna Nagar, Haryana",Yes (49),20,10,19,1,20,10,19,1,Yes,No,Yes,Yes,Yes,"2:45 PM 2nd Aug,22",2022-08-02 14:45,22
Swastik Hospital,"Basant Nagar, Yamuna Nagar, Haryana",Yes (6),4,2,0,0,4,2,0,0,Yes,No,Yes,Yes,Yes,"2:48 PM 2nd Aug,22",2022-08-02 14:48,22
VARDAAN HOSPITAL,OPP KOHLI HOSPITAL NEAR AGARSEN COLLEGE JAGADHRI,Yes (10),8,2,0,0,8,2,0,0,Yes,No,Yes,Yes,Yes,"2:47 PM 2nd Aug,22",2022-08-02 14:47,22