name,address,Availability_availability_of_beds,Availability_oxygen_beds,Availability_non_oxygen_beds,Availability_i_c_u_beds,Availability_ventilators,Allocated_oxygen_beds,Allocated_non_oxygen_beds,Allocated_i_c_u,Allocated_ventilators,Availability_availability_of_oxygen,Availability_antiviral_remdesivir_etc_,Availability_steroids,Availability_anticoagulant,Availability_antipyretic,updated_on_unparsed,updated_on,city
"AMRITDHARA, Chaura Bazar","Near ITI Chowk, Gahoon Vihar, Karnal, Haryana",Yes (64),38,0,26,0,38,0,26,2,Yes,No,Yes,Yes,Yes,"10:29 AM 2nd Aug,22",2022-08-02 10:29,11
Arpana Hospital,"G.T. Road, Madhuban, Karnal, Karnal, Haryana",No (0),0,0,0,1,0,0,0,1,Yes,No,Yes,Yes,Yes,"4:54 PM 2nd Aug,22",2022-08-02 16:54,11
Arsh Hospital,Opp. Kalpana Chawla Medical College,No (0),0,0,0,0,0,0,0,0,Yes,Yes,Yes,Yes,Yes,"4:56 PM 2nd Aug,22",2022-08-02 16:56,11
CHC Assandh,"Assandh, Assandh Ruralpart, Haryana",Yes (10),10,0,0,0,10,0,0,0,Yes,No,Yes,No,Yes,"10:11 AM 2nd Aug,22",2022-08-02 10:11,11
CHC Gharaunda,"Balinagar, Gharaunda, Haryana",Yes (10),10,0,0,0,10,0,0,0,Yes,No,Yes,No,Yes,"10:11 AM 2nd Aug,22",2022-08-02 10:11,11
CHC Kunjpura,Village Kunjpura,Yes (11),11,0,0,0,11,0,0,0,To Be Updated,Yes,Yes,Yes,Yes,"10:24 AM 2nd Aug,22",2022-08-02 10:24,11
CHC Nissing,"SH 8, Gondar, Nissing, Haryana",Yes (10),10,0,0,0,10,0,0,0,Yes,No,Yes,No,Yes,"10:11 AM 2nd Aug,22",2022-08-02 10:11,11
CHC Taraori,CHC Taraori,Yes (6),6,0,0,0,6,0,0,0,Yes,No,Yes,No,Yes,"10:22 AM 2nd Aug,22",2022-08-02 10:22,11
Ishwar Kirpa Hospital,"Ishwar Kirpa Hospital, Sector -14",No (0),0,0,0,0,0,0,0,0,Yes,Yes,Yes,Yes,Yes,"5:01 PM 2nd Aug,22",2022-08-02 17:01,11
"Kalpana Chawla Government Medical College, Karnal","Model Town, Karnal, Haryana",Yes (276),198,0,78,0,200,0,80,80,Yes,Yes,Yes,Yes,Yes,"10:29 AM 2nd Aug,22",2022-08-02 10:29,11
Karnal Nursing Home,"26 Duggal Colony, Karnal",No (0),0,0,0,0,0,0,0,0,Yes,To Be Updated,Yes,Yes,Yes,"5:01 PM 2nd Aug,22",2022-08-02 17:01,11
Park Hospital karnal,"CHD City, NH-1, Sector 45, Karnal, Haryana",Yes (30),10,0,20,2,10,0,20,2,To Be Updated,Yes,Yes,Yes,Yes,"10:09 AM 2nd Aug,22",2022-08-02 10:09,11
Rama Superspeciality Hospital,Civil Hosp Chowk Karnal,No (0),0,0,0,0,0,0,0,0,Yes,No,Yes,Yes,Yes,"5:00 PM 2nd Aug,22",2022-08-02 17:00,11
"Sanjiv Bansal Cygnus Hospital , Karnal","Railway Rd, Ibrahim Mandi, Karnal, Haryana",Yes (19),17,0,2,2,20,0,5,2,Yes,Yes,Yes,Yes,Yes,"10:12 AM 2nd Aug,22",2022-08-02 10:12,11
Sarvodya Hospital Karnal,"Sector 14, Near Tau Devi Lal Chowk",No (0),0,0,0,0,0,0,0,0,To Be Updated,To Be Updated,To Be Updated,To Be Updated,To Be Updated,"8:33 AM 9th Aug,22",2022-08-09 08:33,11
SDH Nilokheri,SDH Nilokheri,Yes (10),10,0,0,0,10,0,0,0,Yes,No,Yes,No,Yes,"10:15 AM 2nd Aug,22",2022-08-02 10:15,11
Shri Ram Chand Memorial Hospital,"12, Ashoka colony,Opp Kalpana Chawla hospital, Karnal, Haryana",Yes (15),8,0,7,0,8,0,7,3,Yes,No,Yes,Yes,Yes,"10:28 AM 2nd Aug,22",2022-08-02 10:28,11
Shri Sanatan Dharam Mahabir Dal,"Kunjpura Road, Karnal Near Sanatan Dharam Mandir",Yes (12),12,0,0,0,12,0,0,0,Yes,Yes,Yes,Yes,Yes,"10:15 AM 2nd Aug,22",2022-08-02 10:15,11
SS Hospital,"Sector 14, Karnal",No (0),0,0,0,0,0,0,0,0,Yes,To Be Updated,Yes,Yes,Yes,"5:00 PM 2nd Aug,22",2022-08-02 17:00,11
Swastik Hospital,Swastic Hospital Opp DCH,No (0),0,0,0,0,0,0,0,0,Yes,No,Yes,Yes,Yes,"5:02 PM 2nd Aug,22",2022-08-02 17:02,11
Virk Hospital Karnal,"363-364, Randhir lane, near Dyal Singh College, Karnal, Haryana",Yes (45),37,0,8,1,37,0,8,1,Yes,Yes,Yes,Yes,Yes,"10:12 AM 2nd Aug,22",2022-08-02 10:12,11
ASHIRWAD BHAGAT HOSPITAL,"Old DC Rd, near bhagat hospital, Sonipat, Haryana 131001",Yes (15),12,0,3,1,12,0,3,1,Yes,Yes,Yes,Yes,Yes,"12:09 PM 16th Jun,22",2022-06-16 12:09,21
Bhagwan Dass Hospital,"Near Shahpur Turk, block-E, omaxe city, Sector 18, Sonipat, Haryana 131001",Yes (3),Beds Over Utilized 13,0,3,2,27,0,13,2,Yes,No,Yes,Yes,Yes,"3:55 PM 17th Jun,22",2022-06-17 15:55,21
"BPS MEDICAL COLLEGE KHANPUR , SONIPAT ( 01263283088)","Ganaur - Gohana Rd, Khanpur Kalan, Haryana",Yes (295),170,77,48,50,170,80,50,50,Yes,Yes,Yes,Yes,Yes,"12:02 PM 21st Aug,22",2022-08-21 12:02,21
CHC GANUR,CHC GANUR,Yes (8),8,0,0,0,8,0,0,0,Yes,No,Yes,Yes,Yes,"12:04 PM 16th Jun,22",2022-06-16 12:04,21
CHC Kharkhoda,"SH 20, Kharkhoda, Haryana 131402",Yes (10),5,5,0,0,5,5,0,0,To Be Updated,To Be Updated,Yes,Yes,Yes,"5:14 PM 7th Jun,22",2022-06-07 17:14,21
"CHC, JUAN, SONIPAT, HARYANA","CHC, JUAN, SONIPAT, HARYANACHC, JUAN, SONIPAT, HARYANA, 131024",Yes (5),3,2,0,0,3,2,0,0,Yes,No,Yes,Yes,Yes,"5:15 PM 7th Jun,22",2022-06-07 17:15,21
"Civil Hospital, Sonipat (9050007668 )","Delhi Road, Near Maharana Pratap Chowk, Sonipat, Haryana 131001",Yes (200),190,0,10,10,190,0,10,10,Yes,Yes,Yes,Yes,Yes,"10:47 AM 3rd Aug,22",2022-08-03 10:47,21
"CYGNUS HOSPITAL, Sonipat","Old Rohtak Rd, near Hindu College of Engineering, Industrial Area, Sonipat, Haryana 131001",Yes (20),18,0,2,1,18,0,2,1,Yes,No,Yes,Yes,Yes,"11:20 AM 16th Jun,22",2022-06-16 11:20,21
Dayanand Hospital-Sonepat,"Kakroi Rd, Prem Nagar, West Ram Nagar, Sonipat, Haryana",Yes (40),35,Beds Over Utilized 1,5,3,35,0,5,3,Yes,No,Yes,Yes,Yes,"1:34 PM 20th May,22",2022-05-20 13:34,21
FIIMS Hospital,"Road, Bahalgarh, Sonipat, Haryana 131304",Yes (99),63,0,36,6,63,0,37,8,Yes,No,Yes,Yes,Yes,"1:50 PM 3rd Mar,22",2022-03-03 13:50,21
GAJRAJ HOSPITAL,"Bus Stand, Gajraj Hospital Road, Near, Gohana, Haryana 131301",Yes (20),20,0,0,0,20,0,0,0,Yes,To Be Updated,Yes,Yes,Yes,"1:50 PM 3rd Mar,22",2022-03-03 13:50,21
"GLAXY ONE HOSPITAL, SONIPAT","SH 11, Bahalgarh, Sonipat, Haryana 131021",Yes (18),18,Beds Over Utilized 4,Beds Over Utilized 5,Beds Over Utilized 1,20,0,0,0,Yes,To Be Updated,Yes,Yes,Yes,"5:14 PM 7th Jun,22",2022-06-07 17:14,21
HARYANA HOSPITAL,"Vivekanand Chowk, Delhi Rd, behind Bullet Showroom, Janta Colony, Sonipat, Haryana 131001",Yes (2),1,0,1,1,1,0,1,1,Yes,No,No,No,Yes,"5:14 PM 7th Jun,22",2022-06-07 17:14,21
MEMORIAL HOSPITAL,"SH 11, near Mama Bhanja Chowk, Nandwani Nagar, Anand Nagar,, Sonipat, Haryana 131001",Yes (20),16,0,4,2,16,0,4,2,Yes,No,Yes,Yes,Yes,"4:53 PM 10th Sep,22",2022-09-10 16:53,21
NIDAAN HOSPITAL PVT.,"Murthal Rd, Sonipat, Haryana 131001",No (0),0,0,0,0,0,0,0,0,Yes,No,Yes,Yes,Yes,"1:16 PM 13th Aug,22",2022-08-13 13:16,21
OSCAR HOSPITAL,"SH 11, Lakshmi Nagar, Sonipat, Haryana 131001",Yes (14),6,0,8,2,7,0,8,2,Yes,No,Yes,Yes,Yes,"5:14 PM 7th Jun,22",2022-06-07 17:14,21
PHC PURKHAS,"Purkhas, Haryana 131102",Yes (30),0,30,0,0,0,30,0,0,To Be Updated,To Be Updated,To Be Updated,To Be Updated,To Be Updated,"5:14 PM 7th Jun,22",2022-06-07 17:14,21
PREMPUSHP MULTISPECIALITY HOSPITAL,"SUBJI MANDI GANAUR,HARYANA SONIPAT 131101",Yes (20),20,0,0,0,20,0,0,0,To Be Updated,No,Yes,Yes,Yes,"5:15 PM 7th Jun,22",2022-06-07 17:15,21
"SANJIVNI HOSPITAL, SONIPAT","Mehlana Rd, Malviya Nagar, Sonipat, Haryana 131304",Yes (15),14,0,1,1,14,0,1,1,Yes,To Be Updated,To Be Updated,Yes,To Be Updated,"5:30 PM 12th Oct,22",2022-10-12 17:30,21
SAXSENA HOSPITAL,"112/113, T.P. Scheme, Delhi Rd, Sonipat, Haryana 131304",Yes (23),18,0,5,2,18,0,5,2,Yes,No,Yes,Yes,Yes,"9:32 AM 5th Aug,22",2022-08-05 09:32,21
SDH GOHANA,"Devi Nagar, Uttam Nagar, Gohana, Haryana 131301",Yes (10),10,0,0,0,10,0,0,0,Yes,Yes,Yes,Yes,Yes,"5:14 PM 7th Jun,22",2022-06-07 17:14,21
SITA HOSPITAL SONIPAT,"Railway Rd, Ganaur, Haryana 131101",Yes (20),20,Beds Over Utilized 4,0,0,20,0,0,0,Yes,No,Yes,Yes,Yes,"10:48 AM 15th Jun,22",2022-06-15 10:48,21
SUNHERI DEVI HOSPITAL,"Mission Rd, Dev Nagar, Sonipat, Haryana 131001",Yes (20),15,0,5,1,15,0,5,1,Yes,No,Yes,Yes,Yes,"5:05 PM 30th Aug,22",2022-08-30 17:05,21
TULIP HOSPITAL,"T. P. Scheme, no.15, Delhi Rd, Vivekanand chowk, Sonipat, Haryana 131001",Yes (20),0,0,20,5,0,0,20,5,Yes,No,Yes,Yes,Yes,"4:19 PM 28th Aug,22",2022-08-28 16:19,21
"Apex Hospital, Sirsa","Circular Road, Sirsa",Yes (16),10,2,4,0,10,2,4,0,Yes,To Be Updated,Yes,Yes,Yes,"12:29 PM 2nd Aug,22",2022-08-02 12:29,20
"Astha Hospital, Sirsa",Dabwali Road Sirsa,Yes (16),11,0,5,4,11,0,5,4,Yes,No,Yes,Yes,Yes,"12:24 PM 2nd Aug,22",2022-08-02 12:24,20
CHC NATHUSARI CHOPTA,Nathusari Chopta,Yes (25),20,5,0,0,20,5,0,0,To Be Updated,To Be Updated,Yes,Yes,Yes,"12:29 PM 2nd Aug,22",2022-08-02 12:29,20
CIVIL HOSPITAL SIRSA,"Civil Hospital Road, Sirsa",Yes (180),130,40,10,21,130,40,10,21,Yes,Yes,Yes,Yes,Yes,"12:24 PM 2nd Aug,22",2022-08-02 12:24,20
"Dayal Nursing Home, Sirsa","Dabwali Road, Sirsa",Yes (20),16,1,3,0,16,1,3,0,Yes,To Be Updated,Yes,Yes,Yes,"12:29 PM 2nd Aug,22",2022-08-02 12:29,20
"Gupta Hospital, Sirsa","Dabwali Road, Sirsa Near Easy Day",Yes (14),6,5,3,0,6,5,3,0,Yes,To Be Updated,Yes,Yes,Yes,"12:31 PM 2nd Aug,22",2022-08-02 12:31,20
"Jagdish Nursing Home, Sirsa","Gandhi Market, Parshuram Chowk, Sirsa",Yes (9),6,3,0,1,6,3,0,1,Yes,No,Yes,Yes,Yes,"12:30 PM 2nd Aug,22",2022-08-02 12:30,20
"Jeevan Jyoti Hospital, Sirsa",Dabwali Road Sirsa,Yes (8),0,2,6,1,0,2,6,1,Yes,No,Yes,Yes,Yes,"12:24 PM 2nd Aug,22",2022-08-02 12:24,20
"Khurana Hospital, Sirsa",Dabwali Road Sirsa,Yes (10),6,0,4,0,6,0,4,0,Yes,No,Yes,Yes,Yes,"12:24 PM 2nd Aug,22",2022-08-02 12:24,20
"Lalgarhia Hospital, Sirsa",Dabwali Road Sirsa,Yes (22),15,4,3,2,15,4,3,2,Yes,Yes,Yes,No,Yes,"12:25 PM 2nd Aug,22",2022-08-02 12:25,20
"Medicare Hospital, Sirsa","Dabwali Road, Sirsa",Yes (9),2,3,4,2,2,3,4,2,Yes,Yes,Yes,Yes,Yes,"12:34 PM 2nd Aug,22",2022-08-02 12:34,20
"Metro Health Care Hospital, Sirsa","Near Dena Bank, lal Batti Chowk, Sirsa",Yes (14),1,9,4,1,1,9,4,1,Yes,Yes,Yes,Yes,Yes,"12:29 PM 2nd Aug,22",2022-08-02 12:29,20
"Mittal Hospital, Sirsa","Near Jhunthra Petrol Pump, Dabwali Road Sirsa",Yes (19),14,1,4,0,14,1,4,0,Yes,No,Yes,Yes,Yes,"5:14 PM 7th Jun,22",2022-06-07 17:14,20
"New Life Care Hospital, Sirsa","Dabwali Road, Sirsa",Yes (11),7,2,2,1,7,2,2,1,Yes,No,Yes,Yes,Yes,"12:26 PM 2nd Aug,22",2022-08-02 12:26,20
"Poonia COVID Care Center, Sirsa","Near Ambedkar chowk, opposite Seth tula ram dharamshala, Hisar Road, Sirsa, Haryana 125055",Yes (24),10,8,6,1,10,8,6,1,Yes,Yes,Yes,Yes,Yes,"12:25 PM 2nd Aug,22",2022-08-02 12:25,20
"Sanjeevni Hospital, Sirsa (Wing -2, 1 &amp; 2nd Floor)","Under over bridge, hisar road, sirsa",Yes (35),30,0,5,5,30,0,5,5,Yes,Yes,Yes,Yes,Yes,"12:24 PM 2nd Aug,22",2022-08-02 12:24,20
SDCH Dabwali,"Dabwali, District Sirsa",Yes (100),100,0,0,2,100,0,0,2,Yes,No,Yes,Yes,Yes,"12:25 PM 2nd Aug,22",2022-08-02 12:25,20
"Shah Satnam Dera Hospital (Wing -2, 2nd floor), Sirsa","Begu Road, Sirsa",Yes (65),21,30,14,7,21,30,14,7,Yes,Yes,Yes,Yes,Yes,"12:08 PM 2nd Aug,22",2022-08-02 12:08,20
"Shivam Hospital, Sirsa",Surkhab Chowk Sirsa,Yes (18),8,8,2,2,8,8,2,2,Yes,No,Yes,Yes,To Be Updated,"12:29 PM 2nd Aug,22",2022-08-02 12:29,20
"Shri Baba Tara Hospital &amp; Research Center, Sirsa","Hisar Road, Sirsa",Yes (25),15,5,5,3,15,5,5,3,Yes,No,Yes,Yes,Yes,"12:29 PM 2nd Aug,22",2022-08-02 12:29,20
"SPS Hospital, Sirsa","Near Sangwan Chowk, Dabwali Road, Sirsa",Yes (21),14,4,3,3,14,4,3,3,Yes,No,Yes,Yes,Yes,"12:36 PM 2nd Aug,22",2022-08-02 12:36,20
"Suraksha Hospital, Sirsa","Dabwali Rd, opposite Hotel Aroma, Sirsa, Haryana 125055",Yes (20),9,3,8,4,9,3,8,4,Yes,No,Yes,Yes,Yes,"12:26 PM 2nd Aug,22",2022-08-02 12:26,20
"Swastik Hospital, Sirsa","Ambedkar Chowk, Nandan Vatika, Sirsa,",Yes (15),5,5,5,0,5,5,5,0,Yes,No,Yes,Yes,Yes,"11:12 AM 15th Jun,22",2022-06-15 11:12,20
"Talwar Nursing Home, Sirsa","Under Over Bridge, Hisar Road, Sirsa",Yes (24),11,10,3,1,11,10,3,1,Yes,Yes,Yes,Yes,Yes,"12:30 PM 2nd Aug,22",2022-08-02 12:30,20
"Tomar Nursing Home, Sirsa","Nandan Vatika, near surkhab Chock, Hathi park, Agrasain Colony, Sirsa, Haryana 125055",Yes (17),14,0,3,1,14,0,3,1,Yes,Yes,Yes,Yes,Yes,"12:27 PM 2nd Aug,22",2022-08-02 12:27,20
"Vardan Hospital, Sirsa","Near Lal Batti Chowk, Sirsa",Yes (18),9,3,6,0,9,3,6,0,Yes,No,Yes,Yes,Yes,"12:28 PM 2nd Aug,22",2022-08-02 12:28,20
Anchal Multispeciality Hospital,"Anchal Multi speciality Hospital, Krishna Colony, Bhiwani, Haryana 127027",Yes (35),25,0,10,2,25,0,10,2,Yes,Yes,Yes,Yes,Yes,"5:14 PM 7th Jun,22",2022-06-07 17:14,2
Ch. Bansilal Govt Hospital,"Bansi Lal General Hospital, Ghanta Ghar Chowk, SH 17, Krishna Colony, Bhiwani, Haryana 127021",Yes (171),139,5,27,16,139,5,28,16,Yes,Yes,Yes,Yes,Yes,"5:14 PM 7th Jun,22",2022-06-07 17:14,2
Chugh Hospital,"Meham Gate, Circular Road, Bhiwani",Yes (20),20,0,0,0,20,0,0,0,Yes,Yes,Yes,Yes,Yes,"5:14 PM 7th Jun,22",2022-06-07 17:14,2
ESI Hospital Bhiwani,"Stadium Rd, Housing Board Colony, Bhiwani, Haryana 127021",Yes (40),0,40,0,0,0,40,0,0,No,No,Yes,Yes,Yes,"5:14 PM 7th Jun,22",2022-06-07 17:14,2
Ganpatrai Hospital,"SH 17, Bank Colony, Bound Kalan, Krishna Colony, Bhiwani, Haryana 127021",Yes (10),4,4,2,1,4,4,2,1,Yes,No,Yes,Yes,Yes,"5:14 PM 7th Jun,22",2022-06-07 17:14,2
Jangra Multispecilaity Hospital,"Bank Colony, Old Bharat Nagar, Bhiwani, Haryana 127021",Yes (10),7,3,0,0,7,3,0,0,Yes,No,Yes,Yes,Yes,"5:14 PM 7th Jun,22",2022-06-07 17:14,2
Jeevan Nursing Home-Bhiwani,Rohtak gate Bhiwani,Yes (10),3,4,3,0,3,4,3,0,Yes,Yes,Yes,Yes,Yes,"5:15 PM 7th Jun,22",2022-06-07 17:15,2
Jeevanrekha Hospital,Near Railway Road Bhiwani,Yes (30),25,0,5,1,25,0,5,1,To Be Updated,To Be Updated,To Be Updated,To Be Updated,To Be Updated,"5:15 PM 7th Jun,22",2022-06-07 17:15,2
Kadam Hospital,"Bank Colony Near New Bus Stand, Bhiwani",Yes (45),11,0,34,1,11,0,34,1,Yes,Yes,Yes,Yes,Yes,"5:29 PM 15th Jun,22",2022-06-15 17:29,2
Krishan Lal Jalan Hospital,"Jalan Nagar, M.C.Colony, Bhiwani, Haryana 127021",Yes (40),20,20,0,0,20,20,0,0,Yes,Yes,Yes,Yes,Yes,"5:14 PM 7th Jun,22",2022-06-07 17:14,2
Life Line Hospital,"Circular Rd, M.C.Colony, Bhiwani, Haryana 127021",Yes (27),21,0,6,0,21,0,6,0,Yes,Yes,Yes,Yes,Yes,"5:14 PM 7th Jun,22",2022-06-07 17:14,2
RPS HOSPITAL,,Yes (24),4,16,4,0,4,16,4,0,Yes,No,Yes,Yes,Yes,"5:14 PM 7th Jun,22",2022-06-07 17:14,2
Sharma Nursing and Maternity Home Tosham,Siwani Road Tosham,Yes (10),7,0,3,2,7,0,3,2,Yes,Yes,To Be Updated,Yes,Yes,"5:15 PM 7th Jun,22",2022-06-07 17:15,2
Shree Ganesha Hospital,"Dadri Gate, Bhiwani",Yes (13),6,3,4,0,6,3,4,0,Yes,Yes,Yes,Yes,Yes,"5:14 PM 7th Jun,22",2022-06-07 17:14,2
"SHRI BABA YOGI NETANATH HOSPITAL , LOHANI ,BHIWANI",VPO Lohani,Yes (50),35,5,10,2,35,5,10,2,Yes,Yes,Yes,Yes,Yes,"5:15 PM 7th Jun,22",2022-06-07 17:15,2
Shri Ram Hospital,Siwani,Yes (11),0,0,11,4,0,0,11,4,To Be Updated,To Be Updated,To Be Updated,To Be Updated,To Be Updated,"5:15 PM 7th Jun,22",2022-06-07 17:15,2
SMSG Multispeciality Hospital,"Rohtak Gate, Bhiwani",Yes (30),2,17,11,2,2,17,11,2,Yes,Yes,Yes,Yes,Yes,"5:14 PM 7th Jun,22",2022-06-07 17:14,2
Spes Hospital,"Circular Rd, Bound Kalan, M.C.Colony, Bhiwani, Haryana 127021",Yes (22),4,6,12,1,4,6,12,1,Yes,Yes,Yes,Yes,Yes,"5:14 PM 7th Jun,22",2022-06-07 17:14,2
Cygnus Multispecialty Hospital Kaithal,"Huda Bypass Road, Sector 20, Kaithal, Haryana",Yes (40),28,0,12,2,28,0,12,2,Yes,No,Yes,Yes,Yes,"10:56 AM 3rd Oct,22",2022-10-03 10:56,10
District Civil Hospital Kaithal,"Huda Sec 18, Kaithal",Yes (115),80,15,20,20,80,15,20,20,Yes,Yes,No,Yes,Yes,"9:14 AM 11th Oct,22",2022-10-11 09:14,10
SDH Guhla,SDH Guhla,Yes (70),35,35,0,5,35,35,0,5,Yes,No,Yes,No,Yes,"10:43 AM 3rd Oct,22",2022-10-03 10:43,10
Shah Multispecialty Hospital Kaithal,"opp.old, bus stand, Jind - Kaithal Rd, Amar Garh Colony, Kaithal, Haryana",Yes (75),50,11,14,10,51,11,15,10,Yes,No,Yes,Yes,Yes,"12:34 PM 12th Oct,22",2022-10-12 12:34,10
Ch Lekh Raj Multispeciality Hospital,Vill Gadhauli Yamuna Nagar,Yes (150),140,0,10,5,140,0,10,5,Yes,Yes,Yes,Yes,Yes,"2:46 PM 2nd Aug,22",2022-08-02 14:46,22
CHC Bilaspur,CHC Bilaspur,Yes (23),8,15,0,0,8,17,0,0,Yes,No,Yes,No,Yes,"2:42 PM 2nd Aug,22",2022-08-02 14:42,22
CHC Chhachharuli,CHC Chhachharuli,Yes (30),10,20,0,0,10,20,0,0,Yes,No,Yes,Yes,Yes,"2:42 PM 2nd Aug,22",2022-08-02 14:42,22
CHC Naharpur,Naharpur Yamuna Nagar,Yes (10),10,0,0,0,10,0,0,0,Yes,No,No,No,Yes,"2:46 PM 2nd Aug,22",2022-08-02 14:46,22
CHC Partap Nagar,CHC Partap Nagar,Yes (16),6,10,0,0,6,10,0,0,Yes,No,Yes,No,Yes,"2:42 PM 2nd Aug,22",2022-08-02 14:42,22
CHC Radaur,Radaur Yamuna Nagar,Yes (20),10,10,0,0,10,10,0,0,Yes,No,Yes,Yes,Yes,"2:46 PM 2nd Aug,22",2022-08-02 14:46,22
CHC Saraswati Nagar,CHC Saraswati Nagar,Yes (25),14,11,0,0,14,11,0,0,Yes,No,Yes,No,Yes,"2:43 PM 2nd Aug,22",2022-08-02 14:43,22
DABRA HOSPITAL Yamunanagar,DABRA HOSPITAL,Yes (23),11,8,4,2,11,8,4,2,No,No,No,No,No,"2:43 PM 2nd Aug,22",2022-08-02 14:43,22
Gaba Hospital,Gaba Hospital Yamunanagar,Yes (50),20,10,20,4,20,10,20,4,Yes,No,Yes,Yes,Yes,"2:41 PM 2nd Aug,22",2022-08-02 14:41,22
GULATI HOSPITAL,GULATI HOSPITAL,Yes (32),23,3,6,0,25,3,6,0,Yes,No,Yes,Yes,Yes,"2:43 PM 2nd Aug,22",2022-08-02 14:43,22
Indra Hospital,109 OPP ESI HOSPITAL JAGADHRI,Yes (30),20,5,5,2,20,5,5,2,Yes,No,Yes,Yes,Yes,"2:53 PM 2nd Aug,22",2022-08-02 14:53,22
JP Hospital Pvt,"Jagadhri Rd, near Luxmi Theater, Vishwakarma Mohalla, Yamuna Nagar,HARAYANA Haryana",Yes (43),15,15,13,2,15,15,13,2,Yes,No,Yes,Yes,Yes,"2:42 PM 2nd Aug,22",2022-08-02 14:42,22
KAPOOR HOSPITAL,"SH 6A Indira Colony Jagadhri, yamunanagart ,Haryana",Yes (12),4,0,8,0,4,0,8,0,Yes,No,Yes,Yes,Yes,"2:45 PM 2nd Aug,22",2022-08-02 14:45,22
KESHWANI HOSPITAL,"Jagadhri - Yamuna Nagar Rd, Tagore Garden, Yamuna Nagar, Haryana",Yes (10),10,0,0,0,10,0,0,0,Yes,No,Yes,Yes,Yes,"2:47 PM 2nd Aug,22",2022-08-02 14:47,22
Maxxwell Hospital,Jagadhari Yamuna Nagar,Yes (17),11,0,6,0,11,0,6,0,Yes,No,Yes,Yes,Yes,"2:43 PM 2nd Aug,22",2022-08-02 14:43,22
Mukand Lal District Civil Hospital Yamunanagar,Mukand Lal District Civil Hospital YNR,Yes (23),18,5,0,5,18,9,0,5,Yes,No,Yes,Yes,Yes,"2:43 PM 2nd Aug,22",2022-08-02 14:43,22
NIRMAL HOSPITAL,"199, Radaur Rd, near nirmal hospital, camp, Garhi Gujran, Haryana",Yes (20),13,1,6,0,13,1,6,0,Yes,No,Yes,Yes,Yes,"2:42 PM 2nd Aug,22",2022-08-02 14:42,22
RK Gupta,opp DAV Sr Sec School Near Madhu Hotel YNR,Yes (16),4,2,10,0,5,2,10,0,Yes,Yes,Yes,Yes,Yes,"2:46 PM 2nd Aug,22",2022-08-02 14:46,22
SABBARWAL HOSPITAL,"Gulab Nagar, Jagadhri, Haryana",Yes (13),6,1,6,0,6,1,6,0,Yes,No,Yes,Yes,Yes,"2:45 PM 2nd Aug,22",2022-08-02 14:45,22
Sachdeva Hospital,"2227, Civil Lines Rd, Sri Nagar Colony, Civil Lines, Gomti Mohalla, Jagadhri, Haryana",Yes (28),16,8,4,0,16,8,4,0,Yes,No,Yes,Yes,Yes,"2:47 PM 2nd Aug,22",2022-08-02 14:47,22
Santosh Hospital,"Santosh Hospital  Kanhaiya Sahib Chowk, near Govt.School, Harbanspura Colony, Gobind Pura, Yamuna Nagar, Haryana",Yes (28),5,9,14,2,5,9,14,2,Yes,No,Yes,Yes,Yes,"2:40 PM 2nd Aug,22",2022-08-02 14:40,22
SHARMA HOSPITAL,Near Agarsain Chowk Jagadhri,Yes (12),12,0,0,0,12,0,0,0,Yes,No,Yes,Yes,Yes,"2:46 PM 2nd Aug,22",2022-08-02 14:46,22
Shree Medical Care Hospital,"359/2, Jain nagar, Jagadhri, Haryana",Yes (15),15,0,0,0,15,0,0,0,Yes,Yes,Yes,Yes,Yes,"2:47 PM 2nd Aug,22",2022-08-02 14:47,22
Shureshtha Hospital,Model Colony YNR,Yes (12),9,1,2,0,9,1,2,0,Yes,No,Yes,Yes,Yes,"2:47 PM 2nd Aug,22",2022-08-02 14:47,22
SP Hospital Jag,S.P Hospital Jag,Yes (7),4,0,3,1,4,0,3,1,Yes,No,Yes,Yes,Yes,"2:44 PM 2nd Aug,22",2022-08-02 14:44,22
Swami Vivekanand Hospital Yamunanagar,"Swami Vivekanand Hospital,Yamuna Nagar, Haryana",Yes (49),20,10,19,1,20,10,19,1,Yes,No,Yes,Yes,Yes,"2:45 PM 2nd Aug,22",2022-08-02 14:45,22
Swastik Hospital,"Basant Nagar, Yamuna Nagar, Haryana",Yes (6),4,2,0,0,4,2,0,0,Yes,No,Yes,Yes,Yes,"2:48 PM 2nd Aug,22",2022-08-02 14:48,22
VARDAAN HOSPITAL,OPP KOHLI HOSPITAL NEAR AGARSEN COLLEGE JAGADHRI,Yes (10),8,2,0,0,8,2,0,0,Yes,No,Yes,Yes,Yes,"2:47 PM 2nd Aug,22",2022-08-02 14:47,22