name,address,Availability_availability_of_beds,Availability_oxygen_beds,Availability_non_oxygen_beds,Availability_i_c_u_beds,Availability_ventilators,Allocated_oxygen_beds,Allocated_non_oxygen_beds,Allocated_i_c_u,Allocated_ventilators,Availability_availability_of_oxygen,Availability_antiviral_remdesivir_etc_,Availability_steroids,Availability_anticoagulant,Availability_antipyretic,updated_on_unparsed,updated_on,city
Adiyogi Arogya Avenue,"232, Subhash Nagar, Near civil hospital back gate, Jhajjar",Yes (15),7,2,6,1,7,2,6,1,To Be Updated,To Be Updated,Yes,Yes,Yes,"5:15 PM 7th Jun,22",2022-06-07 17:15,8
"Advanta Hospital, Jhajjar city","Silani Gate, Jhajjar, Haryana",Yes (50),24,10,16,1,24,10,16,1,Yes,To Be Updated,Yes,To Be Updated,Yes,"1:50 PM 3rd Mar,22",2022-03-03 13:50,8
"Brahm Shakti Sanjivani Hospital, B.garh","Opp. BSNL Exchange, Delhi - Rohtak Road, NH9, Bahadurgarh, Haryana",Yes (100),60,20,20,3,60,20,20,3,Yes,No,Yes,Yes,Yes,"5:12 PM 7th Jun,22",2022-06-07 17:12,8
Civil Hospital Jhajjar,"Jhajjar, NH-71, Jhajjar Rohtak Road, Jhajjar, Jhajjar, Haryana",Yes (38),33,0,5,5,33,0,5,5,Yes,To Be Updated,To Be Updated,To Be Updated,To Be Updated,"5:14 PM 7th Jun,22",2022-06-07 17:14,8
"Delhi Hospital, Bahadurgarh","Rohtak Rd, near Shyamji Complex, Ram Nagar, Bahadurgarh, Haryana",Yes (50),20,20,10,2,20,20,10,2,Yes,No,Yes,Yes,Yes,"5:12 PM 7th Jun,22",2022-06-07 17:12,8
Dr. Sanjay Multi Speciality Hospital,INFRONT OF CIVIL HOSPITAL BAHADURGARH,Yes (61),45,10,6,1,45,10,6,1,Yes,No,No,To Be Updated,To Be Updated,"1:50 PM 3rd Mar,22",2022-03-03 13:50,8
"Jeewan Jyoti Hospital, Bahadurgarh","Rohtak Rd, MIE Part-B, Bahadurgarh, Haryana",Yes (143),70,68,5,4,70,68,5,4,Yes,To Be Updated,To Be Updated,To Be Updated,To Be Updated,"6:34 PM 15th Jun,22",2022-06-15 18:34,8
"JK Hospital, Bahadurgarh","Bahadurgarh,, Bahamnoli, Bahadurgarh, Haryana",No (0),0,0,0,0,0,0,0,0,To Be Updated,To Be Updated,To Be Updated,To Be Updated,To Be Updated,"11:42 AM 15th Jun,22",2022-06-15 11:42,8
"Medicare Super Speciality Hospiatl &amp; Trauma Centre, Jhajjar City","Dadri road Jhajjar, Jhajjar, Haryana",Yes (50),15,23,12,3,15,23,12,3,Yes,To Be Updated,Yes,To Be Updated,Yes,"1:50 PM 3rd Mar,22",2022-03-03 13:50,8
"Mission Hospital, Bahadurgarh","Near main Bus Stand & City Metro Station, Rohtak Rd, Bahadurgarh, Jhajjar ,Haryana",Yes (33),25,0,8,4,25,0,8,4,To Be Updated,No,Yes,Yes,No,"1:50 PM 3rd Mar,22",2022-03-03 13:50,8
"Oscar Hospital, JJR city","Civil Road,Opp Civil Hospital, Jhajjar, Haryana",Yes (80),8,58,14,1,8,58,14,1,To Be Updated,To Be Updated,To Be Updated,To Be Updated,To Be Updated,"1:50 PM 3rd Mar,22",2022-03-03 13:50,8
Oxymus Hospital,"Opposite Civil Hospital, Near Metro Pollar No. 876 Delhi Rohtak Road, Bahadurgarh",Yes (10),4,0,6,0,4,0,6,0,Yes,No,No,No,No,"5:15 PM 7th Jun,22",2022-06-07 17:15,8
"Rana Hospital, Bahadurgarh","OPP. REST HOUSE,OLD BARAHI ROAD, BAHADURGARH",Yes (25),18,0,7,2,18,0,7,2,To Be Updated,To Be Updated,No,No,Yes,"5:15 PM 7th Jun,22",2022-06-07 17:15,8
"RJ Super Speciality Hospital, B.garh","Delhi - Rohtak Rd, Near Rajesh Joon Office, Dalbir Nagar, Bahadurgarh, Haryana",Yes (17),10,5,2,1,10,5,2,1,Yes,No,Yes,Yes,Yes,"5:12 PM 7th Jun,22",2022-06-07 17:12,8
RS GAUR GLOBAL MULTISPECIALITY HOSPITAL,"Jhajjar Road Netaji Subhash Vihar, Haryana",Yes (33),19,7,7,2,19,7,7,2,Yes,No,Yes,Yes,Yes,"1:50 PM 3rd Mar,22",2022-03-03 13:50,8
"SDH, Bahadurgarh","Madhya Marg, Old Industrial Area, Bahadurgarh, Haryana",Yes (35),27,0,8,8,27,0,8,8,Yes,Yes,Yes,No,Yes,"1:50 PM 3rd Mar,22",2022-03-03 13:50,8
"Shivam Hospital, B.garh","Line Par, Shastri Nagar, Netaji Nagar, Bahadurgarh, Haryana",Yes (51),30,15,6,1,30,15,6,1,Yes,No,Yes,Yes,Yes,"5:12 PM 7th Jun,22",2022-06-07 17:12,8
"Swastik Hospital, Bahadurgarh","Jhajjar Rd, Shakti Nagar, Sakti Nagar, Bahadurgarh, Haryana",Yes (40),26,4,10,2,26,4,10,2,Yes,No,Yes,Yes,Yes,"1:50 PM 3rd Mar,22",2022-03-03 13:50,8
World College Of Medical Sciences And Hospital,"Jhajjar Sampla Road, Gurwar, Jhajjar, Haryana",Yes (250),90,135,25,4,90,135,25,4,Yes,Yes,Yes,Yes,Yes,"5:12 PM 7th Jun,22",2022-06-07 17:12,8
GH Charkhi Dadri,"Near Loharu Chowk,Charkhi Dadri",Yes (51),35,15,1,11,35,15,1,11,Yes,Yes,Yes,Yes,Yes,"9:40 AM 15th Jun,22",2022-06-15 09:40,3
Jaihind Hospital,Charkhi Dadri,Yes (13),7,1,5,0,7,1,5,0,Yes,Yes,Yes,To Be Updated,To Be Updated,"5:15 PM 7th Jun,22",2022-06-07 17:15,3
Murari Lal Rasiwasia Ayurvedic Hospital,"Delhi Road,Near Janta College",Yes (70),60,10,0,0,60,10,0,0,Yes,Yes,Yes,Yes,Yes,"9:40 AM 15th Jun,22",2022-06-15 09:40,3
Oscar Hospital,Charkhi Dadri,Yes (20),0,0,20,0,0,0,20,0,To Be Updated,To Be Updated,To Be Updated,To Be Updated,To Be Updated,"5:15 PM 7th Jun,22",2022-06-07 17:15,3
Pradhan Medicare Centre,"Loharu Rd, Charkhi Dadri, Haryana",Yes (17),14,0,3,0,14,0,3,0,To Be Updated,Yes,Yes,Yes,Yes,"9:40 AM 15th Jun,22",2022-06-15 09:40,3
Sunflag Hospital,Charkhi Dadri,Yes (12),6,0,6,0,6,0,6,0,To Be Updated,To Be Updated,To Be Updated,To Be Updated,To Be Updated,"5:15 PM 7th Jun,22",2022-06-07 17:15,3
Ch Lekh Raj Multispeciality Hospital,Vill Gadhauli Yamuna Nagar,Yes (150),140,0,10,5,140,0,10,5,Yes,Yes,Yes,Yes,Yes,"11:21 AM 15th Jun,22",2022-06-15 11:21,22
CHC Bilaspur,CHC Bilaspur,Yes (23),8,15,0,0,8,17,0,0,Yes,No,Yes,No,Yes,"11:04 AM 15th Jun,22",2022-06-15 11:04,22
CHC Chhachharuli,CHC Chhachharuli,Yes (30),10,20,0,0,10,20,0,0,Yes,No,Yes,Yes,Yes,"11:04 AM 15th Jun,22",2022-06-15 11:04,22
CHC Naharpur,Naharpur Yamuna Nagar,Yes (10),10,0,0,0,10,0,0,0,Yes,No,No,No,Yes,"11:22 AM 15th Jun,22",2022-06-15 11:22,22
CHC Partap Nagar,CHC Partap Nagar,Yes (16),6,10,0,0,6,10,0,0,Yes,No,Yes,No,Yes,"11:05 AM 15th Jun,22",2022-06-15 11:05,22
CHC Radaur,Radaur Yamuna Nagar,Yes (20),10,10,0,0,10,10,0,0,Yes,No,Yes,Yes,Yes,"11:22 AM 15th Jun,22",2022-06-15 11:22,22
CHC Saraswati Nagar,CHC Saraswati Nagar,Yes (25),14,11,0,0,14,11,0,0,Yes,No,Yes,No,Yes,"11:05 AM 15th Jun,22",2022-06-15 11:05,22
DABRA HOSPITAL Yamunanagar,DABRA HOSPITAL,Yes (23),11,8,4,2,11,8,4,2,No,No,No,No,No,"11:05 AM 15th Jun,22",2022-06-15 11:05,22
ESI Hospital,"ESI Hospital, Jagadhri",Yes (58),36,0,22,0,36,0,22,0,Yes,No,Yes,Yes,Yes,"11:03 AM 15th Jun,22",2022-06-15 11:03,22
Gaba Hospital,Gaba Hospital Yamunanagar,Yes (50),20,10,20,4,20,10,20,4,Yes,No,Yes,Yes,Yes,"11:02 AM 15th Jun,22",2022-06-15 11:02,22
GULATI HOSPITAL,GULATI HOSPITAL,Yes (32),23,3,6,0,25,3,6,0,Yes,No,Yes,Yes,Yes,"11:06 AM 15th Jun,22",2022-06-15 11:06,22
Heart Care Center Hospital,Near Lal Dwara Mandir Yamuna Nagar,Yes (19),2,2,15,7,2,2,15,7,Yes,No,Yes,Yes,Yes,"11:04 AM 15th Jun,22",2022-06-15 11:04,22
JP Hospital Pvt,"Jagadhri Rd, near Luxmi Theater, Vishwakarma Mohalla, Yamuna Nagar,HARAYANA Haryana",Yes (43),15,15,13,2,15,15,13,2,Yes,No,Yes,Yes,Yes,"11:03 AM 15th Jun,22",2022-06-15 11:03,22
KAPOOR HOSPITAL,"SH 6A Indira Colony Jagadhri, yamunanagart ,Haryana",Yes (12),4,0,8,0,4,0,8,0,Yes,No,Yes,Yes,Yes,"11:10 AM 15th Jun,22",2022-06-15 11:10,22
KESHWANI HOSPITAL,"Jagadhri - Yamuna Nagar Rd, Tagore Garden, Yamuna Nagar, Haryana",Yes (10),10,0,0,0,10,0,0,0,Yes,No,Yes,Yes,Yes,"11:23 AM 15th Jun,22",2022-06-15 11:23,22
Maxxwell Hospital,Jagadhari Yamuna Nagar,Yes (17),11,0,6,0,11,0,6,0,Yes,No,Yes,Yes,Yes,"11:06 AM 15th Jun,22",2022-06-15 11:06,22
Mukand Lal District Civil Hospital Yamunanagar,Mukand Lal District Civil Hospital YNR,Yes (27),18,9,0,5,18,9,0,5,Yes,No,Yes,Yes,Yes,"11:06 AM 15th Jun,22",2022-06-15 11:06,22
NIRMAL HOSPITAL,"199, Radaur Rd, near nirmal hospital, camp, Garhi Gujran, Haryana",Yes (20),13,1,6,0,13,1,6,0,Yes,No,Yes,Yes,Yes,"11:03 AM 15th Jun,22",2022-06-15 11:03,22
RK Gupta,opp DAV Sr Sec School Near Madhu Hotel YNR,Yes (17),0,2,15,0,0,2,15,0,Yes,Yes,Yes,Yes,Yes,"11:22 AM 15th Jun,22",2022-06-15 11:22,22
SABBARWAL HOSPITAL,"Gulab Nagar, Jagadhri, Haryana",Yes (13),6,1,6,0,6,1,6,0,Yes,No,Yes,Yes,Yes,"11:15 AM 15th Jun,22",2022-06-15 11:15,22
Sachdeva Hospital,"2227, Civil Lines Rd, Sri Nagar Colony, Civil Lines, Gomti Mohalla, Jagadhri, Haryana",Yes (28),16,8,4,0,16,8,4,0,Yes,No,Yes,Yes,Yes,"11:23 AM 15th Jun,22",2022-06-15 11:23,22
Santosh Hospital,"Santosh Hospital  Kanhaiya Sahib Chowk, near Govt.School, Harbanspura Colony, Gobind Pura, Yamuna Nagar, Haryana",Yes (28),5,9,14,2,5,9,14,2,Yes,No,Yes,Yes,Yes,"11:00 AM 15th Jun,22",2022-06-15 11:00,22
SHARMA HOSPITAL,Near Agarsain Chowk Jagadhri,Yes (12),12,0,0,0,12,0,0,0,Yes,No,Yes,Yes,Yes,"11:21 AM 15th Jun,22",2022-06-15 11:21,22
Shree Medical Care Hospital,"359/2, Jain nagar, Jagadhri, Haryana",Yes (15),15,0,0,0,15,0,0,0,Yes,Yes,Yes,Yes,Yes,"11:24 AM 15th Jun,22",2022-06-15 11:24,22
Shureshtha Hospital,Model Colony YNR,Yes (12),9,1,2,0,9,1,2,0,Yes,No,Yes,Yes,Yes,"11:22 AM 15th Jun,22",2022-06-15 11:22,22
SP Hospital Jag,S.P Hospital Jag,Yes (7),4,0,3,1,4,0,3,1,Yes,No,Yes,Yes,Yes,"11:07 AM 15th Jun,22",2022-06-15 11:07,22
Swami Vivekanand Hospital Yamunanagar,"Swami Vivekanand Hospital,Yamuna Nagar, Haryana",Yes (49),20,10,19,1,20,10,19,1,Yes,No,Yes,Yes,Yes,"11:09 AM 15th Jun,22",2022-06-15 11:09,22
Swastik Hospital,"Basant Nagar, Yamuna Nagar, Haryana",Yes (6),4,2,0,0,4,2,0,0,Yes,No,Yes,Yes,Yes,"11:25 AM 15th Jun,22",2022-06-15 11:25,22
tejli stadium,64 A Tejli,Yes (76),20,56,0,0,20,56,0,0,Yes,No,No,No,Yes,"11:09 AM 15th Jun,22",2022-06-15 11:09,22
VARDAAN HOSPITAL,OPP KOHLI HOSPITAL NEAR AGARSEN COLLEGE JAGADHRI,Yes (10),8,2,0,0,8,2,0,0,Yes,No,Yes,Yes,Yes,"11:24 AM 15th Jun,22",2022-06-15 11:24,22