name,address,Availability_availability_of_beds,Availability_oxygen_beds,Availability_non_oxygen_beds,Availability_i_c_u_beds,Availability_ventilators,Allocated_oxygen_beds,Allocated_non_oxygen_beds,Allocated_i_c_u,Allocated_ventilators,Availability_availability_of_oxygen,Availability_antiviral_remdesivir_etc_,Availability_steroids,Availability_anticoagulant,Availability_antipyretic,updated_on_unparsed,updated_on,city
Kamal hospital and maternity centre,"Sector 66-68, Sohna Road, Badshahpur, Gurugram, Haryana",Yes (11),5,0,6,1,5,0,6,1,Yes,No,Yes,Yes,Yes,"5:14 PM 7th Jun,22",2022-06-07 17:14,6
Kamla Hospital,"Pataudi Road NEAR RADHA SWAMI SATSANG BHAVAN, Kadipur Industrial Area, Sector 37C, Gurugram",Yes (25),13,7,5,0,13,7,5,0,Yes,No,Yes,Yes,Yes,"11:55 AM 18th Jun,22",2022-06-18 11:55,6
Kathuria Hospital,"9/8, Modal Town, Opp. S.D. School, Khandsa Road, Gurugram",Yes (19),7,0,12,2,8,0,12,2,To Be Updated,To Be Updated,To Be Updated,To Be Updated,To Be Updated,"10:28 AM 2nd Dec,22",2022-12-02 10:28,6
Kriti Hospital Gurugram,"Plot No. 13, Sector 56, Gurugram, Haryana-122002",Yes (49),40,0,9,3,40,0,9,3,Yes,No,Yes,Yes,Yes,"5:01 PM 2nd Dec,22",2022-12-02 17:01,6
LORD KRISHNA HOSPITAL,Wazirpur roaz near anaz mandi farrukhnagar Distict Gurgaon,Yes (21),20,0,1,1,20,0,1,1,To Be Updated,No,Yes,Yes,Yes,"5:15 PM 7th Jun,22",2022-06-07 17:15,6
Lotus Hospital Gurugram,"389, 3, Mata Rd, Prem Nagar, Sector 13, Gurugram, Haryana",Yes (10),7,0,3,0,7,0,3,0,Yes,No,No,No,No,"5:14 PM 7th Jun,22",2022-06-07 17:14,6
Madalasa Hospital,"NH-3,BEHIND HUDA MARKET,SECTOR-46,GURGAON,HARYANA",Yes (16),10,0,6,0,10,0,6,0,Yes,To Be Updated,Yes,Yes,Yes,"5:14 PM 7th Jun,22",2022-06-07 17:14,6
MAHADEV HOSPITAL,"876, 2, Mata Rd, near Bus Stand, Rajiv Nagar, Sector 12, Gurugram, Haryana",Yes (20),12,0,8,1,12,0,8,1,Yes,No,Yes,Yes,Yes,"1:50 PM 3rd Mar,22",2022-03-03 13:50,6
Mamta Hospital,"877/2, Mata Road,Near Haryana Roadways Workshop, Gurugram",Yes (27),20,0,7,1,20,0,7,1,Yes,No,Yes,Yes,Yes,"10:16 AM 5th Aug,22",2022-08-05 10:16,6
Mangalam Hospital,"Gandhi Nagar Rd, Gandhi Nagar, Sector 11, Gurugram, Haryana",Yes (9),9,0,0,0,9,0,0,0,Yes,No,Yes,Yes,Yes,"5:14 PM 7th Jun,22",2022-06-07 17:14,6
MANTHAN HOSPITAL &amp; NEURO PSYCHIATRY CENTRE,"Plot No.4, Near JBM Gate No.2 Nead Sri Gopal Industries, Pace City-II Sector 36 Mohammadpur Jharsa, Road, Gurugram, Haryana",No (0),0,0,0,0,0,0,0,0,To Be Updated,To Be Updated,To Be Updated,To Be Updated,To Be Updated,"1:50 PM 3rd Mar,22",2022-03-03 13:50,6
Max Hospital,"B Block, Sushant Lok 1, Near Huda City Centre, Gurugram",Yes (49),43,0,6,4,43,0,6,4,Yes,Yes,Yes,Yes,Yes,"10:46 AM 15th Jun,22",2022-06-15 10:46,6
Mayom Hospital,"D-Block, 19, South City Rd Number 1, Block G, South City I, Sector 41, Gurugram",Yes (75),54,5,16,4,54,5,16,4,Yes,No,Yes,Yes,Yes,"11:54 AM 15th Jun,22",2022-06-15 11:54,6
Medanta the Medicity,"CH Baktawar Singh Rd, Near Olympus, Medicity, Islampur Colony, Sector 38, Gurugram",Yes (215),141,0,74,13,141,0,75,15,Yes,Yes,Yes,Yes,Yes,"11:14 AM 14th Sep,22",2022-09-14 11:14,6
Medeor Hospital,"Plot no 2, Sector 5, IMT Manesar, Gurugram",Yes (75),57,0,18,12,57,0,18,12,Yes,Yes,Yes,Yes,Yes,"1:06 PM 25th Jul,22",2022-07-25 13:06,6
MEDOX HOSPITAL,"Bhondsi, Sohna Rd, Gurugram, Haryana",Yes (29),25,0,4,2,25,0,4,2,To Be Updated,To Be Updated,To Be Updated,To Be Updated,To Be Updated,"1:04 PM 25th Sep,22",2022-09-25 13:04,6
Metro Hospital,"H Block, Chauma Village, Sector 1, Palam Vihar, Gurugram",Yes (83),27,0,56,8,27,0,56,8,Yes,No,Yes,Yes,Yes,"9:27 AM 2nd Dec,22",2022-12-02 09:27,6
Miracles Apollo Cradle/Spectra,"Plot no.45,Vatika India Next, sector 82,Gurugram",Yes (5),5,0,0,0,5,0,0,0,Yes,No,To Be Updated,To Be Updated,To Be Updated,"1:50 PM 3rd Mar,22",2022-03-03 13:50,6
Naryana Hospital,"Plot 3201, Block - V, DLF Phase - III, Nathupur, Sector 24, Gurugram",Yes (68),35,13,20,6,35,13,20,6,Yes,Yes,Yes,Yes,Yes,"9:33 AM 2nd Dec,22",2022-12-02 09:33,6
Nivaran multispeciality Hospital,"Plot no 13 A , Noble enclave ,opp Maruti Udyog,old delhi road Gurugram 122017",Yes (45),40,0,5,0,40,0,5,0,Yes,No,Yes,Yes,Yes,"9:04 AM 2nd Dec,22",2022-12-02 09:04,6
Orbit Hospital,"Sec 32, Main Jharsa Road, Gurugram",Yes (16),12,0,4,0,12,0,4,0,Yes,No,Yes,Yes,Yes,"11:31 AM 1st Dec,22",2022-12-01 11:31,6
Paras Hospital,"Phase- I, Paras Hospitals, C-1, Sushant Lok Phase I, Sector 43, Gurugram",Yes (177),117,14,46,14,117,14,46,14,Yes,Yes,Yes,Yes,Yes,"8:20 AM 2nd Dec,22",2022-12-02 08:20,6
Park Hospital gurugram,"Q Block South City 2, Sohna Rd, Main, Sector 47, Gurugram",Yes (90),32,0,58,30,32,0,58,30,Yes,No,To Be Updated,Yes,Yes,"11:12 AM 2nd Dec,22",2022-12-02 11:12,6
Polaris Hospital,"Opp. Raheja Mall, Sohna Road, Sector-48,Gurugram, near Vipul Business Park, Gurugram",Yes (16),4,12,0,0,4,12,0,0,Yes,Yes,Yes,Yes,Yes,"9:10 AM 17th Sep,22",2022-09-17 09:10,6
"Police Hospital, RTC, BHONDSI","RTC, BHONDSI, Gurgaon",Yes (50),50,0,0,0,50,0,0,0,To Be Updated,To Be Updated,To Be Updated,To Be Updated,To Be Updated,"1:50 PM 3rd Mar,22",2022-03-03 13:50,6
"Poly Clinic Sector 31, Gurugram","388, LIG Colony, Sector 31, Gurugram",Yes (10),7,3,0,0,7,3,0,0,Yes,Yes,No,No,Yes,"10:04 AM 2nd Dec,22",2022-12-02 10:04,6
Prahlad Singh Memorial Hospital,,No (0),0,0,0,0,0,0,0,0,To Be Updated,To Be Updated,To Be Updated,To Be Updated,To Be Updated,"1:50 PM 3rd Mar,22",2022-03-03 13:50,6
Prakash Hospital and Trauma Centre,"NH 8, Manesar Bus Stand, Manesar, Gurugram",Yes (36),16,15,5,0,16,15,5,0,Yes,No,Yes,Yes,Yes,"9:06 AM 2nd Aug,22",2022-08-02 09:06,6
Pushpanjali Hospital,"Civil Line Road, near Rajiv Chowk, Gurugram",Yes (33),18,0,15,2,18,0,15,2,Yes,No,Yes,Yes,Yes,"9:19 AM 2nd Aug,22",2022-08-02 09:19,6
Rathore IMT Hospital and Trauma Centre,"Sec-7, Near Anant Raj Chowk, IMT Manesar, Gurugram (HR)",Yes (15),10,0,5,0,10,0,5,0,Yes,No,Yes,Yes,Yes,"2:03 PM 2nd Dec,22",2022-12-02 14:03,6
RBS HOSPITAL,"U Block, DLF Phase 3 Rao Balbir Singh, Market, U-37 Rd, Nathupur, Sector 24, Gurugram, Haryana",Yes (15),10,0,5,1,10,0,5,1,Yes,No,To Be Updated,To Be Updated,To Be Updated,"2:15 PM 30th Jul,22",2022-07-30 14:15,6
Safe Hands Hospital,"Plot No. 68-P, Sector 46, Gurugram, Haryana",Yes (18),13,0,5,2,13,0,5,2,Yes,No,Yes,Yes,Yes,"2:10 PM 3rd Aug,22",2022-08-03 14:10,6
SAI SIDDHI HOSPITAL,"82-P, Residency Green, Jal Vihar Colony, Sector 46, Gurugram, Haryana",Yes (14),4,4,6,0,4,4,6,0,Yes,To Be Updated,To Be Updated,Yes,Yes,"3:21 PM 4th Jul,22",2022-07-04 15:21,6
Samvit Health Care,"1, Sohna Rd, Islampur Village, Sector 38, Gurugram, Haryana",Yes (19),8,6,5,1,8,6,5,1,Yes,Yes,No,No,No,"1:50 PM 3rd Mar,22",2022-03-03 13:50,6
Sanjeevani hospital,"Near Radha Krishan Mandir, Sohna - Gurgaon Rd, opposite Corporation Bank, Badshahpur, Sector 66, Gurugram, Haryana",Yes (20),15,0,5,1,15,0,5,1,To Be Updated,No,Yes,Yes,Yes,"5:42 PM 4th Jul,22",2022-07-04 17:42,6
SARASWATI HOSPITAL,"299/2, OLD DELHI ROAD, ANAMIKA ENCLAVE, GURUGRAM-122001",Yes (15),5,5,5,1,5,5,5,1,Yes,No,Yes,Yes,Yes,"9:55 AM 9th Nov,22",2022-11-09 09:55,6
Sarvodya Hospital gurugram,"1031/1, Old Railway Rd, Sector 5, Gurugram, Haryana",Yes (20),14,0,6,0,14,0,6,1,Yes,To Be Updated,Yes,Yes,Yes,"5:15 PM 7th Jun,22",2022-06-07 17:15,6
Satyam Medicare Hospital,C-2 17 dlf phase 1 Arjun marg,Yes (25),21,0,4,1,21,0,4,1,Yes,No,No,No,No,"1:50 PM 3rd Mar,22",2022-03-03 13:50,6
SDH PATAUDI,"SDCH pataudi, gurugram",Yes (10),10,0,0,0,10,0,0,0,Yes,Yes,Yes,Yes,Yes,"9:55 AM 30th Sep,22",2022-09-30 09:55,6
SDH SOHNA,"Baluda Rd, Rajoria Nagar, Sohna, Haryana",Yes (25),25,0,0,0,25,0,0,0,Yes,Yes,Yes,Yes,Yes,"10:21 AM 2nd Aug,22",2022-08-02 10:21,6
Sethi Hospital,"02, 301, 4, Basai Rd, Model Town, Gurugram",Yes (22),18,0,4,0,18,0,4,0,No,To Be Updated,Yes,Yes,To Be Updated,"10:17 AM 9th Sep,22",2022-09-09 10:17,6
"SGT Medical College &amp; Research Institute, Budhera","C/o Shree Guru Gobind Singh Tricentenary University, Inner College Road, Budhera, Gurugram",Yes (360),60,244,56,15,60,244,56,15,To Be Updated,To Be Updated,To Be Updated,To Be Updated,To Be Updated,"10:11 AM 2nd Dec,22",2022-12-02 10:11,6
Sheetla Hospital,"Near DSD College, New Railway Road, Gurugram",Yes (31),21,5,5,0,21,5,5,0,Yes,Yes,Yes,Yes,Yes,"1:50 PM 3rd Mar,22",2022-03-03 13:50,6
Shiva hospital,287/2 mata road sec 12 a near Singha chowk,Yes (14),7,0,7,1,7,0,7,1,Yes,No,Yes,Yes,Yes,"11:25 AM 14th Sep,22",2022-09-14 11:25,6
Shivpriya holistic health hospital,Bajgheda Chowk New palam vihar phase 1 gurugram 122017,No (0),0,0,0,0,5,0,0,0,Yes,No,Yes,Yes,Yes,"8:33 AM 17th Nov,22",2022-11-17 08:33,6
Shri Balaji Multispeciality Hospital,"Sector 9/10, Basai Chonk, Basai Road, Gurugram",Yes (32),27,0,5,1,27,0,5,1,Yes,No,To Be Updated,To Be Updated,To Be Updated,"11:34 AM 21st Oct,22",2022-10-21 11:34,6
Shri Govind Hospital,"601, 20, Madanpuri Rd, Manohar Nagar, Sector 7, Gurugram",Yes (24),14,10,0,0,14,10,0,0,Yes,No,Yes,Yes,Yes,"11:18 AM 29th Sep,22",2022-09-29 11:18,6
Signature Hospital,"Near Euro International School, Sector 37D, Gurugram",Yes (79),50,0,29,8,51,0,32,8,Yes,Yes,Yes,Yes,Yes,"9:21 AM 2nd Aug,22",2022-08-02 09:21,6
Sona Devi Memorial Hospital,Sona Devi Memorial Hospital Badshahpur,Yes (6),6,0,0,0,6,0,0,0,Yes,No,Yes,Yes,Yes,"5:15 PM 7th Jun,22",2022-06-07 17:15,6
SPES HOSPITAL,"369/20 SHANTI NAGAR SEC- 11, GURGAON",Yes (28),15,0,13,3,15,0,13,3,No,No,Yes,No,No,"10:09 AM 31st Jul,22",2022-07-31 10:09,6
sukhda hospital and maternity centre llp,"PATAUDI ROAD, KADIPUR INDUSTRIAL AREA, GURGAON HARYANA",Yes (22),18,0,4,0,20,0,4,1,Yes,No,No,No,No,"5:15 PM 7th Jun,22",2022-06-07 17:15,6
Sukhdai hospital,Shanti kunj part 2 Bhondsi Gurgaon,Yes (20),20,0,0,1,20,0,2,1,Yes,Yes,Yes,Yes,Yes,"5:15 PM 7th Jun,22",2022-06-07 17:15,6
Sunrise Hospital,"Near Sector 10 A, Gurugram",Yes (44),18,11,15,6,18,11,15,6,Yes,No,Yes,Yes,Yes,"9:33 AM 2nd Dec,22",2022-12-02 09:33,6
"SWAMI AMARDEV HOSPITAL Patudi , Gurugram","Ashram Hari Mandir, Pataudi, Haryana",No (0),0,0,0,0,0,0,0,0,To Be Updated,To Be Updated,To Be Updated,To Be Updated,To Be Updated,"5:15 PM 7th Jun,22",2022-06-07 17:15,6
"Swastik Hospital , Gurugram","Sohna Road, Main, Sohna - Gurgaon Rd, Badshahpur, Sector 66, Gurugram, Haryana",No (0),0,0,0,0,0,0,0,0,Yes,Yes,Yes,Yes,Yes,"9:07 PM 11th Nov,22",2022-11-11 21:07,6
TIRATH RAM HOSPITAL PVT LTD.,163/20 BASAI ROAD GURGAON,Yes (30),20,0,10,2,20,0,10,2,Yes,No,Yes,Yes,Yes,"1:50 PM 3rd Mar,22",2022-03-03 13:50,6
Triveni hospital,"Near Canara Bank, Near Dhobi Ghaat, Old Railway Rd, Sector 8, Gurugram, Haryana",Yes (20),14,0,6,0,14,0,6,0,Yes,No,Yes,Yes,Yes,"11:00 PM 15th Jun,22",2022-06-15 23:00,6
Tulasi Healthcare,"Sector 64, next to Shriram millennium school, Gurugram, Haryana",Yes (20),0,20,0,0,0,20,0,0,Yes,No,Yes,Yes,No,"1:50 PM 3rd Mar,22",2022-03-03 13:50,6
UMA SANJEEVANI HEATH CENTRE PVT LTD,01 DAKSHIN MARG DLF CITY PHASE II MG ROAD GURGAON,Yes (10),10,0,0,0,10,0,0,0,Yes,To Be Updated,To Be Updated,To Be Updated,To Be Updated,"5:15 PM 7th Jun,22",2022-06-07 17:15,6
"Umang Hospital, Gurugram",,No (0),0,0,0,0,0,0,0,0,To Be Updated,To Be Updated,To Be Updated,To Be Updated,To Be Updated,"1:50 PM 3rd Mar,22",2022-03-03 13:50,6
Umkal Hospital,"A-5/20 Sushant Lok-1, Gurugram",Yes (35),20,9,6,2,20,10,7,2,Yes,Yes,Yes,Yes,Yes,"11:55 AM 2nd Aug,22",2022-08-02 11:55,6
Vaishnavi nursing home,"Delhi - Jaipur Expy, Sector 33, Gurugram, Haryana",Yes (6),2,4,0,0,2,4,0,0,Yes,No,Yes,Yes,Yes,"2:09 PM 17th Jun,22",2022-06-17 14:09,6
Vardaan Hospital and Trauma Centre,"Opposite Devi Lal Stadium, Ward # 5, Sohna Gurugram",Yes (22),17,0,5,1,17,0,5,1,Yes,Yes,Yes,Yes,Yes,"1:50 PM 3rd Mar,22",2022-03-03 13:50,6
Vedic hospital,L c Umang Bhardwaj chowk main Pataudi road gurugram,Yes (15),15,0,0,0,15,0,5,1,To Be Updated,To Be Updated,To Be Updated,To Be Updated,To Be Updated,"12:34 PM 18th Sep,22",2022-09-18 12:34,6
VS hospital,Hayatpur chowk sec 93 ggn,Yes (14),10,0,4,0,10,0,4,0,To Be Updated,To Be Updated,To Be Updated,To Be Updated,To Be Updated,"5:14 PM 7th Jun,22",2022-06-07 17:14,6
W.Pratiksha Hospital,"Golf Course Ext Rd, Sushant Lok-II, Shushant Lok 2, Sector 56, Gurugram",Yes (19),12,0,7,2,12,0,7,2,To Be Updated,To Be Updated,To Be Updated,To Be Updated,To Be Updated,"11:06 AM 21st Jul,22",2022-07-21 11:06,6
"Ayurvedic Medical College, Patikra",HUDA Sec. 1 Narnaul,Yes (192),35,157,0,0,40,160,0,0,Yes,Yes,Yes,Yes,Yes,"5:13 PM 7th Jun,22",2022-06-07 17:13,13
CHC ATELI,CHC ATELI,Yes (20),15,5,0,0,15,5,0,0,Yes,Yes,Yes,Yes,Yes,"2:04 PM 15th Jun,22",2022-06-15 14:04,13
CHC Kanina,Kanina,Yes (27),15,12,0,0,15,12,0,0,To Be Updated,To Be Updated,To Be Updated,To Be Updated,To Be Updated,"3:34 PM 15th Jun,22",2022-06-15 15:34,13
CHC Nangal Chaudhary,chc nangal choudhary,Yes (5),Beds Over Utilized 5,5,0,0,5,5,0,0,No,No,Yes,No,Yes,"2:09 PM 15th Jun,22",2022-06-15 14:09,13
CHC Sehlang,CHC SEHLANG,Yes (9),5,4,0,0,5,4,0,0,Yes,Yes,Yes,Yes,Yes,"9:52 AM 21st Jun,22",2022-06-21 09:52,13
Civil Hospital Narnaul,"Housing Board, Narnaul",Yes (80),80,0,0,10,80,0,0,10,Yes,Yes,Yes,Yes,Yes,"10:56 AM 20th Jun,22",2022-06-20 10:56,13
Jaipur Heart &amp; Multi Speciality Hospital,"Opp. Sadar Thana, Narnaul",Yes (13),6,3,4,2,6,3,4,2,Yes,Yes,Yes,Yes,Yes,"5:14 PM 7th Jun,22",2022-06-07 17:14,13
LAXMI NARAYANAN,"Laxmi Narayanan Hospital , Narnaul Road Mahendergarh",Yes (10),6,0,4,1,6,0,4,1,Yes,Yes,Yes,Yes,Yes,"5:15 PM 7th Jun,22",2022-06-07 17:15,13
Nihal Hospital Kanina,Kanina Main Bus Stand,Yes (13),12,0,1,1,13,0,1,1,Yes,Yes,Yes,Yes,Yes,"5:15 PM 7th Jun,22",2022-06-07 17:15,13
Rainbow Multispecialty hospital and trauma Centre,"Singhana road, Narnaul",Yes (13),4,3,6,2,4,3,6,2,Yes,No,Yes,Yes,Yes,"5:14 PM 7th Jun,22",2022-06-07 17:14,13
Sammat Memorial Hospital,"Sastri colony, near bus stand, mahendergarh",Yes (13),10,0,3,2,10,0,3,2,Yes,No,Yes,Yes,Yes,"5:15 PM 7th Jun,22",2022-06-07 17:15,13
Sanwedna Hospital Narnaul,"HUDA Sector 1, Narnaul",Yes (26),17,0,9,1,25,0,9,1,Yes,Yes,Yes,Yes,Yes,"5:13 PM 7th Jun,22",2022-06-07 17:13,13
SDH Mahendergarh,SDH Mahendergarh,Yes (20),20,0,0,5,20,0,0,5,Yes,Yes,Yes,Yes,Yes,"2:31 PM 15th Jun,22",2022-06-15 14:31,13
Shanti Hospital Narnaul,Shanti Hospital Narnaul,Yes (22),9,7,6,2,9,7,7,2,Yes,Yes,Yes,Yes,Yes,"5:13 PM 7th Jun,22",2022-06-07 17:13,13
Sheela Multi Superspeciality Hospital,Behind Bus Stand Mahindergarh,Yes (9),6,0,3,1,6,0,3,1,Yes,No,Yes,Yes,Yes,"5:15 PM 7th Jun,22",2022-06-07 17:15,13
Shri Arvind Heart and Multispecialty Hospital,"Rao Tula Ram Chowk, Dadri Road Mahendergarh",Yes (17),9,5,3,3,9,5,3,3,Yes,Yes,Yes,Yes,Yes,"5:14 PM 7th Jun,22",2022-06-07 17:14,13
Tanwar Health Care MGarh,,Yes (9),5,0,4,1,5,0,4,1,Yes,No,Yes,Yes,Yes,"5:15 PM 7th Jun,22",2022-06-07 17:15,13
Vijay Hospital Narnaul,"HUDA Sector 1, Narnaul",Yes (22),8,0,14,2,8,0,15,2,Yes,Yes,Yes,Yes,Yes,"5:13 PM 7th Jun,22",2022-06-07 17:13,13
ANUJ HOSPITAL SAFIDON,safidon panipat road,Yes (30),2,18,10,0,2,18,10,0,Yes,No,Yes,Yes,Yes,"9:58 AM 1st Dec,22",2022-12-01 09:58,9
Balaji Hospital Jind,Rohtak Road Jind,Yes (48),32,16,0,0,32,16,0,0,Yes,No,Yes,Yes,Yes,"9:57 AM 1st Dec,22",2022-12-01 09:57,9
CHC Alewa,"Alewa 2 Sub Health Centre, Alewa Chc Alewa, Alewa, Jind",Yes (15),15,0,0,0,15,0,0,0,Yes,No,Yes,No,Yes,"9:58 AM 1st Dec,22",2022-12-01 09:58,9
CHC Julana,Julana,Yes (26),20,6,0,0,20,6,0,0,Yes,No,Yes,Yes,Yes,"9:56 AM 1st Dec,22",2022-12-01 09:56,9
District Civil Hospital Jind (NEW+OLD),Hosptial,Yes (170),150,0,20,12,150,0,20,12,Yes,Yes,Yes,Yes,Yes,"9:56 AM 1st Dec,22",2022-12-01 09:56,9
Gangaputra Ayurvedic Medical College Jind,Kandela,Yes (100),60,15,25,3,60,15,25,3,Yes,No,Yes,Yes,Yes,"9:57 AM 1st Dec,22",2022-12-01 09:57,9
JIND HEART HOSPITAL,GOHANA BYPASS ROHTAK ROAD JIND,Yes (17),12,0,5,1,12,0,5,1,Yes,No,No,No,No,"9:58 AM 1st Dec,22",2022-12-01 09:58,9
Malik Hospital,Rohtak Road Jind,Yes (8),4,0,4,3,4,0,4,3,Yes,No,Yes,Yes,Yes,"9:57 AM 1st Dec,22",2022-12-01 09:57,9
Meenakashi Jain Hospital,Near Bus Stand,Yes (22),15,2,5,1,15,2,5,1,Yes,No,Yes,Yes,Yes,"9:57 AM 1st Dec,22",2022-12-01 09:57,9
RAJ HOSPITAL ROHTAK RAOD JIND,ROHTAK ROAD JIND,Yes (15),8,5,2,2,8,5,2,2,Yes,No,Yes,Yes,Yes,"9:58 AM 1st Dec,22",2022-12-01 09:58,9
Sarvodhya Hospital Jind,Jind,Yes (20),20,0,0,2,20,0,0,2,Yes,No,Yes,No,No,"9:57 AM 1st Dec,22",2022-12-01 09:57,9
SDH Narwana,Narwana,Yes (32),20,12,0,0,20,12,0,0,Yes,No,Yes,Yes,Yes,"9:57 AM 1st Dec,22",2022-12-01 09:57,9
SDH Safidon,Safidon,Yes (34),20,14,0,0,20,14,0,0,Yes,No,Yes,No,Yes,"9:57 AM 1st Dec,22",2022-12-01 09:57,9
SDH UCHANA,Uchana,Yes (55),20,35,0,0,20,35,0,0,Yes,No,No,No,Yes,"9:56 AM 1st Dec,22",2022-12-01 09:56,9
Shri Gyani Ram Mamorial Hospital,Safidon,Yes (25),10,5,10,0,10,5,10,0,Yes,No,Yes,Yes,Yes,"9:56 AM 1st Dec,22",2022-12-01 09:56,9
Ch Lekh Raj Multispeciality Hospital,Vill Gadhauli Yamuna Nagar,Yes (150),140,0,10,5,140,0,10,5,Yes,Yes,Yes,Yes,Yes,"2:46 PM 2nd Aug,22",2022-08-02 14:46,22
CHC Bilaspur,CHC Bilaspur,Yes (23),8,15,0,0,8,17,0,0,Yes,No,Yes,No,Yes,"2:42 PM 2nd Aug,22",2022-08-02 14:42,22
CHC Chhachharuli,CHC Chhachharuli,Yes (30),10,20,0,0,10,20,0,0,Yes,No,Yes,Yes,Yes,"2:42 PM 2nd Aug,22",2022-08-02 14:42,22
CHC Naharpur,Naharpur Yamuna Nagar,Yes (10),10,0,0,0,10,0,0,0,Yes,No,No,No,Yes,"2:46 PM 2nd Aug,22",2022-08-02 14:46,22
CHC Partap Nagar,CHC Partap Nagar,Yes (16),6,10,0,0,6,10,0,0,Yes,No,Yes,No,Yes,"2:42 PM 2nd Aug,22",2022-08-02 14:42,22
CHC Radaur,Radaur Yamuna Nagar,Yes (20),10,10,0,0,10,10,0,0,Yes,No,Yes,Yes,Yes,"2:46 PM 2nd Aug,22",2022-08-02 14:46,22
CHC Saraswati Nagar,CHC Saraswati Nagar,Yes (25),14,11,0,0,14,11,0,0,Yes,No,Yes,No,Yes,"2:43 PM 2nd Aug,22",2022-08-02 14:43,22
DABRA HOSPITAL Yamunanagar,DABRA HOSPITAL,Yes (23),11,8,4,2,11,8,4,2,No,No,No,No,No,"2:43 PM 2nd Aug,22",2022-08-02 14:43,22
Gaba Hospital,Gaba Hospital Yamunanagar,Yes (50),20,10,20,4,20,10,20,4,Yes,No,Yes,Yes,Yes,"2:41 PM 2nd Aug,22",2022-08-02 14:41,22
GULATI HOSPITAL,GULATI HOSPITAL,Yes (32),23,3,6,0,25,3,6,0,Yes,No,Yes,Yes,Yes,"2:43 PM 2nd Aug,22",2022-08-02 14:43,22
Indra Hospital,109 OPP ESI HOSPITAL JAGADHRI,Yes (30),20,5,5,2,20,5,5,2,Yes,No,Yes,Yes,Yes,"2:53 PM 2nd Aug,22",2022-08-02 14:53,22
JP Hospital Pvt,"Jagadhri Rd, near Luxmi Theater, Vishwakarma Mohalla, Yamuna Nagar,HARAYANA Haryana",Yes (43),15,15,13,2,15,15,13,2,Yes,No,Yes,Yes,Yes,"2:42 PM 2nd Aug,22",2022-08-02 14:42,22
KAPOOR HOSPITAL,"SH 6A Indira Colony Jagadhri, yamunanagart ,Haryana",Yes (12),4,0,8,0,4,0,8,0,Yes,No,Yes,Yes,Yes,"2:45 PM 2nd Aug,22",2022-08-02 14:45,22
KESHWANI HOSPITAL,"Jagadhri - Yamuna Nagar Rd, Tagore Garden, Yamuna Nagar, Haryana",Yes (10),10,0,0,0,10,0,0,0,Yes,No,Yes,Yes,Yes,"2:47 PM 2nd Aug,22",2022-08-02 14:47,22
Maxxwell Hospital,Jagadhari Yamuna Nagar,Yes (17),11,0,6,0,11,0,6,0,Yes,No,Yes,Yes,Yes,"2:43 PM 2nd Aug,22",2022-08-02 14:43,22
Mukand Lal District Civil Hospital Yamunanagar,Mukand Lal District Civil Hospital YNR,Yes (23),18,5,0,5,18,9,0,5,Yes,No,Yes,Yes,Yes,"2:43 PM 2nd Aug,22",2022-08-02 14:43,22
NIRMAL HOSPITAL,"199, Radaur Rd, near nirmal hospital, camp, Garhi Gujran, Haryana",Yes (20),13,1,6,0,13,1,6,0,Yes,No,Yes,Yes,Yes,"2:42 PM 2nd Aug,22",2022-08-02 14:42,22
RK Gupta,opp DAV Sr Sec School Near Madhu Hotel YNR,Yes (16),4,2,10,0,5,2,10,0,Yes,Yes,Yes,Yes,Yes,"2:46 PM 2nd Aug,22",2022-08-02 14:46,22
SABBARWAL HOSPITAL,"Gulab Nagar, Jagadhri, Haryana",Yes (13),6,1,6,0,6,1,6,0,Yes,No,Yes,Yes,Yes,"2:45 PM 2nd Aug,22",2022-08-02 14:45,22
Sachdeva Hospital,"2227, Civil Lines Rd, Sri Nagar Colony, Civil Lines, Gomti Mohalla, Jagadhri, Haryana",Yes (28),16,8,4,0,16,8,4,0,Yes,No,Yes,Yes,Yes,"2:47 PM 2nd Aug,22",2022-08-02 14:47,22
Santosh Hospital,"Santosh Hospital  Kanhaiya Sahib Chowk, near Govt.School, Harbanspura Colony, Gobind Pura, Yamuna Nagar, Haryana",Yes (28),5,9,14,2,5,9,14,2,Yes,No,Yes,Yes,Yes,"2:40 PM 2nd Aug,22",2022-08-02 14:40,22
SHARMA HOSPITAL,Near Agarsain Chowk Jagadhri,Yes (12),12,0,0,0,12,0,0,0,Yes,No,Yes,Yes,Yes,"2:46 PM 2nd Aug,22",2022-08-02 14:46,22
Shree Medical Care Hospital,"359/2, Jain nagar, Jagadhri, Haryana",Yes (15),15,0,0,0,15,0,0,0,Yes,Yes,Yes,Yes,Yes,"2:47 PM 2nd Aug,22",2022-08-02 14:47,22
Shureshtha Hospital,Model Colony YNR,Yes (12),9,1,2,0,9,1,2,0,Yes,No,Yes,Yes,Yes,"2:47 PM 2nd Aug,22",2022-08-02 14:47,22
SP Hospital Jag,S.P Hospital Jag,Yes (7),4,0,3,1,4,0,3,1,Yes,No,Yes,Yes,Yes,"2:44 PM 2nd Aug,22",2022-08-02 14:44,22
Swami Vivekanand Hospital Yamunanagar,"Swami Vivekanand Hospital,Yamuna Nagar, Haryana",Yes (49),20,10,19,1,20,10,19,1,Yes,No,Yes,Yes,Yes,"2:45 PM 2nd Aug,22",2022-08-02 14:45,22
Swastik Hospital,"Basant Nagar, Yamuna Nagar, Haryana",Yes (6),4,2,0,0,4,2,0,0,Yes,No,Yes,Yes,Yes,"2:48 PM 2nd Aug,22",2022-08-02 14:48,22
VARDAAN HOSPITAL,OPP KOHLI HOSPITAL NEAR AGARSEN COLLEGE JAGADHRI,Yes (10),8,2,0,0,8,2,0,0,Yes,No,Yes,Yes,Yes,"2:47 PM 2nd Aug,22",2022-08-02 14:47,22