name,address,Availability_availability_of_beds,Availability_oxygen_beds,Availability_non_oxygen_beds,Availability_i_c_u_beds,Availability_ventilators,Allocated_oxygen_beds,Allocated_non_oxygen_beds,Allocated_i_c_u,Allocated_ventilators,Availability_availability_of_oxygen,Availability_antiviral_remdesivir_etc_,Availability_steroids,Availability_anticoagulant,Availability_antipyretic,updated_on_unparsed,updated_on,city
GH Charkhi Dadri,"Near Loharu Chowk,Charkhi Dadri",Yes (51),35,15,1,11,35,15,1,11,Yes,Yes,Yes,Yes,Yes,"10:28 AM 2nd Aug,22",2022-08-02 10:28,3
Jaihind Hospital,Charkhi Dadri,Yes (13),7,1,5,0,7,1,5,0,Yes,Yes,Yes,To Be Updated,To Be Updated,"10:30 AM 2nd Aug,22",2022-08-02 10:30,3
Murari Lal Rasiwasia Ayurvedic Hospital,"Delhi Road,Near Janta College",Yes (70),60,10,0,0,60,10,0,0,Yes,Yes,Yes,Yes,Yes,"10:28 AM 2nd Aug,22",2022-08-02 10:28,3
Oscar Hospital,Charkhi Dadri,Yes (20),0,0,20,0,0,0,20,0,To Be Updated,To Be Updated,To Be Updated,To Be Updated,To Be Updated,"10:30 AM 2nd Aug,22",2022-08-02 10:30,3
Pradhan Medicare Centre,"Loharu Rd, Charkhi Dadri, Haryana",Yes (17),14,0,3,0,14,0,3,0,To Be Updated,Yes,Yes,Yes,Yes,"10:27 AM 2nd Aug,22",2022-08-02 10:27,3
Sunflag Hospital,Charkhi Dadri,Yes (12),6,0,6,0,6,0,6,0,To Be Updated,To Be Updated,To Be Updated,To Be Updated,To Be Updated,"10:30 AM 2nd Aug,22",2022-08-02 10:30,3
"Aditya Neuro &amp; Spine Hospital, Rewari","Circular Rd, near Kanod gate, Raam Bagh Mahalla, Rewari, Haryana",Yes (10),8,0,2,2,8,0,2,2,Yes,No,Yes,Yes,Yes,"10:30 AM 15th Jun,22",2022-06-15 10:30,18
Advance Hospital,"Bawal Road, Model Town",Yes (8),5,0,3,0,5,0,6,1,Yes,No,Yes,Yes,Yes,"10:27 AM 15th Jun,22",2022-06-15 10:27,18
"Apex Hospital, Dharuhera","Plot No.5, Sector 6, Dharuhera, Haryana 123106",Yes (10),6,0,4,1,6,0,4,1,Yes,No,Yes,Yes,Yes,"10:31 AM 15th Jun,22",2022-06-15 10:31,18
Apollo Rewari/Family Health Edge Hospital,"Garhi Bolni Rd, near Public Health Office, krishna Nagar, Rewari, Haryana",Yes (27),17,3,7,0,17,3,7,0,Yes,No,Yes,Yes,Yes,"10:22 AM 15th Jun,22",2022-06-15 10:22,18
Capt. Nand Lal Hospital,"Circular Road near Government Girls Senior Secondary School naiwali, chowk, Rewari",Yes (20),6,10,4,1,11,10,8,1,Yes,No,Yes,Yes,Yes,"10:25 AM 15th Jun,22",2022-06-15 10:25,18
Civil Hospital rewari,"Kayasthwara Mohalla, Rewari, Haryana",Yes (89),59,16,14,4,59,16,14,4,Yes,Yes,Yes,Yes,Yes,"10:39 AM 15th Jun,22",2022-06-15 10:39,18
Cygnus Hospital Rewari,"Opposite Civil Hospital Mohola, Sanghi Ka Bass, Rewari, Haryana",Yes (32),21,7,4,1,26,7,9,2,Yes,No,Yes,No,Yes,"10:21 AM 15th Jun,22",2022-06-15 10:21,18
Devjyoti Hospital,"Ambedkar chowk, near Bus Stand, Rewari, Haryana",Yes (15),7,2,6,Beds Over Utilized 1,7,2,6,0,Yes,No,Yes,Yes,Yes,"10:37 AM 15th Jun,22",2022-06-15 10:37,18
Dr. K.K. NAGAR HOSPITAL,"317, Near Shishu Shala School, Model Town, Rewari, Haryana",Yes (12),2,0,10,0,2,0,10,0,Yes,No,Yes,Yes,Yes,"10:19 AM 15th Jun,22",2022-06-15 10:19,18
Dr. Vijay Pal Yadav Hospital,"Near Ambedker chowk, Rewari",Yes (7),2,2,3,0,3,3,4,0,Yes,No,Yes,Yes,Yes,"10:26 AM 15th Jun,22",2022-06-15 10:26,18
Kamla Nursing Home/Kalawati Hospital,"201, Model Town, Rewari, Near Bus Stand, Opposite Bal Bhawan, Shivam Chowk",Yes (23),14,0,9,6,14,0,9,6,Yes,No,Yes,Yes,Yes,"10:40 AM 15th Jun,22",2022-06-15 10:40,18
Katyal Hospital,"Katyal Hospital, KANOD GATE, CIRCULAR ROAD, Rewari, Haryana, India",Yes (21),9,6,6,0,12,6,10,1,Yes,No,Yes,Yes,Yes,"10:18 AM 15th Jun,22",2022-06-15 10:18,18
Maars Hospital,"Garhi Bolni Rd, near PWD Office, Sector 19, Rewari, Haryana",Yes (15),15,0,0,0,15,0,0,0,Yes,No,Yes,Yes,No,"10:24 AM 15th Jun,22",2022-06-15 10:24,18
"Manasavi Hospital, Rewari",,Yes (10),10,0,0,0,10,0,0,0,Yes,No,Yes,No,Yes,"10:31 AM 15th Jun,22",2022-06-15 10:31,18
Matrika Hospital,"Matrika Hospital, Ranbir Singh Huda Chowk, Bawal-Rewari Rd, Rewari, Haryana",Yes (45),30,0,15,3,30,0,15,3,To Be Updated,To Be Updated,To Be Updated,To Be Updated,To Be Updated,"11:46 AM 18th Jun,22",2022-06-18 11:46,18
Mediom Hospital/Medcare Hospital,"Sohna Rd, near Municipal Corporation, Dharuhera, Haryana",Yes (4),3,Beds Over Utilized 1,1,0,8,0,4,1,Yes,No,Yes,Yes,Yes,"10:19 AM 15th Jun,22",2022-06-15 10:19,18
Om Hospital,"Om Hospital, Nandrampur Bass Rd, Dharuhera, Haryana",Yes (24),12,4,8,0,12,4,8,0,Yes,No,Yes,Yes,Yes,"10:20 AM 15th Jun,22",2022-06-15 10:20,18
Pushpanjli Hospital Rewari,"Rajesh Pilot Chowk, Rewari, Haryana",Yes (80),60,10,10,4,60,10,10,4,No,No,Yes,Yes,Yes,"10:32 AM 15th Jun,22",2022-06-15 10:32,18
R. B. Yadav Hospital,"Dr. R B Yadav Hospital, Circular Rd Jainpuri, Kayasthwara Mohalla, Rewari, Haryana",Yes (22),8,6,8,2,8,6,8,2,Yes,No,Yes,Yes,Yes,"10:18 AM 15th Jun,22",2022-06-15 10:18,18
Samrat Hospital,Near Azad Chowk Rewari,Yes (9),5,0,4,3,5,0,10,3,Yes,No,Yes,Yes,Yes,"10:26 AM 15th Jun,22",2022-06-15 10:26,18
SDH Kosli,"Kosli, Rewari, Haryana",Yes (45),20,20,5,0,20,20,5,0,Yes,No,No,No,No,"10:40 AM 15th Jun,22",2022-06-15 10:40,18
Shanti Yadav Hospital,"Bawal-Rewari Rd Model Town, Rewari, Haryana",Yes (33),19,10,4,0,19,10,4,0,Yes,No,Yes,No,No,"10:35 AM 15th Jun,22",2022-06-15 10:35,18
Sheela Neuro &amp; Multi. Superspeciality Hospital,"Sheela Neuro Multi-Super Speciality Hospital, Opposite Jain Public School, Circular Road, Rewari",Yes (32),15,15,2,0,15,15,3,1,Yes,No,Yes,Yes,No,"10:19 AM 15th Jun,22",2022-06-15 10:19,18
Shri Ashwani Sexena Hospital,"343-L, Model town Rewari",Yes (10),7,3,0,0,7,3,0,0,Yes,No,Yes,Yes,Yes,"10:26 AM 15th Jun,22",2022-06-15 10:26,18
SMCC Hospital,"Sector 5 Rewari, Haryana",Yes (13),2,0,11,1,2,0,11,1,Yes,No,Yes,Yes,Yes,"10:25 AM 15th Jun,22",2022-06-15 10:25,18
Surendra Hospital Bawal,"Circuar Road, Rewari, Haryana",Yes (11),5,2,4,0,5,2,5,0,Yes,No,Yes,No,Yes,"10:27 AM 15th Jun,22",2022-06-15 10:27,18
"Sushma Devi Hospital, Bawal","Rewari Road, Bawal, Rewari, Near Power House & Bharat Petrol Pump",Yes (18),9,9,0,0,9,9,0,0,Yes,No,Yes,Yes,Yes,"10:24 AM 15th Jun,22",2022-06-15 10:24,18
Vedanta Hospital,"Circulare Road, Near Nirankari Satsang Bhavan Dharuhera, Chungi, Rewari, Haryana",Yes (29),0,7,22,0,0,7,30,0,Yes,No,Yes,Yes,Yes,"10:21 AM 15th Jun,22",2022-06-15 10:21,18
Virat Hospital,"Circular Rd, Near Oriental Bank of Commerce, Madhu Vihar, Rewari, Haryana",Yes (100),63,10,27,2,63,10,27,2,To Be Updated,To Be Updated,To Be Updated,To Be Updated,To Be Updated,"10:36 AM 15th Jun,22",2022-06-15 10:36,18
Yaduvanshi Hospital,"Maharana Pratap Chowk, Model Town, Rewari, Haryana",Yes (46),36,0,10,1,36,0,10,1,Yes,No,Yes,Yes,No,"10:34 AM 15th Jun,22",2022-06-15 10:34,18
Anchal Multispeciality Hospital,"Anchal Multi speciality Hospital, Krishna Colony, Bhiwani, Haryana 127027",Yes (35),25,0,10,2,25,0,10,2,Yes,Yes,Yes,Yes,Yes,"5:14 PM 7th Jun,22",2022-06-07 17:14,2
Ch. Bansilal Govt Hospital,"Bansi Lal General Hospital, Ghanta Ghar Chowk, SH 17, Krishna Colony, Bhiwani, Haryana 127021",Yes (171),139,5,27,16,139,5,28,16,Yes,Yes,Yes,Yes,Yes,"5:14 PM 7th Jun,22",2022-06-07 17:14,2
Chugh Hospital,"Meham Gate, Circular Road, Bhiwani",Yes (20),20,0,0,0,20,0,0,0,Yes,Yes,Yes,Yes,Yes,"5:14 PM 7th Jun,22",2022-06-07 17:14,2
ESI Hospital Bhiwani,"Stadium Rd, Housing Board Colony, Bhiwani, Haryana 127021",Yes (40),0,40,0,0,0,40,0,0,No,No,Yes,Yes,Yes,"5:14 PM 7th Jun,22",2022-06-07 17:14,2
Ganpatrai Hospital,"SH 17, Bank Colony, Bound Kalan, Krishna Colony, Bhiwani, Haryana 127021",Yes (10),4,4,2,1,4,4,2,1,Yes,No,Yes,Yes,Yes,"5:14 PM 7th Jun,22",2022-06-07 17:14,2
Jangra Multispecilaity Hospital,"Bank Colony, Old Bharat Nagar, Bhiwani, Haryana 127021",Yes (10),7,3,0,0,7,3,0,0,Yes,No,Yes,Yes,Yes,"5:14 PM 7th Jun,22",2022-06-07 17:14,2
Jeevan Nursing Home-Bhiwani,Rohtak gate Bhiwani,Yes (10),3,4,3,0,3,4,3,0,Yes,Yes,Yes,Yes,Yes,"5:15 PM 7th Jun,22",2022-06-07 17:15,2
Jeevanrekha Hospital,Near Railway Road Bhiwani,Yes (30),25,0,5,1,25,0,5,1,To Be Updated,To Be Updated,To Be Updated,To Be Updated,To Be Updated,"5:15 PM 7th Jun,22",2022-06-07 17:15,2
Kadam Hospital,"Bank Colony Near New Bus Stand, Bhiwani",Yes (45),11,0,34,1,11,0,34,1,Yes,Yes,Yes,Yes,Yes,"5:29 PM 15th Jun,22",2022-06-15 17:29,2
Krishan Lal Jalan Hospital,"Jalan Nagar, M.C.Colony, Bhiwani, Haryana 127021",Yes (40),20,20,0,0,20,20,0,0,Yes,Yes,Yes,Yes,Yes,"5:14 PM 7th Jun,22",2022-06-07 17:14,2
Life Line Hospital,"Circular Rd, M.C.Colony, Bhiwani, Haryana 127021",Yes (27),21,0,6,0,21,0,6,0,Yes,Yes,Yes,Yes,Yes,"5:14 PM 7th Jun,22",2022-06-07 17:14,2
RPS HOSPITAL,,Yes (24),4,16,4,0,4,16,4,0,Yes,No,Yes,Yes,Yes,"5:14 PM 7th Jun,22",2022-06-07 17:14,2
Sharma Nursing and Maternity Home Tosham,Siwani Road Tosham,Yes (10),7,0,3,2,7,0,3,2,Yes,Yes,To Be Updated,Yes,Yes,"5:15 PM 7th Jun,22",2022-06-07 17:15,2
Shree Ganesha Hospital,"Dadri Gate, Bhiwani",Yes (13),6,3,4,0,6,3,4,0,Yes,Yes,Yes,Yes,Yes,"5:14 PM 7th Jun,22",2022-06-07 17:14,2
"SHRI BABA YOGI NETANATH HOSPITAL , LOHANI ,BHIWANI",VPO Lohani,Yes (50),35,5,10,2,35,5,10,2,Yes,Yes,Yes,Yes,Yes,"5:15 PM 7th Jun,22",2022-06-07 17:15,2
Shri Ram Hospital,Siwani,Yes (11),0,0,11,4,0,0,11,4,To Be Updated,To Be Updated,To Be Updated,To Be Updated,To Be Updated,"5:15 PM 7th Jun,22",2022-06-07 17:15,2
SMSG Multispeciality Hospital,"Rohtak Gate, Bhiwani",Yes (30),2,17,11,2,2,17,11,2,Yes,Yes,Yes,Yes,Yes,"5:14 PM 7th Jun,22",2022-06-07 17:14,2
Spes Hospital,"Circular Rd, Bound Kalan, M.C.Colony, Bhiwani, Haryana 127021",Yes (22),4,6,12,1,4,6,12,1,Yes,Yes,Yes,Yes,Yes,"5:14 PM 7th Jun,22",2022-06-07 17:14,2
DCHC Barara,,Yes (50),50,0,0,0,50,0,0,0,To Be Updated,To Be Updated,To Be Updated,To Be Updated,To Be Updated,"1:26 PM 17th Aug,22",2022-08-17 13:26,1
DCHC Mullana,,Yes (49),49,0,0,0,50,0,0,0,To Be Updated,To Be Updated,To Be Updated,To Be Updated,To Be Updated,"1:26 PM 17th Aug,22",2022-08-17 13:26,1
District Civil Hospital,Ambala City,Yes (120),97,0,23,11,116,0,23,11,Yes,Yes,Yes,Yes,Yes,"1:24 PM 17th Aug,22",2022-08-17 13:24,1
District Civil Hospital Ambala Cantt,Ambala Cantt,Yes (86),73,0,13,7,80,0,13,7,Yes,Yes,Yes,Yes,Yes,"1:25 PM 17th Aug,22",2022-08-17 13:25,1
Guardian Hospital,AMBALA JAGADHARI ROAD AMBALA CANTT,Yes (23),15,3,5,3,15,3,5,3,Yes,Yes,Yes,Yes,Yes,"1:26 PM 17th Aug,22",2022-08-17 13:26,1
Ishwar Hospital,,Yes (16),16,0,0,0,16,0,0,0,Yes,Yes,To Be Updated,Yes,Yes,"1:26 PM 17th Aug,22",2022-08-17 13:26,1
Kuldeep Hospital,,Yes (10),8,0,2,0,8,0,2,0,To Be Updated,To Be Updated,To Be Updated,To Be Updated,To Be Updated,"1:26 PM 17th Aug,22",2022-08-17 13:26,1
Mehndiratta Hospital,"#106, manali house, near central jail,  ambala city",Yes (30),25,0,5,1,25,0,5,1,Yes,No,Yes,Yes,Yes,"1:26 PM 17th Aug,22",2022-08-17 13:26,1
Military Hospital,Ambala Cantonment,Yes (159),59,85,15,15,60,85,15,15,To Be Updated,To Be Updated,To Be Updated,To Be Updated,To Be Updated,"1:24 PM 17th Aug,22",2022-08-17 13:24,1
MM Medical College Pvt,MMIMSR Mullana Ambala,Yes (197),113,70,14,10,116,70,14,10,Yes,Yes,Yes,Yes,Yes,"1:24 PM 17th Aug,22",2022-08-17 13:24,1
Park Healing Touch Hospital,"Sultanpur Chowk, Nr Dhulkot Barrier, Ambala Chandigarh Expy. Ambala",Yes (38),18,0,20,10,30,0,20,10,Yes,Yes,Yes,Yes,Yes,"1:25 PM 17th Aug,22",2022-08-17 13:25,1
Philedelphia mission Hospital pvt,"Mission Compound, Ambala City",Yes (100),92,0,8,2,92,0,8,2,Yes,No,Yes,Yes,Yes,"1:24 PM 17th Aug,22",2022-08-17 13:24,1
Railways Hospital,"Railway Hospital, railway colony,  Ambala Cantt",Yes (35),30,0,5,0,30,0,5,0,Yes,Yes,Yes,Yes,Yes,"1:25 PM 17th Aug,22",2022-08-17 13:25,1
Rotary Hospital Ambala cantt Pvt,"Rambagh road, Opp Dusshera ground, Ambala Cantt",Yes (20),15,0,5,2,15,0,5,2,Yes,No,Yes,Yes,Yes,"1:24 PM 17th Aug,22",2022-08-17 13:24,1
Sant Hospital,,Yes (13),10,0,3,1,10,0,3,1,To Be Updated,To Be Updated,To Be Updated,To Be Updated,Yes,"1:26 PM 17th Aug,22",2022-08-17 13:26,1
SDH Naraingarh,,Yes (48),48,0,0,0,50,0,0,0,To Be Updated,To Be Updated,To Be Updated,To Be Updated,To Be Updated,"1:25 PM 17th Aug,22",2022-08-17 13:25,1
Yafe Indoor Hospital,,Yes (14),9,5,0,0,9,6,0,0,To Be Updated,To Be Updated,To Be Updated,To Be Updated,To Be Updated,"1:26 PM 17th Aug,22",2022-08-17 13:26,1
Ch Lekh Raj Multispeciality Hospital,Vill Gadhauli Yamuna Nagar,Yes (150),140,0,10,5,140,0,10,5,Yes,Yes,Yes,Yes,Yes,"2:46 PM 2nd Aug,22",2022-08-02 14:46,22
CHC Bilaspur,CHC Bilaspur,Yes (23),8,15,0,0,8,17,0,0,Yes,No,Yes,No,Yes,"2:42 PM 2nd Aug,22",2022-08-02 14:42,22
CHC Chhachharuli,CHC Chhachharuli,Yes (30),10,20,0,0,10,20,0,0,Yes,No,Yes,Yes,Yes,"2:42 PM 2nd Aug,22",2022-08-02 14:42,22
CHC Naharpur,Naharpur Yamuna Nagar,Yes (10),10,0,0,0,10,0,0,0,Yes,No,No,No,Yes,"2:46 PM 2nd Aug,22",2022-08-02 14:46,22
CHC Partap Nagar,CHC Partap Nagar,Yes (16),6,10,0,0,6,10,0,0,Yes,No,Yes,No,Yes,"2:42 PM 2nd Aug,22",2022-08-02 14:42,22
CHC Radaur,Radaur Yamuna Nagar,Yes (20),10,10,0,0,10,10,0,0,Yes,No,Yes,Yes,Yes,"2:46 PM 2nd Aug,22",2022-08-02 14:46,22
CHC Saraswati Nagar,CHC Saraswati Nagar,Yes (25),14,11,0,0,14,11,0,0,Yes,No,Yes,No,Yes,"2:43 PM 2nd Aug,22",2022-08-02 14:43,22
DABRA HOSPITAL Yamunanagar,DABRA HOSPITAL,Yes (23),11,8,4,2,11,8,4,2,No,No,No,No,No,"2:43 PM 2nd Aug,22",2022-08-02 14:43,22
Gaba Hospital,Gaba Hospital Yamunanagar,Yes (50),20,10,20,4,20,10,20,4,Yes,No,Yes,Yes,Yes,"2:41 PM 2nd Aug,22",2022-08-02 14:41,22
GULATI HOSPITAL,GULATI HOSPITAL,Yes (32),23,3,6,0,25,3,6,0,Yes,No,Yes,Yes,Yes,"2:43 PM 2nd Aug,22",2022-08-02 14:43,22
Indra Hospital,109 OPP ESI HOSPITAL JAGADHRI,Yes (30),20,5,5,2,20,5,5,2,Yes,No,Yes,Yes,Yes,"2:53 PM 2nd Aug,22",2022-08-02 14:53,22
JP Hospital Pvt,"Jagadhri Rd, near Luxmi Theater, Vishwakarma Mohalla, Yamuna Nagar,HARAYANA Haryana",Yes (43),15,15,13,2,15,15,13,2,Yes,No,Yes,Yes,Yes,"2:42 PM 2nd Aug,22",2022-08-02 14:42,22
KAPOOR HOSPITAL,"SH 6A Indira Colony Jagadhri, yamunanagart ,Haryana",Yes (12),4,0,8,0,4,0,8,0,Yes,No,Yes,Yes,Yes,"2:45 PM 2nd Aug,22",2022-08-02 14:45,22
KESHWANI HOSPITAL,"Jagadhri - Yamuna Nagar Rd, Tagore Garden, Yamuna Nagar, Haryana",Yes (10),10,0,0,0,10,0,0,0,Yes,No,Yes,Yes,Yes,"2:47 PM 2nd Aug,22",2022-08-02 14:47,22
Maxxwell Hospital,Jagadhari Yamuna Nagar,Yes (17),11,0,6,0,11,0,6,0,Yes,No,Yes,Yes,Yes,"2:43 PM 2nd Aug,22",2022-08-02 14:43,22
Mukand Lal District Civil Hospital Yamunanagar,Mukand Lal District Civil Hospital YNR,Yes (23),18,5,0,5,18,9,0,5,Yes,No,Yes,Yes,Yes,"2:43 PM 2nd Aug,22",2022-08-02 14:43,22
NIRMAL HOSPITAL,"199, Radaur Rd, near nirmal hospital, camp, Garhi Gujran, Haryana",Yes (20),13,1,6,0,13,1,6,0,Yes,No,Yes,Yes,Yes,"2:42 PM 2nd Aug,22",2022-08-02 14:42,22
RK Gupta,opp DAV Sr Sec School Near Madhu Hotel YNR,Yes (16),4,2,10,0,5,2,10,0,Yes,Yes,Yes,Yes,Yes,"2:46 PM 2nd Aug,22",2022-08-02 14:46,22
SABBARWAL HOSPITAL,"Gulab Nagar, Jagadhri, Haryana",Yes (13),6,1,6,0,6,1,6,0,Yes,No,Yes,Yes,Yes,"2:45 PM 2nd Aug,22",2022-08-02 14:45,22
Sachdeva Hospital,"2227, Civil Lines Rd, Sri Nagar Colony, Civil Lines, Gomti Mohalla, Jagadhri, Haryana",Yes (28),16,8,4,0,16,8,4,0,Yes,No,Yes,Yes,Yes,"2:47 PM 2nd Aug,22",2022-08-02 14:47,22
Santosh Hospital,"Santosh Hospital  Kanhaiya Sahib Chowk, near Govt.School, Harbanspura Colony, Gobind Pura, Yamuna Nagar, Haryana",Yes (28),5,9,14,2,5,9,14,2,Yes,No,Yes,Yes,Yes,"2:40 PM 2nd Aug,22",2022-08-02 14:40,22
SHARMA HOSPITAL,Near Agarsain Chowk Jagadhri,Yes (12),12,0,0,0,12,0,0,0,Yes,No,Yes,Yes,Yes,"2:46 PM 2nd Aug,22",2022-08-02 14:46,22
Shree Medical Care Hospital,"359/2, Jain nagar, Jagadhri, Haryana",Yes (15),15,0,0,0,15,0,0,0,Yes,Yes,Yes,Yes,Yes,"2:47 PM 2nd Aug,22",2022-08-02 14:47,22
Shureshtha Hospital,Model Colony YNR,Yes (12),9,1,2,0,9,1,2,0,Yes,No,Yes,Yes,Yes,"2:47 PM 2nd Aug,22",2022-08-02 14:47,22
SP Hospital Jag,S.P Hospital Jag,Yes (7),4,0,3,1,4,0,3,1,Yes,No,Yes,Yes,Yes,"2:44 PM 2nd Aug,22",2022-08-02 14:44,22
Swami Vivekanand Hospital Yamunanagar,"Swami Vivekanand Hospital,Yamuna Nagar, Haryana",Yes (49),20,10,19,1,20,10,19,1,Yes,No,Yes,Yes,Yes,"2:45 PM 2nd Aug,22",2022-08-02 14:45,22
Swastik Hospital,"Basant Nagar, Yamuna Nagar, Haryana",Yes (6),4,2,0,0,4,2,0,0,Yes,No,Yes,Yes,Yes,"2:48 PM 2nd Aug,22",2022-08-02 14:48,22
VARDAAN HOSPITAL,OPP KOHLI HOSPITAL NEAR AGARSEN COLLEGE JAGADHRI,Yes (10),8,2,0,0,8,2,0,0,Yes,No,Yes,Yes,Yes,"2:47 PM 2nd Aug,22",2022-08-02 14:47,22