name,address,Availability_availability_of_beds,Availability_oxygen_beds,Availability_non_oxygen_beds,Availability_i_c_u_beds,Availability_ventilators,Allocated_oxygen_beds,Allocated_non_oxygen_beds,Allocated_i_c_u,Allocated_ventilators,Availability_availability_of_oxygen,Availability_antiviral_remdesivir_etc_,Availability_steroids,Availability_anticoagulant,Availability_antipyretic,updated_on_unparsed,updated_on,city
Anchal Multispeciality Hospital,"Anchal Multi speciality Hospital, Krishna Colony, Bhiwani, Haryana 127027",Yes (35),25,0,10,2,25,0,10,2,Yes,Yes,Yes,Yes,Yes,"5:14 PM 7th Jun,22",2022-06-07 17:14,2
Ch. Bansilal Govt Hospital,"Bansi Lal General Hospital, Ghanta Ghar Chowk, SH 17, Krishna Colony, Bhiwani, Haryana 127021",Yes (171),139,5,27,16,139,5,28,16,Yes,Yes,Yes,Yes,Yes,"5:14 PM 7th Jun,22",2022-06-07 17:14,2
Chugh Hospital,"Meham Gate, Circular Road, Bhiwani",Yes (20),20,0,0,0,20,0,0,0,Yes,Yes,Yes,Yes,Yes,"5:14 PM 7th Jun,22",2022-06-07 17:14,2
ESI Hospital Bhiwani,"Stadium Rd, Housing Board Colony, Bhiwani, Haryana 127021",Yes (40),0,40,0,0,0,40,0,0,No,No,Yes,Yes,Yes,"5:14 PM 7th Jun,22",2022-06-07 17:14,2
Ganpatrai Hospital,"SH 17, Bank Colony, Bound Kalan, Krishna Colony, Bhiwani, Haryana 127021",Yes (10),4,4,2,1,4,4,2,1,Yes,No,Yes,Yes,Yes,"5:14 PM 7th Jun,22",2022-06-07 17:14,2
Jangra Multispecilaity Hospital,"Bank Colony, Old Bharat Nagar, Bhiwani, Haryana 127021",Yes (10),7,3,0,0,7,3,0,0,Yes,No,Yes,Yes,Yes,"5:14 PM 7th Jun,22",2022-06-07 17:14,2
Jeevan Nursing Home-Bhiwani,Rohtak gate Bhiwani,Yes (10),3,4,3,0,3,4,3,0,Yes,Yes,Yes,Yes,Yes,"5:15 PM 7th Jun,22",2022-06-07 17:15,2
Jeevanrekha Hospital,Near Railway Road Bhiwani,Yes (30),25,0,5,1,25,0,5,1,To Be Updated,To Be Updated,To Be Updated,To Be Updated,To Be Updated,"5:15 PM 7th Jun,22",2022-06-07 17:15,2
Kadam Hospital,"Bank Colony Near New Bus Stand, Bhiwani",Yes (45),11,0,34,1,11,0,34,1,Yes,Yes,Yes,Yes,Yes,"5:29 PM 15th Jun,22",2022-06-15 17:29,2
Krishan Lal Jalan Hospital,"Jalan Nagar, M.C.Colony, Bhiwani, Haryana 127021",Yes (40),20,20,0,0,20,20,0,0,Yes,Yes,Yes,Yes,Yes,"5:14 PM 7th Jun,22",2022-06-07 17:14,2
Life Line Hospital,"Circular Rd, M.C.Colony, Bhiwani, Haryana 127021",Yes (27),21,0,6,0,21,0,6,0,Yes,Yes,Yes,Yes,Yes,"5:14 PM 7th Jun,22",2022-06-07 17:14,2
RPS HOSPITAL,,Yes (24),4,16,4,0,4,16,4,0,Yes,No,Yes,Yes,Yes,"5:14 PM 7th Jun,22",2022-06-07 17:14,2
Sharma Nursing and Maternity Home Tosham,Siwani Road Tosham,Yes (10),7,0,3,2,7,0,3,2,Yes,Yes,To Be Updated,Yes,Yes,"5:15 PM 7th Jun,22",2022-06-07 17:15,2
Shree Ganesha Hospital,"Dadri Gate, Bhiwani",Yes (13),6,3,4,0,6,3,4,0,Yes,Yes,Yes,Yes,Yes,"5:14 PM 7th Jun,22",2022-06-07 17:14,2
"SHRI BABA YOGI NETANATH HOSPITAL , LOHANI ,BHIWANI",VPO Lohani,Yes (50),35,5,10,2,35,5,10,2,Yes,Yes,Yes,Yes,Yes,"5:15 PM 7th Jun,22",2022-06-07 17:15,2
Shri Ram Hospital,Siwani,Yes (11),0,0,11,4,0,0,11,4,To Be Updated,To Be Updated,To Be Updated,To Be Updated,To Be Updated,"5:15 PM 7th Jun,22",2022-06-07 17:15,2
SMSG Multispeciality Hospital,"Rohtak Gate, Bhiwani",Yes (30),2,17,11,2,2,17,11,2,Yes,Yes,Yes,Yes,Yes,"5:14 PM 7th Jun,22",2022-06-07 17:14,2
Spes Hospital,"Circular Rd, Bound Kalan, M.C.Colony, Bhiwani, Haryana 127021",Yes (22),4,6,12,1,4,6,12,1,Yes,Yes,Yes,Yes,Yes,"5:14 PM 7th Jun,22",2022-06-07 17:14,2
"Aditya Neuro &amp; Spine Hospital, Rewari","Circular Rd, near Kanod gate, Raam Bagh Mahalla, Rewari, Haryana",Yes (10),8,0,2,2,8,0,2,2,Yes,No,Yes,Yes,Yes,"10:30 AM 15th Jun,22",2022-06-15 10:30,18
Advance Hospital,"Bawal Road, Model Town",Yes (8),5,0,3,0,5,0,6,1,Yes,No,Yes,Yes,Yes,"10:27 AM 15th Jun,22",2022-06-15 10:27,18
"Apex Hospital, Dharuhera","Plot No.5, Sector 6, Dharuhera, Haryana 123106",Yes (10),6,0,4,1,6,0,4,1,Yes,No,Yes,Yes,Yes,"10:31 AM 15th Jun,22",2022-06-15 10:31,18
Apollo Rewari/Family Health Edge Hospital,"Garhi Bolni Rd, near Public Health Office, krishna Nagar, Rewari, Haryana",Yes (27),17,3,7,0,17,3,7,0,Yes,No,Yes,Yes,Yes,"10:22 AM 15th Jun,22",2022-06-15 10:22,18
Capt. Nand Lal Hospital,"Circular Road near Government Girls Senior Secondary School naiwali, chowk, Rewari",Yes (20),6,10,4,1,11,10,8,1,Yes,No,Yes,Yes,Yes,"10:25 AM 15th Jun,22",2022-06-15 10:25,18
Civil Hospital rewari,"Kayasthwara Mohalla, Rewari, Haryana",Yes (89),59,16,14,4,59,16,14,4,Yes,Yes,Yes,Yes,Yes,"10:39 AM 15th Jun,22",2022-06-15 10:39,18
Cygnus Hospital Rewari,"Opposite Civil Hospital Mohola, Sanghi Ka Bass, Rewari, Haryana",Yes (32),21,7,4,1,26,7,9,2,Yes,No,Yes,No,Yes,"10:21 AM 15th Jun,22",2022-06-15 10:21,18
Devjyoti Hospital,"Ambedkar chowk, near Bus Stand, Rewari, Haryana",Yes (15),7,2,6,Beds Over Utilized 1,7,2,6,0,Yes,No,Yes,Yes,Yes,"10:37 AM 15th Jun,22",2022-06-15 10:37,18
Dr. K.K. NAGAR HOSPITAL,"317, Near Shishu Shala School, Model Town, Rewari, Haryana",Yes (12),2,0,10,0,2,0,10,0,Yes,No,Yes,Yes,Yes,"10:19 AM 15th Jun,22",2022-06-15 10:19,18
Dr. Vijay Pal Yadav Hospital,"Near Ambedker chowk, Rewari",Yes (7),2,2,3,0,3,3,4,0,Yes,No,Yes,Yes,Yes,"10:26 AM 15th Jun,22",2022-06-15 10:26,18
Kamla Nursing Home/Kalawati Hospital,"201, Model Town, Rewari, Near Bus Stand, Opposite Bal Bhawan, Shivam Chowk",Yes (23),14,0,9,6,14,0,9,6,Yes,No,Yes,Yes,Yes,"10:40 AM 15th Jun,22",2022-06-15 10:40,18
Katyal Hospital,"Katyal Hospital, KANOD GATE, CIRCULAR ROAD, Rewari, Haryana, India",Yes (21),9,6,6,0,12,6,10,1,Yes,No,Yes,Yes,Yes,"10:18 AM 15th Jun,22",2022-06-15 10:18,18
Maars Hospital,"Garhi Bolni Rd, near PWD Office, Sector 19, Rewari, Haryana",Yes (15),15,0,0,0,15,0,0,0,Yes,No,Yes,Yes,No,"10:24 AM 15th Jun,22",2022-06-15 10:24,18
"Manasavi Hospital, Rewari",,Yes (10),10,0,0,0,10,0,0,0,Yes,No,Yes,No,Yes,"10:31 AM 15th Jun,22",2022-06-15 10:31,18
Matrika Hospital,"Matrika Hospital, Ranbir Singh Huda Chowk, Bawal-Rewari Rd, Rewari, Haryana",Yes (45),30,0,15,3,30,0,15,3,To Be Updated,To Be Updated,To Be Updated,To Be Updated,To Be Updated,"11:46 AM 18th Jun,22",2022-06-18 11:46,18
Mediom Hospital/Medcare Hospital,"Sohna Rd, near Municipal Corporation, Dharuhera, Haryana",Yes (4),3,Beds Over Utilized 1,1,0,8,0,4,1,Yes,No,Yes,Yes,Yes,"10:19 AM 15th Jun,22",2022-06-15 10:19,18
Om Hospital,"Om Hospital, Nandrampur Bass Rd, Dharuhera, Haryana",Yes (24),12,4,8,0,12,4,8,0,Yes,No,Yes,Yes,Yes,"10:20 AM 15th Jun,22",2022-06-15 10:20,18
Pushpanjli Hospital Rewari,"Rajesh Pilot Chowk, Rewari, Haryana",Yes (80),60,10,10,4,60,10,10,4,No,No,Yes,Yes,Yes,"10:32 AM 15th Jun,22",2022-06-15 10:32,18
R. B. Yadav Hospital,"Dr. R B Yadav Hospital, Circular Rd Jainpuri, Kayasthwara Mohalla, Rewari, Haryana",Yes (22),8,6,8,2,8,6,8,2,Yes,No,Yes,Yes,Yes,"10:18 AM 15th Jun,22",2022-06-15 10:18,18
Samrat Hospital,Near Azad Chowk Rewari,Yes (9),5,0,4,3,5,0,10,3,Yes,No,Yes,Yes,Yes,"10:26 AM 15th Jun,22",2022-06-15 10:26,18
SDH Kosli,"Kosli, Rewari, Haryana",Yes (45),20,20,5,0,20,20,5,0,Yes,No,No,No,No,"10:40 AM 15th Jun,22",2022-06-15 10:40,18
Shanti Yadav Hospital,"Bawal-Rewari Rd Model Town, Rewari, Haryana",Yes (33),19,10,4,0,19,10,4,0,Yes,No,Yes,No,No,"10:35 AM 15th Jun,22",2022-06-15 10:35,18
Sheela Neuro &amp; Multi. Superspeciality Hospital,"Sheela Neuro Multi-Super Speciality Hospital, Opposite Jain Public School, Circular Road, Rewari",Yes (32),15,15,2,0,15,15,3,1,Yes,No,Yes,Yes,No,"10:19 AM 15th Jun,22",2022-06-15 10:19,18
Shri Ashwani Sexena Hospital,"343-L, Model town Rewari",Yes (10),7,3,0,0,7,3,0,0,Yes,No,Yes,Yes,Yes,"10:26 AM 15th Jun,22",2022-06-15 10:26,18
SMCC Hospital,"Sector 5 Rewari, Haryana",Yes (13),2,0,11,1,2,0,11,1,Yes,No,Yes,Yes,Yes,"10:25 AM 15th Jun,22",2022-06-15 10:25,18
Surendra Hospital Bawal,"Circuar Road, Rewari, Haryana",Yes (11),5,2,4,0,5,2,5,0,Yes,No,Yes,No,Yes,"10:27 AM 15th Jun,22",2022-06-15 10:27,18
"Sushma Devi Hospital, Bawal","Rewari Road, Bawal, Rewari, Near Power House & Bharat Petrol Pump",Yes (18),9,9,0,0,9,9,0,0,Yes,No,Yes,Yes,Yes,"10:24 AM 15th Jun,22",2022-06-15 10:24,18
Vedanta Hospital,"Circulare Road, Near Nirankari Satsang Bhavan Dharuhera, Chungi, Rewari, Haryana",Yes (29),0,7,22,0,0,7,30,0,Yes,No,Yes,Yes,Yes,"10:21 AM 15th Jun,22",2022-06-15 10:21,18
Virat Hospital,"Circular Rd, Near Oriental Bank of Commerce, Madhu Vihar, Rewari, Haryana",Yes (100),63,10,27,2,63,10,27,2,To Be Updated,To Be Updated,To Be Updated,To Be Updated,To Be Updated,"10:36 AM 15th Jun,22",2022-06-15 10:36,18
Yaduvanshi Hospital,"Maharana Pratap Chowk, Model Town, Rewari, Haryana",Yes (46),36,0,10,1,36,0,10,1,Yes,No,Yes,Yes,No,"10:34 AM 15th Jun,22",2022-06-15 10:34,18
"Apex Hospital, Sirsa","Circular Road, Sirsa",Yes (16),10,2,4,0,10,2,4,0,Yes,To Be Updated,Yes,Yes,Yes,"12:29 PM 2nd Aug,22",2022-08-02 12:29,20
"Astha Hospital, Sirsa",Dabwali Road Sirsa,Yes (16),11,0,5,4,11,0,5,4,Yes,No,Yes,Yes,Yes,"12:24 PM 2nd Aug,22",2022-08-02 12:24,20
CHC NATHUSARI CHOPTA,Nathusari Chopta,Yes (25),20,5,0,0,20,5,0,0,To Be Updated,To Be Updated,Yes,Yes,Yes,"12:29 PM 2nd Aug,22",2022-08-02 12:29,20
CIVIL HOSPITAL SIRSA,"Civil Hospital Road, Sirsa",Yes (180),130,40,10,21,130,40,10,21,Yes,Yes,Yes,Yes,Yes,"12:24 PM 2nd Aug,22",2022-08-02 12:24,20
"Dayal Nursing Home, Sirsa","Dabwali Road, Sirsa",Yes (20),16,1,3,0,16,1,3,0,Yes,To Be Updated,Yes,Yes,Yes,"12:29 PM 2nd Aug,22",2022-08-02 12:29,20
"Gupta Hospital, Sirsa","Dabwali Road, Sirsa Near Easy Day",Yes (14),6,5,3,0,6,5,3,0,Yes,To Be Updated,Yes,Yes,Yes,"12:31 PM 2nd Aug,22",2022-08-02 12:31,20
"Jagdish Nursing Home, Sirsa","Gandhi Market, Parshuram Chowk, Sirsa",Yes (9),6,3,0,1,6,3,0,1,Yes,No,Yes,Yes,Yes,"12:30 PM 2nd Aug,22",2022-08-02 12:30,20
"Jeevan Jyoti Hospital, Sirsa",Dabwali Road Sirsa,Yes (8),0,2,6,1,0,2,6,1,Yes,No,Yes,Yes,Yes,"12:24 PM 2nd Aug,22",2022-08-02 12:24,20
"Khurana Hospital, Sirsa",Dabwali Road Sirsa,Yes (10),6,0,4,0,6,0,4,0,Yes,No,Yes,Yes,Yes,"12:24 PM 2nd Aug,22",2022-08-02 12:24,20
"Lalgarhia Hospital, Sirsa",Dabwali Road Sirsa,Yes (22),15,4,3,2,15,4,3,2,Yes,Yes,Yes,No,Yes,"12:25 PM 2nd Aug,22",2022-08-02 12:25,20
"Medicare Hospital, Sirsa","Dabwali Road, Sirsa",Yes (9),2,3,4,2,2,3,4,2,Yes,Yes,Yes,Yes,Yes,"12:34 PM 2nd Aug,22",2022-08-02 12:34,20
"Metro Health Care Hospital, Sirsa","Near Dena Bank, lal Batti Chowk, Sirsa",Yes (14),1,9,4,1,1,9,4,1,Yes,Yes,Yes,Yes,Yes,"12:29 PM 2nd Aug,22",2022-08-02 12:29,20
"Mittal Hospital, Sirsa","Near Jhunthra Petrol Pump, Dabwali Road Sirsa",Yes (19),14,1,4,0,14,1,4,0,Yes,No,Yes,Yes,Yes,"5:14 PM 7th Jun,22",2022-06-07 17:14,20
"New Life Care Hospital, Sirsa","Dabwali Road, Sirsa",Yes (11),7,2,2,1,7,2,2,1,Yes,No,Yes,Yes,Yes,"12:26 PM 2nd Aug,22",2022-08-02 12:26,20
"Poonia COVID Care Center, Sirsa","Near Ambedkar chowk, opposite Seth tula ram dharamshala, Hisar Road, Sirsa, Haryana 125055",Yes (24),10,8,6,1,10,8,6,1,Yes,Yes,Yes,Yes,Yes,"12:25 PM 2nd Aug,22",2022-08-02 12:25,20
"Sanjeevni Hospital, Sirsa (Wing -2, 1 &amp; 2nd Floor)","Under over bridge, hisar road, sirsa",Yes (35),30,0,5,5,30,0,5,5,Yes,Yes,Yes,Yes,Yes,"12:24 PM 2nd Aug,22",2022-08-02 12:24,20
SDCH Dabwali,"Dabwali, District Sirsa",Yes (100),100,0,0,2,100,0,0,2,Yes,No,Yes,Yes,Yes,"12:25 PM 2nd Aug,22",2022-08-02 12:25,20
"Shah Satnam Dera Hospital (Wing -2, 2nd floor), Sirsa","Begu Road, Sirsa",Yes (65),21,30,14,7,21,30,14,7,Yes,Yes,Yes,Yes,Yes,"12:08 PM 2nd Aug,22",2022-08-02 12:08,20
"Shivam Hospital, Sirsa",Surkhab Chowk Sirsa,Yes (18),8,8,2,2,8,8,2,2,Yes,No,Yes,Yes,To Be Updated,"12:29 PM 2nd Aug,22",2022-08-02 12:29,20
"Shri Baba Tara Hospital &amp; Research Center, Sirsa","Hisar Road, Sirsa",Yes (25),15,5,5,3,15,5,5,3,Yes,No,Yes,Yes,Yes,"12:29 PM 2nd Aug,22",2022-08-02 12:29,20
"SPS Hospital, Sirsa","Near Sangwan Chowk, Dabwali Road, Sirsa",Yes (21),14,4,3,3,14,4,3,3,Yes,No,Yes,Yes,Yes,"12:36 PM 2nd Aug,22",2022-08-02 12:36,20
"Suraksha Hospital, Sirsa","Dabwali Rd, opposite Hotel Aroma, Sirsa, Haryana 125055",Yes (20),9,3,8,4,9,3,8,4,Yes,No,Yes,Yes,Yes,"12:26 PM 2nd Aug,22",2022-08-02 12:26,20
"Swastik Hospital, Sirsa","Ambedkar Chowk, Nandan Vatika, Sirsa,",Yes (15),5,5,5,0,5,5,5,0,Yes,No,Yes,Yes,Yes,"11:12 AM 15th Jun,22",2022-06-15 11:12,20
"Talwar Nursing Home, Sirsa","Under Over Bridge, Hisar Road, Sirsa",Yes (24),11,10,3,1,11,10,3,1,Yes,Yes,Yes,Yes,Yes,"12:30 PM 2nd Aug,22",2022-08-02 12:30,20
"Tomar Nursing Home, Sirsa","Nandan Vatika, near surkhab Chock, Hathi park, Agrasain Colony, Sirsa, Haryana 125055",Yes (17),14,0,3,1,14,0,3,1,Yes,Yes,Yes,Yes,Yes,"12:27 PM 2nd Aug,22",2022-08-02 12:27,20
"Vardan Hospital, Sirsa","Near Lal Batti Chowk, Sirsa",Yes (18),9,3,6,0,9,3,6,0,Yes,No,Yes,Yes,Yes,"12:28 PM 2nd Aug,22",2022-08-02 12:28,20
Adiyogi Arogya Avenue,"232, Subhash Nagar, Near civil hospital back gate, Jhajjar",Yes (15),7,2,6,1,7,2,6,1,To Be Updated,To Be Updated,Yes,Yes,Yes,"5:15 PM 7th Jun,22",2022-06-07 17:15,8
"Advanta Hospital, Jhajjar city","Silani Gate, Jhajjar, Haryana",Yes (50),24,10,16,1,24,10,16,1,Yes,To Be Updated,Yes,To Be Updated,Yes,"1:50 PM 3rd Mar,22",2022-03-03 13:50,8
"Brahm Shakti Sanjivani Hospital, B.garh","Opp. BSNL Exchange, Delhi - Rohtak Road, NH9, Bahadurgarh, Haryana",Yes (100),60,20,20,3,60,20,20,3,Yes,No,Yes,Yes,Yes,"5:12 PM 7th Jun,22",2022-06-07 17:12,8
Civil Hospital Jhajjar,"Jhajjar, NH-71, Jhajjar Rohtak Road, Jhajjar, Jhajjar, Haryana",Yes (38),33,0,5,5,33,0,5,5,Yes,To Be Updated,To Be Updated,To Be Updated,To Be Updated,"5:14 PM 7th Jun,22",2022-06-07 17:14,8
"Delhi Hospital, Bahadurgarh","Rohtak Rd, near Shyamji Complex, Ram Nagar, Bahadurgarh, Haryana",Yes (50),20,20,10,2,20,20,10,2,Yes,No,Yes,Yes,Yes,"5:12 PM 7th Jun,22",2022-06-07 17:12,8
Dr. Sanjay Multi Speciality Hospital,INFRONT OF CIVIL HOSPITAL BAHADURGARH,Yes (61),45,10,6,1,45,10,6,1,Yes,No,No,To Be Updated,To Be Updated,"1:50 PM 3rd Mar,22",2022-03-03 13:50,8
"Jeewan Jyoti Hospital, Bahadurgarh","Rohtak Rd, MIE Part-B, Bahadurgarh, Haryana",Yes (143),70,68,5,4,70,68,5,4,Yes,To Be Updated,To Be Updated,To Be Updated,To Be Updated,"6:34 PM 15th Jun,22",2022-06-15 18:34,8
"JK Hospital, Bahadurgarh","Bahadurgarh,, Bahamnoli, Bahadurgarh, Haryana",No (0),0,0,0,0,0,0,0,0,To Be Updated,To Be Updated,To Be Updated,To Be Updated,To Be Updated,"11:42 AM 15th Jun,22",2022-06-15 11:42,8
"Medicare Super Speciality Hospiatl &amp; Trauma Centre, Jhajjar City","Dadri road Jhajjar, Jhajjar, Haryana",Yes (50),15,23,12,3,15,23,12,3,Yes,To Be Updated,Yes,To Be Updated,Yes,"1:50 PM 3rd Mar,22",2022-03-03 13:50,8
"Mission Hospital, Bahadurgarh","Near main Bus Stand & City Metro Station, Rohtak Rd, Bahadurgarh, Jhajjar ,Haryana",Yes (33),25,0,8,4,25,0,8,4,To Be Updated,No,Yes,Yes,No,"1:50 PM 3rd Mar,22",2022-03-03 13:50,8
"Oscar Hospital, JJR city","Civil Road,Opp Civil Hospital, Jhajjar, Haryana",Yes (80),8,58,14,1,8,58,14,1,To Be Updated,To Be Updated,To Be Updated,To Be Updated,To Be Updated,"1:50 PM 3rd Mar,22",2022-03-03 13:50,8
Oxymus Hospital,"Opposite Civil Hospital, Near Metro Pollar No. 876 Delhi Rohtak Road, Bahadurgarh",Yes (10),4,0,6,0,4,0,6,0,Yes,No,No,No,No,"5:15 PM 7th Jun,22",2022-06-07 17:15,8
"Rana Hospital, Bahadurgarh","OPP. REST HOUSE,OLD BARAHI ROAD, BAHADURGARH",Yes (25),18,0,7,2,18,0,7,2,To Be Updated,To Be Updated,No,No,Yes,"5:15 PM 7th Jun,22",2022-06-07 17:15,8
"RJ Super Speciality Hospital, B.garh","Delhi - Rohtak Rd, Near Rajesh Joon Office, Dalbir Nagar, Bahadurgarh, Haryana",Yes (17),10,5,2,1,10,5,2,1,Yes,No,Yes,Yes,Yes,"5:12 PM 7th Jun,22",2022-06-07 17:12,8
RS GAUR GLOBAL MULTISPECIALITY HOSPITAL,"Jhajjar Road Netaji Subhash Vihar, Haryana",Yes (33),19,7,7,2,19,7,7,2,Yes,No,Yes,Yes,Yes,"1:50 PM 3rd Mar,22",2022-03-03 13:50,8
"SDH, Bahadurgarh","Madhya Marg, Old Industrial Area, Bahadurgarh, Haryana",Yes (35),27,0,8,8,27,0,8,8,Yes,Yes,Yes,No,Yes,"1:50 PM 3rd Mar,22",2022-03-03 13:50,8
"Shivam Hospital, B.garh","Line Par, Shastri Nagar, Netaji Nagar, Bahadurgarh, Haryana",Yes (51),30,15,6,1,30,15,6,1,Yes,No,Yes,Yes,Yes,"5:12 PM 7th Jun,22",2022-06-07 17:12,8
"Swastik Hospital, Bahadurgarh","Jhajjar Rd, Shakti Nagar, Sakti Nagar, Bahadurgarh, Haryana",Yes (40),26,4,10,2,26,4,10,2,Yes,No,Yes,Yes,Yes,"1:50 PM 3rd Mar,22",2022-03-03 13:50,8
World College Of Medical Sciences And Hospital,"Jhajjar Sampla Road, Gurwar, Jhajjar, Haryana",Yes (250),90,135,25,4,90,135,25,4,Yes,Yes,Yes,Yes,Yes,"5:12 PM 7th Jun,22",2022-06-07 17:12,8
ABLE HOSPITAL,,Yes (37),10,25,2,2,10,25,2,5,Yes,No,Yes,Yes,Yes,"1:50 PM 3rd Mar,22",2022-03-03 13:50,15
Apex Hospital,"Prakash Vihar, Delhi Mathura Road, Palwal, Haryana",Yes (19),13,0,6,2,13,0,6,2,Yes,No,Yes,Yes,Yes,"1:50 PM 3rd Mar,22",2022-03-03 13:50,15
ATLAS HOSPITAL,"Palwal, Haryana",Yes (14),1,11,2,2,2,11,2,2,To Be Updated,To Be Updated,To Be Updated,To Be Updated,To Be Updated,"1:50 PM 3rd Mar,22",2022-03-03 13:50,15
BIKAL HOSPITAL,"PALWAL, HARYANA",Yes (21),13,5,3,0,13,5,3,0,Yes,No,Yes,Yes,Yes,"1:50 PM 3rd Mar,22",2022-03-03 13:50,15
CHC Alawalpur,CHC Alawalpur,Yes (17),1,16,0,0,4,16,0,0,To Be Updated,To Be Updated,To Be Updated,To Be Updated,To Be Updated,"5:14 PM 7th Jun,22",2022-06-07 17:14,15
Civil Hospital Palwal,"Civil Hospital, palwal",Yes (110),103,0,7,7,103,0,7,7,Yes,To Be Updated,To Be Updated,To Be Updated,To Be Updated,"5:14 PM 7th Jun,22",2022-06-07 17:14,15
COSMOS HOSPITAL,PALWAL,Yes (10),5,5,0,0,5,5,0,0,To Be Updated,To Be Updated,To Be Updated,To Be Updated,To Be Updated,"1:50 PM 3rd Mar,22",2022-03-03 13:50,15
GALAXY HOSPITAL,HUDA SECTOR 2,Yes (21),5,0,16,11,5,0,16,11,Yes,No,Yes,Yes,Yes,"1:50 PM 3rd Mar,22",2022-03-03 13:50,15
"Gurunanak Hospital, Palwal","NH2, Near Bus Stand, Shiv Colony, Palwal Haryana",Yes (37),18,4,15,3,18,4,15,3,Yes,Yes,Yes,Yes,Yes,"1:50 PM 3rd Mar,22",2022-03-03 13:50,15
JINDAL HOSPITAL,"Palwal, Haryana",Yes (15),10,2,3,0,10,2,3,0,To Be Updated,No,Yes,Yes,Yes,"5:14 PM 7th Jun,22",2022-06-07 17:14,15
NIDHI HOSPITAL,"Palwal, Haryana",Yes (12),2,7,3,0,2,7,3,0,Yes,No,Yes,Yes,Yes,"5:14 PM 7th Jun,22",2022-06-07 17:14,15
Palwal Hospital,"Moti Colony, Palwal, Haryana",Yes (22),0,6,16,1,0,6,16,1,Yes,No,Yes,Yes,Yes,"5:13 PM 7th Jun,22",2022-06-07 17:13,15
RAHUL HOSPITAL,PALWAL,Yes (15),7,5,3,0,7,5,3,0,Yes,No,Yes,Yes,Yes,"1:50 PM 3rd Mar,22",2022-03-03 13:50,15
Sachin Hospital,"New Sohna Road, Near Panchwati Chowk, Palwal Haryana",Yes (28),10,5,13,2,10,5,13,2,Yes,Yes,Yes,Yes,Yes,"1:50 PM 3rd Mar,22",2022-03-03 13:50,15
SDH Hodal,SDH Hodal,Yes (20),10,10,0,0,10,10,0,0,Yes,No,Yes,Yes,Yes,"5:14 PM 7th Jun,22",2022-06-07 17:14,15
Shri. Satya Sai Sanjivani Hospital Palwal,"Palwal, Haryana",Yes (23),4,16,3,2,4,17,4,2,Yes,No,Yes,Yes,Yes,"5:12 PM 7th Jun,22",2022-06-07 17:12,15
SRI SAI HOSPITAL,"Palwal, Haryana",Yes (6),0,6,0,0,0,6,0,0,Yes,No,Yes,Yes,Yes,"5:14 PM 7th Jun,22",2022-06-07 17:14,15
VASHU HOSPITAL,,Yes (10),10,0,0,0,10,0,0,0,Yes,No,Yes,Yes,Yes,"1:50 PM 3rd Mar,22",2022-03-03 13:50,15
Cygnus Multispecialty Hospital Kaithal,"Huda Bypass Road, Sector 20, Kaithal, Haryana",Yes (40),28,0,12,2,28,0,12,2,Yes,No,Yes,Yes,Yes,"3:30 PM 29th Nov,22",2022-11-29 15:30,10
District Civil Hospital Kaithal,"Huda Sec 18, Kaithal",Yes (115),80,15,20,20,80,15,20,20,Yes,Yes,No,Yes,Yes,"2:13 PM 2nd Dec,22",2022-12-02 14:13,10
SDH Guhla,SDH Guhla,Yes (70),35,35,0,5,35,35,0,5,Yes,No,Yes,No,Yes,"3:31 PM 29th Nov,22",2022-11-29 15:31,10
Shah Multispecialty Hospital Kaithal,"opp.old, bus stand, Jind - Kaithal Rd, Amar Garh Colony, Kaithal, Haryana",Yes (75),50,11,14,10,51,11,15,10,Yes,No,Yes,Yes,Yes,"3:50 PM 29th Nov,22",2022-11-29 15:50,10
Civil Hospital Fatehabad,Near Bus Stand Fatehabad,Yes (46),20,0,26,6,20,0,26,6,Yes,Yes,Yes,Yes,Yes,"3:07 PM 2nd Aug,22",2022-08-02 15:07,5
Civil Hospital Ratia,"Dera Surjanhar, Ratia, Fatehabad",Yes (50),18,26,6,3,18,26,6,3,Yes,Yes,Yes,Yes,Yes,"3:11 PM 2nd Aug,22",2022-08-02 15:11,5
"Civil Hospital, Tohana",Opposite New Sabzi Mandi Tohana,Yes (27),10,3,14,2,10,3,14,2,Yes,Yes,Yes,Yes,Yes,"3:03 PM 2nd Aug,22",2022-08-02 15:03,5
Community Health Center Bhattu,"Surya Nagar, Bhattu Mandi near Railway Station",Yes (12),4,2,6,0,4,2,6,0,Yes,Yes,Yes,Yes,Yes,"3:16 PM 2nd Aug,22",2022-08-02 15:16,5
Community Health Center Bhuna,CHC Bhuna,Yes (30),15,15,0,0,15,15,0,0,Yes,No,Yes,Yes,Yes,"3:13 PM 2nd Aug,22",2022-08-02 15:13,5
Community Health Center JAKHAL,Near SBI Bank Jakhal,Yes (12),6,0,6,0,6,0,6,0,Yes,Yes,Yes,Yes,Yes,"3:16 PM 2nd Aug,22",2022-08-02 15:16,5
"Gupta Children Hospital, Ratia","Aggarwal Colony, Ratia",Yes (16),6,8,2,1,6,8,2,1,Yes,Yes,Yes,Yes,Yes,"1:07 PM 3rd Aug,22",2022-08-03 13:07,5
Kaushal Hospital,"Near Harvinder Singh Petrol Pump, Hisar Road, Fatehabad",Yes (18),12,0,6,4,12,0,6,4,Yes,Yes,Yes,Yes,Yes,"5:15 PM 7th Jun,22",2022-06-07 17:15,5
"Manav Sewa Sangam Hospital, Tohana",Near Truck Union,Yes (30),20,10,0,0,20,10,0,0,Yes,Yes,Yes,Yes,Yes,"1:18 PM 3rd Aug,22",2022-08-03 13:18,5
Miglani Hospital,"Employees Colony, Ratia,",Yes (20),15,3,2,2,15,3,2,2,Yes,Yes,Yes,Yes,Yes,"3:26 PM 2nd Aug,22",2022-08-02 15:26,5
Rajasthan Medical Centre (RMC) Hospital Tohana,Kenchi Chowk Tohana,Yes (15),11,0,4,2,11,0,4,2,Yes,Yes,Yes,Yes,Yes,"3:48 PM 2nd Aug,22",2022-08-02 15:48,5
Sadhbhawdna Hospital Fatehabad,Near Court Complex Hisar Road Fatehabad,Yes (50),25,10,15,5,25,10,15,5,Yes,Yes,Yes,Yes,Yes,"3:21 PM 2nd Aug,22",2022-08-02 15:21,5
Sanjeevani Hospital Fatehabad,"Goshala Road, near Ashirbad Pelace",Yes (10),6,0,4,3,6,0,4,3,Yes,Yes,Yes,Yes,Yes,"3:44 PM 18th Aug,22",2022-08-18 15:44,5
Sanjeevani Hospital Tohana,"Kenchi Chock, Tohana",Yes (18),0,6,12,2,0,6,12,2,Yes,No,Yes,Yes,Yes,"1:18 PM 3rd Aug,22",2022-08-03 13:18,5
"Singla Hospital , fatehabad","Bhattu Road, Batra Colony, Fatehabad",Yes (13),5,8,0,0,5,8,0,0,Yes,Yes,Yes,Yes,Yes,"3:39 PM 2nd Aug,22",2022-08-02 15:39,5
WadhwaMaternity and surgical Hospital Fatehabad,"Near Papiha Park, Fatehabad",Yes (8),1,0,7,1,1,0,7,1,Yes,Yes,Yes,Yes,Yes,"10:29 AM 3rd Aug,22",2022-08-03 10:29,5
"AADHAR Hospital, Hisar",Tosham Road Hisar,Yes (43),25,6,12,6,26,6,12,6,Yes,No,No,Yes,Yes,"12:20 PM 17th Jun,22",2022-06-17 12:20,7
Amandeep Hospital,ITI CHOWK TOSHAM ROAD HISAR,Yes (5),3,0,2,5,3,0,2,5,To Be Updated,No,No,Yes,Yes,"9:38 AM 23rd Aug,22",2022-08-23 09:38,7
Bharat Multispeciality Hospital,Hisar,Yes (26),16,0,10,2,16,0,10,2,Yes,No,Yes,Yes,Yes,"5:13 PM 7th Jun,22",2022-06-07 17:13,7
Central Medical Centre (CMC),CMC Hospital Delhi Road Hisar,Yes (62),46,7,9,3,46,7,9,3,Yes,Yes,Yes,Yes,No,"11:46 AM 22nd Aug,22",2022-08-22 11:46,7
Churamani Hospital,CAMP CHOWK HISAR,Yes (37),5,2,30,5,5,2,30,5,No,No,No,No,No,"1:50 PM 3rd Mar,22",2022-03-03 13:50,7
District Civil Hospital Hisar,Sirsa Road Hisar,Yes (79),79,0,0,20,80,0,0,20,Yes,Yes,Yes,Yes,Yes,"5:13 PM 7th Jun,22",2022-06-07 17:13,7
DR. ANANTRAM JANTA HOSPITAL PVT LTD BARWALA,Civil Hospital Road Barwala,Yes (17),17,0,0,3,17,0,0,3,Yes,No,Yes,Yes,Yes,"1:50 PM 3rd Mar,22",2022-03-03 13:50,7
Geetanjali Hospital,Model Town Hisar,Yes (48),40,0,8,4,40,0,8,4,Yes,Yes,Yes,Yes,Yes,"12:13 PM 15th Aug,22",2022-08-15 12:13,7
Goswami Hospital,"NEAR BUS STAND, RISHI NAGAR",Yes (9),4,5,0,1,4,5,0,1,Yes,To Be Updated,To Be Updated,To Be Updated,To Be Updated,"12:42 PM 2nd Aug,22",2022-08-02 12:42,7
Gupta Hospital Hisar,Sector 14 Hisar,Yes (35),30,0,5,0,30,0,5,0,Yes,Yes,Yes,No,Yes,"9:17 AM 8th Aug,22",2022-08-08 09:17,7
GUPTA MEDICAL CENTRE,"OPP. MADHUBAN PARK ,PREMNAGAR HISAR",Yes (3),1,0,2,1,1,0,2,1,Yes,To Be Updated,To Be Updated,To Be Updated,To Be Updated,"11:20 AM 15th Jun,22",2022-06-15 11:20,7
"GURU JAMBHESHWAR MULTISPECIALITY HOSPITAL, AGROHA","ADAMPUR ROAD, AGROHA",Yes (14),9,3,2,1,9,3,2,1,Yes,No,Yes,Yes,Yes,"1:35 PM 12th Aug,22",2022-08-12 13:35,7
Holy Help Hospital,Tosham Road Hisar,Yes (39),25,6,8,1,25,6,8,1,Yes,No,Yes,Yes,Yes,"5:13 PM 7th Jun,22",2022-06-07 17:13,7
Janki Children Hospital Hisar,Near Sewak Sabha Hopsital Hisar,Yes (2),0,Beds Over Utilized 1,2,2,0,1,2,2,Yes,No,Yes,Yes,Yes,"10:39 AM 15th Jun,22",2022-06-15 10:39,7
Mahatma Gandhi Hospital,,Yes (42),19,13,10,8,19,13,10,8,To Be Updated,Yes,Yes,Yes,Yes,"2:20 PM 10th Oct,22",2022-10-10 14:20,7
MALIK HOSPITAL,"145A UTTAM NAGAR, HANSI",Yes (7),7,0,0,3,7,0,0,3,Yes,No,Yes,No,No,"5:15 PM 7th Jun,22",2022-06-07 17:15,7
MAMC Agroha,"Maharaj Aggarsin Medical College, VPO Agroha",Yes (140),85,15,40,60,85,15,40,60,To Be Updated,To Be Updated,To Be Updated,To Be Updated,To Be Updated,"1:12 PM 2nd Aug,22",2022-08-02 13:12,7
Military Hospital Hisar,Cantt Hisar,Yes (70),18,52,0,5,18,52,0,5,Yes,To Be Updated,Yes,Yes,No,"2:06 PM 19th Oct,22",2022-10-19 14:06,7
NEKIRAM HOSPITAL,OPP BUS STAND HANSI,Yes (5),2,0,3,3,2,0,3,3,Yes,To Be Updated,To Be Updated,To Be Updated,To Be Updated,"12:52 PM 26th Nov,22",2022-11-26 12:52,7
OPJindal Institute of Cancer &amp; Research Hospital,Model Town Hisar,Yes (144),100,4,40,44,100,4,41,45,Yes,Yes,Yes,Yes,Yes,"5:13 PM 7th Jun,22",2022-06-07 17:13,7
PARDEEP KANSAL MULTISPECIALITY HOSPITAL FOR CHILDREN,"25- Inderprastha Colony, Hisar",Yes (13),0,6,7,3,0,6,7,3,Yes,No,Yes,Yes,Yes,"1:50 PM 3rd Mar,22",2022-03-03 13:50,7
Parnami Hospital,Hisar,Yes (28),21,5,2,2,21,5,2,2,Yes,Yes,Yes,Yes,Yes,"5:13 PM 7th Jun,22",2022-06-07 17:13,7
Ravindra Hospital Hisar,Model Town HISAR,Yes (21),19,0,2,1,19,0,2,1,Yes,No,Yes,Yes,Yes,"1:50 PM 3rd Mar,22",2022-03-03 13:50,7
SAANVI HOSPITAL,"CHC ROAD, BARWALA",Yes (9),5,0,4,1,5,0,4,1,Yes,No,Yes,To Be Updated,To Be Updated,"5:15 PM 7th Jun,22",2022-06-07 17:15,7
Sapra Hospital,Rajgarh Road Hisar,Yes (28),19,3,6,12,19,3,6,12,Yes,Yes,Yes,No,Yes,"10:56 AM 6th Apr,22",2022-04-06 10:56,7
"Sarvodya Hospital, Hisar",Delhi Road Hisar,Yes (22),13,6,3,3,13,6,3,3,Yes,Yes,Yes,Yes,Yes,"9:02 AM 4th Nov,22",2022-11-04 09:02,7
Sewak Sabha Hospital,Near Bus Stand Hisar,Yes (27),16,3,8,1,16,3,8,1,Yes,Yes,Yes,Yes,Yes,"10:45 AM 12th Sep,22",2022-09-12 10:45,7
Shanti Devi Hospital,Delhi Road Hisar,Yes (38),26,0,12,2,26,0,12,2,Yes,Yes,Yes,Yes,Yes,"12:01 PM 2nd Aug,22",2022-08-02 12:01,7
Shri Kali Devi Hospital Hansi,Delhi Road Hansi,Yes (13),8,0,5,0,8,0,5,0,To Be Updated,No,To Be Updated,Yes,Yes,"5:13 PM 7th Jun,22",2022-06-07 17:13,7
SINGLA MULTISPECIALITY HOSPITAL,"RISHI NAGAR, GALI NO. 1, NEAR BUS STAND, HISAR",Yes (19),17,0,2,1,17,0,2,1,Yes,No,Yes,Yes,Yes,"1:50 PM 3rd Mar,22",2022-03-03 13:50,7
