name,address,Availability_availability_of_beds,Availability_oxygen_beds,Availability_non_oxygen_beds,Availability_i_c_u_beds,Availability_ventilators,Allocated_oxygen_beds,Allocated_non_oxygen_beds,Allocated_i_c_u,Allocated_ventilators,Availability_availability_of_oxygen,Availability_antiviral_remdesivir_etc_,Availability_steroids,Availability_anticoagulant,Availability_antipyretic,updated_on_unparsed,updated_on,city
Advanta Super Speciality Hospital,Near Power House,Yes (20),14,1,5,4,14,1,5,4,Yes,No,Yes,Yes,Yes,"1:50 PM 3rd Mar,22",2022-03-03 13:50,19
ARS Holy Heart Advanced Cardiac care &amp; Research Centre,"330, Vinay Nagar Rohtak, Near Delhi Bypass Rohtak",Yes (20),0,0,20,2,0,0,20,2,Yes,No,No,No,No,"1:50 PM 3rd Mar,22",2022-03-03 13:50,19
CHC Chiri,"VOP Chiri, Meham Gohana Road, Distt. Rohtak Haryana",Yes (10),10,0,0,0,10,0,0,0,Yes,Yes,Yes,Yes,Yes,"1:50 PM 3rd Mar,22",2022-03-03 13:50,19
CHC Kahanaur,"Near Sarva haryana Gramin Bank, Opp. Banquet hall, Nigana Road, Kahanaur",Yes (10),4,6,0,0,4,6,0,0,Yes,No,Yes,No,Yes,"1:50 PM 3rd Mar,22",2022-03-03 13:50,19
CHC kalanaur,"Police Station, Bhiwani-Rohtak Road , Near Kalanaur kalan, Kalanaur,",Yes (10),10,0,0,0,10,0,0,0,Yes,No,Yes,No,Yes,"1:50 PM 3rd Mar,22",2022-03-03 13:50,19
CHC Kiloi,"VPO Kiloi, Water Works, Distt. Rohtak",Yes (10),5,5,0,0,5,5,0,0,Yes,No,Yes,No,Yes,"1:50 PM 3rd Mar,22",2022-03-03 13:50,19
CHC Madina,"VPO Madina, Hisar Road Distt. Rohtak, Haryana",Yes (10),0,10,0,0,0,10,0,0,Yes,No,No,No,Yes,"1:50 PM 3rd Mar,22",2022-03-03 13:50,19
CHC Meham,"Near ITI, Meham Distt. Rohtak",Yes (10),10,0,0,0,10,0,0,0,Yes,No,Yes,No,Yes,"1:50 PM 3rd Mar,22",2022-03-03 13:50,19
CHC Sampla,"Gadi Sampla, Rohtak, SH-20, Jhajjar Sampla Road, Sampla, Sampla, Haryana 124501",Yes (10),0,10,0,0,0,10,0,0,No,No,Yes,No,Yes,"1:50 PM 3rd Mar,22",2022-03-03 13:50,19
"Civil Hospital, Rohtak",Subash Road,Yes (71),40,24,7,5,40,24,7,5,Yes,Yes,Yes,Yes,Yes,"1:50 PM 3rd Mar,22",2022-03-03 13:50,19
Holy Heart Super speciality Hospital,Vinay Nagar Delhi Bye pass,Yes (34),20,4,10,4,20,5,10,4,Yes,No,Yes,Yes,Yes,"1:50 PM 3rd Mar,22",2022-03-03 13:50,19
"Hridaya Nilayam Heart, Lung &amp; vascular Institute","5, Raj Garden, Delhi Bypass, Rohtak",Yes (51),47,0,4,4,47,0,4,4,To Be Updated,To Be Updated,To Be Updated,To Be Updated,To Be Updated,"1:50 PM 3rd Mar,22",2022-03-03 13:50,19
Joyline Multispeciality,"Surajmal Colony, Sunarian Road, Opposite Birgadier Muktram Statue Rohtak",Yes (20),15,0,5,1,15,0,5,1,Yes,Yes,Yes,Yes,Yes,"1:50 PM 3rd Mar,22",2022-03-03 13:50,19
Kainos Hospital,Near Kheri Sadh Village Outer Bye Pass,Yes (70),26,10,34,17,26,10,34,17,Yes,No,Yes,Yes,Yes,"1:50 PM 3rd Mar,22",2022-03-03 13:50,19
Life Care Hospital,Subash Nagar,Yes (50),20,0,30,7,20,0,30,7,Yes,No,Yes,Yes,Yes,"1:50 PM 3rd Mar,22",2022-03-03 13:50,19
Maan Hospital,Bhagwan Colony Near Radio Station,Yes (49),20,12,17,4,20,14,17,4,Yes,No,Yes,Yes,Yes,"1:50 PM 3rd Mar,22",2022-03-03 13:50,19
Mansarover Hospital,Mansarover Colony Near Park,Yes (30),20,Beds Over Utilized 1,10,7,20,0,10,7,Yes,No,Yes,Yes,Yes,"1:50 PM 3rd Mar,22",2022-03-03 13:50,19
Neurocentre Super Speciality Hospital,"Kalawati Bulding, Near Power House Rohtak",Yes (23),4,6,13,2,4,6,13,2,Yes,No,Yes,Yes,Yes,"1:50 PM 3rd Mar,22",2022-03-03 13:50,19
Noble Heart Super Speciality Hospital,Near Raj Garden Delhi Bye Pass,Yes (64),22,6,36,8,22,6,36,8,Yes,No,Yes,Yes,Yes,"1:50 PM 3rd Mar,22",2022-03-03 13:50,19
Oscar Super Speciality Trauma Center,"Medical Moad, Daryao Singh Nagar,",Yes (41),23,3,15,2,23,3,15,2,Yes,Yes,Yes,Yes,Yes,"1:50 PM 3rd Mar,22",2022-03-03 13:50,19
Oxygen Hospital,Islam Pura Daries Hisar Road,Yes (30),15,10,5,4,15,10,5,4,Yes,No,Yes,Yes,Yes,"1:50 PM 3rd Mar,22",2022-03-03 13:50,19
PGIMS Rohtak,"Pt.Bhagwat Dayal PGIMS, Medical Rd, Rohtak, Haryana",Yes (565),450,0,115,115,451,0,115,115,Yes,Yes,Yes,Yes,Yes,"9:35 AM 7th Jul,22",2022-07-07 09:35,19
Positron Hospital,Suncity Sector 35,Yes (29),0,14,15,6,0,14,16,6,Yes,No,Yes,Yes,Yes,"1:50 PM 3rd Mar,22",2022-03-03 13:50,19
Pragati Hospital,"Sukhpura Chowk, Gohana Road, opp. Ladhot Road Rohtak",Yes (35),30,0,5,2,30,0,5,2,Yes,No,Yes,Yes,Yes,"1:50 PM 3rd Mar,22",2022-03-03 13:50,19
"Sanghi Nursing Home, Rohtak, Haryana","Chotu Ram Chowk, Civil Road, Arya Nagar, Rohtak, Haryana",Yes (14),10,0,4,4,10,0,4,4,Yes,Yes,Yes,Yes,Yes,"1:50 PM 3rd Mar,22",2022-03-03 13:50,19
Shivam Liver &amp; Gastro Super Speciality Hospital,"CIVIL ROAD NEAR SHANT MAI CHOWK, Rohtak, Haryana - 124001, India",Yes (9),5,0,4,1,5,0,4,1,Yes,No,Yes,Yes,Yes,"1:50 PM 3rd Mar,22",2022-03-03 13:50,19
Sunflag Global Hospital,Bharat Colony Near Sheela Bye Pass,Yes (35),20,Beds Over Utilized 2,15,5,20,0,15,5,Yes,No,Yes,Yes,Yes,"1:50 PM 3rd Mar,22",2022-03-03 13:50,19
Cygnus Multispecialty Hospital Kaithal,"Huda Bypass Road, Sector 20, Kaithal, Haryana",Yes (40),28,0,12,2,28,0,12,2,Yes,No,Yes,Yes,Yes,"6:36 AM 6th Jul,22",2022-07-06 06:36,10
District Civil Hospital Kaithal,"Huda Sec 18, Kaithal",Yes (115),80,15,20,20,80,15,20,20,Yes,Yes,No,Yes,Yes,"8:37 AM 8th Jul,22",2022-07-08 08:37,10
SDH Guhla,SDH Guhla,Yes (70),35,35,0,5,35,35,0,5,Yes,No,Yes,No,Yes,"4:44 PM 8th Jul,22",2022-07-08 16:44,10
Shah Multispecialty Hospital Kaithal,"opp.old, bus stand, Jind - Kaithal Rd, Amar Garh Colony, Kaithal, Haryana",Yes (75),50,11,14,10,51,11,15,10,Yes,No,Yes,Yes,Yes,"10:36 AM 7th Jul,22",2022-07-07 10:36,10
Adiyogi Arogya Avenue,"232, Subhash Nagar, Near civil hospital back gate, Jhajjar",Yes (15),7,2,6,1,7,2,6,1,To Be Updated,To Be Updated,Yes,Yes,Yes,"5:15 PM 7th Jun,22",2022-06-07 17:15,8
"Advanta Hospital, Jhajjar city","Silani Gate, Jhajjar, Haryana",Yes (50),24,10,16,1,24,10,16,1,Yes,To Be Updated,Yes,To Be Updated,Yes,"1:50 PM 3rd Mar,22",2022-03-03 13:50,8
"Brahm Shakti Sanjivani Hospital, B.garh","Opp. BSNL Exchange, Delhi - Rohtak Road, NH9, Bahadurgarh, Haryana",Yes (100),60,20,20,3,60,20,20,3,Yes,No,Yes,Yes,Yes,"5:12 PM 7th Jun,22",2022-06-07 17:12,8
Civil Hospital Jhajjar,"Jhajjar, NH-71, Jhajjar Rohtak Road, Jhajjar, Jhajjar, Haryana",Yes (38),33,0,5,5,33,0,5,5,Yes,To Be Updated,To Be Updated,To Be Updated,To Be Updated,"5:14 PM 7th Jun,22",2022-06-07 17:14,8
"Delhi Hospital, Bahadurgarh","Rohtak Rd, near Shyamji Complex, Ram Nagar, Bahadurgarh, Haryana",Yes (50),20,20,10,2,20,20,10,2,Yes,No,Yes,Yes,Yes,"5:12 PM 7th Jun,22",2022-06-07 17:12,8
Dr. Sanjay Multi Speciality Hospital,INFRONT OF CIVIL HOSPITAL BAHADURGARH,Yes (61),45,10,6,1,45,10,6,1,Yes,No,No,To Be Updated,To Be Updated,"1:50 PM 3rd Mar,22",2022-03-03 13:50,8
"Jeewan Jyoti Hospital, Bahadurgarh","Rohtak Rd, MIE Part-B, Bahadurgarh, Haryana",Yes (143),70,68,5,4,70,68,5,4,Yes,To Be Updated,To Be Updated,To Be Updated,To Be Updated,"6:34 PM 15th Jun,22",2022-06-15 18:34,8
"JK Hospital, Bahadurgarh","Bahadurgarh,, Bahamnoli, Bahadurgarh, Haryana",No (0),0,0,0,0,0,0,0,0,To Be Updated,To Be Updated,To Be Updated,To Be Updated,To Be Updated,"11:42 AM 15th Jun,22",2022-06-15 11:42,8
"Medicare Super Speciality Hospiatl &amp; Trauma Centre, Jhajjar City","Dadri road Jhajjar, Jhajjar, Haryana",Yes (50),15,23,12,3,15,23,12,3,Yes,To Be Updated,Yes,To Be Updated,Yes,"1:50 PM 3rd Mar,22",2022-03-03 13:50,8
"Mission Hospital, Bahadurgarh","Near main Bus Stand & City Metro Station, Rohtak Rd, Bahadurgarh, Jhajjar ,Haryana",Yes (33),25,0,8,4,25,0,8,4,To Be Updated,No,Yes,Yes,No,"1:50 PM 3rd Mar,22",2022-03-03 13:50,8
"Oscar Hospital, JJR city","Civil Road,Opp Civil Hospital, Jhajjar, Haryana",Yes (80),8,58,14,1,8,58,14,1,To Be Updated,To Be Updated,To Be Updated,To Be Updated,To Be Updated,"1:50 PM 3rd Mar,22",2022-03-03 13:50,8
Oxymus Hospital,"Opposite Civil Hospital, Near Metro Pollar No. 876 Delhi Rohtak Road, Bahadurgarh",Yes (10),4,0,6,0,4,0,6,0,Yes,No,No,No,No,"5:15 PM 7th Jun,22",2022-06-07 17:15,8
"Rana Hospital, Bahadurgarh","OPP. REST HOUSE,OLD BARAHI ROAD, BAHADURGARH",Yes (25),18,0,7,2,18,0,7,2,To Be Updated,To Be Updated,No,No,Yes,"5:15 PM 7th Jun,22",2022-06-07 17:15,8
"RJ Super Speciality Hospital, B.garh","Delhi - Rohtak Rd, Near Rajesh Joon Office, Dalbir Nagar, Bahadurgarh, Haryana",Yes (17),10,5,2,1,10,5,2,1,Yes,No,Yes,Yes,Yes,"5:12 PM 7th Jun,22",2022-06-07 17:12,8
RS GAUR GLOBAL MULTISPECIALITY HOSPITAL,"Jhajjar Road Netaji Subhash Vihar, Haryana",Yes (33),19,7,7,2,19,7,7,2,Yes,No,Yes,Yes,Yes,"1:50 PM 3rd Mar,22",2022-03-03 13:50,8
"SDH, Bahadurgarh","Madhya Marg, Old Industrial Area, Bahadurgarh, Haryana",Yes (35),27,0,8,8,27,0,8,8,Yes,Yes,Yes,No,Yes,"1:50 PM 3rd Mar,22",2022-03-03 13:50,8
"Shivam Hospital, B.garh","Line Par, Shastri Nagar, Netaji Nagar, Bahadurgarh, Haryana",Yes (51),30,15,6,1,30,15,6,1,Yes,No,Yes,Yes,Yes,"5:12 PM 7th Jun,22",2022-06-07 17:12,8
"Swastik Hospital, Bahadurgarh","Jhajjar Rd, Shakti Nagar, Sakti Nagar, Bahadurgarh, Haryana",Yes (40),26,4,10,2,26,4,10,2,Yes,No,Yes,Yes,Yes,"1:50 PM 3rd Mar,22",2022-03-03 13:50,8
World College Of Medical Sciences And Hospital,"Jhajjar Sampla Road, Gurwar, Jhajjar, Haryana",Yes (250),90,135,25,4,90,135,25,4,Yes,Yes,Yes,Yes,Yes,"5:12 PM 7th Jun,22",2022-06-07 17:12,8
"AAROGYAM HOSPITAL, Kurukshetra","NEAR OLD BUS STAND, THANESAR, KURUSKHETRA",Yes (67),40,12,15,27,40,12,15,27,Yes,Yes,Yes,Yes,Yes,"5:13 PM 7th Jun,22",2022-06-07 17:13,12
"ADESH MEDICAL COLLEGE, SHAHBAD MOHRI KURUKSHETRA.","VILL. MOHRI, SHAHBAD, KURUSHETRA",Yes (105),30,70,5,11,30,70,5,11,Yes,Yes,Yes,Yes,Yes,"5:13 PM 7th Jun,22",2022-06-07 17:13,12
AGGARWAL NURSING HOME,"SALARPUR ROAD, THANESAR, KURUKSHETRA.",No (0),0,0,0,0,0,0,0,0,Yes,Yes,Yes,Yes,Yes,"5:13 PM 7th Jun,22",2022-06-07 17:13,12
B.S. HEART CARE,"OPP. NEW BUS STAND, KURUKSHETRA.",Yes (25),18,0,7,20,18,0,8,20,Yes,Yes,Yes,Yes,Yes,"5:13 PM 7th Jun,22",2022-06-07 17:13,12
"CYGNUS HOSPITAL, Kurukshetra","NEAR OLD BUS STAND, THANESAR, KURUSKHETRA",Yes (12),7,4,1,4,7,4,1,4,Yes,Yes,Yes,Yes,Yes,"5:13 PM 7th Jun,22",2022-06-07 17:13,12
KURUKSHETRA NURSING HOME,,Yes (19),18,0,1,2,18,0,1,2,Yes,Yes,Yes,Yes,Yes,"5:13 PM 7th Jun,22",2022-06-07 17:13,12
LNJP CIVIL HOSPITAL.,LNJP HOSPITAL KURUKSHETRA.,Yes (94),60,29,5,5,60,30,5,5,Yes,Yes,Yes,Yes,Yes,"2:23 PM 8th Jul,22",2022-07-08 14:23,12
MIRI PIRI SHAHBAD,"SHAHBAD, KURUKSHETRA",Yes (14),10,0,4,4,10,0,4,4,Yes,Yes,Yes,Yes,Yes,"5:13 PM 7th Jun,22",2022-06-07 17:13,12
Nirogi Hospital,Shahabad Kurukshetra,Yes (7),5,2,0,3,5,2,0,3,Yes,Yes,Yes,Yes,Yes,"5:14 PM 7th Jun,22",2022-06-07 17:14,12
"Saraswati Mission Hospital, Kurukshetra","Theme Park Road, Kurukshetra",Yes (20),4,0,16,2,4,0,16,2,Yes,Yes,Yes,Yes,Yes,"5:15 PM 7th Jun,22",2022-06-07 17:15,12
"Saraswati Mission Hospital, Pehowa","Ambala Road Dist. Kurukshetra, Pehowa, Haryana 136128",Yes (22),20,0,2,5,20,0,2,5,Yes,No,Yes,To Be Updated,Yes,"5:13 PM 7th Jun,22",2022-06-07 17:13,12
"SIDHARTH HOSPITAL, SHAHBAD","SHAHBAD, KURUKSHETRA",Yes (16),8,4,4,3,8,4,4,3,Yes,Yes,Yes,Yes,Yes,"5:13 PM 7th Jun,22",2022-06-07 17:13,12
VERMA HOSPITAL,LADWA,Yes (14),9,3,2,2,9,3,2,2,Yes,Yes,Yes,Yes,Yes,"5:13 PM 7th Jun,22",2022-06-07 17:13,12
"Aditya Neuro &amp; Spine Hospital, Rewari","Circular Rd, near Kanod gate, Raam Bagh Mahalla, Rewari, Haryana",Yes (10),8,0,2,2,8,0,2,2,Yes,No,Yes,Yes,Yes,"10:30 AM 15th Jun,22",2022-06-15 10:30,18
Advance Hospital,"Bawal Road, Model Town",Yes (8),5,0,3,0,5,0,6,1,Yes,No,Yes,Yes,Yes,"10:27 AM 15th Jun,22",2022-06-15 10:27,18
"Apex Hospital, Dharuhera","Plot No.5, Sector 6, Dharuhera, Haryana 123106",Yes (10),6,0,4,1,6,0,4,1,Yes,No,Yes,Yes,Yes,"10:31 AM 15th Jun,22",2022-06-15 10:31,18
Apollo Rewari/Family Health Edge Hospital,"Garhi Bolni Rd, near Public Health Office, krishna Nagar, Rewari, Haryana",Yes (27),17,3,7,0,17,3,7,0,Yes,No,Yes,Yes,Yes,"10:22 AM 15th Jun,22",2022-06-15 10:22,18
Capt. Nand Lal Hospital,"Circular Road near Government Girls Senior Secondary School naiwali, chowk, Rewari",Yes (20),6,10,4,1,11,10,8,1,Yes,No,Yes,Yes,Yes,"10:25 AM 15th Jun,22",2022-06-15 10:25,18
Civil Hospital rewari,"Kayasthwara Mohalla, Rewari, Haryana",Yes (89),59,16,14,4,59,16,14,4,Yes,Yes,Yes,Yes,Yes,"10:39 AM 15th Jun,22",2022-06-15 10:39,18
Cygnus Hospital Rewari,"Opposite Civil Hospital Mohola, Sanghi Ka Bass, Rewari, Haryana",Yes (32),21,7,4,1,26,7,9,2,Yes,No,Yes,No,Yes,"10:21 AM 15th Jun,22",2022-06-15 10:21,18
Devjyoti Hospital,"Ambedkar chowk, near Bus Stand, Rewari, Haryana",Yes (15),7,2,6,Beds Over Utilized 1,7,2,6,0,Yes,No,Yes,Yes,Yes,"10:37 AM 15th Jun,22",2022-06-15 10:37,18
Dr. K.K. NAGAR HOSPITAL,"317, Near Shishu Shala School, Model Town, Rewari, Haryana",Yes (12),2,0,10,0,2,0,10,0,Yes,No,Yes,Yes,Yes,"10:19 AM 15th Jun,22",2022-06-15 10:19,18
Dr. Vijay Pal Yadav Hospital,"Near Ambedker chowk, Rewari",Yes (7),2,2,3,0,3,3,4,0,Yes,No,Yes,Yes,Yes,"10:26 AM 15th Jun,22",2022-06-15 10:26,18
Kamla Nursing Home/Kalawati Hospital,"201, Model Town, Rewari, Near Bus Stand, Opposite Bal Bhawan, Shivam Chowk",Yes (23),14,0,9,6,14,0,9,6,Yes,No,Yes,Yes,Yes,"10:40 AM 15th Jun,22",2022-06-15 10:40,18
Katyal Hospital,"Katyal Hospital, KANOD GATE, CIRCULAR ROAD, Rewari, Haryana, India",Yes (21),9,6,6,0,12,6,10,1,Yes,No,Yes,Yes,Yes,"10:18 AM 15th Jun,22",2022-06-15 10:18,18
Maars Hospital,"Garhi Bolni Rd, near PWD Office, Sector 19, Rewari, Haryana",Yes (15),15,0,0,0,15,0,0,0,Yes,No,Yes,Yes,No,"10:24 AM 15th Jun,22",2022-06-15 10:24,18
"Manasavi Hospital, Rewari",,Yes (10),10,0,0,0,10,0,0,0,Yes,No,Yes,No,Yes,"10:31 AM 15th Jun,22",2022-06-15 10:31,18
Matrika Hospital,"Matrika Hospital, Ranbir Singh Huda Chowk, Bawal-Rewari Rd, Rewari, Haryana",Yes (45),30,0,15,3,30,0,15,3,To Be Updated,To Be Updated,To Be Updated,To Be Updated,To Be Updated,"11:46 AM 18th Jun,22",2022-06-18 11:46,18
Mediom Hospital/Medcare Hospital,"Sohna Rd, near Municipal Corporation, Dharuhera, Haryana",Yes (4),3,Beds Over Utilized 1,1,0,8,0,4,1,Yes,No,Yes,Yes,Yes,"10:19 AM 15th Jun,22",2022-06-15 10:19,18
Om Hospital,"Om Hospital, Nandrampur Bass Rd, Dharuhera, Haryana",Yes (24),12,4,8,0,12,4,8,0,Yes,No,Yes,Yes,Yes,"10:20 AM 15th Jun,22",2022-06-15 10:20,18
Pushpanjli Hospital Rewari,"Rajesh Pilot Chowk, Rewari, Haryana",Yes (80),60,10,10,4,60,10,10,4,No,No,Yes,Yes,Yes,"10:32 AM 15th Jun,22",2022-06-15 10:32,18
R. B. Yadav Hospital,"Dr. R B Yadav Hospital, Circular Rd Jainpuri, Kayasthwara Mohalla, Rewari, Haryana",Yes (22),8,6,8,2,8,6,8,2,Yes,No,Yes,Yes,Yes,"10:18 AM 15th Jun,22",2022-06-15 10:18,18
Samrat Hospital,Near Azad Chowk Rewari,Yes (9),5,0,4,3,5,0,10,3,Yes,No,Yes,Yes,Yes,"10:26 AM 15th Jun,22",2022-06-15 10:26,18
SDH Kosli,"Kosli, Rewari, Haryana",Yes (45),20,20,5,0,20,20,5,0,Yes,No,No,No,No,"10:40 AM 15th Jun,22",2022-06-15 10:40,18
Shanti Yadav Hospital,"Bawal-Rewari Rd Model Town, Rewari, Haryana",Yes (33),19,10,4,0,19,10,4,0,Yes,No,Yes,No,No,"10:35 AM 15th Jun,22",2022-06-15 10:35,18
Sheela Neuro &amp; Multi. Superspeciality Hospital,"Sheela Neuro Multi-Super Speciality Hospital, Opposite Jain Public School, Circular Road, Rewari",Yes (32),15,15,2,0,15,15,3,1,Yes,No,Yes,Yes,No,"10:19 AM 15th Jun,22",2022-06-15 10:19,18
Shri Ashwani Sexena Hospital,"343-L, Model town Rewari",Yes (10),7,3,0,0,7,3,0,0,Yes,No,Yes,Yes,Yes,"10:26 AM 15th Jun,22",2022-06-15 10:26,18
SMCC Hospital,"Sector 5 Rewari, Haryana",Yes (13),2,0,11,1,2,0,11,1,Yes,No,Yes,Yes,Yes,"10:25 AM 15th Jun,22",2022-06-15 10:25,18
Surendra Hospital Bawal,"Circuar Road, Rewari, Haryana",Yes (11),5,2,4,0,5,2,5,0,Yes,No,Yes,No,Yes,"10:27 AM 15th Jun,22",2022-06-15 10:27,18
"Sushma Devi Hospital, Bawal","Rewari Road, Bawal, Rewari, Near Power House & Bharat Petrol Pump",Yes (18),9,9,0,0,9,9,0,0,Yes,No,Yes,Yes,Yes,"10:24 AM 15th Jun,22",2022-06-15 10:24,18
Vedanta Hospital,"Circulare Road, Near Nirankari Satsang Bhavan Dharuhera, Chungi, Rewari, Haryana",Yes (29),0,7,22,0,0,7,30,0,Yes,No,Yes,Yes,Yes,"10:21 AM 15th Jun,22",2022-06-15 10:21,18
Virat Hospital,"Circular Rd, Near Oriental Bank of Commerce, Madhu Vihar, Rewari, Haryana",Yes (100),63,10,27,2,63,10,27,2,To Be Updated,To Be Updated,To Be Updated,To Be Updated,To Be Updated,"10:36 AM 15th Jun,22",2022-06-15 10:36,18
Yaduvanshi Hospital,"Maharana Pratap Chowk, Model Town, Rewari, Haryana",Yes (46),36,0,10,1,36,0,10,1,Yes,No,Yes,Yes,No,"10:34 AM 15th Jun,22",2022-06-15 10:34,18
ASHIRWAD BHAGAT HOSPITAL,"Old DC Rd, near bhagat hospital, Sonipat, Haryana 131001",Yes (15),12,0,3,1,12,0,3,1,Yes,Yes,Yes,Yes,Yes,"12:09 PM 16th Jun,22",2022-06-16 12:09,21
Bhagwan Dass Hospital,"Near Shahpur Turk, block-E, omaxe city, Sector 18, Sonipat, Haryana 131001",Yes (3),Beds Over Utilized 13,0,3,2,27,0,13,2,Yes,No,Yes,Yes,Yes,"3:55 PM 17th Jun,22",2022-06-17 15:55,21
"BPS MEDICAL COLLEGE KHANPUR , SONIPAT ( 01263283088)","Ganaur - Gohana Rd, Khanpur Kalan, Haryana",Yes (300),170,80,50,50,170,80,50,50,Yes,Yes,Yes,Yes,Yes,"8:37 AM 22nd Jun,22",2022-06-22 08:37,21
CHC GANUR,CHC GANUR,Yes (8),8,0,0,0,8,0,0,0,Yes,No,Yes,Yes,Yes,"12:04 PM 16th Jun,22",2022-06-16 12:04,21
CHC Kharkhoda,"SH 20, Kharkhoda, Haryana 131402",Yes (10),5,5,0,0,5,5,0,0,To Be Updated,To Be Updated,Yes,Yes,Yes,"5:14 PM 7th Jun,22",2022-06-07 17:14,21
"CHC, JUAN, SONIPAT, HARYANA","CHC, JUAN, SONIPAT, HARYANACHC, JUAN, SONIPAT, HARYANA, 131024",Yes (5),3,2,0,0,3,2,0,0,Yes,No,Yes,Yes,Yes,"5:15 PM 7th Jun,22",2022-06-07 17:15,21
"Civil Hospital, Sonipat (9050007668 )","Delhi Road, Near Maharana Pratap Chowk, Sonipat, Haryana 131001",Yes (200),190,0,10,10,190,0,10,10,To Be Updated,To Be Updated,To Be Updated,To Be Updated,To Be Updated,"8:48 PM 16th Jun,22",2022-06-16 20:48,21
"CYGNUS HOSPITAL, Sonipat","Old Rohtak Rd, near Hindu College of Engineering, Industrial Area, Sonipat, Haryana 131001",Yes (20),18,0,2,1,18,0,2,1,Yes,No,Yes,Yes,Yes,"11:20 AM 16th Jun,22",2022-06-16 11:20,21
Dayanand Hospital-Sonepat,"Kakroi Rd, Prem Nagar, West Ram Nagar, Sonipat, Haryana",Yes (40),35,Beds Over Utilized 1,5,3,35,0,5,3,Yes,No,Yes,Yes,Yes,"1:34 PM 20th May,22",2022-05-20 13:34,21
FIIMS Hospital,"Road, Bahalgarh, Sonipat, Haryana 131304",Yes (99),63,0,36,6,63,0,37,8,Yes,No,Yes,Yes,Yes,"1:50 PM 3rd Mar,22",2022-03-03 13:50,21
GAJRAJ HOSPITAL,"Bus Stand, Gajraj Hospital Road, Near, Gohana, Haryana 131301",Yes (20),20,0,0,0,20,0,0,0,Yes,To Be Updated,Yes,Yes,Yes,"1:50 PM 3rd Mar,22",2022-03-03 13:50,21
"GLAXY ONE HOSPITAL, SONIPAT","SH 11, Bahalgarh, Sonipat, Haryana 131021",Yes (18),18,Beds Over Utilized 4,Beds Over Utilized 5,Beds Over Utilized 1,20,0,0,0,Yes,To Be Updated,Yes,Yes,Yes,"5:14 PM 7th Jun,22",2022-06-07 17:14,21
HARYANA HOSPITAL,"Vivekanand Chowk, Delhi Rd, behind Bullet Showroom, Janta Colony, Sonipat, Haryana 131001",Yes (2),1,0,1,1,1,0,1,1,Yes,No,No,No,Yes,"5:14 PM 7th Jun,22",2022-06-07 17:14,21
MEMORIAL HOSPITAL,"SH 11, near Mama Bhanja Chowk, Nandwani Nagar, Anand Nagar,, Sonipat, Haryana 131001",Yes (20),16,0,4,2,16,0,4,2,Yes,No,Yes,Yes,Yes,"9:56 AM 15th Jun,22",2022-06-15 09:56,21
NIDAAN HOSPITAL PVT.,"Murthal Rd, Sonipat, Haryana 131001",No (0),0,0,0,0,0,0,0,0,Yes,No,Yes,Yes,Yes,"5:14 PM 7th Jun,22",2022-06-07 17:14,21
OSCAR HOSPITAL,"SH 11, Lakshmi Nagar, Sonipat, Haryana 131001",Yes (14),6,0,8,2,7,0,8,2,Yes,No,Yes,Yes,Yes,"5:14 PM 7th Jun,22",2022-06-07 17:14,21
PHC PURKHAS,"Purkhas, Haryana 131102",Yes (30),0,30,0,0,0,30,0,0,To Be Updated,To Be Updated,To Be Updated,To Be Updated,To Be Updated,"5:14 PM 7th Jun,22",2022-06-07 17:14,21
PREMPUSHP MULTISPECIALITY HOSPITAL,"SUBJI MANDI GANAUR,HARYANA SONIPAT 131101",Yes (20),20,0,0,0,20,0,0,0,To Be Updated,No,Yes,Yes,Yes,"5:15 PM 7th Jun,22",2022-06-07 17:15,21
"SANJIVNI HOSPITAL, SONIPAT","Mehlana Rd, Malviya Nagar, Sonipat, Haryana 131304",Yes (15),14,0,1,1,14,0,1,1,Yes,No,Yes,Yes,Yes,"11:01 AM 15th Jun,22",2022-06-15 11:01,21
SAXSENA HOSPITAL,"112/113, T.P. Scheme, Delhi Rd, Sonipat, Haryana 131304",Yes (23),18,0,5,2,18,0,5,2,Yes,No,Yes,Yes,Yes,"12:40 PM 16th Jun,22",2022-06-16 12:40,21
SDH GOHANA,"Devi Nagar, Uttam Nagar, Gohana, Haryana 131301",Yes (10),10,0,0,0,10,0,0,0,Yes,Yes,Yes,Yes,Yes,"5:14 PM 7th Jun,22",2022-06-07 17:14,21
SITA HOSPITAL SONIPAT,"Railway Rd, Ganaur, Haryana 131101",Yes (20),20,Beds Over Utilized 4,0,0,20,0,0,0,Yes,No,Yes,Yes,Yes,"10:48 AM 15th Jun,22",2022-06-15 10:48,21
SUNHERI DEVI HOSPITAL,"Mission Rd, Dev Nagar, Sonipat, Haryana 131001",Yes (20),15,0,5,1,15,0,5,1,Yes,No,Yes,Yes,Yes,"10:18 AM 16th Jun,22",2022-06-16 10:18,21
TULIP HOSPITAL,"T. P. Scheme, no.15, Delhi Rd, Vivekanand chowk, Sonipat, Haryana 131001",Yes (20),0,0,20,5,0,0,20,5,Yes,No,Yes,Yes,Yes,"1:36 PM 15th Jun,22",2022-06-15 13:36,21
"AMRITDHARA, Chaura Bazar","Near ITI Chowk, Gahoon Vihar, Karnal, Haryana",Yes (4),4,0,0,0,38,0,26,2,Yes,No,Yes,Yes,Yes,"5:13 PM 7th Jun,22",2022-06-07 17:13,11
Arpana Hospital,"G.T. Road, Madhuban, Karnal, Karnal, Haryana",Yes (18),16,0,2,1,16,0,2,1,Yes,No,Yes,Yes,Yes,"1:50 PM 3rd Mar,22",2022-03-03 13:50,11
Arsh Hospital,Opp. Kalpana Chawla Medical College,Yes (15),9,0,6,0,9,0,6,0,Yes,Yes,Yes,Yes,Yes,"5:15 PM 7th Jun,22",2022-06-07 17:15,11
CHC Assandh,"Assandh, Assandh Ruralpart, Haryana",Yes (10),10,0,0,0,10,0,0,0,Yes,No,Yes,No,Yes,"5:13 PM 7th Jun,22",2022-06-07 17:13,11
CHC Gharaunda,"Balinagar, Gharaunda, Haryana",Yes (10),10,0,0,0,10,0,0,0,Yes,No,Yes,No,Yes,"5:13 PM 7th Jun,22",2022-06-07 17:13,11
CHC Kunjpura,Village Kunjpura,Yes (11),11,0,0,0,11,0,0,0,To Be Updated,Yes,Yes,Yes,Yes,"5:15 PM 7th Jun,22",2022-06-07 17:15,11
CHC Nissing,"SH 8, Gondar, Nissing, Haryana",Yes (10),10,0,0,0,10,0,0,0,Yes,No,Yes,No,Yes,"5:13 PM 7th Jun,22",2022-06-07 17:13,11
CHC Taraori,CHC Taraori,Yes (6),6,0,0,0,6,0,0,0,Yes,No,Yes,No,Yes,"5:13 PM 7th Jun,22",2022-06-07 17:13,11
Ishwar Kirpa Hospital,"Ishwar Kirpa Hospital, Sector -14",Yes (21),14,0,7,0,14,0,7,0,Yes,Yes,Yes,Yes,Yes,"5:14 PM 7th Jun,22",2022-06-07 17:14,11
"Kalpana Chawla Government Medical College, Karnal","Model Town, Karnal, Haryana",Yes (2),1,0,1,0,200,0,80,80,Yes,Yes,Yes,Yes,Yes,"1:50 PM 3rd Mar,22",2022-03-03 13:50,11
Karnal Nursing Home,"26 Duggal Colony, Karnal",Yes (16),8,0,8,0,8,0,10,0,Yes,To Be Updated,Yes,Yes,Yes,"5:14 PM 7th Jun,22",2022-06-07 17:14,11
Park Hospital karnal,"CHD City, NH-1, Sector 45, Karnal, Haryana",Yes (30),10,0,20,2,10,0,20,2,To Be Updated,Yes,Yes,Yes,Yes,"5:12 PM 7th Jun,22",2022-06-07 17:12,11
Rama Superspeciality Hospital,Civil Hosp Chowk Karnal,No (0),0,0,0,0,8,0,6,0,Yes,No,Yes,Yes,Yes,"5:14 PM 7th Jun,22",2022-06-07 17:14,11
"Sanjiv Bansal Cygnus Hospital , Karnal","Railway Rd, Ibrahim Mandi, Karnal, Haryana",Yes (19),17,0,2,2,20,0,5,2,Yes,Yes,Yes,Yes,Yes,"5:13 PM 7th Jun,22",2022-06-07 17:13,11
Sarvodya Hospital Karnal,"Sector 14, Near Tau Devi Lal Chowk",Yes (22),12,0,10,0,12,0,10,0,Yes,Yes,Yes,Yes,Yes,"5:14 PM 7th Jun,22",2022-06-07 17:14,11
SDH Nilokheri,SDH Nilokheri,Yes (10),10,0,0,0,10,0,0,0,Yes,No,Yes,No,Yes,"5:13 PM 7th Jun,22",2022-06-07 17:13,11
Shri Ram Chand Memorial Hospital,"12, Ashoka colony,Opp Kalpana Chawla hospital, Karnal, Haryana",No (0),0,0,0,0,8,0,7,3,Yes,No,Yes,Yes,Yes,"5:13 PM 7th Jun,22",2022-06-07 17:13,11
Shri Sanatan Dharam Mahabir Dal,"Kunjpura Road, Karnal Near Sanatan Dharam Mandir",Yes (12),12,0,0,0,12,0,0,0,Yes,Yes,Yes,Yes,Yes,"5:13 PM 7th Jun,22",2022-06-07 17:13,11
SS Hospital,"Sector 14, Karnal",Yes (14),7,0,7,0,7,0,7,0,Yes,To Be Updated,Yes,Yes,Yes,"5:14 PM 7th Jun,22",2022-06-07 17:14,11
Swastik Hospital,Swastic Hospital Opp DCH,Yes (19),10,0,9,0,10,0,9,0,Yes,No,Yes,Yes,Yes,"5:13 PM 7th Jun,22",2022-06-07 17:13,11
Virk Hospital Karnal,"363-364, Randhir lane, near Dyal Singh College, Karnal, Haryana",Yes (45),37,0,8,1,37,0,8,1,Yes,Yes,Yes,Yes,Yes,"5:13 PM 7th Jun,22",2022-06-07 17:13,11
Ch Lekh Raj Multispeciality Hospital,Vill Gadhauli Yamuna Nagar,Yes (150),140,0,10,5,140,0,10,5,Yes,Yes,Yes,Yes,Yes,"11:21 AM 15th Jun,22",2022-06-15 11:21,22
CHC Bilaspur,CHC Bilaspur,Yes (23),8,15,0,0,8,17,0,0,Yes,No,Yes,No,Yes,"11:04 AM 15th Jun,22",2022-06-15 11:04,22
CHC Chhachharuli,CHC Chhachharuli,Yes (30),10,20,0,0,10,20,0,0,Yes,No,Yes,Yes,Yes,"11:04 AM 15th Jun,22",2022-06-15 11:04,22
CHC Naharpur,Naharpur Yamuna Nagar,Yes (10),10,0,0,0,10,0,0,0,Yes,No,No,No,Yes,"11:22 AM 15th Jun,22",2022-06-15 11:22,22
CHC Partap Nagar,CHC Partap Nagar,Yes (16),6,10,0,0,6,10,0,0,Yes,No,Yes,No,Yes,"11:05 AM 15th Jun,22",2022-06-15 11:05,22
CHC Radaur,Radaur Yamuna Nagar,Yes (20),10,10,0,0,10,10,0,0,Yes,No,Yes,Yes,Yes,"11:22 AM 15th Jun,22",2022-06-15 11:22,22
CHC Saraswati Nagar,CHC Saraswati Nagar,Yes (25),14,11,0,0,14,11,0,0,Yes,No,Yes,No,Yes,"11:05 AM 15th Jun,22",2022-06-15 11:05,22
DABRA HOSPITAL Yamunanagar,DABRA HOSPITAL,Yes (23),11,8,4,2,11,8,4,2,No,No,No,No,No,"11:05 AM 15th Jun,22",2022-06-15 11:05,22
ESI Hospital,"ESI Hospital, Jagadhri",Yes (58),36,0,22,0,36,0,22,0,Yes,No,Yes,Yes,Yes,"11:03 AM 15th Jun,22",2022-06-15 11:03,22
Gaba Hospital,Gaba Hospital Yamunanagar,Yes (50),20,10,20,4,20,10,20,4,Yes,No,Yes,Yes,Yes,"11:02 AM 15th Jun,22",2022-06-15 11:02,22
GULATI HOSPITAL,GULATI HOSPITAL,Yes (32),23,3,6,0,25,3,6,0,Yes,No,Yes,Yes,Yes,"11:06 AM 15th Jun,22",2022-06-15 11:06,22
Heart Care Center Hospital,Near Lal Dwara Mandir Yamuna Nagar,Yes (19),2,2,15,7,2,2,15,7,Yes,No,Yes,Yes,Yes,"11:04 AM 15th Jun,22",2022-06-15 11:04,22
JP Hospital Pvt,"Jagadhri Rd, near Luxmi Theater, Vishwakarma Mohalla, Yamuna Nagar,HARAYANA Haryana",Yes (43),15,15,13,2,15,15,13,2,Yes,No,Yes,Yes,Yes,"11:03 AM 15th Jun,22",2022-06-15 11:03,22
KAPOOR HOSPITAL,"SH 6A Indira Colony Jagadhri, yamunanagart ,Haryana",Yes (12),4,0,8,0,4,0,8,0,Yes,No,Yes,Yes,Yes,"11:10 AM 15th Jun,22",2022-06-15 11:10,22
KESHWANI HOSPITAL,"Jagadhri - Yamuna Nagar Rd, Tagore Garden, Yamuna Nagar, Haryana",Yes (10),10,0,0,0,10,0,0,0,Yes,No,Yes,Yes,Yes,"11:23 AM 15th Jun,22",2022-06-15 11:23,22
Maxxwell Hospital,Jagadhari Yamuna Nagar,Yes (17),11,0,6,0,11,0,6,0,Yes,No,Yes,Yes,Yes,"11:06 AM 15th Jun,22",2022-06-15 11:06,22
Mukand Lal District Civil Hospital Yamunanagar,Mukand Lal District Civil Hospital YNR,Yes (27),18,9,0,5,18,9,0,5,Yes,No,Yes,Yes,Yes,"11:06 AM 15th Jun,22",2022-06-15 11:06,22
NIRMAL HOSPITAL,"199, Radaur Rd, near nirmal hospital, camp, Garhi Gujran, Haryana",Yes (20),13,1,6,0,13,1,6,0,Yes,No,Yes,Yes,Yes,"11:03 AM 15th Jun,22",2022-06-15 11:03,22
