name,address,Availability_availability_of_beds,Availability_oxygen_beds,Availability_non_oxygen_beds,Availability_i_c_u_beds,Availability_ventilators,Allocated_oxygen_beds,Allocated_non_oxygen_beds,Allocated_i_c_u,Allocated_ventilators,Availability_availability_of_oxygen,Availability_antiviral_remdesivir_etc_,Availability_steroids,Availability_anticoagulant,Availability_antipyretic,updated_on_unparsed,updated_on,city
CHC Madina,"VPO Madina, Hisar Road Distt. Rohtak, Haryana",Yes (10),0,10,0,0,0,10,0,0,Yes,No,No,No,Yes,"1:50 PM 3rd Mar,22",2022-03-03 13:50,19
CHC Meham,"Near ITI, Meham Distt. Rohtak",Yes (10),10,0,0,0,10,0,0,0,Yes,No,Yes,No,Yes,"1:50 PM 3rd Mar,22",2022-03-03 13:50,19
CHC Sampla,"Gadi Sampla, Rohtak, SH-20, Jhajjar Sampla Road, Sampla, Sampla, Haryana 124501",Yes (10),0,10,0,0,0,10,0,0,No,No,Yes,No,Yes,"1:50 PM 3rd Mar,22",2022-03-03 13:50,19
"Civil Hospital, Rohtak",Subash Road,Yes (71),40,24,7,5,40,24,7,5,Yes,Yes,Yes,Yes,Yes,"1:50 PM 3rd Mar,22",2022-03-03 13:50,19
Holy Heart Super speciality Hospital,Vinay Nagar Delhi Bye pass,Yes (34),20,4,10,4,20,5,10,4,Yes,No,Yes,Yes,Yes,"1:50 PM 3rd Mar,22",2022-03-03 13:50,19
"Hridaya Nilayam Heart, Lung &amp; vascular Institute","5, Raj Garden, Delhi Bypass, Rohtak",Yes (51),47,0,4,4,47,0,4,4,To Be Updated,To Be Updated,To Be Updated,To Be Updated,To Be Updated,"1:50 PM 3rd Mar,22",2022-03-03 13:50,19
Joyline Multispeciality,"Surajmal Colony, Sunarian Road, Opposite Birgadier Muktram Statue Rohtak",Yes (20),15,0,5,1,15,0,5,1,Yes,Yes,Yes,Yes,Yes,"1:50 PM 3rd Mar,22",2022-03-03 13:50,19
Kainos Hospital,Near Kheri Sadh Village Outer Bye Pass,Yes (70),26,10,34,17,26,10,34,17,Yes,No,Yes,Yes,Yes,"1:50 PM 3rd Mar,22",2022-03-03 13:50,19
Life Care Hospital,Subash Nagar,Yes (50),20,0,30,7,20,0,30,7,Yes,No,Yes,Yes,Yes,"1:50 PM 3rd Mar,22",2022-03-03 13:50,19
Maan Hospital,Bhagwan Colony Near Radio Station,Yes (49),20,12,17,4,20,14,17,4,Yes,No,Yes,Yes,Yes,"1:50 PM 3rd Mar,22",2022-03-03 13:50,19
Mansarover Hospital,Mansarover Colony Near Park,Yes (30),20,Beds Over Utilized 1,10,7,20,0,10,7,Yes,No,Yes,Yes,Yes,"1:50 PM 3rd Mar,22",2022-03-03 13:50,19
Neurocentre Super Speciality Hospital,"Kalawati Bulding, Near Power House Rohtak",Yes (23),4,6,13,2,4,6,13,2,Yes,No,Yes,Yes,Yes,"1:50 PM 3rd Mar,22",2022-03-03 13:50,19
Noble Heart Super Speciality Hospital,Near Raj Garden Delhi Bye Pass,Yes (64),22,6,36,8,22,6,36,8,Yes,No,Yes,Yes,Yes,"1:50 PM 3rd Mar,22",2022-03-03 13:50,19
Oscar Super Speciality Trauma Center,"Medical Moad, Daryao Singh Nagar,",Yes (41),23,3,15,2,23,3,15,2,Yes,Yes,Yes,Yes,Yes,"1:50 PM 3rd Mar,22",2022-03-03 13:50,19
Oxygen Hospital,Islam Pura Daries Hisar Road,Yes (30),15,10,5,4,15,10,5,4,Yes,No,Yes,Yes,Yes,"1:50 PM 3rd Mar,22",2022-03-03 13:50,19
PGIMS Rohtak,"Pt.Bhagwat Dayal PGIMS, Medical Rd, Rohtak, Haryana",Yes (566),451,0,115,115,451,0,115,115,Yes,Yes,Yes,Yes,Yes,"9:20 AM 5th Apr,22",2022-04-05 09:20,19
Positron Hospital,Suncity Sector 35,Yes (29),0,14,15,6,0,14,16,6,Yes,No,Yes,Yes,Yes,"1:50 PM 3rd Mar,22",2022-03-03 13:50,19
Pragati Hospital,"Sukhpura Chowk, Gohana Road, opp. Ladhot Road Rohtak",Yes (35),30,0,5,2,30,0,5,2,Yes,No,Yes,Yes,Yes,"1:50 PM 3rd Mar,22",2022-03-03 13:50,19
"Sanghi Nursing Home, Rohtak, Haryana","Chotu Ram Chowk, Civil Road, Arya Nagar, Rohtak, Haryana",Yes (14),10,0,4,4,10,0,4,4,Yes,Yes,Yes,Yes,Yes,"1:50 PM 3rd Mar,22",2022-03-03 13:50,19
Shivam Liver &amp; Gastro Super Speciality Hospital,"CIVIL ROAD NEAR SHANT MAI CHOWK, Rohtak, Haryana - 124001, India",Yes (9),5,0,4,1,5,0,4,1,Yes,No,Yes,Yes,Yes,"1:50 PM 3rd Mar,22",2022-03-03 13:50,19
Sunflag Global Hospital,Bharat Colony Near Sheela Bye Pass,Yes (35),20,Beds Over Utilized 2,15,5,20,0,15,5,Yes,No,Yes,Yes,Yes,"1:50 PM 3rd Mar,22",2022-03-03 13:50,19
Cygnus Multispecialty Hospital Kaithal,"Huda Bypass Road, Sector 20, Kaithal, Haryana",Yes (40),28,0,12,2,28,0,12,2,Yes,No,Yes,Yes,Yes,"5:11 PM 3rd Mar,22",2022-03-03 17:11,10
District Civil Hospital Kaithal,"Huda Sec 18, Kaithal",Yes (115),80,15,20,18,80,15,20,18,Yes,Yes,Yes,Yes,Yes,"5:10 PM 3rd Mar,22",2022-03-03 17:10,10
SDH Guhla,SDH Guhla,Yes (70),35,35,0,5,35,35,0,5,Yes,No,Yes,No,Yes,"5:10 PM 3rd Mar,22",2022-03-03 17:10,10
Shah Multispecialty Hospital Kaithal,"opp.old, bus stand, Jind - Kaithal Rd, Amar Garh Colony, Kaithal, Haryana",Yes (75),50,11,14,10,51,11,15,10,Yes,No,Yes,Yes,Yes,"5:10 PM 3rd Mar,22",2022-03-03 17:10,10
"Aditya Neuro &amp; Spine Hospital, Rewari","Circular Rd, near Kanod gate, Raam Bagh Mahalla, Rewari, Haryana",Yes (10),8,0,2,2,8,0,2,2,Yes,No,Yes,Yes,Yes,"1:50 PM 3rd Mar,22",2022-03-03 13:50,18
Advance Hospital,"Bawal Road, Model Town",Yes (8),5,0,3,0,5,0,6,1,Yes,No,Yes,Yes,Yes,"5:13 PM 3rd Mar,22",2022-03-03 17:13,18
"Apex Hospital, Dharuhera","Plot No.5, Sector 6, Dharuhera, Haryana 123106",Yes (10),6,0,4,1,6,0,4,1,Yes,No,Yes,Yes,Yes,"1:50 PM 3rd Mar,22",2022-03-03 13:50,18
Apollo Rewari/Family Health Edge Hospital,"Garhi Bolni Rd, near Public Health Office, krishna Nagar, Rewari, Haryana",Yes (27),17,3,7,0,17,3,7,0,Yes,No,Yes,Yes,Yes,"5:12 PM 3rd Mar,22",2022-03-03 17:12,18
Capt. Nand Lal Hospital,"Circular Road near Government Girls Senior Secondary School naiwali, chowk, Rewari",Yes (20),6,10,4,1,11,10,8,1,Yes,No,Yes,Yes,Yes,"1:50 PM 3rd Mar,22",2022-03-03 13:50,18
Civil Hospital rewari,"Kayasthwara Mohalla, Rewari, Haryana",Yes (63),39,16,8,4,40,16,8,4,Yes,Yes,Yes,Yes,Yes,"5:10 PM 3rd Mar,22",2022-03-03 17:10,18
Cygnus Hospital Rewari,"Opposite Civil Hospital Mohola, Sanghi Ka Bass, Rewari, Haryana",Yes (32),21,7,4,1,26,7,9,2,Yes,No,Yes,No,Yes,"5:11 PM 3rd Mar,22",2022-03-03 17:11,18
Devjyoti Hospital,"Ambedkar chowk, near Bus Stand, Rewari, Haryana",Yes (14),7,2,5,1,7,2,6,2,Yes,No,Yes,Yes,Yes,"5:10 PM 3rd Mar,22",2022-03-03 17:10,18
Dr. K.K. NAGAR HOSPITAL,"317, Near Shishu Shala School, Model Town, Rewari, Haryana",Yes (12),2,0,10,0,2,0,10,0,Yes,No,Yes,Yes,Yes,"5:11 PM 3rd Mar,22",2022-03-03 17:11,18
Dr. Vijay Pal Yadav Hospital,"Near Ambedker chowk, Rewari",Yes (7),2,2,3,0,3,3,4,0,Yes,No,Yes,Yes,Yes,"5:13 PM 3rd Mar,22",2022-03-03 17:13,18
Kamla Nursing Home/Kalawati Hospital,"201, Model Town, Rewari, Near Bus Stand, Opposite Bal Bhawan, Shivam Chowk",Yes (17),12,0,5,5,14,0,9,6,Yes,No,Yes,Yes,Yes,"5:11 PM 3rd Mar,22",2022-03-03 17:11,18
Katyal Hospital,"Katyal Hospital, KANOD GATE, CIRCULAR ROAD, Rewari, Haryana, India",Yes (21),9,6,6,0,12,6,10,1,Yes,No,Yes,Yes,Yes,"5:11 PM 3rd Mar,22",2022-03-03 17:11,18
Maars Hospital,"Garhi Bolni Rd, near PWD Office, Sector 19, Rewari, Haryana",Yes (15),15,0,0,0,15,0,0,0,Yes,No,Yes,Yes,No,"5:12 PM 3rd Mar,22",2022-03-03 17:12,18
"Manasavi Hospital, Rewari",,Yes (10),10,0,0,0,10,0,0,0,Yes,No,Yes,No,Yes,"5:13 PM 3rd Mar,22",2022-03-03 17:13,18
Matrika Hospital,"Matrika Hospital, Ranbir Singh Huda Chowk, Bawal-Rewari Rd, Rewari, Haryana",Yes (23),12,0,11,1,16,0,14,3,Yes,No,No,Yes,Yes,"5:10 PM 3rd Mar,22",2022-03-03 17:10,18
Mediom Hospital/Medcare Hospital,"Sohna Rd, near Municipal Corporation, Dharuhera, Haryana",Yes (4),3,Beds Over Utilized 1,1,0,8,0,4,1,Yes,No,Yes,Yes,Yes,"5:11 PM 3rd Mar,22",2022-03-03 17:11,18
Om Hospital,"Om Hospital, Nandrampur Bass Rd, Dharuhera, Haryana",Yes (24),12,4,8,0,12,4,8,0,Yes,No,Yes,Yes,Yes,"5:11 PM 3rd Mar,22",2022-03-03 17:11,18
Pushpanjli Hospital Rewari,"Rajesh Pilot Chowk, Rewari, Haryana",Yes (62),40,12,10,3,40,12,10,3,No,No,Yes,Yes,Yes,"5:10 PM 3rd Mar,22",2022-03-03 17:10,18
R. B. Yadav Hospital,"Dr. R B Yadav Hospital, Circular Rd Jainpuri, Kayasthwara Mohalla, Rewari, Haryana",Yes (22),8,6,8,2,8,6,8,2,Yes,No,Yes,Yes,Yes,"5:11 PM 3rd Mar,22",2022-03-03 17:11,18
Samrat Hospital,Near Azad Chowk Rewari,Yes (9),5,0,4,3,5,0,10,3,Yes,No,Yes,Yes,Yes,"5:13 PM 3rd Mar,22",2022-03-03 17:13,18
SDH Kosli,"Kosli, Rewari, Haryana",Yes (31),11,20,0,0,20,20,0,0,Yes,No,No,No,No,"5:11 PM 3rd Mar,22",2022-03-03 17:11,18
Shanti Yadav Hospital,"Bawal-Rewari Rd Model Town, Rewari, Haryana",Yes (28),16,8,4,1,19,10,4,1,Yes,No,Yes,No,No,"5:10 PM 3rd Mar,22",2022-03-03 17:10,18
Sheela Neuro &amp; Multi. Superspeciality Hospital,"Sheela Neuro Multi-Super Speciality Hospital, Opposite Jain Public School, Circular Road, Rewari",Yes (32),15,15,2,0,15,15,3,1,Yes,No,Yes,Yes,No,"5:11 PM 3rd Mar,22",2022-03-03 17:11,18
Shri Ashwani Sexena Hospital,"343-L, Model town Rewari",Yes (10),7,3,0,0,7,3,0,0,Yes,No,Yes,Yes,Yes,"5:13 PM 3rd Mar,22",2022-03-03 17:13,18
SMCC Hospital,"Sector 5 Rewari, Haryana",Yes (13),2,0,11,1,2,0,11,1,Yes,No,Yes,Yes,Yes,"5:12 PM 3rd Mar,22",2022-03-03 17:12,18
Surendra Hospital Bawal,"Circuar Road, Rewari, Haryana",Yes (11),5,2,4,0,5,2,5,0,Yes,No,Yes,No,Yes,"5:13 PM 3rd Mar,22",2022-03-03 17:13,18
"Sushma Devi Hospital, Bawal","Rewari Road, Bawal, Rewari, Near Power House & Bharat Petrol Pump",Yes (18),9,9,0,0,9,9,0,0,Yes,No,Yes,Yes,Yes,"5:12 PM 3rd Mar,22",2022-03-03 17:12,18
Vedanta Hospital,"Circulare Road, Near Nirankari Satsang Bhavan Dharuhera, Chungi, Rewari, Haryana",Yes (29),0,7,22,0,0,7,30,0,Yes,No,Yes,Yes,Yes,"5:12 PM 3rd Mar,22",2022-03-03 17:12,18
Virat Hospital,"Circular Rd, Near Oriental Bank of Commerce, Madhu Vihar, Rewari, Haryana",Yes (100),63,10,27,2,63,10,27,2,To Be Updated,To Be Updated,To Be Updated,To Be Updated,To Be Updated,"5:10 PM 3rd Mar,22",2022-03-03 17:10,18
Yaduvanshi Hospital,"Maharana Pratap Chowk, Model Town, Rewari, Haryana",Yes (19),14,0,5,2,14,0,5,2,Yes,No,Yes,Yes,No,"1:50 PM 3rd Mar,22",2022-03-03 13:50,18
Balaji Gautam Hospital,"Model Colony, East Bhatia Nagar, Yamuna Nagar, Haryana",Yes (12),7,2,3,0,7,2,3,0,Yes,No,Yes,Yes,Yes,"1:52 PM 3rd Mar,22",2022-03-03 13:52,22
Ch Lekh Raj Multispeciality Hospital,Vill Gadhauli Yamuna Nagar,Yes (150),140,0,10,5,140,0,10,5,Yes,Yes,Yes,Yes,Yes,"5:12 PM 3rd Mar,22",2022-03-03 17:12,22
CHC Bilaspur,CHC Bilaspur,Yes (23),8,15,0,0,8,17,0,0,Yes,No,Yes,No,Yes,"5:11 PM 3rd Mar,22",2022-03-03 17:11,22
CHC Chhachharuli,CHC Chhachharuli,Yes (30),10,20,0,0,10,20,0,0,Yes,No,Yes,Yes,Yes,"5:11 PM 3rd Mar,22",2022-03-03 17:11,22
CHC Naharpur,Naharpur Yamuna Nagar,Yes (10),10,0,0,0,10,0,0,0,Yes,No,No,No,Yes,"5:12 PM 3rd Mar,22",2022-03-03 17:12,22
CHC Partap Nagar,CHC Partap Nagar,Yes (16),6,10,0,0,6,10,0,0,Yes,No,Yes,No,Yes,"5:11 PM 3rd Mar,22",2022-03-03 17:11,22
CHC Radaur,Radaur Yamuna Nagar,Yes (20),10,10,0,0,10,10,0,0,Yes,No,Yes,Yes,Yes,"5:12 PM 3rd Mar,22",2022-03-03 17:12,22
CHC Saraswati Nagar,CHC Saraswati Nagar,Yes (25),14,11,0,0,14,11,0,0,Yes,No,Yes,No,Yes,"5:11 PM 3rd Mar,22",2022-03-03 17:11,22
DABRA HOSPITAL Yamunanagar,DABRA HOSPITAL,Yes (23),11,8,4,2,11,8,4,2,No,No,No,No,No,"5:11 PM 3rd Mar,22",2022-03-03 17:11,22
ESI Hospital,"ESI Hospital, Jagadhri",Yes (58),36,0,22,0,36,0,22,0,Yes,No,Yes,Yes,Yes,"5:10 PM 3rd Mar,22",2022-03-03 17:10,22
Gaba Hospital,Gaba Hospital Yamunanagar,Yes (45),20,10,15,5,20,10,15,5,Yes,No,Yes,Yes,Yes,"5:10 PM 3rd Mar,22",2022-03-03 17:10,22
GULATI HOSPITAL,GULATI HOSPITAL,Yes (32),23,3,6,0,25,3,6,0,Yes,No,Yes,Yes,Yes,"5:11 PM 3rd Mar,22",2022-03-03 17:11,22
Heart Care Center Hospital,Near Lal Dwara Mandir Yamuna Nagar,Yes (19),2,2,15,7,2,2,15,7,Yes,No,Yes,Yes,Yes,"5:11 PM 3rd Mar,22",2022-03-03 17:11,22
JP Hospital Pvt,"Jagadhri Rd, near Luxmi Theater, Vishwakarma Mohalla, Yamuna Nagar,HARAYANA Haryana",Yes (43),15,15,13,2,15,15,13,2,Yes,No,Yes,Yes,Yes,"5:10 PM 3rd Mar,22",2022-03-03 17:10,22
KAPOOR HOSPITAL,"SH 6A Indira Colony Jagadhri, yamunanagart ,Haryana",Yes (12),4,0,8,0,4,0,8,0,Yes,No,Yes,Yes,Yes,"5:11 PM 3rd Mar,22",2022-03-03 17:11,22
KESHWANI HOSPITAL,"Jagadhri - Yamuna Nagar Rd, Tagore Garden, Yamuna Nagar, Haryana",Yes (10),10,0,0,0,10,0,0,0,Yes,No,Yes,Yes,Yes,"5:12 PM 3rd Mar,22",2022-03-03 17:12,22
Maxxwell Hospital,Jagadhari Yamuna Nagar,Yes (17),11,0,6,0,11,0,6,0,Yes,No,Yes,Yes,Yes,"5:11 PM 3rd Mar,22",2022-03-03 17:11,22
Mukand Lal District Civil Hospital Yamunanagar,Mukand Lal District Civil Hospital YNR,Yes (24),15,9,0,5,18,9,0,5,Yes,No,Yes,Yes,Yes,"5:11 PM 3rd Mar,22",2022-03-03 17:11,22
NIRMAL HOSPITAL,"199, Radaur Rd, near nirmal hospital, camp, Garhi Gujran, Haryana",Yes (20),13,1,6,0,13,1,6,0,Yes,No,Yes,Yes,Yes,"5:10 PM 3rd Mar,22",2022-03-03 17:10,22
RK Gupta,opp DAV Sr Sec School Near Madhu Hotel YNR,Yes (17),0,2,15,0,0,2,15,0,Yes,Yes,Yes,Yes,Yes,"5:12 PM 3rd Mar,22",2022-03-03 17:12,22
SABBARWAL HOSPITAL,"Gulab Nagar, Jagadhri, Haryana",Yes (12),6,0,6,0,6,0,6,0,Yes,No,Yes,Yes,Yes,"5:11 PM 3rd Mar,22",2022-03-03 17:11,22
Sachdeva Hospital,"2227, Civil Lines Rd, Sri Nagar Colony, Civil Lines, Gomti Mohalla, Jagadhri, Haryana",Yes (28),16,8,4,0,16,8,4,0,Yes,No,Yes,Yes,Yes,"5:12 PM 3rd Mar,22",2022-03-03 17:12,22
Santosh Hospital,"Santosh Hospital  Kanhaiya Sahib Chowk, near Govt.School, Harbanspura Colony, Gobind Pura, Yamuna Nagar, Haryana",Yes (28),5,9,14,2,5,9,14,2,Yes,No,Yes,Yes,Yes,"5:10 PM 3rd Mar,22",2022-03-03 17:10,22
SHARMA HOSPITAL,Near Agarsain Chowk Jagadhri,Yes (12),12,0,0,0,12,0,0,0,Yes,No,Yes,Yes,Yes,"5:12 PM 3rd Mar,22",2022-03-03 17:12,22
Shree Medical Care Hospital,"359/2, Jain nagar, Jagadhri, Haryana",Yes (15),15,0,0,0,15,0,0,0,Yes,Yes,Yes,Yes,Yes,"5:13 PM 3rd Mar,22",2022-03-03 17:13,22
Shureshtha Hospital,Model Colony YNR,Yes (11),9,0,2,0,9,0,2,0,Yes,No,Yes,Yes,Yes,"5:12 PM 3rd Mar,22",2022-03-03 17:12,22
SP Hospital Jag,S.P Hospital Jag,Yes (7),4,0,3,1,4,0,3,1,Yes,No,Yes,Yes,Yes,"5:11 PM 3rd Mar,22",2022-03-03 17:11,22
Swami Vivekanand Hospital Yamunanagar,"Swami Vivekanand Hospital,Yamuna Nagar, Haryana",Yes (49),20,10,19,1,20,10,19,1,Yes,No,Yes,Yes,Yes,"5:11 PM 3rd Mar,22",2022-03-03 17:11,22
Swastik Hospital,"Basant Nagar, Yamuna Nagar, Haryana",Yes (6),4,2,0,0,4,2,0,0,Yes,No,Yes,Yes,Yes,"5:13 PM 3rd Mar,22",2022-03-03 17:13,22
tejli stadium,64 A Tejli,Yes (76),20,56,0,0,20,56,0,0,Yes,No,No,No,Yes,"5:11 PM 3rd Mar,22",2022-03-03 17:11,22
VARDAAN HOSPITAL,OPP KOHLI HOSPITAL NEAR AGARSEN COLLEGE JAGADHRI,Yes (10),8,2,0,0,8,2,0,0,Yes,No,Yes,Yes,Yes,"5:12 PM 3rd Mar,22",2022-03-03 17:12,22