name,address,Availability_availability_of_beds,Availability_oxygen_beds,Availability_non_oxygen_beds,Availability_i_c_u_beds,Availability_ventilators,Allocated_oxygen_beds,Allocated_non_oxygen_beds,Allocated_i_c_u,Allocated_ventilators,Availability_availability_of_oxygen,Availability_antiviral_remdesivir_etc_,Availability_steroids,Availability_anticoagulant,Availability_antipyretic,updated_on_unparsed,updated_on,city
Civil Hospital Fatehabad,Near Bus Stand Fatehabad,Yes (60),50,0,10,10,50,0,10,10,Yes,Yes,Yes,Yes,Yes,"4:43 PM 15th May,23",2023-05-15 16:43,5
Civil Hospital Ratia,"Dera Surjanhar, Ratia, Fatehabad",Yes (51),20,26,5,5,20,26,5,5,Yes,Yes,Yes,Yes,Yes,"1:39 PM 19th Apr,23",2023-04-19 13:39,5
"Civil Hospital, Tohana",Opposite New Sabzi Mandi Tohana,Yes (36),30,0,6,6,30,0,6,6,Yes,Yes,Yes,Yes,Yes,"1:38 PM 19th Apr,23",2023-04-19 13:38,5
Community Health Center Bhattu,"Surya Nagar, Bhattu Mandi near Railway Station",Yes (12),10,2,0,0,10,2,0,0,Yes,Yes,Yes,Yes,Yes,"1:44 PM 19th Apr,23",2023-04-19 13:44,5
Community Health Center Bhuna,CHC Bhuna,Yes (27),12,15,0,0,12,15,0,0,Yes,No,Yes,Yes,Yes,"1:39 PM 19th Apr,23",2023-04-19 13:39,5
Community Health Center JAKHAL,Near SBI Bank Jakhal,Yes (12),12,0,0,0,12,0,0,0,Yes,Yes,Yes,Yes,Yes,"1:44 PM 19th Apr,23",2023-04-19 13:44,5
"Gupta Children Hospital, Ratia","Aggarwal Colony, Ratia",Yes (16),6,8,2,1,6,8,2,1,Yes,Yes,Yes,Yes,Yes,"1:07 PM 3rd Aug,22",2022-08-03 13:07,5
"Manav Sewa Sangam Hospital, Tohana",Near Truck Union,Yes (30),20,10,0,0,20,10,0,0,Yes,Yes,Yes,Yes,Yes,"1:18 PM 3rd Aug,22",2022-08-03 13:18,5
Miglani Hospital,"Employees Colony, Ratia,",Yes (20),15,3,2,2,15,3,2,2,Yes,Yes,Yes,Yes,Yes,"3:26 PM 2nd Aug,22",2022-08-02 15:26,5
Rajasthan Medical Centre (RMC) Hospital Tohana,Kenchi Chowk Tohana,Yes (15),11,0,4,2,11,0,4,2,Yes,Yes,Yes,Yes,Yes,"3:48 PM 2nd Aug,22",2022-08-02 15:48,5
Sadhbhawdna Hospital Fatehabad,Near Court Complex Hisar Road Fatehabad,Yes (50),25,10,15,5,25,10,15,5,Yes,Yes,Yes,Yes,Yes,"11:47 AM 6th Apr,23",2023-04-06 11:47,5
Sanjeevani Hospital Fatehabad,"Goshala Road, near Ashirbad Pelace",Yes (10),6,0,4,3,6,0,4,3,Yes,Yes,Yes,Yes,Yes,"3:44 PM 18th Aug,22",2022-08-18 15:44,5
Sanjeevani Hospital Tohana,"Kenchi Chock, Tohana",Yes (18),0,6,12,2,0,6,12,2,Yes,No,Yes,Yes,Yes,"1:18 PM 3rd Aug,22",2022-08-03 13:18,5
"Singla Hospital , fatehabad","Bhattu Road, Batra Colony, Fatehabad",Yes (13),5,8,0,0,5,8,0,0,Yes,Yes,Yes,Yes,Yes,"3:39 PM 2nd Aug,22",2022-08-02 15:39,5
WadhwaMaternity and surgical  Hospital Fatehabad,"Near Papiha Park, Fatehabad",Yes (8),1,0,7,1,1,0,7,1,Yes,Yes,Yes,Yes,Yes,"11:48 AM 6th Apr,23",2023-04-06 11:48,5
"AAROGYAM HOSPITAL, Kurukshetra","NEAR OLD BUS STAND, THANESAR, KURUSKHETRA",Yes (47),12,0,35,15,12,0,35,15,Yes,Yes,Yes,Yes,Yes,"5:16 PM 4th May,23",2023-05-04 17:16,12
"ADESH MEDICAL COLLEGE, SHAHBAD MOHRI KURUKSHETRA.","VILL. MOHRI, SHAHBAD, KURUSHETRA",Yes (100),30,70,0,10,30,70,0,10,Yes,Yes,Yes,Yes,Yes,"5:19 PM 4th May,23",2023-05-04 17:19,12
AGGARWAL NURSING HOME,"SALARPUR ROAD, THANESAR, KURUKSHETRA.",Yes (21),11,7,3,4,11,7,3,4,Yes,Yes,Yes,Yes,Yes,"5:16 PM 4th May,23",2023-05-04 17:16,12
B.S. HEART CARE,"OPP. NEW BUS STAND, KURUKSHETRA.",Yes (45),45,0,0,10,45,0,0,10,Yes,Yes,Yes,Yes,Yes,"5:14 PM 4th May,23",2023-05-04 17:14,12
"CYGNUS HOSPITAL, Kurukshetra","NEAR OLD BUS STAND, THANESAR, KURUSKHETRA",Yes (10),8,0,2,4,8,0,2,4,Yes,Yes,Yes,Yes,Yes,"5:17 PM 4th May,23",2023-05-04 17:17,12
KURUKSHETRA NURSING HOME,,Yes (18),14,0,4,2,14,0,4,2,Yes,Yes,Yes,Yes,Yes,"5:18 PM 4th May,23",2023-05-04 17:18,12
LNJP CIVIL HOSPITAL.,LNJP HOSPITAL KURUKSHETRA.,Yes (42),37,5,0,15,37,5,0,15,Yes,Yes,Yes,Yes,Yes,"5:15 PM 4th May,23",2023-05-04 17:15,12
MIRI PIRI SHAHBAD,"SHAHBAD, KURUKSHETRA",Yes (14),10,0,4,4,10,0,4,4,Yes,Yes,Yes,Yes,Yes,"5:17 PM 4th May,23",2023-05-04 17:17,12
Nirogi Hospital,Shahabad Kurukshetra,Yes (22),10,10,2,2,10,10,2,2,Yes,Yes,Yes,Yes,Yes,"5:19 PM 4th May,23",2023-05-04 17:19,12
"Saraswati Mission Hospital, Kurukshetra","Theme Park Road, Kurukshetra",Yes (46),35,0,11,6,35,0,11,6,Yes,Yes,Yes,Yes,Yes,"5:20 PM 4th May,23",2023-05-04 17:20,12
"Saraswati Mission Hospital, Pehowa","Ambala Road Dist. Kurukshetra, Pehowa, Haryana 136128",Yes (46),35,0,11,6,35,0,11,6,Yes,No,Yes,Yes,Yes,"5:14 PM 4th May,23",2023-05-04 17:14,12
"SIDHARTH HOSPITAL, SHAHBAD","SHAHBAD, KURUKSHETRA",Yes (12),8,0,4,2,8,0,4,2,Yes,Yes,Yes,Yes,Yes,"5:18 PM 4th May,23",2023-05-04 17:18,12
VERMA HOSPITAL,LADWA,Yes (15),9,3,3,1,9,3,3,1,Yes,Yes,Yes,Yes,Yes,"5:18 PM 4th May,23",2023-05-04 17:18,12
"AADHAR Hospital, Hisar",Tosham Road Hisar,Yes (43),25,6,12,6,26,6,12,6,Yes,No,No,Yes,Yes,"12:20 PM 17th Jun,22",2022-06-17 12:20,7
Amandeep Hospital,ITI CHOWK TOSHAM ROAD HISAR,Yes (5),3,0,2,5,3,0,2,5,To Be Updated,No,No,Yes,Yes,"9:38 AM 23rd Aug,22",2022-08-23 09:38,7
Bharat Multispeciality Hospital,Hisar,Yes (26),16,0,10,2,16,0,10,2,Yes,No,Yes,Yes,Yes,"5:13 PM 7th Jun,22",2022-06-07 17:13,7
Central Medical Centre (CMC),CMC Hospital Delhi Road Hisar,Yes (62),46,7,9,3,46,7,9,3,Yes,Yes,Yes,Yes,No,"11:46 AM 22nd Aug,22",2022-08-22 11:46,7
Churamani Hospital,CAMP CHOWK HISAR,Yes (37),5,2,30,5,5,2,30,5,No,No,No,No,No,"1:50 PM 3rd Mar,22",2022-03-03 13:50,7
District Civil Hospital Hisar,Sirsa Road Hisar,Yes (79),79,0,0,20,80,0,0,20,Yes,Yes,Yes,Yes,Yes,"5:13 PM 7th Jun,22",2022-06-07 17:13,7
DR. ANANTRAM JANTA HOSPITAL PVT LTD BARWALA,Civil Hospital Road Barwala,Yes (17),17,0,0,3,17,0,0,3,Yes,No,Yes,Yes,Yes,"1:50 PM 3rd Mar,22",2022-03-03 13:50,7
Geetanjali Hospital,Model Town Hisar,Yes (48),40,0,8,3,40,0,8,4,Yes,Yes,Yes,Yes,Yes,"4:56 PM 5th May,23",2023-05-05 16:56,7
Goswami Hospital,"NEAR BUS STAND, RISHI NAGAR",Yes (9),4,5,0,1,4,5,0,1,Yes,To Be Updated,To Be Updated,To Be Updated,To Be Updated,"12:42 PM 2nd Aug,22",2022-08-02 12:42,7
Gupta Hospital Hisar,Sector 14 Hisar,Yes (35),30,0,5,0,30,0,5,0,Yes,Yes,Yes,No,Yes,"9:17 AM 8th Aug,22",2022-08-08 09:17,7
GUPTA MEDICAL CENTRE,"OPP. MADHUBAN PARK ,PREMNAGAR HISAR",Yes (3),1,0,2,1,1,0,2,1,Yes,To Be Updated,To Be Updated,To Be Updated,To Be Updated,"11:20 AM 15th Jun,22",2022-06-15 11:20,7
"GURU JAMBHESHWAR MULTISPECIALITY HOSPITAL, AGROHA","ADAMPUR ROAD, AGROHA",Yes (14),9,3,2,1,9,3,2,1,Yes,No,Yes,Yes,Yes,"1:35 PM 12th Aug,22",2022-08-12 13:35,7
Holy Help Hospital,Tosham Road Hisar,Yes (39),25,6,8,1,25,6,8,1,Yes,No,Yes,Yes,Yes,"5:13 PM 7th Jun,22",2022-06-07 17:13,7
Janki Children Hospital Hisar,Near Sewak Sabha Hopsital Hisar,Yes (2),0,Beds Over Utilized 1,2,2,0,1,2,2,Yes,No,Yes,Yes,Yes,"10:39 AM 15th Jun,22",2022-06-15 10:39,7
Mahatma Gandhi Hospital,,Yes (42),19,13,10,8,19,13,10,8,To Be Updated,Yes,Yes,Yes,Yes,"2:20 PM 10th Oct,22",2022-10-10 14:20,7
MALIK HOSPITAL,"145A UTTAM NAGAR, HANSI",Yes (7),7,0,0,3,7,0,0,3,Yes,No,Yes,No,No,"5:15 PM 7th Jun,22",2022-06-07 17:15,7
MAMC Agroha,"Maharaj Aggarsin Medical College, VPO Agroha",Yes (140),85,15,40,60,85,15,40,60,To Be Updated,To Be Updated,To Be Updated,To Be Updated,To Be Updated,"1:12 PM 2nd Aug,22",2022-08-02 13:12,7
Military Hospital Hisar,Cantt Hisar,Yes (70),18,52,0,5,18,52,0,5,Yes,To Be Updated,Yes,Yes,No,"2:06 PM 19th Oct,22",2022-10-19 14:06,7
NEKIRAM HOSPITAL,OPP BUS STAND HANSI,Yes (5),2,0,3,3,2,0,3,3,Yes,To Be Updated,To Be Updated,To Be Updated,To Be Updated,"3:44 PM 26th Dec,22",2022-12-26 15:44,7
OPJindal Institute of Cancer &amp; Research Hospital,Model Town Hisar,Yes (144),100,4,40,44,100,4,41,45,Yes,Yes,Yes,Yes,Yes,"5:13 PM 7th Jun,22",2022-06-07 17:13,7
PARDEEP KANSAL MULTISPECIALITY HOSPITAL FOR CHILDREN,"25- Inderprastha Colony, Hisar",Yes (13),0,6,7,3,0,6,7,3,Yes,No,Yes,Yes,Yes,"1:50 PM 3rd Mar,22",2022-03-03 13:50,7
Parnami Hospital,Hisar,Yes (28),21,5,2,2,21,5,2,2,Yes,Yes,Yes,Yes,Yes,"5:13 PM 7th Jun,22",2022-06-07 17:13,7
Ravindra Hospital Hisar,Model Town HISAR,Yes (21),19,0,2,1,19,0,2,1,Yes,No,Yes,Yes,Yes,"1:50 PM 3rd Mar,22",2022-03-03 13:50,7
SAANVI HOSPITAL,"CHC ROAD, BARWALA",Yes (9),5,0,4,1,5,0,4,1,Yes,No,Yes,To Be Updated,To Be Updated,"5:15 PM 7th Jun,22",2022-06-07 17:15,7
Sapra Hospital,Rajgarh Road Hisar,Yes (28),19,3,6,12,19,3,6,12,Yes,Yes,Yes,No,Yes,"5:13 PM 31st Dec,22",2022-12-31 17:13,7
"Sarvodya Hospital, Hisar",Delhi Road Hisar,Yes (22),13,6,3,3,13,6,3,3,Yes,Yes,Yes,Yes,Yes,"4:03 PM 2nd Jan,23",2023-01-02 16:03,7
Sewak Sabha Hospital,Near Bus Stand Hisar,Yes (27),16,3,8,1,16,3,8,1,Yes,Yes,Yes,Yes,Yes,"10:45 AM 12th Sep,22",2022-09-12 10:45,7
Shanti Devi Hospital,Delhi Road Hisar,Yes (38),26,0,12,2,26,0,12,2,Yes,Yes,Yes,Yes,Yes,"12:01 PM 2nd Aug,22",2022-08-02 12:01,7
Shri Kali Devi Hospital Hansi,Delhi Road Hansi,Yes (13),8,0,5,0,8,0,5,0,To Be Updated,No,To Be Updated,Yes,Yes,"5:13 PM 7th Jun,22",2022-06-07 17:13,7
SINGLA MULTISPECIALITY HOSPITAL,"RISHI NAGAR, GALI NO. 1, NEAR BUS STAND, HISAR",Yes (19),17,0,2,1,17,0,2,1,Yes,No,Yes,Yes,Yes,"1:50 PM 3rd Mar,22",2022-03-03 13:50,7
SL Minda Hospital,VPO Bagla,Yes (8),6,0,2,2,6,0,2,2,Yes,No,Yes,Yes,Yes,"5:13 PM 7th Jun,22",2022-06-07 17:13,7
SONAKSHI CHILDREN HOSPITAL,"PLOT NO.2 ,DAYANAND COLONY,JINDAL HOSPITAL ROAD ,NEAR ITI ,HISAR",Yes (3),1,0,2,1,1,0,2,1,Yes,To Be Updated,To Be Updated,To Be Updated,To Be Updated,"11:52 AM 15th Jun,22",2022-06-15 11:52,7
Sukhda Multispeciality Hospital,Dabra Chowk Hisar,Yes (53),31,16,6,6,31,16,6,6,Yes,Yes,Yes,Yes,Yes,"4:03 PM 27th Apr,23",2023-04-27 16:03,7
Vardaan Hospital Hisar,Hisar,Yes (21),9,1,11,2,9,1,11,2,Yes,No,Yes,Yes,Yes,"12:02 PM 2nd Aug,22",2022-08-02 12:02,7
"Ayurvedic Medical College, Patikra",HUDA Sec. 1 Narnaul,Yes (192),35,157,0,0,40,160,0,0,Yes,Yes,Yes,Yes,Yes,"5:13 PM 7th Jun,22",2022-06-07 17:13,13
CHC ATELI,CHC ATELI,Yes (20),15,5,0,0,15,5,0,0,Yes,Yes,Yes,Yes,Yes,"2:04 PM 15th Jun,22",2022-06-15 14:04,13
CHC Kanina,Kanina,Yes (27),15,12,0,0,15,12,0,0,To Be Updated,To Be Updated,To Be Updated,To Be Updated,To Be Updated,"3:34 PM 15th Jun,22",2022-06-15 15:34,13
CHC Nangal Chaudhary,chc nangal choudhary,Yes (5),Beds Over Utilized 5,5,0,0,5,5,0,0,No,No,Yes,No,Yes,"2:09 PM 15th Jun,22",2022-06-15 14:09,13
CHC Sehlang,CHC SEHLANG,Yes (9),5,4,0,0,5,4,0,0,Yes,Yes,Yes,Yes,Yes,"9:52 AM 21st Jun,22",2022-06-21 09:52,13
Civil Hospital Narnaul,"Housing Board, Narnaul",Yes (80),80,0,0,10,80,0,0,10,Yes,Yes,Yes,Yes,Yes,"10:56 AM 20th Jun,22",2022-06-20 10:56,13
Jaipur Heart &amp; Multi Speciality Hospital,"Opp. Sadar Thana, Narnaul",Yes (13),6,3,4,2,6,3,4,2,Yes,Yes,Yes,Yes,Yes,"5:14 PM 7th Jun,22",2022-06-07 17:14,13
LAXMI NARAYANAN,"Laxmi Narayanan Hospital , Narnaul Road Mahendergarh",Yes (10),6,0,4,1,6,0,4,1,Yes,Yes,Yes,Yes,Yes,"5:15 PM 7th Jun,22",2022-06-07 17:15,13
Nihal Hospital Kanina,Kanina Main Bus Stand,Yes (13),12,0,1,1,13,0,1,1,Yes,Yes,Yes,Yes,Yes,"5:15 PM 7th Jun,22",2022-06-07 17:15,13
Rainbow Multispecialty hospital and trauma  Centre,"Singhana road, Narnaul",Yes (13),4,3,6,2,4,3,6,2,Yes,No,Yes,Yes,Yes,"5:14 PM 7th Jun,22",2022-06-07 17:14,13
Sammat Memorial Hospital,"Sastri colony, near bus stand, mahendergarh",Yes (13),10,0,3,2,10,0,3,2,Yes,No,Yes,Yes,Yes,"5:15 PM 7th Jun,22",2022-06-07 17:15,13
Sanwedna Hospital Narnaul,"HUDA Sector 1, Narnaul",Yes (26),17,0,9,1,25,0,9,1,Yes,Yes,Yes,Yes,Yes,"5:13 PM 7th Jun,22",2022-06-07 17:13,13
SDH Mahendergarh,SDH Mahendergarh,Yes (20),20,0,0,5,20,0,0,5,Yes,Yes,Yes,Yes,Yes,"2:31 PM 15th Jun,22",2022-06-15 14:31,13
Shanti Hospital Narnaul,Shanti Hospital Narnaul,Yes (22),9,7,6,2,9,7,7,2,Yes,Yes,Yes,Yes,Yes,"5:13 PM 7th Jun,22",2022-06-07 17:13,13
Sheela Multi Superspeciality Hospital,Behind Bus Stand Mahindergarh,Yes (9),6,0,3,1,6,0,3,1,Yes,No,Yes,Yes,Yes,"5:15 PM 7th Jun,22",2022-06-07 17:15,13
Shri Arvind Heart and Multispecialty Hospital,"Rao Tula Ram Chowk, Dadri Road Mahendergarh",Yes (17),9,5,3,3,9,5,3,3,Yes,Yes,Yes,Yes,Yes,"5:14 PM 7th Jun,22",2022-06-07 17:14,13
Tanwar Health Care MGarh,,Yes (9),5,0,4,1,5,0,4,1,Yes,No,Yes,Yes,Yes,"5:15 PM 7th Jun,22",2022-06-07 17:15,13
Vijay Hospital Narnaul,"HUDA Sector 1, Narnaul",Yes (22),8,0,14,2,8,0,15,2,Yes,Yes,Yes,Yes,Yes,"5:13 PM 7th Jun,22",2022-06-07 17:13,13
"Aditya Neuro &amp; Spine Hospital, Rewari","Circular Rd, near Kanod gate, Raam Bagh Mahalla, Rewari, Haryana",Yes (10),8,0,2,2,8,0,2,2,Yes,No,Yes,Yes,Yes,"10:30 AM 15th Jun,22",2022-06-15 10:30,18
Advance Hospital,"Bawal Road, Model Town",Yes (8),5,0,3,0,5,0,6,1,Yes,No,Yes,Yes,Yes,"10:27 AM 15th Jun,22",2022-06-15 10:27,18
"Apex Hospital, Dharuhera","Plot No.5, Sector 6, Dharuhera, Haryana 123106",Yes (10),6,0,4,1,6,0,4,1,Yes,No,Yes,Yes,Yes,"10:31 AM 15th Jun,22",2022-06-15 10:31,18
Apollo Rewari/Family Health Edge Hospital,"Garhi Bolni Rd, near Public Health Office, krishna Nagar, Rewari, Haryana",Yes (27),17,3,7,0,17,3,7,0,Yes,No,Yes,Yes,Yes,"10:22 AM 15th Jun,22",2022-06-15 10:22,18
Capt. Nand Lal Hospital,"Circular Road near Government Girls Senior Secondary School naiwali, chowk, Rewari",Yes (20),6,10,4,1,11,10,8,1,Yes,No,Yes,Yes,Yes,"10:25 AM 15th Jun,22",2022-06-15 10:25,18
Civil Hospital rewari,"Kayasthwara Mohalla, Rewari, Haryana",Yes (89),59,16,14,4,59,16,14,4,Yes,Yes,Yes,Yes,Yes,"10:39 AM 15th Jun,22",2022-06-15 10:39,18
Cygnus Hospital Rewari,"Opposite Civil Hospital Mohola, Sanghi Ka Bass, Rewari, Haryana",Yes (32),21,7,4,1,26,7,9,2,Yes,No,Yes,No,Yes,"10:21 AM 15th Jun,22",2022-06-15 10:21,18
Devjyoti Hospital,"Ambedkar chowk, near Bus Stand, Rewari, Haryana",Yes (15),7,2,6,Beds Over Utilized 1,7,2,6,0,Yes,No,Yes,Yes,Yes,"10:37 AM 15th Jun,22",2022-06-15 10:37,18
Dr. K.K. NAGAR HOSPITAL,"317, Near Shishu Shala School, Model Town, Rewari, Haryana",Yes (12),2,0,10,0,2,0,10,0,Yes,No,Yes,Yes,Yes,"10:19 AM 15th Jun,22",2022-06-15 10:19,18
Dr. Vijay Pal Yadav Hospital,"Near Ambedker chowk, Rewari",Yes (7),2,2,3,0,3,3,4,0,Yes,No,Yes,Yes,Yes,"10:26 AM 15th Jun,22",2022-06-15 10:26,18
Kamla Nursing Home/Kalawati Hospital,"201, Model Town, Rewari, Near Bus Stand, Opposite Bal Bhawan, Shivam Chowk",Yes (23),14,0,9,6,14,0,9,6,Yes,No,Yes,Yes,Yes,"10:40 AM 15th Jun,22",2022-06-15 10:40,18
Katyal Hospital,"Katyal Hospital, KANOD GATE, CIRCULAR ROAD, Rewari, Haryana, India",Yes (21),9,6,6,0,12,6,10,1,Yes,No,Yes,Yes,Yes,"10:18 AM 15th Jun,22",2022-06-15 10:18,18
Maars Hospital,"Garhi Bolni Rd, near PWD Office, Sector 19, Rewari, Haryana",Yes (15),15,0,0,0,15,0,0,0,Yes,No,Yes,Yes,No,"10:24 AM 15th Jun,22",2022-06-15 10:24,18
"Manasavi Hospital, Rewari",,Yes (10),10,0,0,0,10,0,0,0,Yes,No,Yes,No,Yes,"10:31 AM 15th Jun,22",2022-06-15 10:31,18
Matrika Hospital,"Matrika Hospital, Ranbir Singh Huda Chowk, Bawal-Rewari Rd, Rewari, Haryana",Yes (45),30,0,15,3,30,0,15,3,To Be Updated,To Be Updated,To Be Updated,To Be Updated,To Be Updated,"11:46 AM 18th Jun,22",2022-06-18 11:46,18
Mediom Hospital/Medcare Hospital,"Sohna Rd, near Municipal Corporation, Dharuhera, Haryana",Yes (4),3,Beds Over Utilized 1,1,0,8,0,4,1,Yes,No,Yes,Yes,Yes,"10:19 AM 15th Jun,22",2022-06-15 10:19,18
Om Hospital,"Om Hospital, Nandrampur Bass Rd, Dharuhera, Haryana",Yes (24),12,4,8,0,12,4,8,0,Yes,No,Yes,Yes,Yes,"10:20 AM 15th Jun,22",2022-06-15 10:20,18
Pushpanjli Hospital Rewari,"Rajesh Pilot Chowk, Rewari, Haryana",Yes (80),60,10,10,4,60,10,10,4,No,No,Yes,Yes,Yes,"10:32 AM 15th Jun,22",2022-06-15 10:32,18
R. B. Yadav Hospital,"Dr. R B Yadav Hospital, Circular Rd Jainpuri, Kayasthwara Mohalla, Rewari, Haryana",Yes (22),8,6,8,2,8,6,8,2,Yes,No,Yes,Yes,Yes,"10:18 AM 15th Jun,22",2022-06-15 10:18,18
Samrat Hospital,Near Azad Chowk Rewari,Yes (9),5,0,4,3,5,0,10,3,Yes,No,Yes,Yes,Yes,"10:26 AM 15th Jun,22",2022-06-15 10:26,18
SDH Kosli,"Kosli, Rewari, Haryana",Yes (45),20,20,5,0,20,20,5,0,Yes,No,No,No,No,"10:40 AM 15th Jun,22",2022-06-15 10:40,18
Shanti Yadav Hospital,"Bawal-Rewari Rd Model Town, Rewari, Haryana",Yes (33),19,10,4,0,19,10,4,0,Yes,No,Yes,No,No,"10:35 AM 15th Jun,22",2022-06-15 10:35,18
Sheela Neuro &amp; Multi. Superspeciality Hospital,"Sheela Neuro Multi-Super Speciality Hospital, Opposite Jain Public School, Circular Road, Rewari",Yes (32),15,15,2,0,15,15,3,1,Yes,No,Yes,Yes,No,"10:19 AM 15th Jun,22",2022-06-15 10:19,18
Shri Ashwani Sexena Hospital,"343-L, Model town Rewari",Yes (10),7,3,0,0,7,3,0,0,Yes,No,Yes,Yes,Yes,"10:26 AM 15th Jun,22",2022-06-15 10:26,18
SMCC Hospital,"Sector 5 Rewari, Haryana",Yes (13),2,0,11,1,2,0,11,1,Yes,No,Yes,Yes,Yes,"10:25 AM 15th Jun,22",2022-06-15 10:25,18
Surendra Hospital Bawal,"Circuar Road, Rewari, Haryana",Yes (11),5,2,4,0,5,2,5,0,Yes,No,Yes,No,Yes,"10:27 AM 15th Jun,22",2022-06-15 10:27,18
"Sushma Devi Hospital, Bawal","Rewari Road, Bawal, Rewari, Near Power House & Bharat Petrol Pump",Yes (18),9,9,0,0,9,9,0,0,Yes,No,Yes,Yes,Yes,"10:24 AM 15th Jun,22",2022-06-15 10:24,18
Vedanta Hospital,"Circulare Road, Near Nirankari Satsang Bhavan Dharuhera, Chungi, Rewari, Haryana",Yes (29),0,7,22,0,0,7,30,0,Yes,No,Yes,Yes,Yes,"10:21 AM 15th Jun,22",2022-06-15 10:21,18
Virat Hospital,"Circular Rd, Near Oriental Bank of Commerce, Madhu Vihar, Rewari, Haryana",Yes (100),63,10,27,2,63,10,27,2,To Be Updated,To Be Updated,To Be Updated,To Be Updated,To Be Updated,"10:36 AM 15th Jun,22",2022-06-15 10:36,18
Yaduvanshi Hospital,"Maharana Pratap Chowk, Model Town, Rewari, Haryana",Yes (46),36,0,10,1,36,0,10,1,Yes,No,Yes,Yes,No,"10:34 AM 15th Jun,22",2022-06-15 10:34,18
Adiyogi Arogya Avenue,"232, Subhash Nagar, Near civil hospital back gate, Jhajjar",Yes (15),7,2,6,1,7,2,6,1,To Be Updated,To Be Updated,Yes,Yes,Yes,"5:15 PM 7th Jun,22",2022-06-07 17:15,8
"Advanta Hospital, Jhajjar city","Silani Gate, Jhajjar, Haryana",Yes (50),24,10,16,1,24,10,16,1,Yes,To Be Updated,Yes,To Be Updated,Yes,"1:50 PM 3rd Mar,22",2022-03-03 13:50,8
"Brahm Shakti Sanjivani Hospital, B.garh","Opp. BSNL Exchange, Delhi - Rohtak Road, NH9, Bahadurgarh, Haryana",Yes (100),60,20,20,3,60,20,20,3,Yes,No,Yes,Yes,Yes,"5:12 PM 7th Jun,22",2022-06-07 17:12,8
Civil Hospital Jhajjar,"Jhajjar, NH-71, Jhajjar Rohtak Road, Jhajjar, Jhajjar, Haryana",Yes (38),33,0,5,5,33,0,5,5,Yes,To Be Updated,To Be Updated,To Be Updated,To Be Updated,"5:14 PM 7th Jun,22",2022-06-07 17:14,8
"Delhi Hospital, Bahadurgarh","Rohtak Rd, near Shyamji Complex, Ram Nagar, Bahadurgarh, Haryana",Yes (50),20,20,10,2,20,20,10,2,Yes,No,Yes,Yes,Yes,"5:12 PM 7th Jun,22",2022-06-07 17:12,8
Dr. Sanjay Multi Speciality Hospital,INFRONT OF CIVIL HOSPITAL BAHADURGARH,Yes (61),45,10,6,1,45,10,6,1,Yes,No,No,To Be Updated,To Be Updated,"1:50 PM 3rd Mar,22",2022-03-03 13:50,8
"Jeewan Jyoti Hospital, Bahadurgarh","Rohtak Rd, MIE Part-B, Bahadurgarh, Haryana",Yes (143),70,68,5,4,70,68,5,4,Yes,To Be Updated,To Be Updated,To Be Updated,To Be Updated,"6:34 PM 15th Jun,22",2022-06-15 18:34,8
"JK Hospital, Bahadurgarh","Bahadurgarh,, Bahamnoli, Bahadurgarh, Haryana",No (0),0,0,0,0,0,0,0,0,To Be Updated,To Be Updated,To Be Updated,To Be Updated,To Be Updated,"11:42 AM 15th Jun,22",2022-06-15 11:42,8
"Medicare Super Speciality Hospiatl &amp; Trauma Centre, Jhajjar City","Dadri road Jhajjar, Jhajjar, Haryana",Yes (50),15,23,12,3,15,23,12,3,Yes,To Be Updated,Yes,To Be Updated,Yes,"1:50 PM 3rd Mar,22",2022-03-03 13:50,8
"Mission Hospital, Bahadurgarh","Near main Bus Stand & City Metro Station, Rohtak Rd, Bahadurgarh, Jhajjar ,Haryana",Yes (33),25,0,8,4,25,0,8,4,To Be Updated,No,Yes,Yes,No,"1:50 PM 3rd Mar,22",2022-03-03 13:50,8
"Oscar Hospital, JJR city","Civil Road,Opp Civil Hospital, Jhajjar, Haryana",Yes (80),8,58,14,1,8,58,14,1,To Be Updated,To Be Updated,To Be Updated,To Be Updated,To Be Updated,"1:50 PM 3rd Mar,22",2022-03-03 13:50,8
Oxymus Hospital,"Opposite Civil Hospital, Near Metro Pollar No. 876 Delhi Rohtak Road, Bahadurgarh",Yes (10),4,0,6,0,4,0,6,0,Yes,No,No,No,No,"5:15 PM 7th Jun,22",2022-06-07 17:15,8
"Rana Hospital, Bahadurgarh","OPP. REST HOUSE,OLD BARAHI ROAD, BAHADURGARH",Yes (25),18,0,7,2,18,0,7,2,To Be Updated,To Be Updated,No,No,Yes,"5:15 PM 7th Jun,22",2022-06-07 17:15,8
"RJ Super Speciality Hospital, B.garh","Delhi - Rohtak Rd, Near Rajesh Joon Office, Dalbir Nagar, Bahadurgarh, Haryana",Yes (17),10,5,2,1,10,5,2,1,Yes,No,Yes,Yes,Yes,"5:12 PM 7th Jun,22",2022-06-07 17:12,8
RS GAUR GLOBAL MULTISPECIALITY HOSPITAL,"Jhajjar Road Netaji Subhash Vihar, Haryana",Yes (33),19,7,7,2,19,7,7,2,Yes,No,Yes,Yes,Yes,"1:50 PM 3rd Mar,22",2022-03-03 13:50,8
"SDH, Bahadurgarh","Madhya Marg, Old Industrial Area, Bahadurgarh, Haryana",Yes (35),27,0,8,8,27,0,8,8,Yes,Yes,Yes,No,Yes,"1:50 PM 3rd Mar,22",2022-03-03 13:50,8
"Shivam Hospital, B.garh","Line Par, Shastri Nagar, Netaji Nagar, Bahadurgarh, Haryana",Yes (51),30,15,6,1,30,15,6,1,Yes,No,Yes,Yes,Yes,"5:12 PM 7th Jun,22",2022-06-07 17:12,8
"Swastik Hospital, Bahadurgarh","Jhajjar Rd, Shakti Nagar, Sakti Nagar, Bahadurgarh, Haryana",Yes (40),26,4,10,2,26,4,10,2,Yes,No,Yes,Yes,Yes,"1:50 PM 3rd Mar,22",2022-03-03 13:50,8
World College Of Medical Sciences And Hospital,"Jhajjar Sampla Road, Gurwar, Jhajjar, Haryana",Yes (250),90,135,25,4,90,135,25,4,Yes,Yes,Yes,Yes,Yes,"5:12 PM 7th Jun,22",2022-06-07 17:12,8
Aarti Hospital,"A-628, Near Hanuman Mandir, Dabua Pali Road, NIT Faridabad",Yes (23),5,15,3,0,5,15,3,0,Yes,Yes,Yes,Yes,Yes,"4:08 PM 24th Dec,22",2022-12-24 16:08,4
Aastha Hospital,"SCF -2, Ashoka Enclave Main Rd, Sector 35, Faridabad",Yes (14),10,4,0,0,10,4,0,0,Yes,No,Yes,Yes,Yes,"4:56 PM 16th Jun,22",2022-06-16 16:56,4
Accord  Super special hospital,Sec 86,Yes (12),8,Beds Over Utilized 2,4,4,8,0,4,4,Yes,To Be Updated,To Be Updated,To Be Updated,To Be Updated,"12:06 PM 16th Jun,22",2022-06-16 12:06,4
Al-Falah Hospital,"Al Falah university Campus, Dhouj",Yes (77),50,25,2,2,50,25,2,2,Yes,Yes,Yes,Yes,Yes,"2:39 PM 24th Apr,23",2023-04-24 14:39,4
Anshu Hospital,"Shiv Colony Sehatpur Road, Palla No. 1, Faridabad",Yes (19),10,9,0,0,10,10,0,0,Yes,No,Yes,No,No,"6:36 PM 27th Apr,23",2023-04-27 18:36,4
Arise Healthcare,"SCO: C 3185, Near Corporation Bank, Green Field Colony, Faridabad",Yes (16),2,7,7,2,2,7,7,2,Yes,Yes,Yes,No,No,"10:42 AM 9th Jun,23",2023-06-09 10:42,4
Arsh Hospital,"Opp. Era Redwood Residency, Tigaon Rd, Sector 78, Faridabad,",Yes (65),40,5,20,6,40,5,20,6,Yes,No,Yes,Yes,Yes,"12:35 PM 2nd Jan,23",2023-01-02 12:35,4
Asian Fidelis Multispeciality Hospital,"RPS Savana, RPS City, Sector-88, Faridabad",Yes (50),40,0,10,2,40,0,10,2,Yes,Yes,Yes,Yes,No,"4:07 PM 30th May,23",2023-05-30 16:07,4
Asian Hospital,"Badkal Flyover Road, Sector  21 A Faridabad",Yes (127),89,0,38,14,89,0,40,14,Yes,Yes,Yes,Yes,Yes,"8:34 AM 28th May,23",2023-05-28 08:34,4
B.K. Hospital Faridabad,B.K. Hospital Faridabad B K Chowk FBD,Yes (100),64,25,11,11,64,25,11,11,To Be Updated,To Be Updated,To Be Updated,To Be Updated,To Be Updated,"10:23 AM 1st May,23",2023-05-01 10:23,4
Bhavya Kalyani Hospital,"Mohna Road, Near Aanand Bakery, Ballabgarh, Faridabad",Yes (17),5,9,3,0,5,9,3,0,Yes,No,Yes,Yes,Yes,"5:15 PM 7th Jun,22",2022-06-07 17:15,4
Chugh Hospital,"5L-164, K.C. Road N.I.T. Faridabad",Yes (18),4,14,0,0,4,14,0,0,To Be Updated,No,Yes,Yes,Yes,"12:27 PM 25th Mar,23",2023-03-25 12:27,4
D.M. Hospital,"89-A, NH-5, Railway Road, Near Police Thana, NIT, Faridabad",Yes (28),10,10,8,1,10,10,8,1,Yes,No,No,Yes,Yes,"5:13 PM 7th Jun,22",2022-06-07 17:13,4
Doctor Today Multispecialty Hospital,"5-C/2,B.P., Railway Road,, Near Bankey Bihari Mandir,, next to IDBI Bank, Faridabad",Yes (40),35,0,5,2,35,0,5,2,Yes,No,Yes,Yes,Yes,"5:13 PM 7th Jun,22",2022-06-07 17:13,4
Dr. Harish Hospital,"701, Sector 8, YMCA Road, Faridabad",Yes (7),5,0,2,0,5,0,2,0,Yes,No,Yes,Yes,Yes,"10:57 PM 7th Jan,23",2023-01-07 22:57,4
Durga Multispeciality Hospital,"Shri Bankey Bihari Mandir Complex, Neelam-Railway Road, NIT 5, Faridabad",Yes (30),22,0,8,0,22,0,8,0,No,No,No,No,No,"10:26 AM 15th Oct,22",2022-10-15 10:26,4
"ESIC Medical College, Faridabad","NH-3, NIT Behind BK Hospital, Haryana",Yes (579),150,350,79,50,150,350,80,50,Yes,Yes,Yes,Yes,Yes,"5:21 PM 18th Apr,23",2023-04-18 17:21,4
Fortis Escort Hospital,"Neelam Bata Rd, opp. Neelam Cinema, AC Nagar, New Industrial Town, Faridabad,",Yes (69),55,0,14,7,55,0,14,7,Yes,Yes,Yes,Yes,Yes,"3:53 PM 5th May,23",2023-05-05 15:53,4
Gaurav Hospital,"Rajeev Colony, Samaypur Road, Ballabgarh, Faridabad",Yes (15),3,2,10,1,3,2,10,1,Yes,To Be Updated,Yes,To Be Updated,To Be Updated,"5:14 PM 7th Jun,22",2022-06-07 17:14,4
Geeta Hospital,"Opposite Huda Market and Community Centre, Sector 28, Faridabad",Yes (13),3,0,10,2,8,0,10,2,Yes,No,Yes,Yes,Yes,"11:09 AM 16th Mar,23",2023-03-16 11:09,4
Geetanjali Multispeciality Hospital,"D-635, 60 Feet Rd, Chawla Colony, Ballabhgarh, Faridabad",Yes (23),20,3,0,0,20,3,0,0,Yes,To Be Updated,Yes,Yes,To Be Updated,"5:13 PM 7th Jun,22",2022-06-07 17:13,4
Goyal Hospital,"Plot No. 2 opposite hanuman temple Sec 8, Surdas Park",Yes (18),12,0,6,2,12,0,6,2,Yes,Yes,Yes,Yes,Yes,"3:38 PM 23rd Jan,23",2023-01-23 15:38,4
Handa Medical Center,"Site No-1, Sector 16, Opp Sagar Cinema, Faridabad",No (0),0,0,0,0,0,0,0,0,No,No,No,To Be Updated,No,"5:13 PM 7th Jun,22",2022-06-07 17:13,4
Heritage Hospital,3C-62B/BP NIT Faridabad,Yes (15),11,0,4,1,11,0,4,1,To Be Updated,To Be Updated,To Be Updated,To Be Updated,To Be Updated,"5:15 PM 7th Jun,22",2022-06-07 17:15,4
IBS Ashwani Hospital,"Plot No 8 D/1, YMCA Rd, Pocket D, Sector 11, Faridabad",Yes (35),22,5,8,2,22,5,8,2,To Be Updated,To Be Updated,To Be Updated,To Be Updated,To Be Updated,"5:13 PM 7th Jun,22",2022-06-07 17:13,4
Janak Hospital,Indira complex Neharpar Kheri Road Faridabad,Yes (27),15,6,6,0,15,6,6,0,To Be Updated,To Be Updated,To Be Updated,To Be Updated,To Be Updated,"11:21 AM 21st Mar,23",2023-03-21 11:21,4
Kant Multispeciality Hospital Pvt Ltd,"Plot no. 167, Indra Complex, Kheri Road, Greater, near Kheri Pul Bridge, Sector 87, Neharpar Faridabad, Faridabad, Haryana 121002",Yes (23),18,0,5,1,18,0,5,1,Yes,No,To Be Updated,To Be Updated,To Be Updated,"2:54 PM 22nd May,23",2023-05-22 14:54,4
Kedar Hospital,"3B/3, B.P , Near DAV college, NIT., Faridabad,",Yes (49),31,6,12,1,31,6,12,1,Yes,Yes,Yes,Yes,Yes,"4:06 PM 24th Dec,22",2022-12-24 16:06,4
Kedar Hospital Multispeciality,Gali 7 Krishna Colony Sec25 Faridabad,Yes (30),10,15,5,0,10,15,5,0,Yes,No,Yes,Yes,Yes,"5:14 PM 7th Jun,22",2022-06-07 17:14,4
