name,address,Availability_availability_of_beds,Availability_oxygen_beds,Availability_non_oxygen_beds,Availability_i_c_u_beds,Availability_ventilators,Allocated_oxygen_beds,Allocated_non_oxygen_beds,Allocated_i_c_u,Allocated_ventilators,Availability_availability_of_oxygen,Availability_antiviral_remdesivir_etc_,Availability_steroids,Availability_anticoagulant,Availability_antipyretic,updated_on_unparsed,updated_on,city
SL Minda Hospital,VPO Bagla,Yes (8),6,0,2,2,6,0,2,2,Yes,No,Yes,Yes,Yes,"5:13 PM 7th Jun,22",2022-06-07 17:13,7
SONAKSHI CHILDREN HOSPITAL,"PLOT NO.2 ,DAYANAND COLONY,JINDAL HOSPITAL ROAD ,NEAR ITI ,HISAR",Yes (3),1,0,2,1,1,0,2,1,Yes,To Be Updated,To Be Updated,To Be Updated,To Be Updated,"11:52 AM 15th Jun,22",2022-06-15 11:52,7
Sukhda Multispeciality Hospital,Dabra Chowk Hisar,Yes (53),31,16,6,6,31,16,6,6,Yes,Yes,Yes,Yes,Yes,"10:56 AM 21st Aug,22",2022-08-21 10:56,7
Vardaan Hospital Hisar,Hisar,Yes (21),9,1,11,2,9,1,11,2,Yes,No,Yes,Yes,Yes,"12:02 PM 2nd Aug,22",2022-08-02 12:02,7
GH Charkhi Dadri,"Near Loharu Chowk,Charkhi Dadri",Yes (51),35,15,1,11,35,15,1,11,Yes,Yes,Yes,Yes,Yes,"10:28 AM 2nd Aug,22",2022-08-02 10:28,3
Jaihind Hospital,Charkhi Dadri,Yes (13),7,1,5,0,7,1,5,0,Yes,Yes,Yes,To Be Updated,To Be Updated,"10:30 AM 2nd Aug,22",2022-08-02 10:30,3
Murari Lal Rasiwasia Ayurvedic Hospital,"Delhi Road,Near Janta College",Yes (70),60,10,0,0,60,10,0,0,Yes,Yes,Yes,Yes,Yes,"10:28 AM 2nd Aug,22",2022-08-02 10:28,3
Oscar Hospital,Charkhi Dadri,Yes (20),0,0,20,0,0,0,20,0,To Be Updated,To Be Updated,To Be Updated,To Be Updated,To Be Updated,"10:30 AM 2nd Aug,22",2022-08-02 10:30,3
Pradhan Medicare Centre,"Loharu Rd, Charkhi Dadri, Haryana",Yes (17),14,0,3,0,14,0,3,0,To Be Updated,Yes,Yes,Yes,Yes,"10:27 AM 2nd Aug,22",2022-08-02 10:27,3
Sunflag Hospital,Charkhi Dadri,Yes (12),6,0,6,0,6,0,6,0,To Be Updated,To Be Updated,To Be Updated,To Be Updated,To Be Updated,"10:30 AM 2nd Aug,22",2022-08-02 10:30,3
"AMRITDHARA, Chaura Bazar","Near ITI Chowk, Gahoon Vihar, Karnal, Haryana",Yes (64),38,0,26,0,38,0,26,2,Yes,No,Yes,Yes,Yes,"10:29 AM 2nd Aug,22",2022-08-02 10:29,11
Arpana Hospital,"G.T. Road, Madhuban, Karnal, Karnal, Haryana",No (0),0,0,0,1,0,0,0,1,Yes,No,Yes,Yes,Yes,"4:54 PM 2nd Aug,22",2022-08-02 16:54,11
Arsh Hospital,Opp. Kalpana Chawla Medical College,No (0),0,0,0,0,0,0,0,0,Yes,Yes,Yes,Yes,Yes,"4:56 PM 2nd Aug,22",2022-08-02 16:56,11
CHC Assandh,"Assandh, Assandh Ruralpart, Haryana",Yes (10),10,0,0,0,10,0,0,0,Yes,No,Yes,No,Yes,"10:11 AM 2nd Aug,22",2022-08-02 10:11,11
CHC Gharaunda,"Balinagar, Gharaunda, Haryana",Yes (10),10,0,0,0,10,0,0,0,Yes,No,Yes,No,Yes,"10:11 AM 2nd Aug,22",2022-08-02 10:11,11
CHC Kunjpura,Village Kunjpura,Yes (11),11,0,0,0,11,0,0,0,To Be Updated,Yes,Yes,Yes,Yes,"10:24 AM 2nd Aug,22",2022-08-02 10:24,11
CHC Nissing,"SH 8, Gondar, Nissing, Haryana",Yes (10),10,0,0,0,10,0,0,0,Yes,No,Yes,No,Yes,"10:11 AM 2nd Aug,22",2022-08-02 10:11,11
CHC Taraori,CHC Taraori,Yes (6),6,0,0,0,6,0,0,0,Yes,No,Yes,No,Yes,"10:22 AM 2nd Aug,22",2022-08-02 10:22,11
Ishwar Kirpa Hospital,"Ishwar Kirpa Hospital, Sector -14",No (0),0,0,0,0,0,0,0,0,Yes,Yes,Yes,Yes,Yes,"5:01 PM 2nd Aug,22",2022-08-02 17:01,11
"Kalpana Chawla Government Medical College, Karnal","Model Town, Karnal, Haryana",Yes (276),198,0,78,0,200,0,80,80,Yes,Yes,Yes,Yes,Yes,"10:29 AM 2nd Aug,22",2022-08-02 10:29,11
Karnal Nursing Home,"26 Duggal Colony, Karnal",No (0),0,0,0,0,0,0,0,0,Yes,To Be Updated,Yes,Yes,Yes,"5:01 PM 2nd Aug,22",2022-08-02 17:01,11
Park Hospital karnal,"CHD City, NH-1, Sector 45, Karnal, Haryana",Yes (30),10,0,20,2,10,0,20,2,To Be Updated,Yes,Yes,Yes,Yes,"10:09 AM 2nd Aug,22",2022-08-02 10:09,11
Rama Superspeciality Hospital,Civil Hosp Chowk Karnal,No (0),0,0,0,0,0,0,0,0,Yes,No,Yes,Yes,Yes,"5:00 PM 2nd Aug,22",2022-08-02 17:00,11
"Sanjiv Bansal Cygnus Hospital , Karnal","Railway Rd, Ibrahim Mandi, Karnal, Haryana",Yes (19),17,0,2,2,20,0,5,2,Yes,Yes,Yes,Yes,Yes,"10:12 AM 2nd Aug,22",2022-08-02 10:12,11
Sarvodya Hospital Karnal,"Sector 14, Near Tau Devi Lal Chowk",No (0),0,0,0,0,0,0,0,0,To Be Updated,To Be Updated,To Be Updated,To Be Updated,To Be Updated,"8:33 AM 9th Aug,22",2022-08-09 08:33,11
SDH Nilokheri,SDH Nilokheri,Yes (10),10,0,0,0,10,0,0,0,Yes,No,Yes,No,Yes,"10:15 AM 2nd Aug,22",2022-08-02 10:15,11
Shri Ram Chand Memorial Hospital,"12, Ashoka colony,Opp Kalpana Chawla hospital, Karnal, Haryana",Yes (15),8,0,7,0,8,0,7,3,Yes,No,Yes,Yes,Yes,"10:28 AM 2nd Aug,22",2022-08-02 10:28,11
Shri Sanatan Dharam Mahabir Dal,"Kunjpura Road, Karnal Near Sanatan Dharam Mandir",Yes (12),12,0,0,0,12,0,0,0,Yes,Yes,Yes,Yes,Yes,"10:15 AM 2nd Aug,22",2022-08-02 10:15,11
SS Hospital,"Sector 14, Karnal",No (0),0,0,0,0,0,0,0,0,Yes,To Be Updated,Yes,Yes,Yes,"5:00 PM 2nd Aug,22",2022-08-02 17:00,11
Swastik Hospital,Swastic Hospital Opp DCH,No (0),0,0,0,0,0,0,0,0,Yes,No,Yes,Yes,Yes,"5:02 PM 2nd Aug,22",2022-08-02 17:02,11
Virk Hospital Karnal,"363-364, Randhir lane, near Dyal Singh College, Karnal, Haryana",Yes (45),37,0,8,1,37,0,8,1,Yes,Yes,Yes,Yes,Yes,"10:12 AM 2nd Aug,22",2022-08-02 10:12,11
Aarti Hospital,"A-628, Near Hanuman Mandir, Dabua Pali Road, NIT Faridabad",Yes (23),5,15,3,0,5,15,3,0,Yes,Yes,Yes,Yes,Yes,"9:31 AM 26th Jun,22",2022-06-26 09:31,4
Aastha Hospital,"SCF -2, Ashoka Enclave Main Rd, Sector 35, Faridabad",Yes (14),10,4,0,0,10,4,0,0,Yes,No,Yes,Yes,Yes,"4:56 PM 16th Jun,22",2022-06-16 16:56,4
Accord Super special hospital,Sec 86,Yes (12),8,Beds Over Utilized 2,4,4,8,0,4,4,Yes,To Be Updated,To Be Updated,To Be Updated,To Be Updated,"12:06 PM 16th Jun,22",2022-06-16 12:06,4
Al-Falah Hospital,"Al Falah university Campus, Dhouj",Yes (77),50,25,2,2,50,25,2,2,Yes,Yes,Yes,Yes,Yes,"9:52 AM 2nd Dec,22",2022-12-02 09:52,4
Anshu Hospital,"Shiv Colony Sehatpur Road, Palla No. 1, Faridabad",Yes (20),10,10,0,0,10,10,0,0,Yes,No,Yes,No,No,"9:35 AM 13th Oct,22",2022-10-13 09:35,4
Arise Healthcare,"SCO: C 3185, Near Corporation Bank, Green Field Colony, Faridabad",Yes (16),2,7,7,2,2,7,7,2,Yes,Yes,Yes,No,No,"10:31 AM 1st Dec,22",2022-12-01 10:31,4
Arsh Hospital,"Opp. Era Redwood Residency, Tigaon Rd, Sector 78, Faridabad,",Yes (65),40,5,20,6,40,5,20,6,Yes,No,Yes,Yes,Yes,"10:41 AM 1st Sep,22",2022-09-01 10:41,4
Asian Fidelis Multispeciality Hospital,"RPS Savana, RPS City, Sector-88, Faridabad",Yes (50),40,0,10,2,40,0,10,2,Yes,Yes,Yes,Yes,No,"2:43 PM 1st Dec,22",2022-12-01 14:43,4
Asian Hospital,"Badkal Flyover Road, Sector  21 A Faridabad",Yes (129),89,0,40,14,89,0,40,14,Yes,Yes,Yes,Yes,Yes,"10:21 AM 28th Nov,22",2022-11-28 10:21,4
B.K. Hospital Faridabad,B.K. Hospital Faridabad B K Chowk FBD,Yes (100),64,25,11,11,64,25,11,11,To Be Updated,To Be Updated,To Be Updated,To Be Updated,To Be Updated,"10:19 AM 1st Dec,22",2022-12-01 10:19,4
Bhavya Kalyani Hospital,"Mohna Road, Near Aanand Bakery, Ballabgarh, Faridabad",Yes (17),5,9,3,0,5,9,3,0,Yes,No,Yes,Yes,Yes,"5:15 PM 7th Jun,22",2022-06-07 17:15,4
Chugh Hospital,"5L-164, K.C. Road N.I.T. Faridabad",Yes (18),4,14,0,0,4,14,0,0,To Be Updated,No,Yes,Yes,Yes,"4:18 PM 7th Jul,22",2022-07-07 16:18,4
D.M. Hospital,"89-A, NH-5, Railway Road, Near Police Thana, NIT, Faridabad",Yes (28),10,10,8,1,10,10,8,1,Yes,No,No,Yes,Yes,"5:13 PM 7th Jun,22",2022-06-07 17:13,4
Doctor Today Multispecialty Hospital,"5-C/2,B.P., Railway Road,, Near Bankey Bihari Mandir,, next to IDBI Bank, Faridabad",Yes (40),35,0,5,2,35,0,5,2,Yes,No,Yes,Yes,Yes,"5:13 PM 7th Jun,22",2022-06-07 17:13,4
Dr. Harish Hospital,"701, Sector 8, YMCA Road, Faridabad",Yes (7),5,0,2,0,5,0,2,0,Yes,No,Yes,Yes,Yes,"10:55 AM 23rd Nov,22",2022-11-23 10:55,4
Durga Multispeciality Hospital,"Shri Bankey Bihari Mandir Complex, Neelam-Railway Road, NIT 5, Faridabad",Yes (30),22,0,8,0,22,0,8,0,No,No,No,No,No,"10:26 AM 15th Oct,22",2022-10-15 10:26,4
"ESIC Medical College, Faridabad","NH-3, NIT Behind BK Hospital, Haryana",Yes (580),150,350,80,50,150,350,80,50,Yes,Yes,Yes,Yes,Yes,"9:49 AM 16th Sep,22",2022-09-16 09:49,4
Fortis Escort Hospital,"Neelam Bata Rd, opp. Neelam Cinema, AC Nagar, New Industrial Town, Faridabad,",Yes (69),55,0,14,7,55,0,14,7,Yes,Yes,Yes,Yes,Yes,"10:43 AM 17th Jun,22",2022-06-17 10:43,4
Gaurav Hospital,"Rajeev Colony, Samaypur Road, Ballabgarh, Faridabad",Yes (15),3,2,10,1,3,2,10,1,Yes,To Be Updated,Yes,To Be Updated,To Be Updated,"5:14 PM 7th Jun,22",2022-06-07 17:14,4
Geeta Hospital,"Opposite Huda Market and Community Centre, Sector 28, Faridabad",Yes (14),4,0,10,2,8,0,10,2,Yes,No,Yes,Yes,Yes,"11:02 AM 2nd Dec,22",2022-12-02 11:02,4
Geetanjali Multispeciality Hospital,"D-635, 60 Feet Rd, Chawla Colony, Ballabhgarh, Faridabad",Yes (23),20,3,0,0,20,3,0,0,Yes,To Be Updated,Yes,Yes,To Be Updated,"5:13 PM 7th Jun,22",2022-06-07 17:13,4
Goyal Hospital,"Plot No. 2 opposite hanuman temple Sec 8, Surdas Park",Yes (18),12,0,6,2,12,0,6,2,Yes,Yes,Yes,Yes,Yes,"12:10 PM 3rd Oct,22",2022-10-03 12:10,4
Handa Medical Center,"Site No-1, Sector 16, Opp Sagar Cinema, Faridabad",No (0),0,0,0,0,0,0,0,0,No,No,No,To Be Updated,No,"5:13 PM 7th Jun,22",2022-06-07 17:13,4
Heritage Hospital,3C-62B/BP NIT Faridabad,Yes (15),11,0,4,1,11,0,4,1,To Be Updated,To Be Updated,To Be Updated,To Be Updated,To Be Updated,"5:15 PM 7th Jun,22",2022-06-07 17:15,4
IBS Ashwani Hospital,"Plot No 8 D/1, YMCA Rd, Pocket D, Sector 11, Faridabad",Yes (35),22,5,8,2,22,5,8,2,To Be Updated,To Be Updated,To Be Updated,To Be Updated,To Be Updated,"5:13 PM 7th Jun,22",2022-06-07 17:13,4
Janak Hospital,Indira complex Neharpar Kheri Road Faridabad,Yes (27),15,6,6,0,15,6,6,0,Yes,No,Yes,Yes,Yes,"12:03 PM 23rd Aug,22",2022-08-23 12:03,4
Kant Multispeciality Hospital Pvt Ltd,"Plot no. 167, Indra Complex, Kheri Road, Greater, near Kheri Pul Bridge, Sector 87, Neharpar Faridabad, Faridabad, Haryana 121002",Yes (23),18,0,5,1,18,0,5,1,Yes,No,To Be Updated,To Be Updated,To Be Updated,"8:37 AM 14th Sep,22",2022-09-14 08:37,4
Kedar Hospital,"3B/3, B.P , Near DAV college, NIT., Faridabad,",Yes (49),31,6,12,1,31,6,12,1,Yes,Yes,Yes,Yes,Yes,"9:30 AM 26th Jun,22",2022-06-26 09:30,4
Kedar Hospital Multispeciality,Gali 7 Krishna Colony Sec25 Faridabad,Yes (30),10,15,5,0,10,15,5,0,Yes,No,Yes,Yes,Yes,"5:14 PM 7th Jun,22",2022-06-07 17:14,4
Krishna Medical Centre,"773, Sector-19, Faridabad",Yes (10),5,0,5,0,5,0,5,0,Yes,Yes,Yes,Yes,Yes,"5:15 PM 7th Jun,22",2022-06-07 17:15,4
Life Hospital,Opp Hanuman Mandir Sec 8 Faridabad,Yes (10),4,0,6,1,4,0,6,1,Yes,Yes,Yes,Yes,Yes,"5:14 PM 7th Jun,22",2022-06-07 17:14,4
Lotus Hospital,"Plot-2, Jeevan Nagar, Opp. Lal Kothi, Main Ballabgarh Sohna Road, Faridabad",Yes (20),12,0,8,1,12,0,8,1,Yes,No,Yes,Yes,Yes,"9:17 AM 10th Sep,22",2022-09-10 09:17,4
Madhav Hospital,"Building no 16, Block E, and, New Industrial Twp 5, Faridabad, Haryana 121001",Yes (28),0,0,28,2,0,0,28,2,To Be Updated,No,To Be Updated,To Be Updated,To Be Updated,"1:24 PM 15th Jun,22",2022-06-15 13:24,4
Manavta Hospital,"Plot No-494, Near Women ITI, Uncha Gaon Prem Nagar, Mohna Road, Ballabgarh, Faridabad",Yes (31),10,10,11,3,10,10,11,3,To Be Updated,To Be Updated,To Be Updated,To Be Updated,To Be Updated,"9:50 AM 15th Jun,22",2022-06-15 09:50,4
Manvi Medical Centre,"New Bharat Colony, Opp. Chaddar Godam, Near Mahaban Farm, Kheri Road, Greater Faridabad",Yes (9),7,0,2,0,7,0,2,0,To Be Updated,To Be Updated,To Be Updated,To Be Updated,To Be Updated,"10:05 AM 16th Jul,22",2022-07-16 10:05,4
Medicheck Hospital,"Block C, Plot Number 76, Shahid Bhagat Singh Marg, near Bata Flyover, New Industrial Town, Faridabad",Yes (64),52,0,12,3,52,0,12,3,Yes,No,Yes,Yes,Yes,"5:13 PM 7th Jun,22",2022-06-07 17:13,4
Medstar Hospital,"Om Enclave Part 1, Near Toll Tax, Agwanpur Road, Faridabad",Yes (7),5,2,0,0,5,2,0,0,Yes,No,Yes,Yes,To Be Updated,"5:13 PM 7th Jun,22",2022-06-07 17:13,4
Medwin Hospital,"Plot No. 2, Jeevan Nagar, Sohna Road Gounchi, Sector 55, Faridabad",Yes (20),2,12,6,0,2,12,6,0,To Be Updated,No,Yes,Yes,Yes,"11:18 AM 2nd Dec,22",2022-12-02 11:18,4
Metro Hospital Medicare,"Metro Heart Institute with Multispeciality Sector 16 A, Faridabad",Yes (145),80,45,20,11,80,45,20,11,Yes,Yes,Yes,Yes,Yes,"5:58 PM 19th Nov,22",2022-11-19 17:58,4
National Institute Of Medical Sciences,"Sector -23A,?Faridabad,?",Yes (28),15,4,9,2,15,4,9,2,Yes,No,Yes,Yes,Yes,"12:11 PM 3rd Aug,22",2022-08-03 12:11,4
Ortho 1 Hospital,"1331, Near Community Centre, Sector 55, Faridabad",Yes (30),8,12,10,1,8,12,10,1,Yes,No,Yes,Yes,Yes,"8:14 AM 2nd Dec,22",2022-12-02 08:14,4
Park Hospital Faridabad,"J Block, Sector 10 HBC, opposite Court, Faridabad",Yes (45),10,10,25,5,10,10,25,5,Yes,No,Yes,Yes,Yes,"8:38 AM 2nd Dec,22",2022-12-02 08:38,4
Pawan Hospital Unit-1,"Samaypur Road Near Sector 56, Ballabhgarh, Faridabad",Yes (45),31,0,14,7,31,0,14,7,To Be Updated,To Be Updated,To Be Updated,To Be Updated,To Be Updated,"9:50 AM 2nd Dec,22",2022-12-02 09:50,4
Pawan Hospital Unit-2,"Plot No. 10, Jawahar Colony, Near Disposal Chowk, Faridabad",Yes (11),0,0,11,0,0,0,11,0,To Be Updated,To Be Updated,To Be Updated,To Be Updated,To Be Updated,"10:04 AM 29th Nov,22",2022-11-29 10:04,4
Prachi Hospital,Opp Chimni Bai Dharmshala Faridabad,Yes (17),10,2,5,1,10,2,5,1,Yes,No,Yes,Yes,Yes,"10:41 AM 15th Jun,22",2022-06-15 10:41,4
QRG Central,"Plot No, 69, Mathura Rd, Sector 20 A, New Industrial Town, Faridabad",Yes (10),6,0,4,2,6,0,4,2,Yes,Yes,Yes,Yes,Yes,"1:41 PM 2nd Dec,22",2022-12-02 13:41,4
QRG Hospital Medicare,"Ambedkar Marg, QRG Healthcity, Sector 16, Faridabad",Yes (122),104,0,18,7,104,0,18,7,Yes,Yes,Yes,Yes,Yes,"11:19 AM 10th Sep,22",2022-09-10 11:19,4
Raghav Hospital,Kheri Road Sec 87 Greater Faridabad,Yes (23),17,3,3,1,17,3,3,1,Yes,No,Yes,Yes,Yes,"12:01 PM 15th Jun,22",2022-06-15 12:01,4
Raj Nursing Home,"CLINIC SITE NO-6, Sector 3, Faridabad",Yes (17),13,0,4,1,13,0,4,1,Yes,No,Yes,Yes,Yes,"5:14 PM 7th Jun,22",2022-06-07 17:14,4
Ronak Hospital,"Dabua Pali Road, Near Ganga Ram Devta Mandir, NIT, Faridabad",Yes (50),20,20,10,3,20,20,10,3,Yes,Yes,Yes,Yes,Yes,"11:12 AM 1st Aug,22",2022-08-01 11:12,4
Samrat Hospital,"180, Sanjay Colony, Delhi Mathura Road, JCB Chowk, Ballabgarh, Faridabad",Yes (20),10,0,10,0,10,0,10,0,To Be Updated,To Be Updated,To Be Updated,To Be Updated,To Be Updated,"5:15 PM 7th Jun,22",2022-06-07 17:15,4
Sanjeevan Multispeciality Hospital,"D-947, 60 Feet Road, Opp. Shiv Mandir, Chawla Colony, Ballabgarh, Faridabad",Yes (17),7,2,8,0,7,2,8,0,No,Yes,Yes,Yes,Yes,"5:13 PM 7th Jun,22",2022-06-07 17:13,4
Santosh Multispeciality Hospital,"Shop No. 3F, 139, Metro Rd, New Industrial Township 2b, Block F, New Industrial Twp 3, New Industrial Town, Faridabad,",Yes (60),40,10,10,1,40,10,10,1,Yes,No,Yes,Yes,Yes,"12:46 PM 13th Jul,22",2022-07-13 12:46,4
Sarvodya Hospital Sector-8,"Sector-8, YMCA Rd, near Escorts Mujesar Metro Station, Sector 7, Faridabad",Yes (150),125,0,25,5,125,0,25,5,Yes,Yes,No,No,Yes,"10:14 AM 11th Oct,22",2022-10-11 10:14,4
Sarvodya Hospital Sector 19,"Gopi Colony, Old Faridabad, Faridabad",Yes (37),28,0,9,4,28,0,10,4,Yes,Yes,Yes,Yes,To Be Updated,"3:08 PM 11th Aug,22",2022-08-11 15:08,4
Sattya Hospital,"376, IP Colony, Sector 32-33 Faridabad",Yes (10),6,0,4,2,6,0,4,2,Yes,To Be Updated,To Be Updated,To Be Updated,To Be Updated,"10:06 AM 3rd Sep,22",2022-09-03 10:06,4
Shankar Medicare Center,Sec 28 Faridabad,Yes (35),15,20,0,0,15,20,0,0,Yes,Yes,Yes,Yes,Yes,"11:28 AM 2nd Dec,22",2022-12-02 11:28,4
Shanti Devi Memorial Hospital,"Kheri More Near, Piyush Heights, Sector 89, Faridabad",Yes (25),14,8,3,2,14,8,3,2,Yes,No,Yes,Yes,Yes,"11:10 AM 24th Nov,22",2022-11-24 11:10,4
Shivalik Hospital Unit 1,Huda Market Sector-37 Faridabad,Yes (7),0,3,4,0,0,3,4,0,Yes,No,Yes,Yes,Yes,"5:33 PM 2nd Dec,22",2022-12-02 17:33,4
Shivalik Hospital Unit 2,"Sehatpur, Opp. Sec-91 Faridabad",Yes (2),0,0,2,0,0,0,2,0,Yes,No,Yes,Yes,Yes,"5:34 PM 2nd Dec,22",2022-12-02 17:34,4
"Shri Atal Bihari Vajpayee Government Medical College, Chhainsa","Village  Chhainsa, Faridabad",Yes (100),100,0,0,0,100,0,0,0,Yes,Yes,Yes,No,Yes,"11:24 AM 16th Jun,22",2022-06-16 11:24,4
Siddhi Vinayak Aspataal,"MCF-8280, Main Sohna Road, Near Syndicate Bank/Lal Kothi, Ballabgarh, Faridabad",Yes (26),10,6,10,1,10,6,10,1,Yes,Yes,To Be Updated,To Be Updated,To Be Updated,"10:27 AM 15th Jun,22",2022-06-15 10:27,4
SMS Hospital,"Clinic No. 9, Sector-3, Near Huda Market, Faridabad",Yes (10),5,0,5,3,5,0,5,3,Yes,No,Yes,Yes,Yes,"8:52 PM 3rd Nov,22",2022-11-03 20:52,4
SRU Multispeciality Hospital,"Sunder Colony, Nangla Gujran, Behind Rawal International School, Ballabgarh, Faridabad",Yes (17),14,0,3,0,14,0,3,0,To Be Updated,To Be Updated,To Be Updated,To Be Updated,To Be Updated,"5:13 PM 7th Jun,22",2022-06-07 17:13,4
Sunrise Hospital,"3C-63, BP, NIT Faridabad",Yes (28),25,0,3,0,25,0,3,0,Yes,No,Yes,Yes,Yes,"12:26 PM 2nd Nov,22",2022-11-02 12:26,4
Sunshine Hospital,"Sec 64 Sahupura Road, Unchagaon Ballabgarh",Yes (11),8,0,3,0,8,0,3,0,Yes,No,Yes,Yes,Yes,"3:52 PM 16th Jun,22",2022-06-16 15:52,4
Supreme Hospital,"Suraj Kund Rd, Charmwood Village, Faridabad",Yes (22),20,0,2,1,20,0,2,1,To Be Updated,To Be Updated,To Be Updated,To Be Updated,To Be Updated,"5:13 PM 7th Jun,22",2022-06-07 17:13,4
Suryodaya Hospital,"Chandiwala Bagh, RPS Road, Sector 88 Greater Faridabad",Yes (11),9,0,2,2,9,0,2,2,To Be Updated,To Be Updated,To Be Updated,To Be Updated,To Be Updated,"5:15 PM 7th Jun,22",2022-06-07 17:15,4
Urocare Apolo Multi and Super Speciality Hospital,"H.No 78, Behind Girls College, Sector-2, Ballabgarh, Faridabad",Yes (8),0,6,2,0,0,6,2,0,Yes,No,Yes,Yes,Yes,"11:29 AM 1st Dec,22",2022-12-01 11:29,4
V Care Multispeciality Health Center,"Plot No. V7, Near Police Station, BPTP Park Land, Sector-76, Faridabad",Yes (10),7,0,3,2,7,0,3,2,Yes,No,Yes,Yes,Yes,"4:05 PM 17th Aug,22",2022-08-17 16:05,4
Vardan Hospital,"Opp. Gurudwara, Adarsh Nagar, Main Malerna Road, Ballabgarh, Faridabad",Yes (15),15,0,0,0,15,0,0,0,To Be Updated,To Be Updated,To Be Updated,To Be Updated,To Be Updated,"5:15 PM 7th Jun,22",2022-06-07 17:15,4
Vedanta Hospital,"B-5,Central Green,Near I.T, BK Chowk, New Industrial Town, Faridabad",Yes (30),10,12,8,1,10,12,8,1,Yes,Yes,Yes,Yes,Yes,"5:13 PM 7th Jun,22",2022-06-07 17:13,4
Vibal Hospital Pvt. Ltd.,"Sector-21D, Huda Market, Faridabad",Yes (18),10,0,8,1,10,0,8,1,Yes,Yes,Yes,Yes,Yes,"1:53 PM 17th Jun,22",2022-06-17 13:53,4
Zenith Hospital (P) Ltd.,187/1 Yadav Colony Mohana Road NEar Yadav DairyBallabgarh,Yes (13),10,0,3,3,10,0,3,3,Yes,No,No,No,Yes,"9:45 AM 14th Oct,22",2022-10-14 09:45,4
AAROGYA MULTI-SPECIALITY HOSPITAL Gurugam,"Hayatpur, Pataudi Road, Sec-94, Gurugram-122505 (HR)",Yes (8),4,0,4,0,4,0,4,0,Yes,No,Yes,Yes,Yes,"5:15 PM 7th Jun,22",2022-06-07 17:15,6
"Aarogyam Hospital, Gurugram","Ward Number 15, Gurgaon, SH-13, Gurgaon Sohna Road, Sohna, Sohna, Haryana",Yes (16),16,0,0,1,16,0,3,1,Yes,Yes,Yes,Yes,Yes,"1:50 PM 3rd Mar,22",2022-03-03 13:50,6
Aarvy Healthcare Pvt Ltd,"Sector 90, Gurgaon",Yes (42),20,0,22,15,45,0,25,15,To Be Updated,No,Yes,Yes,Yes,"10:05 AM 2nd Dec,22",2022-12-02 10:05,6
Aarvy Hospital,"530/18 Civil Lines Opp Nehru Stadium, Gurugram",Yes (47),22,0,25,15,22,0,25,15,To Be Updated,To Be Updated,To Be Updated,To Be Updated,To Be Updated,"1:50 PM 3rd Mar,22",2022-03-03 13:50,6
Alfaa Hospital,"Basai Village, Sector 9B, Gurugram, Haryana",Yes (15),8,4,3,0,8,4,3,0,Yes,Yes,Yes,Yes,Yes,"11:37 AM 2nd Aug,22",2022-08-02 11:37,6
"Alpine Hospital, Gurugram","Plot No. 140, near Mother Dairy, Sector 15 Part 2, Sector 15, Gurugram, Haryana",No (0),0,0,0,0,0,0,0,0,To Be Updated,To Be Updated,To Be Updated,To Be Updated,To Be Updated,"1:50 PM 3rd Mar,22",2022-03-03 13:50,6
Anand multispeciality hospital,"Plot no. 29, Sector 56, Gurugram, Haryana",Yes (9),6,0,3,1,6,0,3,1,Yes,No,Yes,Yes,Yes,"10:05 AM 15th Jun,22",2022-06-15 10:05,6
Apollo Cradle,"SCO - 1, 2 & 3, Sector 14, Old Gurugram Road, Gurugram 122001",Yes (5),5,0,0,0,5,0,0,0,Yes,No,No,No,No,"5:24 PM 16th Jun,22",2022-06-16 17:24,6
Artemis Hospital,"Sector 51, Gurugram",Yes (103),73,0,30,15,73,0,30,15,Yes,Yes,Yes,Yes,Yes,"8:54 AM 2nd Dec,22",2022-12-02 08:54,6
Aryan Hospital Gurugram,Old Railway Road Gurugram,Yes (17),10,0,7,2,10,0,7,2,To Be Updated,To Be Updated,To Be Updated,To Be Updated,To Be Updated,"11:17 AM 2nd Aug,22",2022-08-02 11:17,6
Ayushman Hospital,"Hero Honda Chowk, 37 Km, NH 8, Gurugram, Haryana",Yes (10),5,0,5,2,5,0,5,2,Yes,To Be Updated,Yes,To Be Updated,To Be Updated,"10:10 AM 2nd Aug,22",2022-08-02 10:10,6
Bhanot Hospital,"188/18, Jharsa Rd, Gurugram, Haryana",Yes (5),5,0,0,0,5,0,0,0,Yes,No,Yes,Yes,Yes,"10:19 AM 2nd Dec,22",2022-12-02 10:19,6
"Blossom Hospital Kadipur Enclave, Gurugram","kadipur chowk, Kadipur Industrial Area, Sector 37C, Gurugram, Haryana",No (0),0,0,0,0,0,0,0,0,To Be Updated,To Be Updated,To Be Updated,To Be Updated,To Be Updated,"5:15 PM 7th Jun,22",2022-06-07 17:15,6
Boston Hospital,Plot no 7 sector 38 beside medanta hospital,Yes (42),22,20,0,0,22,20,0,0,To Be Updated,To Be Updated,To Be Updated,To Be Updated,To Be Updated,"5:15 PM 7th Jun,22",2022-06-07 17:15,6
C K Birla Hospital,"Block J, CK Birla Hospital, Mayfield Garden, Sector 51, Gurugram",Yes (16),13,0,3,2,13,0,3,2,Yes,Yes,Yes,Yes,Yes,"1:50 PM 3rd Mar,22",2022-03-03 13:50,6
Center of Diabetes &amp; Allied Science,"50, Sohna Rd, Rosewood City, Ghasola, Sector 49, Gurugram, Haryana 122001",Yes (23),15,0,8,1,15,0,8,1,Yes,To Be Updated,To Be Updated,To Be Updated,To Be Updated,"1:37 PM 5th Aug,22",2022-08-05 13:37,6
Chauhan hospital,Tauru road near chungi no 4 pataudi,Yes (10),7,Beds Over Utilized 2,3,0,7,0,3,0,Yes,No,Yes,Yes,Yes,"6:34 PM 19th Jun,22",2022-06-19 18:34,6
Chetanya hospital,"Bajgera road,rajendra park ggn",Yes (8),4,0,4,1,4,0,4,1,No,No,To Be Updated,Yes,Yes,"12:30 PM 23rd Jun,22",2022-06-23 12:30,6
Chetna Multispeciality Hospital,"Plot no. 713, Basai Chowk,, Gurugram, Haryana - 122001",Yes (18),15,0,3,0,15,0,3,0,No,No,Yes,Yes,Yes,"5:15 PM 7th Jun,22",2022-06-07 17:15,6
Chirag Hospital,"3236/31 Rajendra Park, Sector 105, Gurugram, Haryana",Yes (29),15,7,7,0,15,7,7,0,Yes,Yes,Yes,Yes,No,"11:19 AM 30th Nov,22",2022-11-30 11:19,6
Civil Hospital gurugram,"Sector 10A,Gurugram",Yes (47),43,0,4,4,43,0,4,4,Yes,Yes,Yes,No,Yes,"12:41 PM 15th Jun,22",2022-06-15 12:41,6
Cloudnine Hospital,"Plot No. A-2 MSJ House, Vikas Marg, beside SS Plaza, Mayfield Garden, Sector 47, Gurugram",Yes (18),4,14,0,0,4,14,0,0,Yes,No,Yes,No,Yes,"10:21 AM 27th Jun,22",2022-06-27 10:21,6
Colombia Asia Hospital,"Ansal Plaza Near Gol Chakkar, Block F, Palam Vihar, Gurugram",Yes (20),6,0,14,8,6,0,14,8,Yes,Yes,Yes,Yes,Yes,"10:39 AM 1st Dec,22",2022-12-01 10:39,6
Composite Hospital NSG,Composite Hospital NSG campus Manesar,Yes (36),36,0,0,0,40,0,0,0,To Be Updated,To Be Updated,To Be Updated,To Be Updated,To Be Updated,"5:15 PM 7th Jun,22",2022-06-07 17:15,6
Dev Hospital,Rajendra park Near Union bank  gurgaon,Yes (12),8,Beds Over Utilized 10,4,0,8,0,4,0,Yes,No,Yes,Yes,Yes,"10:31 AM 28th Aug,22",2022-08-28 10:31,6
Diamond Hospital Maternity &amp;Trauma Centre,"Imt Manesar, Gurugram, Haryana",No (0),0,0,0,0,0,0,0,0,To Be Updated,To Be Updated,To Be Updated,To Be Updated,To Be Updated,"1:50 PM 3rd Mar,22",2022-03-03 13:50,6
Ektaa hospital,"Main Sohna Road ,Near Community Centre ,Badshahpur, Gurugram, Haryana",Yes (5),5,0,0,0,6,0,0,0,Yes,No,Yes,Yes,Yes,"5:15 PM 7th Jun,22",2022-06-07 17:15,6
ESI Hospital Gurugram,"769, Near Mothers Pride School, sector 9A, Gurugram, Haryana",Yes (72),40,32,0,0,40,32,0,0,Yes,Yes,Yes,Yes,Yes,"10:23 AM 10th Aug,22",2022-08-10 10:23,6
Fortis Hospital,"Opposite Huda City Metro Station, Sector 44, Gurugram",Yes (195),124,15,56,24,125,15,60,25,To Be Updated,To Be Updated,To Be Updated,To Be Updated,To Be Updated,"3:43 PM 2nd Aug,22",2022-08-02 15:43,6
"Geetanjali Hospital, Gurugram","Pataudi Rd, Pataudi, Haryana",Yes (8),4,0,4,0,6,0,4,0,Yes,No,Yes,Yes,Yes,"5:12 PM 7th Jun,22",2022-06-07 17:12,6
Genesis Hospital,"sector 84, near Dps school, Gurugram, Haryana",Yes (12),5,0,7,2,5,0,7,2,Yes,Yes,Yes,Yes,Yes,"12:45 PM 5th Sep,22",2022-09-05 12:45,6
Global Hospital,Atul kathariya road near seetala mata mandir Gurgaon Haryana,Yes (6),4,0,2,3,15,0,4,3,Yes,To Be Updated,Yes,Yes,Yes,"5:15 PM 7th Jun,22",2022-06-07 17:15,6
Global Hospital &amp; Trauma Centre Pataudi,"Opp Bus Stand, Haily Mandi Road, Pataudi, Gurgaon",Yes (15),12,0,3,0,12,0,3,0,To Be Updated,To Be Updated,To Be Updated,To Be Updated,To Be Updated,"5:15 PM 7th Jun,22",2022-06-07 17:15,6
HIGHWAY HOSPITAL AND TRAUMA CENTRE,"HALDIRAM CHOWK, N.H-8 KHERKI DAULA GURGAON H.R",Yes (6),2,0,4,0,2,0,4,0,Yes,No,Yes,Yes,Yes,"5:15 PM 7th Jun,22",2022-06-07 17:15,6
Hope Health Care,"Sector 57 Susant Lok 2 Plot no. 2538 Near Nobel High School, Gurgaon",No (0),0,0,0,0,0,0,0,0,To Be Updated,To Be Updated,To Be Updated,To Be Updated,To Be Updated,"1:50 PM 3rd Mar,22",2022-03-03 13:50,6
IAS Medicare Hoapital Gurugram,"IAS Medicare Hospital, Near Anaj Mandi, Khandsa road, Gurgaon, Haryana - 122001",Yes (30),20,0,10,5,20,0,10,5,Yes,Yes,Yes,Yes,Yes,"9:29 AM 29th Nov,22",2022-11-29 09:29,6
Jai Sai Ram Hospital Gurugram,"T-262, Opposite Church, 40 Feet Road, New Palam Vihar, Phase -II, Gurugram, Haryana",Yes (13),10,0,3,0,10,0,3,0,Yes,To Be Updated,To Be Updated,Yes,To Be Updated,"5:15 PM 7th Jun,22",2022-06-07 17:15,6
Jain Hospital Gurugram,1499P sector 46 Gurgaon Haryana 122002,Yes (12),12,0,0,0,12,0,0,0,Yes,Yes,Yes,Yes,Yes,"5:15 PM 7th Jun,22",2022-06-07 17:15,6
Jyoti Hospital Farrukhnagar Gurugram,"Farukh Nagar, Haryana",No (0),0,0,0,0,0,0,0,0,To Be Updated,To Be Updated,To Be Updated,To Be Updated,To Be Updated,"1:50 PM 3rd Mar,22",2022-03-03 13:50,6
K.K Health Care Centre,"238, Sector 5, Gurugram, Haryana",Yes (10),4,6,0,0,4,6,0,0,Yes,No,Yes,Yes,Yes,"3:23 PM 23rd Sep,22",2022-09-23 15:23,6
Kailash Hospital Gurugram,"Farruknagar,opp Anaj mandi Farruknagar. District- Gurugram.",Yes (15),10,0,5,0,10,0,5,0,No,No,Yes,Yes,To Be Updated,"5:15 PM 7th Jun,22",2022-06-07 17:15,6
Kalyani Hospital,"Mehrauli-Gurgaon Rd, Anamika Enclave, Sector 14, Gurugram",Yes (17),15,0,2,2,15,0,2,2,Yes,To Be Updated,To Be Updated,To Be Updated,To Be Updated,"10:18 AM 2nd Dec,22",2022-12-02 10:18,6
