name,address,Availability_availability_of_beds,Availability_oxygen_beds,Availability_non_oxygen_beds,Availability_i_c_u_beds,Availability_ventilators,Allocated_oxygen_beds,Allocated_non_oxygen_beds,Allocated_i_c_u,Allocated_ventilators,Availability_availability_of_oxygen,Availability_antiviral_remdesivir_etc_,Availability_steroids,Availability_anticoagulant,Availability_antipyretic,updated_on_unparsed,updated_on,city
ASHIRWAD BHAGAT HOSPITAL,"Old DC Rd, near bhagat hospital, Sonipat, Haryana 131001",Yes (15),12,0,3,1,12,0,3,1,Yes,Yes,Yes,Yes,Yes,"12:09 PM 16th Jun,22",2022-06-16 12:09,21
Bhagwan Dass Hospital,"Near Shahpur Turk, block-E, omaxe city, Sector 18, Sonipat, Haryana 131001",Yes (3),Beds Over Utilized 13,0,3,2,27,0,13,2,Yes,No,Yes,Yes,Yes,"3:55 PM 17th Jun,22",2022-06-17 15:55,21
"BPS MEDICAL COLLEGE KHANPUR , SONIPAT ( 01263283088)","Ganaur - Gohana Rd, Khanpur Kalan, Haryana",Yes (300),170,80,50,50,170,80,50,50,Yes,Yes,Yes,Yes,Yes,"8:37 AM 22nd Jun,22",2022-06-22 08:37,21
CHC GANUR,CHC GANUR,Yes (8),8,0,0,0,8,0,0,0,Yes,No,Yes,Yes,Yes,"12:04 PM 16th Jun,22",2022-06-16 12:04,21
CHC Kharkhoda,"SH 20, Kharkhoda, Haryana 131402",Yes (10),5,5,0,0,5,5,0,0,To Be Updated,To Be Updated,Yes,Yes,Yes,"5:14 PM 7th Jun,22",2022-06-07 17:14,21
"CHC, JUAN, SONIPAT, HARYANA","CHC, JUAN, SONIPAT, HARYANACHC, JUAN, SONIPAT, HARYANA, 131024",Yes (5),3,2,0,0,3,2,0,0,Yes,No,Yes,Yes,Yes,"5:15 PM 7th Jun,22",2022-06-07 17:15,21
"Civil Hospital, Sonipat (9050007668 )","Delhi Road, Near Maharana Pratap Chowk, Sonipat, Haryana 131001",Yes (200),190,0,10,10,190,0,10,10,To Be Updated,To Be Updated,To Be Updated,To Be Updated,To Be Updated,"8:48 PM 16th Jun,22",2022-06-16 20:48,21
"CYGNUS HOSPITAL, Sonipat","Old Rohtak Rd, near Hindu College of Engineering, Industrial Area, Sonipat, Haryana 131001",Yes (20),18,0,2,1,18,0,2,1,Yes,No,Yes,Yes,Yes,"11:20 AM 16th Jun,22",2022-06-16 11:20,21
Dayanand Hospital-Sonepat,"Kakroi Rd, Prem Nagar, West Ram Nagar, Sonipat, Haryana",Yes (40),35,Beds Over Utilized 1,5,3,35,0,5,3,Yes,No,Yes,Yes,Yes,"1:34 PM 20th May,22",2022-05-20 13:34,21
FIIMS Hospital,"Road, Bahalgarh, Sonipat, Haryana 131304",Yes (99),63,0,36,6,63,0,37,8,Yes,No,Yes,Yes,Yes,"1:50 PM 3rd Mar,22",2022-03-03 13:50,21
GAJRAJ HOSPITAL,"Bus Stand, Gajraj Hospital Road, Near, Gohana, Haryana 131301",Yes (20),20,0,0,0,20,0,0,0,Yes,To Be Updated,Yes,Yes,Yes,"1:50 PM 3rd Mar,22",2022-03-03 13:50,21
"GLAXY ONE HOSPITAL, SONIPAT","SH 11, Bahalgarh, Sonipat, Haryana 131021",Yes (18),18,Beds Over Utilized 4,Beds Over Utilized 5,Beds Over Utilized 1,20,0,0,0,Yes,To Be Updated,Yes,Yes,Yes,"5:14 PM 7th Jun,22",2022-06-07 17:14,21
HARYANA HOSPITAL,"Vivekanand Chowk, Delhi Rd, behind Bullet Showroom, Janta Colony, Sonipat, Haryana 131001",Yes (2),1,0,1,1,1,0,1,1,Yes,No,No,No,Yes,"5:14 PM 7th Jun,22",2022-06-07 17:14,21
MEMORIAL HOSPITAL,"SH 11, near Mama Bhanja Chowk, Nandwani Nagar, Anand Nagar,, Sonipat, Haryana 131001",Yes (20),16,0,4,2,16,0,4,2,Yes,No,Yes,Yes,Yes,"9:56 AM 15th Jun,22",2022-06-15 09:56,21
NIDAAN HOSPITAL PVT.,"Murthal Rd, Sonipat, Haryana 131001",No (0),0,0,0,0,0,0,0,0,Yes,No,Yes,Yes,Yes,"5:14 PM 7th Jun,22",2022-06-07 17:14,21
OSCAR HOSPITAL,"SH 11, Lakshmi Nagar, Sonipat, Haryana 131001",Yes (14),6,0,8,2,7,0,8,2,Yes,No,Yes,Yes,Yes,"5:14 PM 7th Jun,22",2022-06-07 17:14,21
PHC PURKHAS,"Purkhas, Haryana 131102",Yes (30),0,30,0,0,0,30,0,0,To Be Updated,To Be Updated,To Be Updated,To Be Updated,To Be Updated,"5:14 PM 7th Jun,22",2022-06-07 17:14,21
PREMPUSHP MULTISPECIALITY HOSPITAL,"SUBJI MANDI GANAUR,HARYANA SONIPAT 131101",Yes (20),20,0,0,0,20,0,0,0,To Be Updated,No,Yes,Yes,Yes,"5:15 PM 7th Jun,22",2022-06-07 17:15,21
"SANJIVNI HOSPITAL, SONIPAT","Mehlana Rd, Malviya Nagar, Sonipat, Haryana 131304",Yes (15),14,0,1,1,14,0,1,1,Yes,No,Yes,Yes,Yes,"11:01 AM 15th Jun,22",2022-06-15 11:01,21
SAXSENA HOSPITAL,"112/113, T.P. Scheme, Delhi Rd, Sonipat, Haryana 131304",Yes (23),18,0,5,2,18,0,5,2,Yes,No,Yes,Yes,Yes,"12:40 PM 16th Jun,22",2022-06-16 12:40,21
SDH GOHANA,"Devi Nagar, Uttam Nagar, Gohana, Haryana 131301",Yes (10),10,0,0,0,10,0,0,0,Yes,Yes,Yes,Yes,Yes,"5:14 PM 7th Jun,22",2022-06-07 17:14,21
SITA HOSPITAL SONIPAT,"Railway Rd, Ganaur, Haryana 131101",Yes (20),20,Beds Over Utilized 4,0,0,20,0,0,0,Yes,No,Yes,Yes,Yes,"10:48 AM 15th Jun,22",2022-06-15 10:48,21
SUNHERI DEVI HOSPITAL,"Mission Rd, Dev Nagar, Sonipat, Haryana 131001",Yes (20),15,0,5,1,15,0,5,1,Yes,No,Yes,Yes,Yes,"10:18 AM 16th Jun,22",2022-06-16 10:18,21
TULIP HOSPITAL,"T. P. Scheme, no.15, Delhi Rd, Vivekanand chowk, Sonipat, Haryana 131001",Yes (20),0,0,20,5,0,0,20,5,Yes,No,Yes,Yes,Yes,"1:36 PM 15th Jun,22",2022-06-15 13:36,21
Ch Lekh Raj Multispeciality Hospital,Vill Gadhauli Yamuna Nagar,Yes (150),140,0,10,5,140,0,10,5,Yes,Yes,Yes,Yes,Yes,"11:21 AM 15th Jun,22",2022-06-15 11:21,22
CHC Bilaspur,CHC Bilaspur,Yes (23),8,15,0,0,8,17,0,0,Yes,No,Yes,No,Yes,"11:04 AM 15th Jun,22",2022-06-15 11:04,22
CHC Chhachharuli,CHC Chhachharuli,Yes (30),10,20,0,0,10,20,0,0,Yes,No,Yes,Yes,Yes,"11:04 AM 15th Jun,22",2022-06-15 11:04,22
CHC Naharpur,Naharpur Yamuna Nagar,Yes (10),10,0,0,0,10,0,0,0,Yes,No,No,No,Yes,"11:22 AM 15th Jun,22",2022-06-15 11:22,22
CHC Partap Nagar,CHC Partap Nagar,Yes (16),6,10,0,0,6,10,0,0,Yes,No,Yes,No,Yes,"11:05 AM 15th Jun,22",2022-06-15 11:05,22
CHC Radaur,Radaur Yamuna Nagar,Yes (20),10,10,0,0,10,10,0,0,Yes,No,Yes,Yes,Yes,"11:22 AM 15th Jun,22",2022-06-15 11:22,22
CHC Saraswati Nagar,CHC Saraswati Nagar,Yes (25),14,11,0,0,14,11,0,0,Yes,No,Yes,No,Yes,"11:05 AM 15th Jun,22",2022-06-15 11:05,22
DABRA HOSPITAL Yamunanagar,DABRA HOSPITAL,Yes (23),11,8,4,2,11,8,4,2,No,No,No,No,No,"11:05 AM 15th Jun,22",2022-06-15 11:05,22
ESI Hospital,"ESI Hospital, Jagadhri",Yes (58),36,0,22,0,36,0,22,0,Yes,No,Yes,Yes,Yes,"11:03 AM 15th Jun,22",2022-06-15 11:03,22
Gaba Hospital,Gaba Hospital Yamunanagar,Yes (50),20,10,20,4,20,10,20,4,Yes,No,Yes,Yes,Yes,"11:02 AM 15th Jun,22",2022-06-15 11:02,22
GULATI HOSPITAL,GULATI HOSPITAL,Yes (32),23,3,6,0,25,3,6,0,Yes,No,Yes,Yes,Yes,"11:06 AM 15th Jun,22",2022-06-15 11:06,22
Heart Care Center Hospital,Near Lal Dwara Mandir Yamuna Nagar,Yes (19),2,2,15,7,2,2,15,7,Yes,No,Yes,Yes,Yes,"11:04 AM 15th Jun,22",2022-06-15 11:04,22
JP Hospital Pvt,"Jagadhri Rd, near Luxmi Theater, Vishwakarma Mohalla, Yamuna Nagar,HARAYANA Haryana",Yes (43),15,15,13,2,15,15,13,2,Yes,No,Yes,Yes,Yes,"11:03 AM 15th Jun,22",2022-06-15 11:03,22
KAPOOR HOSPITAL,"SH 6A Indira Colony Jagadhri, yamunanagart ,Haryana",Yes (12),4,0,8,0,4,0,8,0,Yes,No,Yes,Yes,Yes,"11:10 AM 15th Jun,22",2022-06-15 11:10,22
KESHWANI HOSPITAL,"Jagadhri - Yamuna Nagar Rd, Tagore Garden, Yamuna Nagar, Haryana",Yes (10),10,0,0,0,10,0,0,0,Yes,No,Yes,Yes,Yes,"11:23 AM 15th Jun,22",2022-06-15 11:23,22
Maxxwell Hospital,Jagadhari Yamuna Nagar,Yes (17),11,0,6,0,11,0,6,0,Yes,No,Yes,Yes,Yes,"11:06 AM 15th Jun,22",2022-06-15 11:06,22
Mukand Lal District Civil Hospital Yamunanagar,Mukand Lal District Civil Hospital YNR,Yes (27),18,9,0,5,18,9,0,5,Yes,No,Yes,Yes,Yes,"11:06 AM 15th Jun,22",2022-06-15 11:06,22
NIRMAL HOSPITAL,"199, Radaur Rd, near nirmal hospital, camp, Garhi Gujran, Haryana",Yes (20),13,1,6,0,13,1,6,0,Yes,No,Yes,Yes,Yes,"11:03 AM 15th Jun,22",2022-06-15 11:03,22
RK Gupta,opp DAV Sr Sec School Near Madhu Hotel YNR,Yes (17),0,2,15,0,0,2,15,0,Yes,Yes,Yes,Yes,Yes,"11:22 AM 15th Jun,22",2022-06-15 11:22,22
SABBARWAL HOSPITAL,"Gulab Nagar, Jagadhri, Haryana",Yes (13),6,1,6,0,6,1,6,0,Yes,No,Yes,Yes,Yes,"11:15 AM 15th Jun,22",2022-06-15 11:15,22
Sachdeva Hospital,"2227, Civil Lines Rd, Sri Nagar Colony, Civil Lines, Gomti Mohalla, Jagadhri, Haryana",Yes (28),16,8,4,0,16,8,4,0,Yes,No,Yes,Yes,Yes,"11:23 AM 15th Jun,22",2022-06-15 11:23,22
Santosh Hospital,"Santosh Hospital  Kanhaiya Sahib Chowk, near Govt.School, Harbanspura Colony, Gobind Pura, Yamuna Nagar, Haryana",Yes (28),5,9,14,2,5,9,14,2,Yes,No,Yes,Yes,Yes,"11:00 AM 15th Jun,22",2022-06-15 11:00,22
SHARMA HOSPITAL,Near Agarsain Chowk Jagadhri,Yes (12),12,0,0,0,12,0,0,0,Yes,No,Yes,Yes,Yes,"11:21 AM 15th Jun,22",2022-06-15 11:21,22
Shree Medical Care Hospital,"359/2, Jain nagar, Jagadhri, Haryana",Yes (15),15,0,0,0,15,0,0,0,Yes,Yes,Yes,Yes,Yes,"11:24 AM 15th Jun,22",2022-06-15 11:24,22
Shureshtha Hospital,Model Colony YNR,Yes (12),9,1,2,0,9,1,2,0,Yes,No,Yes,Yes,Yes,"11:22 AM 15th Jun,22",2022-06-15 11:22,22
SP Hospital Jag,S.P Hospital Jag,Yes (7),4,0,3,1,4,0,3,1,Yes,No,Yes,Yes,Yes,"11:07 AM 15th Jun,22",2022-06-15 11:07,22
Swami Vivekanand Hospital Yamunanagar,"Swami Vivekanand Hospital,Yamuna Nagar, Haryana",Yes (49),20,10,19,1,20,10,19,1,Yes,No,Yes,Yes,Yes,"11:09 AM 15th Jun,22",2022-06-15 11:09,22
Swastik Hospital,"Basant Nagar, Yamuna Nagar, Haryana",Yes (6),4,2,0,0,4,2,0,0,Yes,No,Yes,Yes,Yes,"11:25 AM 15th Jun,22",2022-06-15 11:25,22
tejli stadium,64 A Tejli,Yes (76),20,56,0,0,20,56,0,0,Yes,No,No,No,Yes,"11:09 AM 15th Jun,22",2022-06-15 11:09,22
VARDAAN HOSPITAL,OPP KOHLI HOSPITAL NEAR AGARSEN COLLEGE JAGADHRI,Yes (10),8,2,0,0,8,2,0,0,Yes,No,Yes,Yes,Yes,"11:24 AM 15th Jun,22",2022-06-15 11:24,22