name,address,Availability_availability_of_beds,Availability_oxygen_beds,Availability_non_oxygen_beds,Availability_i_c_u_beds,Availability_ventilators,Allocated_oxygen_beds,Allocated_non_oxygen_beds,Allocated_i_c_u,Allocated_ventilators,Availability_availability_of_oxygen,Availability_antiviral_remdesivir_etc_,Availability_steroids,Availability_anticoagulant,Availability_antipyretic,updated_on_unparsed,updated_on,city
Krishna Medical Centre,"773, Sector-19, Faridabad",Yes (10),5,0,5,0,5,0,5,0,Yes,Yes,Yes,Yes,Yes,"5:15 PM 7th Jun,22",2022-06-07 17:15,4
Life Hospital,Opp Hanuman Mandir Sec 8 Faridabad,Yes (10),4,0,6,1,4,0,6,1,Yes,Yes,Yes,Yes,Yes,"5:14 PM 7th Jun,22",2022-06-07 17:14,4
Lotus Hospital,"Plot-2, Jeevan Nagar, Opp. Lal Kothi, Main Ballabgarh Sohna Road, Faridabad",Yes (20),12,0,8,1,12,0,8,1,Yes,No,Yes,Yes,Yes,"9:39 AM 9th Jun,23",2023-06-09 09:39,4
Madhav Hospital,"Building no 16, Block E, and, New Industrial Twp 5, Faridabad, Haryana 121001",Yes (28),0,0,28,2,0,0,28,2,To Be Updated,No,To Be Updated,To Be Updated,To Be Updated,"1:24 PM 15th Jun,22",2022-06-15 13:24,4
Manavta Hospital,"Plot No-494, Near Women ITI, Uncha Gaon Prem Nagar, Mohna Road, Ballabgarh, Faridabad",Yes (31),10,10,11,3,10,10,11,3,To Be Updated,To Be Updated,To Be Updated,To Be Updated,To Be Updated,"9:50 AM 15th Jun,22",2022-06-15 09:50,4
Manvi Medical Centre,"New Bharat Colony, Opp. Chaddar Godam, Near Mahaban Farm, Kheri Road, Greater Faridabad",Yes (9),7,0,2,0,7,0,2,0,To Be Updated,To Be Updated,To Be Updated,To Be Updated,To Be Updated,"10:05 AM 16th Jul,22",2022-07-16 10:05,4
Medicheck Hospital,"Block C, Plot Number 76, Shahid Bhagat Singh Marg, near Bata Flyover, New Industrial Town, Faridabad",Yes (64),52,0,12,3,52,0,12,3,Yes,No,Yes,Yes,Yes,"5:13 PM 7th Jun,22",2022-06-07 17:13,4
Medstar Hospital,"Om Enclave Part 1, Near Toll Tax, Agwanpur Road, Faridabad",Yes (7),5,2,0,0,5,2,0,0,Yes,No,Yes,Yes,To Be Updated,"5:13 PM 7th Jun,22",2022-06-07 17:13,4
Medwin Hospital,"Plot No. 2, Jeevan Nagar, Sohna Road Gounchi, Sector 55, Faridabad",Yes (20),2,12,6,0,2,12,6,0,To Be Updated,No,Yes,Yes,Yes,"10:48 AM 8th Jun,23",2023-06-08 10:48,4
Metro Hospital Medicare,"Metro Heart Institute with Multispeciality Sector 16 A, Faridabad",Yes (140),80,40,20,11,80,45,20,11,Yes,Yes,Yes,Yes,Yes,"1:04 PM 28th Apr,23",2023-04-28 13:04,4
National Institute Of Medical Sciences,"Sector -23A,?Faridabad,?",Yes (28),15,4,9,2,15,4,9,2,Yes,No,Yes,Yes,Yes,"12:11 PM 3rd Aug,22",2022-08-03 12:11,4
Ortho 1 Hospital,"1331, Near Community Centre, Sector 55, Faridabad",Yes (30),8,12,10,1,8,12,10,1,Yes,No,Yes,Yes,Yes,"8:40 AM 9th Jun,23",2023-06-09 08:40,4
Park Hospital Faridabad,"J Block, Sector 10 HBC, opposite Court, Faridabad",Yes (44),10,10,24,5,10,10,25,5,Yes,No,Yes,Yes,Yes,"8:53 AM 9th Jun,23",2023-06-09 08:53,4
Pawan Hospital Unit-1,"Samaypur Road Near Sector 56, Ballabhgarh, Faridabad",Yes (45),31,0,14,7,31,0,14,7,To Be Updated,To Be Updated,To Be Updated,To Be Updated,To Be Updated,"9:27 AM 9th Jun,23",2023-06-09 09:27,4
Pawan Hospital Unit-2,"Plot No. 10, Jawahar Colony, Near Disposal Chowk, Faridabad",Yes (11),0,0,11,0,0,0,11,0,Yes,No,Yes,Yes,Yes,"6:35 PM 1st Jun,23",2023-06-01 18:35,4
Prachi Hospital,Opp Chimni Bai Dharmshala Faridabad,Yes (17),10,2,5,1,10,2,5,1,Yes,No,Yes,Yes,Yes,"10:41 AM 15th Jun,22",2022-06-15 10:41,4
QRG Central,"Plot No, 69, Mathura Rd, Sector 20 A, New Industrial Town, Faridabad",Yes (6),3,Beds Over Utilized 5,3,2,6,0,4,2,Yes,Yes,Yes,Yes,Yes,"5:08 PM 2nd May,23",2023-05-02 17:08,4
QRG Hospital Medicare,"Ambedkar Marg, QRG Healthcity, Sector 16, Faridabad",Yes (122),104,0,18,7,104,0,18,7,To Be Updated,To Be Updated,To Be Updated,To Be Updated,To Be Updated,"12:29 PM 27th Dec,22",2022-12-27 12:29,4
Raghav Hospital,Kheri Road Sec 87 Greater Faridabad,Yes (23),17,3,3,1,17,3,3,1,Yes,No,Yes,Yes,Yes,"12:01 PM 15th Jun,22",2022-06-15 12:01,4
Raj Nursing Home,"CLINIC SITE NO-6, Sector 3, Faridabad",Yes (17),13,0,4,1,13,0,4,1,Yes,No,Yes,Yes,Yes,"5:14 PM 7th Jun,22",2022-06-07 17:14,4
Ronak Hospital,"Dabua Pali Road, Near Ganga Ram Devta Mandir, NIT, Faridabad",Yes (50),20,20,10,3,20,20,10,3,Yes,Yes,Yes,Yes,Yes,"10:13 AM 30th Apr,23",2023-04-30 10:13,4
Samrat Hospital,"180, Sanjay Colony, Delhi Mathura Road, JCB Chowk, Ballabgarh, Faridabad",Yes (20),10,0,10,0,10,0,10,0,To Be Updated,To Be Updated,To Be Updated,To Be Updated,To Be Updated,"5:15 PM 7th Jun,22",2022-06-07 17:15,4
Sanjeevan Multispeciality Hospital,"D-947, 60 Feet Road, Opp. Shiv Mandir, Chawla Colony, Ballabgarh, Faridabad",Yes (17),7,2,8,0,7,2,8,0,No,Yes,Yes,Yes,Yes,"5:13 PM 7th Jun,22",2022-06-07 17:13,4
Santosh Multispeciality Hospital,"Shop No. 3F, 139, Metro Rd, New Industrial Township 2b, Block F, New Industrial Twp 3, New Industrial Town, Faridabad,",Yes (60),40,10,10,1,40,10,10,1,Yes,No,Yes,Yes,Yes,"12:46 PM 13th Jul,22",2022-07-13 12:46,4
Sarvodya Hospital  Sector-8,"Sector-8, YMCA Rd, near Escorts Mujesar Metro Station, Sector 7, Faridabad",Yes (150),125,Beds Over Utilized 5,25,5,125,0,25,5,Yes,Yes,No,No,Yes,"9:50 AM 22nd Apr,23",2023-04-22 09:50,4
Sarvodya Hospital Sector 19,"Gopi Colony, Old Faridabad, Faridabad",Yes (37),28,0,9,4,28,0,10,4,Yes,Yes,Yes,Yes,To Be Updated,"3:08 PM 11th Aug,22",2022-08-11 15:08,4
Sattya Hospital,"376, IP Colony, Sector 32-33 Faridabad",Yes (10),6,0,4,2,6,0,4,2,Yes,Yes,Yes,Yes,Yes,"11:45 AM 12th May,23",2023-05-12 11:45,4
Shankar Medicare Center,Sec 28 Faridabad,Yes (35),15,20,0,0,15,20,0,0,Yes,Yes,Yes,Yes,Yes,"11:25 AM 7th Jun,23",2023-06-07 11:25,4
Shanti Devi Memorial Hospital,"Kheri More Near, Piyush Heights, Sector 89, Faridabad",Yes (25),14,8,3,2,14,8,3,2,Yes,No,Yes,Yes,Yes,"5:02 PM 24th Apr,23",2023-04-24 17:02,4
Shivalik Hospital Unit 1,Huda Market Sector-37 Faridabad,Yes (7),0,3,4,0,0,3,4,0,Yes,No,Yes,Yes,Yes,"10:15 AM 9th Jun,23",2023-06-09 10:15,4
Shivalik Hospital Unit 2,"Sehatpur, Opp. Sec-91 Faridabad",Yes (2),0,0,2,0,0,0,2,0,Yes,No,Yes,Yes,Yes,"10:15 AM 9th Jun,23",2023-06-09 10:15,4
"Shri Atal Bihari Vajpayee Government Medical College, Chhainsa","Village  Chhainsa, Faridabad",Yes (100),100,0,0,0,100,0,0,0,Yes,Yes,Yes,No,Yes,"11:24 AM 16th Jun,22",2022-06-16 11:24,4
Siddhi Vinayak Aspataal,"MCF-8280, Main Sohna Road, Near Syndicate Bank/Lal Kothi, Ballabgarh, Faridabad",Yes (26),10,6,10,1,10,6,10,1,Yes,Yes,To Be Updated,To Be Updated,To Be Updated,"10:27 AM 15th Jun,22",2022-06-15 10:27,4
SMS Hospital,"Clinic No. 9, Sector-3, Near Huda Market, Faridabad",Yes (10),5,0,5,3,5,0,5,3,Yes,No,Yes,Yes,Yes,"7:59 PM 3rd Jan,23",2023-01-03 19:59,4
SRU Multispeciality Hospital,"Sunder Colony, Nangla Gujran, Behind Rawal International School, Ballabgarh, Faridabad",Yes (17),14,0,3,0,14,0,3,0,To Be Updated,To Be Updated,To Be Updated,To Be Updated,To Be Updated,"5:13 PM 7th Jun,22",2022-06-07 17:13,4
Sunrise Hospital,"3C-63, BP, NIT Faridabad",Yes (28),25,0,3,0,25,0,3,0,Yes,No,Yes,Yes,Yes,"1:38 PM 28th May,23",2023-05-28 13:38,4
Sunshine Hospital,"Sec 64 Sahupura Road, Unchagaon Ballabgarh",Yes (11),8,0,3,0,8,0,3,0,Yes,No,Yes,Yes,Yes,"3:52 PM 16th Jun,22",2022-06-16 15:52,4
Supreme Hospital,"Suraj Kund Rd, Charmwood Village, Faridabad",Yes (22),20,0,2,1,20,0,2,1,To Be Updated,To Be Updated,To Be Updated,To Be Updated,To Be Updated,"5:13 PM 7th Jun,22",2022-06-07 17:13,4
Suryodaya Hospital,"Chandiwala Bagh, RPS Road, Sector 88 Greater Faridabad",Yes (11),9,0,2,2,9,0,2,2,To Be Updated,To Be Updated,To Be Updated,To Be Updated,To Be Updated,"5:15 PM 7th Jun,22",2022-06-07 17:15,4
Urocare Apolo Multi and Super Speciality Hospital,"H.No 78, Behind Girls College, Sector-2, Ballabgarh, Faridabad",Yes (8),0,6,2,0,0,6,2,0,Yes,No,Yes,Yes,Yes,"9:50 AM 9th Jun,23",2023-06-09 09:50,4
V Care Multispeciality Health Center,"Plot No. V7, Near Police Station, BPTP Park Land, Sector-76, Faridabad",Yes (10),7,0,3,2,7,0,3,2,Yes,No,Yes,Yes,Yes,"12:15 PM 24th Apr,23",2023-04-24 12:15,4
Vardan Hospital,"Opp. Gurudwara, Adarsh Nagar, Main Malerna Road, Ballabgarh, Faridabad",Yes (15),15,0,0,0,15,0,0,0,To Be Updated,To Be Updated,To Be Updated,To Be Updated,To Be Updated,"5:15 PM 7th Jun,22",2022-06-07 17:15,4
Vedanta Hospital,"B-5,Central Green,Near I.T, BK Chowk, New Industrial Town, Faridabad",Yes (30),10,12,8,1,10,12,8,1,Yes,Yes,Yes,Yes,Yes,"11:21 AM 8th Jun,23",2023-06-08 11:21,4
Vibal Hospital Pvt. Ltd.,"Sector-21D, Huda Market, Faridabad",Yes (18),10,0,8,1,10,0,8,1,Yes,Yes,Yes,Yes,Yes,"1:53 PM 17th Jun,22",2022-06-17 13:53,4
Zenith Hospital (P) Ltd.,187/1 Yadav Colony Mohana Road NEar Yadav DairyBallabgarh,Yes (13),10,0,3,3,10,0,3,3,Yes,No,No,No,Yes,"9:45 AM 14th Oct,22",2022-10-14 09:45,4
Aashirwad Hospital,101 Devi Murti Colony Panipat,Yes (9),2,0,7,1,2,0,7,1,Yes,No,Yes,Yes,Yes,"9:59 AM 4th Aug,22",2022-08-04 09:59,17
Aayushmaan Bhav Hospital,"GT Road Sewah, Near Police Line Panipat",Yes (15),5,4,6,2,5,4,6,2,Yes,No,Yes,Yes,Yes,"9:57 AM 4th Aug,22",2022-08-04 09:57,17
APEX HOSPITAL &amp; TRAUMA CENTRE,SANOLI ROAD BABAIL NAKA,Yes (35),9,0,26,2,9,0,26,2,Yes,No,Yes,Yes,Yes,"9:58 AM 4th Aug,22",2022-08-04 09:58,17
CHC Dadlana,"VPO Dadlana, Panipat",Yes (8),0,8,0,0,0,8,0,0,No,No,No,No,Yes,"9:57 AM 4th Aug,22",2022-08-04 09:57,17
CHC Khotpura,VPO Khotpura Panipat,Yes (9),0,9,0,0,0,9,0,0,No,No,No,No,No,"9:58 AM 4th Aug,22",2022-08-04 09:58,17
Chhabra Hospital,A-1 Narain Singh Park,Yes (11),6,0,5,1,6,0,5,1,Yes,No,Yes,Yes,Yes,"10:00 AM 4th Aug,22",2022-08-04 10:00,17
Civil Hospital panipat,Civil Hospital GT Road Panipat,Yes (104),74,20,10,4,74,20,10,4,Yes,Yes,Yes,Yes,Yes,"9:57 AM 4th Aug,22",2022-08-04 09:57,17
Cygnus Hospital panipat,Cygnus Hospital Near Devi Mndir Panipat,Yes (17),12,0,5,4,12,0,5,4,Yes,No,Yes,Yes,Yes,"9:57 AM 4th Aug,22",2022-08-04 09:57,17
GALAXY HOSPITAL,ASSAND ROAD PANIPAT,Yes (15),7,0,8,2,7,0,8,2,Yes,No,Yes,Yes,Yes,"9:58 AM 4th Aug,22",2022-08-04 09:58,17
Hyderabadi General Hospital &amp; Nursing Home,"Sanoli Road, Near Sanjay, Chowk, Panipat",Yes (10),0,0,10,2,0,0,10,2,Yes,No,Yes,Yes,Yes,"9:59 AM 4th Aug,22",2022-08-04 09:59,17
IBM HOSPITAL &amp; TRAUMA CENTRE,NEAR BHIM GODA MANDIR SANOLI ROAD,Yes (24),12,0,12,2,12,0,12,2,Yes,No,Yes,Yes,Yes,"9:58 AM 4th Aug,22",2022-08-04 09:58,17
LHDM &amp; Prem Hospital,Prem Hospital Opp. Bus Stand Panipat,Yes (80),71,0,9,6,71,0,9,6,Yes,Yes,Yes,Yes,Yes,"9:57 AM 4th Aug,22",2022-08-04 09:57,17
MAX PLUS HOSPITAL,NEAR MALIK PETROL PUMP SANOLI ROAD,Yes (15),8,0,7,3,8,0,7,3,Yes,No,Yes,Yes,Yes,"9:58 AM 4th Aug,22",2022-08-04 09:58,17
NC Medical College,NC Medical Colllage Israna,Yes (530),42,483,5,4,42,483,5,4,Yes,No,Yes,Yes,Yes,"9:57 AM 4th Aug,22",2022-08-04 09:57,17
Park Hospital GT road panipat,"GT Road Sewah, Paniapt",Yes (82),52,14,16,2,52,14,16,2,Yes,No,Yes,Yes,Yes,"9:57 AM 4th Aug,22",2022-08-04 09:57,17
Prime Hospital Health Leaders,"Opp. Gangapuri Road, Sanoli Road Panipat",Yes (20),14,2,4,4,14,2,4,4,Yes,No,Yes,Yes,Yes,"9:59 AM 4th Aug,22",2022-08-04 09:59,17
Rainbow Hospital,152-R Model Town Panipat,Yes (9),6,0,3,1,6,0,3,1,Yes,No,Yes,Yes,Yes,"9:59 AM 4th Aug,22",2022-08-04 09:59,17
SDH Samalkha,G.T Road Samalkha,Yes (50),30,20,0,0,30,20,0,0,Yes,No,Yes,No,Yes,"9:57 AM 4th Aug,22",2022-08-04 09:57,17
shobhit Hospital,"adjacent canara bank, tahsil camp",Yes (19),12,2,5,1,12,2,5,1,Yes,No,Yes,Yes,Yes,"9:58 AM 4th Aug,22",2022-08-04 09:58,17
Shree Badri Das Hospital and ICU Care Centre,Assandh Road Panipat,Yes (11),8,0,3,1,8,0,3,1,Yes,No,Yes,Yes,Yes,"9:59 AM 4th Aug,22",2022-08-04 09:59,17
Shree Balajee Multispeciality Hospital,Aggarsan Colony Assandh Road Panipat,Yes (10),4,0,6,2,4,0,6,2,Yes,Yes,Yes,Yes,Yes,"9:59 AM 4th Aug,22",2022-08-04 09:59,17
Shubham Hospital,"202 New Sukhdev Nagar, Panipat",Yes (9),6,0,3,3,6,0,3,3,Yes,No,Yes,Yes,Yes,"10:00 AM 4th Aug,22",2022-08-04 10:00,17
Ch Lekh Raj Multispeciality Hospital,Vill Gadhauli Yamuna Nagar,Yes (150),140,0,10,5,140,0,10,5,Yes,Yes,Yes,Yes,Yes,"2:46 PM 2nd Aug,22",2022-08-02 14:46,22
CHC Bilaspur,CHC Bilaspur,Yes (23),8,15,0,0,8,17,0,0,Yes,No,Yes,No,Yes,"2:42 PM 2nd Aug,22",2022-08-02 14:42,22
CHC Chhachharuli,CHC Chhachharuli,Yes (30),10,20,0,0,10,20,0,0,Yes,No,Yes,Yes,Yes,"2:42 PM 2nd Aug,22",2022-08-02 14:42,22
CHC Naharpur,Naharpur Yamuna Nagar,Yes (10),10,0,0,0,10,0,0,0,Yes,No,No,No,Yes,"2:46 PM 2nd Aug,22",2022-08-02 14:46,22
CHC Partap Nagar,CHC Partap Nagar,Yes (16),6,10,0,0,6,10,0,0,Yes,No,Yes,No,Yes,"2:42 PM 2nd Aug,22",2022-08-02 14:42,22
CHC Radaur,Radaur Yamuna Nagar,Yes (20),10,10,0,0,10,10,0,0,Yes,No,Yes,Yes,Yes,"2:46 PM 2nd Aug,22",2022-08-02 14:46,22
CHC Saraswati Nagar,CHC Saraswati Nagar,Yes (25),14,11,0,0,14,11,0,0,Yes,No,Yes,No,Yes,"2:43 PM 2nd Aug,22",2022-08-02 14:43,22
DABRA HOSPITAL Yamunanagar,DABRA HOSPITAL,Yes (23),11,8,4,2,11,8,4,2,No,No,No,No,No,"2:43 PM 2nd Aug,22",2022-08-02 14:43,22
Gaba Hospital,Gaba Hospital Yamunanagar,Yes (50),20,10,20,4,20,10,20,4,Yes,No,Yes,Yes,Yes,"2:41 PM 2nd Aug,22",2022-08-02 14:41,22
GULATI HOSPITAL,GULATI HOSPITAL,Yes (32),23,3,6,0,25,3,6,0,Yes,No,Yes,Yes,Yes,"2:43 PM 2nd Aug,22",2022-08-02 14:43,22
Indra Hospital,109 OPP ESI HOSPITAL JAGADHRI,Yes (30),20,5,5,2,20,5,5,2,Yes,No,Yes,Yes,Yes,"2:53 PM 2nd Aug,22",2022-08-02 14:53,22
JP Hospital Pvt,"Jagadhri Rd, near Luxmi Theater, Vishwakarma Mohalla, Yamuna Nagar,HARAYANA Haryana",Yes (43),15,15,13,2,15,15,13,2,Yes,No,Yes,Yes,Yes,"2:42 PM 2nd Aug,22",2022-08-02 14:42,22
KAPOOR HOSPITAL,"SH 6A Indira Colony Jagadhri, yamunanagart ,Haryana",Yes (12),4,0,8,0,4,0,8,0,Yes,No,Yes,Yes,Yes,"2:45 PM 2nd Aug,22",2022-08-02 14:45,22
KESHWANI HOSPITAL,"Jagadhri - Yamuna Nagar Rd, Tagore Garden, Yamuna Nagar, Haryana",Yes (10),10,0,0,0,10,0,0,0,Yes,No,Yes,Yes,Yes,"2:47 PM 2nd Aug,22",2022-08-02 14:47,22
Maxxwell Hospital,Jagadhari Yamuna Nagar,Yes (17),11,0,6,0,11,0,6,0,Yes,No,Yes,Yes,Yes,"2:43 PM 2nd Aug,22",2022-08-02 14:43,22
Mukand Lal District Civil Hospital Yamunanagar,Mukand Lal District Civil Hospital YNR,Yes (23),18,5,0,5,18,9,0,5,Yes,No,Yes,Yes,Yes,"2:43 PM 2nd Aug,22",2022-08-02 14:43,22
NIRMAL HOSPITAL,"199, Radaur Rd, near nirmal hospital, camp, Garhi Gujran, Haryana",Yes (20),13,1,6,0,13,1,6,0,Yes,No,Yes,Yes,Yes,"2:42 PM 2nd Aug,22",2022-08-02 14:42,22
RK Gupta,opp DAV Sr Sec School Near Madhu Hotel YNR,Yes (16),4,2,10,0,5,2,10,0,Yes,Yes,Yes,Yes,Yes,"2:46 PM 2nd Aug,22",2022-08-02 14:46,22
SABBARWAL HOSPITAL,"Gulab Nagar, Jagadhri, Haryana",Yes (13),6,1,6,0,6,1,6,0,Yes,No,Yes,Yes,Yes,"2:45 PM 2nd Aug,22",2022-08-02 14:45,22
Sachdeva Hospital,"2227, Civil Lines Rd, Sri Nagar Colony, Civil Lines, Gomti Mohalla, Jagadhri, Haryana",Yes (28),16,8,4,0,16,8,4,0,Yes,No,Yes,Yes,Yes,"2:47 PM 2nd Aug,22",2022-08-02 14:47,22
Santosh Hospital,"Santosh Hospital  Kanhaiya Sahib Chowk, near Govt.School, Harbanspura Colony, Gobind Pura, Yamuna Nagar, Haryana",Yes (28),5,9,14,2,5,9,14,2,Yes,No,Yes,Yes,Yes,"2:40 PM 2nd Aug,22",2022-08-02 14:40,22
SHARMA HOSPITAL,Near Agarsain Chowk Jagadhri,Yes (12),12,0,0,0,12,0,0,0,Yes,No,Yes,Yes,Yes,"2:46 PM 2nd Aug,22",2022-08-02 14:46,22
Shree Medical Care Hospital,"359/2, Jain nagar, Jagadhri, Haryana",Yes (15),15,0,0,0,15,0,0,0,Yes,Yes,Yes,Yes,Yes,"2:47 PM 2nd Aug,22",2022-08-02 14:47,22
Shureshtha Hospital,Model Colony YNR,Yes (12),9,1,2,0,9,1,2,0,Yes,No,Yes,Yes,Yes,"2:47 PM 2nd Aug,22",2022-08-02 14:47,22
SP Hospital Jag,S.P Hospital Jag,Yes (7),4,0,3,1,4,0,3,1,Yes,No,Yes,Yes,Yes,"2:44 PM 2nd Aug,22",2022-08-02 14:44,22
Swami Vivekanand Hospital Yamunanagar,"Swami Vivekanand Hospital,Yamuna Nagar, Haryana",Yes (49),20,10,19,1,20,10,19,1,Yes,No,Yes,Yes,Yes,"2:45 PM 2nd Aug,22",2022-08-02 14:45,22
Swastik Hospital,"Basant Nagar, Yamuna Nagar, Haryana",Yes (6),4,2,0,0,4,2,0,0,Yes,No,Yes,Yes,Yes,"2:48 PM 2nd Aug,22",2022-08-02 14:48,22
VARDAAN HOSPITAL,OPP KOHLI HOSPITAL NEAR AGARSEN COLLEGE JAGADHRI,Yes (10),8,2,0,0,8,2,0,0,Yes,No,Yes,Yes,Yes,"2:47 PM 2nd Aug,22",2022-08-02 14:47,22